,datum,redeID,vorname,nachname,fraktion,name,inhalt_neu
59,16.01.2020,ID1914005900,Günter,Krings,,Günter Krings,"herr präsident! meine sehr verehrten damen und herren! gemeinden sind wichtiger als der staat … diese einschätzung hat niemand geringeres als theodor heuss, der erste präsident unserer bundesrepublik, im jahr ihrer gründung getroffen. die vielleicht zugespitzte feststellung macht deutlich, dass die kommunale politik das fundament unserer demokratie ist und dass die politik und die politiker vor ort unverzichtbar sind für das funktionieren und den zusammenhalt unseres gemeinwesens. kommunalpolitik ist wirklich die keimzelle unserer demokratie.in den letzten jahren erleben wir indes eine zunahme von angriffen auf kommunale verantwortungsträger. immer häufiger erfahren wir von beschimpfungen, aber auch von tätlichen attacken und teils brutalen anschlägen gegen lokalpolitiker. henriette reker, die oberbürgermeisterin von köln, entrann nur knapp dem tod; einen tag vor ihrer wahl stach ihr ein fanatisierter rechtsradikaler in den hals. andreas hollstein, bürgermeister der stadt altena, wurde von einem aufgebrachten flüchtlingshasser ebenfalls ein messer in den hals gestoßen. in diesen zusammenhang gehören auch die aktuellen drohungen aus der rechten szene gegen den bürgermeister christoph landscheidt aus meiner niederrheinischen heimatregion.solche angriffe beschränken sich aber auch nicht auf kommunalpolitiker und bürgermeister das haben sie, herr präsident, gerade schon deutlich gemacht : auch landes- und bundespolitiker werden zur zielscheibe von hass, von gewalt. ich nenne nur den mutmaßlich von linksextremisten begangenen angriff auf den hamburger innensenator andy grote ende des vergangenen jahres und sie haben darauf hingewiesen die schüsse auf das wahlkreisbüro unseres bundestagskollegen karamba diaby, der ja gleich noch zu uns spricht, vom gestrigen tag. der traurige tiefpunkt dieser schlimmen entwicklung ist wohl der feige mordanschlag auf dr. walter lübcke am . juni nicht der erste mord aus der rechtsextremen szene, aber der erste mord von offenbar rechtsextremen an einem deutschen politiker seit dem ende der nationalsozialistischen herrschaft in deutschland.dem bundeskriminalamt wurden für das gerade zu ende gegangene jahr bislang politisch motivierte straftaten gegen amts- und mandatsträger gemeldet, und wir fürchten sogar, dass hier noch einige dazukommen. bislang konnten übergriffe rechtsextremisten und taten linksextremisten zugeordnet werden. das sind, meine damen und herren, erschreckende zahlen, die für uns zugleich mahnung und aufforderung zum handeln sind. denn unsere demokratie lebt ja davon, dass sich politiker hauptamtlich, aber eben mehr noch ehrenamtlich in den dienst der allgemeinheit und ihrer mitmenschen stellen. jeder anschlag auf einen repräsentanten unseres staates ist daher zugleich ein angriff auf unsere gemeinsamen demokratischen werte. er ist ein angriff auf uns alle!zugleich ist unser rechtsstaat in besonderem maße auf diejenigen angewiesen, die täglich für sicherheit, ordnung und recht sorgen. insbesondere polizeibeamte werden aber immer wieder ziel von gewalttätigen angriffen und mit ihnen auch andere einsatzkräfte und rettungskräfte. respektlosigkeit, pöbeleien und sogar körperliche gewalt gehören inzwischen zur polizeilichen alltagserfahrung. allein in berlin werden nach angaben der berliner polizei im schnitt jeden tag beamte angegriffen. im jahre wurden vollstreckungsbeamte sowie andere einsatzkräfte bei ausübung ihres jobs opfer von gewaltdelikten ein anstieg im vergleich zum jahr davor von prozent. diejenigen, die tag für tag, meine damen und herren, ihren kopf für unser aller sicherheit hinhalten, ob als polizisten, als feuerwehrleute, als rettungskräfte, haben den anspruch darauf, dass die politik ihnen auch den rücken stärkt. ich will aber auch hinzufügen, dass ich die proteste des personalrats bei der berliner polizei durchaus gut verstehen kann, in denen er darauf hinweist, dass es nicht sein kann, dass ein antidiskriminierungsgesetz eine art faktische beweislastumkehr statuiert und sich polizisten für ihre arbeit sozusagen einem generalverdacht ausgesetzt sehen, weil sie bei vorwürfen, sie hätten diskriminiert, ihrerseits faktisch die beweislast tragen müssen. auch das haben unsere polizistinnen und polizisten nicht verdient. die attacken, von denen ich eben gesprochen habe, und zwar jede einzelne, verurteilen wir aufs schärfste. wir als bundesregierung ergreifen auch konkrete gegenmaßnahmen. bereits haben wir mit dem gesetz zur stärkung des schutzes von vollstreckungsbeamten und rettungskräften die strafdrohung für angriffe auf polizei und rettungskräfte bei jeder diensthandlung vorher waren es nur vollstreckungshandlungen auf bis zu fünf jahre freiheitsstrafe verschärft. mit der aktuellen umsetzung des von der bundesregierung beschlossenen maßnahmenpakets zur bekämpfung des rechtsextremismus und der hasskriminalität werden wir gezielt auch den schutz von kommunalpolitikern verbessern. nicht mehr werden wie bisher, jedenfalls in der auslegung der gerichte, nur hauptamtliche abgeordnete wie wir alle, sondern eben auch endlich kommunalpolitiker vor übler nachrede und verleumdung durch die verschärfte strafdrohung des § strafgesetzbuch geschützt sein.meine damen und herren, da aus worten des hasses nicht selten taten der gewalt werden, müssen wir uns auch mit beleidigungen oder anfeindungen unter dem schutz der anonymität im internet beschäftigen. ich persönlich bin nicht der auffassung, dass wir eine generelle gesetzliche rechtspflicht zur offenlegung von klarnamen oder zur aufhebung von anonymität brauchen. aber was wir meines erachtens brauchen, ist eine kultur der offenheit, des offenen umgangs miteinander im netz. ich finde, eine ernsthafte politische streitkultur verträgt sich in einer freiheitlichen gesellschaft nicht mit anonymität oder oftmals sogar mit duckmäusertum, was wir in manchen foren im netz auch feststellen müssen. wir werden die regelungen des strafgesetzbuchs mit bezug zur hasskriminalität ergänzen. das betrifft zum beispiel die aufforderung zu straftaten oder billigung oder verharmlosung von straftaten. ferner wollen wir als bundesregierung eine meldepflicht für diensteanbieter nach dem netzwerkdurchsetzungsgesetz einführen, etwa für morddrohungen und volksverhetzung. und diensteanbieter müssen zur bekämpfung und aufklärung von hasskriminalität auch einer auskunftsverpflichtung, etwa gegenüber dem bundeskriminalamt, unterfallen.meine sehr verehrten damen und herren, wir setzen weiterhin, aber nicht nur auf polizeiliche maßnahmen und nicht nur auf repressive staatsanwaltschaftliche, gerichtliche maßnahmen. nein, es geht auch um prävention, und es geht auch um bewusstseinsbildung. die im letzten jahr begonnene kampagne für ein sicheres deutschland werden wir fortführen. mit ihr zeigen wir, dass in jeder uniform von polizei, feuerwehr oder anderen einsatzkräften immer auch ein mensch steckt, der nicht nur als repräsentant des staates, sondern auch ganz persönlich anspruch auf achtung seiner würde hat.für unsere kommunalpolitiker, meine damen und herren, können wir alle gemeinsam, innerhalb und außerhalb dieses hauses, selbst wohl das beste signal setzen. in diesem jahr finden in bayern und in nordrhein-westfalen kommunalwahlen, in hamburg neben der bürgerschaftswahl auch bezirkswahlen statt. ich werbe auch vor dem hintergrund der heutigen debatte dafür, dass die bürgerinnen und bürger in diesen ländern mit einer hohen, hoffentlich sehr hohen wahlbeteiligung gerade den ehrenamtlichen politikern den rücken stärken und damit ein deutliches zeichen gegen hass, hetze und gewalt setzen.vielen dank. vielen dank. nächster redner in der debatte ist der kollege martin hess für die fraktion der afd."
60,16.01.2020,ID1914006000,Martin,Hess,AfD,Martin Hess,"sehr geehrter herr präsident! werte damen und herren! auf antrag der koalitionsfraktionen befassen wir uns heute wieder einmal, möchte man sagen, mit drohungen und gewalt gegen kommunalpolitiker, gegen polizei- und rettungskräfte. ich möchte zunächst die gelegenheit nutzen und mich auch im namen meiner fraktion bei allen kollegen der sicherheitsorgane des bundes und der länder, der feuerwehren und der rettungsdienste bedanken: ihr leistet unter widrigsten politischen rahmenbedingungen hervorragende arbeit. dafür herzlichen dank! die gewalt gegen einsatz- und rettungskräfte nimmt zu. diese entwicklung ist nicht nur besorgniserregend, sie ist für einen rechtsstaat schlicht inakzeptabel. verantwortlich hierfür sind sie, meine sehr verehrten damen und herren von den altparteien. sie praktizieren seit jahrzehnten eine sicherheitspolitik, die zum rückzug des rechtsstaates und zum vormarsch von schwerstkriminellen und gewaltverbrechern führt. diese kriminellen zeigen ihre tiefe staatsverachtung durch massive angriffe gegen unsere sicherheits- und rettungskräfte. dass sie das zulassen, zeigt: sie sind weder willens noch in der lage, die polizei- und rettungskräfte unseres landes effektiv zu schützen. sie lassen diejenigen alleine, die tagtäglich für unser aller sicherheit sorgen. und damit muss endlich ein für alle mal schluss sein! wenn es einen grundkonsens unter demokraten geben muss, dann den: gewalt gegen den staat und seine repräsentanten ist kategorisch abzulehnen und zu verurteilen. es darf keine wie auch immer geartete legitimation für gewalt gegen den staat und seine vertreter geben. aber diesen grundkonsens darf man nicht nur als hohle phrase verwenden, man muss ihn auch aktiv leben, und genau hier versagen sie, die altparteien, jeden tag aufs neue. sie tun alles im sogenannten kampf gegen rechts, sind aber auf dem linken auge blind. dabei sind es gerade linksextremisten, die permanent unsere polizei angreifen. weit mehr als die hälfte der linksextremistisch motivierten gewalttaten sind gegen die polizei und die sicherheitsbehörden gerichtet. in unserem land sind menschenverachtende linksextremistische angriffe gegen die polizei mittlerweile alltag. ein aktueller fall: an silvester entrissen linksextremisten in leipzig-connewitz einem polizeibeamten den helm und verletzten ihn dabei am kopf. der kollege wurde sogar bewusstlos und musste noch in der nacht operiert werden. ich wünsche ihm auch im namen meiner fraktion von hier aus schnelle genesung. wie reagieren sie auf diese ganzen vorfälle? obwohl jeder bürger klar erwartet, dass sich zumindest bürgerliche kräfte eindeutig von solchen extremisten distanzieren, tun sie genau das gegenteil. sie, meine damen und herren von der union, kooperieren offen mit den politischen feinden unserer polizei, mit den grünen, und, wie neuerdings in thüringen zu sehen, auch mit der linkspartei. wer vom schutz unserer einsatzkräfte redet, aber mit dem politischen arm der linksextremisten zusammenarbeitet, der macht sich nicht nur unglaubwürdig, der liefert polizei, feuerwehr und rettungsdienste sehenden auges gewaltverbrechern aus. wir müssen linksextremisten endlich in die schranken weisen. wir müssen diesen gewaltverbrechern klarmachen, dass der staat sich nicht mehr auf der nase herumtanzen lässt. ein erster und wichtiger schritt besteht darin, keine rechtsfreien räume wie in der rigaer straße in berlin oder die rote flora in hamburg mehr zu dulden. der rechtsstaat muss stärke zeigen und diese objekte endlich dauerhaft räumen. das wäre ein wahres signal der stärke unseres rechtsstaates, und genau das brauchen wir. aber nicht nur linksextremisten haben wegen ihrer desaströsen sicherheitspolitik freie bahn. die regierung hat auch keine effektiven mittel gegen parallelgesellschaften und clans, aus deren reihen unsere polizeibeamten, rettungskräfte und feuerwehrleute ständig angegriffen werden. vor wenigen tagen erst hat eine jugendbande in berlin-kreuzberg einen feuerwehrmann auf dem weg zur nachtschicht krankenhausreif geschlagen. rund gewalttaten gegen feuerwehrleute kamen letztes jahr in berlin zur anzeige. laut landesbranddirektor hat die intensität der angriffe deutlich zugenommen.angehörige krimineller clans verletzen und bedrohen polizisten sogar im privaten umfeld und stürmen notaufnahmen. um ärzte, pfleger und retter vor clans zu schützen, beschäftigen krankenhäuser in berlin schon jetzt private sicherheitsdienste. sie können die lage nicht mehr schönreden. wenn wir jetzt nicht gegensteuern, dann hat unser rechtsstaat verloren. wir müssen clankriminellen die deutsche staatsangehörigkeit entziehen, das vermögen viel stärker als bisher abschöpfen und vor allem konsequent abschieben. das ist die einzige sprache, die diese schwerkriminellen verstehen. deshalb muss dies auch ab sofort umgesetzt werden. linksextremisten und clankriminelle haben eines gemeinsam: sie greifen einsatzkräfte an, weil sie unseren staat und sein gewaltmonopol ablehnen. deshalb hilft hier keine deeskalation. gegen staatsfeinde hilft nur nulltoleranz und robustes vorgehen. aber man darf nicht nur darüber reden, wie sie das ständig tun, sondern man muss das auch konsequent umsetzen. wir dürfen nicht länger zulassen, dass verfassungsfeinde sich unseren staat zur beute machen, sondern wir müssen dem endlich entschlossen entgegentreten. hören sie damit auf, sich unseren sicherheitspolitischen forderungen zu verweigern! setzen sie unsere vorschläge zur verbesserung der sicherheitslage endlich um! dann wird deutschland auch wieder sicherer, und unsere polizei- und rettungskräfte sind bestmöglich geschützt. vielen dank. als nächster spricht für die fraktion der spd der kollege bernhard daldrup."
61,16.01.2020,ID1914006100,Bernhard,Daldrup,SPD,Bernhard Daldrup,"herr präsident! liebe kolleginnen und kollegen! gewalt und drohungen gegenüber mandatsträgern, gegenüber polizisten und rettungskräften nehmen in erschreckender weise zu. ja, selbst politischer mord wie an walter lübcke gehört zur bilanz des abgelaufenen jahres. deshalb gehört der kampf gegen hetze, rechtsextremismus und hasskriminalität auf die tagesordnung des deutschen bundestages. bevor ich dazu im einzelnen komme, wende ich mich an dich, lieber karamba diaby. die schüsse auf dein wahlkreisbüro sind nicht nur ein anschlag auf dich, deine mitarbeiterinnen und mitarbeiter, sondern auch, wie der präsident gerade gesagt hat, ein anschlag auf unsere demokratie. deshalb darf ich dir versichern: wir stehen an deiner seite, an der seite deiner mitarbeiterinnen und mitarbeiter, und wir hoffen, dass du dich in deinem engagement für demokratie, freiheit, gerechtigkeit und solidarität in unserem land nicht beirren lässt. und weil du nicht der einzige bist, gilt diese solidarität auch unserem kollegen carsten träger, der beispielsweise zum jahreswechsel einen anonymen brief mit einer patronenhülse bekommen hat.wir stehen aber nicht nur an eurer seite. die zeit ist überfällig, mit weiterer entschiedenheit die grenze zu den feinden unserer demokratie ziehen zu müssen. der anlass für diese aktuelle stunde besteht genau in der offensichtlichen eskalation der gewaltbereitschaft, die auch vor ehrenamtlich und hauptamtlich tätigen kommunalpolitikern und ebenso vor rettungskräften oder polizeibeamten nicht haltmacht, denen selbstverständlich unser dank und unsere anerkennung gelten. die zahlen sind erschreckend und die beispiele mittlerweile zahlreich; staatssekretär krings hat einige genannt. bedauerlicherweise steigt die summe in der bundesrepublik insgesamt bald auf eine vierstellige zahl. ich bin besonders unserem bundespräsidenten frank-walter steinmeier dankbar, der sich mehrfach zuletzt auf seinem neujahrsempfang an die seite der kommunalpolitikerinnen und kommunalpolitiker, an die seite der ehrenamtlich tätigen in unserer gesellschaft gestellt hat und mehr schutz gegen ein klima des hasses und der menschenverachtung gefordert hat.an uns richtet sich aber nicht nur die pflicht zu solidarität mit den bedrohten, sondern gleichermaßen müssen wir antworten auf die frage finden, was denn eigentlich zu tun ist. es ist deshalb gut, dass unsere justizministerin christine lambrecht dem nährboden für hetze und rechtsextremismus im netz mit einem aktionsplan entgegenwirkt, unter anderem ein beispiel durch das netzwerkdurchsetzungsgesetz, das es ermöglicht, morddrohungen und volksverhetzungen besser zu verfolgen, und durch die verschärfung des § strafgesetzbuch sowie des § strafgesetzbuch, wodurch notärzte, sanitäter und die kommunale ebene vor nachrede, verleumdung und ähnlichem stärker geschützt werden. das waffen- und sprengstoffrecht zu verschärfen, ist die bessere alternative zur bewaffnung von bürgermeistern, auch wenn ich persönlich christoph landscheidt verstehe. allerdings dürfen all die verschärfungen im strafrecht nicht davon ablenken, dass auch gerichtsverfahren zu ergebnissen, zu ende geführt werden müssen und nicht, wie gegenwärtig bisweilen der eindruck entsteht, allzu sehr ins leere laufen bzw. eingestellt werden dürfen. auch das ist eine berechtigte forderung der kommunalen ebene an unsere justiz.sosehr dieses handeln notwendig ist, kann es nicht darüber hinwegtäuschen, dass die zunehmende gewalt und der hass ursachen haben, soziale und kulturelle. darüber müssen wir reden. demokratie muss immer wieder neu gelernt, neu erkämpft, neu gelebt werden. deshalb ist prävention wie im programm demokratie leben! so wichtig; das wurde eben angesprochen.damit bin ich bei einem weiteren punkt. wir diskutieren zu recht die rolle der sozialen medien. aber das ist nicht das einzige. dieser missstand ist nicht allein mit schärferem recht zu bekämpfen. carlo schmid, einer der väter unseres grundgesetzes, hat einmal das merkmal der rechtsstaatlichkeit unseres grundgesetzes durch den satz gekennzeichnet, es orientiere sich an der sittlichen idee der gerechtigkeit. daran dürfen die menschen ebenso wenig zweifel haben wie am ringen um politische ziele mit der bereitschaft zum kompromiss im demokratischen staat.der faule kompromiss war die diffamierende formel der nazis gegenüber dem ringen um die demokratie in der weimarer republik. diese haltung verspottet die diskussion als gerede und das parlament als schwatzbude. wo sich die unfähigkeit zum kompromiss mit macht verbindet und auf minderheiten zielt, entsteht brutalität. das hat uns unsere geschichte gelehrt. jeder muss wissen, dass hetzerische sprache, herr hess, die vorhut der gewalt ist. und bei nicht wenigen von ihnen habe ich den eindruck, dass sie nicht dennoch so reden, sondern deshalb so reden. sie sind die hetzer in diesem land. demokratie, liebe kolleginnen und kollegen, ist und bleibt ein wagnis, weil sie sich völlig ihren bürgerinnen und bürgern anvertraut. jeder, der sich abwendet, fehlt der demokratie. deshalb dürfen wir niemanden achselzuckend ziehen lassen; so sagt frank-walter steinmeier, und er hat recht. wir müssen das öffentliche bewusstsein für unsere demokratie und ihre geschichte stärken. dazu gehört auch die politische bildung. wenn wir wirksam gegen hass und hetze, ausländerfeindlichkeit und gewalt vorgehen, ist die stärkung einer der säulen der demokratie, nämlich der städte und gemeinden, nicht nur unverzichtbar, sondern geboten. wer die kommunen stärkt, macht unsere gesellschaft stark. demokratie, toleranz, menschenfreundlichkeit: das ist eine lebensform, von der sie nichts verstehen hier auf der rechten seite. sie entsteht nicht von selbst, sondern fordert unseren täglichen einsatz. denn letzter satz sowenig der demokratie vor jahren ihr scheitern vorherbestimmt war, so wenig ist heute ihr gelingen garantiert; so mahnt zu recht der bundespräsident in seiner erinnerung an die weimarer republik. und wer sie reden hört, soll denken an die mahnung brechts im arturo ui : der schoß ist fruchtbar noch, aus dem das kroch .herzlichen dank. vielen dank. als nächstes spricht für die fraktion der fdp die kollegin dr. marie-agnes strack-zimmermann."
62,16.01.2020,ID1914006200,Marie-Agnes,Strack-Zimmermann,FDP,Marie-Agnes Strack-Zimmermann,"vielen dank. herr präsident! meine sehr verehrten damen und herren! dass frauen und männer, die sich in unserem land politisch engagieren, bedroht und angegriffen werden, ist ein nicht hinnehmbarer zustand. ich spreche jetzt auch meine kollegin judith skudelny an, die auch bedroht wurde; wir sprachen gerade darüber. ob das von links, von rechts, von der mitte, von hinten oder von vorne kommt, ist egal. es ist empörend, es ist widerwärtig, und dass wir überhaupt gezwungen werden, heute im bundestag über dieses phänomen der respekt- und distanzlosigkeit zu diskutieren, ist wirklich ernüchternd.meine damen und herren, kommunalpolitik es wurde gesagt; es ist wichtig, das immer zu wiederholen ist der stoff, aus dem die wahre demokratie gemacht wird. vor der eigenen türe wird nämlich nicht nur gefegt, sondern es werden die dinge entschieden, die unmittelbar das leben der menschen im alltäglichen prägen und beeinflussen. welcher politische weg der richtige ist, darüber wird gerungen und letztlich demokratisch abgestimmt.dies betrifft uns, die wir hier sitzen, die bürgerinnen und bürger unseres landes und damit den staat, unsere kommunalen vor ort und natürlich auch die rettungskräfte und die polizistinnen und polizisten. wie bekloppt ist es eigentlich, leute anzugehen, die ihr leben einsetzen, um uns zu schützen? das ist wirklich unglaublich. wer das macht, der legt die axt an das soziale miteinander und an die wurzel unserer demokratie. damit wird die größte errungenschaft dieser bundesrepublik deutschland, nämlich frei von angst seine meinung zu äußern und für seine sache einzustehen, zerstört. die angriffe starten oft verbal, meist im netz, manchmal ganz subtil, und enden immer häufiger, wie wir gerade erleben, in körperlichen übergriffen, um missliebige politiker zu verängstigen, sie mundtot zu machen und sie letztlich zu nötigen, sich wieder ins private, fern vom allgemeinwohl, zurückzuziehen.meine damen und herren, wir müssen uns nicht wundern, dass es immer schwieriger wird, engagierte menschen zu finden, die sich kommunalpolitisch engagierten. wer soll sich diese respektlosen anfeindungen noch antun und übrigens auch seiner familie zumuten? das geht ja so weit, dass kommunalpolitische mandate in einigen gemeinden inzwischen schon ausgeschrieben werden müssen. natürlich ist man als kommunaler mandatsträger kritik ausgesetzt. ich meine, wer damit nicht umgehen kann, sollte ein solches engagement nicht übernehmen. salopp gesagt: wer in die küche geht, sollte auch hitze abkönnen. aber keine diskussion rechtfertigt übergriffe.dass betroffene mandatsträger waffen tragen es wurde gerade gesagt oder sich wünschen, ist natürlich keine lösung. wir sind hier nicht im wilden westen. es ist, meine damen und herren, die aufgabe der polizei, einzuschreiten, wo nötig auch die aufgabe der staatsanwaltschaft, bedrohungen ernst zu nehmen und entsprechend zu ahnden. leider werden verfahren bei verbalen bedrohungen viel zu schnell eingestellt. sie werden relativiert, und sie werden leider oft verharmlost. ich wende mich an unsere kollegin renate künast. frau künast und ich, wir können an vielen stellen streiten, ganz sicher. aber die verbalen ausdrücke, denen sie ausgesetzt waren, sind unerträglich. aber mindestens genauso unerträglich war das urteil des berliner landgerichts. der straftatbestand der beleidigung wurde durch dieses urteil bei allem respekt vor dem gericht ad absurdum geführt. das ist meine meinung. so geht das nicht. was wir umgehend brauchen, ist eine zentrale ansprechstelle, an die sich die betroffenen sofort wenden können, eine stelle, in der die bereiche prävention, staatsschutz, strafverfolgung gebündelt sind, damit effektive bereichsübergreifende maßnahmen ergriffen werden können. es macht sinn, dass § strafgesetzbuch, der üble nachrede und verleumdung unter strafe stellt, auch bei ehrenamtlich tätigen politikerinnen und politikern und nicht nur bei bundestagsabgeordneten und landtagsabgeordneten anwendung findet. meine damen und herren, zum schluss. es wurde zeit, dass wir hier diese debatte führen, nicht nur weil viele mitglieder des deutschen bundestages ein kommunales mandat haben. es wurde zeit, weil es nicht hinnehmbar ist, dass die menschen, die anderen helfen polizei und rettungskräfte , angegriffen werden. und, meine damen und herren, es wird zeit: jeder hetzer, jeder dumpfe heini in diesem land und im netz muss sich klar sein, dass wir alle, losgelöst von der jeweiligen politischen meinung, so etwas nicht länger dulden und uns gemeinsam entschieden vor unser wertesystem stellen und es verteidigen. es ist zeit, dass der deutsche bundestag gemeinsam aufsteht und sich dies nicht mehr gefallen lässt. vielen dank. nächste rednerin ist für die fraktion die linke die kollegin petra pau."
