,datum,redeID,vorname,nachname,fraktion,name,inhalt_neu
72,19.04.2018,ID192607200,Ottmar,von Holtz,BÜNDNIS 90/DIE GRÜNEN,Ottmar von Holtz,frau präsidentin verehrte kolleginnen und kollegen die operation atalanta hat tatsächlich zwei seiten: kurzfristig sichert sie die hilfslieferungen auf die die menschen in somalia aber auch in äthiopien im jemen und im südsudan angewiesen sind; aber mittelfristig hat sie keinen effekt auf die ursachen der pirateriekriminalität nachdem die anzahl der vorfälle vor der küste somalias in den letzten jahren sehr niedrig war ist sie im vergangenen jahr wieder deutlich gestiegen bislang sind diese anschläge zwar glimpflich verlaufen aber sie lassen doch schon befürchten dass es schlimmer kommen könnte die gründe für den erneuten anstieg der piraterie sind klar: fortdauernde korruption schwache staatliche strukturen in somalia einfluss von islamistischen gruppierungen die schwemme an waffen in der region die hungerkrise am horn von afrika treibt zusätzlich menschen in die kriminalität vor diesem hintergrund ist der einsatz der bundeswehr vor der küste somalias genau genommen lediglich eine symptombekämpfung es ist kein beitrag für eine nachhaltige lösung man kann jetzt zwar sagen: ja gut das ist besser als nichts aber dann muss es von anderen maßnahmen flankiert werden und teil einer umfassenden ganzheitlichen strategie werden herr tauber sie haben eine strategie angesprochen sie soll bis ende stehen; aber bis ende ist es tatsächlich noch sehr weit hin und dann die sache mit dem einsatz an land das mandat sieht einsätze an land vor die bundeswehr dürfte bis zu kilometer weit im inland gelegene logistische einrichtungen der piraten angreifen das ist doch keine rein maritime mission mehr das hat auch eskalationspotenzial das ist auch einer der gründe warum viele meiner fraktionskolleginnen und -kollegen dem mandat in der vergangenheit nicht zustimmen konnten wäre ich pirat würde ich meine logistische einrichtung kilometer weit ins landesinnere legen herr roth streichen sie endlich diesen sinnlosen landeinsatz aus dem mandatstext fatal für die gesamtstrategie ist die somalische aufrüstung mit deutschen waffen die waffen gelangen unter anderem über lizenzfabriken in saudi-arabien und im iran dorthin hinzu kommen unendlich viele alte waffen in die region zum beispiel aus den libyschen armeebeständen wir müssen endlich mehr dafür tun diese waffen aus dem verkehr zu ziehen das wäre eine nachhaltige und wirksame maßnahme gegen die piraterie vor der küste somalias braucht es eine strategie zur bekämpfung der ursachen beispielsweise gegen die raubfischerei in den somalischen gewässern gegen die illegale müllverklappung in den fischereigebieten vor allem muss der friedensprozess in somalia vorangetrieben werden die menschen dort brauchen eine lebensperspektive das ist das einzige was wirklich hilft die piraterie kann nicht nur mit militärischen instrumenten bekämpft werden etwa millionen menschen herr tauber sie sprachen von millionen; die tatsächliche zahl ist eigentlich unerheblich es sind sehr viele leiden an hunger die hälfte der bevölkerung wir müssen die entwicklungszusammenarbeit ausbauen die bisherigen projekte sind zwar gut erreichen aber bei weitem nicht genug leute und werden zusätzlich durch dürre und hungersnot oftmals zunichtegemacht im flüchtlingslager dadaab im nachbarland kenia leben somalier unter schweren bedingungen diejenigen die zurückkehren weil sie es dort nicht aushalten erwartet eine unsichere zukunft wir können doch nicht einfach dabei zusehen wie sich die rückkehrerinnen und rückkehrer völlig desillusioniert bald nach anderen einkommensquellen umsehen werden meine damen und herren der mandatsverlängerung sollte man zustimmen wenn man der sache mit den unsicheren wegen für die hilfsgüter ein besonderes gewicht beimisst ich habe aber auch großes verständnis für alle diejenigen die der verlängerung nicht zustimmen können weil es an der gesamtstrategie fehlt und das mandat nicht zur bekämpfung der ursachen der piraterie beiträgt vielen dank vielen dank ottmar von holtz nächster redner: ingo gädechens für die cdu/csu-fraktion
73,19.04.2018,ID192607300,Ingo,Gädechens,CDU/CSU,Ingo Gädechens,meine sehr verehrte präsidentin liebe kolleginnen und kollegen ja das was der staatsminister roth und der parlamentarische staatssekretär tauber hier gesagt haben atalanta wirkt stimmt zehn jahre sind wir im einsatz dort und es war ein langer weg die praxis war unterschiedlich es gab die entwicklung von safe rooms auf handelsschiffen von sogenannten schutzräumen wir mussten mit unseren boarding-teams neue methoden entwickeln die piraterischen skiffs aufzubringen wir haben mit der bundespolizei und der bundeswehr best practice zu der frage entwickelt wie unsere handelsschiffe aber auch die internationalen handelsschiffe sich auf dieser route schützen können es war ein langer weg zehn jahre ich habe die diskussion über das atalanta-mandat nahezu von anbeginn begleitet nicht nur im politischen raum sondern mehrfach auch vor ort: in dschibuti bei den schwimmenden und fliegenden einsatzkräften unserer bundeswehr wir haben hier leidenschaftlich debattiert eigentlich vermisse ich in dieser debatte die wortmeldung vom kollegen ströbele aus der fraktion bündnis /die grünen die wird es heute nicht geben in der er mir sagt wie er es immer getan hat wir mögen doch die ursachen der piraterie bekämpfen wir mögen doch endlich aufpassen dass nicht irgendwelche fischtrawler die küste vor somalia leerfischen und der arme somalische fischer seinen lebensunterhalt nicht bestreiten kann ich freue mich dass sie applaudieren; das ist nämlich bestandteil dieses mandats wir observieren das gebiet mit unserem seefernaufklä rer um genau diese piraterie die dort auch von internationalen fischtrawlern betrieben wird zu melden und zu bekämpfen damit der somalische fischer seine lebensgrundlage hat bitte teilen sie das herrn ströbele mit falls er jetzt nicht am fernseher sitzt und meinen wortbeitrag genießt meine sehr verehrten damen und herren abschreckung durch militärische präsenz ist ein grund dafür dass die schiffe des welternährungsprogramms auch das wurde erwähnt den hafen von mogadischu sicher erreichen können auch die zahl ist schon genannt worden: über millionen menschen in somalia sind auf diese humanitäre hilfe zwingend angewiesen wir sind nicht allein in diesem einsatz nicht nur eu- und nato-einheiten sondern auch einheiten anderer nationen beteiligen sich in diesem atalanta-verband um piraterie einzudämmen meine damen und herren ich sage das jetzt nicht weil das gern mal applaus einbringt; ich sage das in richtung der soldaten wenn es irgendwo auf der welt knallt oder kriselt richtet sich der fokus sehr schnell auf diese region richtet sich der fokus darauf: was macht unsere bundeswehr dort eigentlich wenn die sogenannte einsatzrealität die einsatzroutine greift dann ist dieser fokus sehr schnell wieder weg; dann reden wir im politischen raum manchmal von einem vergessenen mandat das atalanta-mandat ist im deutschen bundestag nicht vergessen ich sage es nicht weil es applaus bringt sondern ich sage es aus vollem herzen: ich danke all denen die dort am horn von afrika ihren dienst schon geleistet haben heute leisten und zukünftig leisten werden meine sehr verehrten damen und herren weil die regierungsvertreter gute gründe genannt haben und in der debatte diese gründe auch wiederholt worden sind empfehle ich ihnen allen diesem mandat zuzustimmen herzlichen dank vielen dank ingo gädechens christian ströbele hat sich jetzt sicher gefreut ihnen zu lauschen ich bin mir fast sicher dass er das wirklich tut ja aber er hat ja christian ströbele genannt letzter redner in der debatte: dr reinhard brandl für die cdu/csu-fraktion
74,19.04.2018,ID192607400,Reinhard,Brandl,CDU/CSU,Reinhard Brandl,frau präsidentin verehrte kolleginnen und kollegen am ostersamstag dem märz ist es zum letzten mal passiert: vor dem horn von afrika haben piraten ein schiff attackiert es war ein rohöltanker aus liberia zwei skiffs mit hoher geschwindigkeit versuchten das schiff zu kapern die mannschaft des schiffs hat sich erfolgreich gewehrt und konnte die piraten in die flucht schlagen am februar lief es ähnlich ab: ungefähr kilometer südlich an der küste vor mogadischu erwischte es einen tanker aus singapur und im november war gleich in der nähe ein containerschiff aus panama an der reihe auch da hat die mission atalanta mit eingegriffen meine damen und herren solche vorfälle sind bei weitem nicht mehr so zahlreich wie es gab damals angriffe auf schiffe und schiffsentführungen dagegen sind das was wir im moment erleben nur noch einzelfälle trotzdem: die gefahr der piraterie ist immer noch da dass es weniger geworden ist hat zwei wesentliche gründe erstens der kollege gädechens hat es bereits sehr fachkundig angesprochen haben die reedereien mehr in die sicherheit investiert auch mit staatlicher hilfe die best management practices sind schon thematisiert worden der zweite grund ist die mission atalanta seit sind wir mit dabei; seit besteht eine ständige militärische präsenz im indischen ozean das seegebiet wird auch von uns überwacht und es kann im ernstfall eingegriffen werden natürlich konnten wir nachdem die piraterie zurückgegangen war auch unsere präsenz vor ort reduzieren wir sind zwar seit nicht mehr mit einem schiff dort es macht aber noch sinn dort präsent zu sein: erstens um das was wir an sicherheit auf den seewegen erreicht haben nachhaltig zu sichern zweitens um auch gegen den terrorismus gegen menschenschmuggel oder illegalen waffenhandel vorzugehen es ist eine der gefährlichsten regionen der welt: das instabile somalia auf der einen seite der küste und auf der anderen seite der jemen mit den kriegshandlungen drittens das ist hier auch schon angesprochen worden macht es auch aus wirtschaftlichem interesse sinn durch den golf von aden fahren jedes jahr schiffe prozent des handels zwischen europa afrika und asien werden darüber abgewickelt und ja wir als exportnation haben ein interesse an sicheren seewegen und mit unserem beitrag zu atalanta leisten wir einen beitrag zur sicherheit auf den internationalen seewegen wir tun es im moment vorrangig mit unserem seefernaufklärer einem flugzeug das drei- bis viermal die woche abhebt in der region unterwegs ist und im auftrag von atalanta verdächtige bewegungen auf see aufklärt aber deutschland leistet noch andere beiträge die vielleicht nicht so im licht der öffentlichkeit stehen einen will ich beispielhaft dafür was die marine leistet nennen wir betreiben in dschibuti eine hochmoderne taucherkammer wenn ein tauchunfall passiert das geschieht meist dann wenn ein taucher zu schnell auftaucht und es dadurch zur dekompressionskrankheit kommt kann man in solchen taucherkammern die entsprechende behandlung durchführen es ist die einzige kammer im umkreis von mehreren hundert kilometern und immer wenn partnernationen in einsätze gehen versichern sie sich dass diese kammer zur verfügung steht damit einem taucher im notfall geholfen werden kann das kommt nur drei- bis viermal im jahr vor aber unser einsatz die bereitstellung der kammer wird hoch geschätzt und wenn ein notfall eintritt ist sie wirklich lebensnotwendig meine damen und herren ich fasse zusammen: atalanta ist ein erfolgreicher einsatz der einsatz liegt im deutschen interesse wir leisten einen wichtigen beitrag und wollen ihn auch weiterhin leisten ich bitte um zustimmung und bedanke mich für ihre aufmerksamkeit vielen dank dr brandl damit schließe ich diese aussprache interfraktionell wird überweisung der vorlage auf drucksache / an die in der tagesordnung aufgeführten ausschüsse vorgeschlagen sie sind sicher damit einverstanden dann ist die überweisung so beschlossen ich bitte sehr zügig die plätze zu tauschen oder einzunehmen damit ich den nächsten tagesordnungspunkt aufrufen kann
75,19.04.2018,ID192607500,Katja,Kipping,DIE LINKE,Katja Kipping,frau präsidentin meine damen und herren die erste tafel wurde gegründet inzwischen gibt es tafeln dass es die tafeln gibt ist das verdienst vieler ehrenamtlicher dass es die tafeln in diesem land braucht ist das versagen aller bisherigen bundesregierungen ja auch diese bundesregierung aus union und spd betreibt beim kampf gegen armut arbeitsverweigerung ich sage es einmal so: wenn ein hartz‑iv-betroffener bei der suche nach arbeit so wenig einsatz zeigen würde wie diese regierung beim kampf gegen armut er wäre schon längst mit einigen sanktionen belegt und sein arbeitslosengeld ii wäre wahrscheinlich um mindestens prozent gekürzt wenn nicht gar gestrichen worden halten wir fest: prozent also millionen menschen sind hierzulande von armut bedroht die politik reagiert auf diesen missstand sehr unterschiedlich es gibt einzelne minister wie jens spahn die arme belehren dass man mit dem geld doch gut über die runden kommt als ob er eine ahnung davon hätte wie man mit euro im monat über die runden kommt und wehe die waschmaschine geht kaputt die neoliberalen spielen arme ohne arbeit und arme mit arbeit gegeneinander aus als ob ein niedriglohnbetroffener auch nur einen cent mehr in der tasche hätte wenn der hartz‑iv-regelsatz gezielt kleingerechnet wird das gegenteil ist doch der fall die ganz rechten reden den armen ein man müsse nur alle ausländer abschieben dann würde wieder wohlstand für alle herrschen als ob die arme rentnerin nur einen cent mehr in der tasche hätte wenn geflüchtete in kriegsgebiete abgeschoben werden tatsache ist doch: wir hatten schon viel zu niedrige renten und viel zu niedrige löhne bevor die geflüchteten gekommen sind wir linke sagen hingegen klar: eine gesellschaft in der alle menschen garantiert vor armut geschützt sind ist machbar dieses parlament müsste nur die richtigen sozialen alternativen umsetzen damit meine ich nicht die maßnahmen die ihnen ihre freunde von goldman sachs also die lobby der finanzspekulation einreden möchten sicherheit vor kinderarmut ist möglich zum beispiel durch eine kindergrundsicherung die alle kinder garantiert vor armut schützt mit einem breiten bündnis streiten wir dafür; denn jedes kind hat das recht auf einen guten start ins leben sicherheit vor armut ist möglich wenn wir das hartz‑iv-sanktionssystem abschaffen und durch gute arbeit und eine sanktionsfreie mindestsicherung in höhe von euro ersetzen sicherheit vor altersarmut ist möglich wenn wir das rentenniveau erhöhen und eine solidarische mindestrente in höhe von euro als unteres sicherheitsnetz einführen diese sicherheit vor armut ist finanzierbar wir müssten nur den mumm haben millionenerbschaften und gewinne aus finanzspekulationen stärker zu besteuern die frage ist doch: will man weiter millionärserben beschützen oder will man endlich millionen in diesem lande vor armut schützen wir linke haben uns entschieden: wir sagen der armut den kampf an vielen dank vielen dank katja kipping nächster redner: stephan stracke für die cdu/csu-fraktion
76,19.04.2018,ID192607600,Stephan,Stracke,CDU/CSU,Stephan Stracke,grüß gott frau präsidentin meine sehr verehrten damen und herren wir als union sind beim kampf gegen armut sehr erfolgreich; denn unsere antwort auf armut ist arbeit arbeit durch die man in der lage ist sein leben selbst zu bestreiten deswegen haben wir uns als koalition das ziel gesetzt vollbeschäftigung in deutschland zu schaffen die vergangenheit gibt uns hierbei recht: seit sind tag für tag über menschen weniger arbeitslos und über menschen mehr sozialversicherungspflichtig tätig das ist ein großer erfolg den wir uns in keinster weise von den sozialpopulisten schlechtreden lassen die diese fakten letztendlich einfach nur negieren unser anspruch ist alle menschen mitzunehmen jeder und jede ist wichtig keiner darf zurückbleiben das gilt insbesondere für die langzeitarbeitslosen wir wollen menschen die sehr lange arbeitslos sind trittfestigkeit im leben wiedergeben und perspektiven auf dem arbeitsmarkt eröffnen die linke frau kollegin kipping hat es wiederholt schlägt eine sanktionsfreie mindestsicherung in höhe von ungefähr euro brutto vor ja euro brutto aber netto stehen euro bei euch im antrag steht halt so drin aber letztendlich ist es wurscht es klingt zunächst einmal sympathisch wenn man sagen kann: na ja wir werden beschützt es sorgt jemand für uns und wir haben den übergang geschafft von der notwendigkeit einer arbeit nachzugehen zu der möglichkeit in das reich der freiheit in diesem bereich zu kommen; denn es kommt nicht mehr darauf an ob ich arbeiten gehe oder nicht was dahintersteckt ist eine entkopplung der existenzsicherung vom arbeitsmarkt letztendlich bedarf es überhaupt keiner bereitschaft mehr einer zumutbaren arbeit nachzugehen hier machen sie im hinblick auf die betroffenen auch sozialpsychologisch einen riesenfehler hilfe zur selbsthilfe wird verkehrt in eine verfestigung von abhängigkeit das ist die folge der ideen die sie in diesem bereich haben wir tun uns insgesamt nichts gutes wenn wir nichts mehr voneinander fordern und erwarten herr über das eigene leben zu sein selbstbestimmt zu sein und selbstbestimmt einer arbeit nachzugehen das für jeden zu erreichen sollte unser gemeinsames ziel sein wie auch die potenziale des einzelnen anzuschauen zu wecken und zu heben das ist das programm von union und spd daran arbeiten wir wie ich meine sehr erfolgreich; denn nach den zahlen der bundesagentur für arbeit beispielsweise haben menschen die bis zu drei jahre ohne job sind tatsächlich gute chancen auf dem arbeitsmarkt wir kümmern uns mit dem bundesprogramm soziale teilhabe am arbeitsmarkt auch um diejenigen es sind um die die sehr arbeitsfern sind auch für die übrigen menschen bedarf es noch mehr betreuung und unterstützung nach dem grundsatz des forderns und förderns ziel muss immer die integration in den arbeitsmarkt sein und keine daueralimentierung so wie es die linke will und auch kein dauerhaftes abschieben in einen scheinarbeitsmarkt ohne perspektive deswegen halten wir am system der grundsicherung für arbeitsuchende fest fast auf den tag genau vor einem jahr meine sehr verehrten damen und herren wurde der armuts- und reichtumsbericht der bundesregierung vorgelegt zentrales ergebnis ist: deutschland geht es gut wie nie sozialtransferleistungen senken deutlich das armutsrisiko für die menschen der sozialstaat in deutschland wirkt das ist unionspolitik gestatten sie eine zwischenfrage von der fraktion der linken herzlich gerne meine redezeit wäre jetzt nämlich abgelaufen; insofern kann ich noch wunderbar verlängern vielen dank herr birkwald vielen dank herr präsident vielen dank herr kollege dass sie die zwischenfrage zulassen sie haben eben insinuiert deutschland ginge es gut und das würde sich auf alle beziehen niemand stellt in abrede dass es vielen menschen glücklicherweise gutgeht; das soll auch so bleiben aber immer mehr menschen geraten in armut ich will ihnen das am beispiel der altersarmut gerne einmal aufzeigen die zahlen die ich nenne sind nicht etwa ein jahr alt sondern sie stammen aus einer aktuellen antwort der bundesregierung auf eine kleine anfrage der linken es sind also zahlen der bundesregierung wenn man sich diese zahlen anschaut dann stellt man fest dass sowohl nach dem messinstrument mikrozensus das ist die offizielle grundlage ihrer armutsrisikoberechnung wie auch nach der europäischen berechnungsgrundlage eu-silc wie auch nach dem sozio-oekonomischen panel festzuhalten ist dass menschen die älter als jahre sind vom jahr bis zum jahr deutlich ärmer geworden sind für sie sind die armutsrisikoquoten deutlich gestiegen jetzt will ich ihnen die zahlen dazu wer in diesem land arm ist einmal vortragen arm ist ein alleinlebender mensch in einem haushalt nach mikrozensus wenn er oder sie weniger als euro im monat zur verfügung hat nach dem sozio-oekonomischen panel wenn er oder sie weniger als euro zur verfügung hat und nach eu-silc wenn er oder sie weniger als euro zur verfügung hat nach der einkommens- und verbrauchsstichprobe liegt die grenze bei euro wenn wir diese zahlen einmal arithmetisch mitteln dann kommt heraus: wer alleine in diesem land lebt und weniger als euro und cent zur verfügung hat ist als arm oder von armut bedroht zu bezeichnen so jetzt müsste der kollege bald antworten ich komme zum schluss herr präsident nach diesen daten die mir die bundesregierung geliefert hat steigt die armutsgefährdung der älteren menschen und auch vieler anderer aber ich habe jetzt einmal ein beispiel gebracht von jahr zu jahr was sagen sie denn dazu und sagen sie mir bitte: wie wollen sie diese armutsgefährdung mit ihrer politik denn überhaupt bewältigen können ich sehe da keinen ansatz sehr geehrter herr kollege birkwald das ist ja wieder ein beispiel dafür dass im zuge der frage nach der armutsquote die frage nach der gefährdung durch armut sofort mit armut gleichsetzt wird das ist ja nicht einmal wissenschaftlich korrekt was sie vortragen man darf das nämlich nicht gleichsetzen es handelt sich bei dem was sie vorgetragen haben um die gefährdung durch armut und ich finde dass es nicht skandalisierungsfähig ist wenn jemand so viel geld durch arbeit verdient wie sie das beispielsweise tun der einzelne der von armut betroffen ist ist darauf angewiesen dass er unterstützung bekommt etwa durch aufstockende leistungen oder anderes mehr genau da hilft der sozialstaat unser ziel muss es doch sein gerade den risikogruppen die wir in diesem bereich schon so oft beschrieben haben also gerade alleinerziehenden migranten langzeitarbeitslosen weiterhin gute und noch bessere perspektiven zu eröffnen und genau das tun wir wir sehen dass es oftmals an mangelnder qualifikation liegt mangelnde qualifikation und armutsrisiko sind zwillingsbrüder genau dort setzt diese bundesregierung diese koalition an wir wollen das über präventive maßnahmen verhindern indem wir alles menschenmögliche dafür tun dass es nicht zu armut kommt und setzen nach dem motto des förderns und forderns an deswegen sind die instrumente die wir haben sehr gut herzliches dankeschön herr birkwald der nächste redner ist der kollege martin sichert für die afd-fraktion
