,datum,redeID,vorname,nachname,fraktion,name,inhalt_neu
15,09.12.2021,ID20601500,Bernd,Reuther,FDP,Bernd Reuther,"frau präsidentin! liebe kolleginnen und kollegen! liebe kolleginnen und kollegen der union, da haben sie ein schönes sammelsurium zusammengeschrieben. lieber kollege schreiner, da sind auch einige richtige punkte dabei. ich frage mich nur: warum haben sie die denn in den vergangenen zwölf jahren, als die union den verkehrsminister gestellt hat, nicht schon angegangen und umgesetzt? das ist doch die frage! dann widmen sie einen ganzen absatz der kritik am verkehrsteil des koalitionsvertrages. da frage ich mich, warum der gerade ausgeschiedene verkehrsminister andreas scheuer dieser tage noch gesagt hat, dieses kapitel hätte er ohne probleme unterschreiben können. da müssen sie sich doch fragen lassen: finden sie den verkehrsteil jetzt gut, oder finden sie ihn nicht gut? wir setzen uns auf jeden fall in der neuen bundesregierung dafür ein, dass mobilität auch in zukunft bezahlbar bleibt und das brennstoffemissionshandelsgesetz sinnvoll weiterentwickelt wird. das haben wir mit unseren partnern auch so im koalitionsvertrag festgehalten. sozial gerechte energiepreise sorgen dafür, dass besonders menschen mit geringen einkommen nicht zu stark belastet werden. gleichzeitig behalten wir das ökologisch notwendige im blick. deswegen halten wir weiterhin an einem steigenden -preis im verkehrssektor fest. das ist ein wichtiger anreiz, um die emissionen nachhaltig zu senken. die letzte bundesregierung hat hier viel zu wenig getan, liebe kolleginnen und kollegen. wir freien demokraten gehen allerdings noch einen schritt weiter: mit einem starken sozialen ausgleich entlasten wir insbesondere menschen mit geringem einkommen. auch für die steigenden spritkosten, liebe kolleginnen und kollegen der union seien sie unbesorgt , werden wir in der neuen bundesregierung eine lösung finden, damit wir die pendler im ländlichen raum sie wissen es, ich komme selber aus einem sehr ländlichen wahlkreis weiterhin entlasten. wesel, niederrhein. bitte. gern geschehen. bezahlbare mobilität hört allerdings nicht beim pkw auf. um die emissionen im verkehr weiter zu senken, müssen wir stärker auf den öpnv setzen. deswegen gleichen wir in einem ersten schritt die pandemiebedingten einnahmeausfälle der verkehrsbetriebe aus und erhöhen die regionalisierungsmittel ab dem nächsten jahr. damit werden wir verhindern, dass die ticketpreise weiter so stark anziehen wie unter ihrer regierungsverantwortung. unser ziel ist es schließlich, die fahrgastzahlen im öpnv deutlich zu steigern. dazu zählen wir auch digitale und innovative mobilitätsdienste. diese wurden in der vergangenheit ebenfalls sträflich vernachlässigt, und es fehlen die richtigen rahmenbedingungen. dabei haben wir besonders im ländlichen raum die chance, das mobilitätsangebot zu verbessern und den menschen hier eine ergänzung zum klassischen öpnv zu bieten. liebe kolleginnen und kollegen, die neue bundesregierung wird die versäumnisse der letzten jahre nicht nur aufarbeiten und beseitigen. wir werden neue schritte wagen und die modernisierung unseres landes vorantreiben; denn nur wer mehr fortschritt wagt, kann den wohlstand unseres landes langfristig sichern. herzlichen dank. nächste rednerin: für die spd-fraktion dr. wiebke esdar."
16,09.12.2021,ID20601600,Wiebke,Esdar,SPD,Wiebke Esdar,"frau präsidentin! meine damen und herren! vorfahrt für die bahn, ein starker öpnv und bis zum jahr -mal so viele elektroautos wie heute auf unseren straßen damit der verkehr jetzt endlich klimafreundlich wird, brauchen wir wirklich einen aufbruch in der mobilitätspolitik, und den liefern wir mit dem jetzt unterzeichneten koalitionsvertrag. wir haben drei kernelemente in unserem plan. erstens. wir müssen massiv in die schiene investieren. die bahn muss in ganz deutschland zum rückgrat der mobilität werden auch im ländlichen raum. wir brauchen einen klugen ausbau der schieneninfrastruktur und des bahnbetriebs. wir wollen den schienengüterverkehr bis auf prozent steigern, und wir wollen die verkehrsleistung im personenverkehr verdoppeln. zweitens wollen wir, dass länder und kommunen in die lage versetzt werden, die attraktivität des öpnv wirklich zu steigern: durch eine engere taktung und durch eine bessere erreichbarkeit, auch über die tarifzonen hinweg. wir wollen die fahrgastzahlen im öffentlichen verkehr massiv steigern. dazu sollen zudem busse und bahnen zeitnah klimaneutral fahren. es gibt schon pilotprojekte. in bielefeld durften wir uns in der letzten woche über die ersten mit grünem wasserstoff betriebenen busse freuen. auch der wasserstoffbeauftragte unserer fraktion klatscht. das sind erste pilotprojekte. jetzt wird es darum gehen, dass wir das in der breite umsetzen, damit es auch wirklich einen klimafreundlichen effekt gibt. schließlich wollen wir, drittens, deutschland zum leitmarkt für elektromobilität und zum innovationsstandort für autonomes fahren machen. wir wollen dafür den ausbau der ladesäuleninfrastruktur massiv vorantreiben: million öffentlich zugängliche ladepunkte in den nächsten jahren und millionen vollelektrische pkws auf den straßen bis . damit können wir die verkehrswende, die in vielen kommunen und städten schon begonnen wurde, endlich unterstützen und die bundesinvestitionen, die dafür benötigt werden, liefern. meine damen und herren, auf dem weg zur klimaneutralität gilt im koalitionsvertrag ein ganz klarer grundsatz: das, was gut fürs klima ist, wird günstiger; das, was schlecht fürs klima ist, muss teurer werden. um dies sicherzustellen, haben wir parteiübergreifend meine damen und herren, da waren sie von der union auch dabei einen verlässlichen, moderaten -preisanstieg vereinbart. an dem wollen wir festhalten. wir dürfen gleichzeitig auch das ist klar auf diesem pfad natürlich nicht diejenigen vergessen, die auch heute noch auf den verbrennungsmotor angewiesen sind, weil sie auf dem land leben und ihnen auf ihrem pendelweg eben noch kein gut ausgebauter öpnv zur verfügung steht. wir wollen diejenigen weiter unterstützen. wir wollen sicherstellen, dass mobilität bezahlbar bleibt, indem wir einerseits noch stärker auf attraktive kaufanreize für strombetriebene pkws setzen, zudem aber auch den steigenden -preis über ein klimageld ausgleichen und die eeg-umlage neu finanzieren. es war in der letzten wahlperiode auch richtig, dass wir gemeinsam mit der union meine damen und herren, da verwundert mich ihr antrag schon; sie haben das scheinbar vergessen beschlossen haben, die pendlerpauschale für langstreckenpendler befristet anzuheben. seit diesem jahr wurde sie auf cent angehoben, und bis wird sie auf cent erhöht. meine damen und herren, ich finde, ihr antrag ist, wenn ich das mal so sagen darf, ziemlich peinlich. sie haben, in der opposition angekommen, wohl vergessen, was sie zuletzt beschlossen haben. und, herr schreiner, dass sie in ihrem redebeitrag das kommt obendrauf den eindruck erwecken, wir würden hier die pendlerpauschale abschaffen, ist, ehrlich gesagt, auch ziemlich peinlich. ich hoffe, dass da ein bisschen mehr niveau in die oppositionsarbeit hineinkommt. ich will außerdem erwähnen, dass sie auch mit ihrer forderung zu den energiesteuersätzen für diesel und benzin einen falschen eindruck erwecken. sie wissen genauso gut wie wir, dass die europäische kommission die eu-energiesteuerrichtlinie vorgelegt hat und nicht der koalitionsvertrag anlass für eine angleichung der besteuerung von diesel und benzin ist. ich wette, wir sind uns an diesem punkt relativ schnell einig: wenn die richtlinie die anhebung der energiesteuer auf dieselkraftstoff zur folge haben sollte, dann können und dann sollten wir diese höhere besteuerung des diesels in der kfz-steuer korrigieren. wir können das korrigieren, aber erwecken sie nicht den eindruck, im koalitionsvertrag würden dinge stehen, die da nicht stehen. ich will ganz kurz auf den antrag der afd eingehen. meine damen und herren, sie machen weiter mit der leugnung des menschengemachten klimawandels. sie wollen daraus ableitend den -preis kippen und das brennstoffemissionshandelsgesetz abschwächen. sie haben wieder sündenböcke gefunden, die, wenn wir ehrlich sind, keine sündenböcke sind. es wäre ehrlicher, wenn sie mal auf den weltmarktpreis für rohöl oder den starken dollar eingehen würden. meine damen und herren, wenn es ihnen wirklich darum geht, zu erfahren, wie wir haushalte mit kleinen einkommen entlasten wollen, dann lesen sie den koalitionsvertrag noch einmal ganz genau. da finden sich auch in den kapiteln zur kindergrundsicherung und zum mindestlohn gute anreize. herzlichen dank. ich rufe sie später auf. es gab hier gerade noch blickkontakt wegen einer kurzintervention. herr spaniel hat jetzt das wort zu einer kurzintervention."
17,09.12.2021,ID20601700,Dirk,Spaniel,AfD,Dirk Spaniel,"vielen dank, frau präsidentin. frau esdar, sie haben hier unterstellt, dass wir in unserem antrag den klimawandel leugnen. ich muss das jetzt hier an dieser stelle im plenum einmal richtigstellen. die afd-fraktion hat zu keinem zeitpunkt den klimawandel geleugnet. sie hat lediglich betont, dass der von den menschen verursachte einfluss sehr gering ist. das hat übrigens auch gar nichts mit den themen zu tun, die wir hier heute diskutieren. sie unterstellen permanent, dass durch die elektromobilität oder die steigerung des öffentlichen personennahverkehrs die emissionen reduziert werden. wir wissen eigentlich alle in diesem plenum: erstens. sie können den öpnv nicht in dem maße ausbauen, wie sie das hier propagieren. zweitens. die emissionen, die durch elektromobilität entstehen das bestätigen viele studien , führen gerade nicht dazu, dass sie die -emissionen in unserem land reduzieren, weil der strom, den sie brauchen, sowohl für bus und bahn als auch für elektromobilität, auf viele jahre aus kohlekraftwerken kommen wird. das bestätigen alle studien. das heißt also: ihr plan führt nicht dazu, dass wir die emissionen in diesem land reduzieren; er führt nur dazu, dass das leben für die menschen, die auto fahren, unendlich teuer wird. dies ist unsere argumentation. frau esdar, möchten sie antworten?"
18,09.12.2021,ID20601800,Wiebke,Esdar,SPD,Wiebke Esdar,"herr spaniel, richtig zuhören hilft. ich habe vom menschengemachten klimawandel, den sie immer wieder leugnen, gesprochen. richtig zuhören hilft auch bei dem von mir genannten beispiel aus bielefeld, wo von grünem wasserstoff angetriebene busse fahren. genau das haben wir im koalitionsvertrag vor: wir wollen die auf erneuerbare energien setzenden antriebe stichwort grüner wasserstoff fördern. das ist, glaube ich, ziemlich klar. nächster redner: für die cdu/csu-fraktion dr. christoph ploß."
19,09.12.2021,ID20601900,Christoph,Ploß,CDU/CSU,Christoph Ploß,"frau präsidentin! verehrte kolleginnen und kollegen! wie sieht die mobilität der zukunft aus? das ist eine frage, die wir nicht nur in der vergangenen legislaturperiode mit vielen initiativen der cdu/csu-fraktion schon in die richtige richtung beantwortet haben, sondern die auch in dieser legislaturperiode eine wichtige frage sein wird. da muss man ganz zu beginn dieses redebeitrags erst einmal eines klarstellen, weil einige hier geschichtsklitterung betreiben: es gab noch nie so viele investitionen in die schiene und in den öffentlichen nahverkehr wie unter der unionsgeführten bundesregierung in der letzten legislaturperiode, meine damen und herren. ich kann eines sagen: wir werden auch als opposition, wir werden als cdu/csu-fraktion einen schwerpunkt auf den ausbau des öffentlichen nahverkehrs und auf investitionen in die schiene legen und in den nächsten jahren sehr, sehr viele anträge und initiativen für den schienenausbau in deutschland einbringen. aber es sind natürlich das muss man, glaube ich, hier ganz klar benennen viele menschen in unserem land auch in sorge, weil sie im moment widersprüchliche aussagen von den regierungsfraktionen dazu hören. spd und grüne sagen: mobilität soll teurer werden. autofahren muss teurer werden. es soll nicht sein, dass personen, die zum beispiel im ländlichen raum wohnen, mit dem auto zur arbeit in die großstadt fahren. das sind alles aussagen, die wir von spd und grünen hören. dann hören wir auf der anderen seite christian lindner, jetziger finanzminister, hat es kurz vor der wahl gesagt; auch volker wissing, jetziger verkehrsminister, hat es kurz vor der wahl gesagt; klare beteuerung der fdp , dass der benzinpreis nicht verteuert wird und dass die mobilität in unserem land für die bürger nicht teurer wird. ich sage eines ganz klar, auch in richtung fdp: wir als cdu/csu-fraktion werden genau darauf achten, dass diese versprechen, die sie noch wenige tage vor der bundestagswahl gegeben haben, erfüllt werden. wenn sie der pflegekraft, die morgens zur frühschicht ins krankenhaus muss, sagen, sie soll im winter das rad nutzen sie hat vielleicht gar keine u- oder s-bahn-station vor der tür , wenn sie den menschen, die im ländlichen raum oder in den randgebieten der großstädte wohnen, sagen: ihr dürft jetzt nur noch mit dem rad oder dem öffentlichen nahverkehr fahren , dann wird das unser land spalten. die frage, die wir im deutschen bundestag beantworten müssen, ist nicht schiene oder auto? , sondern wir brauchen schiene und auto. wir müssen in diesem zusammenhang das auto klimafreundlich machen. wir müssen dafür sorgen, dass autofahren bezahlbar wird und dass wir die -ziele erfüllen. es gibt noch einen weiteren punkt, der nicht nur uns als cdu/csu-fraktion, sondern vielen menschen in unserem land sorge macht: sie gehen nicht technologieoffen an das thema heran. wenn sie nicht dafür sorgen, dass den , millionen menschen in den -, -jahren, die dann immer noch mit dem verbrennungsmotor unterwegs sein werden, zum beispiel günstige e‑fuels und günstige klimaneutrale kraftstoffe zur verfügung stehen, dann wird das dazu führen, dass sich diese menschen mobilität nicht mehr leisten können. deswegen sage ich eines ganz klar: wir werden im sinne der vielen millionen hart arbeitenden menschen in unserem land darauf achten, dass mobilität bezahlbar bleibt, dass mobilität technologieoffen bleibt auch in dieser legislaturperiode und dass wir mit innovation und sozialer marktwirtschaft die herausforderungen angehen. darauf werden wir achten, und dafür werben wir um unterstützung. herzlichen dank. nächster redner: für die fraktion bündnis /die grünen matthias gastel."
20,09.12.2021,ID20602000,Matthias,Gastel,BÜNDNIS 90/DIE GRÜNEN,Matthias Gastel,"sehr geehrte frau präsidentin! liebe kolleginnen! liebe kollegen! ganz schön mutig von der cdu/csu, einen solchen antrag zu stellen. sie sind es gewesen, die drei legislaturperioden in folge die bundesverkehrsminister gestellt haben und eine ganze reihe von falschen entscheidungen und dingen, die liegen geblieben sind, zu verantworten haben. sie waren es, die das ministerium jahrelang lahmgelegt haben mit einer unsinnigen ausländermaut. sie waren es, die den bundesverkehrswegeplan mit straßenbauprojekten völlig überfrachtet haben. sie waren es, die einseitig auf die straße gesetzt und die schiene vernachlässigt haben. lieber kollege ploß, sehen sie doch einmal in den haushaltsplan dieses jahres, wie viel geld für die straße und wie viel für die schiene vorgesehen ist! sie sind es, die die elektrifizierung und die digitalisierung der schiene verschleppt haben. und sie sind es, die es zu verantworten haben, dass die klimaziele im verkehrsbereich krass verfehlt worden sind. das ist ihre verantwortung ihrer jahrelangen falschen verkehrspolitik. die ampelkoalition hat viele vereinbarungen getroffen, um diesen stillstand aufzulösen und die notwendigen entscheidungen herbeizuführen. wir haben ehrgeizige ziele für die stärkung des öffentlichen verkehrs und des schienengüterverkehrs getroffen. wir wollen erheblich mehr in die schiene als in die straße investieren. wir werden mehr oberzentren an den fernverkehr der bahn anbinden und die bahn wieder in die fläche bringen. wir werden strecken elektrifizieren; ein wesentlicher beitrag für die stärkung des güterverkehrs auf der schiene und für die klimaziele im verkehrsbereich. wir werden dafür sorgen, dass es mehr gleisanschlüsse in industriegebieten gibt und mehr terminals für den kombinierten verkehr, damit die verlagerung auf die schiene gelingt. wir werden das straßenverkehrsgesetz und die straßenverkehrs-ordnung ökologisch reformieren und den städten und gemeinden mehr handlungsspielräume eröffnen. das ist gut für den radverkehr und gut für den fußverkehr. unter zu vielen csu-verkehrsministern ist zu vieles zu lange liegen geblieben. vieles davon wird die ampel anpacken. nächster redner: für die cdu/csu-fraktion alois rainer."
21,09.12.2021,ID20602100,Alois,Rainer,CDU/CSU,Alois Rainer,"sehr geehrte frau präsidentin! liebe kolleginnen und kollegen! seit nunmehr circa einer halben stunde beraten wir unseren antrag mobilität für alle bezahlbar halten, pendler und wirtschaftsverkehr schützen . dabei wurden drei dinge deutlich: die ampel steht für pendler und unternehmen, die auf das auto angewiesen sind, auf rot. pendler werden mehr zahlen, und die pendlerpauschale wird infrage gestellt. unternehmen erleiden im europäischen vergleich wettbewerbsnachteile durch die im koalitionsvertrag angekündigte angleichung von diesel- und benzinpreisen. meine damen und herren, das dieselprivileg ist in wahrheit kein privileg, sondern ein ausgleich einseitiger belastungen der betroffenen. zweitens. im gesamten bereich der verkehrspolitik steht die ampel auf gelb. liebe geschätzte kollegen der grünen, ganz schön mutig, herr gastel, diesen koalitionsvertrag zu unterschreiben. nach den vollmundigen ankündigungen in der letzten legislaturperiode unterschreiben sie einen koalitionsvertrag, in dem ich grüne politik sehr wenig sehe. es steht nur drin: klimaschädliche subventionen sollen abgeschafft werden. ich bin am ende der tage gespannt, wie dieser konflikt mit der fdp zu schaffen ist. wir werden darauf schauen. wir werden ein genaues augenmerk darauf haben, wie sie das am ende der tage lösen werden. ich sage ihnen eines: noch nie wurde in der bundesrepublik so viel in den radverkehr investiert wie in der letzten legislatur. noch nie wurde so viel in die bahn investiert wie in der letzten legislatur. dieses investitionsministerium, lieber andreas scheuer, hat den namen in den letzten jahren auch verdient gehabt. wir werden ganz genau darauf schauen, was von diesen investitionen am ende der tage auch übrig bleibt. für uns ist es wichtig: wir brauchen weiterhin bezahlbare mobilität. ganz wichtig ist, wenn wir von subventionen reden, dass beim agrardiesel keine mehrbelastung für unsere land- und forstwirte kommt; denn die steuervergünstigung beim agrardiesel fördert die wettbewerbsfähigkeit vieler familienbetriebe in unserem land. ich freue mich auf die aufmerksame arbeit mit ihnen. ich sage nicht: ich freue mich auf die opposition. auf die freue ich mich nicht. ich freue mich auf eine aufmerksame arbeit mit ihnen. glauben sie uns: wir werden ein wachsames augenmerk haben auf das, was in der verkehrspolitik passiert, was in der infrastrukturpolitik passiert und wie in unserem land investiert wird. vielen herzlichen dank."
22,09.12.2021,ID20602200,Ekin,Deligöz,BÜNDNIS 90/DIE GRÜNEN,Ekin Deligöz,"frau präsidentin! sehr geehrte kolleginnen und kollegen! die neue koalition bringt heute eine gesetzliche änderung zu regelungen der ganztagsfinanzierung ein. damit schaffen wir klarheit und vereinfachen die investitionen in die schulkindbetreuung in zwei punkten. der erste punkt ist, dass die laufzeit der beschleunigungsmittel in höhe von millionen euro um ein jahr verlängert wird. es hat sich gezeigt, dass diese gelder nicht so abfließen konnten, wie es eigentlich geplant war. die gründe dafür liegen auf der hand: lieferengpässe in der bauwirtschaft, planungsengpässe im handwerk, folgen von hochwasser, die pandemie. all diese gründe lagen vor. wir als ampelparteien haben diesen schritt bereits in der letzten sitzungswoche angekündigt. heute setzen wir ihn um. bitte erlauben sie mir an dieser stelle einen ganz herzlichen dank an meinen kollegen sönke rix und an herrn seestern-pauly. wir drei haben das verhandelt. vielen herzlichen dank für die gute zusammenarbeit gleich von anfang an. jetzt wird eine partei, nämlich die cdu/csu-fraktion, sagen: wir haben das doch noch vor ihnen eingebracht. wissen sie was: wir hätten nicht so schnell handeln müssen, hätten sie die handwerklichen fehler erst gar nicht gemacht. ihnen haben wir es zu verdanken, dass wir so schnell agieren mussten. sie wussten nämlich, als das gesetz damals verabschiedet wurde, dass es diese probleme gibt. ihnen ging es gar nicht um die unterstützung der kommunen. womöglich ging es ihnen auch gar nicht um die ganztagsschulen. sie wollten einfach so schnell wie möglich ein konjunkturmittel auf den weg bringen, und symbolik hatte bei ihnen vorrang. deshalb haben sie diese fehler gemacht, und diese fehler korrigieren wir. das ist unser plan. ich habe in meiner rede angekündigt, dass es nicht nur darum gehen kann, sondern dass es um ein ganzheitliches denken geht, dass es darum geht, fortschritt voranzubringen, dass es darum geht, die kommunen und die länder zu unterstützen und die besten bildungseinrichtungen für die kinder in diesem land zu schaffen. deshalb gehen wir noch einen zweiten schritt: wir sorgen dafür, dass nicht nur diese mittel, sondern die gesamten ganztagsmittel von allen in anspruch genommen werden können, dass sie unbürokratisch und einfach abfließen können. wir machen das ganze viel einfacher, viel unkomplizierter, viel unbürokratischer, und wir überführen die bonusmittel in die basismittel, sodass die inanspruchnahme auch erfolgen kann. das nenne ich: ganzheitliches denken und handeln. es ist wichtig und richtig, dass wir das so machen, liebe kolleginnen und kollegen; denn wir haben gemeinsam ein bekenntnis zur ganztagsschule gegeben. wir haben das im bundesrat verhandelt. das ergebnis ist da. jetzt geht es nicht um bund gegen länder, länder gegen kommunen oder wie auch immer, sondern es geht darum, dass wir dieses ziel gemeinsam entschlossen und ehrgeizig verfolgen. aber, liebe kolleginnen und kollegen, das kann ich ihnen auch sagen: wir werden bei diesem einen punkt nicht stehen bleiben. wir haben uns wirklich vorgenommen, die bildungseinrichtungen in diesem land bestmöglich zu fördern. sie können es in unserem koalitionsvertrag nachlesen: wir setzen nicht nur auf quantität; wir setzen nicht nur auf investitionen. wir setzen auch auf qualität, weil auch das zur bestmöglichen förderung der bildungseinrichtungen gehört. wir werden das gute-kita-gesetz nicht nur verlängern, sondern wir werden es in ein betreuungsqualitätsgesetz überführen, bei dem es darauf ankommt, die besten kindergärten für unsere kinder zu schaffen. um beste startchancen für unsere kinder und jugendlichen zu schaffen, werden wir auch die schulsozialarbeit in den schulen erweitern. die schulkinderbetreuung wird durch das investitionsprogramm ergänzt, wo digitalisierung, moderne schulen, klimagerechte bauten und barrierefreiheit nicht nur gedacht, sondern auch umgesetzt werden. auch die schulkinderbetreuung wird von diesem land in richtung qualitätsrahmen in der bildung in einer ganztagsschuleinrichtung gefördert werden. das gehört zu den vorhaben des bildungsministeriums. sie sehen: unsere ziele in diesem bereich sind wahnsinnig hoch. das ist auch richtig und wichtig in diesem land. es ist übrigens auch unumgänglich, dass wir noch ein sehr, sehr wichtiges thema rausholen: das ist der bereich der fachkräftesicherung. hier brauchen wir einen großen kraftakt, nicht nur symbolik, sondern das handeln einer entschlossenen regierung, damit wir die menschen davon überzeugen können, dass dieses berufsbild nicht nur attraktiv, sondern auch wichtig für unsere gesellschaft ist. diese regierung wird aber noch weiter gehen. wir packen es an, kinderarmut zu bekämpfen. wir wollen nicht, dass jedes fünfte kind in armut aufwächst. wir wollen alleinerziehende nicht im stich lassen. wir haben so vieles vor, um diese gesellschaft umzubauen. sie von cdu und csu finden zumindest erst mal die fristverlängerung richtig. das finde ich, ehrlich gesagt, gut. ich bin gespannt, ob sie auch dementsprechend abstimmen werden. uns reicht das nicht. das ist erst der anfang. alles andere sind unsere hausaufgaben, die wir in der kommenden zeit umsetzen werden. bereits in den ersten tagen werden sie hier einiges von uns vorgelegt bekommen. dann wird es darauf ankommen, ob es ihnen tatsächlich um kinder und jugendliche in diesem land geht, ob sie uns darin unterstützen werden, dieses land voranzubringen, ob sie uns darin unterstützen werden, dieses land gerechter zu machen. dann wird sich abzeichnen, ob es ihnen um kinder geht, spätestens dann, wenn wir nicht nur im bundestag, sondern auch im bundesrat darüber entscheiden werden. vielen dank, liebe kolleginnen und kollegen. nächste rednerin: für die cdu/csu-fraktion nadine schön."
