,datum,redeID,vorname,nachname,fraktion,name,inhalt_neu
78,03.07.2018,ID194407800,Beatrix,von Storch,AfD,Beatrix von Storch,"ich versuche es mal. sind sie der meinung, dass viele, die zwei einkommen erzielen müssen, weil die abgaben so hoch sind, möglicherweise mit einem einkommen zufrieden wären und sich dann ein elternteil ob der vater oder die mutter, ist ganz egal schwerpunktmäßig um die kindererziehung kümmern würde? sind sie der meinung, dass das der bessere weg wäre: abgaben senken und dadurch die eltern in die lage versetzen, nicht auf zwei einkommen angewiesen zu sein, um überhaupt über die runden zu kommen? als erstes würde ich mir wünschen, sie würden nicht immer interpretieren, was familien wollen. die freiheit der familien wollen wir stärken, ihre entscheidungsfreiheit, und nicht das dogmatische leitbild, das sie für familien haben. der zweite punkt ist: wenn sie in diesen haushalt schauen und sich die planungen für die nächsten vier jahre anschauen, stellen sie fest, dass wir familien insgesamt um milliarden euro entlasten. allein die kindergelderhöhung um euro, die bis durchgeführt wird, entlastet ja gerade die familien. wenn wir den steuerlichen entlastungsbeitrag deutlich erhöhen, wenn wir das kindergeld deutlich erhöhen, bringt das eine entlastung der familien in der breite mit sich. und das ist es, was sich familien wünschen. wir müssen auch die rahmenbedingungen für familienpolitik ändern. das hat etwas mit der lebenssituation in großstädten zu tun. das hat zum beispiel etwas mit der frage von arbeitsverträgen zu tun. genau deswegen reden wir ja darüber stichwort teilzeit und vollzeit , wie wir es den familien besser ermöglichen können, ihr familienmodell zu leben. unser ansinnen ist, die freiheit der familien zu stärken, und nicht, dogmatische leitbilder vorzugeben, wie sie es gerne machen. der blick zurück macht es relativ deutlich ich habe die kindergelderhöhung, die kinderfreibeträge schon erwähnt : wir wollen in der breite familien stärken, aber auch sehr gezielt stichwort erhöhung des kinderzuschlages dorthin schauen, wo menschen, wo familien finanzielle nöte haben. das unterhaltsvorschussgesetz wurde bereits angesprochen. nächster punkt: elterngeld und elterngeld plus. der anteil erwerbsfähiger mütter mit kindern im alter zwischen zwei und drei jahren ist von auf prozent gestiegen. ich bewerte das nicht so wie sie, weil das nicht meinem leitbild entspricht. ich will das nicht bewerten. es ist aber die freiheit der familien, zu sagen: jawohl, wir wollen früh in den beruf zurückkehren. andere familien sagen: wir wollen länger zu hause bleiben. dafür müssen wir räume schaffen. das tun wir auch. dazu gehört insbesondere der bereich der kindertagesbetreuung. über milliarden euro haben wir dafür bisher bereitgestellt. wir geben jährlich millionen euro für die betriebskosten aus. da setzen wir an. nach dem quantitativen ausbau der kindertagesbetreuung kommt für uns jetzt eine große zäsur; denn nun folgt der qualitätsausbau. satt und sauber allein reicht nicht. eltern wollen eine vernünftige, eine gute betreuung ihrer kinder. die , milliarden euro bis darüber hinaus haben wir noch nichts festgelegt sind gut angelegtes geld, weil wir die qualität steigern können. hinzu kommt etwas, was uns die familien gesagt haben. sie haben gesagt: das, was ihr bei der kindertagesbetreuung macht, ist ja wunderbar. wir finden das gut, und wir erkennen das an. aber es kann doch nicht sein, dass es für ein kind, das von der kita in die grundschule kommt, in gewissen regionen des landes möglicherweise kein angebot der ganztagsbetreuung gibt. deswegen haben wir gesagt: eine zweite zielfunktion muss sein, dass wir für ganz deutschland einen rechtsanspruch auf eine ganztagsbetreuung auch im grundschulbereich schaffen. das haben wir uns für vorgenommen. das ist der nächste schritt. in diesem zusammenhang müssen wir uns natürlich fragen: wie sieht es mit den erzieherinnen und erziehern aus? das wird in den nächsten jahren eine große aufgabe sein, und das muss eine gemeinsame anstrengung werden. die kommunen, die länder und der bund müssen sagen, wie sie die noch fehlenden erzieherinnen und erzieher ausbilden wollen. aber ich glaube, da wird man gemeinsam zu guten ergebnissen kommen. herr weinberg, gestatten sie eine weitere zwischenfrage des kollegen von der linken? jetzt nicht mehr, vielen dank. konkret zum haushalt und zu den dingen, die wir uns vorgenommen haben. das kindergeld habe ich bereits angesprochen. ich komme zum thema zeit. zeit ist die zukunftsressource. in den nächsten jahren geht es darum, zeit zu generieren, zeit für die arbeit und für die familie. außerdem haben wir im koalitionsvertrag zwei dinge angeregt. dabei geht es um zuschüsse für haushaltsnahe dienstleistungen und um das thema recht auf befristete teilzeit . das schafft freiheiten, arbeitszeit und familienzeit besser zu vereinbaren. im haushalt sind manche dinge gelungen sie wurden bereits angesprochen , die ich als sehr bedeutsam betrachte. beim baukindergeld ist gott sei dank die -quadratmeter-regelung vom tisch. es ist nicht erklärbar, warum diese forderung überhaupt in die welt gekommen ist aber sei es drum. ich glaube, das baukindergeld ist eine gute familienpolitische maßnahme, übrigens auch eine maßnahme, die die altersarmut bekämpft. denn wir wissen: eine immobilie stärkt die familien heute und sichert auch im alter die existenz. ich will noch ganz konkret auf zwei dinge zu sprechen kommen. erstens: zum bundesmodellprojekt einer mobilen und spezialisierten fachberatung zur bekämpfung sexualisierter gewalt an kindern und jugendlichen. es wird eine aufgabe der zukunft sein, dass wir uns das thema gewalt an kindern und jugendlichen vornehmen. die , millionen euro bis zum jahr an dieser stelle vielen dank, alois rainer und den übrigen haushältern sind gut angelegtes geld. zweitens. zum thema demokratie leben ist bereits einiges gesagt worden. wir bekämpfen den extremismus tatsächlich. mir ist es, auf deutsch gesagt, scheißegal, ob es sich dabei um terrorismus von links, von rechts oder um islamistischen terrorismus handelt. ich will, dass der zusammenhalt der gesellschaft gestärkt wird, indem wir in diesen bereich investieren und präventionsprojekte unterstützen. ich muss sagen: die millionen euro für die gedenkstätte hohenschönhausen sind ein tolles ergebnis. dort wird wichtige arbeit geleistet, und es wird eine erinnerungskultur geschaffen. deswegen gilt mein dank auch an dieser stelle den haushältern. sie merken: das alles hat mit dem oberbegriff des zusammenhalts der gesellschaft und der familie zu tun. daran haben wir uns bei diesem haushalt orientiert, und das werden wir auch beim haushalt tun. vielen dank. nächster redner ist grigorios aggelidis für die fdp."
79,03.07.2018,ID194407900,Grigorios,Aggelidis,FDP,Grigorios Aggelidis,"sehr geehrter herr präsident! sehr geehrte frau ministerin! liebe kolleginnen und kollegen! die bundesregierung will familien und kinder in den mittelpunkt stellen. das begrüßen wir ausdrücklich. dann sollten sie und ihre groko aber endlich anfangen, die familienpolitik aus der sicht der familien zu betrachten. wer wie finanzminister olaf scholz in der vergangenen woche bei der regierungsbefragung von freibetragsprofitierenden und kindergelderhöhungsprofitierenden spricht, hat offensichtlich den sichtkontakt zu den menschen verloren. hier geht es um familien und ihre zukunft. wenn ich mir die vorhaben für die gesamte legislaturperiode anschaue, dann lese ich größtenteils nur wesensgleiche worte: aufstockung, ausbau, steigerung, fortsetzung, erhöhung. hören sie erst mal zu! ganz locker bleiben! als wenn dieser politische weg in den letzten jahren die gravierenden probleme für familien gelöst hätte! schließlich kritisierte die familienministerin der spd die familienpolitischen reformpläne der union schon vor der wahl als maßnahmen mit der gießkanne . jetzt tragen sie diese pläne mit stolzer brust vor sich her. erhöhung und ausbau bedeuten, immer mehr mittel aufzuwenden wenn ich mir die ergebnisse der letzten jahren angucke , in der vagen hoffnung, dass am ende des tages bei den familien auch ein bisschen ankommt. trotzdem oder gerade deswegen stagniert die kinderarmut, sind für viele familien kinder ein armutsrisiko und entscheidet allzu oft die familiäre herkunft über die chancen der kinder. lernen sie es endlich: die wirksamkeit, die inanspruchnahme und vor allem eine mutige finanzielle entlastung der familien sind entscheidend. immerhin hat sich die bundesregierung laut finanzminister scholz einen großen aufschlag beim kinderzuschlag vorgenommen, der für seine ausarbeitung allerdings zeit benötigt. mehr zeit wofür? , frage ich. damit er wieder passend erst zur nächsten wahl vorliegt? bereits im juni vor einem jahr stellte ihre vorgängerin, katarina barley, der presse ein gutes konzept zur zusammenlegung von kindergeld und kinderzuschlag vor. was ist aus diesem konzept geworden? entweder war dieses angekündigte konzept, das wohlgemerkt kurz vor der wahl erneut prominent hervorgehoben wurde, nur eine lose idee, oder im ministerium verschwinden gute ideen in schubladen, bis man vor den wahlen erneut medienwirksame konzepte benötigt. beide varianten sind politisch mehr als peinlich und helfen familien eben überhaupt nicht. das familienministerium ist so grokoisiert , dass dort selbst ernsthaft geglaubt wird, nur ein mehr an ausgaben löse schon die probleme. dabei müssen sie endlich erkennen: die probleme liegen in den strukturen. eine fünf jahre dauernde evaluation verschwindet zwischen dem finanzministerium und dem familienministerium. die vom bundesrechnungshof angemahnte verbesserungsinitiative ist nicht in sicht. allensbach verweist auf probleme des lebensfernen zeitkorridors beim elterngeld plus und bei den vaterschaftsmonaten. konkrete verbesserungsinitiativen für familien und die eltern sind nicht in sicht. laut der letzten evaluation im auftrag des bundesministeriums für arbeit und soziales liegt die inanspruchnahme beim bildungs- und teilhabepaket nur bei knapp über prozent. konkrete verbesserungsinitiativen sind auch hier sie ahnen es schon nicht in sicht. ja, darin stand die letzten male auch viel. wer weiter denken kann als von der wand bis zur tapete, dem wird klar: wir haben familienpolitische leistungen, die für viele familien keinen unterschied machen, weil sie bei den familien gar nicht erst ankommen. sorgen sie deswegen endlich dafür, dass die familienleistungen unkompliziert und unbürokratisch ineinandergreifen und die leistungen endlich bei den familien ankommen. das ist der entscheidende faktor, damit die menschen eigenverantwortlich sein können und positiv in die zukunft schauen. leider ist die bundesregierung hier seit jahren nicht wirklich vom fleck gekommen. ich bleibe trotzdem optimistisch. ich bin gesellschaftlich optimistisch; denn angesichts der geburten in unserem land und der wachsenden anzahl an jungen familien freue ich mich über die offensichtlich familienfreundliche grundstimmung in unserer gesellschaft. ich bin familienpolitisch optimistisch; denn ich traue ihnen, frau ministerin giffey, in der nächsten haushaltswoche für eine deutlich familienorientiertere handschrift jenseits eines weiter-so zu. und ich bin politisch optimistisch; denn eine liberale fraktion macht einen unterschied, indem wir die menschen in den mittelpunkt unserer bemühungen stellen und sie befähigen, ihren eigenen weg zu gehen. vielen dank. vielen dank. nächster redner ist norbert müller für die linke."
80,03.07.2018,ID194408000,Norbert,Müller,DIE LINKE,Norbert Müller,"sehr geehrter herr präsident! sehr geehrte damen und herren! werte gäste! die bundesfamilienministerin giffey hat gute kitas zum schwerpunkt ihrer amtszeit gemacht, und so ist sie rastlos unterwegs und kündigt dies und das in der öffentlichkeit an. am . märz haben sie während der tarifverhandlungen im öffentlichen dienst erklärt, kitaerzieher sollten annähernd wie grundschullehrer bezahlt werden ohne einen finanzierungsvorschlag. am . april haben sie das gute-kita-gesetz angekündigt, von dem immer noch kein entwurf auf dem tisch liegt und das offenbar zu großen verstimmungen zwischen den koalitionsfraktionen geführt hat. es geht um mittel in höhe von milliarden euro. sie haben gesagt, das gehe umgehend in die ressortabstimmung. diese abstimmung müsste jetzt ungefähr zwei monate andauern. am . mai, kurz nach dem tag der arbeit, haben sie eine kita-fachkräfteoffensive angekündigt. dazu liegt so richtig noch nichts auf dem tisch. und am . juni, also letzte woche, haben sie gesagt, kitaerzieher sollten jetzt zwar nicht mehr so viel verdienen wie grundschullehrer, aber mindestens pauschal euro brutto mehr im monat. im haushalt steht dazu nichts. die realität: es fehlen kitaplätze per annum. es fehlen über erzieherinnen und erzieher. allein in berlin sind tausende plätze mangels personal unbesetzt. eltern demonstrieren für kitaplätze gegen teilweise extrem hohe gebühren. träger demonstrieren für mehr qualität und dafür, dass ihre beschäftigten besser bezahlt werden können. erzieherinnen demonstrieren und streiken die tarifrunde war erst vor zwei jahren für bessere arbeitsbedingungen und für mehr anerkennung ihres berufes. was es bedeutet, wenn jemand keinen kitaplatz für sein kind bekommt und deswegen zu hause bleiben muss, hat uns die bertelsmann-stiftung erst in der letzten woche in einer studie vorgestellt. darin steht, dass in paarhaushalten mit kindern prozent der kinder dauerhaft oder wiederkehrend in armut sind, wenn einer der elternteile nicht arbeiten kann, weil zum beispiel kein kitaplatz zur verfügung steht. liebe frau giffey, liebe kolleginnen und kollegen von der cdu/csu und der spd, was niemand braucht, ist eine politik der ankündigungen. die menschen wollen einen kitaplatz, wenn sie ihn brauchen. sie wollen, wenn sie einen haben, eine gute qualität in der betreuung ihrer kinder. ja, sie wollen auch nicht, dass ihre verfügbaren einkommen von elternbeiträgen aufgefressen werden. frau giffey, sie sind eine ankündigungsministerin, die zu all ihren ankündigungen nichts in der tasche hat. da nützt es auch nichts, wenn sie die mageren , milliarden euro oder vielleicht auch , milliarden euro das weiß hier offenbar niemand so recht , die vielleicht ab zur verfügung stehen, aufpusten, indem sie von millionen euro reden. das macht nämlich keinen kitaplatz mehr. eltern sowie erzieherinnen und erzieher, die in diesen wochen regelmäßig an vielen orten zu tausenden auf den straßen sind, wollen jetzt lösungen. da liefert die koalition eben nicht. so, jetzt warte ich auf den ersten oberschlauen, der uns gleich erklärt, dass doch bitte die kommunen und länder ihre hausaufgaben machen sollen. herr rainer hat ja schon so angefangen. wissen sie was, die kommunen und die länder sind seit schaffung des rechtsanspruches die einzigen, die ihre hausaufgaben gemacht haben. das land brandenburg, aus dem frau giffey und ich ursprünglich stammen wir sind beide aus ostbrandenburg, das freut mich besonders , hat im haushalt millionen euro für kitas bereitgestellt. ist die linke in die regierung eingetreten. nach zehn jahren regierung im nächsten jahr haben wir wahlen und werden diese regierung verteidigen wird im haushalt die grenze zu millionen euro durchbrochen. aus millionen euro wurden in brandenburg millionen euro für kitas, und zwar nicht nur durch den ausbau von u da waren wir schon immer gut , sondern auch durch verbesserungen der betreuungsqualität durch leitungsfreistellung und durch einen einstieg in die beitragsfreiheit. das sind alles ihre versprechungen, für die vom bund aber nichts geliefert wurde. übrigens wurden auch erzieherinnen zur verbesserung der betreuung neu eingestellt. in thüringen, seit linksregiert, wurden kitagruppen verkleinert und wurde, wie in brandenburg, das letzte kitajahr beitragsfrei gestellt. in thüringen führt das bei einer durchschnittlichen familie zu einer ersparnis von euro im jahr, übrigens sehr viel mehr als durch ihre kindergelderhöhung. auch andere länder haben die qualität verbessert und beitragsfreiheit eingeführt und zusammen mit den kommunen und den eltern nebenbei auch noch den ausbau von kitaplätzen gestemmt, für den sie nicht sehr viel getan haben. der bund hat sich rar gemacht. wir erwarten, dass sie ihren job machen, dass die ankündigungspolitik endet und sie endlich liefern. wir linke sagen auch: wir brauchen ein kitaqualitätsgesetz des bundes. wir brauchen vergleichbare standards, damit es für die menschen völlig egal ist, ob ihre kinder in bayern, in brandenburg, in thüringen oder in berlin in die kita gehen. sie brauchen kitaplätze mit vergleichbaren betreuungsstandards, sowohl was die fachkraft-kind-relation als auch was die betreuungszeiten, die leitungsfreistellung und weiteres mehr angeht. das hat die spd mal versprochen. daraus wurde dann ein qualitätsentwicklungsgesetz. jetzt wollen sie ein gute-kita-gesetz machen. besser geworden sind nur die überschriften. der inhalt ist entkernt worden. ich fordere sie auf, zu ihren ideen zurückzukehren und ein kitaqualitätsgesetz auf den weg zu bringen, und zwar mit bundesweit vergleichbaren standards, und das auch mitzufinanzieren. da haben sie übrigens auch die länder an ihrer seite. vielen dank. nächste rednerin ist katja dörner für bündnis /die grünen."
81,03.07.2018,ID194408100,Katja,Dörner,BÜNDNIS 90/DIE GRÜNEN,Katja Dörner,"sehr geehrter herr präsident! liebe kolleginnen! liebe kollegen! heute ist eine gute gelegenheit, die ministerin einmal zu fragen, wo ihr sogenanntes gute- kita-gesetz überhaupt steckt. es war uns nämlich für vor der sommerpause angekündigt. aber weder im kabinett noch im parlament ward es bis dato gesehen. dieses gesetz sollte die erste große initiative der neuen familienministerin sein, und jetzt zerbröselt es zwischen den ressorts. liebe kolleginnen, liebe kollegen, das ist ein schlechter einstieg für ministerin giffey, und es ist vor allem eine schlechte nachricht für die familien in unserem land, die dringend auf gute kitas angewiesen sind. sehr viele familien warten übrigens nicht nur auf mehr personal in den kitas, auf flexiblere öffnungszeiten oder kleinere gruppen. viele warten schlicht darauf, überhaupt einen platz in einer kita zu bekommen. ich finde es ehrlich gesagt skandalös, dass sich der bund heimlich, still und leise aus seiner verantwortung für den bau und die finanzierung von kitaplätzen stiehlt. in den nächsten jahren fehlen zusätzliche kitaplätze, und es gibt keine zusage des bundes, das investitionsprogramm weiter fortzusetzen. es ist im koalitionsvertrag nicht vorgesehen, es ist in der mittelfristigen finanzplanung nicht vorgesehen, und wenn man die ministerin konkret dazu befragt, verweist sie auf das sogenannte gute-kita-gesetz. schaut man in den gesetzentwurf hinein, sieht man, dass darin gerade der platzausbau ausgeschlossen wird. also ist doch ganz klar: ab ist schluss mit der finanzierung von zusätzlichen kitaplätzen durch den bund. das darf nicht sein; wir stehen da in der pflicht. wir können die kommunen und vor allem die eltern nicht im regen stehen lassen. so geht es einfach nicht, liebe große koalition. im koalitionsvertrag ist auch vorgesehen, einen rechtsanspruch auf ganztagsbetreuung für grundschulkinder im sgb viii zu verankern. wir finden das gut und auch konsequent mit blick auf die vereinbarkeit von familie und beruf. wir werden dafür aber eine finanzvereinbarung und eine gute kooperation zwischen dem bund und den bundesländern brauchen. ich kann ehrlich gesagt verstehen, dass die bundesländer jetzt sehr, sehr skeptisch sind, wenn der bund noch nicht einmal bereit ist, seine schon eingegangenen verpflichtungen tatsächlich zu erfüllen. auch deshalb ist es absolut notwendig, dass es jetzt eine klare zusage gibt, dass sich der bund an der finanzierung von zusätzlichen kitaplätzen beteiligt. liebe kolleginnen, liebe kollegen, es war ja zu erwarten, dass sich die regierungsfraktionen in vorauseilendem gehorsam heute selbst schon einmal für die kindergelderhöhung auf die schulter klopfen. aber so schön die kindergelderhöhung für die familien auch ist: wir werden nicht müde, klarzumachen, dass diese kindergelderhöhung gerade armen familien und auch sehr vielen alleinerziehenden gar nichts nützt, weil jeder cent auf die leistungen, die heute in anspruch genommen werden können, angerechnet wird. wir erwarten, dass die bundesregierung gezielt gegen kinderarmut vorgeht. wir haben zum kinderzuschlag einen konkreten vorschlag unterbreitet und ihn in den haushaltsberatungen auch finanziell untersetzt. die bekämpfung von kinderarmut muss endlich priorität haben. es sind genug sonntagsreden von dieser großen koalition gehalten worden. frau giffey, sie sind ja auch frauenministerin, auch wenn man davon bis dato nicht so viel gemerkt hat. sie sagen gerne: frauen können alles. ich sage: frauen können sich nicht vor ihrem gewalttätigen partner in sicherheit bringen, wenn es nicht ausreichend plätze in frauenhäusern gibt. frauen können sich nicht effektiv gegen entgeltdiskriminierung wehren, wenn wir nicht endlich ein gesetz machen, das auch wirkt. und frauen können sich nicht umfassend über schwangerschaftsabbrüche informieren, wenn ärztinnen kriminalisiert werden. wir hatten letzte woche die anhörung zu § a. ich frage ganz konkret, frau giffey: wo bleiben ihre initiativen auf diesem feld? wir wollen ihre starke stimme für die frauen in diesem land hören. alles andere ist aus unserer sicht indiskutabel. ich bedanke mich für ihre aufmerksamkeit. als nächstes spricht für die fraktion der spd der abgeordnete sönke rix."
