,datum,redeID,vorname,nachname,fraktion,name,inhalt_neu
29,16.01.2020,ID1914002900,Gesine,Lötzsch,DIE LINKE,Gesine Lötzsch,"vielen dank. herr präsident! meine sehr geehrten damen und herren! wir als linke fordern mehr transparenz von der bundesregierung. wir wollen endlich konkrete angaben zur steuerhinterziehung der vermögenden. wir wollen wissen, wie es um die maßlose verschwendung bei der bundeswehr bestellt ist. und wir wollen auskunft darüber, wie der verfassungsschutz illegal geld dafür ausgegeben hat, rechtsterroristische gruppen zu unterstützen. da stoßen wir auf eine mauer des schweigens. das nehmen wir nicht hin, meine damen und herren. ich glaube, die öffentlichkeit sollte wissen, was die bundesregierung nun selbst zu den sogenannten flüchtlingskosten rechnet: die weltweiten auslandseinsätze der bundeswehr mit personalausgaben, verwaltungsausgaben, erhaltung von wehrmaterial, militärische beschaffung. wie absurd ist das denn! selbst der titel trennungsgeld, fahrtkostenzuschüsse sowie umzugskostenvergütungen fließt in die berechnung der sogenannten flüchtlingskosten mit ein. das kannste dir nicht vorstellen , sagt man bei uns in berlin. ich finde das wirklich absurd. damit lenkt man nämlich die hetze und den hass der menschen auf die geflüchteten, und das darf nicht sein, meine damen und herren. ich sage auch ganz deutlich: die bundeswehr bekämpft in afghanistan keine fluchtursachen. sie ist mit dafür verantwortlich, dass menschen aus afghanistan nach deutschland flüchten. deshalb fordern wir den sofortigen rückzug der bundeswehr aus afghanistan, meine damen und herren. in diesen von der bundesregierung selbst so bezeichneten flüchtlingskosten sind also , milliarden euro für verdeckte kriegsführung eingeplant, und das ist der größte posten unter den öffentlich so genannten flüchtlingskosten. ich finde, kosten für auslandseinsätze dürfen da nicht eingerechnet werden. das verhetzt die bevölkerung in unserem land, und dem stellen wir uns entgegen. ich kann nur sagen: wenn die antragstellende fraktion die flüchtlingskosten drastisch senken will, dann muss sie im bundestag nur konsequent gegen jeden kriegseinsatz der bundeswehr stimmen. das wäre der richtige weg. meine damen und herren, das problem ist nun ich will das noch einmal ganz deutlich sagen , dass die bundesregierung selbst völlig überhöhte flüchtlingskosten veröffentlicht. das ist ein spiel mit dem feuer; denn menschen mit geringem einkommen fragen sich, warum die bundesregierung kein geld für armutsfeste renten, für alleinerziehende mütter und für preiswerte wohnungen bereitstellt, aber geld für geflüchtete.darum fordern wir als linke ehrliche zahlen; denn mit den manipulierten zahlen wird die konkurrenz unter den armen menschen verstärkt. die menschen sollen nicht sehen, dass die bundesregierung die vermögenden in unserem land bevorzugt. wir sagen: mit diesen falschen zahlen wird der soziale friede zerstört und werden die rechtsextremen, wie wir das gerade gesehen und gehört haben, gestärkt. dem muss ein ende gesetzt werden.vielen dank. vielen dank, frau kollegin lötzsch. als nächste rednerin hat die kollegin luise amtsberg, bündnis /die grünen, das wort."
30,16.01.2020,ID1914003000,Luise,Amtsberg,BÜNDNIS 90/DIE GRÜNEN,Luise Amtsberg,"herr präsident! liebe kolleginnen und kollegen! als wenn es denen tatsächlich ums geld ginge! als wenn die intention dieses antrages tatsächlich von der sorge um die richtige verwendung von steuergeldern getragen würde! natürlich nicht. nein, ihnen von der afd geht es nicht ums geld, ihr antrag hat eine politische intention. sie wollen dafür hätten sie keine acht seiten gebraucht doch eigentlich nur sagen: wir wollen keine zuwanderung, wir wollen keine flüchtlinge aufnehmen in diesem land. das kostenargument ist vorgeschoben. in dem antrag nennt die afd zum teil ja selbst die zahlen, nach denen sie fragt. sie zitieren selbst die quellen, in denen steht, was der bund zahlt. auch die landeshaushalte weisen die unmittelbaren kosten aus. sie brauchen eigentlich nur nachzulesen. das würde aber das muss man erwähnen natürlich nicht zu ihrer erzählung passen: der staat vertuscht hier doch irgendwas! , die bundesregierung will doch gar nicht, dass der bürger die echten zahlen kennt! im übrigen wir kennen diese methode, sie ist nicht neu : das hat alice weidel schon in bezug auf den eu-haushalt versucht; aber das nur am rande.liebe kolleginnen und kollegen, worum es in dem antrag eigentlich geht, sind die von der afd so getauften indirekten kosten der migrationspolitik. die neue erzählung der afd: die indirekten kosten. darunter sollen zum beispiel auch die kosten für die abfallwirtschaft fallen. im ernst jetzt? wollen sie künftig dann auch, dass die kosten für die sanierung öffentlicher gebäude, in die auch geflüchtete gehen, anteilig angerechnet werden, oder die für die sanierung von gehwegen, weil auch diese von geflüchteten menschen benutzt werden? das kann ja wohl nicht ihr ernst sein. ich werde noch konkret, da machen sie sich mal keine sorgen. als indirekte kosten führt die afd übrigens auch projekte an, die die akzeptanz der migration erhöhen sollen.da wir über kosten, über finanzen reden, fällt mir hier eine ganz konkrete einsparmöglichkeit ein, nämlich wenn sie aufhören würden, den ganzen tag stimmung gegen geflüchtete menschen zu machen. kosten für demokratieprojekte sind nämlich kosten, die sie mit ihrer politik doch nur in die höhe treiben. und was ist eigentlich mit den kosten, die durch forderungen in ihrem antrag entstehen, für die hunderten von stellen und tausenden arbeitsstunden zur erhebung von daten, die zum teil gar nicht messbar sind? wissen sie, keiner hält sie davon ab, inhaltlich zu kritisieren, wenn sie finden, dass in der asylpolitik geld falsch ausgegeben wird oder falsche prioritäten gesetzt werden. wir machen das auch, zum beispiel in bezug auf anker-zentren, darauf, dass es zu wenig sprachkurse gibt, dass chancen verspielt werden arbeitsverbote, fehlender spurwechsel , oder wenn kosten entstehen, die nicht notwendig sind, zum beispiel bei den verwaltungsgerichten aufgrund schlechter bamf-bescheide. meine liste ist lang! aber die mühe machen sie sich gar nicht; denn sie kritisieren und das ist das wichtige einen politischen grundsatz. die aufnahme von geflüchteten lehnen sie kategorisch ab. die historische verantwortung dieses landes hin oder her: sie lehnen das ab. und mit diesem antrag versuchen sie, anhand von kosten zu argumentieren, um das zu verwässern. ich finde es aber eigentlich gar nicht so schlecht, dass wir mal über kosten reden; denn das gibt mir die möglichkeit, zu ihrer politik zwei dinge zu sagen. erstens. keine flüchtlings- und integrationspolitik ist teurer als die der afd. zweitens. es ist offensichtlich, dass sie auf bestimmte probleme in dieser gesellschaft überhaupt keine antworten haben. rechnen sie den menschen doch mal vor, was passiert, wenn ihre forderung nach geschlossenen deutschen grenzen wirklichkeit wird, wenn wir nicht mehr teil des eu-binnenmarktes sind, was das für unser land wirtschaftlich bedeutet. wenn es nach ihnen ginge, wären diese sogenannten indirekten kosten noch viel, viel höher. sie sind es doch, die geflüchteten jede gesellschaftliche beteiligung und integration versagen, diesen menschen und unserem land die chancen versagen, die damit einhergehen, denen restriktionen wie arbeitsverbote nicht weit genug gehen, denen die aufwendungen für sprachkurse zu hoch sind. sie sind es, die geflüchteten menschen absprechen, überhaupt echte gründe zu haben, hier zu sein; das wird in ihrem antrag doch total klar.die größte unverschämtheit aber ist, dass sämtliche antworten auf drängende fragen ausbleiben. sie meckern, und sie reden dieses land schlecht; das tun sie den ganzen tag. ich weiß, dass sie von der afd meine generation und jünger nicht wirklich interessiert; das habe ich schon gelernt. deshalb helfe ich ihnen jetzt gern mal auf die sprünge: die direkten auswirkungen ihrer isolationistischen politik würden doch vor allem die jüngeren in diesem lande zu spüren bekommen. deshalb: haben sie verdammt noch mal den hintern in der hose, dann auch auszubuchstabieren, was ihre antworten sind und bedeuten. sie lehnen zuwanderung ab. was ist denn ihre antwort auf den demografischen wandel, auf die fortschreitende überalterung unserer gesellschaft, auf den mangel an fach- und hilfskräften? sorry, aber das ist genau das, was die jüngeren menschen in diesem land interessiert; denn für sie ist es existenziell. sie zielen in ihrem gesamten antrag das finde ich auch interessant sehr auf ballungsräume ab; er ist komplett fokussiert auf die wachsenden städte. sie vergessen den ländlichen raum komplett. es gibt gegenden in deutschland, denen es nicht gut geht. da gibt es nicht nur keine flüchtlinge, sondern da ziehen auch alle anderen, gerade die jungen und insbesondere junge frauen, weg. geschäfte schließen, die soziale infrastruktur geht verloren, und zurück bleibt große frustration. ich verstehe das. zuwanderung ist in diesen gebieten keine frage des wollens, sondern sie ist eine notwendigkeit und eine chance. gute politik, die alle mitdenkt, würde das erkennen. mal abseits davon und damit ende ich dann auch : ihr antrag trieft ja nur so von verwertungslogik. ich finde, es ist, ehrlich gesagt, nicht mit geld aufzuwiegen, menschen vor dem tod im krieg zu retten. aber das nur als abschließender impuls; vielleicht kommt er ja an.vielen dank. vielen dank, frau kollegin amtsberg. nächster redner ist für die cdu/csu-fraktion der kollege alexander throm."
31,16.01.2020,ID1914003100,Alexander,Throm,CDU/CSU,Alexander Throm,"sehr geehrter herr präsident! werte kolleginnen und kollegen! um was geht es der afd eigentlich? nach außen hin um zahlen, um angebliche transparenz. aber in der tat geht es ihnen doch eigentlich nur darum, den keil noch ein bisschen tiefer in unsere gesellschaft hineinzuklopfen, die einen, die inländer, gegen die anderen, die ausländer, auszuspielen und damit ihr politisches spiel zu betreiben. in der tat: sie brauchen derartige anträge, und sie brauchen diese spaltung in der gesellschaft für ihr politikmodell. herr kollege, erlauben sie eine zwischenfrage aus der afd-fraktion? nein. jetzt lassen sie mich doch erst mal ein bisschen ausführen, und dann können wir darauf gerne zu einem späteren zeitpunkt zurückkommen. der antrag spricht ausschließlich von den lasten der migration, nicht aber vom möglichen nutzen, den die migration durchaus auch hat. und sie schreiben nicht nur von den kosten der flüchtlingspolitik, sondern sie schreiben ausdrücklich auch von den finanziellen lasten der migrationspolitik. diese umfasst aber deutlich mehr als nur die bereiche asyl und flucht, wie wir sie in den letzten jahren erlebt haben. deswegen sollten wir etwas differenzierter an die sache herangehen, ohne die scheuklappen, die sie ganz offensichtlich aufgesetzt haben.migration ist nämlich in erster linie arbeitsmigration. diese haben wir in den -jahren mit den sogenannten gastarbeitern von uns aus, von deutschland aus initiiert. in den letzten jahren sind allein über , millionen eu-ausländer nach deutschland gekommen und tragen hier mit ihrer arbeit zur sicherung und stärkung unseres wirtschaftsstandorts bei.egal auf welche branche wir momentan schauen, wir hören immer vom fachkräftemangel. deswegen haben wir letztes jahr das fachkräfteeinwanderungsgesetz beschlossen. auch das trägt zum nutzen und zur stärkung unserer wirtschaft bei; denn nur, wenn wir entsprechende fachkräfte in deutschland haben, wenn wir eine gewisse arbeitsmigration haben, auch im nicht ganz hochqualifizierten bereich, können wir den wohlstand für zukünftige generationen sichern. dann kommen die menschen, die wir brauchen, und nicht nur die menschen, die uns brauchen. also, wir sollten das durchaus differenzierter betrachten.sie haben natürlich ihre klientel im blick, deren vorurteile sie mit ihrem antrag bedienen. sie sagen: den deutschen wird etwas genommen, weil sehr viele flüchtlinge gekommen sind. das ist ein sehr durchschaubares spiel. ja, natürlich hat migration auch lasten zur folge. das sind aber keineswegs lasten, die ausschließlich durch die flüchtlinge, die kommen, schutzberechtigt oder nicht, entstehen; vielmehr werden integrationskurse, sprachkurse und vieles andere auch für menschen aus den eu-staaten angeboten, genauso für reguläre arbeitsmigranten oder spätaussiedler. insofern lässt es sich nicht eins zu eins aufrechnen.dann gibt es diejenigen, die zu uns kommen, weil sie verfolgt werden, weil sie aus einem kriegsland kommen, weil sie schutz brauchen, schutz suchen. man kann, glaube ich, nicht alles in euro und cent ausrechnen, nicht überall eine bilanz ziehen und den volkswirtschaftlichen nutzen herausrechnen; vielmehr ist eines gefragt, was ihnen offensichtlich komplett abgeht, und das ist humanität. ich glaube, wir, die übrigen fraktionen hier im parlament, haben diese humanität, wenn auch in unterschiedlichen ausprägungen, was detailfragen betrifft. aber wir sind uns im grundsatz einig, dass wir denjenigen, die schutz brauchen, diesen auch gewähren, ja, auch dann, wenn er für unseren staat lasten und kosten verursacht. viele derer, die in den letzten jahren gekommen sind das ist angesprochen worden , tragen inzwischen durch ihre arbeit zum volkswirtschaftlichen nutzen bei. junge menschen aus den hauptherkunftsländern der asylbewerber machen eine ausbildung. rund schutzberechtigte gehen einer sozialversicherungspflichtigen arbeit nach. das ist mehr, als wir erwartet haben, aber das sage ich ganz offen noch nicht so viel, dass wir uns aufs ruhekissen legen können. es gibt noch knapp menschen, die erwerbsfähig sind, die als flüchtlinge anerkannt sind, aber im sgb-ii-system leben. da müssen wir durchaus mehr machen. diese müssen wir motivieren; wir müssen sie besser an die arbeit heranführen, etwa auch, indem wir für diesen personenkreis in einem gewissen umfang verpflichtende praktische einheiten einführen, wie es beispielsweise in ähnlicher form in schweden und anderswo auch schon gemacht wird.ich würde mir von ihnen konstruktive vorschläge wünschen und nicht eine solche debatte, die sie hier heute vom zaun brechen, einfach nur, um den zwiespalt in unserer gesellschaft noch mehr zu schüren. konstruktive vorschläge sind von ihnen nicht zu erwarten. alles, was sie hier schreiben, beantragen, aber und auch ausgeführt haben, ist ohne weiteren erkenntniswert. deswegen werden wir ihren antrag ablehnen. herzlichen dank. nächster redner ist für die fdp-fraktion der kollege christoph meyer."
32,16.01.2020,ID1914003200,Christoph,Meyer,FDP,Christoph Meyer,"herr präsident! meine damen und herren! wenn man ihren antrag zu ende liest, dann stellt man sehr schnell fest, dass er von fehlern, falschdarstellungen und falschen behauptungen nur so trieft und strotzt. ich möchte das, herr curio, an einem beispiel festmachen. sie sind abgeordneter aus berlin. sie sind noch nicht mal in der lage, in diesen antrag hineinzuschreiben, dass der viel diskutierte mietendeckel, der vom rot-rot-grünen senat eingeführt werden soll, nicht zum . januar in kraft getreten ist, sondern erst später in kraft tritt. ich glaube, das ist sehr bezeichnend. wenn man sich die einzelnen themenfelder, die die kollegen hier schon angesprochen haben, anschaut, wird man, wenn man fachleute aus den jeweiligen fachgebieten hier im haus befragt, bei jedem einzelnen thema sehr schnell fehler und falschdarstellungen identifizieren. das einzige ziel von ihnen ist das wurde bereits häufiger gesagt , weiter angst zu schüren. das werden wir ihnen nicht durchgehen lassen. ich bin herrn rehberg sehr dankbar dafür, dass er zum einen sehr deutlich formuliert hat, dass die zahlen vorliegen, und zum anderen, was sie mit diesem antrag tatsächlich bezwecken. wenn man sich die diktion anschaut hart arbeitende deutsche bürger, keine gegenrechnung von migrationserfolgen , stellt man fest: überall da, wo sie selbst nicht genau wissen, wie ihre behauptungen mit zahlen unterlegt werden, kommen sie mit gutachteraufträgen daher, mithilfe derer sie ein zahlenwerk definieren wollen. das ist für einen haushälter es haben hier sehr viele innenpolitiker gesprochen dann doch ein bisschen viel. wir haben zwar durchaus das gefühl, dass wir an der einen oder anderen stelle etwas mehr transparenz im zahlenwerk benötigen, aber sicherlich nicht so.wir müssen darüber reden, dass der kontrollverlust, der uns im jahr alle bewegt hat, so nicht mehr stattfindet; aber das bedeutet nicht, dass wir im jahr so einen antrag ernsthaft beraten können, dessen mehrwert gleich null ist. deswegen werden wir diesen antrag ablehnen.wesentlich wichtiger wäre, dass wir uns über die flüchtlingsreserve oder ‑rücklage unterhalten und darüber reden, dass die schatztruhe von rot-schwarz oder schwarz-rot im nächsten jahr wieder praller gefüllt ist, als ursprünglich gedacht, und was damit gemacht werden soll. das wäre konstruktive arbeit; aber dazu sind sie ja offensichtlich nicht in der lage. deswegen werden wir diesen antrag ablehnen. vielen dank. nächster redner ist für die spd der kollege professor dr. lars castellucci."
33,16.01.2020,ID1914003300,Lars,Castellucci,SPD,Lars Castellucci,"vielen dank. herr präsident! meine sehr verehrten damen und herren! liebe kolleginnen und kollegen! migration ist erst mal ein ziemlich normaler vorgang. das kann man an dem antrag der afd auch erkennen; denn er wurde unter anderem eingebracht von petr bystron, geboren in der tschechoslowakei, und frau cotar und herrn frohnmaier, geboren in rumänien. aber er kostet uns etwas, zum beispiel kostet er uns hier gerade lebenszeit wegen der immer gleichen, absurden und menschenverachtenden anträge, die sie hier einbringen. dann gibt es noch andere personen: frau petry, herrn mieruch und zuletzt auch herrn herrmann. sie sind weitergewandert. sie können also nicht mal sekundärmigration in ihrer eigenen fraktion aufhalten. das zeigt: ja, menschen suchen ein besseres leben, und der erste schritt zu einem besseren leben ist ein leben ohne die afd. jetzt kommen wir zum ernst der sache. dieser ernst kommt in einer zahl zum ausdruck: die durchschnittliche geburtenrate in europa liegt bei , . das zeigt, wir sind in ganz europa auf einwanderung angewiesen. wenn unser kontinent vor sich hin schrumpft und altert, werden wir unseren wohlstand nicht halten können, dann ist die pflege, dann sind die sozialversicherungen der künftigen generationen nicht gesichert. deutschland und europa brauchen einwanderung. das ist die wahrheit. es kommt einzig und allein darauf an, dass wir sie gerecht und gut gestalten.herr curio, sie betreiben hier nicht nur hetze, sondern sie verbreiten auch die unwahrheit. das hamburger modell ist geradezu vorbildlich; denn hier werden nicht menschen mit geringem einkommen und geflüchtete gegeneinandergestellt, sondern alle haben den gleichen anspruch auf mobilität, mit dem unterschied, dass die geflüchteten das von ihrem taschengeld zwangsweise abgezogen bekommen. ich halte das hamburger modell für ein gutes modell. sie sollten sich besser informieren, bevor sie hier falschbehauptungen verbreiten. wir sind auf migration angewiesen, aber die flüchtlinge … , könnte man sagen. ich bin sehr dankbar, dass folgendes von meinen vorrednern schon herausgearbeitet worden ist. ich bin so erzogen: wenn jemand hilfe braucht und du kannst helfen, dann hilf. ich bin stolz und froh, dass unser land helfen kann, in den letzten jahren viel geholfen hat und das noch weiter tun wird. ich bin der bevölkerung dankbar, die das unterstützt.gleichzeitig können wir auf erfolge zurückblicken, dass von den menschen, die zu uns gekommen sind, schon auf dem arbeitsmarkt erfolgreich sein können, zu fast prozent in sozialversicherungspflichtiger beschäftigung. das zeigt: die geschichten können mit krieg, mit leid beginnen, aber wir haben miteinander die chance, dass wir sie zum besseren gestalten können. das ist unser anspruch. daran arbeiten wird. dafür bitte ich das ganze haus um unterstützung.vielen dank. vielen dank, herr kollege. nächste rednerin ist für die fraktion die linke die kollegin gökay akbulut."
34,16.01.2020,ID1914003400,Gökay,Akbulut,DIE LINKE,Gökay Akbulut,"sehr geehrter herr präsident! liebe kolleginnen und kollegen! der antrag der afd über die sogenannten finanziellen lasten der migrationspolitik ist wie alle anderen papierkorbanträge der afd fachlich falsch und reine rechtspopulistische hetze, die wir uns hier immer wieder anhören müssen. sie kreieren mit ihrer hysterie falsche bilder und wollen den leuten damit angst machen. ich selber betreue zahlreiche einzelfälle. eine frau hat sich vor kurzem bei mir gemeldet, die wir seit längerer zeit betreuen. maryam kommt aus syrien und hat einen großen teil ihrer familie während des krieges verloren. maryam ist eine von denen, die fliehen mussten, die sie jetzt hier als finanzielle last abstempeln wollen. es ist der reinste hohn gegenüber maryam, ihrer verstorbenen familie und allen menschen, die aus kriegsgebieten fliehen, dass sie so über sie herziehen. das ist schlichtweg eine schande. maryam steht kurz davor, ihr studium zu beenden, und wird anschließend anfangen, zu arbeiten. im gegensatz zur afd ist sie eine bereicherung für unsere gesellschaft. wir als linksfraktion stehen an der seite derer, die aus kriegsgebieten fliehen und unterstützung und hilfe brauchen. sie sprechen von einer verschleierung der kosten und fordern eine offenlegung der daten. die kosten sind weitestgehend zugänglich, wie auch hier erklärt worden ist. deutschland hat die aufnahme und versorgung von flüchtlingen mit einer schwarzen null im haushalt bewältigt. die migrantische bevölkerung in deutschland arbeitet und leistet ihren beitrag zur finanzierung des steuer- und rentensystems. wenn sie in ihrem antrag von harter arbeit sprechen, dann muss man sagen: es sind in erster linie flüchtlinge, migranten und migrantinnen, die im niedriglohnsektor unter schwierigsten bedingungen arbeiten. wer arbeitet denn im baugewerbe, in der gastronomie oder im reinigungsgewerbe in deutschland? wer putzt den bundestag? das können sie sich morgens hier anschauen. es ist genau dieser rechtspopulistische diskurs, der hier von ihnen geschürt wird, der mitverantwortlich ist für die restriktionen im bereich asyl- und migrationspolitik der bundesregierung der letzten jahre. das muss sich ändern. wenn man von kosten spricht, darf man auch die kosten der abschreckung nicht vergessen. die abschreckungspolitik der bundesregierung kommt den steuerzahlerinnen und steuerzahlern teuer zu stehen. die unterbringung in anker-zentren und anderen lagern kostet beispielsweise ein vielfaches mehr als eine dezentrale und integrationsfördernde unterbringung in wohnungen. meine damen und herren, wenn wir wirklich über verschleierung von kosten sprechen, dann müssen wir auch über die afd sprechen. ihre parteispitze hat vor wenigen tagen ein gerichtsverfahren verloren, bei dem es um ihre illegalen parteispenden ging. sie stellen sich hier ernsthaft hin, fordern offenlegung, und gleichzeitig weiß ihre eigene parteispitze nicht, wo plötzlich bei herrn meuthen zum beispiel euro herkommen, und sie erzählen: es gab damals keine professionelle organisation. frau kollegin, kommen sie zum schluss. sie gönnen den anderen menschen nichts, nicht einmal den familiennachzug zu ihren angehörigen, und wollen rechtfertigen, dass in ihrem laden freundschaftsdienste von euro okay sind. sie sind schlichtweg verlogen und einfach menschenfeindlich.vielen dank. als nächster redner hat das wort für die cdu/csu-fraktion der kollege florian oßner."
