,datum,redeID,vorname,nachname,fraktion,name,inhalt_neu
73,04.03.2021,ID1921507300,Frank,Schwabe,SPD,Frank Schwabe,"herr präsident! verehrte damen und herren! min aung hlaing, soe win, myint swe, sein win, soe htut, ye aung, mya tun oo, tin aung san, ye win oo und aung lin dwe. man könnte auf die idee kommen, die namen der opfer der ermordeten der letzten tage und stunden hier vorzutragen. das sind sie in dem falle aber nicht, sondern es sind die namen der täterinnen und täter. aber das ist auch wichtig, damit man sich die namen merkt und schaut, wie man damit international umgehen kann. die usa haben sie bereits auf eine sanktionsliste gesetzt. es sind dieselben vertreterinnen und vertreter der militärs, die übrigens in den haag schon vor dem internationalen strafgerichtshof stehen. ich will noch mal sagen: ich glaube, man kann nicht opfer gegen opfer aufrechnen. aber es ist schon infam, herr braun, wenn sie hier die argumentationsmuster genau der militärs übernehmen, die von bengalen reden, die eigentlich gar nicht zu myanmar gehören würden, wenn sie über die rohingya reden und genau diese argumentationsmuster übernehmen, die die grundlage und der hintergrund des völkermordes, des genozids, sind, der an tausenden menschen verübt wird. hunderttausende sind vertrieben worden. das sollten sie bei aller politischen auseinandersetzung wirklich unterlassen. der völkermord an den rohingya ist dramatisch und schlimm. deswegen ist es richtig, dass der deutsche bundestag diesen verurteilt. es sind dieselben militärs, die diesen völkermord verantworten und die jetzt auf unschuldige menschen schießen lassen, sie gezielt erschießen lassen. sie sind verantwortlich und müssen dafür zur verantwortung gezogen werden. die lage und entwicklung myanmars ist wirklich ein internationales drama. myanmar hat mehr aufmerksamkeit bekommen als viele andere länder der welt. das hat sicherlich etwas zu tun mit dem charisma von aung san suu kyi. es hat sich am ende leider das bewahrheitet, was sie befürchtet hat. sie hat befürchtet, dass am ende die militärs wieder putschen werden. sie hat sich wahrscheinlich auch deswegen in der frage der rohingyas zurückgehalten. man könnte es aber auch andersherum sagen: das, was sie versucht hat, nämlich einen völkermord nicht völkermord zu nennen, hat sich am ende für sie nicht ausgezahlt. es hat trotzdem am ende diesen putsch gegeben. es hat sich auch nicht ausgezahlt so viel kritische betrachtung muss schon sein , dass sie es versäumt hat, ihre partei, die nationale liga, entsprechend neu aufzustellen. auch ich war in myanmar und habe vertreterinnen und vertreter dieser nationalen liga getroffen. es war eine riege alter männer. die partei hat es leider nicht geschafft, das, was wir jetzt auf den straßen an jungen menschen, an zukunftshoffnung, an zukunftsperspektiven sehen können, mit in diesen demokratischen prozess einzubringen. am ende sind auch die vertreter der rohingyas, die früher in dieser partei an führender stelle waren, zum teil als stellvertretende parteivorsitzende, ausgeschlossen worden. das hat zu großen enttäuschungseffekten geführt. jetzt haben wir aber die situation, dass eine demokratisch legitimierte führung des landes geputscht wurde und dass junge menschen dagegen aufbegehren, eine zivilgesellschaft, wie man sich das, glaube ich, nicht hätte vorstellen können, wie sich das auch die militärs nicht hätten vorstellen können. das macht große hoffnung. es stimmt tieftraurig, zu sehen, wie tagtäglich menschen ermordet werden. was können wir tun? wir tun das ja in großer einigkeit, glaube ich. wir müssen die dinge auf den tisch legen und die fragen diskutieren, um deutlich zu machen: niemand kommt ungenannt davon. wir müssen alles tun, um aung san suu kyi, ihre partei und die demokratisch legitimierte regierung zu unterstützen, dass sie wieder ins amt kommt. wir müssen verurteilen, dass diese gewalt gerade stattfindet, und fordern, dass politische gefangene freigelassen werden, dass die verfolgung eingestellt wird. und wir müssen den eu-sanktionsmechanismus nutzen, den wir dankenswerterweise mittlerweile haben, auch in abstimmung mit den vereinigten staaten von amerika, die zum glück zurück sind auf der weltbühne. wir dürfen solche verbrechen nicht decken, sondern müssen sie entsprechend anprangern. und wir müssen auch gemeinsam alles tun, um das verfahren vor dem internationalen strafgerichtshof voranzutreiben. noch mal: man trifft sozusagen immer die richtigen. es sind dieselben, die den völkermord an den rohingya begehen und die gerade unschuldige menschen erschießen lassen. lassen sie uns hoffen, dass mit dem internationalen protest, aber vor allem mit dem engagement der jungen menschen im land, die demokratie in myanmar schnell zurückkehrt. vielen dank. der letzte redner in der aktuellen stunde ist der abgeordnete martin patzelt, cdu/csu-fraktion. bitte schön."
74,04.03.2021,ID1921507400,Martin,Patzelt,CDU/CSU,Martin Patzelt,"danke schön. herr präsident! herr minister! meine damen und herren! liebe kolleginnen und kollegen! wir haben eine stunde lang mit betroffenheit die geschehnisse in myanmar geschildert und aufgenommen. wir haben sie mit empathie aufgenommen. wir haben danach gefragt: wie ist das zu beurteilen? und wir haben zusammen versucht, die frage zu beantworten: was können wir eigentlich tun? mich persönlich überfällt immer das wird manchem in diesem haus so gehen eine große ohnmacht: eine aktuelle stunde, wie schon öfters bei solchen gelegenheiten, und dann war es das wieder und wir gehen zu unseren tagesgeschäften über. was sollen wir auch tun? wie können wir dieses leid, die gewalt, das morden, die herrschaftssucht von führenden personen der weltgeschichte wirklich begrenzen? als mitglied des menschenrechtsausschusses überfällt mich diese ohnmacht immer wieder. wir hören sitzungswoche für sitzungswoche vom elend aus allen teilen der welt und wissen dann doch nicht so richtig, was wir machen können. herr braun, ich möchte ihnen und auch herrn mieruch entgegentreten. es ist nicht so, dass die deutsche regierung oder die deutschen parlamentarier nichts getan hätten. allein das schreiben unseres bundestagspräsidenten an den sprecher des parlaments macht deutlich, dass enge beziehungen gewachsen waren, dass wir im austausch standen. es wurde erwähnt, dass die bundeskanzlerin gleich zu beginn der präsidentschaft von aung san suu kyi die kontakte gesucht hat. in der entwicklungszusammenarbeit haben wir zusammengearbeitet. es ist einfach nicht wahr, wenn man das so sagt. ich denke an die vielen briefe und kontakte, die wir als menschenrechtler geknüpft haben. aber, frau dağdelen, wer kann denn wirklich ermessen, welche drahtseilwanderung es ist, die die präsidentin mit dieser verfassung und den erbschaften angetreten hat: mit einem hochgradigen nationalismus im land, mit einem hass auf die rohingyas? wir kennen ja die aktionen gegen flüchtlinge, gegen fremde in unserem land. diese präsidentin, von der wir so beeindruckt waren, weil sie den friedensnobelpreis bekommen hat, stand in der kritik, weil sie versucht hat, auf diesem drahtseil weiterzugehen. das ist gerissen. das ist gerissen, weil die militärs es nicht mehr ertragen konnten, dass die entwicklung vielleicht in eine demokratische richtung geht, die sie so nicht wollen, vielleicht nicht nur, weil ihre pfründe weniger werden, sondern weil sie auch dem alten weltbild und da sind wir ganz nah auch bei unserem land verhaftet sind und nicht verstehen, dass eine multikulturelle gesellschaft wie myanmar mit der vielvölkersituation gerade ein vorbild sein könnte, dass diese multikulturelle situation die zukunft der welt ist. anders können wir nicht friedlich und gerecht zusammenleben. ich würde mir wünschen, liebe kolleginnen und kollegen, dass wir menschenrechtler in diesem parlament eine stärkere stimme bekommen. ich empfinde uns immer als ein anhängsel. ja, wir tun etwas, vielleicht sind wir auch das feigenblatt des parlaments, vielleicht sind wir in einzelfällen dann auch mal erfolgreich. aber eigentlich müsste unsere regierung mit uns intensiver zusammenarbeiten. eigentlich müssten die anderen ausschüsse intensiver mit uns zusammenarbeiten, sozusagen als gütekontrolleur: ob das, was wir in unserer politik und den einzelnen bestrebungen machen, tatsächlich unseren menschenrechtlichen vorstellungen entspricht. denn im abgleich zwischen wirtschaftlichen und diplomatischen interessen erlebe ich immer wieder, dass menschenrechtliche interessen ganz zurücktreten. das will ich keinem vorwerfen; die sind ja auch wichtig. aber wenn wir uns so schmücken und wenn wir eine solche aktuelle stunde haben, dann müsste uns das mehr beeindrucken und wir müssten sagen: wir wollen uns dieser selbstkontrolle auch unterwerfen. warum? weil natürlich alle menschen und vor allem die jungen menschen in der welt uns zum vorbild nehmen. sie wollen frei leben. sie wollen wirtschaftlich erfolgreich leben. sie wollen in einem allgemeinen wohlstand leben, wie wir es tun. und sie schauen, wie wir miteinander umgehen und woher unser wohlstand und unsere freiheit resultieren. ich kann ihnen nur wünschen, dass das wasser, von dem sie sprechen, überall hinrinnen wird, dass es auch die harten strukturen und die harten menschen erreichen und erweichen wird. denn ich will das mal ein bisschen relativieren von insidern höre ich, dass es gar nicht so eindeutig ist, dass zwar die mehrheit, insbesondere junge menschen, aufseiten der präsidentin steht, aber es auch eine große gruppe von nationalisten und menschen, die totalitären regimen anhängen, gibt, die dem militär sehr wohl die stange halten und die jetzt als bürgermilizen durch die straßen gehen und die bürger kontrollieren, die die ermächtigung dazu haben, ihnen die handys wegzunehmen, sie zu verhaften, sie in die gefängnisse zu bringen. im land selber und nicht nur in der generalität herrscht also eine stimmung, die vielleicht sogar zum bürgerkrieg führen könnte. darauf müssen wir achten. was können wir tun? neben dem, was hier schon gesagt wurde, will ich nur noch eins anmahnen. ich habe es nämlich öfter erlebt, wie schwer es ist, ein visum für menschen, die auf der flucht sind, zu bekommen. einer meiner vorredner ich glaube, herr schwabe hat das gesagt: wir müssen diesen menschen asyl bieten, und zwar ohne große schwierigkeiten. immer wieder erleben wir, wie schwer es ist, aus solchen situationen heraus in deutschland eine zuflucht zu finden. ich denke an die botschaft in prag, als sich die ddr aufgelöst hat. wie viele menschen wurden dort aufgenommen! so schlimm muss es nicht kommen. aber ich habe bei meinen reisen in vietnam und auf die philippinen auch erlebt, wie schwer sich unsere botschaften tun, herr kollege, auch der letzte redner hat nur fünf minuten. letzter satz, bitte. ja hilfesuchenden menschen auch konkret hilfe zu geben. das will ich nur mitgeben. und dann will ich noch herr präsident, wenn sie gestatten das patenschaftsprogramm parlamentarier schützen parlamentarier erwähnen. es ist immer schwer, parlamentarier dafür zu finden. wir haben viel mehr parlamentarier, die schutz suchen, als kolleginnen und kollegen, die ihnen helfen wollen. danke."
75,04.03.2021,ID1921507500,Sarah,Ryglewski,,Sarah Ryglewski,"herr präsident! liebe kolleginnen und kollegen! meine sehr verehrten damen und herren! der fall wirecard hat gezeigt, dass das bisherige system der bilanzkontrolle börsennotierter unternehmen und deren abschlussprüfung in deutschland verbessert werden muss. mit dem aktionsplan zur bekämpfung von bilanzbetrug und zur stärkung der kontrolle über kapital- und finanzmärkte hat bundesminister olaf scholz schon im oktober deutlich gemacht, dass wir entschlossen und schnell konsequenzen aus dem fall wirecard ziehen wollen. der im dezember vorgelegte entwurf für ein gesetz zur stärkung der finanzmarktintegrität, den wir hier heute beraten, ist ein wesentlicher schritt, damit sich der fall wirecard nicht wiederholt. worum geht es konkret? erstens. wir brauchen eine neuaufstellung der bilanzkontrolle. die erfahrung mit wirecard hat gezeigt: die bilanzkontrolle muss insgesamt schneller, transparenter und auch effektiver werden. wo anhaltspunkte für unregelmäßigkeiten bestehen, müssen wir sofort hoheitlich tätig werden können, und wir müssen auch die prozesse deutlich beschleunigen. anlass- und verdachtsprüfungen sollen daher grundsätzlich in die alleinige zuständigkeit der bafin fallen. wir wollen die durchgriffsrechte der bafin insgesamt stärken, sodass sie auch in der bilanzkontrolle forensisch ermitteln kann. zweiter punkt. die abschlussprüferinnen und abschlussprüfer tragen in dem system der kontrolle eine hohe verantwortung. dieser das möchte ich ausdrücklich betonen werden sie in der absoluten mehrheit auch gerecht. dass sie dieser hohen verantwortung gerecht werden, ist in unserem aufsichtsregime aber auch zwingend notwendig. alle marktakteure bis hin zum kleinanleger müssen sich auf die geprüften jahres- und konzernabschlüsse verlassen können. dieses vertrauen das hat der fall wirecard gezeigt hat gelitten. mit dem vorgelegten gesetzentwurf wollen wir dieses vertrauen wiederherstellen. mit verschärften rotationspflichten und einer strikteren trennung von prüfung und beratung wollen wir nicht nur interessenkonflikte oder auch nur den anschein von interessenkonflikten vermeiden, sondern wir wollen auch durch den häufigeren frischen prüferblick die qualität der prüfungen verbessern. ein weiterer punkt in diesem zusammenhang ist die erhöhung der haftungshöchstgrenzen und die abschaffung des haftungsprivilegs bei grober fahrlässigkeit. damit wollen wir ebenfalls verlorengegangenes vertrauen wiederherstellen, aber auch zusätzliche anreize für eine qualitativ hochwertige prüfung geben. in den meisten fällen wird das nicht notwendig sein; das wissen wir. die meisten prüfer prüfen gewissenhaft. aber wir halten es doch für angemessen, dass in den fällen, wo tatsächlich und das ist die definition von grober fahrlässigkeit einfache und offenkundig grundlegende regeln nicht beachtet wurden und schaden in kauf genommen wird, eben auch ein wirtschaftlicher anreiz besteht, genauer hinzuschauen. das ist insbesondere auch im sinne all derer, die einen ordentlichen job machen. drittens. wir wollen neben den durchgriffsrechten für die bafin und den regeln für die abschlussprüfer auch die internen kontrollsysteme in den unternehmen verbessern, zum beispiel durch einen verpflichtenden prüfungsausschuss. wir wollen verhindern, dass sich einzelne, wie im fall wirecard geschehen, mit kriminellem verhalten ein unternehmen zur beute machen. natürlich bringen wir noch weitere reformen auf den weg. für einen integren und damit attraktiven finanzplatz deutschland brauchen wir auch eine gut aufgestellte, moderne und schlagkräftige finanzaufsicht. wir schieben den handelsaktivitäten der einzelnen mitarbeiter der bafin einen riegel vor. ich glaube, auch das stärkt vertrauen. wir stärken die rolle des präsidenten, der damit aber natürlich auch das muss uns allen klar sein mehr verantwortung bekommt, und wir möchten das säulendenken innerhalb der bafin durchbrechen durch eine abteilungsübergreifende taskforce und eine stärkere datengetriebene aufsicht. auch hierzu werden wir weitere vorschläge unterbreiten, und ich freue mich auch schon auf die weiteren diskussionen. ich bin der union auch sehr dankbar für das positionspapier, das sie eingebracht hat. ich nehme das einmal als signal dafür, dass wir alle zusammen hier gut und angeregt diskutieren wollen, aber auch als signal dafür, dass wir nicht nur gründlich beraten wollen, sondern dass uns allen auch bewusst ist, dass wir möglichst zügig beraten sollen. denn der finanzplatz deutschland braucht vertrauen, und das bekommen wir, wenn wir schnell klarheit schaffen. vielen dank. vielen dank. für die fraktion der afd hat das wort der abgeordnete kay gottschalk."
76,04.03.2021,ID1921507600,Kay,Gottschalk,AfD,Kay Gottschalk,"sehr geehrter herr präsident! verehrte damen und herren! verehrte vorrednerin frau ryglewski, der fall wirecard fällt nicht vom himmel, und wir diskutieren schon sehr lange über die bafin und ihre disfunktionalität. ich bin heilfroh, dass es den untersuchungsausschuss wirecard gibt, der da bedanke ich mich bei allen kollegen durch seinen druck und seine aufklärungsarbeit dazu beigetragen hat, dass die koalition nun endlich auch handelt. denn dass bei der bafin was war, ist seit vier jahren in den anhörungen, glaube ich, kenntlich gewesen, meine damen und herren. aber es geht nicht nur um die gesetzliche regelung. wir haben hier ja einen sehr guten gesetzentwurf beigestellt. was vielmehr deutlich geworden ist das zieht sich durch alle regierungsmitglieder, das betrifft alle ministerien, die apas, das wirtschaftsministerium und das finanzministerium , ist die corporate governance und vor allen dingen die compliance. in der bafin wird sie haben es gesagt gezockt, da wird gar kein entsprechender regelkatalog vorgehalten. jemand von der apas wenn auch unabhängig, aber beim bafa im wirtschaftsministerium angesiedelt hat aktien der wirecard ag und soll das alles beaufsichtigen. meine damen und herren, wir müssen ähnlich wie für die wirtschaftsprüfer auch für regierungseinrichtungen wie wirtschaftsministerium und alle anderen nachgelagerten geschäftsbereichsbehörden eine neue compliance, eine kritische grundhaltung einführen. wenn wir das nicht tun, dann sind viele gesetze makulatur und laufen ins leere. ich höre zum beispiel in bezug auf die geldwäsche auch da müssen wir ran , dass es da mal wieder eine regelungslücke zwischen niederbayern und der bafin gab. auch hier ist es wieder die bafin. wenn es eine regelungslücke in gesetzen gibt, dann ist immer die regierung daran schuld, die dieses gesetz auf den weg gebracht hat; denn sie hat handwerklich gepfuscht und hat nicht richtig gehandelt bzw. juristisch nicht einwandfrei gearbeitet. also auch hier muss man der regierung, die es bzw. veranlasst hat das war damals schon die regierung merkel , sagen: leute, da habt ihr handwerklich unsauber gearbeitet. mit dem sogenannten finanzmarktintegritätsstärkungsgesetz versucht nun herr scholz das muss man eben auch so sagen , zunächst politisches vertrauen zurückzugewinnen. denn das vertrauen der anleger, der märkte und der menschen, die investieren, wird nicht allein durch einen gesetzentwurf wiederhergestellt. wir müssen grundlegend an dieses problem heran; und daran wird sich die afd konstruktiv beteiligen. wir haben dementsprechend einen gesetzentwurf wohlbemerkt einen gesetzentwurf und nicht nur einen antrag vorgelegt. ich möchte einigen dingen mal vorgreifen. wir als afd schütten nicht wie die regierung in ihrem entwurf das kind mit dem bade aus, sondern wollen die haftungssumme der wirtschaftsprüfer diese ist nach dem hgb auf millionen euro begrenzt gewesen auf prozent der bilanzsumme des zu prüfenden unternehmens, aber mindestens millionen euro festsetzen. die regierung, insbesondere die spd, möchte ja schon millionen euro, wenn es geht, wahrscheinlich millionen euro ich weiß es nicht , aber auf jeden fall ganz, ganz hohe summen in den strafkatalogen ansetzen. ich glaube nicht, dass es zu besseren prüfungen und prüfungsergebnissen führt, wenn wir die strafen hochschrauben. aber sie müssen merklich sein, und sie sollten daran orientiert sein das ist immer vernünftig , welchen jahresumsatz das zu prüfende unternehmen eigentlich macht. des weiteren haben wir einen vorschlag zur rotation; ich kann mir schon vorstellen, dass da der eine oder andere stöhnt. man muss sich das mal vorstellen: bis zu jahre hätte ey bei wirecard maximal prüfen und testieren können. also dass da nicht vorher schon mal einer darauf gekommen ist, dass das ein bisschen lang ist, erschließt sich mir nicht. wir sagen hier ganz klar da gibt es zwar kritik, aber wenn schon, denn schon : nein, jeweils vier jahre sollen es sein. sie wollen jetzt zehn jahre nehmen. vier jahre sind relevant. ich möchte auch keinen arzt haben, der sagt, er brauche ein, zwei jahre, bis er mal eine herz-op machen kann oder bis er den blinddarm rausnehmen kann. nein, ich glaube, ich kann heute von guten wirtschaftsprüfungsgesellschaften erwarten, dass sie sofort, wenn sie ein unternehmen prüfen, ihrem prüfungsauftrag auch entsprechend nachkommen. alles in allem begrüßt meine fraktion aber tatsächlich, dass die koalition hier sehr schnell auf die anliegen unseres untersuchungsausschusses reagiert. wir werden das kritisch begleiten. wir werden uns mit einbringen und hoffen, dass sich ein fall wie wirecard tatsächlich nicht wieder ereignet im interesse der sparer, der rentner und vor allen dingen auch des finanzplatzes deutschland und damit der arbeitnehmerinnen und arbeitnehmer. denn wirecard hat auch arbeitsplätze gekostet. vielen dank. das wort für die cdu/csu-fraktion hat der abgeordnete matthias hauer."
