,datum,redeID,vorname,nachname,fraktion,name,inhalt_neu
0,,,,,, ,
1,19.04.2018,ID192600100,Heiko,Maas,SPD,Heiko Maas,sehr geehrter herr präsident liebe kolleginnen und kollegen jüngst kündigte der russische präsident in einer rede zur lage der nation neue offensive waffensysteme an die das nuklearpotenzial von russland erheblich erweitern sollen auch china indien pakistan rüsten beträchtlich auf und die usa setzen die bereits begonnene modernisierung ihres nuklearwaffenarsenals fort noch viel beunruhigender ist die tatsache dass das tabu chemiewaffen einzusetzen vielfach gebrochen worden ist wir haben darüber gestern gesprochen liebe kolleginnen und kollegen gerne würde ich zu beginn der diskussion über den jahresabrüstungsbericht anderes berichten aber die aktuelle sicherheitspolitische lage zwingt uns dazu zu erkennen und es führt kein weg daran vorbei dies zu erkennen : die zeichen stehen in vielen teilen der welt auf aufrüstung leider gleichzeitig erodiert die weltweite wie auch speziell die europäische regelbasierte und kooperative abrüstungs- und rüstungskontrollarchitektur kaum eines der regime die jahrzehntelang zu unserer sicherheit in europa beigetragen haben funktioniert noch in vollem umfang so ist seit über zehn jahren der vertrag über konventionelle streitkräfte in europa durch russland einseitig suspendiert und es stimmt: auch andere vertragsparteien im kaukasus zum beispiel erfüllen diesen nicht in allen punkten die usa und russland werfen sich gegenseitig vor den inf-vertrag zu verletzen anstatt konstruktiv die besorgniserregenden vorwürfe wechselseitig auszuräumen liebe kolleginnen und kollegen wie soll man mit dieser sicherheitspolitischen großwetterlage umgehen unsere aufgabe ist es den schutz und die sicherheit der menschen in unserem land aber auch darüber hinaus zu gewährleisten jeder militärischen eskalation strikt entgegenzuwirken und auf allen ebenen für politische lösungen zu kämpfen die nato-partner haben beim warschauer gipfel einvernehmlich beschlossen die konventionellen verteidigungsfähigkeiten zu optimieren vor allem aber meine damen und herren stärken abrüstung rüstungskontrolle und nichtverbreitung unsere sicherheit das zeigt der ihnen vorliegende bericht außerordentlich anschaulich hier wird es notwendig sein zusätzliches engagement zu zeigen dies muss aus unserer sicht drei ziele verfolgen erstens wir müssen alles daransetzen die bestehende abrüstungs- und rüstungskontrollarchitektur zu erhalten das bedeutet vor allem eskalationsvermeidung durch transparenzbildung und dialog auch um bereits verlorengegangenes vertrauen zurückzugewinnen deshalb setzen wir uns zum beispiel in gesprächen mit russland und den anderen osze-staaten für den erhalt und wo nötig auch die modernisierung der konventionellen rüstungskontrolle in europa ein zweitens wir müssen auch akute proliferationsrisiken minimieren wir wissen alle: nordkoreas völkerrechtswidrige nuklear- und raketenprogramme bedrohen den frieden und die sicherheit nicht nur in der dortigen region sondern weltweit deutschland steht deswegen hinter dem doppelansatz aus sanktionsdruck aber vor allen dingen auch dialog gleichzeitig begrüßen wir trotz aller skepsis die man dabei haben kann jede diplomatische bemühung die zu einer verbindlichen und überprüfbaren denuklearisierung der koreanischen halbinsel führt; denn wir müssen auch im hinterkopf behalten: wenn es nicht gelingt die nordkoreanische nukleare bewaffnung zu beenden droht die entstehung weiterer nuklearwaffenstaaten in ostasien in dieser situation sollten wir alles dafür tun dass eine bereits weitgehend eingehegte krise der konflikt über das iranische nuklearprogramm nicht wieder ausbricht die unsicherheit über die zukunft der wiener nuklearvereinbarung ist alles andere als hilfreich wir haben daher ein überragendes interesse daran dass die wiener nuklearvereinbarung erhalten bleibt als e- -außenminister setzen wir uns gerade sehr intensiv auch gegenüber den vereinigten staaten dafür ein dass das nach dem mai so bleibt liebe kolleginnen und kollegen drittens wir dürfen das ist ebenfalls sehr wichtig das ziel einer nuklearwaffenfreien welt nicht aus den augen verlieren wir gehen dabei nicht darüber haben wir hier vor einigen wochen schon ausführlich diskutiert den weg des atomwaffenverbotsvertrages unser zentraler eckpfeiler und kompass ist und bleibt der nukleare nichtverbreitungsvertrag da gilt es das erreichte das ist nicht wenig zu bewahren dafür setzen wir uns auch gegenüber unseren g- -partnern ein die sich am kommenden wochenende in toronto treffen werden denn wir hier in deutschland haben den anspruch die rahmenbedingungen für die nuklearwaffenfreie welt aktiv mitzugestalten; und das werden wir auch auf diesem treffen tun wir können hier bereits erfolge verbuchen maßgeblich auf deutsches betreiben hin sind die verhandlungen über ein verbot zur herstellung von waffenfähigem spaltmaterial ein gutes stück nähergerückt fortschritte im bereich der nuklearen abrüstung sind auch darüber hinaus möglich und das obwohl wir sicherlich in sicherheitspolitisch schwierigen zeiten leben das haben die usa und russland im februar dieses jahres schon gezeigt sie haben die im rahmen des new-start-vertrages vereinbarten obergrenzen für einsatzbereite strategische nuklearwaffen erreicht das ist ein gutes zeichen für die verlängerung des vertrages die demnächst ansteht; und diese verlängerung brauchen wir für die sicherheit in europa und auch darüber hinaus deshalb liebe kolleginnen und kollegen: über sicherheit in europa in deutschland und auf der welt brauchen wir eine offene und realistische debatte und die wollen wir heute führen ich danke ihnen für ihre aufmerksamkeit nächster redner ist der kollege hampel afd-fraktion
2,19.04.2018,ID192600200,Armin-Paulus,Hampel,AfD,Armin-Paulus Hampel,herr präsident verehrte kollegen liebe gäste im deutschen bundestag ich staune immer herr bundesaußenminister wenn die deutschen ihre weltsicht darlegen wir wollen in der korea-frage mitmischen wir wollen in syrien dabei sein wir wollen zu einem ausgleich in der welt beitragen was haben sie für ein problem wir wollen immer bei dingen mitreden bei denen deutschland im grunde genommen kein gewicht hat sie werden es erleben: wenn die amerikaner sich in der tat entscheiden sollten den vertrag mit dem iran aufzugeben dann werden wir deutschen daran nichts ändern meine damen und herren auch an dem dialog zwischen nord- und südkorea oder gar den usa und nordkorea werden wir wahrscheinlich nicht teilhaben nun wird hier ein abrüstungsbericht vorgelegt wissen sie was: an sich erwarte ich von frau von der leyen erst einmal einen rüstungsbericht; denn in dem zustand in dem die bundewehr ist müssen wir erst einmal nachlegen bevor man uns in der welt wieder ernst nimmt ich habe in meinem journalistischen beruf über jahre verteidigungs- und außenpolitik begleitet und ich habe damals immer wieder gehört dass man nach dem aus dem lateinischen stammenden spruch willst du den frieden rüste dich für den krieg ein abgestuftes potenzial haben muss um ernst genommen zu werden wenn wir im konventionellen bereich schon nicht dazu in der lage sind weil unsere panzer nicht mehr fahren unsere flugzeuge und hubschrauber nicht mehr fliegen und unsere u-boote an land bleiben dann werden wir dieses konventionelle potenzial auch nicht als überzeugendes argument in die diskussion einbringen können wir haben in den vergangenen jahren angefangen mit herrn guttenberg milliarden in den verteidigungsetats eingespart bis wir jetzt auf amerikanischen druck auf die idee kommen wir müssten jetzt ein bisschen nachlegen um überhaupt wieder auf ein niveau zu kommen damit andere länder uns ernst nehmen den einsatz der bundeswehr in den verschiedenen bereichen der welt wollen übrigens die meisten deutschen nicht wir wollen keine teilhabe in syrien in afghanistan in regionen wo wir erstens den schaden nicht angerichtet haben und zu denen wir zweitens auch keine historische beziehung haben länder wie syrien irak und andere nahoststaaten sind doch zuallererst einmal auf die vereinigten staaten von amerika angewiesen; denn die haben mit dem irakkrieg die konflikte begonnen derzeit befindet sich der nahe osten fast durch die bank weg in aufruhr und instabilität deshalb ist das zuallererst aufgabe der amerikaner und dann vielleicht der ehemaligen kolonialländer denn seien wir ehrlich meine damen und herren: wir räumen derzeit den postkolonialen schrott von großbritannien und frankreich auf und da war deutschland in der vergangenheit eben nicht beteiligt deshalb sind diese länder zuallererst in der verantwortung und müssen ihren beitrag leisten es wird hier immer darüber gesprochen dass man nuklear abrüsten müsse ja das wollen wir alle wir wollen vor allen dingen dass länder wie pakistan indien aber vielleicht auch israel nicht unbedingt über große atomwaffenpotenziale verfügen am besten über gar keine atomwaffen aber wir wissen auch dass die nukleare verteidigungskomponente über jahrzehnte den frieden in europa garantiert hat und dann müssen wir dem bürger auch ernsthaft und ehrlich sagen: auch diese ist ein teil der abschreckung nicht gegen irgendjemanden sondern sie einfach wie heißt es so schön als system der kollektiven verteidigung das ist die nato zu haben hat potenzielle gegner politisch davon abgeschreckt in europa gefährliche dinge einzugehen das ist das alles entscheidende in ihrem schönen abrüstungsbericht werde ich auf seiten mit details zugeschüttet das will kein mensch wissen ich möchte ihre generallinie wissen ich möchte wissen: was haben sie erreicht welche ziele setzen sie sich für die zukunft das steht nämlich nicht in diesem bericht das will aber die deutsche bevölkerung hören meine damen und herren also seien wir gegenüber unseren landsleuten ehrlich und sagen ihnen: wir brauchen eine konventionelle rüstung die überzeugt unsere panzer müssen wieder fahren die flugzeuge wieder fliegen und die schiffe in see stechen und wir müssen genauso mit unseren nato-partnern eine flexible response in der nuklearen abschreckung erreichen die überzeugend ist für jeden der unruhe in europa stiften will sie wissen sie erreichen das nicht mit sanktionen dann verhandelt keiner mit ihnen herr maas sondern mit einem gespräch in moskau gespräche mit moskau statt sanktionen garantieren den europäischen frieden dahin müssen wir das muss das deutsche ziel sein ich danke ihnen meine damen und herren jetzt erteile ich das wort dem kollegen jürgen hardt cdu/csu
3,19.04.2018,ID192600300,Jürgen,Hardt,CDU/CSU,Jürgen Hardt,herr präsident liebe kolleginnen und kollegen ich finde dass der von der bundesregierung vorgelegte bericht ein erfreuliches beispiel dafür ist dass man durch präzision und gebündelte information den erkenntnisfortschritt im parlament tatsächlich fördert ich finde den vorgelegten bericht ausgezeichnet ich finde es gut dass wir solche debatten hier im deutschen bundestag haben und regelmäßig darüber beraten ich möchte auf drei besondere aspekte eingehen der erste aspekt betrifft die frage der nuklearen aufrüstung von iran und nordkorea deutschland hat an der seite der fünf ständigen mitglieder im sicherheitsrat intensiv an führender stelle für das nuklearabkommen mit dem iran gekämpft wir haben natürlich auch weitere fragen an die iranische politik bezüglich ihrer aggressivität gegenüber israel und ihrer unterstützung der terroristen im jemen aber wir sind der meinung dass dieser vertrag ein fortschritt gegenüber dem zustand ist der vor dem vertrag bestanden hat deswegen kämpfen wir dafür dass dieser vertrag erhalten bleibt so hat er ja auch die sicherheit des staates israel gegenüber dem zustand der vorher herrschte erhöht wir werden am mai eine wichtige entscheidung in amerika erleben ich danke der bundesregierung dafür sie hat die volle unterstützung der regierungskoalition dass sie mit den amerikanern gemeinsam einen weg sucht der es dem amerikanischen präsidenten trotz der dinge die er im wahlkampf gesagt hat und seinen wählern versprochen hat letztlich ermöglicht an diesem vertrag festzuhalten wenn man mit generalen und politikern in israel spricht die israelische regierung ist diesem vertrag gegenüber ja negativ eingestellt hört man hinter den kulissen eben oft auch: wir würden uns mehr wünschen aber diesen vertrag über bord zu werfen ist keine gute politik im sinne der sicherheit des staates israel dieser begeht ja in diesen tagen seinen geburtstag zu dem wir herzlich gratulieren der zweite aspekt auf den ich eingehen will ist die frage nach chemischen waffen wir haben ein völkerrechtlich sehr strenges regime was das verbot chemischer waffen angeht aber wir wissen dass in dieser welt chemische waffen weiterhin existieren wir haben beispiele dafür dass sie leider auch eingesetzt werden: entweder im krieg wie in syrien in den vergangenen wochen und in vielen fällen davor oder im bereich krimineller handlungen wie wir es im fall skripal in großbritannien erlebt haben das völkerrechtliche regime gegen chemiewaffen ist nur dann wirksam durchsetzbar wenn alle vertragsparteien wenn alle partner die den vertrag von unterschrieben haben unterstützung dabei leisten dass dieser vertrag durchgesetzt werden kann dass sie dann wenn die behörde in den haag ermittelt woher eine chemische waffe kommt die türen von instituten laboren und lagern öffnen in denen möglicherweise solche waffen hergestellt worden sind und vielleicht noch entsprechende bestände vorhanden sind wenn einzelne partner in diesem zusammenhang sei namentlich russland genannt den zugang und die öffnung ihrer entsprechenden labore verweigern dann ist es natürlich nicht möglich einen so sicheren beweis über die herkunft des stoffes zu führen wie wir uns das wünschen würden das wäre möglich wenn die inspektoren tatsächlich in die entsprechenden labore gehen könnten insofern ist es die pflicht eines jeden unterzeichners dieses abkommens nicht nur die entsprechenden chemischen waffen zu vernichten bzw entsprechend dem abkommen gar nicht zu produzieren sondern auch das verifikationsregime das dahintersteht und erforderlich ist nach kräften zu unterstützen das ist mein appell an russland der dritte aspekt auf den ich eingehen möchte ist die frage des mittelstreckenraketenvertrags aus den -jahren zwischen den usa und russland bzw damals der sowjetunion die frage der stationierung von atomaren mittelstreckenwaffen in europa hat anfang der -jahre die öffentliche meinung in deutschland und in anderen teilen europas gespalten und sie hat zum bruch einer bundesregierung geführt es war ein enormer quantensprung in der friedenspolitik dass es gelungen ist die landgestützten raketen mit einer reichweite zwischen und kilometern in europa komplett abzuschaffen im übrigen hätten die anhänger der friedensbewegung anfang der -jahre gar nicht zu erträumen gewagt dass tatsächlich schon wenige jahre später diese waffen komplett verschwinden wir haben jetzt anzeichen dafür dass durch neue technologie und modernisierung möglicherweise dieser vertrag infrage steht ich plädiere und appelliere an die bundesregierung und alle beteiligten mit aller effizienz und sorgfalt zu untersuchen ob die vorwürfe die im raum stehen tatsächlich berechtigt sind dass nämlich die ssc- -raketen russlands möglicherweise diesen vertrag verletzen oder ob das eben nicht der fall ist ich appelliere dass wir uns diesem thema intensiv widmen weil es für die sicherheit deutschlands und europas von so großer und tragender bedeutung ist herzlichen dank nächster redner ist der kollege alexander müller fdp
4,19.04.2018,ID192600400,Alexander,Müller,FDP,Alexander Müller,herr präsident liebe kolleginnen und kollegen um zu abkommen zur abrüstung zu kommen ist ein zäher und oft jahrzehnte dauernder prozess nötig trotzdem muss immer wieder neu versucht werden durch internationale verhandlungen fortschritte zu erreichen der abrüstungsbericht der bundesregierung macht deutlich wie mühselig die internationalen bemühungen um abrüstung sind wir begrüßen dabei die vielfältigen aktivitäten die im vorliegenden abrüstungsbericht dokumentiert sind es gibt immer wieder rückschläge bei der verlängerung und der kontrolle der verträge trotzdem ist es seit dem höhepunkt des kalten krieges international gelungen durch hartnäckige abrüstungsverhandlungen die anzahl der nuklearen sprengköpfe von auf heute zu reduzieren so wurden in jahren immerhin schon drei viertel des weges zu global zero zurückgelegt also zu dem ziel einer welt ohne nuklearwaffen wir freien demokraten verlieren dieses ziel nicht aus den augen dieser weg zur atomwaffenfreien welt muss weiter beschritten werden trotzdem mussten wir durch erfahrung lernen dass dieser weg nicht über den einseitigen totalverzicht auf nukleare abschreckung führt so wie ihn grüne und linke hier beantragt haben auch hier in europa gibt es immer noch kräfte die das völkerrecht mit füßen treten die das budapester memorandum und die schlussakte von helsinki erst unterzeichnen um dann beides zu brechen solange es mächte gibt die in militärisch aggressiver weise ihre friedlichen nachbarn unterwerfen wollen müssen wir uns durch abschreckung selbst verteidigen können das ist unsere feste überzeugung in drei wochen entscheidet sich die zukunft des iran-abkommens mit dem es gelungen ist iran zu verpflichten nukleartechnologie ausschließlich friedlich zu nutzen und die einhaltung wirksam überprüfen zu lassen iran hat sich an alle regeln gehalten und hat heute kein hochangereichertes nuklearmaterial mehr trotzdem denkt der amerikanische präsident laut über eine kündigung dieses abkommens nach es wäre das ende der früchte jahrzehntelanger bemühungen um die eingrenzung der verbreitung von atomwaffen wir appellieren an die bundesregierung und an den französischen präsidenten der heute hier in berlin zu gast ist bei ihren gesprächen kommende woche in washington alle diplomatischen kanäle zu nutzen und auf präsident trump einzuwirken damit dieses abrüstungsabkommen eingehalten und nicht zerstört wird dasselbe gilt natürlich für den friedensprozess in korea hier öffnet sich gerade ein fenster für einen dialog mit dem nordkoreanischen präsidenten der zu einem friedensprozess der koreanischen staaten und zu einer wiedereinbindung nordkoreas in internationale nuklear abkommen führen kann auch hier müssen wir europäer alle gesprächsmöglichkeiten nutzen insbesondere bei der gelegenheit in der amerikanischen hauptstadt nächste woche wenn die kanzlerin auf den amerikanischen präsidenten trifft die ereignisse der letzten wochen haben uns gezeigt wie wichtig das thema rüstungskontrolle nach wie vor ist die vergiftung der familie skripal und der einsatz von chemiewaffen in syrien zeigen: es ist unfassbar dass jahre nach der ächtung von biologischen und chemischen waffen durch das genfer protokoll und viele weitere abkommen danach heute noch immer solche waffen eingesetzt werden die uno will aktiv untersuchen wer im syrischen duma giftgas eingesetzt hat doch das untersuchungsteam der opcw wird ständig hingehalten wird beschossen und die aufklärung wird systematisch behindert im uno-sicherheitsrat blockiert russland resolutionen zur sanktionierung der giftgaseinsätze es ist für uns unerträglich ohnmächtig zuschauen zu müssen wie in syrien seit jahren immer und immer wieder giftgas gegen die eigene bevölkerung eingesetzt wird umso unverständlicher ist für uns wenn die fraktion die linke dann bei den beratungen in den gremien dieses hauses spekuliert die giftgaseinsätze könnten ja von interessierten westlichen kreisen inszeniert worden sein angesichts der erdrückenden faktenlage ist das schlicht zynisch gegenüber den ermordeten giftgasopfern wir sollten in diesem haus alle ein interesse daran haben dass die aufklärung der giftgaseinsätze nicht länger behindert wird und nicht mit kruden verschwörungstheorien das weitere verwischen von spuren betreiben vielen dank nächster redner ist der kollege dr gregor gysi fraktion die linke
