,datum,redeID,vorname,nachname,fraktion,name,inhalt_neu
114,17.06.2020,ID1916511400,Ulle,Schauws,BÜNDNIS 90/DIE GRÜNEN,Ulle Schauws,"sehr geehrte frau präsidentin! liebe kolleginnen und kollegen! wir führen heute eine längst überfällige debatte. endlich sprechen wir darüber, welche folgen die aktuelle krise für frauen hat. dass wir das erst heute tun, ist ernüchternd. diese debatte hätte längst von der bundesregierung kommen müssen. seit monaten werden frauen übersehen. dabei sehen wir in den letzten monaten sehr genau: die krise ist nicht geschlechterneutral. eine repräsentative umfrage zur aktuellen belastung zeigt sehr deutlich: es sind die frauen, die seit dem shutdown besonders unzufrieden mit ihrer lebenssituation sind. und das hat einen grund: frauen halten in dieser krise sprichwörtlich den laden am laufen. es sind vor allem frauen, die in den systemrelevanten berufen als pflegekräfte, erzieherinnen oder als verkäuferinnen einer höheren infektionsgefahr ausgesetzt sind, und viele von ihnen werden viel zu schlecht bezahlt. es sind überwiegend frauen, die mit unbezahlter arbeit zu hause die lücke schließen, die durch die kita- und schulschließungen entstanden ist. denn in unserer gesellschaft gibt es trotz aller gleichstellungspolitischen erfolge noch immer die stillschweigende erwartung an frauen, in der krise einzuspringen. das zeigt, wie brüchig die bislang erlangte gleichstellung ist. und es zeigt: das private ist politisch. liebe kolleginnen und kollegen, schauen wir auf das konkrete handeln dieser bundesregierung: im milliardenschweren konjunkturpaket kommen frauen nicht vor. da hilft es auch nichts, wenn ministerin giffey den familienbonus nun als leistung für frauen verkauft. warum sitzt sie als zuständige ministerin nicht im ständigen krisenkabinett? die zentrale frage ist: wird die bundesregierung dem anspruch gerecht, die interessen aller im blick zu haben? nein, das wird sie nicht! nicht für frauen. und das ist fatal. in unserem grünen antrag zeigen wir auf, was es jetzt braucht, um geschlechtergerechter aus der krise zu kommen. zahlreiche frauenverbände mahnen und fragen zu recht: wann, wenn nicht jetzt? darum fordern wir, die veränderungen der strukturen, die frauen immer noch benachteiligen, jetzt in angriff zu nehmen. meine damen und herren, das grundgesetz gibt der bundesregierung einen aktiven auftrag, bestehende nachteile für frauen zu beseitigen. jetzt ist die zeit, mit einem geschlechtergerechtigkeitscheck alle bestehenden und kommenden krisenmaßnahmen fair für alle auszugestalten. im sinne von good governance, guter regierungsführung, werden die gesetze besser, wenn sie mit blick auf die auswirkungen auf die geschlechter erarbeitet werden. wir wollen, dass paare, die sich erwerbs- und sorgearbeit fair aufteilen wollen, dies auch tun können. aber solange frauen strukturell schlechter gestellt sind mit schlechter bezahlten jobs und schlechteren karrierechancen, ist genau das für viele paare sehr schwer. deswegen brauchen wir endlich eine bessere bezahlung von sorgeberufen, entgeltgleichheit und ein ende des unfairen ehegattensplittings. das kurzarbeitergeld muss besonders für kleine einkommen weiter angehoben werden das haben wir gefordert , und es muss schluss sein mit der benachteiligung von frauen bei den lohnersatzleistungen durch die steuerklassen. liebe kolleginnen und kollegen, wir können aus der krise viel lernen. wir reden jetzt seit wochen darüber, dass wir wie unter einem brennglas sehen, wo die probleme in der geschlechtergerechtigkeit liegen. ich sage ihnen: wenn wir die probleme jetzt klar sehen, dann können wir sie anpacken. die chance ist da! jetzt ist die zeit für geschlechtergerechtigkeit. vielen dank. vielen dank, ulle schauws. nächste rednerin: für die cdu/csu-fraktion melanie bernstein."
115,17.06.2020,ID1916511500,Melanie,Bernstein,CDU/CSU,Melanie Bernstein,"frau präsidentin! liebe kolleginnen und kollegen! die vorliegenden anträge zur geschlechtergerechtigkeit lesen sich, mit verlaub, wie ein drittaufguss aus der ideologischen mottenkiste. ich fasse zusammen: die grünen möchten steuervorteile für unternehmen mit festen quoten, neue stabsstellen, neue krisenräte und kommissionen, mehr geld vom staat, mehr steuern, höhere belastungen für kleine und mittelständische unternehmen und einen rechtsanspruch auf homeoffice und natürlich gesetzlich verankerte quoten für listen und wahlkreise. den linken reicht das alles nicht. hier geht es gleich an die ganz dicken bretter. ich zitiere: das kapitalistische wirtschaftssystem kann nicht angemessen auf krisen reagieren, … sondern verschärft sie noch. da trifft es sich gut, dass heute der . juni ist, ein guter tag, um sich mal daran zu erinnern, wie der staat in sozialistischen systemen auf krisen reagiert, mal ganz abgesehen von der tatsache, dass sich die supermärkte im sozialismus auch ohne krise vorrangig durch leere regale auszeichnen. da ist dann zumindest der unterschied in der lebensqualität der menschen mit oder ohne krise nicht so groß, weil es allen gleich schlecht geht also allen bis auf die parteifunktionäre, die in den stabsstellen und kommissionen sitzen. irgendeinen konstruktiven vorschlag habe ich in beiden anträgen vergeblich gesucht. um es mal ganz klar zu sagen: die coronakrise hat deutschland in eine seit dem zweiten weltkrieg nicht gekannte wirtschaftliche situation gebracht, gemessen an der ausgangslage. die bundesregierung versucht alles menschenmögliche, um unser land sicher und mit so geringem schaden wie möglich durch diese schwere zeit zu bringen. dazu haben wir das größte staatliche hilfspaket unserer geschichte verabschiedet. nur wenn unternehmen und ihre angestellten steuern zahlen, können wir hilfspakete überhaupt bezahlen. da helfen aber keine stabsstellen und auch nicht die gesetzliche pflicht, aus jedem minijob eine volle stelle zu machen. das ergebnis wäre dann nämlich, dass es diesen job mini- oder nicht gar nicht mehr gäbe. ja, die frauen haben in dieser krise großartiges geleistet. kinder zu betreuen und gleichzeitig zu arbeiten, ist eine heftige belastung, vor der ich ganz großen respekt habe. und ja, wir haben beobachtet, dass geschlossene kitas und schulen nicht immer, aber oft dazu führen, dass frauen einen höheren anteil an der häuslichen arbeit übernehmen als männer. dazu hat die cdu/csu-fraktion gerade vorgestern ein digitales fachgespräch geführt, mit guten impulsen, etwa zur reform des elterngeldes. es ging da auch um das isländische modell, wo elternzeit zu gleichen teilen genommen werden muss und auch nicht auf den partner übertragen werden kann. da können wir ansetzen. das ist seriöse, lösungsorientierte politik. man darf aber auch mal sagen, dass viele unternehmen mit großem engagement digitalisierung vorangetrieben und flexible arbeitsmodelle gefunden haben, um ihre mitarbeiter zu unterstützen und halten zu können. an dieser stelle auch dafür herzlichen dank! vielen dank. vielen dank, melanie bernstein. nächster redner: für die afd-fraktion thomas ehrhorn."
116,17.06.2020,ID1916511600,Thomas,Ehrhorn,AfD,Thomas Ehrhorn,"frau präsidentin! meine damen und herren! liebe zuschauer! die geschichte, die ich jetzt erzähle, veranschaulicht in eindrücklicher weise, welches maß an absurdität die nicht enden wollende diskussion um die angebliche benachteiligung von frauen in unserer gesellschaft inzwischen angenommen hat. im letzten jahr gab sich eine delegation der gleichstellungsbeauftragten höherer bundesbehörden ein stelldichein im ausschuss für familie, senioren, frauen und jugend. sie berichteten über ihre arbeit im zusammenhang mit dem bundesgleichstellungsgesetz. fragen waren erlaubt, also stellte ich die frage, meine damen und herren: wie viele männliche und wie viele weibliche gleichstellungsbeauftragte gibt es denn? die antwort war: na, hören sie mal! selbstverständlich gibt es nur weibliche und keinen einzigen männlichen gleichstellungsbeauftragten. auf meine weitere frage, warum das denn so sei, war die antwort: na, hören sie mal, das müssten sie doch eigentlich wissen! das gleichstellungsgesetz gibt das nicht her. männer haben nach dem bundesgleichstellungsgesetz weder das aktive noch das passive wahlrecht. will also sagen: männer können nicht nur nicht gewählt werden, sondern sie dürfen auch gar nicht erst mit abstimmen. ist doch toll! - ja, richtig! höre ich da gerade. wunderbar! ja, genau. dass sie das richtig finden, das glaube ich ihnen sogar. was heißt das eigentlich? heißt das, dass nach dem bundesgleichstellungsgesetz frauen und männer grundsätzlich gleich sind, aber frauen etwas gleicher sind? oder heißt das, dass jemand, der zufällig das pech hatte, als mann auf die welt zu kommen, in diesem moment schon jegliches recht, als gleichstellungsbeauftragter gewählt zu werden, verwirkt hat, weil er möglicherweise so etwas wie ein macho-gen in sich trägt? man muss sich das ganze mal umgekehrt vorstellen. man stelle sich mal eine organisation vor, die sich die gleichstellung der geschlechter auf die fahnen geschrieben hat und explizit alle frauen ausschließt. ich glaube, das geschrei linker frauenrechtsorganisationen würde diese bundesrepublik bis ins mark erschüttern, meine damen und herren. man würde wahrscheinlich den verfassungsschutz auf den plan rufen wegen klar erkennbarer gruppenbezogener menschenfeindlichkeit, und das in diesem falle wahrscheinlich sogar mit recht. erklärt wird das ganze dann immer mit den angeblichen strukturellen benachteiligungen, unter denen frauen zu leiden haben und die man natürlich ausgleichen muss. ja, eine dieser strukturellen benachteiligungen liegt eben darin, dass sich immer noch mehr frauen als männer dafür entscheiden, nach der geburt ihres kindes eine zeit zu hause zu bleiben und die karriere zu unterbrechen. wenn sie sich mal von den personalabteilungen großer industrieunternehmen erklären lassen, wie das anforderungsprofil für führungspositionen aussieht, dann wird man ihnen sagen: möglichst jung, optimal ausgebildet und eine möglichst lange, am besten zehnjährige berufserfahrung. das ist eben etwas im anforderungsprofil, was auch heute noch offenkundig von mehr männern als frauen erfüllt werden kann. wenn nun irgendjemand in diesem hohen hause glaubt, hier könnten wir abhilfe schaffen, indem wir ganz einfach dasselbe tun wie beim gleichstellungsgesetz, nach dem motto ene, mene, muh und raus sind alle männer! oder umgekehrt gesprochen egal wie qualifiziert ein mann ist, gewählt wird halt immer die frau , - kommen sie bitte zum schluss. dann kann ich nur sagen: sie haben das grundgesetz der bundesrepublik deutschland entweder nicht gelesen oder nicht verstanden. vielen dank. danke schön. nächste rednerin: für die spd-fraktion josephine ortleb."
117,17.06.2020,ID1916511700,Josephine,Ortleb,SPD,Josephine Ortleb,"sehr geehrte frau präsidentin! liebe kolleginnen und kollegen! sehr geehrte damen und herren! wie die kollegin ulle schauws richtig feststellt, legt die coronakrise viele ungerechtigkeiten offen. sie funktioniert wie eine taschenlampe und wirft ein licht dahin, wo zuvor weibliche lebensrealitäten in dunkle ecken gedrängt wurden. aber themen wie pflege , unbezahlte sorgearbeit , vereinbarkeit und repräsentanz von frauen in entscheidungsgremien lassen sich nicht mehr verdrängen. die systemrelevanz von unbezahlter wie auch bezahlter arbeit, die von frauen geleistet wird, wird endlich sichtbar. gleichzeitig rücken schieflagen wieder in unseren fokus, von denen wir glaubten, sie überwunden zu haben. dies stellen sie, liebe grüne, auch in ihrem antrag richtigerweise fest. für beides brauchen wir lösungen. zum einen brauchen wir, um die tatsächliche gleichstellung der geschlechter zu erreichen, strukturelle veränderungen in unserer gesellschaft. genauso nötig sind aber gerade auch kurzfristige hilfen für frauen, die sie sicher durch die krise bringen. so stellt man sich berechtigterweise die frage: was tun die maßnahmen der bundesregierung im konjunkturpaket für frauen? wenn man mit strg+f das wort frauen im papier sucht, findet man erst mal: nichts. aber, liebe kolleginnen und kollegen, so einfach darf man es sich an dieser stelle nicht machen. man muss sich jede einzelne maßnahme genau anschauen; denn unser konjunkturprogramm ist weder ein gleichstellungspolitischer ausfall, noch sind frauen voll aus dem blick der spd geraten. etwa die überbrückungshilfen für kleine und mittelständische unternehmen kommen insbesondere der tourismus-, hotel- und gaststättenbranche zugute. wie schon von den soforthilfen profitieren also frauen überdurchschnittlich; denn etwa prozent der beschäftigten sind hier weiblich. wir bleiben unserer linie treu und stärken branchen, in denen mehrheitlich frauen arbeiten. auch beim ausbau der kinderbetreuung entlasten wir frauen bei der unbezahlten sorgearbeit. und von der zunächst befristeten verdopplung des entlastungsbetrags für alleinerziehende profitieren frauen am meisten; denn prozent der alleinerziehenden sind weiblich. allein diese beispiele zeigen: die hilfen werden bei frauen unmittelbar ankommen. die größeren hürden sind aber immer noch die strukturen in unserer gesellschaft, die frauen diskriminieren und eine echte gleichstellung verhindern. wenn wir nicht wollen, dass die nächste krise auch auf dem rücken der frauen ausgetragen wird, brauchen wir mehr licht im dunkeln, als es uns eine taschenlampe geben kann. wir dürfen nicht riskieren, dass frauen zum dank traditionell nur weiter blumen geschenkt wird. diese zeiten sind vorbei! blumen, klatschkonzerte und nette worte helfen nicht, wenn es um gleiche rechte und echte selbstbestimmung geht. unsere vorschläge für mehr gleichstellung liegen vor. denn wir als spd-bundestagsfraktion wollen statt blumen mehr frauen in führungspositionen, statt blumen eine nachhaltige aufwertung von sozialen berufen, statt blumen eine grundrente, die die lebensleistung von frauen anerkennt, statt blumen eine strategie, die die gleichstellungspolitik in deutschland stärkt. denn für uns als spd-bundestagsfraktion haben frauen immer konjunktur! vielen dank. vielen dank, josephine ortleb. nächste rednerin: für die fdp-fraktion nicole bauer."
118,17.06.2020,ID1916511800,Nicole,Bauer,FDP,Nicole Bauer,"sehr geehrte frau präsidentin! liebe kolleginnen und kollegen! viele länder schauen anerkennend nach deutschland. bisher, so scheint es, haben wir die coronakrise gut überstanden. doch fallzahlen, intensivbetten und sterberaten sind eben nicht alles, was zählt. fragen sie doch mal die familien, die kinder, die eltern! die vielen eltern, die wochenlang homeschooling und homeoffice vereinbart haben. sie kommen auf dem zahnfleisch daher. vollzeitkinderbetreuung, lehrerersatz und nebenbei unzählig viele videokonferenzen und telefonkonferenzen im eigenen job das ist unglaublich; das funktioniert nicht. genau da müssen wir ansetzen. wer jedoch gerne etwas anderes behauptet, verhöhnt im eigentlichen sinne die fachkräfte in den kitas und die lehrerinnen und lehrer an den schulen, die tagtäglich großartiges leisten. das möchte ich ausdrücklich an dieser stelle noch mal betonen, sehr geehrte damen und herren. deshalb darf es eigentlich nur eine notlösung sein und keinesfalls ein dauerzustand. denn was passiert denn in den familien hierzulande? wer sind diejenigen, die neben homeoffice homeschooling und den haushalt wuppen? das sind überwiegend die frauen. es sind die mütter, die beruflich zurückstecken, die in teilzeit zurückgehen oder ihre meist ohnehin geringe teilzeit noch weiter reduzieren. aber warum ist das so? ist das immer wirklich so freiwillig gewählt? genau darüber müssen wir sprechen, meine damen und herren! wir sprechen über einen rückwärtstrend in unserer gesellschaft. wir sprechen über eine unfaire rollenverteilung im normalzustand. krisen verdeutlichen eigentlich nur und verstärken die bestehende schieflage. die vereinten nationen weisen ja auch ausdrücklich darauf hin, dass wir eigentlich einen angriff auf die emanzipation haben. wir wollen nicht zurückgeworfen werden, wir wollen klar nach vorne! deshalb fordern wir freie demokraten die bundesregierung auf, einen zukunftsgipfel emanzipation einzurichten, der eigentlich längst überfällig ist. wir müssen uns dabei damit beschäftigen: wie können wir uns besser aufstellen? wie können wir den männern und frauen echte chancenverwirklichung ermöglichen? wie können wir müttern und vätern echte wahlfreiheit ermöglichen, damit sie die verantwortung zwischen familie und beruf eigenständig aufteilen können? und wie können wir die krise als eine chance begreifen und daraus lernen als eine chance der veränderung und eine chance des neudenkens? wir brauchen eine strategie mit ganz klaren maßnahmen. bei dieser strategieentwicklung setzen wir auf diversity, auf eine fülle von möglichst vielen perspektiven. denn für uns ist klar: in einer modernen gesellschaft darf es nicht vom geschlecht abhängen, wie man durch die krise kommt. wir wollen männer und frauen, mütter und väter künftig gleichermaßen krisenfest machen. das ist unser ziel und unser anliegen. herzlichen dank."
119,17.06.2020,ID1916511900,Doris,Achelwilm,DIE LINKE,Doris Achelwilm,"frau präsidentin! liebe kolleginnen und kollegen! die gleichstellungspolitik des bundes ist in dieser wahlperiode wieder äußerst bescheiden und blockiert. das zeigt sich in der coronakrise deutlicher als vorher schon. aus allen lebenslagen wird uns berichtet, was es bedeutet, dass die groko sich nicht reinhängt, frauenspezifische nachteile und extralasten abzustellen. sichtbar wird dieser unwille anhand von krisenstäben und hilfspaketen, die mit einer selbstverständlichkeit an frauen vorbeigebaut werden, dass es kaum zu fassen ist. aktuell streitet sich die groko um ein neues führungspositionengesetz, damit die privatwirtschaft zumindest einzelfrauen in vorstände lässt. das ist so was von zu wenig, liebe kolleginnen und kollegen, dass ich nur hoffe: verkäuferinnen und pflegekräfte sind bald aus dem gröbsten krisendruck heraus und machen richtig alarm. als linke grüßen wir selbstverständlich alle, die heute und in diesen tagen gegen den pflegenotstand auf die straße gehen. wir sind hier an eurer seite! denn ja, es ist unbegreiflich, dass pflegekräfte weiter auf die überfällige aufwertung warten und obendrein als notfallregelung das arbeitszeitgesetz ausgehebelt wurde, damit der laden auf ihre kosten läuft. wenn csu und wirtschaftsflügel der cdu sogar noch wollen, dass es aus profitgründen gleich dabei bleibt, hätten sie sich beim applaus für die systemrelevant tätigen letztens lieber enthalten sollen. so geht es überhaupt nicht! anders als zur finanzkrise sind aktuell zum beispiel mit der gastronomie, dem tourismus oder dem kulturbereich maßgeblich branchen mit hohem frauenanteil von lohneinbußen und auch jobverlust betroffen, darunter geringverdienende aus bestimmten gründen ebenfalls eher frauen , über deren umstände hier viel zu wenig gesprochen wird. es ist auch nicht hinnehmbar, dass frauen selbstverständlich die hauptlasten zu hause tragen zuletzt sehr deutlich beim homeschooling , dass viele durch steuerliche fehlanreize wie dem ehegattensplitting und anderen maßnahmen und rückständigkeiten zurückstecken. es ist höchste zeit, bei all diesen maßnahmen darzulegen, wie sie sich geschlechterspezifisch und vor allem geschlechtergerecht auswirken. das hat bislang bei der krisenbewältigung komplett gefehlt. klar: frauen sind aber noch immer mitgedacht , heißt es dann, und es gibt ja noch euro kinderbonus, der allerdings bei alleinerziehenden mit dem kindesunterhalt verrechnet wird, sodass nur noch euro bleiben. und klar, auch männer übernehmen inzwischen familienaufgaben. dass aber all das gegen patriarchale windmühlen nicht reicht, sehen wir spätestens bei der masse an armutsrentnern, die vor allem weiblich sind. wenn jetzt kein umsteuern passiert, nehmen diese gerechtigkeitslücken zu. das ist nicht akzeptabel! es muss nach vorne gehen. wie gleichstellung funktioniert, ist bekannt, in unserem antrag auch nachzulesen. es gibt reichlich strategisches zu tun, zum beispiel höhere mindestlöhne und kurzarbeitergelder, allgemeinverbindlichkeit von tarifverträgen, aufwertung unterbezahlter sorgeberufe, umverteilung von ressourcen wie geld und zeit. setzen sie sich endlich für geschlechtergerechtigkeit ein! vielen dank, doris achelwilm. nächste rednerin: für die cdu/csu-fraktion silvia breher."
120,17.06.2020,ID1916512000,Silvia,Breher,CDU/CSU,Silvia Breher,"sehr geehrte frau präsidentin! liebe kolleginnen und kollegen! geschlechtergerecht aus der corona-krise so lautet der titel des antrags der grünen, der heute debattiert wird. meine vorrednerinnen haben heute schon mehrfach gesagt, wie schwierig die lage war, wie schwierig es auch noch immer für familien und insbesondere für frauen in dieser coronakrise ist. nicht zuletzt, weil ich selber drei kinder im grundschulalter habe, möchte ich, auch im namen meiner fraktion, den familien und ganz besonders den frauen einfach mal für alles, was sie geleistet haben, und für alles, was sie noch immer leisten, von ganzem herzen danke sagen. diese debatte heute ist wichtig, nicht nur, weil wir das thema kennen, weil wir die probleme und die herausforderungen rund um geschlechtergerechtigkeit kennen und weil wir unsere unterschiedliche herangehensweise, unsere verschiedenen lösungsansätze kennen. nein, diese debatte heute ist auch wichtig, weil schon allein der titel dieser debatte in männerrunden zu einem schmunzeln führt und weil dieses thema heute morgen im ausschuss beim fachgespräch zum dritten gleichstellungsbericht bei einem männlichen kollegen für ein vorpubertäres gekicher gesorgt hat. frau professor dr. yollu-tok hat uns heute unter anderem davon berichtet, dass werte und normen auch in bezug auf geschlechterstereotypen wichtig sind. es geht um werte und normen das finde ich in diesem zusammenhang wirklich wichtig. lassen sie uns debattieren, lassen sie uns unterschiedlicher meinung sein, lassen sie uns unterschiedliche lösungsansätze haben aber lassen sie uns alle gemeinsam eine haltung haben für gleiche verwirklichungschancen von männern und frauen! heute liegen uns fünf anträge vor. während der afd zu diesem thema wir haben es auch nicht anders erwartet nichts besseres einfällt, als dass auch männer als gleichstellungsbeauftragte gewählt werden müssen, gibt es im übrigen umfangreiche ideen und vorschläge; sie wurden schon dargestellt. ich freue mich auf die intensive beratung im ausschuss. schade finde ich allerdings, dass die linke diese debatte für ihre üblichen neidanträge beispielsweise vermögensteuer in form einer millionärssteuer nutzt. sie macht sich zwar über einen flächendeckenden zugang zu abtreibungen sorgen, aber ich kann nicht eine einzige pressemeldung der linken zur aktuellen debatte der strafverschärfung bei kinderpornographie und kindesmissbrauch finden. das wiederum finde ich sehr schade. zum ende meiner rede möchte ich denn ich bin ein durch und durch positiv denkender mensch auch dieser krise einen positiven impuls für die zukunft abgewinnen. ja, den großen teil der care-arbeit zu hause werden aktuell und auch in zukunft noch die frauen leisten; aber und das ist auch eine besonderheit der coronakrise plötzlich gab es in haushalten ganz neu verteilte rollenbilder. männer mussten zu hause bleiben, weil sie in kurzarbeit waren, homeoffice hatten oder weil die frau in einem systemrelevanten beruf gearbeitet hat. plötzlich haben männer die erfahrung gemacht, dass sie auf einmal alleine für die kindererziehung verantwortlich sind. das hat, positiv gedacht, zumindest potenzial für einen kulturwandel. auch dafür möchte ich diese debatte nutzen. vielen dank."
