,datum,redeID,vorname,nachname,fraktion,name,inhalt_neu
18,19.10.2018,ID195901800,Helge,Lindh,SPD,Helge Lindh,herr präsident liebe kolleginnen und kollegen ein element dieses gesetzentwurfes ist eine form einer generalpräventiven haft einer präventivhaft jenseits unserer verfassung ich nehme dies zum anlass für eine dringend notwendige generalabrechnung mit dem geist der aus diesem vorhaben diesem artikelgesetz spricht wunderbar in erschreckender weise wunderbar dazu passt was wir in den letzten tagen erleben durften: die afd hat in verschiedenen landesverbänden medienplattformen ich nenne sie onlinepranger für lehrerinnen und lehrer eingerichtet in denen unliebsame politisch zu kritische lehrerinnen und lehrer angeprangert werden was ist für sie zu kritisch wer afd-kritisch ist ist dort zu denunzieren bereits damit verlassen sie eindeutig den boden des rechtsstaates das passt aber wie die faust aufs auge zu ihren rechtspolitischen vorstellungen wenn sie jenseits des rechtsstaates anprangern wollen haben auch wir das recht anzuprangern allerdings ganz legitim und auf dem boden des rechtsstaates was wir dazu nutzen ist allein das papier das sie heute vorgelegt haben ich fordere alle auf die es lesen können auch alle juristinnen und juristen die es in die finger bekommen es zu verbreiten es in lesbare sprache zu übersetzen und deutlich zu machen was das ist und was uns erwartet wir haben uns vielleicht lange täuschen lassen aber wer das liest weiß wohin die reise mit der afd geht und in welch einen unrechtsstaat wir uns bewegen schauen wir uns an was wir da finden: abschaffung der revision das wurde schon genannt präventivhaft in drittstaaten kafkas strafkolonie wird in diesem sinne wiederauferstehen aber kein hinweis wie das finanziert und strukturiert werden soll wir finden als begründung den hinweis es sei eine tatsache eine tatsache dass die exekutive in diesem land nicht mehr für recht und ordnung für sicherheit und für das gewaltmonopol einstehen könne woher nehmen sie diese tatsache keine begründung hinzu kommt dass sie gestern noch ausgeführt haben dass syrien doch ein sicheres land sei ich frage sie: ist für sie also die voraussetzung dafür dass ein staat die innere sicherheit gewährleistet dass es folterkeller gibt dass ein polizei- und militärstaat herrscht und dass wir einen totalitären staat haben ein satz der kollege von der fdp wies schon darauf hin macht das ganz deutlich in der problemerklärung heißt es: auch soll die einbürgerung von ausländern erschwert werden deren familie bereits lassen sie mich doch bitte ausreden gehäuft strafrechtlich in erscheinung getreten sind entweder müsste es familien und sind oder familie und ist heißen wenn sie über einbürgerung sprechen verwenden sie also auch noch falsches deutsch was bei ihnen ja häufiger passiert auch das ist etwas verwirrend lässt aber auf ihre gedanken schließen was tun sie da sie führen wieder die idee einer sippenhaft ein ich spreche für eine partei deren abgeordnete ins kz gegangen sind die dafür gekämpft haben dass es in diesem land kein sonderrecht für juden gibt die dafür eingestanden sind dass es kein schicksal ist welche herkunft man hat wir können sagen: im leben nicht werden wir zulassen dass solcher geist hier im parlament und in diesem land herrscht schauen wir uns die weiteren instrumente an die sie einführen wollen beispielsweise soll unser einbürgerungsrecht komplett verändert werden sie wollen einen abschied vom ius soli übrigens haben wir ja gar kein reines ius soli sondern eine verbindung von abstimmungsprinzip und geburtsprinzip all das soll geschliffen werden all die rechte die mühsam erkämpften rechte für menschen mit migrationshintergrund für die auch wir eingetreten sind sollen verschwinden und bei den ausreisepflichten man sehe es sich genau an ist als ein grund genannt: wenn ausländer oder ihre familienangehörigen oder haushaltsangehörigen man muss genau darauf achten abhängig sind von sgb-xii oder sgb-ii-leistungen von grundsicherung oder sozialhilfe wenn man sich das genau ansieht stellt man fest: im grunde soll dadurch nach ihren vorstellungen ein nicht unerheblicher teil der ausländer in diesem land ausreisepflichtig werden meinen sie das wirklich ernst meinen sie dass prozent der einwohner meiner stadt nach ihrem gutdünken dieses land verlassen sollen gewiss nicht ihre vorstellungen von innerer sicherheit haben noch einen ganz anderen haken sie verwechseln nämlich gesellschaftliche entwicklung auch mögliche gesellschaftliche missstände mit strafrecht in wichlinghausen zum beispiel einem stadtteil mit großen sozialen problemen in meiner stadt wird das was sie vorschlagen keinem menschen helfen es wird aber helfen wenn wir was wir verstärkt tun müssen die sozialen lebensbedingungen verbessern wenn mehr polizei vor ort ist und wenn wir ordnungspartnerschaften einrichten das sind maßnahmen zur inneren sicherheit aber gewiss nicht ihr ausländer- und sippenhaftrecht liebe kolleginnen und kollegen ich denke in einem sind wir uns einig da muss man gar nicht die rassismuskeule rausholen; die haben sie selber in der hand man muss nur sehen was für ein gedanke dahintersteckt was ist der grund erklären sie es mir; der grundinstinkt sollte doch in jedem von uns stecken dass jemand der geflüchtet ist und hier lebt oder der aus der fremde hierhergekommen ist aus ihrer sicht nicht die gleichen rechte genießen sollte was ist das für eine botschaft die wir die sie damit aussenden das müssen wir klar benennen an alle menschen hier im parlament noch zu wenige auf den tribünen und im land die jetzt zuhören und einen migrationshintergrund haben oder ausländer sind was ist das für eine botschaft die botschaft lautet: ihr seid nicht gewollt; ihr seid minderwertig ihr genießt nicht die gleichen rechte das kann man nicht hinnehmen dazu können wir nicht schweigen da müssen wir viel lauter werden als wir es bisher waren das ist unwürdig und es ist auch eine beleidigung des rechtsstaates; denn der rechtsstaat lebt davon dass es gerade ungeachtet der herkunft keine absolute sicherheit gibt keine absolute freiheit und keine absolute gerechtigkeit das ist die geburtsstunde der toleranz und die demokratie lebt davon dass das ziel demokratisch ist aber auch der zweck und die mittel sie aber haben weder demokratische ziele noch demokratische zwecke und ihr vorschlag zeigt dass sie demokratische mittel überhaupt nicht wollen einer den sie wie ich weiß sehr schätzen nämlich der strafrechtler fischer hat einmal auf folgendes hingewiesen sie argumentieren ja gerne damit dass unser recht so lückenhaft sei : dass es lückenhaft ist ist das prinzip unseres rechtsstaates sonst bräuchten wir damit komme ich zum schluss nämlich nur einen einzigen paragrafen der lautet: das menschliche handeln ist strafbar und wird mit freiheitsstrafe von einem jahr bis lebenslänglich bestraft absatz : für ausnahmen wenden sie sich bitte an die nächste polizeidienststelle genau das ist nicht der staat in dem wir leben wollen deshalb fordere ich alle in diesem land die diesen text lesen können die vielleicht auch zweifel haben die sich besorgte bürger nennen ja selbst die die sie gewählt haben oder die pegida unterstützen auf: herr kollege lindh gucken sie sich das an und bedenken sie herr kollege lindh sie reden jetzt zulasten der redezeit ihres nächsten fraktionskollegen; damit das klar ist ich komme zum schluss : jetzt noch sind es die ausländer und flüchtlinge aber irgendwann werden sie selbst es sein die dieses denken treffen wird vielen dank nächste rednerin ist die kollegin gökay akbulut fraktion die linke
19,19.10.2018,ID195901900,Gökay,Akbulut,DIE LINKE,Gökay Akbulut,sehr geehrter herr präsident liebe kolleginnen und kollegen sehr geehrte damen und herren bei dem gesetzentwurf der afd handelt es sich um einen weiteren rechtspopulistischen angriff auf den rechtsstaat und auf unsere demokratie dieser gesetzentwurf hat einige parallelen zum dritten reich die forderungen verstoßen gegen das grundgesetz gegen die rechtsstaatlichkeit gegen die europäische menschenrechtskonvention sowie gegen die allgemeine erklärung der menschenrechte der vereinten nationen sie zeigen einmal mehr dass sie weder ahnung noch interesse an unserem grundgesetz haben nach diesem entwurf sollen grund- und menschenrechte von geflüchteten und migrantinnen komplett ausgehebelt werden auch wenn sie es nicht wahrhaben wollen: es gibt keinen kausalen zusammenhang zwischen herkunft und strafrechtlichem verhalten laut der kriminalstatistik des innenministeriums ist der anteil an delikten von nichtdeutschen im jahr um prozent zurückgegangen auch bei der kriminalität von geflüchteten ist ein rückgang der zahlen zu verzeichnen was man aber bei der kriminalstatistik ihrer partei nicht behaupten kann derzeit laufen verfahren gegen mandatsträgerinnen und -träger der afd wegen betrug steuerhinterziehung sexueller nötigung beihilfe zu gefährlicher körperverletzung bis hin zu volksverhetzung ihre liste ist sehr lang liebe kolleginnen und kollegen in der allgemeinen erklärung der menschenrechte von heißt es: jeder mensch hat den anspruch auf eine staatsangehörigkeit laut der afd sollen einbürgerungen zu ermessensentscheidungen werden und um ausschlussgründe erweitert werden erschwert werden soll die einbürgerung auch wenn familien bereits strafrechtlich in erscheinung getreten sind die afd will hier die sippenhaft einführen wie im dritten reich sie wollen mit ihren forderungen die staatenlosigkeit fördern und menschen entrechtlichen viele migrationsforscher kritisieren die einbürgerungspolitik in deutschland deutschland bürgert im internationalen und europäischen vergleich wenig menschen ein im vergangenen jahr haben gerade einmal personen die deutsche staatsangehörigkeit erhalten wir brauchen dringend eine einbürgerungsoffensive die linke tritt für ein fortschrittliches staatsangehörigkeitsrecht ein wir fordern die verkürzung der frist für einbürgerungen die senkung der gebühren sowie die abschaffung der einbürgerungstests außerdem sollten einbürgerungen unabhängig vom einkommen erfolgen deutschwerden darf nicht vom geldbeutel abhängen liebe kolleginnen und kollegen in ihrem gesetzentwurf fordert die afd unter anderem dass ausländische straftäter die zu einer haftstrafe von mindestens einem jahr verurteilt wurden und nicht abgeschoben werden können unter deutscher aufsicht in staaten außerhalb der eu untergebracht werden hierdurch sollen sonderrechte geschaffen und menschengruppen externalisiert werden das erinnert uns doch sehr stark an guantánamo oder gar an den madagaskar-plan der nazis die von ihnen geforderte präventivhaft ist die spitze des eisbergs das ist offensichtlich verfassungswidrig mit diesem gesetzentwurf und ihrer law-and-order-politik stellen sie eine gefahr für den rechtsstaat und auch für die innere sicherheit dar ihr entwurf gehört in den papierkorb vielen dank nächste rednerin ist canan bayram bündnis /die grünen
20,19.10.2018,ID195902000,Canan,Bayram,BÜNDNIS 90/DIE GRÜNEN,Canan Bayram,sehr geehrter herr präsident meine damen und herren als ich den gesetzentwurf das erste mal gelesen habe habe ich mich gefragt: ist das ein gesetzentwurf oder kann das weg es ist tatsächlich erstaunlich wie es einem menschen der vorher beruflich in einem bereich eingesetzt war den man nicht geringschätzen sollte gelingt so einen gesetzentwurf zu schreiben dann habe ich mich damit getröstet dass er immerhin kein buch geschrieben hat das was sie hier ausführen ist tatsächlich beachtlich weil sie sich sozusagen den ganzen frust als früherer staatsanwalt der sie ja vor ihrer abgeordnetentätigkeit waren von der seele geschrieben haben sie haben dann das eine mit dem anderen verwurschtelt und am ende ist etwas herausgekommen bei dem sie sich sorgen machen müssen was es über sie aussagt die fachlichkeit haben sie hier komplett über bord geworfen straf- und verwaltungsrecht haben sie durcheinandergeschmissen die statistik da haben sie sich wahrscheinlich an herrn sarrazin orientiert haben sie aus dem hobbykeller und am ende ist etwas herausgekommen mit dem wir uns hier leider ernsthaft beschäftigen müssen ich will mit dem anfangen was die kollegen schon angesprochen haben sie wollen die revision abschaffen aber sie können nicht erklären was sie den menschen stattdessen an die hand geben wollen und wie sie den rechtsschutz den sie damit abschaffen wollen ausgleichen sie wollen beim jugendstrafrecht und beim justizvollzug änderungen vornehmen ohne deutlich zu machen wie sie mit den folgen dieser änderungen umgehen wollen sie haben keine antworten darauf sie haben in ihrer rede gesagt dass die antworten nicht in eine achtminutenrede passen aber offenbar haben ihre antworten auch nicht in den gesetzentwurf reingepasst und da war die zahl der seiten unbegrenzt da hätten sie uns ja informieren können tatsächlich ist es ja so dass sie beim thema migration und einbürgerung und all dem was in ihrer partei so dazu gesagt wird ein stück weit den versuch unternehmen so will ich es ihnen einmal unterstellen das in eine rechtliche form zu gießen die das handhabbar macht aber ich muss ihnen sagen: auch da sind sie kläglich gescheitert es ist ihnen weder gelungen verfassungskonforme regelungen auf den weg zu bringen noch eine handhabbare form dessen hier auf den weg zu bringen die kollegen haben es schon gesagt: soll denn der strafrichter nun auch die arbeit des verwaltungsrichters übernehmen wenn sie das wollen fragt sich: warum eigentlich warum sollen wir etwas zusammenführen was getrennt doch sehr gut gelingt die antwort darauf bleiben sie uns schuldig angesichts der ausländer raus -parolen der afd haben sie ja die anforderungen ihrer partei nicht ganz umgesetzt weil sie nicht so radikal sind wie wir es hier sonst von herrn seitz oder herrn curio gewohnt sind man muss schon sagen: eigentlich ist es ja wünschenswert dass leute die in den bundestag kommen ihre erfahrungen aus den berufen die sie früher ausgeübt haben einbringen bei ihnen als früherem staatsanwalt hätte man hoffnung haben können dass sie hier etwas ordentliches vorlegen aber das ist ihnen nicht gelungen es ist vielleicht eine gewisse ironie des schicksals dass jahre nach gründung der alternativen liste gerade eine grüne ihnen hier bescheinigen muss dass nach ihrem hier vorliegenden gesetzentwurf der rechtsstaat in einer art und weise gefährdet wäre dass selbst wir grüne ihn gegen die afd nicht nur verteidigen müssen sondern auch verteidigen wollen deswegen werden wir diesen gesetzentwurf auf jeden fall ablehnen aber wir sind bereit darüber im ausschuss zu diskutieren nächster redner ist der kollege dr patrick sensburg cdu/csu
21,19.10.2018,ID195902100,Patrick,Sensburg,CDU/CSU,Patrick Sensburg,sehr geehrter herr präsident meine sehr geehrten damen und herren nachdem wir in der letzten woche eine vorlage der afd diskutiert haben in der es um religionspolizei abschaffung des koran oder vielleicht sogar des islam ging das alles konnte man ihr nicht so genau entnehmen haben wir jetzt einen gesetzentwurf über den man wenigstens in der sache diskutieren kann er hat seiten eine vielzahl von punkten ist ausformuliert da hat sich die antragstellung also schon um wesentliches verbessert ich glaube er kommt auch aus einer anderen feder; da scheint es ganz unterschiedliche lager in ihrer fraktion zu geben hierüber kann man reden in der sache muss ich aber viele punkte ansprechen mit denen man wirklich probleme haben muss artikel gg ist angesprochen worden ich freue mich schon auf die überschrift afd will reichsbürger ausweisen und auf die diskussion in ihren reihen; denn sie wollen ja die deutsche staatsangehörigkeit zugrunde legen und von denen wird die sowieso nicht akzeptiert ich höre in ihren reihen gibt es viele die mit diesen damen und herren sympathisieren damit geben sie also das klare signal sie demnächst abschieben zu wollen nachdem sie ihnen flugs die staatsangehörigkeit genommen haben von daher ist das eine interessante wende bei ihnen sie können ja dann noch erklären warum sie so etwas machen und damit der ausbürgerungspolitik der nazizeit inhaltlich folgen ich glaube wir brauchen eine solche regelung nicht das gleiche gilt für die regelung im jugendstrafrecht wir haben regeln die aus meiner sicht dazu haben wir als union schon öfter anträge gestellt von der rechtsprechung nicht hinreichend angewendet werden die regel sollte sein: der - bis ‑jährige wird nach dem erwachsenenstrafrecht beurteilt außer in den fällen wo er die tragweite seiner handlungen nicht erkennen kann das wird in der regel aber inzwischen von der justiz von den gerichten angenommen diesbezüglich haben wir als union immer wieder handlungsbedarf angemahnt unterstützen sie uns also aber schaffen sie die regel nicht gänzlich ab wie in ihrem antrag gefordert das hieße das kind mit dem bade ausgießen so geht es leider eben auch nicht § staatsangehörigkeitsgesetz ist angesprochen worden dass sie jetzt mit der gießkanne der sippenhaft das thema angehen und sagen dass jeder der aus einer auffällig gewordenen familie stammt schon in den blick genommen wird kann doch nicht ihr ernst sein das ist doch keine differenzierte rechts- und justizpolitik auch da geht ihr gesetzentwurf zu weit als hochschullehrer äußere ich eine bitte nehmen sie den vorlesungen nicht die actio libera in causa ein wunderbar in den vorlesungen unter juristen ausdiskutiertes problem: wie handele ich bei teilschuldunfähigkeit § und bei schuldunfähigkeit § stgb dazu gibt es eine dezidierte rechtsprechung ganze bibliotheken an literatur; das ist ausdiskutiert da müssen wir nichts ändern das ist teil der juristenausbildung nehmen sie dies den vorlesungen nicht indem sie eine unklare regelung treffen zum ende zur stpo eine bitte an die bundesregierung an die justizministerin: wir haben in der letzten legislaturperiode eine große stpo-reform versucht sie ist in einzelregelungen stecken geblieben obwohl sich das ministerium zusammen mit einer kommission viel mühe gemacht hat es ist dann nicht zu einem ergebnis gekommen; das ist nun einmal so aber in dieser legislaturperiode müssen wir den großen bereich man kann jetzt nicht sagen: die left-overs noch einmal anpacken daran ob sie die großen themen zeitnah angepackt hat wird auch die justizministerin gemessen werden schafft sie es oder schafft sie es nicht und da ist die stpo-reform wirklich ein großes thema wir müssen das wirklich mit nachdruck angehen und dürfen nicht auf vorlagen der afd warten da ist die ministerin in der verantwortung und ich hoffe sie wird der verantwortung gerecht danke schön jetzt hat das wort konstantin kuhle fdp
22,19.10.2018,ID195902200,Konstantin,Kuhle,FDP,Konstantin Kuhle,herr präsident meine damen und herren nach gut einem jahr im deutschen bundestag macht mich eines immer wieder nachdenklich das ist die tatsache dass es angehörige der sicherheitsbehörden und der justiz gibt polizisten bundespolizisten staatsanwälte leitende oberstaatsanwälte die aufgrund ihrer praktischen erfahrungen frustriert sind die in ihrem täglichen leben und erleben etwa des managements der migrationskrise erfahrungen machen die sie frustriert zurücklassen ich glaube dass alle parteien alle fraktionen im deutschen bundestag sich sehr genau mit den praktischen erfahrungen auseinandersetzen müssen die etwa leitende oberstaatsanwälte staatsanwälte in ihrer täglichen arbeit machen lieber kollege reusch sie haben sich hier so diplomatisch hingestellt und über leichte modifikationen im bereich der strafprozessordnung des strafrechts des verwaltungsrechts gesprochen aber ganz bestimmte punkte nicht genannt vielleicht weil sie es selber besser wissen und das sind die punkte sippenhaft sonderstrafrecht und staatenlosigkeit merken sie eigentlich nicht dass sie all die praktischen erfahrungen die ihre kolleginnen und kollegen bei der staatsanwaltschaft und bei der polizei tagtäglich machen und und die haben vielleicht gute ideen wie wir im deutschen bundestag die gesetze verbessern können beispielsweise indem wir bei abschiebungen die zahl der zuständigen polizeibehörden und ausländerbehörden reduzieren damit das schneller vonstattengeht in den dreck ziehen indem sie sich hier zum anwalt von verfassungswidrigem und von radikalität machen lieber kollege reusch man sollte in den reihen der rechtspopulisten nicht denjenigen einen vorwurf machen die überzeugte rechtsradikale sind und auch nicht denjenigen die es nicht besser wissen aber man sollte denjenigen einen vorwurf machen die sich im gewand der bürgerlichkeit und der biederkeit mit einer solchen radikalität gemein machen da fragt man sich wirklich: wie kann so jemand eigentlich noch in den spiegel gucken das ist der beweis dafür dass es ihnen das hat herr gauland ja in seinem gastbeitrag für die faz beschrieben überhaupt nicht um tatsächliche problemlösung geht sondern um die anstachelung einer gesellschaftlichen debatte und um das durchsetzen eines rassistischen und menschenfeindlichen weltbildes sie sollten sich wirklich selber fragen hier wurden ja viele kolleginnen und kollegen attackiert weil sie beispielsweise kein jura studiert haben oder vielleicht noch jünger an jahren sind : was hätte dieser roman reusch mit anfang am beginn seines jurastudiums davon gehalten einen solchen gesetzentwurf lesen zu müssen hätte er sich nicht möglicherweise dafür geschämt mit einer solchen radikalität konfrontiert zu sein die erfahrungen die die beamtinnen und beamten jeden tag sammeln sollten anlass sein dass wir tatsächlich in der sache miteinander diskutieren aber nicht dass wir frust zur obersten leitmotivation unseres politischen handelns erheben deshalb ist dieser gesetzentwurf in gänze abzulehnen vielen dank nächste rednerin ist die kollegin sonja steffen spd
