,datum,redeID,vorname,nachname,fraktion,name,inhalt_neu
0,,,,,, ,
1,24.03.2022,ID202500100,Robert,Habeck,BÜNDIS 90/DIE GRÜNEN,Robert Habeck,"frau präsidentin, sehr geehrte damen und herren, guten morgen! lieber herr merz, sie haben gestern ihre rede mit der feststellung begonnen, es werde von zeitenwende gesprochen, aber man würde sie nicht sehen. nun, ich möchte für die bundesregierung, aber auch für mein ministerium sagen: man muss blind sein, wenn man sie nicht sieht. wir befreien uns in einer großen geschwindigkeit von der abhängigkeit von russischen fossilen energien, und zwar nicht nur von den fossilen energien, sondern wir kämpfen auch gegen eine infrastruktur, die die abhängigkeit noch vergrößert hat. gazprom besitzt den größten speicher in deutschland. dieser wurde über den letzten sommer geleert, was als vorbereitung diente, um uns in diesem winter zu gängeln. rosneft besitzt eine große ölraffinerie in ostdeutschland. nord stream wurde gebaut. wir haben all das korrigiert oder sind dabei, es zu korrigieren. wenn man das nicht als zeitenwende, als politische sowohl von der qualität wie der quantität, erkennt, dann will man das nicht erkennen. sehr geehrte damen und herren, wenn man sich davon unabhängig machen will, muss man noch für alternativen sorgen. das heißt, wir bauen lng-terminals und kaufen die rohstoffe ein, die wir brauchen, um diese lng-terminals zu betreiben. der qualitative unterschied besteht dabei nicht im herkunftsland, der qualitative unterschied ist, dass wir uns nie wieder in die hand von einem lieferanten alleine begeben wollen. das, was wir machen, ist, die energieversorgung in deutschland breiter aufzustellen und sicherer zu machen. der weg über die gasbrücke wird immer kürzer werden, je höher die preise sind. wir bauen die wasserstoffinfrastruktur auf. wir sorgen dafür, dass der hochlauf bei der wasserstoffwirtschaft stattfindet. dafür bauen wir die erneuerbaren energien nach jahren des stillstandes mit großer dringlichkeit aus; das gleiche gilt für die netze. und wir sorgen für effizienz und einsparung. ich verstehe, warum man darüber so wenig redet; denn das, was man einspart, das sieht man ja nicht. aber es macht keinen sinn, gegen die hohen preise anzusubventionieren, wenn wir nicht den verbrauch reduzieren, wenn wir nicht die effizienz nach vorne bringen. den abschied von den fossilen energien auch durch die reduzierung des verbrauchs mit leibeskräften voranzubringen, das ist das gebot der stunde. wo ich rolf mützenich und britta haßelmann sehe, möchte ich noch sagen: wir hatten eine interessante nacht im koalitionsausschuss, die zu einem guten ergebnis geführt hat. das ergebnis ist gerade im bereich der effizienz vorzeigbar, ja, ich würde sagen, es wird sogar ausrufezeichen setzen, wenn die parteivorsitzenden nachher das ergebnis des koalitionsausschusses vorstellen. so geht eine zeitenwende! so wird eine zeitenwende gemacht! so lösen wir uns aus dem klammergriff, der in den letzten jahren entweder durch unwissenheit oder durch strategische blindheit immer enger um deutschland gezogen wurde. ja, wir sind noch nicht in der lage, ein sofortiges embargo auf kohle, auf öl oder auf gas aus russland zu verhängen. das muss man zugeben, und es ist bitter genug, es zugeben zu müssen. aber dass wir das noch nicht können, heißt nicht, dass wir nichts tun. schritt für schritt sind wir jetzt schon dabei, die abhängigkeit von öl und von kohle und von gas strategisch zu reduzieren. die zahlen, die ich am anfang des krieges genannt habe, sie stimmen jetzt schon nicht mehr. die bundesregierung und die unternehmen dafür bedanke ich mich bei den unternehmen, die mitziehen sind jetzt schon dabei, ein schrittweises embargo umzusetzen. meine damen und herren, natürlich verstehe ich die dringlichkeit, mit der leute sagen: macht doch schneller! vielleicht wäre ein embargo, das jetzt sofort auf alle drei rohstoffe verhängt würde, der gamechanger. vielleicht wäre der krieg in der ukraine dann nach drei, vier tagen zu ende vielleicht aber auch nicht. die indizien sprechen, wenn man sich die russischen aggressionen in den anderen ländern anschaut, die zuvor betroffen waren, eher dagegen. syrien, georgien, der angriff auf die krim und die sanktionen nach der annexion der krim das alles ist jahre her, teilweise über ein jahrzehnt her. wir können also nicht sicher davon ausgehen, dass die maßnahmen, die wir ergreifen könnten, zu einem sofortigen ergebnis führen. deswegen ist die politik der bundesregierung, nicht unbedacht zu handeln, sondern schritt für schritt die voraussetzungen zu schaffen und uns außenpolitisch und sicherheitspolitisch freiraum zu erkämpfen, um dann die maßnahmen, die wir ergreifen, auch durchzuhalten. das ist das gebot der stunde: eine kluge, umsichtige, aber energische politik. vieles von dem, was wir machen, unterstützen wir mit finanziellen aufwendungen, und zwar wenn ich auf den haushalt meines ministeriums schaue mit erheblichen aufwendungen. aber wir sind auch dabei, die überförderung der vergangenheit zurückzufahren. ich habe schon, als wir über die förderung der gebäudesanierung gestritten haben, gesagt, subventionen sind die ultima ratio in einer marktwirtschaft: sie sind notwendig, wenn es die märkte noch nicht gibt, aber da, wo die märkte schon funktionieren, da kann man sie auch zurücknehmen. und ich muss feststellen, dass wir nach jahren unionsgeführter regierung eine übersubventionierung in vielen bereichen haben. teilweise glaubt man wohl, die leute in deutschland würden sich nur noch bewegen, wenn man ihnen einen finanziellen klaps auf den hintern gibt. komisch, dass wir ihnen erklären müssen, wie marktwirtschaft funktioniert! es geht jetzt in dieser situation von hoher inflation und schwächelnder konjunktur durch die krise darum, die kräfte des marktes zu entfalten, und zwar nicht blind zu entfalten, sondern ihnen eine richtung zu geben, sodass verringerung des rohstoffverbrauchs, klimaschutz und unabhängigkeit mit wachstum und wohlstand in diesem land kombiniert werden. das tun wir mit den großen geldern, die meinem haus zur verfügung gestellt werden: mit milliarden euro für den klima- und transformationsfonds und dem grundhaushalt, der ungefähr milliarden euro beträgt. wir investieren in wasserstoff. wir investieren in innovationen. wir investieren in cloud-technologie. wir investieren in die effizienz von antrieben und von gebäuden. so schaffen wir die neuen märkte. so schaffen wir innovation in deutschland, und so schaffen wir wettbewerb um innovation statt darum, wer am längsten im status quo verharrt. meine damen und herren, genau heute vor einem jahr hat das bundesverfassungsgericht ein wegweisendes urteil gefällt. es lässt sich zusammenfassen mit dem satz: wer das klima schützt, schützt die freiheit. so haben die richterinnen und richter damals geurteilt, und es ging wie ein beben durch die politische landschaft. heute, ein jahr nach diesem urteil, muss man übersetzen: wer darum kämpft, sich von den fossilen energien freizumachen, der kämpft für die freiheit. das, sehr geehrte damen und herren, bedeutet zeitenwende. machen wir uns frei von den fossilen energien! erst aus russland, dann insgesamt! so kämpfen wir für die freiheit. so kämpfen wir für die ukraine. für die ukraine! für die freiheit! danke schön. nächster redner: für die cdu/csu-fraktion andreas jung."
2,24.03.2022,ID202500200,Andreas,Jung,CDU/CSU,Andreas Jung,"frau präsidentin! liebe kolleginnen und kollegen! heute vor einer woche hat präsident selenskyj hier zugeschaltet im bundestag gesprochen. er hat gesprochen von bomben und raketen auf wohnungen, auf krankenhäuser, auf kindergärten, auf schulen. er hat gesprochen von nord stream ; er hat in diesem zusammenhang den ausdruck gebraucht, das sei zement für eine neue mauer zwischen freiheit und unfreiheit in europa. er hat an unsere historische verantwortung für die ukraine appelliert. diese worte des frei gewählten präsidenten der ukraine, überfallen von putin mit einem schrecklichen krieg, wiegen schwer. sie treffen unser herz, unser gewissen, und sie dürfen nicht folgenlos bleiben. wir alle müssen uns fragen: was hätten wir früher mehr tun müssen? wie müssen wir jetzt konsequenz zeigen? und: was können wir mehr tun? die antworten sind nicht einfach. aber eines möchte ich mit blick auf die ankündigung putins von gestern, mit blick auf die sanktionierung der russischen zentralbank sagen dabei habe ich das unermessliche leid der menschen in mariupol und an vielen anderen orten in der ukraine vor augen : wir dürfen in dieser situation nicht hinter unsere eigenen beschlüsse zurückgehen und unsere eigenen sanktionen unterlaufen. in einer anderen konstellation, aber auch schweren lage hat helmut schmidt als bundeskanzler gesagt: der staat darf sich nicht erpressen lassen. heute gilt: das freie europa darf sich nicht erpressen lassen. deshalb, herr minister und sehr geehrte damen und herren der bundesregierung, braucht es hierauf jetzt eine klare, eine gemeinsame, eine europäische antwort. diese erwarten wir von den beratungen der nächsten tage. der richtige weg ist, alles zu tun, um von russischen importen bei der energie unabhängig zu werden. herr minister, auf diesem weg haben sie unsere ausdrückliche unterstützung. das ist unser weg. es ist richtig, das jetzt genau so zu tun. ja, dafür haben wir eine gemeinsame grundlage, nämlich den beschluss des bundestages, klimaneutralität bis zu erreichen. dieser wurde nach der entscheidung des bundesverfassungsgerichts von der großen koalition gefasst und nun von der ampel übernommen. jetzt geht es darum, energiesicherheit und klimaschutz zusammenzubringen. deshalb ist es notwendig, den weg, den wir eingeschlagen haben, weiterzugehen, nämlich ausbau der erneuerbaren energien da darf es keinen stillstand geben; dieser muss massiv beschleunigt werden , die steigerung der energieeffizienz, die fortführung der wasserstoffstrategie. das ist die eigentliche antwort, das muss beschleunigt werden. in diesem sinne unterstützen wir auch das oster- und das sommerpaket. wir werden uns die inhalte genau anschauen. wir werden eigene vorschläge machen. aber dieses ziel unterstützen wir. wenn gute vorschläge gemacht werden in dem sinne, wie sie es beschrieben haben, wenn die kraft der natur und die stärke des marktes zusammengebracht werden, dann werden wir das mit überzeugung im bundestag unterstützen. neben oster- und sommerpaket brauchen wir jetzt aber auch ein winterpaket. wir brauchen ein paket zur vorsorge für den kommenden winter. dieses muss kurzfristig auf den weg gebracht werden, und darin müssen wir vorsorge treffen bzw. kurzfristig darauf eine antwort geben: wie könnten wir ohne russische importe über den nächsten winter kommen? das muss jetzt passieren. erstens ist es richtig, dazu alles zu unternehmen, um zusätzliche kapazitäten zu erschließen und bei anderen ländern als russland einzukaufen, in europa und weltweit. das ist der richtige weg. das unterstützen wir. zweitens. es ist richtig, die konsequenzen daraus zu ziehen, dass unsere gasspeicher zu beginn dieses winters nicht gefüllt, sondern zu guten teilen leer waren. der markt hat es hier eben nicht gerichtet, und das wird so lange gelten, wie gazprom prozent der deutschen gasspeicher unter seinem einfluss hat. deshalb werden wir als union morgen im bundestag den entsprechenden gesetzentwurf unterstützen. da gilt es jetzt, konsequenzen zu ziehen. drittens. herr minister habeck, sie haben angemahnt, es müsse auch über einsparungen gesprochen werden. ich sage ihnen: wir sind bereit, wenn sie vorschläge machen, ohne vorfestlegungen mit ihnen über die dinge zu sprechen, die in dieser schweren situation möglich und vertretbar sind. das muss auch ohne vorfestlegung zum bestandteil des winterpakets werden. machen sie vorschläge; wir werden mit ihnen darüber sprechen. die forderung, es dürfe keine denkverbote geben, richtet sich nicht nur an sie, sondern auch wir wollen sie beherzigen. aber viertens richtet sich die forderung eben auch an sie. deshalb ist unsere aufforderung, dass sie das tun, was sie angekündigt haben, nämlich dass sie ergebnisoffen und ohne vorfestlegung prüfen, und zwar auf basis des gemeinsamen bekenntnisses zum kohlekompromiss und zum ausstieg aus der kernenergie, was in dieser situation möglich ist und welche optionen es gibt, also etwa eine modifizierung des stilllegungspfads bei der kohle, aber auch ein möglicher weiterbetrieb der letzten drei verbliebenen kernkraftwerke über den . dezember hinaus. ergebnisoffen und wirklich ohne vorfestlegung das ist unsere erwartung. fünftens. sie haben über eine einigung bei den entlastungen berichtet. zur abfederung der gestiegenen preise muss es mehr geben, als bisher vereinbart wurde. sie haben jetzt über einige dinge diskutiert. wir werden sie bewerten. es muss mehr gemacht werden, um die hohen belastungen von bürgern und betrieben abzufedern. wenn sie gute vorschläge machen, werden wir sie dabei unterstützen. wir haben unsere eigenen vorschläge eingebracht. diese sind nicht so bürokratisch wie das, was bei ihnen diskutiert wird. sie würden sofort und zielgenau wirken. das wäre die basis, um auch hier zusammenzukommen. letzte bemerkung. wenn sie so vorgehen, dann kann gelingen, dass wir so wie bei der sondersitzung vor vier wochen über die grenzen von regierung und opposition zu einem breiteren konsens zusammenkommen. mein fester eindruck ist: in der lage, in der wir sind, würde es unserem land guttun. vielen dank. nächster redner: für die spd-fraktion frank junge."
3,24.03.2022,ID202500300,Frank,Junge,SPD,Frank Junge,"frau präsidentin! liebe kolleginnen und kollegen! in diesen zeiten des verbrecherischen angriffskriegs wladimir putins gegen die ukraine mit all seinen konsequenzen auch für uns, in den zeiten, in denen wir immer noch die folgen der coronapandemie zu bewältigen haben, und in der zeit der generationenübergreifenden existenziellen zukunftsaufgaben braucht es einen staat, der stabilität schafft und handlungsfähigkeit bewahrt. herr jung, genau das verkörpert unser haushalt, den wir in dieser woche diskutieren, und genau das verkörpert der einzelplan vom bundeswirtschaftsminister, den wir heute diskutieren. denn mit ihm stellen wir nicht nur die notwenigen mittel bereit, um die äußere, die innere und auch die soziale sicherheit für unsere bürgerinnen und bürger zu gewährleisten; mit diesem haushalt eröffnen wir auch ein jahrzehnt der investitionen in noch nie dagewesener höhe in den klimaschutz und in die zukunftsfähigkeit unseres landes. zusammen mit den entsprechenden bereichen aus dem energie- und klimafonds herr habeck hat es erwähnt sind es etwa milliarden euro, die in ansatz gebracht werden. sie investieren wir in transformationsprozesse der wirtschaft, und wir unterstützen damit auch nachhaltiges wirtschaftswachstum, um die auswirkungen der coronapandemie wirklich vollständig hinter uns zu lassen. ich finde es dabei überaus erfreulich, dass der einzelplan , der uns jetzt vorliegt, im vergleich zum ersten festgestellten ansatz um , milliarden euro angewachsen ist. allein das ist für mich ein signal dafür, wie bedeutend und wichtig die aufgabe ist und wie ernst die bundesregierung diese herausforderung nimmt. wir werden mit diesen mitteln in die bereiche neue mobilität , digitalisierung und weiterentwicklung der wasserstoffwirtschaft genauso investieren, wie wir innovationsförderung vornehmen werden, hilfe bei unternehmensgründungen leisten werden, die vom kohleausstieg betroffenen regionen unterstützen werden und vor allen dingen auch die strukturschwäche, die wir im land immer noch haben, bekämpfen werden. außerdem sichern wir es wurde erwähnt die gasversorgung, indem wir ausländische bezugsquellen diversifizieren und mit massiven investitionen unsere wirtschaft im land darauf vorbereiten, lng-terminals zu bauen und lng zu nutzen. vor allem werden wir aber den ausbau der erneuerbaren energien forcieren; das will ich hier noch mal ganz klar unterstreichen. denn wenn es uns gelingt, uns von fossilen energieträgern unabhängig zu machen, entziehen wir uns auch dieser verheerenden preissteigerungsspirale, unter der wir gegenwärtig alle leiden. deshalb ist das eine aufgabe mit existenzieller bedeutung auch für die zukünftigen generationen. liebe kolleginnen und kollegen, neben diesen massiven investitionen im rahmen des ekf ich nenne hier noch mal die , milliarden euro zur dekarbonisierung der industrie, ich nenne hier auch noch mal die , milliarden euro für die schaffung von lade- und elektroinfrastruktur, ich nenne hier aber auch die milliarden euro für die energetische gebäudesanierung richtet sich der fokus dieses haushaltes insbesondere auf den innovativen mittelstand. diesen wollen wir stärken und ihm durch gezielte fördermaßnahmen mehr wachstumsimpulse versetzen, um innovation und beschäftigung zu schaffen. ich will hier exemplarisch nennen, dass wir etwa milliarden euro in forschung und entwicklung investieren. wir stellen über milliarde euro für die digitalisierung in diesem bereich zur verfügung; im übrigen ist das ein ansatz, der sich im vergleich zum letzten verdoppelt hat. diesen ansatz flankieren wir zusätzlich mit , milliarden euro aus dem ekf. ich glaube, das sind gut investierte gelder, um unsere wirtschaft auch im digitalen bereich zukunftsfähiger zu machen. darüber hinaus erwähne ich ein neues programm mit einem volumen in höhe von millionen euro, mit dem wir gemeinwohlorientierte kmus unterstützen ein bereich, den es so vorher noch gar nicht gegeben hat. als letztes beispiel will ich nennen, dass wir durch den verstetigten haushaltsplanansatz für die grw eine wichtige größe haben, um bei der strukturschwäche anzusetzen, so wie wir das in den vergangenen jahrzehnten auch getan haben. vor dem hintergrund leistet auch die grw wieder unverzichtbare möglichkeiten zur bekämpfung von strukturschwäche und zur angleichung der lebensverhältnisse. liebe kolleginnen und kollegen herr jung, ich nehme ihr angebot gerne freudvoll zur kenntnis , mit dem vorliegenden haushaltsentwurf haben wir jetzt schon gute möglichkeiten, die weichen in richtung transformation unserer wirtschaft und zukunftsfähigkeit unseres landes zu stellen. ich glaube aber, dass kein entwurf so gut ist, dass er nicht noch verbessert werden könnte. im parlamentarischen verfahren, lieber andreas mattfeldt, liebe andere haushälter, wollen wir uns dem prozess gerne stellen. ich bin gespannt auf unsere zusammenarbeit, und ich freue mich darauf. vielen dank. nächster redner: für die afd-fraktion wolfgang wiehle."
4,24.03.2022,ID202500400,Wolfgang,Wiehle,AfD,Wolfgang Wiehle,"sehr geehrte frau präsidentin! kolleginnen und kollegen! die regierung muss alles tun, um die heutigen krisen in schranken zu halten und die auswirkungen auf die bürger wie auch auf die wirtschaft zu begrenzen. das gegenteil wird jedoch gemacht; und ihr ministerium, herr kollege habeck, spielt hier eine unrühmliche rolle. die etablierte politik leidet unter einer dramatischen selbstüberschätzung, unter einer überschätzung der möglichkeiten, die dieses land hat, aber auch eu-ropa und die westliche welt. das gefährdet unser land, unsere bürger und unsere wirtschaft. die, die nicht so viel haben, spüren es zuerst, und die, die weiterdenken, sagen es zuerst. die harte lockdown-politik in der coronakrise hat viele existenzen zerstört und die staatsverschuldung gewaltig ansteigen lassen. machtpolitische übertreibungen ich nenne nur den namen söder kosten mehr, als wir uns leisten können! jetzt auf den angriffskrieg in der ukraine mit hektischen sanktionen zu reagieren, die uns mehr schaden als der russischen regierung, die sich nun stärker china und indien zuwendet auch das zeigt eine überschätzung dessen, was unser land aushält. wir erleben es jeden tag an den zapfsäulen! es beweist selbsterzeugte not, wenn nun sie, herr minister habeck, nach katar pilgern, um dort um gaslieferungen nachzusuchen. die dortigen regenten sind genauso wenig lupenreine demokraten wie herr putin. deutsche regierungen verschärften diese krisen, und sie setzen ihre ideologische klimapolitik noch obendrauf. eu-ropa glaubt hier, den oberlehrer für die ganze welt spielen zu können, während china weiter kohlekraftwerke baut. die deutsche politik stockt wie besessen die brüsseler vorgaben regelmäßig noch weiter auf. sie von der ampel, aber auch ihre schwarzen sekundanten riskieren den industriestandort deutschland, millionen von arbeitsplätzen und den letzten rest noch verbliebener solidität der staatsfinanzen. es ist krasse selbstüberschätzung, wenn man auf dem weltmarkt der erste sein will, der das epochale hochrisikoprojekt der großen transformation durchziehen will. wachsende summen werden in wasserstoffstrategien in anderen weltregionen wie nordafrika gesteckt. die risiken für die energieversorgung steigen dadurch weiter. solche beträge sind im haushalt an mehreren stellen versteckt, nicht zuletzt im sogenannten energie- und klimafonds. dieser ekf wurde gerade durch den zweiten nachtragshaushalt mit milliarden euro neuen schulden aufgefüllt. vergessen sie nicht: auch das geld im ekf müssen die konsumenten und steuerzahler mühsam erarbeiten! fehlende transparenz ist auch bei vielen förderprogrammen zu beklagen, beispielsweise bei zim und grw. geradezu das gegenteil von transparenz beweist das ministerium bei der förderung effizienter gebäude. der knallharte förderstopp vom . januar hat bei vielen bauherren das vertrauen zerstört. wie die bundesregierung so auf neue wohnungen im jahr kommen will, bleibt ihr geheimnis. die afd-fraktion wird immer transparenz verlangen, vor der selbstüberschätzung der etablierten politik warnen und die interessen der bürger im auge behalten, die sich experimente nicht leisten können und auch nicht wollen. nächster redner: für die fdp-fraktion karsten klein."
