,datum,redeID,vorname,nachname,fraktion,name,inhalt_neu
68,28.04.2022,ID203106800,Christian,Leye,DIE LINKE,Christian Leye,"sehr geehrter herr präsident! meine damen und herren! die energiepreise gehen durch die decke, allein heizöl und kraftstoffe sind um prozent teurer geworden. die jährlichen energiekosten für einen familienmusterhaushalt sind im märz um prozent gestiegen. das sind über euro obendrauf. können sie sich vorstellen, was euro zusätzlich für einen musterhaushalt bedeuten? eines kann ich ihnen sagen: der musterhaushalt verdient nicht so gut wie wir hier, meine damen und herren. schon im februar hatten prozent der menschen draußen im land angst vor der nächsten heizkostenabrechnung. daher sage ich ihnen: der bundestag darf den sozialen sprengstoff nicht unterschätzen, der im anstieg der energiepreise liegt. das konzept die mittelschicht und die kleinen leute zahlen, und oben knallen die sektkorken wird in dieser krise nicht funktionieren. wir brauchen jetzt eine zeitenwende für mehr soziale gerechtigkeit, meine damen und herren! was machen eigentlich andere staaten gegen die hohen energiepreise? in der sonst so wirtschaftsliberalen schweiz gibt es seit jahrzehnten das amt des preisüberwachers, der im extremfall preisvorgaben per verordnung durchsetzen kann. in italien kontrolliert die finanzpolizei die preise für strom, öl und gas, und zwar vom einkauf über die produktion bis zum verkauf. und warum? damit spekulanten keine kasse machen können! und in frankreich reguliert der staat die strompreise. die französische regierung hat den anstieg der energiepreise beim staatlichen stromkonzern auf prozent gedeckelt. zum vergleich: bei uns stiegen die strompreise in der gleichen zeit um prozent. prozent zu prozent, den unterschied merken sie selber, oder? so, und was tut unsere politik gegen die steigenden preise? ein hochbezahlter ex-politiker gab die parole frieren für die freiheit aus. eines sage ich ihnen: er wird nicht frieren, wenn die preise weiter steigen. minister habeck gab energiespartipps und kommentierte: das schont den geldbeutel und ärgert putin . das bundeskartellamt schießt den vogel ab und rät wegen monopolpreisen an autobahntankstellen dazu, zum tanken von der autobahn abzufahren. heidewitzka! vielleicht wäre es die aufgabe des kartellamtes gewesen, monopolpreise zu verhindern, anstatt solche geheimtipps auszuarbeiten. es ist ja ein witz: woanders reguliert die politik die energiepreise, und bei uns werden energiespartipps und durchhalteparolen von gut bezahlten politikern an weniger gut bezahlte haushalte durchgegeben. wir sagen daher: das problem muss bei der wurzel gepackt werden. der staat ist jetzt gefordert, mondpreise bei der energie so weit es geht zu verhindern. das fängt damit an, dass strompreise eben auch an der börse gebildet werden. an der börse gibt es das merit-order-prinzip. wie funktioniert das? das teuerste gaskraftwerk gibt den preis für alle anderen kraftwerke vor. das teuerste kraftwerk gibt den preis für alle anderen, billigeren kraftwerke vor, und das mitten in einer energiepreiskrise. was für ein wahnsinn außer für die kraftwerksbetreiber, für die gerade party ist, meine damen und herren. der freie markt regelt das gerade nicht. deswegen sagen wir: es braucht eine staatliche preiskontrolle. und das geht, wenn man will; denn das gibt es in deutschland schon, und zwar beim netzentgelt. da funktioniert der markt auch nicht, und deswegen kontrolliert der staat die preise. wie macht er das? er lässt sich die betriebskosten auf den tisch legen. dann wird eine profitmarge festgesetzt, die natürlich nicht durch die decke geht. so werden mondpreise verhindert. wenn wir schon ein solches instrument haben, warum wird das dann hier nicht angewandt? wir sagen: deckeln sie die energiepreise jetzt! das wäre vernünftig und gerecht. ich höre hier widerspruch. ich denke, das liegt daran, dass sich das wie eine halbe verstaatlichung anfühlt, weil es ja auch eine halbe verstaatlichung ist. das ist in ordnung, das ist okay. energieversorgung ist daseinsvorsorge. wir merken doch gerade: die liberalisierung der energiemärkte war ein fehler. das ist wie bei den krankenhäusern. das liberalisiert man einfach nicht. wenn die bevölkerung für die topprofite von einigen wenigen so hohe stromrechnungen zahlen muss, dann ist das einfach falsch. wir sagen ihnen: in der krise des kapitalismus hilft nicht noch mehr markt. dann braucht es eine regierung, die sich mutig vor ihre bürgerinnen und bürger stellt und sich mit den konzernen anlegt. so geht gerechtigkeit in der krise. danke schön. vielen dank, herr kollege leye. liebe kolleginnen und kollegen, wir freuen uns, dass wir auch mal wieder einen vertreter des bundesrates unter uns haben. nun bekommt das wort der minister für wirtschaft, innovation, digitalisierung und energie des landes nordrhein-westfalen, professor andreas pinkwart."
69,28.04.2022,ID203106900,Andreas,Pinkwart,,Andreas Pinkwart,"herr präsident! meine sehr verehrten damen und herren! wir diskutieren in dieser aktuellen stunde des deutschen bundestages über die energiepreisentwicklung vor dem hintergrund außergewöhnlicher, schwieriger herausforderungen für das energiesystem in unserem land. unser energiesystem war noch nie so stark herausgefordert wie im moment durch den schrecklichen krieg in der ukraine. deswegen muss sich eine debatte zu energiepreisen natürlich einerseits mit der frage beschäftigen, wie wir insbesondere die einkommensschwächeren haushalte und die energieintensiven unternehmen in dieser schwierigen situation entlasten können. das tut die bundesregierung. sie hat unterschiedliche pakete auf den weg gebracht. der bundesrat hatte darum gebeten. wir sehen, dass die bundesregierung viele wichtige schritte unternommen hat. herr habeck, sie werden heute nachmittag dankenswerterweise mit den mitgliedern der wirtschaftsministerkonferenz über die die energieintensiven unternehmen betreffenden maßnahmen sprechen. dafür sind wir dankbar. hier ist vieles auf dem weg, was kurzfristig hilft, haushalte und unternehmen zu entlasten. das ist dringend notwendig. hier arbeiten wir eng zusammen, meine damen und herren. wir müssen uns in dieser situation, in der auch ein gasembargo drohen könnte schneller als wir das vielleicht bislang befürchteten und voraussehen konnten , andererseits mit blick auf die energiepreise fragen: wie gehen wir mit dem energieangebot um? wie gehen wir mit der energienachfrage um? wie können wir es so gestalten, dass die energiepreise in dieser notsituation nicht noch dramatischer ansteigen? denn da könnte der staat mit allen mitteln, die er mobilisieren könnte, gar nicht gegenhalten. wir müssen uns also fragen: wie können wir die energiequellen schneller diversifizieren? wie können wir neue quellen erschließen? wie können wir in dieser situation den fuel switch von gas zu kohle, zu schweröl und zu anderen energieträgern beschleunigen, gerade hinsichtlich der energieintensiven unternehmen? meine damen und herren, wir haben hier spielräume. wir müssen allerdings auch die genehmigungsverfahren anpassen. auch hier bitten wir die bundesregierung um unterstützung. wenn jetzt das embargo käme, müsste die industrie trotzdem, soweit es ginge, weiterarbeiten können. hier müssen wir innovativ werden. hier müssen wir zusehen, dass das schnell angepasst werden kann. darauf müssen wir uns konzentrieren. dann ist es entscheidend, dass wir den weg zum klimaneutralen ufer überbrücken und gas auf dem weg dorthin durch andere stützpfeiler ersetzen. dafür brauchen wir andere konventionelle energien, von denen wir glaubten, dass wir uns von ihnen schon längst hätten verabschieden können. möglicherweise werden wir diese kurz- und mittelfristig stärker einsetzen müssen. das gilt aus meiner sicht bis ende der -jahre für alle konventionellen energien. ich möchte für die nordrhein-westfälische landesregierung hier bekräftigen: wir wollen möglichst bis abschließend aus der kohle aussteigen; aber bis dahin brauchen wir eine brücke zum klimaneutralen ufer, die auch tragfähig ist. dafür müssen wir alles in den blick nehmen. wir brauchen auch neue stützpfeiler aus erneuerbaren, die schneller ausgebaut werden. das müssen wir beschleunigen. hier unterstützen wir das von herrn habeck vorgelegte osterpaket. wenn wir den ausbau erneuerbarer energien endlich als überragendes öffentliches interesse einordnen, werden wir es einfacher haben, planungs- und genehmigungsverfahren in unserem land durchzuführen und auch endlich das füge ich aus nordrhein-westfälischer sicht hinzu die netze auszubauen. denn bislang ist die offshorewindenergie in nordrhein-westfalen frühestens ab verfügbar. der netzausbau muss, meine sehr verehrten damen und herren, deutlich beschleunigt werden. hier setzen wir auf mutige entscheidungen der bundesregierung. damit der ausbau der erneuerbaren auch ganz lebenspraktisch schneller vorankommt, brauchen wir mehr standardisierung, mehr digitalisierung, mehr manpower in den genehmigungsbehörden. wir brauchen auch viel mehr fachkräfte im handwerk. bundesweit werden mitarbeiterinnen und mitarbeiter im handwerk benötigt, um die energiewende hin zu den erneuerbaren möglich zu machen. hier gilt es, die berufliche qualifizierung, die tätigkeit im handwerk und in anderen bereichen unserer gesellschaft endlich wieder anzuerkennen, damit mehr junge leute dorthin gehen. für mich sind handwerkerinnen und handwerker die klimamacher unserer zeit. wir müssen dafür werben, meine damen und herren, damit wir dort vorankommen. neben der verteuerung der energiepreise sehen wir, dass auch die materialpreise galoppieren und das handwerk und alle anderen bereiche massiv darunter leiden, dass sie gar nicht das material haben, um die energiewende vorantreiben zu können. dies könnte sich noch verschärfen, wenn die energieintensiven unternehmen in deutschland nicht mehr die energie verfügbar haben, um in der grundstoffindustrie und in anderen industrien ihre beiträge zu leisten. wenn wir auch das noch alles importieren wollten, würden wir uns im übrigen ein neues klumpenrisiko an abhängigkeit zulegen. dann wären wir auch nicht mehr so leistungsfähig, und die preise würden explodieren. deswegen möchte ich für die nordrhein-westfälische industrie und auch für die sozialpartner, die sich am vergangenen wochenende noch einmal ganz deutlich zu wort gemeldet haben, mit blick auf ein energieembargo sagen und wir sind der bundesregierung und dem energieminister sehr dankbar; sich in die brandung zu stellen, ist alles andere als selbstverständlich : ein energieembargo zum jetzigen zeitpunkt hieße aus deutscher sicht, dass wir uns stärker belasteten als den aggressor und dass wir uns die möglichkeiten nähmen, all diese umbaumaßnahmen in der notwendigen weise voranzubringen. das würde unserem standort schaden, das würde dem klima schaden. deswegen wollen wir alles unternehmen, um die abhängigkeit vom gas, vom öl, von der kohle weiter zu reduzieren, bevor wir eine solche entscheidung treffen, meine sehr verehrten damen und herren. wir müssen auch auf folgendes achten die bundesnetzagentur arbeitet tag und nacht daran, sich vorzubereiten; auch dafür sind wir dankbar : es könnte sein, dass uns ein solches embargo, ein solcher ausfall der gaslieferungen in den nächsten wochen trotzdem bevorstehen könnte. das würde zu ganz erheblichen friktionen führen. deswegen muss man sich klug darauf vorbereiten. wir müssen uns eng abstimmen, und wir müssen sehen, dass wir uns die brückenpfeiler, die wir brauchen, nicht selber wegschlagen, indem wir das nicht gut organisiert bekommen. wir brauchen eine gesicherte versorgung für eine starke industrie, um beim umbau unseres energiesystems und unserer industrie voranzukommen, mit vereinfachten planungs- und genehmigungsverfahren, mit mehr bereitschaft, in diese bereiche zu investieren, um dann den vorteil der erneuerbaren energien für unser land endlich nutzen zu können. wenn wir sie konsequent ausbauen und dies mit einer entsprechenden wasserstoffwirtschaft verbinden, dann schaffen wir es auch, die energiepreise langfristig stabilisieren zu können. dafür brauchen wir technologie, innovation und investition. das gilt es jetzt klug voranzutreiben, meine sehr verehrten damen und herren. es wird ja immer wieder gefragt: wer ist denn da wie weit gekommen? wir müssen dringend davor warnen, uns der allgemeinen illusion hinzugeben, wir hätten das ziel schon halb erreicht. leider stehen wir, gemessen an unseren sehr ehrgeizigen zielen, erst am anfang. ich will das einmal an wenigen beispielen verdeutlichen: wir haben in nordrhein-westfalen seit den jährlichen photovoltaikausbau vervierfachen können. wunderbar! das wollen wir aber in den nächsten acht jahren noch mal verdrei- bis vervierfachen. zum windausbau ein vergleich zu baden-württemberg, auch ein wichtiges industrieland wie nordrhein-westfalen, aber quadratkilometer kleiner: nordrhein-westfalen hat eine dichtere wohnbevölkerung. trotzdem haben wir in den letzten vier jahren dreimal so viel im bereich wind zugebaut wie baden-württemberg. und wir haben achtmal mehr genehmigungen für die nächsten jahre, die uns vorliegen, als baden-württemberg. meine, damen und herren, wenn wir das alles ernst meinen, dann müssen jetzt auch alle mitmachen, und dann müssen sie sich auch vor ihre bürgerinnen und bürger stellen und auf die notwendigkeit dieser ausbaumaßnahmen hinweisen, sich hinter diese maßnahmen stellen, bund und länder. wir wollen es dem energieminister nicht allzu schwer machen, die ziele zu erreichen. wenn wir sie nicht erreichen, werden wir hier in zukunft ganz andere debatten über energiepreissteigerungen haben. das sollten wir vermeiden. herr minister. hier gilt es jetzt, die ärmel hochzukrempeln. alle müssen dabei verantwortung übernehmen. herzlichen dank für ihre aufmerksamkeit."
70,28.04.2022,ID203107000,Jens,Spahn,CDU/CSU,Jens Spahn,"herr präsident! liebe kolleginnen und kollegen! vielen dank, herr minister pinkwart, dass sie noch mal deutlich gemacht haben: wo die cdu regiert, da geht es mit dem ausbau der erneuerbaren energien voran. vielen dank dafür! zur aktuellen debatte. wir hätten uns übrigens einen politischeren titel der debatte gewünscht, aber bei den titeln der aktuellen stunden ist es leider immer so, dass sie neutral sein sollen. unser titel wäre gewesen: kehrtwende der bundesregierung zu spät, zu wenig, zu bürokratisch . alles drin in dem titel. das träfe es dann ziemlich genau. zu zu spät will ich sagen: wir haben hier auf antrag der union bereits am . februar und am . märz debatten zu den energiepreisen gehabt. ich habe sie noch im ohr, die kollegen mohrs, gremmels und audretsch. heute machen sie zum teil das, wogegen sie vor zwei monaten noch gesprochen haben. ich empfehle ihnen, herr kollege gremmels: denken sie daran, wenn sie hier gleich wieder lautstark reden! sie könnten ihre worte in vier oder sechs wochen wieder ändern müssen, weil sie am ende doch tun, was richtig ist und was wir hier vorschlagen. nachdem sie es vor zwei monaten nicht anerkannt haben, erkennen sie nun endlich an, dass es ein problem bei den energiepreisen gibt, und sie tun etwas immerhin. das ist eine kehrtwende, aber eben zu spät, zu wenig, zu bürokratisch. zu spät ist am ende auch ein problem für die bürgerinnen und bürger. seit vielen wochen und monaten überlegen sich pendler und diejenigen, die heizen, handwerk und mittelstand, wie sie am ende die tankfüllungen und das heizen noch bezahlen können. jede woche später, in der die notwendigen entscheidungen getroffen werden, ist für diese bürgerinnen und bürger, für die breite mitte der bevölkerung, eine woche zu spät an hilfe in dieser schwierigen zeit. deswegen: tun sie endlich, was wir schon seit zwei monaten einfordern, und beschließen sie es hier im deutschen bundestag! es ist zu wenig in der breite und der tiefe. rentner, studenten, handwerk und mittelstand gehen leer aus. viele millionen menschen lassen sie mit den steigenden energiekosten alleine. ja, es ist richtig, dass sie, wie gerade von ihnen angekündigt, etwas für die geringverdiener tun. das ist gut. aber es sind mittlerweile auch die normalverdiener, die breite mitte in deutschland, von diesen starken energiepreisen betroffen. und zu viele davon erreichen sie mit ihren maßnahmen nicht, und das ist ein problem. das ist zu wenig, liebe kolleginnen und kollegen von der ampel. es ist übrigens auch zu wenig in der summe. selbst die euro pauschale kommen ja, weil sie die noch besteuern, bei niemandem als euro an. das muss man einmal dazusagen, weil sie das hier immer so rausstellen. es ist deswegen zu wenig in der breite und in der tiefe, weil sie nicht das problem in den mittelpunkt stellen, die hohen energiepreise, sondern weil sie in der binnenlogik einer ampelkoalition am ende versucht haben, ein paket zu schnüren, wo jeder seine spielwiese hat. wenn sie wirklich die gesellschaft zusammenhalten wollen, dann machen sie das, was richtig ist, und nicht das, was sich aus der binnenlogik einer ampelkoalition ergibt, weil jeder ein bisschen was haben muss. dadurch ist es eben auch zu bürokratisch geworden. der kollege steiniger hat schon darauf hingewiesen: über milliarde euro bürokratiekosten bei der pauschale von euro! wir haben heute morgen über ein belastungsmoratorium für bürokratie diskutiert. auch für die arbeitgeber bedeutet es zusätzlichen aufwand, wenn die pauschale über den lohn mit ausgezahlt werden soll. das ist genau das, was wir heute morgen gemeint haben. in dieser schwierigen zeit ist es eben das falsche, die wirtschaft, handwerk, mittelstand, vor allem die kleinen unternehmen mit zusätzlicher bürokratie für ihre pauschale zu belasten. genau damit so etwas nicht mehr passiert, brauchen wir dieses bürokratiemoratorium, liebe kolleginnen und kollegen. dann ist die frage: was denn stattdessen? ich kann ihnen sagen, was stattdessen: eine entlastung über steuern, über die steuern auf die energie. das wäre der richtige weg gewesen. das wäre schneller gegangen. etwa bei der mehrwertsteuer: streiche , setze ! den gesetzentwurf hätte ich ihnen noch schreiben können. den hätten wir in einer woche hier im deutschen bundestag beschließen können, wenn wir gewollt hätten. der weg über die steuern wäre einfach gewesen, es wäre schnell gegangen, und es hätte vor allem alle erreicht. deswegen bitten wir sie inständig im interesse der bürgerinnen und bürger, von handwerk und mittelstand: gehen sie weg von ihrem paket mit den unterschiedlichsten bürokratischen maßnahmen, die am ende bei vielen gar nicht ankommen, und gehen sie den weg über eine entlastung bei den energiesteuern! denn die kommt bei allen an, die gerade betroffen sind. ein letztes. planbarkeit und bezahlbarkeit sind zwei seiten einer medaille. das sehen wir übrigens gerade auch bei der situation in polen und bulgarien. der stopp der lieferungen von gas führt zu unsicherheit an den gasmärkten und zu steigenden preisen. das tut es unter anderem deswegen, weil es keinen plan gibt. den fordern wir auch seit monaten ein. ich finde das mit insta gut; das ist die kür. ich freue mich auch, wenn die kommunikation da gelingt. ich würde mich nur gelegentlich freuen, wenn auch die pflicht mit dabei wäre, nämlich dass dem deutschen bundestag, diesem parlament, ein konzept vorgelegt wird. übrigens haben sie heute morgen in einem antrag einen ausstiegsfahrplan aus der russischen abhängigkeit beschlossen. das fordern wir seit zwei monaten ein. wenn es diesen fahrplan gäbe, dann könnten sich auch alle marktteilnehmer darauf einstellen, kommen sie bitte zum schluss. und nicht jede kleine verunsicherung durch neuigkeiten würde zu steigenden preisen führen. das ist der entscheidende teil. also legen sie endlich diesen ausstiegsfahrplan vor! auch das beruhigt die preise. vielen dank, herr kollege spahn. nächster redner ist der bereits angesprochene kollege timon gremmels, spd-fraktion."
71,28.04.2022,ID203107100,Timon,Gremmels,SPD,Timon Gremmels,"herr präsident! meine sehr verehrten damen und herren! ich hätte nicht gedacht, dass ich das irgendwann einmal sagen würde: herr spahn, wären sie doch lieber bei gesundheitsthemen geblieben. da hatten sie mehr kompetenz als bei diesem. ich überlege mir noch einmal, ob ich diesen satz nicht zurücknehme. aber ich bin echt sprachlos. vor allem: was wäre geschehen, wenn man ihren forderungen hier gefolgt wäre? herr spahn, ich erinnere nur daran: sie haben gesagt, wir sollten öfter auf die cdu hören. ihr fraktionsvorsitzender, herr merz, hat am . märz gefordert, die gaslieferungen über nord stream sofort einzustellen. was hätte denn das für auswirkungen auf die energiepreise gehabt? das, was sie hier machen, sich hierhinzustellen, ist doch ein doppelzüngiges spiel. sie fordern einerseits dinge, die die energiepreise nach oben getrieben hätten, andererseits fordern sie hier energiepreissenkungen. das ist zynisch, meine sehr verehrten damen und herren. dann fordern sie hier von der bundesregierung ein, sie solle doch endlich handeln, und die solle endlich etwas tun und einen fahrplan erarbeiten, wie wir unabhängig von fossilen energien werden. herr spahn, sind sie denn einmal in den ausschusssitzungen? was macht denn robert habeck tagtäglich, tag und nacht? er macht nichts anderes, als daran zu arbeiten. übrigens waren die schubladen leer, als sie den bundeswirtschaftsminister hier gestellt haben. wo waren denn die schubladen? wo waren denn ihre konzepte? wo war denn der fall, der auch schon früher hätte eintreten können? es war doch nichts da. das muss jetzt diese regierung erarbeiten. jahre hat die cdu die kanzlerin gestellt, und sie tun so, als ob sie mit den letzten jahren nichts zu tun hätten. meine sehr verehrten damen und herren, das ist unredlich. das sage ich ihnen an dieser stelle. diese koalition handelt nicht erst seit dem . februar, sondern wir haben uns schon vorher um steigende energiepreise gekümmert, weil das eine fossile inflation ist, die wir erleben, die verstärkt wurde durch den angriffskrieg russlands auf die ukraine, aber die vorher schon da war. unser erstes entlastungspaket insofern sind wir dankbar für die aktuelle stunde, weil man es darin noch einmal darlegen kann haben wir am . februar, einen tag vor dem angriff russlands, als koalition auf den weg gebracht. ich erinnere mal an die punkte: abschaffung der eeg-umlage zum . juli, die wir gleich beschließen werden, erhöhung der fernpendlerpauschale rückwirkend zum . januar, heizkostenzuschuss für wohngeldempfänger, azubis und studierende, einmalzahlungen für bedürftige, sofortzuschlag für von armut betroffene kinder, höhere grundfreibeträge, erhöhung der werbungskostenpauschale, erhöhung des mindestlohns auf euro, verlängerung des kurzarbeitergeldes, steuerliche erleichterungen für die wirtschaft. dann das zweite entlastungspaket, vom . märz: energiepauschale von euro, einmalbonus von euro zusätzlich für jedes kind, einmalzahlungen von euro für empfänger/-innen von sozialleistungen zusätzlich zu den bereits im februar beschlossenen euro, absenkung der energiesteuer auf kraftstoffe, öpnv-flatrate. das waren konkrete maßnahmen, die die bürgerinnen und bürger spürbar entlasten. ja, es ist alles zu spät, herr spahn, wie sie hier hereinrufen. wissen sie, was zu spät ist? das, was sie die letzten jahre ausgebremst haben, war nämlich die energiewende. hätten wir vorher den turbo bei der energiewende, beim ausbau der erneuerbaren energien gezündet, dann hätten wir heute deutlich preiswertere energie, weil die erneuerbaren energien heute deutlich preiswerter sind. deswegen: das argument zu spät fällt doch auf sie selber zurück, herr spahn. sie haben nicht gehandelt; sie haben hier gebremst und den ausbau verhindert, meine sehr verehrten damen und herren. ansonsten wir haben das jetzt auch bei herrn pinkwart gerade gehört war das ein bisschen wahlkampf nrw; ist okay. aber ich meine: wenn nun die landesregierung von nrw sozusagen beim ranking von bundesländern sagt: es gibt aber ein bundesland, das noch schlechter ist als nrw, und daran orientieren wir uns; das ist baden-württemberg , finde ich das, ehrlich gesagt, ein bisschen wenig. ich hätte mir schon noch gewünscht, herr pinkwart, nachdem sie hier auch herrn habeck gelobt haben zu recht, wie ich finde und gefordert haben, dass man beim osterpaket beim ausbau der windkraft noch einmal nachlegen muss, dass sie vielleicht auch etwas zur ankündigung, meter abstand für windkraftanlagen in nrw zu kassieren, gesagt hätten. das habe ich leider vermisst, meine sehr verehrten damen und herren. sie haben gerade eben vereinfachte planungsverfahren für die transformation in richtung wasserstoff eingefordert. da bin ich sofort bei ihnen. aber wenn wir von vereinfachten planungsverfahren sprechen, dann möchten wir auch vereinfachte planungsverfahren für den ausbau von windkraft, nicht nur in nrw, sondern in ganz deutschland. daran arbeiten wir mit dem osterpaket. dieses land und die menschen sind mit dieser ampelkoalition gut versorgt. wir werden das erfolgreich umsetzen. in diesem sinne: alles gute, und glück auf! vielen dank, herr kollege gremmels. wir sind alle in diesem hause überrascht darüber, dass hier auch wahlkampfreden gehalten werden. das ist völlig ungewöhnlich. nächste rednerin ist die kollegin dr. ingrid nestle, bündnis /die grünen."
