,datum,redeID,vorname,nachname,fraktion,name,inhalt_neu
44,14.02.2019,ID198004400,Frank,Schwabe,SPD,Frank Schwabe,"herr präsident! verehrte damen und herren! auch wenn mehrfach gesagt wurde und ich teile das ausdrücklich , dass es richtig und wichtig ist, dass wir uns mit der lage in deutschland beschäftigen dass das unsere verantwortung vor allem ist, wenn wir über menschenrechte reden , muss man, glaube ich, aufpassen, dass man die dinge nicht durcheinanderwirft und wir uns am ende an einer trivialisierung der schwierigen, wirklich schwierigen medienlage in ungarn, in der türkei, in ägypten und anderen teilen der welt beteiligen, indem wir so tun, als ob wir hier in deutschland keine medienfreiheit und keine pressefreiheit hätten das ist großer unfug. deswegen sollten wir uns daran nicht beteiligen. wir haben es zu tun mit einigen berichten des deutschen instituts für menschenrechte. wir haben uns selber verpflichtet, wir haben selber im gesetz festgelegt, dass das deutsche institut für menschenrechte uns jährlich hier entsprechend berichten soll. ich will noch einmal unterstreichen, was auch andere unterstrichen haben: mit dem deutschen institut für menschenrechte haben wir eine weltweit anerkannte institution. es ist nicht umsonst so, dass das deutsche institut für menschenrechte im internationalen verband der menschenrechtsinstitutionen bis zu diesem jahr die präsidentschaft hatte. es ist, ich will das auch noch einmal unterstreichen, in der tat die zentrale aufgabe nationaler menschenrechts institutionen alles andere wäre ein missverständnis , sich um die lage in dem land zu kümmern, in dem die institution ihren sitz hat. das ist der sinn der veranstaltung: dass sich das österreichische institut, das ungarische, das türkische und andere sich mit der lage im jeweiligen land beschäftigen. und diese berichte sollen natürlich wehtun, na selbstverständlich, die sollen zum nachdenken anregen. das muss so sein. wenn es nicht so wäre, wenn wir alle sagen: och, alles wunderbar , dann wäre irgendetwas falsch an diesen berichten. ich will die direktorin des instituts, frau professor dr. beate rudolf, zitieren. sie hat gesagt: die qualität des menschenrechtsschutzes in einem staat misst sich gerade daran, ob die rechte der schwächsten in gesetzen verankert und auch in der praxis geachtet und geschützt werden. daher greift der menschenrechtsbericht schwere benachteiligungen der rechte von menschen auf, die sich im politischen diskurs hierzulande nur schwer gehör verschaffen können. zum beispiel geht es um migrantinnen und migranten, menschen mit behinderungen, die in einrichtungen sind und dort nicht ordentlich versorgt werden; genau das sind diese schwachen menschen. deswegen ist es gut, dass der bericht über diese menschen redet. ein paar der themen sind hier benannt worden: arbeitsausbeutung von migrantinnen und migranten, zwang in der psychiatrie, aber auch das thema wahlrechtsausschluss von menschen mit geistiger behinderung ; das sind themen, denen sich die berichte des menschenrechtsinstituts widmen. ich will, weil es noch nicht genannt worden ist, das beispiel des zwangs in der psychiatrie herausgreifen. deutschland steht hier international in der kritik, und zwar nicht erst seit kurzem, sondern seit vielen jahren. der un-ausschuss für die rechte von menschen mit behinderungen ist für ein absolutes verbot von zwangsmaßnahmen in der psychiatrie. der europäische gerichtshof für menschenrechte und das bundesverfassungsgericht haben gesagt, dass zwangsmaßnahmen in der psychia trie nur die absolute ultima ratio sein dürfen. das scheint in deutschland schlichtweg nicht der fall zu sein. das sieht man schon daran, dass es in den bundesländern unterschiedliche handhabungen gibt: es gibt eine sehr intensive nutzung des sogenannten unterbringungsverfahrens zum beispiel in schleswig-holstein, aber es wird deutlich weniger stark genutzt zum beispiel in sachsen. deswegen, glaube ich, ist es richtig, sich auch mit solchen fragestellungen zu beschäftigen. deswegen will ich dem deutschen institut für menschenrechte ausdrücklich danken, dass es dieses thema in dem bericht aufgegriffen hat und wichtige hinweise gegeben hat, wie man das ganze ändern könnte. ich will ein zweites thema ansprechen, das heute auch noch keine rolle gespielt hat; das ist das thema des wahlrechtsausschlusses. meine herzliche bitte an den koalitionspartner ist, diese schamvolle angelegenheit, wie ich finde, endlich zu beenden. ich kann mich gut daran erinnern, wie ich im letzten bundestagswahlkampf vor einer haustür gestanden und geklingelt habe. mir hat eine frau geöffnet, die nicht wählen durfte. sie hätte mich wählen wollen. jetzt können sie sagen: na, sehen sie mal! aber es hätte auch jemand ganz anderes sein können. jedenfalls war es vollkommen ersichtlich, wen sie hätte wählen wollen, und sie war tieftraurig, dass sie es nicht konnte. ich war wirklich beschämt darüber, dass wir das nicht hinbekommen haben; dass sie nicht wählen durfte. deswegen: bitte lassen sie uns gemeinsam daran arbeiten, das zu ändern dann wird dieser punkt im nächsten bericht des instituts nicht mehr erwähnt werden müssen. ich will zum schluss eingehen auf das, was hier vielfach angesprochen wurde es ist eine herzensangelegenheit der beauftragten der bundesregierung für menschenrechtspolitik und humanitäre hilfe ; das ist die frage der sozialen rechte. ich glaube, wir dürfen die soziale dimension der menschenrechte wirklich nicht unterschätzen. deswegen ist es gut und richtig, dass wir jetzt die ratifizierung des zusatzprotokolls zum un-sozialpakt auf den weg gebracht haben und dass wir auch die ratifizierung des ilo-übereinkommens zum schutz der indigenen bevölkerung auf den weg bringen gerade zu einem zeitpunkt, wo länder wie brasilien den schutz der indigenen bevölkerung eigentlich mit füßen treten unter einer neuen, rechtsnationalistischen regierung. es ist, glaube ich, ein richtiges zeichen, was hier aus deutschland kommt. auch beim nationalen aktionsplan wirtschaft und menschenrechte ist es wichtig, fortschritte zu machen. auch dort verweise ich auf den koalitionsvertrag. wir haben verabredet, dass wir zu gesetzlichen maßnahmen kommen wollen. deswegen ist es absolut begrüßenswert, dass sich unterschiedliche bundesministerien auf den weg gemacht haben, sich gedanken zu machen, wie man denn dazu kommen kann, dass eine exportnation wie deutschland und die wollen wir zu recht bleiben dafür sorgt, dass das, was wir in der welt produzieren und was wir importieren, unter menschenrechtlich akzeptablen bedingungen hergestellt wird. wir wollen niemanden zu irgendetwas zwingen; aber am ende brauchen wir auch ein level playing field für all die unternehmen, die guten willens sind. deswegen ist es, glaube ich, richtig, sich dort auf den weg gesetzlicher regelungen zu machen. vielen dank. vielen dank, herr kollege schwabe. als nächster redner hat das wort der kollege dr. lukas köhler, fdp-fraktion."
45,14.02.2019,ID198004500,Lukas,Köhler,FDP,Lukas Köhler,"sehr geehrter herr präsident! geschätzte kolleginnen und kollegen! die erste und wichtigste aufgabe des staates ist der schutz vor willkürlicher gewalt. dazu gehört insbesondere die abwesenheit von zwang. aber immer dann, wenn dieser eingriff unvermeidbar ist, dann muss er absolut mit verhältnismäßigkeit und unter größtmöglicher transparenz ausgeführt werden. ich freue mich, dass sie, herr schwabe, das gerade angesprochen haben, und ich freue mich, dass im bericht des deutschen instituts für menschenrechte dieses thema, insbesondere bei psychisch kranken, noch einmal aufgegriffen wird. ich halte es für absolut wichtig und zentral, dass wir immer dann, wenn wir staatlichen zwang anwenden müssen es ist schlimm genug, dass das so passieren kann , die größtmögliche vorsicht walten lassen und dass wir dann auch dafür sorgen, dass die bundesländer die möglichkeiten ausschöpfen, diesen zwang möglichst zu vermeiden und möglichst gut zu begründen. aber, meine damen und herren, wir reden heute ja nicht nur über den bericht des deutschen instituts für menschenrechte, wir sprechen ja über die gesamtaufgabe der menschenrechte, und dazu gehört eben auch die internationale ebene. dabei sticht vor allen dingen der antrag der linken ins auge. man findet einmal mehr einen strauß an forderungen, die sie offenbar für menschenrechtspolitik halten. die friedenssicherung durch die bundeswehr ist ihnen natürlich ein dorn im auge. sie sind genauso gegen die nukleare teilhabe, wie sie gegen die nato sind. beides das ignorieren sie gerne hat in den letzten jahren dafür gesorgt, dass wir hier in frieden und sicherheit leben können. das ist ein punkt, den sie tatsächlich gerne ignorieren. ich weiß nicht, woran es liegt. vielleicht liegt es auch daran, dass sie die aggressive politik aus moskau seit jeher nicht als bedrohung für die menschenrechte, sondern als verheißung sehen, und dabei ähneln sie doch öfter stark den kolleginnen und kollegen im rechten teil des spektrums. herr kollege köhler, erlauben sie eine zwischenfrage aus der fraktion die linke? nein, tue ich nicht. es kommen noch mehr. sie können vielleicht gleich noch mal darauf eingehen. aber wir wissen ja: es ist nicht alles neu, was von dort kommt. ihr autoritärer freundeskreis reicht von moskau über damaskus bis nach caracas. sobald die kumpane das eigene volk unterdrücken, sind sie immer ganz schnell bei irgendwelchen fadenscheinigen ausreden. irgendwie sind die usa immer schuld. da ist ihnen keine rechtfertigung zu peinlich, keine anschuldigung zu platt und keine verschwörungstheorie zu absurd. aber ich hätte nicht geglaubt, dass diese absurdität noch zu steigern ist. ihre menschenrechtspolitische sprecherin, frau nastic, die hier gerade selber geredet hat, möchte nicolás maduro in das programm parlamentarier schützen parlamentarier aufnehmen. das ist an absurdität nicht zu überbieten. das ist ein programm, das oppositionelle vor zwang, folter und gewalt schützen soll, und sie wollen denjenigen, der am härtesten die opposition unterdrückt und der für menschenrechtsverletzungen verantwortlich ist, in dieses programm aufnehmen. das ist eine schande für das programm. ich finde es fürchterlich, dass sie sich trauen, das hier vorzuschlagen. es tut mir leid, das so sagen zu müssen. es täte mir wirklich leid um dieses programm, wenn das passieren würde. meine damen und herren, wir können zu einer gemeinsamen menschenrechtspolitik kommen, die wirklich dafür sorgt, dass wir es schaffen, menschenrechte zu schützen, und das weltweit. das können wir aber nur tun, wenn wir es ohne heuchelei angehen. lassen sie uns gemeinsam daran arbeiten. vielen herzlichen dank. vielen dank, herr kollege dr. köhler. die fraktion die linke hat um eine kurzintervention gebeten, die ich zulasse. bitte, sie haben das wort."
46,14.02.2019,ID198004600,Stefan,Liebich,DIE LINKE,Stefan Liebich,"herr dr. köhler, sie hatten gerade im rahmen ihres wutanfalls gegen unsere partei auch einen abschnitt dabei, in dem es um nukleare teilhabe ging. sie haben gesagt, sie finden es nicht gut, dass wir das kritisieren, weil sie die sicherheit unseres landes gewährleistet. ich glaube, ich bin ein paar tage älter als sie. deswegen bin ich auch schon länger im bundestag, und ich kann mich an die zeit erinnern, als guido westerwelle außenminister der bundesrepublik deutschland war und sich bei der cdu/csu mit seiner forderung durchgesetzt hat, dass die atomwaffen aus deutschland abgezogen werden sollen. das war nicht nur die position der fdp, sondern es war dann die position des gesamten deutschen bundestages. das ist ja einstimmig beschlossen worden. mich würde interessieren, wie es zu der positionsänderung in ihrer partei gekommen ist. herr kollege dr. köhler, sie können jetzt antworten."
47,14.02.2019,ID198004700,Lukas,Köhler,FDP,Lukas Köhler,"eine kurze vorbemerkung. ich glaube, diesen ageism, den sie gerade vorgeführt haben irgendwie auf das alter von kolleginnen oder kollegen einzugehen , würde ich mir sparen. aber ich möchte auf ihre frage eingehen. das, was sie gerne ignorieren, ist das gleichgewicht der kräfte, das international dafür gesorgt hat, dass es nicht zu einer katastrophe gekommen ist. von dieser position brauchen wir nicht abzuweichen; denn diese position haben wir schon immer vertreten. natürlich sind atomwaffen ein problem. natürlich ist es ein problem, dass wir weltweit überhaupt so ein bedrohungspotenzial haben. aber dass sie immer wieder ignorieren, dass sicherheit auch etwas mit gleichgewicht zu tun hat, ist ein fataler fehler ihrer außenpolitik, und das haben sie nie gelöst bekommen. solange sie da keinen punkt setzen, werden sie auch weiterhin meine wutanfälle ertragen müssen, vor allen dingen, wenn sie so einen quatsch fordern, wie es ihre menschenrechtspolitische sprecherin gemacht hat. vielen dank. vielen dank, herr kollege dr. köhler. vielleicht darf ich darauf hinweisen, dass es sinn macht, bei kurzinterventionen die beiträge zu liefern und sich den rest anzuhören. es macht auch aus sicht des präsidiums keinen sinn, dass wir den redner kaum verstehen können, weil die zwischenrufe zu einer amorphen kulisse werden. es fällt mir nicht nur bei ihnen auf; ich habe das auch schon bei anderer gelegenheit gesagt. es macht keinen sinn, dass zwischenrufe herr kollege, wenn sie jetzt nicht damit aufhören, bekommen sie einen ordnungsruf. so einfach geht das. als nächster redner hat der kollege sebastian brehm von der cdu/csu-fraktion das wort."
48,14.02.2019,ID198004800,Sebastian,Brehm,CDU/CSU,Sebastian Brehm,"sehr geehrter herr präsident! liebe kolleginnen und kollegen! zunächst bin ich dankbar, dass wir heute einmal mehr über das thema menschenrechte im deutschen bundestag debattieren, heute über die unterrichtung des deutschen instituts für menschenrechte und dessen jahresberichte und sowie die beiden berichte zur entwicklung der menschenrechtssituation in deutschland für mitte bis mitte . menschenrechte ich glaube, das kann man nie oft genug betonen sind zentrale grundrechte, und diese werden leider in der welt mit füßen getreten. deshalb ist es so wichtig und auch richtig, diese themen so oft wie möglich hier im bundestag in öffentlicher sitzung zu diskutieren und immer wieder darauf aufmerksam zu machen: menschenrechte sind universell und unteilbar. liebe kollegin nastic, wenn sie die menschenrechte in gute und schlechte menschenrechte einteilen, dann schaden sie damit der diskussion um menschenrechte in der welt. deswegen glaube ich, dass immer wieder betont werden muss: so wie sie argumentieren, schaden sie den menschenrechten in der welt. menschenrechte sind unteilbar, für alle gültig und universell. wir müssen uns unermüdlich dafür einsetzen, dass auf der ganzen welt die menschenrechte eingehalten werden. das ist für uns auftrag und verpflichtung zugleich. aber es ist natürlich unser zentrales ziel, auch in deutschland die menschenrechte aller menschen zu achten. deshalb ist eine selbstkritische haltung notwendig und richtig. die zentrale aufgabe in deutschland bleibt es vor allem, diskriminierung, antisemitismus und fremdenfeindlichkeit zu bekämpfen, entwicklungen zu beobachten und gegebenenfalls politisch zu reagieren. hier gibt es immerwährenden handlungsbedarf. der jahresbericht enthält einen wichtigen punkt für die diskussion. gerade in der politischen und gesellschaftlichen auseinandersetzung vor allem im netz werden die wortwahl und die art der auseinandersetzung härter und rücksichtsloser. das hat man auch in der debatte heute ein stück weit gemerkt. ich darf aus dem jahresbericht zitieren und kann das nur in aller entschiedenheit unterstreichen: die verrohung der gesellschaftlichen auseinandersetzung mit dem ziel, die grenzen des sagbaren immer weiter zu verschieben und die spaltung der gesellschaft voranzutreiben, greift auch die grundlagen der demokratischen gesellschaft als ganzes an. deswegen bedarf dieses thema meines erachtens einer viel intensiveren betrachtung und einer höheren aufmerksamkeit. wenn wir die einzelthemen in den berichten über die entwicklung der menschenrechtssituation in deutschland betrachten, sollten wir aber vermeiden, unser land schlechtzureden. denn unser land ist weltweit vorbild beim thema menschenrechte. auch hier kommt es auf die sprache an. mir ist die analyse in den berichten leider zu ungenau. der bericht informiert nicht über die aktuelle lage in teilpunkten ich werde im einzelnen darauf eingehen , sondern suggeriert auch meiner meinung nach aus politischen erwägungen heraus ein falsches bild. ich möchte das an einem beispiel aus dem berichtszeitraum juli bis juni festmachen. die überschrift eines der schwerpunktthemen lautet: schwere arbeitsausbeutung und die lohnansprüche betroffener migrantinnen und migranten in deutschland. diese überschrift prägte dann auch die schlagzeile in den berichterstattungen der medien. und im überblick wird allgemein festgestellt ich zitiere noch mal : um arbeitsrechtliche standards zu umgehen, bedienen sich arbeitgeberinnen und arbeitgeber offensichtlich rechtswidriger praktiken wie vorenthalten von lohn, drohungen und zwang. liebe kolleginnen und kollegen, hier findet aus meiner sicht keine notwendige differenzierung statt, sondern eine nicht zutreffende pauschalisierung. ich möchte dies auch an zahlen festmachen. leider das ist realität gibt es schwarze schafe. das zeigen die zahlen der finanzkontrolle schwarzarbeit oder die lückenlosen prüfungen der sozialversicherung. im jahr sind verfahren eröffnet worden, davon wegen mindestlohnfragen. selbstverständlich müssen die kontrollen auch weiterhin engmaschig sein. aber die allgemeine these im bericht, die pauschal gefasst ist, stützt sich auf interviews mit migrantinnen und migranten und telefonische interviews mit rechts- und sozialwissenschaftlern. mit dieser geringen datenbasis die gesamte deutsche wirtschaft zu diskreditieren, geht aber aus meiner sicht weit über das ziel hinaus. laut der bundesagentur für arbeit gingen im dezember , millionen ausländer einer sozialversicherungspflichtigen beschäftigung nach. von lediglich interviews auf alle arbeitgeberinnen und arbeitgeber von , millionen ausländischen beschäftigten zu schließen und sie in dieser weise darzustellen, ist unredlich. deswegen wünsche ich mir ich komme zum schluss für die künftigen berichte, insbesondere bei solchen behauptungen, eine tiefergehende datenbasis, und die politische bewertung sollte hier im parlament erfolgen. herzlichen dank. vielen dank, herr kollege. als nächster redner erhält das wort der kollege kai gehring von bündnis /die grünen."
49,14.02.2019,ID198004900,Kai,Gehring,BÜNDNIS 90/DIE GRÜNEN,Kai Gehring,"herr präsident und frau präsidentin! liebe kolleginnen und kollegen! sehr geehrte damen und herren! deutschland als demokratie und rechtsstaat muss weltweit für die wahrung der menschenrechte einstehen, eine menschenrechtsbasierte außenpolitik betreiben und ekla tante menschenrechtsverletzungen überall anprangern. das sind wir den betroffenen menschen, aber auch der allgemeinen erklärung der menschenrechte und unserem grundgesetz beide feiern ihr . jubiläum so etwas von schuldig! denn: alle menschen sind frei und gleich an würde und rechten geboren . das muss überall gelten. wenn wir weiterhin weltweit glaubwürdiger akteur für menschenrechte sein wollen, dann müssen wir im inland anfangen und auch vor der eigenen haustür kehren. daher ist es richtig, dass heute die menschenrechtslage in deutschland thema dieser debatte ist. das heißt, selbstkritisch sein, sich den spiegel vorzuhalten und vorhalten zu lassen und auch unbequem zu sein so unbequem wie auch das dimr, unser deutsches institut für menschenrechte. daher danke auch von unserer gesamten fraktion für die großartige arbeit, die es leistet, und für die menschenrechtsberichte. wir haben das große glück, hier in einer freien gesellschaft zu leben, aber vieles liegt auch im argen. vier beispiele dafür: zu recht werden wir von anderen staaten auch im upr-verfahren besorgt nach dem wachsenden rassismus in deutschland gefragt. ja, die gruppenbezogene menschenfeindlichkeit hierzulande ist beschämend. fremdenfeindlichkeit, rassismus, antisemitismus, antiziganismus, homophobie und sexismus gehören in unserem rechtsstaat klar bekämpft. hier erwarte ich auch mehr von der bundesregierung. aktive menschenrechtspolitik und verfassungsschutz heißen, ausgrenzung und diskriminierung keinesfalls zu dulden; denn jeder mensch ist gleich an rechten und gleichwertig. shrinking spaces besorgen uns alle, wenn also von autokraten im ausland freiräume der zivilgesellschaft massiv eingeschränkt werden. in einem rechtsstaat hängt die förderung von ngos nicht von willkür und wohlgefallen regierender parteien ab. wenn hierzulande parteien in kampagnen oder deutsche kabinettsmitglieder die arbeit deutscher ngos, allen voran von seenotrettern und umweltverbänden wie der deutschen umwelthilfe, attackieren und drohen, deren gemeinnützigkeit abzuerkennen, dann ist das menschenrechtlich verheerend. es ist ein sündenfall, ngos so dermaßen in den rücken zu fallen. unsere menschenrechtspolitik ist dann besonders glaubwürdig, wenn sie auch hierzulande vorbildlich ist. dies gilt für die tatsächliche umsetzung der un-kinderrechtskonvention. wir sagen: kinderrechte gehören endlich in das grundgesetz. das begründet das dimr in seinen berichten überzeugend. in vielen landesverfassungen wie der in nrw sind sie längst verankert. deshalb: endlich kinderrechte in unser grundgesetz! dies gilt ebenso für die umsetzung der un-behindertenrechtskonvention in deutschland; denn auch inklusion ist ein menschenrecht. hierzu liefert das dimr im rahmen seiner monitoringberichte wertvolle beiträge und hinweise. das zeigt: das dimr ist sehr leistungsfähig, international anerkannt und ein kraftvoller akteur. ich würde mir wünschen, dass wir uns in der nächsten debatte gemeinschaftlich gedanken machen, wie man das deutsche institut für menschenrechte noch mehr strukturell und finanziell stärken und profilieren kann, auch im internationalen vergleich. kollege gehring, achten sie bitte auf die zeit! die deutsche menschenrechtsarchitektur gehört gestärkt und ganz klar weiter profiliert. deswegen freue ich mich auf die nächste debatte. das wort hat der kollege martin patzelt für die cdu/csu-fraktion."
