,datum,redeID,vorname,nachname,fraktion,name,inhalt_neu
38,19.10.2018,ID195903800,Gyde,Jensen,FDP,Gyde Jensen,vielen dank herr präsident liebe kolleginnen und kollegen was im april galt herr braun das gilt immer noch dieser antrag der afd-fraktion ist nichts als ein feigenblatt für ausgrenzung von religionsgemeinschaften die spaltung kommt noch herr gauland christenverfolgung wird in ihrem antrag einseitig als problem islamischer staaten deklariert damit zerstören sie das prinzip der gleichwertigkeit aller glaubensgemeinschaften meine damen und herren in diesem antrag steht dass christen geschützt werden sollen dem stimmen wir als freien demokraten natürlich definitiv zu die wirkung des antrags der afd-fraktion ist allerdings eine ganz andere religionen werden hier gegeneinander ausgespielt das ist ihr ziel unser ziel ist das nicht wer religionen gegeneinander ausspielt schadet allen religionen auch dem christentum für die afd-fraktion geht es bei diesem thema nicht um den schutz vor verfolgung; es geht um die ausgrenzung von muslimen genau so verstehen sie eben auch menschenrechte: für die einen gelten sie ein bisschen mehr für die anderen ein bisschen weniger im gegensatz zu ihnen bin ich fest davon überzeugt dass uns in diesem hohen hause gerade der glaube an die gültigkeit der menschenrechte und daran dass diese für alle gleichermaßen gelten einen sollte wenn ich ihren antrag lese muss ich feststellen: sie scheinen das konzept von menschenrechten vorsätzlich falsch verstehen zu wollen als vorsitzende im ausschuss für menschenrechte und humanitäre hilfe habe ich schnell eines gelernt: die art wie sie politik machen hat methode was sie machen ist eigentlich nichts anderes als gesellschaftliche brandstiftung ich möchte ihnen gern noch mal erklären warum das so ist im politischen streit darf es nie um das ob von menschenrechten gehen niemand in diesem haus darf ernsthaft die these aufstellen dass menschenrechte für bestimmte gruppen mehr oder weniger gelten es gibt keine menschenrechte light es gibt auch keine menschen erster und zweiter klasse ihr auftreten an dieser stelle ist ein ausgewiesenes beispiel für die demagogie die sie in die gesellschaft tragen wollen das hat auch nichts mit schlechter kinderstube zu tun vielmehr entscheiden sie sich bewusst für provokation um jeden preis wir müssen hier viel mehr darüber reden wie menschenrechte zur geltung gebracht werden können da ist noch viel zu tun: international national doch während wir hier über die akzeptanz von vielfalt sprechen versuchen sie nur und jetzt kommt es herr gauland zu spalten sie können gerne bullshit-bingo spielen; es ist trotzdem wahr menschenrechte sind nicht an bedingungen geknüpft sie müssen nicht verliehen werden sie sind für alle gleich und sie sind unveräußerlich das hat herr gehring von den grünen ebenfalls gesagt genau aus diesem grund fordert das grundgesetz nicht: die würde des menschen darf nicht angetastet werden vielmehr steht dort: die würde des menschen ist unantastbar jeder der menschenrechte anrührt verletzt sie zu menschenrechten kann man daher auch keine meinung haben entweder man achtet sie und liegt richtig oder man achtet sie nicht und liegt falsch der deutsche bundestag sollte auf dem boden der verfassung auf dem boden von rechtsstaatlichkeit ein zeichen gegen jedwede religiöse gewalt setzen wir sind in der einzigartigen position so viel für menschenrechte tun zu können für den schutz von leben für religionsfreiheit für freiheit und menschenrechte weltweit mit diesem antrag machen sie von der afd-fraktion sich zu einer unheiligen sammlung von biedermännern und brandstiftern das ist ein buch von max frisch das sollten sie vielleicht auch mal lesen vielen dank nächster redner ist sebastian brehm für die fraktion cdu/csu
39,19.10.2018,ID195903900,Sebastian,Brehm,CDU/CSU,Sebastian Brehm,sehr geehrter herr präsident liebe kolleginnen und kollegen liebe vertreterinnen und vertreter der kirchen und glaubensgemeinschaften sehr geehrte gäste auf den zuschauertribünen ich glaube an gott den vater den allmächtigen den schöpfer des himmels und der erde und an jesus christus seinen eingeborenen sohn unsern herrn … in nordkorea wird man wegen dieses glaubensbekenntnisses als feind des regimes in ein arbeitslager gesperrt gefoltert und zu schwerer zwangsarbeit gezwungen in afghanistan betreiben selbsternannte glaubenswächter lynchjustiz und gerichte verhängen todesurteile beim bekenntnis zu einer anderen religion als dem islam in indien wollen extremistische hindus ihr land von christen und muslimen säubern dabei wird zu oft weggeschaut teilweise herrscht sogar straffreiheit liebe kolleginnen und kollegen das sind nur drei traurige beispiele religiös verfolgter menschen weltweit als mitglieder der cdu/csu-fraktion und als christen fühlen wir uns natürlich den christen in der welt ganz besonders verbunden dennoch sind die menschenrechte nicht exklusiv sondern universell und gelten damit für alle für die verfolgung der christen ist laut open doors der islamische extremismus die haupttriebkraft deshalb ist es das muss man in einer solchen debatte auch ansprechen umso bedauerlicher dass in der kairoer erklärung der menschenrechte der organisation der islamischen konferenz keine notwendige abgrenzung vorgenommen wird auch in unserem land müssen wir die aktuellen entwicklungen genau anschauen das muss man in so einer debatte auch ansprechen aber die beispiele insbesondere von nordkorea und indien zeigen dass keineswegs nur islamistisch und islamisch geprägte länder für die einschränkung der religionsfreiheit besonders für christen verantwortlich sind das wäre unsachlich einseitig und viel zu kurz gegriffen als cdu/csu-fraktion ist es unsere tiefste überzeugung dass religionsfreiheit das zentrale grund- und menschenrecht ist welches die würde des menschen in den mittelpunkt rückt liebe deinen nächsten wie dich selbst das betrifft eben jeden das betrifft den nächsten den christen den moslem den nichtgläubigen den hindu die bahai den jesiden alle menschen in unserem land das ist unsere tiefe grundüberzeugung überall wo das zentrale menschenrecht der religionsfreiheit eingeschränkt wird gibt es keinen frieden gibt es keine demokratie keine rechtsstaatlichkeit und kein recht auf gedanken- und gewissensfreiheit liebe kolleginnen und kollegen der ökumenische bericht zur religionsfreiheit von christen weltweit der deutschen bischofskonferenz und der ekd aus dem jahr weist darauf hin dass von staaten das zentrale menschenrecht auf religionsfreiheit teilweise sogar erheblich einschränken deshalb dürfen wir nicht wegschauen deshalb müssen wir aktiv werden und wir sind es; wir handeln insbesondere mit unserem antrag setzen wir heute ein wichtiges zeichen für die förderung der vernetzung der kirchen und glaubensgemeinschaften weltweit für bilaterale gespräche und multilaterale dialogformen die religiösen akteure die heute bei uns zu gast sind gehören zu den wichtigsten zivilgesellschaftlichen kräften weltweit es ist wichtig eine systematische erhebung religionsspezifischer daten vorzunehmen und anschließend eine vernetzung durchzuführen um hunger elend ungerechtigkeit und fluchtursachen wirksam zu bekämpfen und frieden zu schaffen das ist der wesentliche punkt unseres antrags es freut mich sehr liebe vertreterinnen und vertreter der glaubensgemeinschaften dass sie heute bei dieser debatte anwesend sind das ist ein starkes zeichen gegen jegliche art von extremismus ein starkes zeichen für freiheit und verantwortung und ein starkes zeichen für religionsfreiheit weltweit herzlichen dank für ihre aufmerksamkeit liebe kolleginnen und kollegen der raum füllt sich langsam für die gleich anstehende namentliche abstimmung ich bitte alle die unterhaltungen so zurückhaltend zu führen dass der letzte redner dieser debatte nicht beeinträchtigt wird das ist dr heribert hirte für die fraktion der cdu/csu
40,19.10.2018,ID195904000,Heribert,Hirte,CDU/CSU,Heribert Hirte,herr präsident liebe kolleginnen und kollegen vor allen dingen aber: liebe vertreter der religionsgemeinschaften auf der tribüne liebe zuhörerinnen und zuhörer sie sehr geehrte damen und herren auf der tribüne stehen seit vielen jahren im austausch mit dem stephanuskreis der cdu/csu-bundestagsfraktion einem freiwilligen zusammenschluss von vielen abgeordneten meiner fraktion der sich bereits vor acht jahren gegründet hat um als sprachrohr für bedrängte und verfolgte christen in der ganzen welt da zu sein es war eine initiative von volker kauder mit der er sich in so vorbildlicher weise für die religionsfreiheit und insbesondere für die verfolgten christen in der ganzen welt eingesetzt hat und das seit vielen vielen jahren ich möchte auch daran erinnern dass es volker kauder war der sich für die resolution zum völkermord an den armeniern eingesetzt hat die ja umstritten war und am ende die zustimmung fast des ganzen hauses bekommen hat der handschlag zwischen volker kauder und cem özdemir ist durch die medien gegangen auch dafür nochmals herzlichen dank religionsfreiheit wir haben es schon mehrfach gehört ist ein zentrales vielleicht sogar das zentrale grund- und menschenrecht denn wenn die religionsfreiheit verletzt oder gefährdet wird stehen auch andere grundrechte wie die meinungs- die presse- die versammlungsfreiheit oder die gleichbehandlung von mann oder frau unter druck deshalb ist der einsatz für die religionsfreiheit für uns immer auch ein einsatz für andere wichtige grund- und menschenrechte wenn man dann in unserem kleinen handbuch nachsieht welche religiöse affinität die kollegen von der afd-fraktion haben und feststellt dass fast prozent keine angabe zur religionszugehörigkeit machen dann weiß man dass das was sie hier machen nicht etwa das ist was der kollege ruppert fordert wenn er von respekt vor der religiosität redet sondern die missachtung ebendieser grund- und menschenrechte wir setzen uns für christen ein aber wir tun dies nicht exklusiv sondern exemplarisch hat der katholische erzbischof schick so schön formuliert mein kollege michael brand hat dies eben noch einmal gesagt diese überlegung finden sie in unserem antrag wieder in den vergangenen vier jahren in denen ich unseren stephanuskreis geleitet habe habe ich deshalb den fokus nie allein auf die christen gelegt sondern immer auch andere religiöse minderheiten in den blick genommen es ist zu betonen dass in pakistan neben den christen auch die ahmadiyya-moslems verfolgt sind eine ganz ähnliche lage treffen wir in indien myanmar und china an nochmals meine vorrednerin hat es eben gesagt : in diesen ländern gibt es keine muslimischen mehrheiten sondern atheistische buddhistische oder hinduistische mehrheiten die aleviten stehen im übrigen auch unter druck weil sie von vielen moslems nicht als richtige moslems angesehen werden und dass der streit zwischen sunniten und schiiten im nahen osten ein streit innerislamischer natur ist ist allgegenwärtig nicht selten stehen auch christen gegen christen ich denke nur an nordirland deshalb müssen wir vorsichtig sein bei den verhandlungen um den brexit aus ganz aktuellem anlass möchte ich an die ukraine erinnern wo die loslösung der dortigen kirche vom moskauer patriarchat ganz bewusst nicht als religiöse entscheidung zu werten ist wir vom stephanuskreis haben die ukrainischen bischöfe hier gehabt und sie in diesem bestreben unterstützt der entscheidende punkt ist schon mehrfach gesagt worden: ein ganz besonderes augenmerk ist darauf zu legen dass staaten religion nicht für ihre zwecke instrumentalisieren dürfen denn die religionsfreiheit wird bedroht von nationalismen die ihre nation mit einer bestimmten religion verbinden und andere religionen als ausländisch fremd und unpatriotisch abtun das müssen wir bekämpfen und daran wollen wir gemeinsam arbeiten deshalb: stimmen sie unserem antrag zu herzlichen dank da weitere wortmeldungen nicht vorliegen schließe ich jetzt die aussprache wir kommen zu den abstimmungen zunächst über den antrag der fraktionen der cdu/csu und spd auf drucksache / mit dem titel menschenrecht auf religionsfreiheit weltweit stärken wir stimmen über diesen antrag auf verlangen der fraktionen der cdu/csu und spd namentlich ab ich möchte aus gegebenem anlass weil sich gestern einige kollegen bei der stimmabgabe verspätet hatten darauf hinweisen: aufgrund einer eindeutigen festlegung des präsidiums ist eine nachträgliche stimmabgabe nicht möglich wenn ich nachher die abstimmung schließe dann können sie ihre stimmkarte wenn sie sie noch nicht abgegeben haben wieder ins fach zurücklegen aber nicht mehr nachträglich hier beim präsidium abgeben diese möglichkeit gibt es nicht mehr ich bitte nunmehr die schriftführerinnen und schriftführer ihre plätze einzunehmen sind die plätze an den urnen besetzt dann eröffne ich die erste namentliche abstimmung und zwar über den antrag der fraktionen der cdu/csu und der spd haben alle mitglieder des hauses ihre stimmkarte abgegeben dann schließe ich die abstimmung und bitte die schriftführerinnen und schriftführer mit der auszählung zu beginnen wir werden ihnen das ergebnis der auszählung später bekannt geben jetzt kommen wir zur zweiten abstimmung sie betrifft den antrag der fraktion bündnis /die grünen auf drucksache / mit dem titel einsatz für religions- und weltanschauungsfreiheit weltweit verstärken die fraktion bündnis /die grünen verlangt namentliche abstimmung ich bitte die nächste gruppe der schriftführerinnen und schriftführer die vorgesehenen plätze einzunehmen sind an allen abstimmungsplätzen urnen vorhanden und genügend schriftführer anwesend das ist der fall dann eröffne ich die abstimmung über den antrag der fraktion bündnis /die grünen ist noch ein mitglied des hauses anwesend das seine stimme noch nicht abgegeben hat ich sehe keine reaktion dann schließe ich die abstimmung und bitte die schriftführerinnen und schriftführer auch bei dieser abstimmung mit der auszählung zu beginnen wir werden ihnen das ergebnis später mitteilen wir kommen jetzt zur dritten abstimmung über die beschlussempfehlung des ausschusses für menschenrechte und humanitäre hilfe zu dem antrag der fraktion der afd mit dem titel christenverfolgung stoppen und sanktionieren der ausschuss empfiehlt in seiner beschlussempfehlung auf drucksache / den antrag der fraktion der afd auf drucksache / abzulehnen die fraktion der afd verlangt namentliche abstimmung es geht also hier darum dass über die ausschussempfehlung ablehnung des antrages abgestimmt wird nicht über den antrag selbst ich bitte die schriftführerinnen und schriftführer die vorgesehenen plätze einzunehmen sind alle plätze besetzt das ist der fall dann eröffne ich die abstimmung über die beschlussempfehlung des ausschusses zum antrag der afd
41,19.10.2018,ID195904100,Pascal,Meiser,DIE LINKE,Pascal Meiser,vielen dank sehr geehrter herr präsident liebe kolleginnen und kollegen wenn es um die eigenen mitarbeiterinnen und mitarbeiter geht nimmt michael o’leary der chef der billigfluglinie ryanair kein blatt vor den mund ich darf zitieren: heute müssen unternehmen-chefs sagen unsere beschäftigten sind unser wichtigstes asset was für ein schwachsinn die beschäftigten sind unser größter kostenblock und viele sind so faul dass wir sie ständig in den hintern treten müssen ich finde dieses zitat lässt tief blicken und ich finde eine solche arbeitnehmerfeindliche haltung hat in einer sozialen marktwirtschaft die diesen namen verdient nichts aber auch gar nichts verloren liebe kolleginnen und kollegen in den letzten wochen habe ich viele persönliche gespräche mit flugbegleiterinnen und piloten geführt die hier in deutschland leben und täglich von deutschem boden aus ihren dienst für ryanair antreten das kann ich ihnen allen nur sehr empfehlen wenn sie es noch nicht selbst getan haben; denn die geschichten die diese menschen zu erzählen haben sind erschreckend fast prozent der in deutschland stationierten flugbegleiterinnen sind bei einer dubiosen irischen leiharbeitsfirma angestellt nicht selten mit armutslöhnen in vollzeit von unter euro im monat versetzungen quer durch europa von heute auf morgen und ohne jegliche mitbestimmung sind an der tagesordnung was das für junge familienväter und -mütter bedeutet können sie sich sicher leicht ausmalen auch beim kündigungsschutz verstößt das unternehmen systematisch gegen geltendes deutsches recht wer sich mehr als dreimal krankmeldet wird nicht selten zum personalgespräch nach irland zitiert und riskiert seinen job zu verlieren die folge: flugbegleiterinnen und piloten steigen krank ins flugzeug anstatt sich auszukurieren das alles auch zulasten der sicherheit der passagiere milliarden euro gewinn hat ryanair mit diesem geschäftsmodell im letzten jahr gemacht milliarden euro liebe kolleginnen und kollegen natürlich übt ein solches geschäftsmodell druck auf die gesamte flugverkehrsbranche aus geraten löhne und arbeitsbedingungen auch bei anderen flugunternehmen unter druck ich kann nur sagen: ich finde es ist eine riesensauerei was da bei ryanair passiert liebe kolleginnen und kollegen ich frage mich schon warum aufsichtsbehörden und regierung diesem treiben schon so lange tatenlos zusehen umso beeindruckender finde ich dass die flugbegleiterinnen und piloten sich jetzt gemeinsam gegen diese zustände wehren und ja dass sie quasi aus notwehr jetzt auch für ihre rechte streiken diese mutigen frauen und männer einige von ihnen sind heute hier auf der tribüne zu gast fordern nicht mehr und nicht weniger als respekt für die eigene arbeit löhne von denen sie leben können und arbeitsbedingungen die nicht krankmachen das ist doch wohl nicht zu viel verlangt liebe kolleginnen und kollegen und sie kämpfen für einen betriebsrat denn das betriebsverfassungsgesetz sieht für das fliegende personal und nur für dieses vor dass der arbeitgeber der gründung einer personalvertretung ausdrücklich per tarifvertrag zustimmen muss doch ryanair verweigert seinen beschäftigten nicht nur die gründung eines betriebsrats auch das grundgesetzlich garantierte streikrecht wird ganz offen torpediert mit lügen einschüchterungen und abmahnungen am standort bremen dort wo die flugbegleiterinnen es als erstes gewagt haben sich gewerkschaftlich zu organisieren und zu wehren will ryanair jetzt ein exempel statuieren und den standort schließen nur damit wir uns nicht falsch verstehen: natürlich will ryanair auch weiterhin von und nach bremen fliegen und am dortigen flugverkehr verdienen nur eben ohne die wehrhafte bremer belegschaft die soll von heute auf morgen in aller herren länder versetzt werden ich finde diese angriffe auf das streikrecht liebe kolleginnen und kollegen sind völlig inakzeptabel deshalb ist es gut und wichtig dass fraktionsübergreifend zahlreiche kolleginnen und kollegen aus diesem haus ich will sie jetzt nicht nennen; einige sind im saal persönlich patenschaften für die streikenden beschäftigten übernommen haben aber dem müssen jetzt auch taten folgen denn mit jedem tag den wir warten verlieren weitere ryanair-beschäftigte ihren job und viele andere werden weiter vertrauen in die handlungsfähigkeit der politik verlieren deshalb: lassen sie uns jetzt schnell gemeinsam handeln meine fraktion hat dazu konkrete vorschläge vorgelegt ich habe heute morgen erfreut zur kenntnis genommen dass arbeitsminister heil bereits darauf reagiert und einen teil unserer vorschläge übernommen hat ich hoffe nur das ist nicht wieder eine der bekannten ankündigungen denen dann nichts folgt liebe kolleginnen und kollegen von der spd lassen sie uns gemeinsam dafür sorgen dass künftig auch das fliegende personal einen betriebsrat wählen kann ohne dabei auf die zustimmung des arbeitgebers angewiesen zu sein aber lassen sie uns auch dafür sorgen dass auch bei billigfluglinien wie ryanair und das betrifft nicht nur ryanair das streikrecht gilt wenn ein unternehmen wie ryanair glaubt weiterhin grundlegende arbeitnehmerrechte verletzen zu müssen dann muss die bundesregierung dafür sorgen dass die fluglinie ihre start- und landerechte in der bundesrepublik verliert liebe kolleginnen und kollegen das wäre ein starkes und wichtiges signal nicht nur an ryanair-chef o’leary sondern auch an alle die glauben sich in deutschland wie in einer bananenrepublik gebärden zu können vielen dank nächster redner ist wilfried oellers für die fraktion cdu/csu
42,19.10.2018,ID195904200,Wilfried,Oellers,CDU/CSU,Wilfried Oellers,sehr geehrter herr präsident meine sehr geehrten kolleginnen und kollegen meine sehr geehrten damen und herren die linken haben heute einen antrag zu der besonderen situation bei der fluggesellschaft ryanair eingereicht lassen sie mich dazu zunächst etwas allgemeines sagen tarifautonomie und mitbestimmung sind bestandteil der sozialen marktwirtschaft die unser land stark gemacht haben wir haben gesehen ich denke da insbesondere an / zurück dass gerade die tarifpartnerschaft dazu geführt hat dass man gut durch diese schwierige zeit gekommen ist deswegen ist es wünschenswert das sollte für jedes unternehmen selbstverständlich sein die tarifpartnerschaft zu leben und sie mit inhalten zu füllen wenn man solche entwicklungen wie bei ryanair sieht dann muss man aber ganz ehrlich sagen: das kann man in keiner weise gutheißen und schönreden das sage ich ganz deutlich und das mache ich auch nicht das was dort geschieht ist in dieser form sicherlich zu verurteilen da bin ich also gar nicht ganz so weit von ihnen weg die frage ist natürlich wie wir darauf reagieren sie liebe kollegen von den linken haben zwei vorschläge eingereicht ich will auf den ersten vorschlag den im hinblick auf § betriebsverfassungsgesetz eingehen wenn man sich diese regelung anschaut muss man sich natürlich fragen: was ist da damals geregelt worden und was war der hintergrund dass man zwischen bodenpersonal und flugpersonal unterschieden hat hatte den hintergrund dass es eine ortsungebundenheit der im flugbetrieb tätigen mitarbeiter gibt die gesetzgeberisch nicht ganz einfach zu regeln ist deswegen ist es in meinen augen nicht verkehrt dass man die tarifpartnerschaft heranzieht um diese einzel- und sonderfälle speziell regeln zu können in diesem zusammenhang muss man aber auch zur kenntnis nehmen dass es bezogen auf § absatz betriebsverfassungsgesetz mehr als zehn tarifverträge gibt wenn man jetzt fordert diesen paragrafen zu streichen dann entzieht man den tarifverträgen ein bisschen die grundlage an dieser stelle muss man also aufpassen ich will nicht in abrede stellen dass man sich den § betriebsverfassungsgesetz vor dem hintergrund dieser neuen situation und an solchen situationen muss man gesetze immer messen noch einmal genau anschauen muss aber ich denke an der stelle müssen wir vorsichtig sein wie wir damit umgehen der vorschlag den minister heil unterbreitet hat ist schon angesprochen worden ich will meinem vorredner ein bisschen widersprechen er hat das nicht übernommen er hat vielleicht den grundgedanken übernommen dass wir § angehen müssen aber er hat nicht ihren vorschlag übernommen § zu streichen das muss man der ehrlichkeit halber dazusagen wir werden uns das problem ganz genau anschauen sie machen mit ihrem antrag dazu den aufschlag ich bitte aber wie gesagt zu berücksichtigen dass wir trotz § absatz schon funktionierende tarifverträge haben daher muss man das sicherlich auch aus diesem lichte heraus betrachten sie haben als zweiten punkt die ilo-kernarbeitsnormen angesprochen die einzuhalten sind ich meine das sollte für diejenigen die sie ratifiziert haben eine selbstverständlichkeit sein aber bei der konkreten formulierung in ihrem vorschlag muss man berücksichtigen welche kreise das dann im ergebnis zieht sie haben jetzt den fall ryanair im blick die ilo-kernarbeitsnomen sind zwar von vielen nationen ratifiziert worden aber inwieweit sie sich tatsächlich daran halten muss man vielleicht noch einmal genau überprüfen ich habe so meine bedenken ob der antrag an der stelle nicht zu weitgehend ist insgesamt muss man sicherlich auch feststellen das ist auch ein appell an die allgemeinheit : natürlich versucht erst einmal jeder für sich das günstigste herauszuholen um möglichst viel zu verdienen aber da wo man dumpingpreise einsetzt gibt es in der tat erst einmal wettbewerbsunterschiede und man muss vor allem sehen dass die dumpingpreise auf dem rücken von bestimmten leuten ausgetragen werden das darf nicht sein deswegen freue ich mich schon auf die beratungen damit werden wir uns intensiv befassen sehen sie mir nach dass ich in der kürze der zeit der antrag wurde erst gestern verteilt nicht näher darauf eingehen kann aber das sehen wir uns sicherlich noch ganz genau an danke schön
