,datum,redeID,vorname,nachname,fraktion,name,inhalt_neu
41,07.04.2022,ID202804100,Gottfried,Curio,AfD,Gottfried Curio,sehr geehrte präsidentin meine damen und herren die vielen pseudoflüchtlinge von männer ohne ihre familien ohne pässe ohne dank ohne rückkehrwillen sie waren das was sie waren jetzt lernt deutschland wahre flüchtlinge kennen: frauen und kinder mit pässen dankbar rückkehrwillig so unterscheidet sich diese flucht von der migrationswelle in allem fundamental nur in einem nicht: wieder weigern sich die politisch zuständigen die lage zu kontrollieren und zu erfassen die allseitige unterstützung der ukrainischen flüchtlinge ist ja fraglos effektive hilfe funktioniert aber nur wenn die helfer die kontrolle haben über das was sie tun deutsche sicherheitsbehörden warnen schleuser würden die erleichterten einreisebedingungen aktiv bewerben gefälschte ukrainische pässe in umlauf bringen deutschland stehe damit auch für terroristische gruppierungen offen die innenministerin aber nimmt trotz dieser warnungen sicherheitsrisiken für deutschland sehenden auges in kauf das kann nicht sein meine damen und herren was es jetzt braucht ist lückenlose registrierung prüfung der personaldokumente erfassung der identität verhinderung von trittbrettfahrern die sich als ukrainer ausgeben oder im strom der flüchtlinge mit einreisen um hier asyl zu beantragen die ukraine ist kein land afrikanischer austauschstudenten nur eine vollständige registrierung macht eine gute organisation der versorgung und eine belastungsgerechte verteilung möglich aber die innenministerin verweigert die registrierung ausdrücklich so werden im schatten einer echten flüchtlingskrise unberechtigte hierhergelockt ideal um die statistiken über illegale migranten zu bereinigen indem man sie im breiten strom einer echten humanitären zuwanderung die unregistriert läuft untertauchen lässt meine damen und herren war kein kontrollverlust es war eine bewusste kontrollverweigerung und jetzt droht sie sich zu wiederholen haben sie denn nichts gelernt übrigens so wie die illegale migration in den ukraineflüchtlingen versteckt werden soll so soll jetzt das gesamte missmanagement dieser regierung als kriegsfolge vertuscht werden so sollen die schon im februar vor kriegsbeginn explodierten energiepreise und die inflation auf kriegsverursacht umgedeutet werden dabei stecken da vor allem drin: uferloses drucken von ezb-geld für eu-schuldenstaaten -besteuerung was tatsächlich hinzukam waren die hausgemachten sanktionen die uns selbst erheblich schaden das ist diese regierung: sich gesinnungsethisch in die brust werfen aber schaden vom deutschen volk abwenden fehlanzeige meine damen und herren was ist noch notwendig nichtukrainer die jetzt mit ankommen müssen wie es die massenzustromrichtlinie vorsieht in ihr heimatland zurück das alte hunderttausender-heer die es sich nach wie vor auf steuerzahlerkosten in deutschland wohlergehen lassen die vollziehbar ausreisepflichtigen ausländer sind endlich zurückzuführen das setzt erhebliche ressourcen frei: bei unterbringung im bildungswesen bei der staatsfinanzierung und bitte: rückführen rückführen rückführen; nationale kraftanstrengung nie umgesetzt reine propagandaparolen werden diesmal nicht reichen spätestens jetzt muss doch schluss sein mit noch zusätzlichen globalistischen umsiedlungs- und resettlement-programmen meine damen und herren wichtig: die flüchtlinge selbst wollen nach ende der kämpfe zurück die ukraine braucht nicht den zynismus von arbeitsminister heil der den hiesigen fachkräftemangel durch ukrainer decken will sie werden sehr bald in ihrer heimat gebraucht die ukraine wünscht deshalb unterricht nach ukrainischen lehrplänen aber keine schulische integration nach deutschland der unterricht in der ukraine sei intensiver mit höheren anforderungen in kürzerer zeit außerdem könne heißt es vonseiten der ukraine in integrationsklassen die eigene nationale identität schaden nehmen liebe altparteien-politiker wertvolle hinweise: man legt dort wert auf unterricht mit niveau statt absenkung zur verschleierung der probleme durch sprachfremde schüler und für alle die jetzt gelb-blaue fahnen schwenken aber bestimmt nie die deutschen farben: man legt dort wert auf nationale identität und ihre wahrung ich danke ihnen die nächste rednerin in der debatte ist bundesministerin anne spiegel
42,07.04.2022,ID202804200,Anne,Spiegel,BÜNDIS 90/DIE GRÜNEN,Anne Spiegel,sehr geehrte frau präsidentin meine sehr geehrten damen und herren abgeordnete liebe zuhörende es ist nun fünf wochen her dass dieser schreckliche angriffskrieg von putin in der ukraine gestartet ist sechs wochen pardon es sind schreckliche bilder die uns tagtäglich erreichen und die uns alle fassungslos machen aber sie machen uns nicht tatenlos wir handeln als bundesregierung und das von anfang an wir stehen zusammen und wir arbeiten daran dass wir die zu uns fliehenden frauen und kinder aus der ukraine vom ersten tag an gut aufnehmen können unzählige helferinnen und helfer haben sich auch ehrenamtlich engagiert und tun das nach wie vor viele menschen haben auch private unterkünfte angeboten für diese wirklich großartige hilfsbereitschaft der vielen ehrenamtlichen in der bundesrepublik die das ankommen der menschen die schreckliches und traumatisches erlebt haben erleichtern möchte ich mich an dieser stelle ganz ganz herzlich bedanken ich hatte gestern im zuständigen ausschuss schon ausführlich berichtet was wir auch in der bundesregierung machen um die ukrainischen frauen und kinder gut aufnehmen zu können ich möchte hier auf einige punkte eingehen die sehr wichtig sind zum einen gibt es die bundesweite koordinierung für die aufnahme von kindern aus ukrainischen waisenheimen mit ihren betreuerinnen und betreuern denn es ist sehr wichtig dass wir diese kinder die in ihrem jungen leben schon so viel durchgemacht haben die dramatisches im krieg und auf der flucht erlebt haben als gruppe mit ihren betreuerinnen und betreuern zusammen unterbringen können deswegen gibt es zwei säulen: es gibt die sos meldestelle die auch dank des großartigen engagements der sos-kinderdörfer ins leben gerufen wurde hier können kapazitäten an unterkünften in waisenheimen gemeldet werden dann erfolgt das ist die zweite säule über das bundesverwaltungsamt die verteilung auf die länder nach dem königsteiner schlüssel ich möchte ausdrücklich betonen: es gibt ein gemeinsames unaufgeregtes und entschlossenes handeln von bund ländern und kommunen an dieser stelle und das ist auch richtig der gemeinsame maßstab unseres handelns sind der kinderschutz und das kindeswohl des weiteren gibt es den schutz der frauen vor menschenhandel und zwangsprostitution ich bin sehr froh zu wissen dass die strukturen die in den jahren ff beim bundeskriminalamt bei der bundespolizei bei den lkas aber auch beim kok dem bundesweiten koordinierungskreis gegen frauenhandel aufgebaut wurden zum schutz der frauen ineinandergreifen dass man vor ort präsent ist und dafür sorgt dass frauen sicher sind ich möchte betonen dass überfälle zum glück nur einzelfälle sind aber es ist gut dass man hier genau hinschaut und sensibilisiert ist selbstverständlich sind die hilfetelefone die beratungsstellen alles was wir hier an infrastruktur haben hilfetelefone für von gewalt betroffene frauen oder frauen in schwierigen situationen schwangere in not und andere auch für die ukrainischen frauen da deshalb ist es wichtig dass wir diese angebote jetzt über dolmetscherinnen und dolmetscher auch sprachlich zugänglich machen ich komme zu einem weiteren punkt der ganz besonders wichtig ist und bei dem wir in der bundesrepublik eine verantwortung ja eine verpflichtung haben zur evakuierung von holocaustüberlebenden aus der ukraine dank des großen engagements der jewish claims conference ist es unter anderem gelungen dass gestern holocaustüberlebende in die bundesrepublik gebracht werden konnten das sind sehr schwierige evakuierungen; denn die menschen sind hochbetagt; sie sind teils schwerstpflegebedürftig aber es ist wichtig dass wir hier zu der verantwortung und verpflichtung stehen diese menschen gemeinsam gut aufzunehmen selbstverständlich stärken wir die vielen ehrenamtlichen die jetzt aktiv sind nicht nur an den bahnhöfen und den ankunftspunkten nein auch bei den ersten schritten der integration sind sie da und stehen den ukrainischen frauen und kindern zur seite da möchte ich exemplarisch die deutsche stiftung für engagement und ehrenamt nennen die vom ersten tag an sofort aktiv war und alles darangesetzt hat hier die entsprechenden strukturen bereitzustellen ebenso organisationen wie menschen stärken menschen wo über patenschaften die ersten schritte der integration hand in hand gemeinsam gegangen werden und das neben vielen weiteren tollen aktivitäten damit die ukrainischen menschen hier gut ankommen dazu gehört auch der schnelle zugang zu integrationskursen zu sprachkursen selbstverständlich tun wir was selbstverständlich werden wir das weiter ausbauen damit der spracherwerb aber auch der zugang zum arbeitsmarkt jetzt schnell vorangehen exemplarisch möchte ich hier mama lernt deutsch nennen einen sprachkurs des familienministeriums bei dem neben dem deutschlernen der mütter auch dafür gesorgt ist dass es eine betreuung für die kinder gibt meine sehr geehrten damen und herren ich werde in den nächsten tagen gemeinsam mit vertretern deutscher kinderschutzorganisationen nach polen reisen das ist eine mir sehr wichtige reise ich treffe dort unter anderem die polnische familienministerin es ist wichtig dass wir hier in der europäischen union zusammenstehen und uns gemeinsam dieser herausforderung annehmen damit die menschen die schreckliches durchgemacht haben und es sind überwiegend frauen und kinder auf der flucht hier gut aufgenommen werden damit sie eine psychosoziale versorgung bekommen das ist in den strukturen des ankommens enthalten damit vor allen dingen die kinder die schreckliches durchgemacht haben und zum teil traumatisiert sind wieder kinder sein können das sollte unser aller anstrengung wert sein danke die nächste rednerin in der debatte ist frau clara bünger fraktion die linke
43,07.04.2022,ID202804300,Clara,Bünger,DIE LINKE,Clara Bünger,sehr geehrte präsidentin sehr geehrte frau ministerin spiegel liebe kolleginnen und kollegen die union gefällt sich ganz offensichtlich darin die aufnahme von geflüchteten aus der ukraine unter dem label sicherheit und ordnung zu thematisieren wenn sie jetzt noch einen masterplan fordern dann lässt das aus meiner sicht nichts gutes erahnen; denn unter dieser anmaßenden überschrift hatte ex-innenminister seehofer zahlreiche verschärfungen im umgang mit schutzsuchenden propagiert als juristin sage ich ihnen frau bär: rechtlich gibt es momentan keine möglichkeit eine systematische registrierung der geflüchteten aus der ukraine zu erzwingen solange sie keine staatlichen leistungen und keinen aufenthaltstitel beantragen bis zum mai können sie sich legal in deutschland aufhalten und dass die übergangsverordnung jetzt verlängert werden soll ist gut so sehr viele geflüchtete können derzeit privat bei bekannten und verwandten unterkommen das ist doch positiv und sollte im übrigen auch anderen geflüchtetengruppen ermöglicht werden frau bünger erlauben sie eine zwischenfrage nein danke wenn es ihnen wirklich ein anliegen wäre geflüchtete frauen und kinder vor patriarchaler gewalt zu schützen dann müssten wir hier vor allem über die situation in den lagern und massenunterkünften sprechen; denn dort sind frauen sexuellen übergriffen meist schutzlos ausgeliefert das sagte übrigens auch ein vertreter des bka im innenausschuss und die täter sind nicht nur ehemänner männliche verwandte oder mitbewohner sondern sicherheitsdienstmitarbeiter sozialarbeiter hausmeister also personen die dort im staatlichen auftrag tätig sind was lernen wir daraus staatliche kontrolle ist nicht gleichbedeutend mit schutz für frauen der beste schutz für frauen und kinder wäre es sie nicht in massenunterkünfte und anker-zentren zu stecken wie es die union seit jahren zur abschreckung propagiert sondern auf dezentrale unterbringung zu setzen als sie in der letzten legislaturperiode eine verschärfung nach der nächsten im flüchtlingsrecht durch den bundestag gejagt haben ich erinnere mich hat sie die sicherheit von frauen herzlich wenig interessiert vor diesem hintergrund wirkt ihr antrag heuchlerisch und aus meiner sicht auch peinlich die union fordert einen hilfsgipfel wir denken auch dass es einen flüchtlingsgipfel braucht um von anfang an eine gute abstimmung von bund ländern und kommunen mit zivilgesellschaftlichen akteuren und fachverbänden zu gewährleisten; denn fachverbände wissen am besten über praktische probleme bescheid und ihre kompetenz muss bei der entwicklung kurz- aber auch mittel- und langfristiger maßnahmen genutzt werden ich war diese woche mit meiner kollegin petra pau im ankunftszentrum in tegel das ankunftszentrum ist das erste zentrum deutschlandweit in dem hilfsorganisationen zusammen unter einem dach arbeiten das ist schon mal gut weil dinge so besser koordiniert werden können; denn es kommen mittlerweile sehr viele menschen besonders vulnerabler gruppen an darunter auch menschen mit kriegsverletzungen eine mutter ist dort mit ihrem kriegsverletzten sohn der sehr schnell in ein krankenhaus gebracht werden musste angekommen dank der guten zusammenarbeit konnte die versorgung des kindes professionell und schnell koordiniert werden das ist gut und sollte vorbildfunktion haben dennoch gibt es sehr viele baustellen immer noch müssen schutzlücken geschlossen werden es muss sichergestellt werden dass alle die aus der ukraine geflohen sind geschützt werden das heißt auch drittstaatler/-innen und insbesondere studierende brauchen diese rechtssicherheit wir müssen aber auch diejenigen schützen die sich dem kriegsdienst in russland verweigern und diejenigen die in russland gegen den krieg protestieren ich bekomme immer mehr anfragen von menschen aus russland die fliehen wollen wir dürfen diese mutigen menschen nicht alleine lassen und schließlich: lassen sie uns das diskriminierende asylbewerberleistungsgesetz endlich aufheben wir wollen alle schutzsuchenden gleich behandeln und zwar menschenwürdig vielen dank zu einer kurzintervention erteile ich das wort der kollegin silke launert
44,07.04.2022,ID202804400,Silke,Launert,CDU/CSU,Silke Launert,vielen dank schade dass sie die zwischenfrage nicht zugelassen haben sie hätte zu ihrem satz dass es rechtlich keine möglichkeit gebe diese registrierung durchzuführen gepasst dann hätte die antwort auf die nachfrage das ergänzt sie haben recht: wir von der union hätten gerne eine registrierung möglichst grenznah eine feststellung wer alles im land ist vielleicht sogar vor ort aber spätestens danach meine frage im innenausschuss ob das denn rechtlich zu ermöglichen ist ob wir eine gesetzliche grundlage schaffen können wofür wir als gesetzgeber auch zuständig sind entweder national oder europarechtlich wurde von der innenstaatssekretärin ganz klar bejaht und so ist es auch man kann diese rechtliche grundlage schaffen daher tut es mir leid dass sie hier so tun als sei das rechtlich nicht möglich wir sind dazu da eine grundlage zu schaffen wenn es zweckmäßig ist und gerade angesichts der hohen zahlen ist es zweckmäßig wir wollen auch helfen; aber es muss strukturiert sein wir müssen wissen wie viele kinder da sind wenn sie in die schulen kommen; wir müssen uns vorbereiten deshalb ist es echt schade dass sie hier falsche auskünfte geben bzw nennen wir es mal so halbwahrheiten verbreiten frau bünger sie haben die möglichkeit zu antworten
45,07.04.2022,ID202804500,Clara,Bünger,DIE LINKE,Clara Bünger,sie haben ja selber erkannt dass sie da falschliegen sie haben gesagt sie wollten gern eine rechtliche möglichkeit dafür schaffen dass die menschen registriert werden ich habe die rechtliche lage beschrieben wie sie ist dass es derzeit keinen zwang zur registrierung gibt ich denke das sollte auch so bleiben die nächste rednerin in der debatte: gyde jensen fdp-fraktion
46,07.04.2022,ID202804600,Gyde,Jensen,FDP,Gyde Jensen,vielen dank frau präsidentin liebe kolleginnen und kollegen ich freue mich liebe union dass sie in ihrem antrag familienpolitisch genau die programme aufzählen die auch wir als koalitionsfraktionen für eine gute unterstützung für die ukrainischen frauen kinder und jugendlichen identifiziert haben und die im übrigen im familienministerium seit wochen mit ganz großem engagement entsprechend angepasst wurden und werden und sich mit eigenen webauftritten und mit übersetzungen zielgerichtet an ukrainer/-innen wenden stichworte sind hier frühe hilfen sprach-kitas oder auch die programme stark im beruf und menschen stärken menschen dass es bei diesen einzelnen programmen natürlich auch darum geht sie haushalterisch zu stärken haben wir auf dem schirm da freuen wir uns auf die zusammenarbeit im rahmen der haushaltsberatungen ich weiß natürlich liebe kolleginnen und kollegen von der union dass sie an ihrem gefühlten alleinvertretungsanspruch als fürsprecher der anliegen der kommunen in deutschland festhalten diese zeiten sind aber schon lange vorbei und wenn sie ganz ehrlich sind stimmt es wenn sie vermeintlich für die kommunen in die bresche springen wollen nicht ganz mit dem überein was wir über die abstimmungen zwischen bund ländern und vor allen dingen den kommunen hören diese abstimmungen laufen nämlich sehr konstruktiv auf ihren wunsch wurde zum beispiel die zentrale koordinierungsstelle für die versorgung von heim- und waisenkindern auf bundesebene eingerichtet wer allerdings in dieser debatte nicht konstruktiv ist ist die csu und zwar schon seit wochen wenn unbegleitete minderjährige bzw minderjährige mit betreuern einreisen wir haben das auch in der debatte zum einzelplan in der vergangenen sitzungswoche gehört dann sollten diese kinder entsprechend betreut werden und möglichst schnell zugang zu leistungen nach sgb viii erhalten und nicht unter das asylbewerberleistungsgesetz fallen letzteres ist natürlich im sinne einer restriktiveren haushaltsführung; aber dann stellen sie sich bitte nicht hier hin und sagen bei ihnen stehe das wohl des kindes im mittelpunkt und dann stellen sie bitte nicht solche anträge was sie dann bitte machen ist folgendes: rufen sie ihren mp in bayern an und sagen sie ihm er solle sich bitte nicht länger querstellen auch im rahmen der mpk nicht und daran arbeiten dass keine pms herausgegeben werden in denen eine einigung der er vorher zugestimmt hat im nachhinein ganz anders lautet jetzt gehe ich noch auf ihren antrag ein sie schreiben in ihrem antrag: den schutz für sie müssen wir jetzt in den vordergrund stellen und ihre integration ermöglichen ein gut organisierter staat ist die grundlage dafür dass hilfe sicherheit und integration für ukrainische frauen kinder und jugendliche gelingt ich muss ihnen sagen: das macht mich ein bisschen traurig und zwar aus dem grund dass es so floskelhaft klingt weil sie mit dem schlagwort integration der damit verbundenen herausforderung gar nicht gerecht werden und zwar einerseits zu ermöglichen dass diejenigen die hier ankommen sofort einen platz in unserer gesellschaft erhalten und sich zumindest für eine zeit hier ein leben aufbauen können und andererseits gleichzeitig den starken wunsch zu respektieren ihre ukrainische heimat außerhalb des ukrainischen territoriums hier weiter zu bewahren bis sie nach hause zurückkehren unsere bundesbildungsministerin kümmert sich zum beispiel im bildungsbereich genau darum nämlich dass das miteinander verzahnt ist dann wären wir noch ganz kurz frau präsidentin beim stichwort masterplan ich verstehe ihren wunsch; ich war auch in der letzten legislatur dabei das innenministerium hat sich ungern an absprachen mit anderen häusern beteiligt aber auch diese zeiten sind vorbei deswegen brauchen wir flexible schnelle lösungen auf allen ebenen aber nicht einen staatlich-zentral verordneten masterplan wir freuen uns dennoch auf die beratung im ausschuss vielen dank der nächste redner in der debatte: alexander throm cdu/csu-fraktion
47,07.04.2022,ID202804700,Alexander,Throm,CDU/CSU,Alexander Throm,sehr geehrte frau präsidentin werte kolleginnen und kollegen seit sechs wochen herrscht krieg auf europäischem boden und die bilder werden von tag zu tag schrecklicher unerträglicher und brutaler das hat zur folge dass ein viertel des ukrainischen volkes sich auf der flucht befindet; millionen menschen haben ihr land verlassen es ist unsere pflicht diesen europäischen binnenflüchtlingen in europa und in deutschland obhut und schutz zu gewähren wir fühlen mit den menschen; sie sind uns nicht nur geografisch sondern auch emotional nahe deswegen gibt es in deutschland eine große hilfsbereitschaft darum möchte ich an dieser stelle allen danken die menschen bei sich zu hause aufnehmen den ehrenamtlichen aber auch den hauptamtlichen in unseren behörden die mit dieser aufgabe betraut sind ein herzliches dankeschön jetzt wäre es aufgabe der bundesregierung diese hilfsbereitschaft aufzunehmen zu fördern zu unterstützen damit es weitergeht und hilfe bestmöglich zu organisieren doch diese bundesregierung hinkt seit sechs wochen der entwicklung hinterher wir haben keine durchgehende personenfeststellung wir haben kein gleichmäßiges system der registrierung keine gut organisierte verteilung der menschen innerhalb von deutschland vor allem frau ministerin spiegel haben wir keinen ausreichenden schutz von frauen und kindern wenn sie bei uns in deutschland ankommen die bundesregierung weiß bis heute nicht wie viele menschen sich hier aufhalten und wer und wo sie sind ganz anders als in polen das viel stärker durch die flüchtlingszahlen belastet ist gleichzeitig erklärt frau ministerin faeser die heute wieder mal mit abwesenheit glänzt in ihren vielen interviews folgendes: die polizei kontrolliert sehr intensiv in bussen und zügen besonders die drittstaatler ohne ukrainischen pass werden kontrolliert und registriert dazu zwei anmerkungen: erstens sie erkennt mit diesen aussagen an dass eine kontrolle notwendig ist; sonst würde sie das nicht immer wieder behaupten zweitens stimmt diese behauptung von frau faeser zuletzt in der leipziger volkszeitung vom vergangenen samstag mit der wahrheit und der realität nicht überein es wird in deutschland keine vollständige personenfeststellung durchgeführt insbesondere nicht bei drittstaatlern meine kolleginnen und kollegen deswegen wird die innenministerin ihrer aufgabe nicht gerecht zu wissen wer in deutschland ist und wie viele es sind; das ist ihre verantwortung sie schadet damit nicht nur den sicherheitsinteressen unseres landes sondern auch den vielen menschen den frauen und kindern die deshalb keinen schutz erfahren können die beiden ministerinnen haben nichts gemacht weder frau faeser noch frau spiegel wir haben im innenausschuss darauf hingewiesen einzige antwort: wir werden die bundespolizei sensibilisieren bis heute gibt es keine schutzzonen kein schutzkonzept frau ministerin spiegel sie haben gerade gesagt sie handelten unaufgeregt meinetwegen können sie auch aufgeregt handeln hauptsache sie handeln die ministerin faeser ist auch auf europäischer ebene gescheitert ja die massenzustrom-richtlinie wurde aktiviert; das haben wir von anfang an begrüßt das ist ein gutes mittel um den menschen aus der ukraine hier schnell und unbürokratisch eine aufnahme zu gewähren aber es wurde entgegen den vorschriften der richtlinie selbst beim beschluss nicht festgestellt wie die aufnahmekapazitäten in den einzelnen europäischen ländern sind jetzt ist die frau ministerin faeser mit der forderung nach einer verbindlichen quote letzte woche nach brüssel gereist sie ist gescheitert sie ist ohne ergebnis nach deutschland nach berlin zurückgekommen es gibt keine solidarität in diesem bereich auf europäischer ebene die ministerin ist gescheitert und sie möge hier eine lernkurve hinlegen für zukünftige verhandlungen auch in anderen bereichen der migration damit sie so nicht nochmals scheitert liebe kolleginnen und kollegen das sehen offensichtlich auch die koalitionspartner der frau ministerin so insbesondere die grünen ihr vorsitzender hat einen krisenstab im bundeskanzleramt gefordert ebenso die vizepräsidentin frau göring-eckardt und bei der fdp nicht viel anders: der herr migrationsminister stamp aus nordrhein-westfalen fordert ebenso einen solchen krisenstab im kanzleramt auch außerhalb der politik gibt es beispiele: der flüchtlingsbeauftragte der ekd fordert ebenfalls einen krisenstab nicht mehr im innenministerium sondern als chefsache im bundeskanzleramt ich hoffe der bundeskanzler hört diese rufe aus seiner koalition und beispielsweise aus der evangelischen kirche herzlichen dank die nächste rednerin ist die kollegin gülistan yüksel spd-fraktion
