,datum,redeID,vorname,nachname,fraktion,name,inhalt_neu
77,17.06.2020,ID1916507700,Linda,Teuteberg,FDP,Linda Teuteberg,"sehr geehrter herr präsident! sehr geehrte kolleginnen und kollegen! liebe gäste! kollegen, reiht euch ein! wir wollen freie menschen sein! dieser ruf erschallte am . juni in berlin und auch an anderen orten in der damaligen ddr. eine senkung der arbeitsnormen, die freilassung politischer gefangener, der rücktritt der regierung der sed-diktatur, freie wahlen und die einheit deutschlands mutig traten menschen am . juni in der ganzen sogenannten ddr für diese ziele ein. die hoffnungen der demonstrierenden wurden schon im laufe des nachmittags zerstört, als sowjetische panzer auffuhren, um den aufstand niederzuschlagen. trotzdem blieben die ereignisse ein trauma für die sed-führung. mehr als drei jahrzehnte später fragte stasichef erich mielke angesichts wachsender bürgerproteste : ist es so, dass morgen der . juni ausbricht? das zeigt das paranoide verhältnis der ddr-obrigkeit zu den ereignissen im juni , allem zur schau getragenen selbstbewusstsein zum trotz. erinnerung, um die es heute geht, kann vieles, im guten und im schlechten. das gedenken an den . juni hat eine lange, wechselvolle geschichte; frau kollegin budde ist darauf eingegangen. der . juni ist ein herausragendes ereignis deutscher und europäischer freiheitsgeschichte. wir haben den auftrag, uns die ereignisse immer wieder anzueignen, zu fragen: was sollte davon allgemeingut werden, was sollte teil unserer kollektiven erinnerung sein und bleiben? in diesem zusammenhang möchte ich drei punkte ansprechen. zum ersten. die unterdrückung war existenzbedingung des sozialismus. mit weiterer historischer erfahrung und aktuellem internationalen vergleich füge ich hinzu: sie ist es auch weiterhin. jene tage im juni ließen unübersehbar werden, dass die sed-herrschaft keine basis in der ddr-bevölkerung hatte, dass sie nur mit brutaler waffengewalt aufrechterhalten werden konnte. von wolfgang leonhard ist überliefert, dass walter ulbricht bei der rückkehr nach deutschland sagte: es ist doch ganz klar: es muss demokratisch aussehen, aber wir müssen alles in der hand haben. am . juni wurde selbst für den unbedarftesten betrachter klar, dass das nicht mal mehr demokratisch aussah. um es klipp und klar zu sagen: die menschen im osten unseres landes haben der sed nie in freien, geheimen und gleichen wahlen ein mandat erteilt, die geschicke dieses teils unseres landes zu bestimmen. und deshalb schrieb auch die new york times am . juni : wir wissen jetzt, und die welt weiß es, dass in dem deutschen volk ein mut und ein geist leben, die die unterdrückung nicht ewig dulden werden. da nützte auch die diffamierung als vermeintlich faschistische provokation ausländischer agenten nichts. zweitens. es wird manchen überraschen, wenn ich als liberale politikerin darauf hinweise, dass vor allem eine große streikwelle stattfand, also eine art arbeiteraufstand. und dass es ohne diese forderung der arbeiter nach gerechter entlohnung nie und nimmer zu den massenprotesten gekommen wäre, die dann in der forderung nach völliger neuordnung der politischen verhältnisse und schließlich in dem wunsch nach wiedervereinigung endeten. das ist ein beispiel für die bildung falscher gegensätze. viele deuten die ereignisse entweder nur als arbeiteraufstand im gegensatz zu einer demokratiebewegung oder nur als demokratische bewegung. beides gehört aber zusammen und ist kein gegensatz. denn der sed-staat war schon nach wenigen jahren aufgrund seiner wirtschaftlichen und wirtschaftspolitischen verfassung nicht in der lage, den menschen ein vergleichbar gutes auskommen zu sichern. er hat nicht nur die freiheitsrechte mit füßen getreten, sondern er verwehrte den menschen den wohlstand, der in der bundesrepublik schon bald zur selbstverständlichkeit wurde. es ist zu sagen, dass der größte feind der sed nicht so sehr wie es über die landwirtschaft in der planwirtschaft immer ironisch gesagt wird frühling, sommer, herbst und winter waren. nein, es waren die ergebnisse einer ruinösen wirtschaftspolitik, die hart arbeitende menschen um ihren lohn brachten. die lehre des . juni ist nicht zuletzt die erkenntnis, dass mit der verstaatlichung der betriebe auch der beschleunigte wirtschaftliche niedergang einherging. vom schweigen darüber ist es nicht weit bis zu der illusion, man hätte die ddr mit ein paar reformen retten können; ein weites feld für verschwörungserzählungen. als freie demokratin ist mir da wichtig: die menschen wussten damals ob sie wegen wirtschaftlicher oder demokratischer oder beider motive auf die straße gingen , dass die freiheit unteilbar ist, dass wirtschaftliche und politische freiheit sowie individuelle und gesellschaftliche freiheit zusammengehören und nicht gegeneinander ausgespielt. schließlich ist auch an den . juni zu denken. morgen vor jahren beschloss die volkskammer eine verfassungsänderung, mit der jeder bezug auf den sozialismus aus der damaligen verfassung der ddr entfernt wurde. damit komme ich zu aktuellen bezügen der causa borchardt, die eigentlich eine causa von mehreren ist: von herrn riexinger und der linken, von frau schwesig und sozialdemokraten und manchen in der union. es geht um die grundsätzliche frage, dass unsere verfassung ein samen ist und freiheit auch hier unteilbar ist. die wirtschaftsordnung ist teil der verfassung. berufsfreiheit, eigentumsfreiheit und die freiheit zur bildung unabhängiger gewerkschaften sind inhalte unseres grundgesetzes. und wer sagt, er sei nur zum hüten der verfassung da, das habe mit der wirtschaftsordnung nichts zu tun, der hat unser grundgesetz leider nicht verstanden. unser grundgesetz ordnet nicht plump wie die damalige ddr-verfassung eine bestimmte wirtschaftsordnung an, aber es ist nicht beliebig oder neutral. mit diesen freiheiten zur entfaltung des menschen auch in wirtschaftlicher und beruflicher hinsicht, hinsichtlich freier gewerkschaftsbildung und tarifautonomie wurden weichenstellungen vorgenommen. wir sollten in den nächsten wochen und monaten, finde ich, zwei konkrete dinge berücksichtigen: wir sollten den überfraktionellen weg bei der schaffung des neuen opferbeauftragten suchen, den die große koalition übrigens versprochen hat; das sind wir den opfern schuldig. wer sich mit der wechselvollen geschichte des gedenkens an den . juni beschäftigt, der weiß, dass es in den jahren der teilung unseres landes einen jährlichen bericht zur lage der nation im geteilten deutschland gab, mit einer regierungserklärung des kanzlers und einer intensiven aussprache im deutschen bundestag. jahre einheit in freiheit davon haben die menschen, die am . juni viel riskiert haben, geträumt sind grund genug für uns, ein starkes zeichen zu setzen. damit zu feierlichkeit und freude auch die ernsthaftigkeit hinzukommt, sollten wir eine debatte über die innere einheit unseres landes führen, und zwar anlässlich eines berichts der bundesregierung zur lage im wiedervereinigten deutschland, mit einer regierungserklärung der kanzlerin und einer aussprache hier im plenum dieses hauses. diese aussprache ist notwendig, sie ist ausdruck von ernsthaftigkeit und debattenfreude in einer reifen demokratie. sie gehört in dieses parlament. vielen dank. vielen dank. als nächste spricht für die fraktion die linke die kollegin petra pau."
78,17.06.2020,ID1916507800,Petra,Pau,DIE LINKE,Petra Pau,"sehr geehrter herr präsident! sehr geehrte kolleginnen und kollegen! der . juni war in der ddr ein schwarzer tag. seit längerem anschwellende proteste wurden insbesondere durch die sowjetarmee blutig niedergeschlagen. es gab zahlreiche tote, ungezählte verletzte sowie tausende verhaftungen. daran ist zu erinnern. proteste gab es vielerorts, nicht nur in ostberlin. die gründe waren so vielfältig wie die forderungen. es ging um soziale rechte, etwa lohnerhöhungen oder die rücknahme staatlich verordneter arbeitsnormen, und es ging um demokratie und bürgerrechte, zum beispiel um pressefreiheit und die forderung nach freien wahlen. die reaktionen der sed-spitze waren zwiespältig. vielen sozialen forderungen wurde infolge des . juni entsprochen. das führte zu verbesserungen der arbeits- und lebensbedingungen für millionen bürgerinnen und bürger. die politischen forderungen wiederum wurden missachtet, der führungsanspruch der sed verfestigt und mithin der sozialismus sowjetischer prägung verhärtet. mitglieder der sed, die diesen kurs für falsch hielten, wurden aus der partei geworfen, etliche gar inhaftiert. andere, wie überhaupt viele bürgerinnen und bürger der damaligen ddr, verließen das land gen westen. so gab es rund um den . juni eine entwicklung, die in vielem an den herbst erinnerte und die schließlich zur implosion des sozialismus sowjetischer prägung führte, und das nicht nur in der ddr, und ich unterstreiche hier das auch völlig zu recht. als linke sage ich rückblickend: ein sozialismus, in dem soziale rechte und freiheits- und bürgerrechte nicht als gleichwertig gelten, ist kein sozialismus. man darf soziale rechte sowie freiheits- und bürgerrechte nicht gegeneinanderstellen und auch nicht miteinander verrechnen. wer dies dennoch tut, ist nicht links. das ist das credo der partei und auch der fraktion die linke. damit unterstreiche ich auch: unser bruch mit dem stalinismus als system von gilt unwiderruflich. wer das infrage stellt, ist kein linker. nun wurden soziale rechte, freiheits- und bürgerrechte nicht nur im sozialismus sowjetischer prägung beschränkt oder ausgesetzt. wir erleben das auch heute, weltweit. überall, wo dies geschieht, ist widerspruch gefragt. deshalb möchte ich abschließend auf einen umstand eingehen, der die soziale und politische krise in der ddr damals beschleunigte. die usa und die udssr befanden sich längst im kalten krieg. in beiden ländern wurde massiv hochgerüstet. damit wuchs der finanzielle druck der sowjetunion auf die ddr, den die sed-führung an die bevölkerung durchreichte. mit blick auf aktuelles gebe ich zu bedenken: wir erleben durchaus auch heute auf dieser welt eine militarisierung der politik, verbunden mit einer gewaltigen aufrüstung. die linke das unterstreiche ich hier ist dagegen: aus historischen, aus sozialen und aus friedensgründen. vielen dank. der kollege bystron erhält gelegenheit zu einer kurzintervention."
79,17.06.2020,ID1916507900,Petr,Bystron,AfD,Petr Bystron,"frau pau, respekt für diesen drahtseilakt, den sie hier vollbracht haben, und respekt, dass sie sich von dem terrorregime der sed distanziert haben. aber ich möchte ihnen ein zitat von wladimir iljitsch lenin angedeihen lassen: taten sprechen, nicht worte. wenn sie sich wirklich distanzieren, warum geben sie als partei dann das in diesem unrechtsregime erworbene vermögen nicht zurück? wollen sie antworten? nein. dann fahren wir fort in der debatte. nächste rednerin ist für die fraktion bündnis /die grünen die kollegin monika lazar. herr kollege brandner, solche zwischenrufe stehen ihnen nicht zu, die sind respektlos. ich glaube, das war ein ironischer zwischenruf. ich erteile ihnen dafür einen ordnungsruf."
80,17.06.2020,ID1916508000,Monika,Lazar,BÜNDNIS 90/DIE GRÜNEN,Monika Lazar,"herr präsident! liebe kolleginnen und kollegen! lieber roland jahn! wir fordern ein besseres leben, wir fordern freie wahlen , mit diesen und anderen losungen zogen vor jahren leipziger arbeiterinnen und arbeiter ins zentrum der stadt. bereits vor dem . juni hatte sich in der ganzen ddr der widerstand der arbeiter gegen die harten arbeits- und lebensbedingungen und gegen die schlechte versorgungslage formiert. die unzufriedenheit brach sich in stadt und land bahn. aus den forderungen, normerhöhungen zurückzunehmen, wurde der ruf nach freiheit, freien wahlen, einer neuen regierung und dem ende des sozialismus. aber noch am selben tag wurde die hoffnung der aufständischen begraben. in leipzig war die streikwelle in der nacht zuvor angekommen. bis mittag demonstrierten schon über menschen in der stadt. in der beethovenstraße versuchten viele, das untersuchungsgefängnis zu stürmen, wurden aber mit waffengewalt davon abgehalten. um uhr trafen sowjetische truppen ein und trieben die demonstranten auseinander. um uhr war in leipzig der erste tote zu beklagen. ein -jähriger mann starb, als stasioffiziere und volkspolizisten in die menge schossen. neun tote und mindestens verletzte waren im bezirk leipzig zu beklagen. in den folgenden tagen ebbte die streikwelle zwar nicht komplett ab, aber das ende des aufstands war besiegelt. bis zum . juli galt in leipzig das kriegsrecht. unmittelbar nach dem aufstand setzte eine große verhaftungswelle ein. von den fast verhafteten in leipzig wurden in den folgemonaten über personen zu langjährigen haftstrafen verurteilt, einer auch zum tode. noch heute erinnern in der leipziger innenstadt zwei in bronze gegossene kettenspuren an die niederschlagung des aufstandes. warum sollte man nun so detailliert von den ereignissen in einer stadt sprechen? wir müssen verstehen, dass sich die geschichte des aufstandes vom . juni aus vielen unterschiedlichen bildern der hoffnung und des leids zusammensetzt und dass sie an vielen verschiedenen orten geschrieben wurde. ich persönlich hatte ja ein etwas schwieriges verhältnis zu diesem datum. aufgewachsen in der ddr, wurde uns schon in der schule beigebracht, dass damals ein vom westen gesteuerter konterrevolutionärer putschversuch unternommen werden sollte. das war wenig glaubhaft und eben die typische sed-bürokratensprache, die man schon sehr schnell satthatte und die mehr verbarg als erklärte. die interpretation in der bundesrepublik fand ich allerdings auch nicht sonderlich überzeugend. da überwog für mich eher ein wohlfeiler und paternalistischer blick auf die armen brüder und schwestern im osten. im grunde war es für ost- und westdeutschland erst nach und nach der friedlichen revolution möglich, einen entstaubten und emanzipierten blick auf die ereignisse rund um den . juni zu werfen. die aufstände in polen und ungarn , der prager frühling , die streiks und demonstrationen in polen in den - und -jahren und schließlich das ende der diktaturen in osteuropa, das alles zeigt uns: der wunsch nach freiheit lässt sich nicht für immer mundtot machen und von panzern überrollen. so warf der . juni seinen schatten viele jahre in die zukunft und prägte die ängste der opposition in der ddr. noch im september , bei den ersten montagsdemonstrationen in leipzig, als das bisherige system schon erste risse zeigte, und auch am . oktober, dem entscheidenden tag in leipzig, war noch immer die angst vor einer gewalttätigen niederschlagung da, auch bei jungen leuten. doch zum glück fielen diesmal keine schüsse. der . oktober zeigte, dass es möglich war, gemeinsam das trauma des . juni zu überwinden. aus der forderung nach einem besseren leben war die forderung nach demokratie, freiheit und menschenrechten geworden, und der staat konnte den ruf nach freiheit nun nicht mehr ignorieren. die opfer des . juni mahnen uns, die werte von freiheit und demokratie hochzuhalten und zu verteidigen, und das muss auch weiterhin unsere gemeinsame aufgabe sein. vielen dank. vielen dank. nächster redner in der debatte ist der kollege manfred grund für die cdu/csu."
81,17.06.2020,ID1916508100,Manfred,Grund,CDU/CSU,Manfred Grund,"vielen dank. herr präsident! meine damen und herren! andere länder, andere nationalfeiertage: in den usa ist es der . juli als tag der unabhängigkeitserklärung, frankreich hat den . juli, sturm auf die bastille, und russland begeht besonders den . mai als tag des sieges über den hitlerfaschismus. wir erinnern uns hier und heute an den . juni, welcher bis zur deutschen wiedervereinigung der nationalfeiertag der bundesrepublik deutschland war. warum überhaupt nationalfeiertage? zuallererst: ohne nationen mit einer gemeinsamen geschichte keine nationalfeiertage. an solchen feiertagen versichern sich nationen ihrer geschichte, ihrer identität, ihres zusammenhaltes. eine nation ist stark vom wir-gefühl seiner bevölkerung abhängig. es geht und ich nehme bezug auf ausführungen des verfassungsrechtlers ernst-wolfgang böckenförde um das staatsvolk als politische schicksalsgemeinschaft. im nationalstaat ist der zusammenhalt grundlage des gesellschaftsvertrages. um auch in krisenzeiten füreinander einzustehen, ist die voraussetzung, gemeinsame herausforderungen auch gemeinsam zu bewältigen. damit ist die demokratie mehr als jede andere regierungsform darauf angewiesen, dass ihre bürger sie bejahen und mit leben erfüllen. ob diese zustimmung nur vom kopf oder auch vom herzen ausgeht, es braucht zur identifikation symbole, und es braucht einen entspannten umgang mit diesen symbolen. wenn wir nicht flagge zeigen, eignen sich andere diese symbole an. und mit bertolt brecht finde ich: man kann und man darf sein land auch lieben. und ja, es gibt auch einen fröhlichen patriotismus und nicht nur einen hurra-patriotismus. aber zurück zum . juni. marion gräfin dönhoff veröffentlichte bereits eine woche nach dem . juni folgendes: der . juni wird einst und vielleicht nicht nur in die deutsche geschichte eingehen als ein großer, ein symbolischer tag. … die erste wirkliche deutsche revolution, ausgetragen von arbeitern, die sich gegen das kommunistische herrschaftsparadies empörten. und weiter: der . juni hat unwiderlegbar bewiesen, dass die einheit deutschlands eine historische notwendigkeit ist. andere geschichtsbetrachter sehen im . juni sogar den ersten massenaufstand gegen die stalinistische diktatur, gegen den stalinistischen totalitarismus. nicht nur das historische ereignis . juni ist hier beschrieben, sondern auch seine zuschreibungen als revolution der arbeiter gegen das kommunistische herrschaftssystem, einheit deutschlands als historische notwendigkeit, aufstand gegen totalitarismus. all diese zuschreibungen mussten damals und seitdem bis heute bei jedem ordentlichen kommunisten die fußnägel zurückrollen; bei manchen bekennenden linken ist das bis heute auch so geblieben. in der ddr-geschichtsschreibung wurde der . juni ganz schnell zum faschistischen putschversuch erklärt, eingefädelt durch imperialistische agenten im auftrag der bösen bonner ultras. das sed-regime perfektionierte nach der niederwerfung seinen repressionsapparat mit mfs, kasernierter volkspolizei, kampfgruppen der arbeiterklasse. es folgten schauprozesse, säuberungswellen, hinrichtungen, zwangsaussiedlungen, kirchenkampf, mauerbau, zwangskollektivierung, verstaatlichung und mangelwirtschaft, das ganze realsozialistische elend also. wenn sich übrigens erich honecker das sei hier auch erwähnt mit seinen geraer forderungen einer eigenen ddr-staatsbürgerschaft und der auflösung der erfassungsstelle von ddr-unrecht in salzgitter durchgesetzt hätte, dann hätten nach dem mauerfall millionen ostdeutsche asyl in der bundesrepublik beantragen müssen, weil sie eben nicht mehr deutsche nach dem grundgesetz gewesen wären. teile der westdeutschen politik und der westdeutschen intellektuellen öffentlichkeit waren schnell bereit, honecker nachzugeben. so hatten alle damals spd-regierten bundesländer die finanzierung der erfassungsstelle salzgitter eingestellt, wollten deren arbeit beenden. in dieser erfassungsstelle von ddr-unrecht wurden auch die verbrechen nach niederschlagung des volksaufstandes vom . juni dokumentiert, und mancher häftling in bautzen hat nur überlebt in der hoffnung, das an ihm begangene unrecht wird dokumentiert, wird nicht vergessen, und die täter werden vor gericht gestellt. trotz aller repressionen war der wunsch nach einheit des vaterlandes nicht aufzuhalten. die deutsche einheit nahm ihren lauf, und weder ochs’ noch esel hielten ihn auf. wir gedenken heute des . juni, und wir freuen uns auf unseren neuen nationalfeiertag, den wir zum . mal feiern, den . oktober. die freiheitskämpfer von stehen auf den schultern der freiheitskämpfer von . / wurde vollendet, was begann. auch deshalb dürfen wir stolz sein auf unser land, in welchem wir in freiheit zusammenleben. wir müssen es ja nicht alle gleichermaßen lieben. vielen dank. vielen dank. nächster redner in der debatte ist der kollege leif-erik holm für die fraktion der afd."
82,17.06.2020,ID1916508200,Leif-Erik,Holm,AfD,Leif-Erik Holm,"sehr geehrte bürger! herr präsident! meine damen und herren! der . juni ist und bleibt ein bedeutender tag unserer geschichte, weil er uns zeigt, dass wir bürger den lauf der dinge beeinflussen können. auch wenn der aufstand damals blutig niedergeschlagen wurde, so war er dennoch der grundstein für die spätere friedliche revolution. wir können uns vor den mutigen von damals nur verneigen. aber was lernen wir aus diesem tag? der . juni zeigt, dass sozialismus immer mit gewaltherrschaft einhergeht. er funktioniert nur mit zwang, weil die menschen nämlich keine lust haben, sich von einem politbüro umerziehen zu lassen, sondern ihr eigenes leben wollen. sozialismus hat nie funktioniert und wird nie funktionieren. aber können wir sicher sein, dass es nicht wieder versucht wird? nein, können wir nicht. das kuscheln der altparteien mit der umbenannten sed muss jeden erschrecken, der die freiheit schätzt. sogar die union feiert heute verbrüderung mit der sed nach dem motto einmal blockpartei, immer blockpartei . anders lässt es sich nicht erklären, dass sie, liebe kollegen von der cdu, einer betonkommunistin in mecklenburg-vorpommern ins höchste richteramt als verfassungsrichterin verholfen haben. mal abgesehen davon, dass frau borchardt nicht einmal die befähigung zum richteramt hat, ist sie mitbegründerin der antikapitalistischen linken, die als linksextremistisch eingestuft wird und einem revolutionär-kommunistischen weltbild anhängt. distanziert davon hat sich frau borchardt nie. im gegenteil: bis heute relativiert sie die vielen mauertoten. bei einer gedenkminute für die opfer im landtag von mecklenburg-vorpommern ist sie demonstrativ sitzen geblieben. viel schlimmer kann man die opfer nicht verhöhnen. und das wohl perfideste: wenn die zeitungsberichte stimmen, hat diese frau als bürgermeisterin in der ddr republikflüchtlingen kurz vor deren ausreise das haus abgepresst. wie kann man eine solche frau zur verfassungsrichterin wählen? von allen linken parteien erwarte ich ja nichts anderes. aber dass die cdu einer solchen person mit ins amt verhilft, ist wirklich bemerkenswert. ich sage dazu nur: wer den schutz der verfassung einer richterin überlässt, die mit der verfassung offensichtlich probleme hat, der macht den bock zum gärtner und wird damit selbst zum risiko für die demokratie. im übrigen ist diese wahl im cdu-heimatverband der kanzlerin passiert. wo ist eigentlich der ruf von frau merkel, dass das rückgängig gemacht werden muss? da ist sie doch auch schnell bei der sache. diesmal hören wir nichts, und das ist bezeichnend für den zustand der cdu. diese partei betätigt sich heute als steigbügelhalter für linksextreme. dass es dagegen bei ihnen kein aufbegehren gibt, das ist das schlimme. das zeigt die ganze würstchenhaftigkeit ihrer truppe. die opferverbände kommunistischer gewaltherrschaft haben die richtige vokabel für dieses verhalten der union gefunden. sie lautet ganz einfach: schande. die bürger, die und gegen das kommunistische regime auf die straße gegangen sind, werden der cdu diese totalkapitulation vor den sed-jüngern nicht vergessen. die cdu hat damit das erbe der wiedervereinigung und auch das erbe der mutigen männer des . juni verraten. vielen dank. nächste rednerin ist für die fraktion der spd die kollegin elisabeth kaiser."
