,datum,redeID,vorname,nachname,fraktion,name,inhalt_neu
21,03.07.2018,ID194402100,Sven-Christian,Kindler,BÜNDNIS 90/DIE GRÜNEN,Sven-Christian Kindler,"sehr geehrte frau präsidentin! meine damen und herren! herr minister scheuer, am anfang will ich sie loben. sie haben in der ersten lesung dieses haushalts in der haushaltswoche anfang mai gesagt das war sehr richtig; ich zitiere : eine wende leitet man ein, wenn man in die falsche richtung gefahren ist . angesichts von acht jahren csu-verkehrspolitik sage ich: es wird höchste zeit für eine wende in der verkehrspolitik. ich will sie erinnern, was csu-verkehrspolitik heißt: pkw-maut-fiasko, chaos bei der wasser- und schifffahrtsverwaltung, ber, stuttgart , die klimaabgase steigen, wir haben marode eisenbahnbrücken, öpp-desaster, milliarden gelder für den breitbandausbau fließen nicht ab, giftige luft in den städten, der audi-chef sitzt jetzt sogar in untersuchungshaft und, und, und. ich könnte hier stundenlang, tagelang weitererzählen. hören sie auf mit dieser geisterfahrt! eine verkehrswende ist endlich notwendig. die sehen wir im haushalt aber leider nicht. wir sehen, dass die gelder für den straßenbau und für öpp-projekte steigen. ansonsten senken sie die mittel in den bereichen schiene, radverkehr, nahverkehr. dieser verkehrshaushalt ist leider die grundlage für eine verkehrspolitik des letzten jahrhunderts. das muss sich endlich ändern. wir haben hier klare anträge eingebracht, die zeigen, wie man das machen kann: das ministerium muss aufhören mit dem straßenbauwahnsinn. auch mit öpp-projekten, die teuer und eine privatisierung öffentlichen eigentums sind, muss schluss sein. wir wollen, dass das geld endlich für die verkehrswende genutzt wird. wir wollen eine verkehrswende in den städten, damit der radverkehr endlich in schwung kommt. wir wollen moderne mobilität fördern, wir wollen den bereich schiene fördern, den öffentlichen nahverkehr insgesamt, und wir wollen die ländlichen räume an den öffentlichen nahverkehr anschließen. das wäre ein sinnvoller verkehrshaushalt. das wäre ein verkehrshaushalt mit zukunft. das haben wir im haushaltsausschuss beantragt. statt darüber zu beraten, haben wir während der haushaltsberatungen wochenlang chaos und streit in dieser regierungskoalition gesehen, vor allen dingen zwischen cdu und csu. das hat auch europa schweren schaden zugefügt. ich erinnere daran, dass das nicht das erste mal ist, dass die csu offen europafeindlich agiert. das ist nicht erst seit diesem jahr so. es wurde nicht nur von einer herrschaft des unrechts , von grenzschließungen und obergrenze gesprochen. auch bei der pkw-maut geht es in die gleiche richtung. das thema ist massiv ressentimentgeladen. die pkw-maut hilft in der sache überhaupt nicht. im gegenteil: sie schadet in der sache und ist gerichtet gegen europa und gegen unsere nachbarn. trotzdem, obwohl die pkw-maut erst einmal ausgesetzt ist, haben sie millionen euro in diesem haushalt dafür veranschlagt, millionen euro mehr als . was ist das für ein verbrennen von steuergeld! ich sage ihnen: das muss endlich gestoppt werden. gucken wir auf die bayerische grenze: der kompromiss, den sie gestern abend geschlossen haben das ist ein mieser deal auf dem rücken von menschen; ich nenne das inhuman und schäbig , hat auch massive auswirkungen auf die verkehrspolitik in der grenzregion zwischen bayern und österreich. österreich hat jetzt schon gesagt, dass es die südgrenze dichtmachen wird, wenn diese inhumanen internierungslager kommen. sie legen mit ihrer verkehrs- und asylpolitik die axt an den schengen-raum. ich finde das unverantwortlich. herr minister scheuer, sie sind jetzt tage im amt. es ist an der zeit, eine kleine bilanz zu ziehen. es gab viele schöne pr-fotos, lässige posen, durchaus geschickter gemacht als von herrn dobrindt, aber in der substanz leider das gleiche elend. ich will ihnen nur zwei kurze beispiele nennen. wir haben einen milliardenschweren betrug der autoindustrie. sie mussten dann herrn zetsche vorladen, nachdem in den usa nicht in deutschland! bekannt wurde, dass es wiederum bei der automobilindustrie millionenfachen betrug gibt. was machen sie? sie lassen sich von herrn zetsche vorführen: eine rückrufaktion, und daimler soll ein jahr zeit für softwarelösungen bekommen. das, was sie wirklich machen müssten hardwarenachrüstungen, bußgelder verhängen, sanktionen , machen sie nicht. die europäische kommission hat ein vertragsverletzungsverfahren eingeleitet, weil es keine bußgeldverfahren gegen die automobilindustrie gibt. es zeigt sich: am ende sind sie wieder der minister, der die gewinninteressen der autoindustrie zulasten von umwelt und gesundheit schützt. so geht es nicht! zweites beispiel: toll collect. sie haben sich massiv unter zeitdruck setzen lassen bzw. sich selber unter zeitdruck gesetzt, weil sie unbedingt einen deal machen wollten. am ende haben sie im mautschiedsverfahren nur ein drittel ihrer berechtigten forderungen zugesprochen bekommen. das ist deutlich zu wenig. außerdem will ich sagen: sie lernen nichts aus dem mautschiedsverfahren, und sie lernen nichts aus der privatisierung der lkw-maut. der staat kann das besser und auch günstiger, weil er keine privaten renditeinteressen bedienen muss. stattdessen setzen sie weiter auf private schiedsgerichte, sie setzen weiter auf die privatisierung der lkw-maut. das kann man nur noch mit neoliberaler ideologie erklären. ich sage ihnen: hören sie auf damit! hören sie auf damit ist ein gutes stichwort. ich muss ihnen leider sagen, dass die redezeit zu ende ist. frau präsidentin, ich danke den kolleginnen und kollegen für die aufmerksamkeit. ich komme zum ende. das ist ein haushalt ohne zukunft. das muss sich dringend ändern. vielen dank. vielen dank, kollege kindler. jetzt hat besagter minister das wort. ich gebe das wort dem minister für verkehr und digitale infrastruktur, andreas scheuer."
22,03.07.2018,ID194402200,Andreas,Scheuer,CDU/CSU,Andreas Scheuer,"frau präsidentin! verehrte kolleginnen und kollegen! , milliarden, so viele kilometer legen die deutschen jeden tag zurück. , milliarden, die wir zu managen haben. im durchschnitt sind es pro person kilometer. wir wollen diese mobilität managen, verkehrsträger übergreifend. herr kollege kindler und herr kollege perli, sie sind doch berichterstatter im haushaltsausschuss. der einzelplan ist auch leicht zu lesen. es steht dort genau das drin, was sie hier jetzt kritisiert haben, abzulesen an zahlen und fakten. wir stärken den radverkehr, wir stärken die schiene und den regionalverkehr. wir stärken die gvfg-mittel für den nahverkehr. alles, was wir ins rollen bringen können, verkehrsträger übergreifend, haben wir in diesem haushalt abgebildet. deswegen bedanke ich mich bei cdu/csu und spd für diese kluge verkehrspolitik. die aufgabe für mein haus und für mein team ist doch klar umrissen: mobilität zu ermöglichen, zu erleichtern und für die zukunft zu sichern, mit anreizen und mit wahlfreiheit und nicht mit verboten. deswegen bezeichne ich es als kluge verkehrspolitik und gute infrastrukturpolitik, kräftig zu investieren und mit der herstellung von wahlfreiheit für die bürgerinnen und bürger mobilität zu ermöglichen und nicht einzuschränken. wenn ich in das weite rund des hauses blicke, möchte ich mich an diesem punkt des haushaltsverfahrens einmal grundsätzlich, auch wenn die konzepte unterschiedlich sind, bei den berichterstattern für die zusammenarbeit bedanken. sie haben uns auch mit berichten und fragen ordentlich in trab gehalten. wir haben sie alle abgearbeitet. ich möchte mich nicht nur beim haushaltsausschuss, sondern auch beim verkehrsausschuss bedanken; denn mit dem vorliegenden haushalt für können wir zuversichtlich in die zukunft schauen. wir sind ja auch schon bei der erarbeitung des haushaltes . meine damen und herren, verehrte kolleginnen und kollegen, fahrverbote jedenfalls gehören nicht zu meiner verkehrspolitik. wichtig ist nicht, verbote zu verhängen, sondern mobilität zu ermöglichen. wir brauchen nicht weniger, sondern mehr und gute mobilität. wir brauchen vor allem eine verkehrspolitik für eine intelligente, effiziente und saubere mobilität. herr kollege holm, auch sie haben den haushalt scheinbar zu wenig gelesen. wir fördern technologieoffen technologieoffen! die modernen antriebsmöglichkeiten, nicht nur elektromobilität, sondern auch brennstoffzelle, wasserstoff und synthetische kraftstoffe. zu all dem vom rednerpult aus verkehrs-fake-news zu verbreiten, bringt uns nicht weiter. wir wollen kräftig investieren: in die zukunft, in neue geschäftsmodelle und vor allem in unternehmen, die in die zukunft schauen und mit hunderttausenden von arbeitsplätzen die mobilität von morgen garantieren. meine damen und herren, wir als koalition schützen die arbeitsplätze: die, die wir jetzt haben und deren zahl auf rekordniveau ist, und die, die in zukunft durch neue geschäftsmodelle entstehen sollen. wir haben einen gesamtetat von , milliarden euro. davon werden rund milliarden euro für diesen etat bereitgestellt, um kräftig zu investieren. er ist der größte investitionsetat des bundes. an dieser stelle möchte ich mich ganz herzlich bedanken. herr meyer, wir haben natürlich die aufgabe, dafür zu sorgen, dass es zu einem besseren mittelabfluss kommt. aber damit es einen besseren mittelabfluss gibt, braucht es die notwendigen grundentscheidungen, die gewährleisten, dass wir planer, gutachter und ingenieure haben. ich möchte mich auch für den aufwuchs beim personal sehr herzlich bedanken. wir brauchen gute, motivierte mitarbeiterinnen und mitarbeiter. ich habe eine ausbildungsoffensive gestartet, und ich habe den jungen leuten garantien gegeben, damit sie bei der öffentlichen verwaltung bleiben. von vier personen, die wir ausbilden, verlieren wir derzeit nämlich drei an andere verwaltungen oder an die freie wirtschaft. ich möchte, dass sich dieser trend umkehrt und wir den jungen leuten eine perspektive in unserer verwaltung bieten. die botschaft an die bürgerinnen und bürger muss lauten: seid motiviert! wir, unser ministerium und auch die vielen nachgelagerten behörden, sind ein guter arbeitgeber. wir brauchen die jungen leute, meine damen und herren. für einen besseren mittelabfluss habe ich einen baugipfel abgehalten, um mit der bauindustrie in einen dialog zu treten. der investitionshochlauf, den alexander dobrindt gestartet hat, muss solide fortgesetzt werden. es muss hier zu einem mittelabfluss kommen, damit wir mit guten baufirmen zusammenarbeiten können. meine damen und herren, wir sind kreativ. wenn sie sich die förderungen fürs gewerbe anschauen, stellen sie das fest. ich habe nächste woche einen gipfel zum abbiegeassistenten. wir haben bereits mit den ersten unternehmen angefangen. wir werden diesen abbiegeassistenten fördern; denn hier geht es um eine förderung von sicherheit. wir wollen die schlimmen unfälle mit kindern und jugendlichen vermeiden. deswegen werden wir auch mit ihrer unterstützung mit gutem beispiel vorangehen und den fuhrpark des bmvi und seiner vielen nachgelagerten behörden entsprechend ausrüsten. wir wollen also mit gutem beispiel vorangehen und den abbiegeassistenten, der ein paar hundert euro kostet, einbauen. wir haben die trassenpreise gesenkt, wir investieren verkehrsträgerübergreifend, und wir setzen einen schwerpunkt bei der digitalen infrastruktur. es freut mich, dass die vorredner nicht nur auf das brot-und-butter-geschäft des verkehrsministeriums eingegangen sind, sondern auch auf das thema der digitalen infrastruktur. ich kann ihnen heute vermelden: wir geben in diesen stunden die richtlinie zur förderung des breitbandausbaus frei. es handelt sich um eine neue richtlinie, die dazu führt, dass wir zeit sparen. wir haben intensiv mit den kommunen zusammengearbeitet. auch aus dem parlament sind sehr, sehr viele gute vorschläge gekommen. herzlichen dank dafür! beispielsweise haben wir das scoring, also das bewerten jedes antrags anhand eines umfassenden kriterienkatalogs, komplett abgeschafft, und wir ermöglichen ein upgrade. wir möchten, dass das programm intensiver genutzt wird und sich die planzeiten mindestens um ein halbes jahr verkürzen. deswegen werde ich heute den startschuss geben. die neuen anträge können ab dem . august dieses jahres gestellt werden. somit ist die forderung glasfaser bis ins haus keine wunschvorstellung, sondern sie wird durch diese koalition realität. außerdem werde ich noch vor der sommerpause einen mobilfunkgipfel durchführen. ich bin unzufrieden damit, dass es immer noch stellen gibt woran auch immer wieder kritik geäußert wird , wo es teilweise seit jahren oder jahrzehnten funklöcher gibt. wir müssen diese funklöcher schnellstens abarbeiten. deswegen führe ich einen mobilfunkgipfel mit den anbietern durch, damit unsere hochentwickelte wirtschaft endlich auch an dieser stelle besser wird. das werden wir tun, und wir werden schulen mit schnellem internet versorgen. wir haben das digitale testfeld in häfen und die -strategie für den neuen mobilfunkstandard, und wir werden mit kreativen köpfen und kreativen ideen schauen, dass wir in diesem ministerium im haushaltsjahr ordentlich vorwärtskommen. auch in werden wir dieses lebensministerium so mit investitionen ausstatten, dass das steuergeld der bürgerinnen und bürger bei ihnen wieder reinvestiert wird, damit berlin nicht weit weg von den bürgerinnen und bürgern ist, sondern die investitionen vor ort getätigt werden. dafür brauche ich ihre unterstützung, und ich bedanke mich für diesen haushalt bei allen, die tatkräftig mitgeholfen und nicht nur kritisiert haben. herzlichen dank. vielen dank, andreas scheuer. nächster redner für die afd-fraktion: wolfgang wiehle."
23,03.07.2018,ID194402300,Wolfgang,Wiehle,AfD,Wolfgang Wiehle,"sehr geehrte frau präsidentin! kolleginnen und kollegen! die schienenwege, straßen und digitalen netze sind die lebensadern unseres landes. sie bedarfsgerecht auszubauen und in schuss zu halten, ist kernaufgabe der politik. wie oft habe ich aber in den letzten wochen gehört, dass es gar nicht einmal an geld mangelt, sondern bürokratie und lange planungszeiten im wege stehen. in diesem lande sind viel zu oft die bremser am zug und nicht die macher. unsere nachbarn wundern sich immer wieder, warum es beim deutschen anteil an grenzüberschreitenden projekten so langsam vorangeht. der kollege holm hat die anbindung des fehmarnbelt-tunnels bereits erwähnt. wir brauchen eine beherzte planungsbeschleunigung, und zwar so, dass der dialog mit den bürgern vor ort auch in zukunft seinen guten platz hat. die einsprüche, die einzig und allein der verhinderung dienen, müssen ins leere laufen. in den letzten jahren wurde der ausbau der rheintal-strecke mit großzügigem lärmschutz entworfen weit über das gesetzlich geforderte maß hinaus. das kostet zwar viel geld zusätzlich, wird aber viel besser akzeptiert. der ausbau der zulaufstrecke für den brenner-basistunnel muss auf dieselbe großzügige weise mit lärmschutz ausgerüstet werden. wenn das von vornherein klar ist, dann sollte betrachtet man das mit gesundem menschenverstand die planung auch rasch zu einem guten ergebnis führen. realismus, transparenz und verlässlichkeit: das hat die afd-fraktion bei der beratung des haushalts für verkehr und digitale infrastruktur eingefordert. auch wenn sie die öffentlichkeit wochenlang mit ihrem streit in atem halten, meine damen und herren kolleginnen und kollegen von der regierungskoalition: für die ablehnung auch der sinnvollsten anträge der opposition reicht die einigkeit ja dann doch aber zum schaden unseres landes. transparenz bedeutet zum beispiel, wie vom bundesrechnungshof ja auch gefordert, die bundesmittel für das projekt stuttgart in einem eigenen haushaltstitel auszuweisen. was gibt es hier eigentlich zu verbergen? warum verweigert die mehrheit dieses hauses einen solchen schritt, der nicht einen einzigen euro mehr kosten würde? realismus heißt, die verkehrsachsen dort auszubauen, wo wirklich bedarf besteht. ein wichtiges beispiel sind die tausenden von lastwagen, die jeden tag im transitverkehr durch unser land rollen und die staus auf den autobahnen länger werden lassen. sorgen wir dafür, dass ein wachsender anteil davon auf die schiene verlagert wird. die afd setzt sich dafür ein, die notwendigen stationen und kapazitäten auf den bahnstrecken zügig zu planen und auszubauen. bei der verlässlichkeit sind wir einen ganz kleinen schritt weiter. die versprochene senkung der trassenpreise, also der schienenmaut, im güterverkehr soll nun doch noch in kommen, jedenfalls wenn brüssel es erlaubt. über den weg dorthin kann man aber nur den kopf schütteln. an einem vormittag wurde im verkehrsausschuss der afd-antrag hierzu abgelehnt, auch mit den stimmen der grünen. am selben tag wurde im haushaltsausschuss am nachmittag seitens der grünen ein eigener antrag eingebracht, der dem antrag der afd sehr, sehr ähnlich war. in der bereinigungssitzung schob die koalition einen weiteren antrag nach. meine damen und herren, manches kann man auch einfacher haben. wir laden sie dazu ein, auch einmal einem afd-antrag zuzustimmen. dann klappt es vielleicht auch mit der transparenz bei stuttgart . wenn wir an der spitze der technologischen entwicklung mitspielen wollen, müssen wir auch bei der digitalen vernetzung kräftig nachlegen. die produktion der zukunft, aber auch viele alltägliche abläufe werden ohne das internet der dinge nicht mehr vorstellbar sein. dafür brauchen wir schnellere netze, glasfaserverkabelung und mobilfunk nach dem standard . wie bei straßen- und schienenwegen fehlt es hier meist nicht primär am geld. fördermittel in beträchtlicher höhe bleiben liegen, weil die bürokratie im wege steht. dass nach den regeln der eu internetanschlüsse standardmäßig nur bis megabit pro sekunde gefördert werden dürfen, ist einfach ein anachronismus. für die digitalen netze brauchen wir genauso eine planungs- und umsetzungsbeschleunigung. wir dürfen uns nicht blindlings auf den markt verlassen. vielleicht funktioniert das in den großen städten. aber in der fläche wird vielerorts wie beim straßenbau die öffentliche hand die infrastruktur selbst hochziehen müssen. wir dürfen nicht jahrelang warten, bevor wir netz- und funklöcher mit notmaßnahmen schließen. nutzen wir die verfügbaren mittel, um die digitale infrastruktur systematisch auszubauen. die lebensadern unseres landes, meine damen und herren, verkehrswege und digitale netze, brauchen eine befreiung von den blockaden, die bürokratie und ideologie verursachen. dann können wir die staatlichen mittel effizient und nutzbringend einsetzen. nur so kommt deutschland wieder an die spitze der entwicklung. vielen dank. nächster redner: gustav herzog für die spd-fraktion."
24,03.07.2018,ID194402400,Gustav,Herzog,SPD,Gustav Herzog,"frau präsidentin! liebe kolleginnen und kollegen! diese koalition investiert tatkräftig in die digitale zukunft unseres landes. herr bundesminister, wir sind heftig dabei, den koalitionsvertrag umzusetzen. das spiegelt sich in diesem haushalt wider. mein dank geht auch an die haushälter der koalition, die die fachlichen anregungen der politiker aus dem ausschuss für verkehr und digitale infrastruktur gerne übernommen haben. liebe kolleginnen und kollegen, digitale infrastruktur ist kein selbstzweck. wir wollen, dass die menschen einen zugang zum schnellen internet bekommen, dass die wirtschaft einen draht in eine leistungsfähige und vor allen dingen zuverlässige digitale infrastruktur hat. wie rasant diese entwicklung in der wirtschaft ist, will ich an der begrifflichkeit industrie . festmachen. als in der wissenschaftsstadt kaiserslautern das erste mal der begriff smart factory fiel, haben noch viele gefragt: was ist denn das? heute ist es allgemeingut. wir wissen: es ist die zukunft unseres landes. liebe kolleginnen und kollegen, in diesem koalitionsvertrag ist wie in keinem anderen vorher das ziel der gleichwertigkeit der lebensverhältnisse auch im hinblick auf die digitale ausstattung unseres landes festgeschrieben. wir wollen auch, dass der ländliche raum genauso wie die urbanen zentren die entsprechenden möglichkeiten hat. das ist ein schwerpunkt dieses koalitionsvertrages und dieser koalition. wir wollen, dass die förderung des infrastrukturausbaus technikneutral vonstattengeht. alle, die sich mit dieser sache intensiver beschäftigen, wissen: gigabitfähige infrastruktur heißt breitband und , wobei für mich die heirat von einer wirklichen breitbandversorgung und mobilfunk ist und die glasfaser der trauzeuge ist. herr kollege, herr bundesminister, es war gut eine richtige punktlandung , heute die neue förderrichtlinie für den breitbandausbau auf den tisch zu legen und dabei besonders zu erwähnen, dass auch der ausbau der versorgung mit mobilfunknetzen teil dieser richtlinie ist. da gehen wir gemeinsam einen guten weg. liebe kolleginnen und kollegen, in der letzten woche hat der beirat bei der bundesnetzagentur auf anregung der koalitionsfraktionen einen guten beschluss gefasst, wie wir uns die ausstattung mit vorstellen. und ich will, weil einige gesagt haben, wir hätten das sozusagen im stillen kämmerlein gemacht, sagen: nein, wir haben mit allen aus der branche gesprochen: den mobilfunkern, den dienstleistern, den herstellern, der industrie. das war ein sehr breit abgestimmter weg, den wir hier gegangen sind, und es war ein guter beschluss, was sich auch daran zeigt, dass es keine gegenstimmen gab, sondern nur vereinzelt enthaltungen. liebe kolleginnen und kollegen, beim mobilfunk reiht sich jetzt wohl ein gipfel an den anderen. und, herr bundesminister, ich hoffe, es wird ein gipfel und nicht wie in nrw nur ein hügel. denn dort ist im grunde genommen etwas vereinbart worden, was ja in der verpflichtung der mobilfunker steht, und das land nordrhein-westfalen war dann so schlau, zu sagen: wir fordern dann mal den bund auf, für ein beihilfeprogramm zu sorgen, oder wir fordern die bundesnetzagentur auf, auf eine dienstanbieterverpflichtung zu verzichten. liebe kolleginnen und kollegen, nordrhein-westfalen kann hier kein vorbild sein. ich denke, beim bund können wir es besser, so wie wir es mit diesem haushalt deutlich machen, indem wir in modellregionen und in mehr qualität und sicherheit beim mobilfunk auf und entlang der schienenwege investieren. wir sind gut aufgestellt. wir werden es tatkräftig umsetzen. vielen dank für die aufmerksamkeit. vielen dank, gustav herzog. nächster redner: bernd reuther für die fdp-fraktion."
