,datum,redeID,vorname,nachname,fraktion,name,inhalt_neu
105,28.04.2022,ID203110500,Kay-Uwe,Ziegler,AfD,Kay-Uwe Ziegler,"sehr geehrte frau präsidentin! sehr geehrte kolleginnen und kollegen! die einrichtungsbezogene impfpflicht mit der erklärten zielstellung des fremdschutzes, in diesem fall des schutzes der zu betreuenden patienten, ist krachend gescheitert und muss umgehend wieder zurückgenommen werden. in der gestrigen sitzung des gesundheitsausschusses stellte ich nachfolgende frage ans ministerium, ans robert-koch-institut und auch ans paul-ehrlich-institut: gibt es eine studie, mit der nachgewiesen werden konnte, dass ungeimpfte mitarbeiter in den gesundheitsberufen mehr patienten mit corona infizieren als vollständig geimpfte mitarbeiter? vom ministerium und vom rki gab es nur ein ganz kurzes nein als antwort. vom paul-ehrlich-institut erhielt ich überhaupt keine antwort. professor wieler äußerte in der nächsten runde noch den satz, es gebe da eine modellierung, und die werde das wohl irgendwie nachweisen können. eine modellierung? da draußen gibt es doch echte menschen in den medizinischen berufen, die seit über zwei jahren mit und ohne impfung tagtäglich ihren job machen. deshalb müsste es doch möglich sein, dass in vorbereitung dieses gesetzes über eine einrichtungsbezogene impfpflicht ein beweis vorgelegt wird, dass die ungeimpften pflegekräfte für ihre patienten eine größere gefahr der ansteckung mit covid- darstellen als die geimpften mitarbeiter. sie ahnen es vielleicht schon: diesen wissenschaftlichen nachweis gab und gibt es bis heute nicht. ich sage ihnen auch, warum das so ist. weil in diesem haus immer noch alle entscheidungen zum thema impfen unter einem falschen narrativ aus dem jahr getroffen werden. bei den allermeisten kolleginnen und kollegen hier steht immer noch wie in stein gemeißelt: die impfung sorgt für eine sterile und lebenslange immunität. wir wissen aber heute: dem ist nicht so. deshalb müssen unser gesamter umgang mit covid- und die bewertung der impfung endlich neu gedacht werden. die neuen impfstoffe, die nicht leisten können, was man uns ende vollmundig versprochen hat, dienen im günstigsten fall dem eigenschutz. deshalb ist durch die impfpflicht in den gesundheitsberufen das eigentlich angestrebte ziel, der patientenschutz, nicht erreichbar. da gibt es noch ein problem, meine damen und herren: nicht nur, dass die impfstoffe nicht die gewünschten wirkungen entfalten. sie entfalten auch noch wirkungen, die nicht gewünscht sind. ich empfehle allen vertretern der glaubensgemeinschaft diese impfung ist nebenwirkungsfrei , den gestrigen mdr-bericht impfkomplikationen: mehr schwere nebenwirkungen als gedacht? anzuschauen. schauen sie sich den bericht an! nach einer studie von professor dr. harald matthes von der berliner charité können schwere nebenwirkungen bei , prozent aller geimpften auftreten. das wäre jeder hundertfünfundzwanzigste. sollten sich diese studienergebnisse bewahrheiten, meine damen und herren, dann stehen wir vor dem größten medizinskandal deutschlands, und eine beibehaltung der impfpflicht für die gesundheitsberufe wäre unverantwortlich. nachfolgend noch eine kleine geschichte für die, die diese einrichtungsbezogene impfpflicht so toll finden: stellen sie sich vor, sie kommen in ein krankenhaus, hatten einen unfall, und nach anderthalb stunden wartezeit fragen sie die vorbeihuschende schwester, wer sich denn irgendwann einmal um sie kümmert, und dann lautet die antwort, dass die eigentlich diensthabende hervorragende notärztin seit gestern ein betretungsverbot hat. dann wird auch ihnen schlagartig klar, dass eine stimme für die einrichtungsbezogene impfpflicht eine richtig, richtig schlechte idee war. und nein, ich wünsche niemandem ein solches erlebnis. aber manchmal hilft ja eine persönliche erfahrung beim erkenntnisfortschritt. sehr geehrte damen und herren, das klatschen von den balkonen ist verstummt. es wurde daraus eine impfpflicht für die gesundheitsberufe, und wer dieser pflicht nicht nachkommen will, auf den warten jetzt betretungsverbote und der verlust der beruflichen existenz. ich möchte sie vielmals bitten: lassen sie uns die persönlichen entscheidungen der pflegekräfte da draußen egal ob pro oder kontra impfung akzeptieren! beenden wir die bis heute anhaltende ungerechtfertigte ausgrenzung der ungeimpften mitarbeiter! sie alle haben unseren respekt verdient. wir brauchen jeden einzelnen, weil wir viel zu wenige von ihnen haben. vielen dank. heike engelhardt ist die nächste rednerin für die spd-fraktion."
106,28.04.2022,ID203110600,Heike,Engelhardt,SPD,Heike Engelhardt,"sehr geehrte frau präsidentin! sehr geehrte kolleginnen und kollegen! liebe bürgerinnen und bürger, ganz besonders aus meinem wahlkreis ravensburg und dem bodenseekreis! als ich den antrag gelesen habe, dachte ich, dass ich in einer zeitschleife gefangen wäre. hatte ich nicht hier am . februar meine erste bundestagsrede zu ihrem antrag zur aufhebung der einrichtungsbezogenen impfpflicht gehalten? meine mitarbeiter konnten mir aber versichern, dass es keine fehlgegangenen experimente im cern gab und ich auch nicht in der matrix gefangen bin. ganz im gegenteil: unsere zeit hier wird geraubt von der opposition, die einfach ihren antrag noch einmal einbringt, obwohl der alte nicht einmal final behandelt wurde und auch keine aussicht auf erfolg hat. wir hatten erst gestern die öffentliche anhörung zu diesem thema. wie sehr wollen sie sich eigentlich blamieren? alles, was es dazu zu sagen gibt, wurde hier zu ihrem alten antrag schon gesagt. und täglich grüßt das murmeltier! die einrichtungsbezogene impfpflicht ist nicht nur wichtig nein , sie ist auch richtig, um besonders gefährdete gruppen zu schützen. menschen, die in gesundheitsberufen arbeiten, haben eine besondere verantwortung gegenüber denjenigen, die sie behandeln, betreuen und pflegen. hochbetagte, chronisch kranke und pflegebedürftige menschen haben ein deutlich erhöhtes risiko, schwer an covid zu erkranken und zu sterben. uns geht es auch darum, das gesundheitssystem am laufen zu halten und dafür zu sorgen, dass es nicht erneut zu großen ausbrüchen zum beispiel in alten- und pflegeheimen kommt. klar hätten wir von der spd-fraktion bis auf wenige ausnahmen uns gewünscht, dass es diese ungleichbehandlung bezüglich der impfpflicht zwischen dem pflegepersonal und der restlichen bevölkerung nicht geben würde, sondern dass sich alle impfen lassen müssen. dafür können sich diese berufsgruppen bei fdp und cdu/csu bedanken, die mit ihren verantwortungslosen, parteitaktischen und diesem parlament unwürdigen spielen eine allgemeine impfpflicht verhindert haben. ich freue mich, dass die einrichtungsbezogene impfpflicht jetzt umgesetzt wird, und zwar so, wie wir sie hier in diesem parlament beschlossen haben. ich setze mich auch weiterhin für eine allgemeine impfpflicht ab jahren ein. denn die bekämpfung der pandemie ist eine aufgabe, an der wir uns alle beteiligen müssen, nicht nur einzelne berufsgruppen. also, egal wie oft sie den antrag noch stellen: wir lehnen ihn überzeugt ab. und ganz zum schluss: falls es sich doch um eine zeitschleife handelt, hier ein kleiner service. erlauben sie eine zwischenfrage des kollegen sorge? nein. hier noch ein kleiner service für diejenigen, die in der zeitschleife sind: die lottozahlen am kommenden samstag lauten: , , , , , , superzahl . viel erfolg und vielen dank. und ich gebe dem kollegen sorge die möglichkeit zu einer kurzintervention."
107,28.04.2022,ID203110700,Tino,Sorge,CDU/CSU,Tino Sorge,"vielen dank, frau präsidentin. liebe frau kollegin engelhardt, da sie gerade den eindruck erweckt haben, als sei die allgemeine impfpflicht quasi an der überwiegenden mehrheit hier gescheitert, würde ich sie gerne fragen: ist ihnen bewusst, dass gegen die allgemeine impfpflicht in der form, wie sie sie vorgeschlagen haben, eine negative kanzlermehrheit gestimmt hat? sie haben die möglichkeit, zu antworten. wenn sie dazu aufstehen würden! herr brandner, jetzt hat die kollegin engelhardt die möglichkeit, zu antworten."
108,28.04.2022,ID203110800,Heike,Engelhardt,SPD,Heike Engelhardt,"ich kann antworten, aber ich muss nicht. dann fahren wir fort in der debatte. der kollege dr. georg kippels, cdu/csu-fraktion, hat das wort."
109,28.04.2022,ID203110900,Georg,Kippels,CDU/CSU,Georg Kippels,"verehrte frau präsidentin! liebe kolleginnen und kollegen! verehrte damen und herren! geimpft zu sein ist besser, als nicht geimpft zu sein. diesen satz unterstreiche ich ausdrücklich. er zeigt auch meine tiefe innere überzeugung, dass impfen nach wie vor ein hoch wirkungsvolles und erstrebenswertes mittel im kampf gegen die pandemie ist. ich werbe unverändert für die ausdehnung der impfquote. aber aus meiner feder stammt dieser satz nicht. vielmehr ist er in der urheberschaft des präsidenten des rki, professor lothar wieler, der gestern in dieser besagten anhörung auf die frage des kollegen von der afd genau diesen komprimierten satz gesagt hat und weiter erläutert hat, dass es nicht nur um die wirkung des eigenschutzes der impfung geht, sondern natürlich auch um den fremdschutz. denn es ist für dritte ein ganz erheblicher vorteil, wenn der ausstoß der virenlast deutlich geringer ist, und das ist der fall. die pandemie ist nicht vorbei. wir müssen uns weiter mit diesem thema auseinandersetzen. alleine die heutigen zahlen zeigen dies: inzidenz auch wenn sich die aussagekraft der inzidenzzahl gewandelt hat , neuinfektionen. und wieder sind sterbefälle zu beklagen. herr kippels, erlauben sie eine zwischenfrage? nein, das erlaube ich nicht. intensivbetten sind belegt. bei der impfquote sind wir bedauerlicherweise erst bei , prozent grundimmunisierten und bei prozent bei den boostern. hier besteht nachholbedarf. von delta zu omikron haben wir in der tat eine veränderung im erscheinungsbild: wir haben weniger schwere verläufe, aber mehr infektionen. dennoch sind wir weit davon entfernt, dass diese erkrankung nur als normale grippe deklariert werden kann. falsche botschaften sind brandgefährlich und vollkommen unangebracht! wissen wir, was kommt? nein, das wissen wir leider nicht. auch das hat bundesgesundheitsminister lauterbach heute morgen in unserer ausschusssitzung bestätigt. die entwicklung der mutationen vorherzusehen, bedarf leider eines blickes in die glaskugel. es bleibt zwar zu hoffen, aber es ist nicht sicher, dass passgenaue impfstoffe entwickelt werden können. nichtsdestotrotz muss es unsere gemeinsame aufgabe sein, die impfungen weiter fortzuführen, und das gilt gerade auch in den einrichtungen. die bewohnerinnen und bewohner von einrichtungen, die zu pflegenden, sind die verletzlichste personengruppe in dieser pandemie. dieser müssen wir eine ganz besondere aufmerksamkeit widmen. deshalb ist die einrichtungsbezogene impfpflicht auch seitens der cdu/csu im dezember für grundsätzlich richtig gehalten worden. überdies bin ich der meinung, dass die impfung von pflegepersonal auch eine frage des berufsethos ist. aber das darf nicht unerwähnt bleiben wir haben von anfang an kritisiert, dass die systematik und die ausführung mangelhaft sind. da muss nachgearbeitet werden; hier besteht dringender handlungsbedarf. wir sind in der verantwortung für kommunen und träger. sie dürfen mit den rechtsfolgen für die mitarbeiter und für ihr versorgungssystem nicht allein gelassen werden. deshalb, so die vorstellung seitens der cdu/csu, ist es wichtig, dass an dieser stelle nachjustiert wird nicht durch rücknahme der regelung, sondern durch eine vorläufige aussetzung, um das system nicht ohne not zu belasten. aber und das sollte unser gemeinsames bemühen sein wir müssen die zeit nutzen. so das sagte heute morgen auch professor hallek, der ärztliche direktor der universitätsklinik köln sollten wir mit augenmaß nicht bei unseren bemühungen nachlassen, auf überzeugung hinzuwirken, damit auch das pflegepersonal in der zwischenzeit die impfung an sich vornehmen lässt. kommen sie bitte zum schluss. wir werden diesen antrag ablehnen und an der steigerung der impfquote gemeinschaftlich intensiv arbeiten. der antrag ist abzulehnen. vielen dank für die aufmerksamkeit. jetzt erhält der kollege sichert die möglichkeit einer kurzintervention. herr sichert, sie haben das wort."
110,28.04.2022,ID203111000,Martin,Sichert,AfD,Martin Sichert,"vielen dank für das zulassen der kurzintervention. wenn ich auch die aufmerksamkeit vom kollegen kippels haben könnte, der gerade hierzu gesprochen hat? herr kippels, sie haben gesagt, dass die einrichtungsbezogene impfpflicht durchaus sinn macht, auch wegen eines gewissen fremdschutzes. kennen sie beispielsweise die studie von hansen, in der festgestellt wurde, dass bei omikron tage nach der impfung mit biontech die wahrscheinlichkeit eines geimpften, sich zu infizieren, anderthalbmal so hoch ist wie bei einem ungeimpften? seit omikron haben wir eine komplett andere lage in bezug auf den fremdschutz, der sich durch die impfung nach tagen nämlich ins negative verkehrt. entsprechend ist bei omikron auch der eigenschutz durch die impfung nicht mehr relevant vorhanden. , prozent derjenigen, die in den letzten vier wochen auf die intensivstationen gekommen sind, haben in den letzten sechs monaten eine impfung erhalten. das sind mehr menschen, als dieser anteil an der gesamtbevölkerung ausmacht. das heißt, wir haben bei der impfung weder einen relevanten eigenschutz noch einen relevanten fremdschutz. wie können sie sich unter solchen umständen dafür aussprechen, dass man eine einrichtungsbezogene impfpflicht in irgendeiner weise weiter braucht?"
111,28.04.2022,ID203111100,Georg,Kippels,CDU/CSU,Georg Kippels,"verehrter herr kollege sichert, sie haben eine studie zitiert, von deren richtigkeit sie ausgehen. aber in dem vortrag von professor wieler gestern im ausschuss ist auch darauf hingewiesen worden, dass das rki sich permanent mit zahlreichen studien auseinandersetzt und daraus im sinne einer soliden wissenschaftlichen arbeit eine mehrheitsmeinung herausarbeitet. das ist im rahmen dieser empfehlung geschehen. deshalb werde ich mich mit sicherheit nicht einer einzigen meinung anschließen, nur weil diese vielleicht ihrem meinungsbild besonders gelegen kommt. nun hat die kollegin kordula schulz-asche, bündnis /die grünen, das wort."
112,28.04.2022,ID203111200,Kordula,Schulz-Asche,BÜNDNIS 90/DIE GRÜNEN,Kordula Schulz-Asche,"vielen dank. frau präsidentin! die einrichtungsbezogene impfpflicht gegen covid- hat zum ziel, menschen zu schützen, die hochbetagt sind, pflegebedürftig oder schwer krank oder alles gemeinsam, und zwar durch die impfung des personals für den eigenen schutz des personals und für den schutz der ihnen anvertrauten menschen. das gilt auch für die omikron-variante. die gestrige anhörung im ausschuss für gesundheit hat gezeigt, dass die von einigen hier beschworene gefahr eines massenhaften ausstiegs von pflegekräften aus der pflege nicht eingetreten ist. es gibt keinen signifikanten anstieg bei kündigungen oder bei meldungen von arbeitslosigkeit bei pflegekräften. die impfquote in krankenhäusern liegt im durchschnitt bei über prozent es gibt unterschiede und damit weit über der impfquote der gesamtbevölkerung. für die langzeitpflege liegen noch keine abschließenden ergebnisse vor. ich selber war vor kurzem in einem pflegeheim in meinem wahlkreis, in dem es natürlich verunsicherung gab, in dem natürlich die aufklärung und die diskussionen weitergingen. inzwischen liegt die impfquote in diesem pflegeheim bei prozent. das ist auch kein wunder; denn, meine damen und herren, pflegeeinrichtungen in deutschland arbeiten wissenschaftsbasiert nach den vorgaben des robert-koch-instituts und des paul-ehrlich-instituts. das ist auch gut so. zudem sind pflegekräfte in deutschland befähigt, eigenverantwortlich zu handeln. sie wissen um ihre besondere verantwortung und die sorgfaltspflicht für die menschen, die ihnen anvertraut sind, und deren familien. professionelle pflegekräfte orientieren sich an wissenschaftlichen empfehlungen unserer institutionen. dazu gehören, wie schon erwähnt, das robert-koch-institut und das paul-ehrlich-institut. wir werden auch von diesen instituten erfahren, wie der weitere verlauf dieser pandemie sein wird, wie die varianten sich verhalten und welche impfstoffe wir brauchen, um diese varianten in den griff zu bekommen. deswegen sind die empfehlungen von robert-koch-institut und paul-ehrlich-institut empfehlungen für die bevölkerung im interesse der bevölkerung. pandemien haben immer zur folge, dass es ein spannungsverhältnis zwischen grundrechten auf der einen seite und dem schutz vor infektionen auf der anderen seite gibt. für uns sind in der aktuellen situation der infektionsschutz und die impfung solidarität mit den schwächsten, gerade in zeiten der pandemie. ich danke ihnen für ihre aufmerksamkeit. die nächste rednerin: kathrin vogler, fraktion die linke."
113,28.04.2022,ID203111300,Kathrin,Vogler,DIE LINKE,Kathrin Vogler,"sehr geehrte frau präsidentin! werte kolleginnen und kollegen der demokratischen fraktionen! seit dem . märz sind beschäftigte in einrichtungen der kranken- und altenpflege, des gesundheitswesens und von behinderteneinrichtungen gesetzlich verpflichtet, nachzuweisen, dass sie gegen covid- geimpft sind. an dieser einrichtungsbezogenen impfpflicht gibt es durchaus sachliche kritik sowie sicher auch nachbesserungsbedarf bei der umsetzung. aber der vorliegende antrag der afd ist weder sachlich noch konstruktiv, und deswegen lehnen wir ihn ab. gerade die afd mit ihrem ideologischen kampf gegen masken, coronaschutzregeln und impfungen sowie ihrer strategie der maximalen verunsicherung sorgt doch mit dafür, dass wir von den hohen inzidenzen nicht herunterkommen. das bedeutet für die beschäftigten im gesundheitswesen nicht nur massive arbeitsbelastungen, sondern auch das ständige risiko, selbst infiziert zu werden und zu erkranken. die afd nutzt die schlimme situation in der pflege, um weiter fake news über die coronaimpfung zu verbreiten. dazu hat sie uns gestern in der anhörung des gesundheitsausschusses sogar einen sachverständigen zugemutet, der allen ernstes der auffassung ist, dass adipositas keine gefahr für die gesundheit ist. die sehr sicheren impfstoffe, die schon hunderttausende leben gerettet haben, hält er aber für echt gefährlich. also, das ist doch absurd! und sie berufen sich auf evidenz und wissenschaft? sie zitieren die deutsche krankenhausgesellschaft, um ihren kruden thesen den anschein der seriosität zu verleihen, unterschlagen dabei aber die eigentliche schlussfolgerung. in der stellungnahme heißt es nämlich wörtlich da geht es um die allgemeine impfpflicht : somit laufen wir gefahr, dass wir im herbst vor der gleichen situation stehen wie vor einem jahr: neuer lockdown, gefahr der überlastung von kliniken, patientinnen und patienten werden sich erneut auf wartelisten wiederfinden. das können sie natürlich alles ignorieren. aber dass sie das unterschlagen, zeigt doch, dass sie hier nicht seriös arbeiten. vor diesem hintergrund, finde ich, sollte sich übrigens die bundesregierung sehr viel ernsthafter damit beschäftigen, das gesundheitswesen auf einen möglichen dritten pandemiewinter vorzubereiten und nachhaltig die arbeitssituation in den kliniken und in den pflegeeinrichtungen zu verbessern. dafür brauchen wir dringend flächendeckende tarifverträge für eine gute bezahlung und die abschaffung des kirchlichen sonderarbeitsrechts, entlastungstarifverträge, die einen ausgleich für die belastungen in unterbesetzten bereichen vorschreiben, also genau das, wofür im augenblick die kolleginnen und kollegen der unikliniken in nrw kämpfen. vor allem brauchen wir dafür sind sie zuständig eine gesetzliche personalbemessung in der pflege, und zwar schnell. die beschäftigten in den arztpraxen, in den kliniken und in den pflegeeinrichtungen warten schon zu lange auf wirkliche entlastung und anerkennung. als soziale opposition werden wir nicht lockerlassen, damit hier endlich etwas passiert. und der nächste redner in der debatte: professor dr. andrew ullmann, fdp-fraktion."
