,datum,redeID,vorname,nachname,fraktion,name,inhalt_neu
31,18.11.2021,ID20303100,Silvia,Breher,CDU/CSU,Silvia Breher,"sehr geehrte frau präsidentin! liebe kolleginnen und kollegen! es ist ja schön, und es ist auch wichtig, dass wir über den ausbau der ganztagsbetreuung und den weg, auf dem wir ihn hinbekommen, diskutieren. aber darum geht es heute in diesem gesetzentwurf nicht. wir haben im rahmen des konjunkturprogramms das hat meine kollegin frau launert schon ausgeführt mittel zur verfügung gestellt für den beschleunigten ausbau von infrastruktur für die ganztagsbetreuung; mittelabruffrist ende dieses jahres, damit es schnell geht, damit impulse in die wirtschaft gehen. und oh wunder: die kommunen haben es angenommen. in meinem wahlkreis zum beispiel kann ich den kommunen keinen vorwurf machen, dass sie die mittel bis ende des jahres nicht abrufen können. allein der runderlass aus niedersachsen spd-haus kam ende januar, zehn tage später war der antrag der gemeinde essen gestellt, und dann hat es vier monate gedauert, bis das spd-haus in niedersachsen ihn beschieden hat. dann wurde gebaut, und jetzt wird es nicht fertig, weil die handwerker coronabedingt nicht so schnell sind, weil das material fehlt. jetzt gibt es eine ganz, ganz einfache lösung für dieses problem. sie diskutieren über einen grundsatz, und wir wollen nur dieses schlichte, einfache problem lösen. die frist zum mittelabruf einfach um ein jahr zu verlängern, das ist inhalt unseres antrages, und darum geht es hier. herr heidt, wenn sie davon sprechen, sie wollen das problem intelligenter lösen, wäre es schön gewesen, sie hätten ihre redezeit für einen intelligenten vorschlag genutzt. gehört habe ich ihn jedenfalls nicht. wir können mit dieser lösung auch nicht mehr warten, frau kollegin bahr. wann wollen sie es entscheiden? sie haben gesagt, nachdem der kanzler gewählt ist, nachdem sie ein regierungsprogramm haben. dann geht’s los? frau bahr, die zeit haben wir nicht. das jahr geht zu ende, und die handwerker stehen heute unter druck, und die kommunen wissen heute nicht, wie sie diese bauvorhaben fertigstellen können. das heißt, das signal ihr dürft die mittel später abrufen brauchen wir heute und nicht irgendwann. sie verschieben es, sie verschieben es wieder und wieder. sie haben es von der tagesordnung genommen. und was sagt zum beispiel ihr spd-minister in niedersachsen? ich zitiere mal ihren kollegen grant hendrik tonne aus niedersachsen, der gesagt hat: die niedersächsische landesregierung unterstützt ausdrücklich alle initiativen zur fristverlängerung, und sie wird eine bundesratsinitiative zur fristverlängerung einbringen. seien sie doch mal schlauer, und machen sie diese bundesratsinitiative nicht mehr nötig. es ist ende november. die frist läuft ab. frau kollegin, erlauben sie eine zwischenfrage der kollegin deligöz? ja. frau kollegin breher, vielen dank, dass sie mir diese zwischenfrage ermöglichen. ist ihnen eigentlich bekannt, dass aufgrund der initiative, dass wir alle, aus allen fraktionen, genau diese frage gestellt haben, sowohl das finanzministerium als auch das familienministerium anders als das bildungsministerium, wo eine antwort noch aussteht uns bereits geantwortet haben, dass wir gar keine frist in diesem sinne setzen müssen? natürlich ist es möglich, jetzt das geld auszuzahlen. natürlich ist es möglich, darüber hinaus auch das geld auszuzahlen, dass wir auch im nachhinein eine rückwirkende fristverlängerung machen und dass das parlament, wenn es den willen hat, die mittel auszuzahlen, die mittel auch auszahlen kann. es ist möglich, dass wir ganz in ruhe das ganze auch auf gesetzliche beine stellen, womit eine verlässlichkeit für die kommunen entsteht, nämlich über die nächste frist hinaus zu planen, zu bauen und die mittel entsprechend einzusetzen. wenn ihnen das bekannt ist wenn es ihnen nicht bekannt ist, bitte ich sie, die antworten auf die fragen ihrer fraktion zu lesen , dann wundert es mich erst recht, warum sie schon wieder für eine kurzfristige lösung eintreten, anstatt eine richtige, verlässliche und nachhaltige lösung vorzuziehen. vielen dank für diese frage. man kann einiges machen. aber der druck in den kommunen besteht heute, nicht erst morgen. die anträge für diese mittel sind gestellt. diese anträge sind bewilligt. diese bauvorhaben laufen aktuell und werden nicht fertig. das heißt, heute steht der handwerker vor der tür und weiß nicht, wie er es machen soll. was sie machen können? sie können viel. aber werden sie es dann auch tun? das weiß der handwerker heute nicht, das weiß die kommune heute nicht, und die kommunen brauchen heute unsere hilfe, damit sie diese mittel abrechnen können, und zwar sicher. wenn sie regieren wollen, dann machen sie es richtig. dann reden sie nicht nur drüber, sondern dann packen sie es auch an! das problem der kommunen ist bekannt. es ist so einfach zu lösen: einfach diese frist verlängern. jetzt werden sie mal ihrem anspruch gerecht, den kommunen wirklich zu helfen und was für den ausbau der ganztagsbetreuung zu tun. diese bauvorhaben sind am start, und ihre zustimmung ist jetzt wirklich gefragt. vielen dank. vielen dank, frau kollegin. als nächste rednerin erhält marja-liisa völlers für die spd-fraktion das wort."
32,18.11.2021,ID20303200,Marja-Liisa,Völlers,SPD,Marja-Liisa Völlers,"sehr geehrte frau präsidentin! meine damen und herren! wir behandeln heute in erster lesung den gesetzentwurf der unionsfraktion mit dem titel: planungssicherheit für familien und kommunen frist für den beschleunigten infrastrukturausbau in der ganztagsbetreuung verlängern. ein thema, das laut den kolleginnen der unionsfraktion sehr wichtig ist, auf den nägeln brennt. dann gucke ich auf die regierungsbank, und wen sehe ich da nicht? die geschäftsführende bundesbildungsministerin, frau karliczek. stattdessen sitzt auf jeden fall da frau lambrecht, die geschäftsführende bundesfamilienministerin. das finde ich spannend in der debatte. lassen sie mich ein paar punkte noch aufgreifen. wir alle kennen diese thematik, diese problematik, die sorgen und nöte insbesondere unserer kommunen. ich habe dazu erst kürzlich mit meinem bürgermeister telefoniert; die kolleginnen und kollegen haben ähnliche gespräche geführt. frau deligöz und frau bahr haben eben auch schon ausgeführt, wie sich das gesamte thema hier zusammensetzt. am ende des tages ist aber eines klar: die zukünftige ampel wird dieses thema zeitnah adressieren. wir werden dieses problem lösen, gemeinsam lösen, und dann vor allem nachhaltig und langfristig positiv gestalten, damit zum beispiel auch mein bürgermeister planungssicherheit hat. meine kommune, die stadt rehburg-loccum, hat für die grundschule in rehburg auch so einen förderbescheid zur thematik des beschleunigten infrastrukturausbaus erhalten. mit dem geld darauf freuen wir uns alle schon werden die ausstattung der lernwerkstätten und die errichtung eines musikraums gefördert werden; der umbau der aula wird kommen. all das ist gut und richtig. aber auch sorgen sind da. aber hier ist die botschaft an alle bürgermeisterinnen und bürgermeister, an die kommunalen parlamente: wir kümmern uns um das thema. die schwierigkeiten werden behoben werden, und das geld kann fließen. die baumaßnahmen können beendet werden. am ende des tages wird damit auch etwas deutlich: wie wichtig das thema bildung für die zukünftige ampelkoalition ist. das sage ich als lehrerin, als bildungspolitikerin der spd-fraktion, der partei, die seit vielen, vielen jahrzehnten für bildungspolitik, für den aufbruch in dem feld steht. ich weiß aber auch, dass die kolleginnen und kollegen der fdp und auch von bündnis /die grünen das große anliegen haben, die botschaft zu senden, dass kinder, familien, junge leute die zukunft unseres landes sind und dass wir das gemeinsam angehen werden. liebe kolleginnen und kollegen, ich möchte abschließend noch zwei punkte in der thematik aufgreifen. der erste punkt wurde schon ein wenig von meiner lieben kollegin ulrike bahr angerissen, und zwar: wir sind ja hier nicht im luftleeren raum miteinander. wir haben in der letzten wahlperiode eine regierung gehabt, in der auch die union ganz stark vertreten war, und ihre ministerinnen und minister und ja, insbesondere auch in baden-württemberg die landesminister haben es so lange verzögert, weswegen wir jetzt erst überhaupt mit dem ganztag an den start gehen konnten. das ist auch ein teil der wahrheit, den man hier auch noch mal betonen muss. der letzte punkt; frau deligöz hat es gerade auch schon angerissen. es gibt ja anregungen aus dem bundesfinanzministerium und auch aus dem bundesfamilienministerium, diese fristverlängerung schnell anzugehen. und wer hat es blockiert? das unionsgeführte kanzleramt, meine damen und herren das müssen wir auch noch mal ganz deutlich sagen , mit der begründung, die bundesregierung sei ja nur noch geschäftsführend im amt. und dann kommen sie hier heute mit dieser schaufensterdebatte um die ecke, um so zu tun: wir kümmern uns um die kommunen und die familien. liebe kolleginnen und kollegen, das ist irgendwie ein bisschen albern. an der stelle müssten sie oppositionsarbeit noch mal lernen. an die kommunen und an die familien sende ich als spd-abgeordnete abschließend folgende botschaft: die zukünftige ampelkoalition wird sich zeitnah um die verlängerung der fristen kümmern und sorge dafür tragen, dass das licht für die finanzierung der ganztagsbetreuung im grundschulalter auch zukünftig auf grün gestellt wird. in diesem sinne arbeiten wir gemeinsam weiter. herzlichen dank. vielen dank, frau kollegin. als letzter redner in dieser debatte erhält christian haase für die cdu/csu-fraktion das wort."
33,18.11.2021,ID20303300,Christian,Haase,CDU/CSU,Christian Haase,"sehr geehrte frau präsidentin! liebe kolleginnen und kollegen! wir stellen fest: in den letzten jahren ist das staatsgefüge in deutschland immer enger zusammengewachsen. es hat mischverantwortung gegeben, mischfinanzierungen gegeben. ich glaube, es ist eine gemeinsame aufgabe für die zukunft, das wieder zu lösen. wir als cdu/csu stehen für eine klare trennung der aufgaben- und finanzverantwortung zwischen den ebenen in deutschland. deshalb an die linken gerichtet: bildungspolitik ich habe zumindest aus den ländern noch nichts anderes gehört ist aufgabe der länder. und wenn der bund es an der stelle gut meint, so wie beim kitaausbau oder bei der ganztagsbetreuung, gibt er geld. das machen wir richtigerweise, weil es eine wichtige aufgabe ist. die verantwortung ist aber nach wie vor in den ländern. und deswegen: reden sie hier nicht immer so über versäumnisse einer bundesbildungsministerin. nein, dafür ist sie nicht verantwortlich. das sind die bildungsministerinnen und ‑minister in den ländern. kommen wir aber zum thema. die kommunen haben die sogenannten beschleunigungsmittel gerne in die hand genommen. sie haben alles in bewegung gesetzt, was sie tun können, haben fertige planungen rausgeholt, haben mit den unternehmen vor ort gesprochen und haben sich gefragt: können wir die mittel in dieser knappen frist die wir bewusst gesetzt haben, weil wir damit ja die konjunktur ankurbeln wollten noch dieses jahr ausgeben? viele haben ihre vorhaben im vertrauen darauf im frühjahr auf den weg gebracht, haben ausschreibungen gemacht. sie wissen: ab da lässt sich für eine kommune nichts mehr aufhalten. wenn sie eine ausschreibung rausgegeben haben, müssen sie die aufträge vergeben. vergeben sie die aufträge, fangen die mitarbeiter an zu bauen. sie wissen alle: es sind die störungen von lieferketten dazugekommen. baumaterialien sind nicht angekommen. viele baufirmen haben gott sei dank viel in dieser zeit gearbeitet. jetzt sind wir am ende des jahres, und jetzt, liebe frau bahr, muss in den kommunen entschieden werden, ob sie noch die mittel abrufen. anfang dezember haben die kommunen die letzte möglichkeit, zu sagen: wir rufen jetzt die mittel ab. nun hat man drei möglichkeiten. entweder sagt man den mitarbeitern: ich rufe jetzt die mittel ab, und wir bekommen sie irgendwie bis zum jahresende auch noch verausgabt, sprich: wir geben den baufirmen das geld. oder man sagt es gibt auch die ersten kommunen, die das tun : das ist mir viel zu gefährlich, ich habe angst davor, die zurückzahlen zu müssen; ich schiebe jetzt investitionen, die ich eigentlich für das nächste jahr vorhatte, auf, weil ich nicht mehr auf fördermittel vertrauen kann. oder auch das passiert jetzt : ich baue einen zaun um meine schule und sage: vorbei mit ganztagsbetreuung! damit hätten wir den kommunen einen bärendienst erwiesen. ich glaube, das wollen wir alle nicht. deswegen habe ich im oktober jetzt gucke ich mal in richtung der geschäftsführenden bundesregierung die familienministerin angeschrieben, weil sie hier die führende ministerin ist. ich habe den bundesfinanzminister angeschrieben im oktober, da war noch zeit. im oktober hätten wir das locker über die bühne bringen können. es ist nichts passiert. ich habe eine antwort aus dem familienministerium erhalten, die besagt hat: wir kümmern uns um das problem. aber es muss jetzt entschieden werden. sie können nicht das vertrauen, das die kommunen möglicherweise in diese neue regierung setzen, jetzt schon kaputtmachen. handeln sie! vielen dank, herr kollege. damit schließe ich die aussprache."
34,18.11.2021,ID20303400,Maria,Klein-Schmeink,BÜNDNIS 90/DIE GRÜNEN,Maria Klein-Schmeink,"sehr geehrte frau präsidentin! sehr geehrte damen und herren! wir werden heute mit der zustimmung zur bundeszuschussverordnung einen überfälligen schritt machen. wir werden milliarden euro bereitstellen, um sicherzustellen, dass die gkv handlungsfähig bleibt, dass die gesetzlichen krankenkassen insgesamt einen auf , beitragspunkte gedeckelten zusatzbeitrag durchhalten können und jetzt ihre beiträge für das nächste jahr in ihren vertreterversammlungen festsetzen können. es geschieht auf den letzten drücker. das ist nicht gut nachvollziehbar, weil es eigentlich der alten regierung und auch der alten mehrheit hier im hause gut angestanden hätte, das zu vollziehen und finanziell nachzuvollziehen, was sie bereits ins gesetz gegossen haben. insofern machen wir jetzt nachholendes handeln; aber wir haben uns dem natürlich gerne angeschlossen, weil es wichtig ist, dass wir unsere gesetzlichen krankenkassen handlungsfähig halten gerade in diesen zeiten, wo wir alle wissen: es kann jeden treffen, dass er das gesundheitswesen in anspruch nehmen muss und dass wir dafür sorgen, dass das gesundheitswesen funktionsfähig bleibt und auch verlässlich finanziert ist. genau dieses versprechen das muss man leider sagen hat die alte regierung und konstellation letztendlich vorsorglich jedenfalls nicht eingehalten. wir werden ab eine situation erleben, wo wir es mit einer großen deckungslücke zu tun haben: milliarden euro mindestens, wahrscheinlich mehr, beständig aufwachsend. sie, herr bundesminister spahn, haben uns also aus der letzten wahlperiode ein sehr, sehr schweres vermächtnis hinterlassen. alle rücklagen der gesetzlichen krankenkassen und im gesundheitsfonds sind geplündert. da ist nichts mehr zu holen. das heißt, wir werden als neue konstellation dafür sorgen müssen, dass wir einen weg finden, wie wir unsere gesetzliche krankenversicherung so absichern, dass es nicht zu riesigen beitragssprüngen kommt. die mittel, die ab fehlen werden, entsprechen mehr als einem vollständigen beitragspunkt. das ist viel; das ist ordentlich viel. das zeigt, wie stark der handlungsdruck ist. die neue konstellation wird sich dieser frage annehmen müssen. sie wird gucken müssen, welche aufgaben der gesetzlichen krankenkasse übergeholfen wurden, die eigentlich gar nicht zu ihren aufgaben gehören. das ist das eine. das andere ist: wir müssen wichtige strukturreformen auf den weg bringen. denn eins ist ja schon mal klar: wir wissen, dass im gesundheitswesen einiges effizienter aufgestellt sein müsste, einiges patientengerechter und insbesondere auch versorgungsgerechter aufgestellt sein müsste. denn vieles bei der behandlung älterer oder hochbetagter menschen ist heute schlecht organisiert, schlecht abgestimmt, wenig koordiniert. wir werden in der frage der sektorübergreifenden versorgung vorankommen müssen, wir werden in der zusammenarbeit der gesundheitsberufe vorankommen müssen. und: wir haben eine situation geerbt, in der wir wissen, dass wir die berufe im gesundheitswesen attraktiver machen müssen, dafür sorgen müssen, dass die arbeitsbedingungen so sind, dass die menschen gerne in diesem beruf bleiben. all das werden wir in den nächsten jahren angehen müssen. sie haben uns also tatsächlich große, große aufgaben ins aufgabenheft geschrieben, herr minister. wir werden jetzt sehen, wie wir das gemeinsam angehen. wir grüne möchten das natürlich mit einer stabilen gesetzlichen krankenversicherung, die solidarisch finanziert ist, voranbringen. in diesem sinne werden wir in den nächsten monaten hier bei vielen, vielen punkten entscheidungen treffen müssen. danke schön. vielen dank, frau kollegin. als nächste rednerin erhält sabine dittmar für die spd-fraktion das wort."
35,18.11.2021,ID20303500,Sabine,Dittmar,SPD,Sabine Dittmar,"sehr geehrte frau präsidentin! liebe kolleginnen und kollegen! auch wenn wir heute angesichts rasant steigender infektionszahlen neue, sehr einschneidende maßnahmen im kampf gegen das coronavirus beschlossen haben g am arbeitsplatz, g im öffentlichen personennah- und ‑fernverkehr, verpflichtendes homeoffice, stringentes testregime überall dort, wo menschen betreut, behandelt, gepflegt oder untergebracht sind , gehört auch zur wahrheit, dass wir im internationalen vergleich unser land bislang gut durch die pandemie gesteuert haben. richtig ist, dass wir unsere lehren ziehen müssen auch aus den windigen maskendeals, dem zu langsamen impftempo und manchmal unerträglichen durcheinander unserer föderalen vielstimmigkeit. das gesundheitssystem vor dem kollaps zu bewahren, triage zu vermeiden, soziale und wirtschaftliche folgen der einschneidenden schutzmaßnahmen abzufedern, darauf war unser hauptaugenmerk gerichtet. olaf scholz hat das bild der bazooka benutzt, um deutlich zu machen, dass wir weiterhin alle mittel einsetzen werden, die erforderlich sind, um corona die stirn zu bieten. er hat klargemacht, dass wir über die nötigen mittel verfügen. damit schafft er vertrauen, vertrauen in die leistungsfähigkeit und die krisenfestigkeit unseres staates. der internationale währungsfonds berichtet, dass deutschland mit seinen coronaausgaben im januar im vergleich mit allen anderen industrienationen auf platz sechs lag. im verhältnis zum bruttoinlandsprodukt gab kein eu-mitglied mehr geld zur bewältigung der krise aus als deutschland. meine damen und herren, auch die gesetzliche krankenversicherung hat in erheblichem maße zur krisenbewältigung beigetragen. indem schutzschirme über nahezu alle leistungsbereiche gespannt wurden, haben wir die pandemiebedingten folgen für die gesundheitliche infrastruktur abgefedert. so wurden zum beispiel ausgleichszahlungen für erlöseinbußen ebenso finanziert wie höhere aufwendungen für persönliche schutzausrüstungen und längeres kinderkrankengeld. wir haben einen schutzschirm gespannt über heilmittelerbringer, rehaeinrichtungen und einrichtungen des müttergenesungswerkes. erst heute morgen haben wir hier im plenum wieder versorgungsaufschläge für krankenhäuser beschlossen, die coronapatienten und ‑patientinnen behandeln. der größte teil dieser pandemiebedingten zusatzausgaben wurde aus dem bundeshaushalt finanziert, und dennoch blieben erhebliche finanzielle belastungen für den beitragszahler/die beitragszahlerin der gesetzlichen krankenversicherung. der bundesrechnungshof nennt zum beispiel die ausgaben für mehr als zusätzliche intensivbetten mit beatmungsmöglichkeit, prämienzahlungen an das krankenhauspersonal und aufwendungen für die labordiagnostik von coronatests. allein im vergangenen jahr beliefen sich diese leistungen auf circa milliarden euro. die kommen natürlich allen zugute: den gesetzlich versicherten und den privat versicherten. neben den höheren ausgaben der gesetzlichen krankenversicherung für die coronamaßnahmen ist die gesetzliche krankenversicherung in erheblichem maße auch von geringeren beitragseinnahmen betroffen. hier geht der bundesrechnungshof davon aus, dass allein im jahr die beitragseinnahmen um , milliarden euro geringer ausfallen, als vor der pandemie prognostiziert wurde. die einnahmenrückgänge resultieren vor allem aus einem rückgang der beschäftigung, aus kurzarbeit sowie erleichterten verfahren zur stundung von beitragszahlungen. der kassensturz bei der gkv sieht daher wie folgt aus: die ausgaben für maßnahmen aufgrund unserer regulären gesetzgebungsprozesse zur verbesserung der versorgung, die pandemiebedingten zusatzausgaben und die pandemiebedingten beitragsausfälle werden im jahr ein finanzloch von milliarden euro in der gesetzlichen krankenversicherung verursachen. das heißt, ohne zusätzliche finanzmittel des bundes würde das eine durchschnittliche steigerung der zusatzbeiträge um , prozentpunkte zur folge haben. dadurch wäre die deutsche wirtschaft mit höheren lohnnebenkosten konfrontiert, während sie sicherlich noch immer mit den wirtschaftlichen folgen der pandemie belastet sein wird. auch um die wirtschaftliche erholung nicht zu gefährden, hat die alte bundesregierung die sozialgarantie verlängert. danach dürfen die sozialversicherungsbeiträge im jahr insgesamt nicht über prozent steigen. meine damen und herren, die spd steht hier zu ihrem wort: wir sorgen für kontinuität und dafür, dass auch die neue bundesregierung die finanziellen zusagen der alten bundesregierung einhalten wird. das bundesministerium für gesundheit wurde deshalb ermächtigt, bis zum . dezember im einvernehmen mit dem bundesministerium der finanzen und mit zustimmung des deutschen bundestages einen ergänzenden bundeszuschuss durch rechtsverordnung festzusetzen, sodass die -prozent-grenze nicht überschritten wird, und genau das tun wir heute. durch die vorliegende verordnung stellen wir einen ergänzenden bundeszuschuss in höhe von milliarden euro für die gesetzliche krankenversicherung zur verfügung. meine kolleginnen und kollegen, durch die stabilisierung der beiträge zur gesetzlichen krankenversicherung im jahr setzen wir unseren entschlossenen und erfolgreichen kurs zur krisenbewältigung fort. der bund leistet hier einen erheblichen beitrag zur begrenzung der sozialversicherungsbeiträge auf unter prozent und damit auch zu einer schnelleren erholung der deutschen wirtschaft nach der pandemie. das geld ist gut investiert. damit stabilisieren wir die gesetzliche krankenversicherung und sichern die gute gesundheitliche und pflegerische versorgung der bürgerinnen und bürger in zeiten von corona und darüber hinaus. ich bitte deshalb um zustimmung zu dieser verordnung. herzlichen dank, frau kollegin. als nächstes erhält das wort dietrich monstadt für die cdu/csu-fraktion."
