,datum,redeID,vorname,nachname,fraktion,name,inhalt_neu
0,,,,,, ,
1,19.10.2018,ID195900100,Katarina,Barley,SPD,Katarina Barley,ganz herzlichen dank herr präsident liebe kolleginnen und kollegen sehr verehrte damen und herren bezahlbarer wohnraum ist die soziale frage unserer zeit; das ist mittlerweile schon fast ein geflügeltes wort geworden für ihn zu sorgen ist aber eben richtig und es besteht dringender handlungsbedarf im koalitionsvertrag haben wir deswegen viele maßnahmen vorgesehen um diese soziale frage zu lösen die antworten bestehen natürlich zu einem großen teil aus bauen vor allem bezahlbaren wohnraum zu bauen aus steuerlichen vorteilen und aus mehr möglichkeiten auch für die kommunen aber ein baustein ist eben auch das mietrecht denn bis all diese maßnahmen die wir vereinbart haben greifen steigen die mieten weiter in ballungszentren das wissen wir alle sind die möglichkeiten neu zu bauen ohnehin begrenzt wir haben im koalitionsvertrag vereinbart maßnahmen zur verbesserung der mietpreisbremse sowie zum schutz vor überhöhten mieten nach modernisierungen vorzunehmen wir haben uns auch darauf verständigt dass wir etwas gegen das missbräuchliche herausmodernisieren tun wollen schnelligkeit ist an diesem punkt wichtig wir schulden den mieterinnen und mietern ein zügiges und beherztes tätigwerden deswegen bin ich auch sehr froh dass wir diesen gesetzentwurf nur etwa sechs monate nach regierungsbildung nun in der ersten lesung beraten können ich will nicht verhehlen dass ich mir durchaus noch weiter gehende möglichkeiten vorstellen kann weiter gehende maßnahmen um mieterinnen und mieter zu schützen über solche maßnahmen wird sicherlich in dieser legislaturperiode auch noch heftig gerungen werden jetzt ist aber vorrangig dass wir die maßnahmen die wir auf dem tisch haben zügig verabschieden welche sind das erstens studien haben uns gezeigt dass mieterinnen und mieter die mietpreisbremse dort wo sie anwendbar ist nutzen dass sie aber noch deutlich besser werden muss dass sie vor allen dingen transparenter und leichter handhabbar werden muss dem kommen wir jetzt nach wenn sich vermieterinnen und vermieter auf ausnahmen von der mietpreisbremse berufen wollen haben sie zukünftig eine auskunftspflicht bezüglich dieser ausnahmen das heißt sie müssen vor abschluss des mietvertrages unaufgefordert sagen auf welche dieser ausnahmen sie sich gegebenenfalls berufen nur so können die mieterinnen und mieter beurteilen ob die mietpreisbremse greift oder nicht nur so können sie rechtssicher wissen welche miete sie am ende zahlen müssen gibt es keine solche angabe vor bzw bei vertragsabschluss dann darf der vermieter diese höhere miete eben auch nicht verlangen der mieter die mieterin kann zu viel gezahlte miete ab dem zeitpunkt der rüge zurückbehalten oder zurückverlangen es reicht in zukunft ein einfaches: ich rüge eine überhöhe miete oder ich rüge einen verstoß gegen die mietpreisbremse der mieter muss nicht mehr konkret darlegen wie hoch beispielsweise die vormiete war das war bisher eines der probleme da die mieterinnen und mieter gar nicht die möglichkeit hatten diese informationen zu bekommen die sie damals noch brauchten zweitens: die modernisierungsumlage es ist für viele mieterinnen und mieter ein großes problem dass sie nach einer modernisierung ihre miete nicht mehr bezahlen können dem dürfen wir nicht tatenlos zusehen denn wir alle wissen: wohnraum ist eben mehr als irgendeine ware; wohnen ist zu-hause-sein deswegen führen wir erstmals und bundesweit das ist ganz wichtig eine absolute kappungsgrenze ein eine mieterhöhung ist nur bis zu euro pro quadratmeter innerhalb von sechs jahren zulässig des weiteren senken wir in angespannten wohnungsmärkten den umlagesatz mit dem die kosten an die mieter weitergegeben werden können von auf prozent das bietet mietern einen schutz vor weit überzogenen maßnahmen und vor luxusmodernisierungen dritter punkt wir werden die mieterinnen und mieter vor dem schikanösen herausmodernisieren schützen wir wollen die schwarzen schafe unter den vermieterinnen und vermietern erfassen und ihnen dieses geschäftsmodell zunichtemachen dabei geht es um sehr belastende maßnahmen wir kennen das dass zum beispiel das gas oder der strom abgestellt wird oder dass der weg aufgegraben und nicht wieder zugemacht wird; das reicht manchmal bis hin zu nächtlichen anrufen wer solche maßnahmen einsetzt um mieterinnen und mieter aus ihren angestammten wohnungen zu vertreiben der muss sich zukünftig einem bußgeld von bis zu euro ausgesetzt sehen hier setzen wir ein ganz klares zeichen: herausmodernisieren aus profitgier ist unrecht das ist auch ein wichtiges zeichen das der staat geben muss: die rechtsordnung sieht dem nicht länger tatenlos zu den mieterinnen und mietern geben wir außerdem mit einer neuen vermutungsregelung mehr in die hand um einen schadensersatzanspruch in so einem fall gegen die vermieterinnen und vermieter geltend zu machen die so unterwegs sind das heißt sie können dann das was sie mehr bezahlen müssen zum beispiel wenn sie umziehen auch vom vermieter zurückbekommen schließlich viertens : für kleinere modernisierungsmaßnahmen bis zu einem umfang von euro pro wohnung führen wir ein vereinfachtes verfahren ein das ist natürlich insbesondere für die privaten vermieterinnen und vermieter wichtig die trotzdem gewährleisten wollen dass sie ihren mieterinnen und mietern eine gute eine moderne wohnung überlassen da sie sich dadurch weniger bürokratie ausgesetzt sehen und trotzdem einen anreiz haben so tätig zu werden sie müssen weniger darlegungspflichten beachten und können die mieterhöhung besser umsetzen wir kümmern uns also um alle die die schutz verdienen: um die mieterinnen und mieter und um die anständigen vermieterinnen und vermieter wir sanktionieren die die nicht rechtmäßig unterwegs sind das ist insgesamt ein sehr sehr gutes paket und ich freue mich auf die weitere diskussion und ihre zustimmung nächster redner ist der abgeordnete jens maier afd
2,19.10.2018,ID195900200,Jens,Maier,AfD,Jens Maier,sehr geehrter herr präsident meine damen und herren in einem meiner letzten beiträge zum thema mietpreisbremse habe ich bereits darauf hingewiesen dass man ein totes pferd nicht mehr reiten kann genau das versucht die regierung jedoch mit diesem gesetzentwurf mit dem man die bereits gescheiterte mietpreisbremse verbessern will dabei sagt einem bereits der gesunde menschenverstand dass man über eine änderung der rechtslage nichts an der tatsächlichen situation auf dem mietwohnungsmarkt ändern kann diese situation ist durch eine hohe nachfrage nach bezahlbarem wohnraum besonders in den ballungsgebieten geprägt die am markt real wirkenden kräfte werden dadurch nicht außer kraft gesetzt sie werden auch nicht wesentlich zu beeinflussen sein momentan bewirkt die mietpreisbremse genau das gegenteil von dem was sinnvoll wäre sie verhindert bereits in ihrer jetzigen form den dringend notwendigen neubau von wohnungen durch private investoren nur das würde die reale lage verändern nur das würde zu einer verbesserung führen da kann man nur sagen: bauen bauen bauen ist das gebot der stunde die in diesem entwurf enthaltenen regelungen verursachen zudem eine fülle an neuer bürokratie dieses mehr an bürokratie macht es für vermieter wenig attraktiv ihre wohnung oder ihr haus überhaupt länger als nur zum vorübergehenden gebrauch als wohnraum zu vermieten die geplante einführung von informationspflichten für den vermieter bringt außer aufwand überhaupt nichts was will ich denn als mieter der dringend eine wohnung braucht tun wenn der vermieter seiner informationspflicht nicht nachkommt rechtstreue einfordern vor gericht ziehen was bringt denn das der entwurf berücksichtigt doch gar nicht das machtgefälle zwischen mieter und vermieter das kann er auch nicht weil das machtverhältnis keinen rechtlichen sondern einen tatsächlichen hintergrund hat in die richtige richtung geht es dass die kosten für bestimmte modernisierungsmaßnahmen in gebieten mit zu wenig wohnraum für die bevölkerung nur noch in höhe von prozent statt wie bisher in höhe von prozent auf die mieter umgelegt werden können aber warum sollen weiterhin die länder festsetzen wann die ausreichende versorgung der bevölkerung mit mietwohnungen in einer gemeinde besonders gefährdet ist das sollte für meine begriffe der bund übernehmen im hinblick auf die geplante änderung von § satz nummer bgb und von § des wirtschaftsstrafgesetzes fällt negativ auf dass die formulierung erheblichen objektiv nicht notwendigen belastungen des mieters ausgesprochen unbestimmt ist die geplante vorschrift ist ein völliger missgriff wann ist eine bauliche veränderung in einer weise durchgeführt dass sie geeignet ist zu erheblichen objektiv nicht notwendigen belastungen des mieters zu führen jeder mieter der nach einer baulichen veränderung nicht zufrieden ist oder schlichtweg seinem vermieter eins auswischen will kann nunmehr in seiner anzeige behaupten er sei einer erheblichen objektiv nicht notwendigen belastung ausgesetzt gewesen leute da wird viel arbeit auf die ordnungsämter zukommen wenn sie dann die zweckmäßigkeit von bauarbeiten beurteilen sollen viele ämter werden davon absehen die angezeigten taten zu verfolgen weil im ordnungswidrigkeitenrecht der opportunitätsgrundsatz gilt dann macht man nämlich lieber gar nichts als riesigen aufwand bei der tatsachenermittlung zu betreiben besser wäre es an das subjektive befinden des mieters zum beispiel in gesetzlicher analogie zu § absatz bgb anzuknüpfen so wäre es möglich dass der mieter schon ab kenntnis der geplanten modernisierung seinen vermieter anspricht und ihm sagt die folgen der baulichen modernisierung träfen ihn hart und brächten ihm keinen vorteil dann könnte sich der vermieter hierauf einstellen und die nachweisbarkeit im verfahren wäre auch einfacher zu dem antrag der linken sei nur so viel gesagt: frau wagenknecht hat auf dem bundesparteitag der linken in leipzig darauf hingewiesen dass inzwischen mehr arbeitslose und arbeiter auch solche mit gewerkschaftsbuch ihr kreuz bei der afd als bei der sed-nachfolgepartei machen da sie offenbar die hoffnung aufgegeben haben noch als vertreter der arbeiter punkten zu können stürzen sie sich seit monaten mit immer neuen anträgen auf das thema miete und sehen gar nicht dass sie sich dabei noch mehr entlarven niemand mit verstand will einen einstieg in eine sozialistische wohnraumbewirtschaftung welche qualität das wohnen im sozialismus hatte konnte man in der ddr sehen mehr braucht man dazu nicht zu sagen vielen dank nächster redner ist der kollege dr jan-marco luczak cdu/csu-fraktion
3,19.10.2018,ID195900300,Jan-Marco,Luczak,CDU/CSU,Jan-Marco Luczak,herr präsident meine sehr verehrten damen und herren ich möchte am anfang feststellen nachdem ich ihre rede herr maier gehört habe dass die afd anders als glaube ich alle anderen parteien hier in diesem hohen hause das problem steigender mieten in großen städten in ballungsgebieten überhaupt nicht als solches erkannt hat sie sind offensichtlich nicht wie sie sich hier immer darstellen die partei der kleinen leute sie negieren das problem das muss man an dieser stelle festhalten bei uns ist das anders wir sehen natürlich dass steigende mieten in den großen städten in den ballungsgebieten ein wirkliches problem sind breite teile der bevölkerung sind mittlerweile davon betroffen wir als union nehmen das wirklich sehr ernst wir wollen nicht dass menschen aus ihren angestammten wohnvierteln verdrängt werden weil wir der auffassung sind dass es gut ist wenn wir durchmischte kieze haben deswegen machen wir als koalition ein umfassendes paket für einen besseren mieterschutz wir haben hier schon gehört was in diesem paket enthalten ist für uns ist ganz zentral dass wir die transparenz auf dem wohnungsmarkt erhöhen und mieter in die lage versetzen ihre rechte die sie schon heute haben besser geltend zu machen deswegen führen wir jetzt eine auskunftspflicht ein: vermieter müssen wenn sie eine ausnahme von der mietpreisbremse geltend machen das auch deutlich machen damit mieterinnen und mieter wissen woran sie sind und das gegebenenfalls auch überprüfen können damit diese dann ihre rechte auch wirklich geltend machen senken wir die hürde wir sagen im gegensatz zur qualifizierten rüge die wir bisher gehabt haben wo mieterinnen und mieter substanziiert darlegen mussten aus welchen gründen sie der auffassung sind dass die miete zu hoch ist da senken wir die hürden wir sagen eine einfache rüge reicht aus wir müssen uns im gesetzgeberischen prozess noch genau ansehen wie wir das ausgestalten wir sind zum beispiel der auffassung dass es nicht ausreicht dass man einfach nur ins blaue hinein rügt irgendein anknüpfungspunkt muss schon vorhanden sein aber damit schaffen wir genau das was richtig und wichtig ist: wir müssen mieterinnen und mieter in die lage versetzen ihre rechte geltend zu machen der zweite bereich dem sich dieses gesetz widmet ist der ganze bereich der modernisierung wir wollen dass auch nach einer modernisierung die mieten noch bezahlbar sind deswegen wollen wir das haben sie frau ministerin schon dargelegt die höhe der modernisierungsumlage begrenzen: wir senken die modernisierungsumlage von prozent auf prozent ab wir sehen eine absolute deckelung eine kappungsgrenze vor und setzen damit einen anreiz für eine wirtschaftlich vernünftige entwicklung dann gibt es das ist uns als union besonders wichtig gewesen ein vereinfachtes verfahren für die privaten kleinvermieter wenn sie eine kleine modernisierungsmaßnahme machen wollen das ist ein ganz wichtiges instrument damit dort mehr an energetischer modernisierung mehr an altersgerechtem umbau passiert wir müssen allerdings sehr stark darauf aufpassen dass das in der praxis auch funktioniert so wie die regelung jetzt im kabinettsbeschluss gestaltet ist wird sie glaube ich ins leere laufen weil dort eine ausschlussfrist vorgesehen ist: wenn jemand von einem vereinfachten verfahren gebrauch gemacht hat dann ist für die nächsten fünf jahre eine normale modernisierungsmieterhöhung ausgeschlossen das wird gerade in wohnungseigentümergemeinschaften häufig dazu führen dass das instrument des vereinfachten verfahrens nicht zur geltung kommen wird da müssen wir noch nachbessern mir ist ein punkt sehr wichtig das war übrigens eine forderung die wir von der union in die koalitionsverhandlungen mit eingebracht haben : wir wollen die schwarzen schafe die es unter den vermietern auf dem wohnungsmarkt gibt bekämpfen wir dulden nicht dass jemand modernisierungen in missbräuchlicher weise nutzt um menschen ganz bewusst ganz zielgerichtet aus den wohnungen herauszumodernisieren das darf es nicht geben wir müssen all diejenigen schwarzen schafe die so vorgehen hart sanktionieren deswegen wird es zukünftig einen ordnungswidrigkeitentatbestand geben das wird schadensersatzansprüche auslösen das ist gut und richtig so wir müssen schauen dass das ganz genau und zielgerichtet diejenigen trifft die es treffen soll nämlich die schwarzen schafe aber nicht das gros der anderen der privaten kleinvermieter deswegen ist es wichtig verschärft auf das tatbestandsmerkmal der subjektiven belastung in diesem gesetz zu achten es ist uns wichtig die schwarzen schafe an die kandare zu bekommen nicht nur weil wir mieter schützen wollen sondern auch weil sie das gesellschaftliche klima vergiften in dem wir momentan unsere politische diskussion führen wir müssen sehr aufpassen dass wir als politik unsere gesetze nicht nur von den extremen ableiten nicht immer nur schwarz und weiß betrachten nicht immer nur auf diejenigen schauen die wirklich missbrauch betreiben sondern wir müssen uns vor augen führen dass die weit überwiegende mehrheit der menschen in unserem land die wohnungen vermieten ein sehr gutes verhältnis zu ihren mieterinnen und mietern hat diese dürfen wir an dieser stelle nicht belasten da spreche ich von den privaten kleinvermietern da spreche ich etwa von dem handwerker der eine wohnung zur altersvorsorge hat diejenigen dürfen wir nicht aus dem markt drängen; denn die werden wirklich gebraucht an dieser stelle sollten wir sehr genau aufpassen ich möchte am ende meiner rede noch einen punkt ansprechen bei dem ich mich ehrlicherweise ein bisschen geärgert habe die ministerin hat gerade gesagt wir müssten über die forderungen über die wir gerade diskutieren noch weiter hinausgehen ich habe heute morgen ein großes interview in der welt mit dem kollegen michael groß gelesen in dem er ganz weitreichende forderungen nennt was wir im mietrecht noch alles machen müssten er fordert mehr regulierung einen mietenstopp er fordert dass mieter ihre miete im prinzip selber absenken dürfen die mietpreisbremse flächendeckend einzuführen die modernisierungsumlage auf prozent abzusenken all das wird von der spd jetzt noch zusätzlich gefordert dazu könnte ich fachlich noch sehr viel sagen aber ich habe leider keine zeit mehr deswegen nur so viel: am ende würde dieser mietenstopp zu einem investitionsstopp führen das ist genau das gegenteil von dem was wir brauchen wir müssen mehr schneller und kostengünstiger bauen wenn wir das problem in den griff bekommen wollen was mich da wirklich geärgert hat ist nicht so sehr die fachliche seite sondern dass sich die spd an dieser stelle wieder selber klein macht wir haben doch ein gutes und ausgewogenes paket gemacht lassen sie uns dieses paket doch jetzt einfach einmal auf den weg bringen lassen sie uns den menschen doch sagen dass es gut ist dass es richtig ist was wir machen spielen sie von der spd in der koalition doch nicht schon wieder opposition das hilft ihnen am ende doch nicht sie stehen in den umfragen gerade bei prozent lernen sie doch daraus lassen sie uns dieses paket gemeinsam kraftvoll nach vorne bringen das hilft den menschen in unserem land bringen sie nicht wieder streit in dieses gesetzgebungsverfahren vielen dank nächste rednerin ist die kollegin katharina willkomm fdp
4,19.10.2018,ID195900400,Katharina,Willkomm,FDP,Katharina Willkomm,sehr geehrter herr präsident liebe kolleginnen und kollegen nicht ihre wünsche werfe ich ihnen vor sondern das was sie in der wirklichkeit damit anrichten die mietpreisbremse muss weg und sie darf nicht weiterentwickelt werden warum wie im internet stand hat allein die seit monaten wabernde diskussion um mietrechtsverschärfungen dazu geführt dass die mieten zuletzt auch in bestehenden mietverhältnissen auf viel breiterer front gestiegen sind als zuvor warum weil die vermieter das mietrechtsvorhaben dieser regierung ganz richtig verstanden haben auch wenn dieses gesetz zustande kommt will der vermieter auf lange sicht auf den grünen zweig kommen deshalb darf er seine bestandsmieter nicht mehr weitgehend in ruhe lassen und das auseinandergehen von kosten und einnahmen erst beim nächsten neuen mieter wieder ausgleichen nein er steht unter dem druck die mieten im bestand permanent zu erhöhen bei diesem einen punkt gelingt der großen koalition was sie sonst nicht hinbekommt: die umgestaltung eines politikbereichs auch ohne gesetzgeberisches handeln dieselskandal flugausfälle fachkräftemangel in der pflege es gibt viele andere themen wo die leute sich wünschten das würde immer funktionieren greifen wir nur ein beispiel aus ihrem vorhaben um zu zeigen: sie wollen sicher das gute sie erreichen aber etwas anderes: der wegfall der qualifizierten rügepflicht ist ganz klar eine erleichterung für den mieter aber was sie tatsächlich kreieren ist eine rüge des mieters ins blaue hinein schon ihre grundannahme ist unzutreffend der deutsche richterbund hat bereits im hinblick auf den referentenentwurf darauf hingewiesen dass die gerichte so viel vom mieter gar nicht verlangen der mieter muss in der rüge lediglich die tatsachen mitteilen auf denen die beanstandung der vereinbarten miete beruht wozu damit er die zulässigkeit der vereinbarten miete zunächst prüft bevor er deren höhe moniert besondere anforderungen werden an die begründung der rüge jedoch nicht gestellt auch ihre forderungen zu kappungsgrenzen und zur kostenumlage bei modernisierungen dienen für sich genommen dem geldbeutel der mieter an dieser absicht gibt es nichts zu kritisieren im gegenteil dass sie mit diesen vorschlägen aber zugleich massiv das investitionsklima verschlechtern das müsste doch zumindest die union erkennen was sie tatsächlich fördern ist die gefahr den modernisierungsstau im bestand zu vergrößern das hilft ihnen weder die vollmundigen klimaschutzziele zu erreichen noch bringt es uns bei den herausforderungen des demografischen wandels weiter wir brauchen nicht noch mehr vom falschen deshalb lehnt die fdp diesen gesetzentwurf ab vielen dank nächste rednerin ist die kollegin caren lay fraktion die linke
