,datum,redeID,vorname,nachname,fraktion,name,inhalt_neu
31,24.03.2022,ID202503100,Maria,Klein-Schmeink,BÜNDNIS 90/DIE GRÜNEN,Maria Klein-Schmeink,"sehr geehrte frau präsidentin! meine lieben kolleginnen und kollegen! ich finde es eigentlich bedauerlich, dass das niveau der debatte der größe der aufgabe nicht wirklich gerecht wird. das finde ich wirklich bedauerlich! denn man muss sich mal klarmachen, dass es um die großen existenziellen fragen geht, insbesondere um die unversehrtheit des körpers, aber auch um die themen gesundheit und versorgung bei pflegebedarf . das sind die größten fragen, die die bevölkerung umtreiben. wer weiß das besser als diejenigen, die jetzt gerade in der ukraine erleben, wie schlimm es ist, wenn genau das nicht gewährleistet ist. das zeigt sehr deutlich, wie wichtig unsere aufgabe ist, die wir hier gemeinsam zu bearbeiten haben. das gilt für den bereich der gesundheit, das gilt für den bereich der pflege. wir haben mit der gesetzlichen krankenversicherung und mit der pflegeversicherung wirksame instrumente, um sicherheit zu schaffen und auch zu finanzieren. es ist unsere aufgabe, dafür zu sorgen, dass die versicherungssysteme mit ihrer aufgabe mitwachsen und dem berechtigten anspruch der bevölkerung gerecht werden können. es reicht nicht, nur darauf zu verweisen man könnte doch , man sollte doch , sondern wir müssen ganz konkret liefern und leisten. genau da stehen wir vor großen herausforderungen. die jahre unionsgeführte regierung hat uns ein riesiges defizit in der gkv hinterlassen. die jahre uniongeführte regierung hat uns eine fast nicht handlungsfähige soziale pflegeversicherung hinterlassen. und wir haben neue aufgaben zu stemmen, erstens mit der pandemie, zweitens mit der aufnahme der vielen, vielen geflüchteten, die jetzt zu uns kommen und fast alle auch einen hohen versorgungsbedarf haben. das sind die herausforderungen, die wir zu stemmen haben, und das können wir nur gemeinsam; gemeinsam mit dem gesundheitsminister und gemeinsam hier im parlament müssen wir dafür die voraussetzungen schaffen. wenn ich sehe, herr sorge, wie selbstgefällig sie sich hierhinstellen, groß etwas einklagen, aber nicht einmal im ansatz problemlösungen liefern selbst jetzt nicht, wie es aufscheint , dann muss ich fragen: wie wollen sie denn diese finanzierungsprobleme lösen? sie waren in politischer verantwortung in der letzten wahlperiode, bei der mittelfristigen finanzplanung. wo findet sich in ihren konzepten, in ihrem wahlprogramm auch nur eine antwort darauf, wie sie diese probleme lösen wollen? antworten verlange ich natürlich auch von einer opposition. wir haben viele jahre miteinander gerungen; aber wir haben in all den jahren immer wieder vorschläge geliefert. das erwarte ich auch von ihnen. wir haben in der ampelkoalition einige stellschrauben verabredet, die deutlich machen, wie wir dieses geerbte defizit denn lösen wollen. wir haben vereinbart, dass es eine dynamisierung des bundeszuschusses gibt, wobei im übrigen versicherungsfremde leistungen ausgekehrt werden, nicht aufgaben der gkv, sondern versicherungsfremde leistungen. sie haben in den letzten jahren, als es noch überschüsse gab, viele, viele ausgaben immer wieder in eine richtung geschoben: nämlich in die gkv und zusätzlich in die spv. dann haben wir eine große aufgabe vereinbart, dass wir die kosten der beiträge für alg-ii-beziehende endlich anpassen, dass die beiträge so refinanziert werden, dass sie annähernd dem umfang der belastungen für die gkv entsprechen. diese frage wird immer wichtiger werden, weil jetzt über geflüchtete dazukommen, die natürlich nach einer gewissen zeit auch in diesen regelkreislauf kommen. dann haben wir die übernahme der rentenbeiträge für pflegende angehörige in der spv vereinbart. auch das ist eine ganz, ganz wichtige aufgabe, die da gesetzlich und gesellschaftlich geleistet wird. sie haben dafür gesorgt, dass das nur den versicherten übergeholfen wird und eben nicht über den haushalt steuerfinanziert wird. da haben wir eine aufgabe, die zu lösen ist. weiterhin haben wir das problem in der spv, dass die häusliche krankenpflege noch immer nicht adäquat refinanziert wird. auch das wird etwas sein, was wir zu lösen haben. wir haben also in der ampel vereinbarungen getroffen, wie wir diese strukturellen probleme lösen wollen. wir haben gleichzeitig aber auch viele, viele ansätze verankert und vereinbart, wo wir die überfälligen antworten liefern wollen, die da sind: die große krankenhausreform, die große reform der grundlegenden versorgung im ländlichen raum. wir haben viele, viele aufgaben, insbesondere bei der fachkräftesicherung, zu stemmen. alles das gehen wir an. wir werden dafür sorgen, dass das verlässlich, stabil finanziert wird. darum werden wir in den nächsten wochen ringen. ich hoffe, sie machen konstruktiv mit und nicht nur mit einer billigen polemik, die jede antwort vermissen lässt. danke schön. es folgt die kollegin der afd dr. christina baum."
32,24.03.2022,ID202503200,Christina,Baum,AfD,Christina Baum,"frau präsidentin! meine damen und herren! es ist die gesundheit, die der wahre reichtum ist, nicht gold- und silberstücke ; das zitat ist von mahatma gandhi. nicht erst seit corona wissen die deutschen ihr bisher gut funktionierendes gesundheitssystem zu schätzen. noch bis vor wenigen jahren gab es in fast jeder größeren gemeinde einen hausarzt, einen zahnarzt, eine apotheke und in unmittelbarer nähe, leicht erreichbar, auch ein krankenhaus und fachärzte. doch diese grundstrukturen bröckeln immer mehr, vor allem im ländlichen raum, der dadurch immer unattraktiver wird. viele ärzte nehmen neue patienten gar nicht mehr auf, weil sie bereits überlastet sind. termine in sechs monaten oder noch später sind keine seltenheit mehr. wie viel teurer die behandlungen dadurch werden, weil sich der gesundheitszustand der patienten bis zum sehnlichst erwarteten termin bereits drastisch verschlechtert hat, ist nicht verifizierbar, auch nicht, wie viele patienten eventuell in der zwischenzeit verstorben sind. verantwortlich für die inzwischen akut gewordenen miseren sind die regierungen der letzten jahre; denn die probleme sind seit langem bekannt. doch auch mit der neuen regierung ist keine besserung in sicht. trotz der unglaublichen steigerung der ausgaben von , milliarden im jahr auf über milliarden in diesem jahr kommt kein cent davon zum beispiel in der pflege an. die schlimmste entwicklung von allem jedoch ist die profitorientierte krankenhauspolitik. durch das drg-fallpauschalensystem wurde unsere gesundheit zur ware. aufgrund des ökonomischen drucks wird nur noch geschaut, mit welcher behandlung das meiste geld zu verdienen ist. diese entwicklung muss gestoppt werden! gesundheitsversorgung ist daseinsvorsorge. eines kann ich ihnen versprechen: wenn ich mit ihrem beamtenapparat den aktuellen haushalt durchgehen könnte, dann fände ich genug geld, um unser gesundheitssystem wieder auf vordermann zu bringen. die mittel für eine verstümmelung unserer kinder, verharmlosend und irreführend geschlechtsumwandlung genannt, würden von mir ebenso gestrichen wie alle ausgaben zur durchsetzung der genderideologie oder für den fiktiven kampf gegen rechts, der nichts weiter als einen kampf gegen die opposition darstellt. und hören sie endlich auf, ein ganzes volk zu bevormunden! glücklichsein, zufriedenheit und lebensfreude sind die wichtigsten voraussetzungen für unser alle gesundheit; denn gesundheit beruht auf einem gleichgewicht zwischen körper, seele und geist. nie zuvor wurde dieses gleichgewicht so zerstört wie durch ihre coronamaßnahmen. werfen sie endlich die masken zusammen mit allen maßnahmen und der impfpflicht in die mülltonne! denn dort gehören sie hin. vielen dank. es folgt für die fdp-fraktion die kollegin nicole westig."
33,24.03.2022,ID202503300,Nicole,Westig,FDP,Nicole Westig,"frau präsidentin! liebe kolleginnen und kollegen! kommen wir zurück zur sache und zur gesundheitspolitik. als fortschrittskoalition begegnen wir den vielfältigen herausforderungen, die hier alle schon genannt worden sind, mit einem großen verantwortungsbewusstsein gegenüber den aktuellen und künftigen generationen. eine große baustelle in unserem gesundheitswesen ist die pflege, und das nicht erst seit der pandemie. wenn wir patientinnen und patienten bedarfsgerecht versorgen wollen, wenn menschen in würde alt werden können sollen, dann müssen wir hier endlich ran. die pflege steht deshalb weit oben auf der agenda dieser koalition. wir wollen die arbeitsbedingungen dort nachhaltig verbessern. das gelingt uns jedoch nur dann, wenn wir den personalmangel beheben und mehr menschen für die pflege gewinnen. deshalb müssen wir in die bildung, in ausbildung und akademisierung, investieren. gemeinsam mit den ländern wollen wir pflegewissenschaft und pflegeforschung voranbringen. diese sind kein selbstzweck; sie geben uns evidenzbasierte antworten auf die frage nach einer guten und bedarfsorientierten patientenversorgung, und das kommt uns allen als gesellschaft zugute. eine besondere rolle spielt dabei auch die pflegepädagogik; denn zu viele lehrerinnen und lehrer fehlen an unseren pflegeschulen, was mitunter zur schließung führt. das muss sich ganz schnell ändern. liebe kolleginnen und kollegen, es kommt auf jeden ausbildungsplatz an. deshalb ermöglichen wir die pflegeausbildung künftig auch an rehakliniken. ein weiterer baustein für mehr pflegepersonal liegt natürlich in der zuwanderung. deshalb ist es gut, dass sich diese koalition ganz klar dazu bekennt, deutschland zu einem modernen und weltoffenen einwanderungsland zu machen. dass sie damit ein problem haben, wissen wir. allerorten haben wir fachkräftemangel, aber nirgends fällt er uns so übel auf die füße wie in der pflege. mit diesem haushalt fördern wir auch die möglichkeit, pflegekräfte im ausland nach deutschem standard auszubilden. doch das ist nicht genug. bei der gewinnung der besten köpfe konkurrieren wir mit ländern, in denen pflegende eine größere autonomie haben als bei uns. deshalb ist es wichtig, die heilkundeübertragung endlich umzusetzen. denn pflegende können mehr, als sie dürfen. wir sind die koalition, die den menschen etwas zutraut. das hat auch etwas mit wertschätzung zu tun. diese brauchen pflegende dringender denn je. mit der community health nurse schaffen wir ein neues berufsbild. hochqualifiziert soll sie die pflegerische versorgung gerade im ländlichen raum mitgestalten. sie hilft, damit auch menschen mit pflegebedarf länger in ihrer gewohnten umgebung bleiben können, und sie stärkt pflegenden angehörigen den rücken. denn, liebe kolleginnen und kollegen, pflege in unserem land ist zu einem ganz großen anteil angehörigenpflege. fast drei viertel aller pflegebedürftigen werden zu hause von angehörigen betreut. diese menschen brauchen dringend unterstützung. deshalb wollen wir leistungen wie die kurzzeit- und verhinderungspflege zu einem flexiblen entlastungsbudget zusammenfassen. die pflegegeldleistung wollen wir dynamisieren, und wir wollen mehr kurzzeitpflegeplätze schaffen. damit ist es nicht getan. wichtig ist aber, dass wir endlich anfangen, hier entlastung zu schaffen. als fortschrittskoalition wollen wir entbürokratisieren, vereinfachen, beschleunigen und vernetzen, gerade im gesundheitswesen, und dabei endlich den digitalisierungsstau in unserem land beheben. überbordende dokumentationspflichten müssen auf den prüfstand. machen wir es pflegenden mit digitalen anwendungen so einfach wie möglich! schenken wir ihnen mehr zeit! nutzen wir ki, um pflegebedürftigen und pflegenden angehörigen das leben zu erleichtern! wir stärken aber auch unsere kommunen; denn sie wissen am besten, wie sie ihre quartiere für ein gutes leben im alter, auch mit pflegebedarf, gestalten. wir fördern innovative wohnformen. das pflegeheim sollte stets die allerletzte station sein. damit das gelingt, setzen wir als ampelkoalition verstärkt auf prävention und rehabilitation. pflegebedarf hinauszuzögern, lebensqualität bis ins hohe alter zu ermöglichen, das ist das gebot der stunde. dafür setzen wir uns mit aller kraft ein. vielen dank. vielen dank, vor allen dingen an diejenigen, die die zeit immer so wunderbar einhalten. es folgt für die fraktion die linke der kollege ates gürpinar."
34,24.03.2022,ID202503400,Ates,Gürpinar,DIE LINKE,Ates Gürpinar,"sehr geehrte frau präsidentin! schön, dass sie wieder da sind! sehr geehrte damen und herren! die ampel einigt sich heute auf ein entlastungspaket, und sie, herr lauterbach, kündigen eine erhöhung der krankenkassenbeiträge an. ist das eigentlich schon satire, herr lauterbach? herr spahn hat bereits alle ersparnisse der krankenkassen munter aufgebraucht. ja, wenn wir hier nicht tätig werden im hause, dann drohen ab , spätestens ab massive steigerungen für die beitragszahlenden der krankenkassen. aber das bedeutet doch eine aufgabe für sie, herr lauterbach. sie haben doch die funktion, das zu verhindern. sie müssen eine ordentliche reform auf die reihe bringen, herr lauterbach. das ist ihre aufgabe. das ist ein bruch der versprechen aller koalitionsparteien, die normalverdienenden nicht zusätzlich zu belasten. die leute werden es in ihrem geldbeutel richtig spüren, wenn den kassen milliarden euro fehlen. da geht es um circa prozentpunkt. das bedeutet lohnkürzung, meine damen und herren. nichts anderes bedeutet das, und das dürfen sie nicht zulassen. bei den jetzigen preisen und der inflation dürfen wir das nicht zulassen. stoppen sie das, herr lauterbach! schaffen sie eine solidarische gesundheitsversicherung, in die alle einzahlen, ohne beitragsbemessungsgrenze, sodass auch wir, die wir hier so schön sitzen, endlich etwas ordentliches dazu beitragen! dann würden die beiträge sogar sinken, herr lauterbach. herr scholz hat an manche minister gestern dank verteilt. sie, herr lauterbach, waren nicht dabei. machen sie sich nichts daraus! ein dank vom kanzler ist nichts wert. denn wie sie bedankte er sich in seiner rede einmal mehr auch bei denjenigen, die uns durch die pandemie bringen und das bei dem ganzen genöle, was sich pflegekräfte, rettungssanitäterinnen und medizinische fachangestellte seit zwei jahren anhören müssen. er dankte, sie klatschten. dann meinte herr scholz, dass es damit nicht getan sei, und es folgte in seinen erläuternden ausführungen nichts. nichts für die pflegekräfte, nichts für die medizinischen fachangestellten, nichts für die rettungssanitäter! für die, die uns durch die pandemie bringen, folgte nichts. herr lauterbach, ein dank vom kanzler ist also generell relativ wenig wert. warten sie nicht darauf! tun sie etwas! wenn sie sich am ende von den pflegekräften, von den patientinnen und patienten, von den beitragszahlenden einen dank abholen, dann haben sie wirklich etwas geschafft. deswegen ende ich nicht mit vielen dank , sondern: bringen sie endlich etwas auf die reihe! frohes schaffen! es folgt für die spd-fraktion die kollegin heike baehrens."
35,24.03.2022,ID202503500,Heike,Baehrens,SPD,Heike Baehrens,"verehrte frau präsidentin! liebe kolleginnen und kollegen! trotz der großen krisen, die diesen haushaltsplan prägen, hat bundeskanzler olaf scholz gestern in seiner rede in der generaldebatte deutlich gemacht, dass eben das nicht vernachlässigt wird, was wir uns für die zukunft vorgenommen haben. aufbruch und fortschritt gestalten, das werden wir auch unter diesen schwierigen bedingungen in der gesundheitspolitik tun. schauen wir auf die digitalisierung, und zwar nicht nur in den schulen und den verwaltungen, sondern gerade auch im gesundheitswesen. wir werden diesen rückstand aufholen, der heute schon mehrfach angesprochen worden ist. denn digitalisierung kann dinge einfacher machen: für patientinnen und patienten, die bessere und passgenauere vorsorgeangebote bekommen, für reisende, die ihren impfpass einfach auf dem smartphone dabeihaben können, für pflegende, die weniger zeit für bürokratie verschwenden müssen, für die forschenden, die bessere daten für ihre arbeit brauchen, und für den öffentlichen gesundheitsdienst, der stärker und moderner werden muss. daran arbeiten wir nicht nur mit neuen gesetzen, sondern auch, indem wir uns intensiver um die umsetzung kümmern. das haben wir uns als fortschrittskoalition vorgenommen, und dabei erwarten wir eine konstruktive mitarbeit aller beteiligten im gesundheitswesen; denn wenn wir erfolgreich mit der digitalisierung sind, dann können auch argumente wie papiermangel nicht mehr vorgeschoben werden. moderne gesundheitspolitik braucht aufgeschlossenheit und gestaltungswillen auf allen ebenen der selbstverwaltung. aufbruch und fortschritt braucht es unbedingt aber auch in der pflege. auch das hat die pandemie nachdrücklich gezeigt; da knüpfe ich gern an das an, was frau westig eben schon gesagt hat. gute pflege geht nur mit stabiler und solider finanzierung. deshalb braucht die soziale pflegeversicherung dauerhaft einen ordentlichen bundeszuschuss. aber auch über diesen ersten schritt hinaus müssen wir für eine nachhaltige finanzierung der pflege sorgen, damit das gelingen kann, was wir uns vorgenommen haben. denn wir wollen die belastung der pflegebedürftigen in grenzen halten: bei den eigenanteilen in der stationären pflege, mit der einführung des flexiblen entlastungsbudgets für alle, die zu hause gepflegt werden, und durch die regelhafte dynamisierung des pflegegeldes. wir werden pflegebedürftige und ihre angehörigen durch den ausbau der tages- und nachtpflege stärken. wir werden diejenigen nachdrücklich stärken, die in der pflege arbeiten. sie brauchen endlich bessere arbeitsbedingungen. sie müssen sich auf ordentliche personalschlüssel in den krankenhäusern und in den pflegeheimen ebenso verlassen können wie auf eine gute bezahlung. dazu braucht es auch die stärkung der pflege in den gremien der selbstverwaltung. aber auch hier, in der pflegepolitik, gilt: alle akteure müssen an einem strang ziehen. da sind die arbeitgeber genauso gefordert, innovative und familienfreundliche arbeitszeitmodelle endlich auch in der praxis umzusetzen. und da will ich an den kollegen klein anknüpfen die länder müssen endlich in vollem umfang die verantwortung für die investitionskostenfinanzierung unserer krankenhäuser und auch der pflegeheime tragen; denn sonst bleibt die pflege unterfinanziert. ich komme zum schluss. liebe kolleginnen und kollegen, zukunftskoalition zu sein, das bedeutet, strukturen zu schaffen, die über die vier jahre dieser legislaturperiode hinausreichen. ich freue mich auf die gemeinsame zusammenarbeit. vielen dank, kollegin baehrens. es folgt für die cdu/csu-fraktion der abgeordnete michael hennrich."
36,24.03.2022,ID202503600,Michael,Hennrich,CDU/CSU,Michael Hennrich,"sehr geehrte frau präsidentin! liebe kolleginnen und kollegen! die haushaltswoche bietet immer eine wunderbare gelegenheit, bilanz zu ziehen, nach hundert tagen ampelregierung ganz besonders. es ist ein gutes signal, wie sie, frau piechotta, es auch formuliert haben, dass das thema gesundheit und gesundheitsschutz nicht am geld scheitert. was mich aber stört, ist, dass wir in den letzten wochen und monaten nur über das thema pandemie und covid gesprochen haben. sosehr ich sie, lieber herr lauterbach, geschätzt habe in den schwierigen monaten der pandemie, wo sie einen klaren kurs gefahren sind, so sehr verzweifle ich momentan an der politik in der pandemie. sie sorgen weder für klarheit, was die zukunft des gesundheitssystems angelangt, noch für orientierung. lassen wir die diskussion über die impfkampagne einmal revue passieren: wir hatten eine diskussion darüber die haben sie angezettelt , dass zum ende des jahres zu wenig impfstoff da wäre. heute sehen wir, dass impfstoff auf halde liegt. wir haben eine völlig verquere debatte über das thema impfpflicht. es wäre meines erachtens ihre aufgabe gewesen, einen vernünftigen plan vorzulegen, abgestimmt mit den koalitionspartnern, und nicht das instrument der gewissensentscheidung herbeizureden. jetzt stehen wir vor den scherben dieser debatte über die impfpflicht, und es geht weder vor noch zurück. auch das thema infektionsschutzgesetz hat spuren hinterlassen. aber viel wichtiger ist mir, dass sie vom modus des pandemieministers endlich in den modus des gesundheitsministers wechseln, dass sie die strukturreform vornehmen, auf die wir alle warten. das allerwichtigste ist, dass sie uns einen vorhabenplan vorlegen. unter minister spahn wussten wir für ein jahr genau, was an gesetzesvorhaben kommen soll. bisher steht da bei ihnen auf der habenseite nichts. sie haben vor kurzem im bereich arzneimittel einen finanzierungsentwurf vorgelegt, über den es sich wirklich lohnt zu diskutieren. da gibt es sicher elemente, die auch eine unionsgeführte regierung eingeführt hätte. orphan-drug-regelung, rückwirkung des erstattungsbetrages, bezahlbarkeit von kombinationstherapien, verwurfsproblematik das sind alles dinge, über die es sich lohnt zu diskutieren. aber ich gebe ganz offen zu: ich halte es für fatal, wenn sie jetzt im einzigen wirtschaftsbereich, der in deutschland international bestens positioniert ist, nämlich die pharmaindustrie wir haben es endlich geschafft, wieder ein stück weit apotheke der welt zu werden , für verunsicherung sorgen durch diskussionen über herstellerabschlag und ähnliches. das ist ein fatales zeichen, was die investitionstätigkeit internationaler konzerne angeht. ich bitte sie eindringlich, das zurückzunehmen. ich will sie auffordern, endlich deutlich zu machen, wie es weitergeht mit dem thema digitalisierung. jens spahn hat das wunderbar aufs gleis gesetzt. ich habe den eindruck, dass sie die räder wieder zurückdrehen wollen, dass es im kern keine elektronische patientenakte geben soll, kein e-rezept. zu dem ganzen thema wie geht es weiter mit den apps? wie können wir effizienzreserven heben? haben wir bis zum heuten tage nichts gehört. das gehört zu ihren aufgaben. wir als opposition würden uns gern mit ihnen streiten. aber dafür gibt es zwei voraussetzungen: erstens. legen sie pläne vor! zweitens und noch viel wichtiger: kommen sie in den gesundheitsausschuss, um mit uns diese dinge zu diskutieren! herzlichen dank für ihre aufmerksamkeit. vielen dank. als nächste rednerin folgt für bündnis /die grünen kordula schulz-asche."
37,24.03.2022,ID202503700,Kordula,Schulz-Asche,BÜNDNIS 90/DIE GRÜNEN,Kordula Schulz-Asche,"frau präsidentin! meine damen und herren! wir erleben gerade die erschütterung europas durch den krieg gegen die ukraine. millionen menschen jeden alters flüchten aus ihrem land und viele davon zu uns. wir müssen befürchten, dass dieser krieg länger dauert. deswegen stehen wir hier zusammen im kampf für demokratie und frieden in der ukraine und auch weltweit. wir müssen aber auch darauf achten, dass durch solche entwicklungen andere krisen nicht in vergessenheit geraten. dazu gehört der demografische wandel, den wir in deutschland in den nächsten jahrzehnten erleben werden. und dazu gehört der pflegenotstand, den es schon vor corona gab, der sich aber durch die coronapandemie erheblich verschärft hat. deswegen wird diese regierung handeln. ich möchte meinen vorrednerinnen frau westig und frau baehrens ausdrücklich für ihre beiträge danken. lassen sie mich aus meiner sicht noch mal einige punkte hervorheben. dazu gehört die steigerung der attraktivität der pflegeberufe. das geht durch höhere löhne, vor allem aber durch bessere arbeitsbedingungen. danke schön. ich bin auch verdi-mitglied. das geht durch höhere löhne, das geht durch bessere arbeitsbedingungen, vor allem auch durch bessere personalbemessungsinstrumente, durch familienfreundliche arbeitszeiten usw. usf. wir müssen die pflege durch ein zusammenspiel im gesundheitswesen aufwerten, durch heilkundliche tätigkeiten, durch neue berufsbilder wie die community health nurse in der gemeindepflege, und wir brauchen mehr unterstützung für die pflegenden familien, auch durch infrastruktur wie tages- und kurzzeitpflege. das sind alles überfällige projekte, die in den letzten jahrzehnten vernachlässigt wurden. und wir brauchen mehr menschen, die bereit sind, in der pflege zu arbeiten, und zwar so schnell wie möglich. pflege muss für junge menschen attraktiv sein. deswegen fangen wir natürlich mit ausbildung, fort- und weiterbildung an. aber ich möchte auch über die anerkennung ausländischer fachkräfte reden. die müssen wir endlich deutschlandweit harmonisieren. meine herzliche bitte an die bundesregierung und die bundesländer ist, jetzt möglichst schnell ein bundeseinheitliches verfahren der berufsanerkennung für pflegefachkräfte aus der ukraine zu schaffen, mit allem, was dazugehört, mit sprachkursen usw. usf., und dieses verfahren, wenn es etabliert ist, bitte auch bei allen anderen ausländischen pflegekräften, die zu uns kommen, anzuwenden. wir brauchen bundeseinheitliche lösungen. dieses hin und her zwischen den bundesländern muss endlich ein ende haben. wir werden sonst den demografischen wandel nicht meistern können. wir haben nicht mehr viel zeit, der steigenden anzahl von menschen, die auf professionelle hilfe angewiesen sind, und den familien, die sie unterstützen, zu helfen. lassen sie uns gemeinsam endlich ein massives und gutes fundament für die pflege schaffen! ich danke ihnen für die aufmerksamkeit. vielen dank, frau kollegin. nunmehr erhält das wort für die afd-fraktion jörg schneider."
