,datum,redeID,vorname,nachname,fraktion,name,inhalt_neu
38,04.03.2021,ID1921503800,Albert,Rupprecht,CDU/CSU,Albert Rupprecht,"frau präsidentin! liebe kolleginnen! liebe kollegen! herr sattelberger, der vorliegende nationale bildungsbericht gibt überhaupt keine grundlage für eine derartige skandalisierung, wie sie sie hier vorbringen. ich war wirklich gespannt eigentlich sollten sie mitarbeiter der bild -zeitung werden. sie lesen durch, schauen überall, wo ein schwachpunkt ist, und skandalisieren das auf eine dramatische art und weise. aber lösungen ich war wirklich gespannt darauf, was sie an lösungen vorschlagen : null komma null. wenn das die auseinandersetzung mit einem komplexen bildungssystem in unserem land ist, dann ist das viel zu kurz gesprungen. der nationale bildungsbericht zeigt stärken, und er zeigt schwächen. er zeigt im ergebnis ein weit besseres und ein weit differenzierteres bild, als die debatte hier abbildet. auf der positivseite ist zu vermerken: die zahl der bildungsteilnehmer, der bildungsstand, die zahl der beschäftigten im bildungswesen und die ausgaben für bildung sind gestiegen. die ausgaben für bildung sind gegenüber um prozent gestiegen, also , prozent des bruttoinlandsproduktes für forschung und bildung insgesamt. die durchlässigkeit des bildungssystems nimmt zu. die zahl der kinder geht zurück, aber die zahl der lehrkräfte steigt. ja, es gibt auch viele punkte auf der negativseite. ja, die zahl der jugendlichen ohne abschluss steigt. der grad der digitalisierung das haben wir rauf und runter diskutiert ist vollkommen unzureichend. da ist die frage abseits von rumgeschrei und skandalisierung : was sind unsere politischen konzepte? gehen wir doch mal ans eingemachte: wer macht es gut, und wer macht es schlecht? welche politischen konzepte funktionieren, und welche sind bloß sonntagsreden? gehen wir mal die punkte im bildungsbericht durch: erster punkt: schulqualität, mathematikkompetenzen. am ende der . klasse haben prozent der schüler den mindeststandard nicht erreicht. bayern ist prozentpunkte besser und sachsen prozentpunkte besser als der durchschnitt. zweiter punkt: bildungsarmut. der anteil von schulabsolventen ohne abschluss beträgt in bayern , prozent, in berlin aber , prozent das sind unterschiede! dritter punkt: bereich der integration, zusammenhang zwischen sozialer herkunft und bildungserfolg. im bildungsmonitor hat bayern hier den ersten platz. das sind die unterschiede, sehr geehrte damen und herren! jetzt könnte man weitermachen mit beruflicher bildung und noch vielen anderen sachen darüber hinaus. erstes zwischenergebnis. wenn alle bundesländer dieselben ergebnisse hätten wie bayern und sachsen alte bundesländer, neue bundesländer , dann wären wir im internationalen vergleich vorne dabei. zweites zwischenergebnis. das ist an sie gerichtet: wo unionsparteien schon seit langer zeit regieren wie in bayern und in sachsen, sind die bildungsergebnisse substanziell besser. drittes zwischenergebnis. dieses ewige lamento, die länder seien überfordert und der bund müsse alles lösen, stimmt schlichtweg nicht. wenn man sich die länder genauer anschaut, sieht man nämlich, dass es länder gibt, die die kraft haben, gute bildungspolitik hinzukriegen. sie müssen es nur endlich tun, sehr geehrte kolleginnen und kollegen! subsidiarität, dezentralität, entscheidungsfähigkeit in kleinen einheiten vor ort sind in komplexen, modernen zeiten wichtiger denn je. die hattie-studie aus dem jahr hat genau das noch einmal gezeigt: entscheidend für den unterschied im lernergebnis ist der lehrer, seine einstellung, wie er auf die schüler zugeht und wie er seinen beruf versteht. deswegen braucht der lehrer freiheit. er braucht eines als allerletztes: dass wir hier glauben, in berlin ohne komma und punkt alles übernehmen zu wollen, weil wir anscheinend für alles zuständig wären. subsidiarität und dezentralität sauber neu durchdeklinieren das ist das, was wir tun müssen. das gilt im übrigen auch in coronazeiten. ich habe eine tochter von acht und eine tochter von zwölf jahren, und ich kriege das mit so wie viele eltern zu hause. da gibt es lehrer, die sind herausragend trotz widriger umstände. und wieso sind sie das? weil sie die richtige einstellung haben. weil sie trotz dieser widrigen umstände einen genialen, bravourösen fernunterricht machen. ich weiß, dass die umstände schwierig sind, dass das nicht zufriedenstellend ist. aber es ist möglich, wenn man lehrerinnen und lehrer motiviert und unterstützt. das ist die schlüsselfrage. liebe kolleginnen und liebe kollegen, das heißt aber nicht, dass unsere position wäre, dass der bund nicht zuständig sei und keine aufgaben hätte; ganz im gegenteil. wir müssen uns sehr genau überlegen, was wir tun und wie wir es tun. diese naive sicht einiger linker gruppierungen im übrigen gehört die fdp seit dieser legislaturperiode inzwischen dazu , dass immer dann, wenn etwas nicht klappt, der bund sofort in die bresche springen muss, das ist der falsche ansatz. das ist unsinn, weil es letztendlich das gesamte system durcheinanderbringt und das problem nicht löst, sondern mehr probleme schafft. die aufgaben des bundes nehmen zu. aber es braucht klare verantwortlichkeiten. und wenn jeder für alles zuständig ist, ist zuletzt keiner verantwortlich und zuständig, sehr geehrte damen und herren. ich sage nur: das gehört auch zur bildungspolitik dazu. hier wird ständig ausschließlich über schulpolitik diskutiert. es geht um den nationalen bildungsbericht. da geht es um weit mehr als um die kerntätigkeiten von schule. wir haben in den vergangenen jahren mit großen paketen verantwortung übernommen: wir geben für den hochschulpakt bis milliarden euro an bundesmitteln. wir geben in den nächsten jahren für die hochschulen mit dem zukunftsvertrag studium und lehre stärken milliarden euro jährlich. wir haben für innovation und modernisierung in der beruflichen bildung in den letzten drei jahren während dieser legislaturperiode so viel zusätzliches geld gegeben wie jahrzehnte nicht, liebe kolleginnen und liebe kollegen. wir geben jetzt die , milliarden euro für den digitalpakt schule. und vielleicht eine anmerkung: ich war einer von denen, der vor fünf jahren hier mit ministerin wanka gesagt hat: wir stellen die milliarden euro ins schaufenster. von den kolleginnen und kollegen hier ist so etwas nicht gekommen. von den ländern, in denen sie verantwortung haben, gab es keinen antrag im bundesrat. es war unsere initiative. aber wir erwarten schon, dass sie bei der umsetzung ihre arbeit machen. zum geld. was haben wir als bund gemacht? und dann schauen wir, ob das die ganze nation hinkriegt. wir haben vonseiten des bundes seit die bildungsausgaben von , auf milliarden euro erhöht. das ist eine steigerung um prozent. das land brandenburg hat im selbigen zeitraum die gelder um prozent erhöht um nur ein beispiel zu nennen. also, reden sie nicht über uns, sondern reden sie dort, wo sie zugang haben, mit denen, die da verantwortung tragen! wenn alle das machten, was wir, seit wir an der regierung sind, machen, dann wären das gute zeiten in diesem lande. deswegen abschließend: ja, der kooperative föderalismus muss weiterentwickelt werden. natürlich macht es keinen sinn, dass jedes bundesland eine eigene schul-cloud hat. deswegen haben wir auch in den letzten zwei legislaturperioden die verfassung geändert, den artikel seither können wir uns an der grundfinanzierung der hochschulen beteiligen und den artikel hinzugefügt. seither können wir die schulen bei digitalisierung, betreuungsangeboten und weiterem mehr unterstützen. wir werden auch in der nächsten legislaturperiode die zuständigkeiten weiterentwickeln. ralph brinkhaus hat recht, wenn er sagt: corona hat uns gezeigt, dass die zusammenarbeit auf den staatlichen ebenen grundlegend verbessert werden muss. genau das werden wir tun, nicht aktionistisch, beliebig und nach dem motto jeder ist für alles zuständig , sondern indem wir genau überlegen, was unsere aufgabe auf bundesebene sein soll, was wir weiterentwickeln müssen. dann werden wir genau diese reform des staatswesens machen nicht aktionistisch, sondern klug und vernünftig. danke schön. vielen dank, albert rupprecht. nächste rednerin: für die afd-fraktion nicole höchst."
39,04.03.2021,ID1921503900,Nicole,Höchst,AfD,Nicole Höchst,"frau präsidentin! frau ministerin! werte kollegen! sehr geehrte damen und herren! vieles ist bereits gesagt worden. auf der tagesordnung heute müsste eigentlich nicht die selbstbeweihräucherung der regierung, sondern ein strategiepapier zur schnellstmöglichen wiederherstellung des regelbetriebs in unseren bildungseinrichtungen stehen. der bericht und die vielzahl der gestellten anträge zeigen, dass die fehlentwicklungen in bund und ländern nun überdeutlich zutage treten. dass immer mehr bürger über abitur oder einen hochschulabschluss verfügen, ist generell keine errungenschaft, sondern ein trauriges zeugnis über den niveauverfall im deutschen schul- und hochschulwesen, meine damen und herren. zudem verschärft diese entwicklung den fachkräftemangel im handwerk und die quote arbeitsloser akademiker. stärken sie endlich die berufliche bildung, wie in unseren zwei heute zu beratenden anträgen gefordert! das anwachsen des segments frühkindliche bildung , das heißt die fremdbetreuung von klein- und kleinstkindern ab einem jahr, feiern sie als einen erfolg. dabei ist die klassische familie die pandemiekrisensicherste, maskenfreieste und kinderfreundlichste form, seine kinder zu betreuen. wir fordern: eine familie muss endlich wieder von einem gehalt leben können, damit sie echte wahlfreiheit bezüglich innerfamiliärer arbeitsaufteilung und kinderbetreuung hat. meine damen und herren, alle tanzen um den weißen elefanten im raum. der bildungsbericht hingegen spricht probleme an, die die staatlich forcierte zuwanderung nach deutschland mit sich bringt. ja, lachen sie nur. es ist so. prozent der zuzügler über jahren haben keinen berufsabschluss. von den in deutschland geborenen menschen mit besonderem migrationshintergrund hat mehr als jeder vierte keinen berufsabschluss, und das, obwohl diese menschen das komplette bildungsangebot in deutschland wahrnehmen konnten. leider passt das genau zu den erkenntnissen von , dass sich nämlich zugezogene aus bestimmten zuzugskontexten in unserem hartz-iv-system mit prozent besonders wohlfühlen. wann fangen sie endlich an, mit diesen erkenntnissen zu arbeiten? wer die zukunft sehen will, schaut in die kitas. selbst im beschaulichen kurort bad kreuznach waren im jahr die kinder mit migrationshintergrund teilweise schon in der mehrheit. spitzenreiter war eine kita mit fast prozent kindern mit zuwanderungsgeschichte. wer integriert sich hier wo hinein? der bildungsbericht und sämtliche statistiken zeigen: wir haben ein wachsendes migrationsgeschuldetes passungsproblem beim übertritt in den ausbildungsmarkt und die beruflichkeit. deutschland braucht dringend eine abkehr von der globalistischen politik, die scheinbar jedem erdenbürger das menschenrecht auf ein leben in deutschland zuerkennen möchte. die alternative für deutschland fordert eine willkommenskultur für kinder, eine geregelte qualifizierte zuwanderung. dann klappt es auch wieder mit integration und bildung. vielen dank. nächster redner: für die spd-fraktion oliver kaczmarek."
40,04.03.2021,ID1921504000,Oliver,Kaczmarek,SPD,Oliver Kaczmarek,"frau präsidentin! meine damen und herren! natürlich kann man so tun, als wenn das eine debatte wäre, in der man alles mögliche unterbringen kann. aber es geht um bildungspolitik, und darum, dass in diesem land, in dieser situation viele anforderungen an unser bildungssystem gestellt werden. ich will zwei punkte aufgreifen. der lockdown hat doch gezeigt, wie wichtig schulen, wie wichtig kitas als orte sind, wo wissen geschaffen wird, als orte, wo sozialer zusammenhalt geschaffen wird. und deshalb ist es gut, dass die ersten schülerinnen und schüler wieder in die schule gehen können; wenn auch noch nicht alle und viele im wechselunterricht. jetzt kommt es darauf an, dass wir dieser öffnung von schulen den rücken stärken. ich will deshalb auch ganz klar sagen: das, was da gestern beschlossen worden ist das vorziehen der impfung von erzieherinnen und erziehern, von lehrerinnen und lehrern und die vereinbarung über regelmäßige tests in den schulen und kitas , gibt sicherheit für den schul- und kitabetrieb, das ermöglicht weitere öffnungsschritte. die beschlüsse von gestern gehen vielleicht noch nicht so weit, wie wir uns das vorgestellt haben, aber sie sind ein fortschritt und geben auch ein bisschen rückenwind für die öffnung von schulen und kitas. aber das reicht noch nicht; denn schülerinnen und schüler haben zu hause in den letzten wochen und monaten unterschiedlich lernen können. schätzungen gehen davon aus, dass bis zu prozent aller schülerinnen und schüler, die jetzt in die einrichtungen zurückkommen, lernrückstände haben und damit auch unterschiedlich ausgeprägten förderbedarf aufweisen. diese schülerinnen und schüler, meine damen und herren, brauchen unterstützung, und zwar nicht nur in den nächsten vier wochen oder in den ferien, sondern über mindestens ein jahr, damit aus lernrückständen eben nicht weniger chancen für die zukunft junger menschen werden. frau karliczek, wir fanden es gut, dass sie schon vor zwei, drei wochen angekündigt haben, dass sie den ländern dazu auch ein angebot machen wollen. wir freuen uns darüber und auch darüber, dass wir von ihnen jetzt konkrete vorschläge und verhandlungsergebnisse bekommen. denn das, was wir machen müssen, ist klar: wir müssen die lernrückständige in den mittelpunkt stellen nicht alles mögliche, sondern die lernrückstände , und es muss schnell gehen. das datum der sommerferien ist genannt. wir freuen uns über die initiative. es muss jetzt auch ganz konkret werden. in corona hat sich bestätigt, was der nationale bildungsbericht mit zahlen belegt hat: die menschen in diesem land wünschen sich die vereinbarkeit von familie und beruf. der bedarf ist groß. der nationale bildungsbericht weist einen bedarf von etwa plätzen bis für die ganztagsbetreuung in der grundschule aus. deshalb war es richtig, dass wir als koalition in dieser frage gehandelt haben. insgesamt , milliarden euro für den ausbau von ganztägiger bildung und betreuung an den grundschulen haben wir in dieser wahlperiode zur verfügung gestellt. das geld steht zur verfügung. wir können jetzt in mehr ganztagsbetreuung investieren. das war eine richtige entscheidung und auch eine wichtige lehre aus corona. ich will aber auch sagen: der rechtsanspruch auf ganztagsbetreuung an grundschulen fehlt uns noch; der würde das vervollständigen. ich habe deshalb die bitte, dass unser koalitionspartner, aber auch die grünen auf ihre landesverbände in baden-württemberg und hessen zugehen, damit wir klarheit bekommen, wie man dort zu einem rechtsanspruch auf ganztagsbetreuung an grundschulen steht. wir müssen auch bei diesen ländern endlich die bremsen lösen. dazu reicht es nicht, appelle hier im bundestag abzugeben. bitte sorgen sie in ihren eigenen läden dafür, dass das in dieser wahlperiode über die bühne gehen kann. corona hat gezwungenermaßen die potenziale und defizite des digital unterstützten lernens aufgezeigt. der digitalpakt hilft; das ist doch gar keine frage. er hilft vielleicht noch nicht ausreichend und sicherlich noch nicht schnell genug, aber man muss sich doch einmal vorstellen, wo wir in der pandemie ohne ihn wären. von frau wanka gab es nur eine ankündigung ohne ergebnis; kein einziger euro wurde im haushalt dafür bereitgestellt. es war doch richtig, dass olaf scholz und frau karliczek gehandelt haben und dass olaf scholz als finanzminister in einer seiner ersten amtshandlungen den digitalfonds eingerichtet hat. das erste geld für den digitalpakt schule stand bereits zur verfügung, bevor es eine entsprechende bund-länder-vereinbarung gegeben hat. deswegen sage ich: der digitalpakt ist eine gute sache. das geld ist da. es muss jetzt noch schneller und unkomplizierter gehen. daran müssen wir noch arbeiten. ich glaube, wenn wir dies in den mittelpunkt stellen ganztagsbetreuung, digitalisierung und wenn wir uns jetzt um die schülerinnen und schüler mit lernrückständen kümmern, dann können wir vertrauen in bildungspolitik zurückgewinnen. ich glaube, die debatte heute hat gezeigt, dass das notwendig ist. vielen dank, kollege kaczmarek. nächster redner: für die fdp-fraktion dr. jens brandenburg."
41,04.03.2021,ID1921504100,Jens,Brandenburg,FDP,Jens Brandenburg,"frau präsidentin! frau ministerin! liebe kolleginnen und kollegen! wir diskutieren heute einen bericht, der im wesentlichen unser bildungssystem in der zeit vor der pandemie beschreibt. seitdem hat sich viel verändert. aber einiges war vorher schon absehbar. der bildungserfolg eines menschen hängt in deutschland von seiner sozialen herkunft ab, stärker als in vielen anderen entwickelten staaten. die zahl junger menschen ganz ohne schulabschluss ist um erschreckende prozent angestiegen. auch die digitale bildung hat deutschland völlig verschlafen. die coronakrise hat diese probleme massiv verschärft. im fernunterricht haben schon jetzt viele schüler und schülerinnen den anschluss verloren. viele auszubildende sorgen sich um ihre zukunft. viele studierende haben nebenjobs verloren und fallen beim bafög trotz finanzieller nöte weiter durchs raster. sie alle leiden im lockdown unter sozialer isolation. die probleme sind riesig. und was macht unsere regierung? ein progrämmchen hier, ein trostpflaster dort. aber die nötigen ps bringen sie nicht auf die straße. das vorhaben, einen nationalen bildungsrat einzusetzen, haben herr söder aus bayern und herr kretschmann aus baden-württemberg gegen die wand gefahren. im kernprogramm des digitalpakts schule sind nach fast zwei jahren bundesweit gerade einmal etwa prozent der mittel abgeflossen. frau eisenmann hat diesen schnitt in baden-württemberg mit , prozent noch deutlich unterboten, und bayern, herr rupprecht, liegt übrigens bei , prozent des mittelabrufs nach zwei jahren. wenn sie, frau ministerin, dieses bundesweite schneckentempo heute hier in der debatte allen ernstes als eigenen erfolg verkaufen wollen, dann ist das ein schlechter witz. von routinierten kenntnisnahmen haben wir hier genug. unser land braucht endlich eine regierung, die bildungschancen in deutschland wieder zu einem schwerpunkt ihrer arbeit macht. ein paar vorschläge dazu? sehr gerne: schaffen sie doch endlich einen digitalpakt . , der schulen planungssicherheit gibt und auch in it-kräfte, in pädagogische konzepte und lehrerweiterbildung investiert. wir brauchen ein bundesprogramm lern-buddys dies haben wir letzte woche vorgeschlagen , bei dem studierende bundesweit schülerinnen und schülern helfen, die lernrückstände aufzuholen. wir brauchen eine starke mint-offensive für mathe und naturwissenschaften, auch um die fachkräftelücke endlich wieder zu schließen, einen modernen bildungsföderalismus mit verbindlichen standards und abschlussprüfungen und auch hoher umsetzungsfreiheit vor ort. wir brauchen eine strukturelle reform des bafög zu einer elternunabhängigen förderung, damit sich jeder ein studium leisten kann, eine qualitätsoffensive in der lehre, um den hochschulen zu ermöglichen, auch bessere betreuungsquoten und innovativere lehrkonzepte anzubieten, eine exzellenzinitiative in der beruflichen bildung, angefangen bei der berufsorientierung über auslandsaufenthalte bis hin zur besseren ausstattung der berufsschulen. ein weiterer vorschlag betrifft eine öffnung der begabtenförderung dies wurde mehrfach hier im deutschen bundestag beantragt , der akademischen begabtenförderung für talente in der beruflichen bildung. wir wollen ein midlife-bafög für weiterbildung ein leben lang, auch in der mitte des lebens. frau karliczek, ich hoffe, sie haben jetzt fleißig mitgeschrieben. wir haben all diese vorschläge und vieles mehr in dieser legislaturperiode immer wieder in den deutschen bundestag eingebracht. sie müssen das nicht alles sofort übernehmen, aber schon ein stück davon würde unser land spürbar voranbringen. tun sie es nicht für uns, sondern für millionen schülerinnen und schüler, für auszubildende und studierende in diesem land. weltbeste bildung für jeden, unabhängig von der sozialen herkunft, das muss unser aller anspruch sein. vielen dank, dr. brandenburg. nächster redner: für bündnis /die grünen kai gehring."
42,04.03.2021,ID1921504200,Kai,Gehring,BÜNDNIS 90/DIE GRÜNEN,Kai Gehring,"frau präsidentin! liebe kolleginnen und kollegen! ich bin eigentlich immer noch ziemlich konsterniert. niemand braucht eine ministerin fürs schönreden, sondern es braucht eine bundesbildungsministerin, die bildungsrealitäten anerkennt, die ambitionen hat, die engagement für beste bildung zeigt, die dafür brennt, dass alle kinder in unserem land die gleichen chancen haben. ihre rede aber strotzte vor realitätsverweigerung und planlosigkeit. der bildungsbericht, den wir hier heute debattieren, ist für mich wie ein stillleben, eine momentaufnahme der deutschen bildungslandschaft vor dem coronaausbruch. und was sehe ich? ich sehe schulen und universitäten, die kaum digitale bildung anbieten konnten. ich sehe, dass wieder mehr jugendliche ohne abschluss die schule verlassen und mehr junge erwachsene ohne berufsausbildung bleiben. im bmbf müssten alle alarmglocken schrillen, aber keiner reagiert. das ist doch fatal. dann kam die coronapandemie. sie wirkte wie ein krisenbeschleuniger. geschlossene kitas und schulen bedeuten weniger chancen auf bildung. einschränkungen im sozialen leben lassen kinder und jugendliche vereinsamen. viele studierende und azubis haben finanznöte, stehen vor einem ungewissen berufseinstieg. ob homeschooling oder onlinesemester lernen und prüfungen digital sind der pure stresstest. ob kinderärzte, ob bildungsforscherinnen und bildungsforscher alle warnen vor den folgen des lockdowns auf die psychosoziale gesundheit, auf die entwicklung von kids, auf ihre chancen. aber wann kapiert das eigentlich diese bundesregierung? nach einem jahr corona wird weiter herumgedoktert ohne ein klares regierungskonzept, wie familien mit der pandemie leben und wie bildungseinrichtungen sicher geöffnet werden können. bundesregierung und ministerpräsidentenkonferenz gehen eindeutig den zweiten schritt vor dem ersten. öffnungen ohne ausreichende tests, ohne teststrategie, mit geringen impfquoten sind ein wagnis. man sehnt die normalität herbei, aber vorausschauendes handeln für sichere bildung geht eindeutig anders. ihre -leitlinie zu schulen in der pandemie bündelt wissenschaftliche erkenntnisse von fachgesellschaften, kam aber ein dreivierteljahr zu spät. frau karliczek, sie haben einfach ihren job nicht gemacht. die bundesregierung macht so aus der coronakrise eine bildungskrise. das muss sich ändern. es geht um , millionen unter -jährige. viele können die coronaeinschränkungen kompensieren, indem sie auf wissen und unterstützung der eltern zurückgreifen. andere können das aber nicht. gerade kinder aus bildungsfernen elternhäusern haben nur eine chance, wenn sie gute bildung und begleitung bekommen. initiativen von den demokratischen oppositionskräften, die sie hätten aufgreifen können, gab es zuhauf: luftfilter an schulen, teststrategien, anspruch auf förderung bei lernrückständen, eine öffnung des bafög für bedürftige studierende, eine ausbildungsgarantie und, und, und. wann bringen sie das denn endlich auf den weg? ein bildungsschutzschirm des bundes ist überfällig. kommen sie zum schluss bitte! ich komme zum schluss. mangels tatkraft klafft die bildungsschere weiter auseinander. ich mache mir große sorgen und fürchte mich vor dem nächsten bildungsbericht und vor einem pisa-schock in der zukunft. der muss abgewendet werden. wenn jeder vor ort an seiner stelle die verantwortung wahrnimmt, herr kollege! dann schaffen wir es, dass auch bildungsbenachteiligte kids chancen bekommen. vielen dank, kai gehring. nächster redner: für die cdu/csu-fraktion tankred schipanski."
