,datum,redeID,vorname,nachname,fraktion,name,inhalt_neu
36,19.04.2018,ID192603600,Torsten,Schweiger,CDU/CSU,Torsten Schweiger,sehr geehrter herr präsident liebe kolleginnen und kollegen meine sehr verehrten damen und herren wir befassen uns heute mit dem antrag wohnungsbau entbürokratisieren kostenexplosion eindämmen meine vorredner sind bereits umfassend auf die aktivitäten von bund und ländern eingegangen um den wohnungsbau in deutschland anzukurbeln die kostentreiber und auch die hemmnisse sind benannt worden ich will daher den blick auf die aktuelle wohnungsbaupolitik richten und die offensichtlichen fehlentwicklungen die wir in der vergangenheit gehabt haben aus einer völlig anderen perspektive darstellen die sicherlich in dem vorliegenden antrag jedenfalls meiner meinung nach noch unzureichend zum ausdruck kommt während meiner -jährigen tätigkeit als bauamtsleiter in der stadt sangerhausen das ist eine kleine kreisstadt in sachsen-anhalt mit rund einwohnern habe ich mich sozusagen täglich mit den problemen des öffentlichen baurechts auseinandergesetzt zum beispiel sorgte insbesondere im zusammenhang mit den baugenehmigungen im rahmen des § baugesetzbuch immer wieder die auslegung für probleme zwischen den baugenehmigungsbehörden das sind die landkreise den städten die das planungsrechtliche einvernehmen erteilen und natürlich auch den bauherren die im gesetzestext vorhandenen formulierungen wie maß der baulichen nutzung oder eigenart der näheren umgebung bereiten immer wieder probleme die mühsam und zeitaufwendig geklärt werden müssen aber auch die dreimonatsfrist die für die genehmigungsbehörde gilt ist mitunter schwer zu rechtfertigen zumal sie für ein bauvorhaben von einigen tausend euro genauso gilt wie für ein millionenprojekt auch daraus ergibt sich sicherlich die notwendigkeit einer diskussion über eine überarbeitung des baugesetzbuches es gilt nun aber auch zu schauen ob sich beispielsweise objektivere kriterien für die genehmigung nach § finden lassen ein weiteres hemmnis für die zügige umsetzung von bauprojekten insbesondere dann wenn es sich nicht nur um ein einzelnes haus handelt das bauvorhaben größerer art ist oder beispielsweise im außenbereich liegt sind die zeitraubenden bebauungsplanverfahren die in der regel mindestens ein jahr dauern und das ist schon optimistisch die beteiligung (an der bauleitplanung) einer unmenge von trägern öffentlicher belange der sogenannten töbs ist immens zeitaufwendig und problematisch dass es zum beispiel notwendig ist die wehrbereichsverwaltung in einer kleinstadt zu beteiligen um herauszufinden ob nicht gerade an diesem standort der planung irgendwann zukünftig eine neue militärische anlage gebaut werden soll zeigt dass wir hier unbedingt stärker differenzieren müssen wenn wir bei den genehmigungen an geschwindigkeit gewinnen wollen auch hier greift der antrag der fdp meiner meinung nach etwas zu kurz seit aber die umweltverbände vom gesetzgeber durch das verbandsklagerecht privilegiert wurden nimmt die zahl der klagen ständig zu so auch in den vergangenen jahren in meinem verantwortungsbereich als bauamtsleiter klagen sind das wissen wir alle über mehrere instanzen sehr verzögernd und letztendlich geben viele investoren auf weil die finanzierung zusammenbricht und das projekt nicht mehr umsetzbar ist meiner erfahrung nach geraten genehmigungsverfahren für infrastrukturprojekte aber auch für notwendigen wohnungsbau oftmals so in eine schieflage das verbandsklagerecht wird zunehmend als blockadeinstrument benutzt und somit zweckentfremdet investoren wird damit meiner meinung nach ein oft überdurchschnittliches maß und risiko aufgebürdet auch hier gilt es zügig abhilfe zu schaffen damit die wichtung der interessenlage ausgeglichener erfolgt um kosten zu sparen und den planungshorizont überschaubar zu halten einen weiteren zentralen aspekt möchte ich deutlich hervorheben unser wohnungsmarkt ist schon seit vielen jahren ein stück weit aus dem gleichgewicht geraten die diskrepanz zwischen nachfrageengpässen in den ballungsräumen und angebotsüberhang im ländlichen raum wird immer größer insofern ist das jetzt notwendige wohnungsbauprogramm unabweisbar ganz deutlich aber für eine gleichwertigkeit der lebensverhältnisse in stadt und land wie es auch der koalitionsvertrag vorsieht ist es eigentlich nicht zuträglich ich möchte ihnen nicht vorenthalten dass in meinem wahlkreis im süden sachsen-anhalts viel geld in die hand genommen wurde um durch abwanderung leer stehende gebäude abzureißen wir mussten wohnraum vernichten um wenigstens die mieten stabil halten zu können und für investoren überhaupt eine refinanzierung zu sichern in den wachstumszentren und ballungsräumen hingegen muss der wohnungsbau massiv vorangetrieben werden oft mit milliardenaufwand wir doktern seit jahren an den symptomen eines problematischen wohnungsmarktes herum ich bin überzeugt dass die ursache der fehlentwicklung auch in der teilweisen vernachlässigung der ländlichen räume besteht wir haben bisher einfach zu wenig getan um gleichwertige lebensbedingungen in stadt und land sowie in einzelnen ländlichen räumen zu schaffen es gelingt nicht ausreichend den menschen insbesondere den jungen menschen eine attraktive soziale und technische infrastruktur zu bieten die den abwanderungsprozessen entgegenwirkt daher bin ich ausgesprochen froh darüber dass der koalitionsvertrag die herstellung von gleichwertigen lebensverhältnissen in stadt und land zum ziel hat lassen sie mich über einen weiteren punkt des fdp-antrags reden der unterstützung verdient die energieeinsparverordnung sollte nicht weiter verschärft werden nicht einmal ansatzweise damit neue und sanierte wohngebäude besonders energieeffizient sind hat der gesetzgeber die bereits bestehenden richtlinien verschärft und die anforderungen an den zulässigen primärenergiebedarf erhöht für bauherren und eigentümer bedeutet dies enorme mehrkosten somit unterstütze ich die im antrag der fdp formulierte forderung nach einem verzicht auf weitere verschärfungen der energieeinsparverordnung ein weiterer punkt ist ebenfalls diskussionswürdig: die wiedereinführung der degressiven abschreibung ursprünglich sollten familien von diesem lukrativen steuermodell profitieren einem steuerlichen anreiz um den traum vom privaten eigenheim zu realisieren als ersichtlich wurde dass weniger familien sondern mehr wohnungsbaugesellschaften nutznießer waren hat man die degressive steuerliche abschreibung wieder abgeschafft mit der fatalen folge dass auf dem deutschen immobilienmarkt ein drastischer rückgang zu verzeichnen ist die folgen sind bis heute spürbar um den privaten wohnungsbau wieder anzukurbeln sollte deshalb die wiedereinführung der degressiven abschreibung zumindest in erwägung gezogen werden ich komme zu meinem letzten punkt zu der grunderwerbsteuer und der grundsteuer die prüfung eines freibetrags bei der grunderwerbsteuer wie es der koalitionsvertrag vorsieht ist ein vernünftiger ansatz ganz deutlich allerdings wird man die auswirkungen in den ländern genau im blick haben müssen dazu erwarte ich eine rege erörterung in den ausschüssen ein korrespondierender punkt wird die diskussion über die neugestaltung der grundsteuer sein praktikabilität und dadurch schnelle umsetzung sind hier das gebot der stunde bei dieser wichtigen einnahmequelle unserer kommunen als bemessungsgrundlage sollten bereits verfügbare daten wie die bodenrichtwerte dienen jeglicher bürokratischer aufwand zulasten der behörden und der steuerpflichtigen muss vermieden werden die forderung dass die reform aufkommensneutral sein soll ist berechtigt auch wenn mir hier momentan die fantasie fehlt mir vorzustellen wie das gehen soll wenn wir in zukunft wohnungsbaupolitik in deutschland erfolgreicher und mit größerer gesellschaftlicher akzeptanz betreiben wollen müssen wir die ursachen der fehlentwicklung im ländlichen raum beherzt angehen der heute vorliegende fdp-antrag ist dafür eine erste basis greift aber nicht weit genug ich freue mich daher auf die beratungen in den ausschüssen herzlichen dank vielen dank da sich das plenum langsam füllt mit blick auf die nahenden abstimmungen bitte ich darum die notwendigen gespräche wenn sie geführt werden müssen draußen in der lobby zu führen und dem letzten redner die nötige aufmerksamkeit zu schenken das ist timon gremmels für die fraktion der spd
37,19.04.2018,ID192603700,Timon,Gremmels,SPD,Timon Gremmels,herr präsident meine sehr verehrten damen und herren ich dachte schon die kolleginnen und kollegen kommen meinetwegen in den saal; aber anscheinend liegt es doch nur an der abstimmung ich freue mich dass wir uns heute hier mit dem thema wohnungsbau beschäftigen als ich den ersten absatz des fdp-antrags gelesen habe habe ich gedacht dass sie von der fdp die zeichen der zeit erkannt haben und ein ernsthaftes soziales problem adressieren der erste absatz dieses antrags ist okay aber im hinblick darauf wie sie ihr vorhaben umsetzen wollen springen sie deutlich zu kurz meine sehr verehrten damen und herren von der fdp der mangel an wohnraum ich füge hinzu: der mangel an bezahlbarem wohnraum ist die soziale frage des kommenden jahrzehnts ich finde dass wir in der großen koalition mit hochdruck an diesem wichtigen thema arbeiten und auch gute lösungen vereinbart haben das ist zum ersten die arbeit der baukostensenkungskommission fortzusetzen zum zweiten die initiative für ein bündnis für bezahlbares wohnen und bauen die schon die damalige bundesbauministerin hendricks auf den weg gebracht hat fortzuführen drittens den sozialen wohnungsbau weiter zu fördern viertens ein planungs- und beschleunigungsgesetz auf den weg zu bringen fünftens die digitalisierung des planens und bauens gemeinsam mit der wirtschaft voranzubringen und sechstens was mich ganz besonders freut weil die koalition insbesondere die cdu da ihre blockade aufgegeben hat endlich auch bundeseigene grundstücke kostengünstig abzugeben damit sie für den sozialen wohnungsbau genutzt werden können das wäre gut und es ist längst überfällig liebe kolleginnen und kollegen von der fdp was wir ganz sicherlich nicht tun werden ist dass wir wohn- und klimaschutz gegeneinander ausspielen genau das ist der kern ihres antrages das ist aus meiner sicht nicht der richtige weg sie schreiben von überdurchschnittlich gestiegenen preisen für die technische gebäudeausrüstung und von energetischen anforderungen die sich nach verschiedenen wissenschaftlichen untersuchungen als kostentreiber erwiesen hätten; allerdings belegen sie diese untersuchungen nicht ich sage ihnen: das ist schlicht und einfach falsch ich habe einen beleg für das was ich sage der kollege kühn hatte die gleiche quelle : das institut für technische gebäudeausrüstung dresden hat anfang dieses jahres untersucht wie das mit den kosten ist dabei kam ganz klar heraus dass die gesamtkostensteigerungen durch energetische auflagen seit dem jahr als gering einzuschätzen sind von der -prozentigen preissteigerung zwischen und fallen gerade einmal prozentpunkte auf den gebäudeenergiebereich zurück das spricht doch bände sie bauen da einen popanz auf sie wollen die energiewende im gebäudebereich nicht und versuchen jetzt sie gegen die frage bezahlbaren wohnraums auszuspielen das ist nicht gut weil sie die energiepolitische realität verkennen energieeffizienz im gebäudebereich ist gleich dreimal sinnvoll: sie ist sinnvoll für die mieterinnen und mieter weil sie sich von steigenden energiekosten unabhängig machen die häuser und die wohnungen die heute gebaut werden müssen so beschaffen sein dass menschen in den nächsten jahren darin wohnen können wenn wir einmal geld in die hand nehmen dann sollten wir das nachhaltig tun und die energiekosten von denen wir nicht wissen wie sie sich weiterentwickeln im blick behalten energieeffizienz ist zweitens für die wirtschaft günstig weil die branche der technischen gebäudeausrüstung über gutbezahlte ingenieure hat und mehr als milliarden euro umsetzt eigentlich ist das doch die sprache die sie verstehen hören sie doch einmal auf die kolleginnen und kollegen aus dieser wirtschaftsbranche zum dritten ist sie gut klima und umwelt aber liebe kolleginnen und kollegen von der fdp wenn sie dieses thema hier schon ansprechen dann sollten sie doch auch bitte an der stellschraube drehen bei der das wirklich nutzt und das ist wie vom bundesinstitut für bau- stadt- und raumforschung im september amtlich festgestellt die frage mangelnder geeigneter flächen und zu hoher grundstückspreise das ist doch das eigentliche problem vor dessen behandlung drücken sie sich in ihrem antrag; dazu sagen sie nichts die beseitigung dieses engpasses ist der entscheidende faktor für mehr bezahlbaren wohnraum lassen sie uns doch darüber diskutieren wenn wir jetzt über die grundsteuer diskutieren bodenspekulationen muss im rahmen einer umfassenden grundsteuerreform einhalt geboten werden dazu könnten sie einen beitrag leisten nämlich indem sie die baukosten nachhaltig reduzieren und bezahlbaren wohnraum schaffen das ist die richtige stellschraube von der in ihrem antrag mit keinem wort die rede ist das zeigt einmal mehr dass die fdp nach wie vor eine klientelpartei ist ich sage ihnen noch etwas: wenn sie hier die enev zitieren dann schauen sie doch einmal welche unterschrift unter dieser verordnung steht wer hat die unterschrieben gucken sie mal rein ich gebe ihnen einen tipp: das war noch ein wirtschaftsminister der ihr parteibuch hat so viel zur redlichkeit der fdp vielen dank weitere wortmeldungen liegen nicht vor ich schließe damit die aussprache interfraktionell wird überweisung der vorlage auf drucksache / an den ausschuss für umwelt naturschutz bau und reaktorsicherheit vorgeschlagen damit sind sie soweit erkennbar einverstanden dann ist die überweisung so beschlossen
38,19.04.2018,ID192603800,Martin,Hebner,AfD,Martin Hebner,sehr geehrte frau präsidentin verehrte damen und herren alles hängt mit allem zusammen oder: nichts hat mit nichts zu tun die wahrheit dahinter ist oft ganz simpel oder manchmal auch komplex und verschachtelt die ausarbeitung des sogenannten global compacts for migration zu deutsch: globaler pakt für migration befindet sich in der abschließenden phase dieser pakt soll in von den regierungen unterschrieben werden vorgestern am dienstag fand im eu-parlament eine aussprache zu diesem pakt statt und gestern gab es eine entscheidung dazu auch mit zustimmung der union aus cdu und csu wurde beschlossen dass ich zitiere : … migranten und flüchtlinge unabhängig von ihrem rechtsstatus anerkannt und die staaten verpflichtet werden sie zu achten einschließlich des fundamentalen grundsatzes der nichtzurückweisung … meine damen und herren das wurde auch mit den stimmen der union gestern im eu-parlament beschlossen ziel der union ist die etablierung eines weltweiten globalen pakts für migration die aktuelle ausarbeitung der beschlossenen new yorker erklärung etabliert ein bündel von rechten für reguläre migration und von pflichten für die aufnehmenden zielstaaten zu den staatlichen pflichten gehört die bekämpfung von xenophobie jegliche kritik an diesem plan wird als ebensolche fremdenfeindlichkeit bezeichnet es soll auch keine rolle mehr spielen ob flüchtlinge und migranten an den grenzen pässe haben oder nicht die erklärung könnte zu einem signal für eine nie da gewesene völkerwanderung werden die vor allem in die sozialsysteme europas erfolgen wird wir hatten uns darüber gewundert was die beteiligung am resettlement- und relocation-programm dem umsiedlungsprogramm der un im wahlprogramm der union zu suchen hat jetzt wissen wir es sprache steuert das denken wo also von flüchtlingen oder gar geflüchteten die rede ist denkt man an bürgerkrieg not und hilfe aber man ahnt spätestens seit der gewalt des übergriffigen migrantenmobs aus nordafri kanischen staaten in köln und anderswo dass viele der sogenannten syrer eben nicht von dort kommen die iom die internationale organisation für migration in brüssel gegründet beschäftigt sich seit mit der steuerung von migration seit dem jahr ist sie teil des un-flüchtlingshilfswerks unhcr europa zielregion der migration hat kaum mitsprache im hintergrund stehen neben der westlichen hilfsbereitschaft im übrigen handfeste wirtschaftliche interessen ein einheitlicher globalisierter markt auch für menschen unbeschränkt durch nationale regelungen lässt sich nur nach auflösung nationaler identität erreichen das world economic forum in davos hat in seinem global agenda council for migration für die industrie bereits einen businessplan bzw einen business case for migration beschrieben somit ein geschäftsmodell für migration ein geschäftsmodell zu dem im übrigen der daimler-chef zetsche mit blick auf die migranten und flüchtlinge sagte dass ein neues wirtschaftswunder heraufziehen würde was aber will ein staat ohne grenzen ohne budgethoheit ohne definition der eigenen identität kein grundgesetz kann die kulturelle wertebeliebigkeit noch sinnstiftend regeln die ein solches siedlungsgebiet für jedermann darstellen würde das ist der bekannte one-world-unsinn der armut sozialisiert statt leistung zu fördern und der nicht erkennt dass toleranz ohne die akzeptanz von grundregeln zur blaupause für anarchie mutiert die bisherigen entscheidungen erfolgten an den demokratischen strukturen vorbei um anschließend als alternativlos und großer gewinn für die zielländer präsentiert zu werden oder wie frau merkel schlicht sagte: nun sind sie halt da meine damen und herren verantwortung sieht anders aus im übrigen geht benjamin netanjahu davon aus dass die schwarzafrikaner die israel nicht haben will und die das land verlassen müssen auf deutschland verteilt werden weil verpflichtungen gegenüber dem unhcr bestehen es ist damit klar dass es hier nicht um flucht vor krieg oder um verfolgung gehen kann es geht um eine geplante umsiedlung zu der sich deutschland verpflichtet hat am deutschen parlament vorbei wer meine damen und herren hat die bundesregierung dazu ermächtigt wann wurde das thema im bundestag behandelt wann wurde darüber in der öffentlichkeit berichtet wo waren die sogenannten qualitätsmedien allen voran ard und zdf die doch immer so gern am nerv der zeit sind lassen sie sich noch einmal vor augen führen was gestern im eu-parlament verabschiedet wurde und lesen sie das einmal es geht um eine globale neuordnung die eu ist dabei und der bundestag ist entmündigt sie die sie hier sitzen haben sich selbst entmündigt meine damen und herren ändern wir das die usa haben die mitwirkung am globalen pakt für migration gekündigt; denn er ist ein no-border-programm sie haben recht: er ist ein pakt zur aufhebung der grenzen eine welt ohne grenzen ist eine ähnliche illusion wie wohlstand ohne arbeit herr hebner achten sie bitte auf die zeit ja meine damen und herren im fries dieses geschichtsträchtigen hohen hauses steht nicht: der ganzen welt dort steht: dem deutschen volke vielen dank das wort hat der abgeordnete dr andreas nick für die cdu/csu-fraktion
39,19.04.2018,ID192603900,Andreas,Nick,CDU/CSU,Andreas Nick,frau präsidentin meine damen und herren liebe kolleginnen und kollegen mit dieser aktuellen stunde soll offenbar der eindruck erweckt werden so haben sie es gesagt kollege hebner die vereinten nationen wollten mit dem global compact for migration eine nie da gewesene völkerwanderung in richtung europa und in unsere sozialsysteme in gang setzen die stichworte migration und internationale zusammenarbeit reichen offenbar schon aus um bei ihnen entsprechende reflexe auszulösen das genaue gegenteil ist in wahrheit der fall: es ist das erklärte ziel des pakts ungeregelte migrationsströme zu verringern es geht um globale lösungen im umgang mit fluchtbewegungen und um geordnete migration es geht an keiner stelle darum das ist jedenfalls die klare position der bundesregierung staatliche souveränitätsrechte einzuschränken meine damen und herren wir wollen migration ordnen steuern und begrenzen deshalb wollen wir die bekämpfung der eigentlichen fluchtursachen in den ursprungsländern in den vordergrund rücken deshalb setzen wir uns für die nachhaltige verbesserung der lebenssituation in den herkunfts- und transitländern ein deshalb bekämpfen wir illegale migration und schleuserkriminalität und deshalb wollen wir auch funktionierende rücknahmeabkommen mit möglichst zahlreichen herkunftsländern in afrika und anderswo und im rahmen von migrationspartnerschaften mag es an der einen oder anderen stelle sinnvoll sein im gegenzug auch klar definierte kontingente für begrenzte zuwanderung zu eröffnen zum beispiel über studenten- und arbeitsvisa wir haben alles im übrigen im bereich des westlichen balkan mit großem erfolg praktiziert denn kluge einwanderungspolitik wie es im koalitionsvertrag heißt verringert die attraktivität von illegaler und ungesteuerter einwanderung gesteuerte einwanderung muss nach festen von den zielländern festgelegten kriterien erfolgen deshalb beteiligen wir uns im rahmen der un auch an den verhandlungen zum migrationspakt resettlement-programme mit dem unhcr nach humanitären kriterien sind eine klare ergänzung für das was in diesem bereich zu tun ist wie wir es auch im eu-türkei-abkommen dargelegt haben meine damen und herren wer eine steuerung und begrenzung der migration erreichen will kann nicht ignorieren: fluchtbewegungen und migrationsdruck sind weltweit eine realität und das mehr denn je millionen menschen leben heute in einem anderen land als ihrem geburtsland mehr als jemals zuvor weltweit sind derzeit rund millionen menschen auf der flucht davon über millionen binnenvertriebene die meisten flüchtlinge finden aufnahme in nachbarländern die häufig selbst entwicklungsländer sind mehr als prozent der flüchtlinge weltweit halten sich in staaten mit niedrigem oder mittlerem einkommen auf diese aufnahmeländer benötigen unterstützung auch um ihre eigene stabilität weiterhin gewährleisten zu können wer globale wanderungsbewegungen begrenzen und steuern will der muss auch hier ansetzen denn es ist sinnvoll dass flüchtlinge möglichst in der region oder den nachbarländern verbleiben können; das wahrt am besten ihre chance auf rückkehr in ihr heimatland dort muss selbstverständlich ihre elementare versorgung sichergestellt werden das ist nicht nur eine humanitäre verantwortung; lastenteilung in dieser hinsicht ist auch wirtschaftlich sinnvoll die versorgung und unterbringung eines flüchtlings in europa kostet nach manchen berechnungen mehr als das hundertfache des betrages den man bräuchte um ihm in der region seiner herkunft sichere perspektiven zu eröffnen es reicht aber nicht aus sie dort nur mit lebensmitteln oder einer unterkunft zu versorgen viele menschen bleiben heute länger oft für mehrere jahre in ihrem zufluchtsland sie brauchen auch die möglichkeit dort geld für ihren lebensunterhalt zu verdienen um wie es der ökonom paul collier formuliert hat aus arbeit würde zu beziehen und ihre familien zusammenzuhalten dabei ist auch der zugang zu bildung für ihre kinder ein ganz zentrales thema; auch das haben wir im eu-türkei-abkommen berücksichtigt cash for work die initiative des bmz ist ein gutes beispiel mit der wir in jordanien und im libanon rund jobs in bildung im handwerk und in der infrastruktur für flüchtlinge geschaffen haben liebe kolleginnen und kollegen die deutsche beteiligung an den verhandlungen zum globalen migrationspakt ist sinnvoll und notwendig wir nehmen diese verantwortung an und wer den menschen in deutschland einreden will wir bräuchten uns nur hinter mauern und stacheldraht zu verschanzen und uns dann um die probleme in der welt nicht mehr zu kümmern der handelt schlichtweg verantwortungslos und im zentrum steht für uns auch beim globalen migrations- und fluchtpakt die würde des menschen wer sich gerne als retter des christlichen abendlandes stilisiert der sollte sich vielleicht auch die worte des vatikanvertreters zu herzen nehmen: flüchtlinge sind nicht einfach nur zahlen die verschoben und zugeteilt werden sondern jeder einzelne ist eine individuelle persönlichkeit mit einem namen einer geschichte und mit seinen ganz persönlichen hoffnungen und sehnsüchten vielen dank für ihre aufmerksamkeit das wort hat der kollege christoph matschie für die spd-fraktion
