,datum,redeID,vorname,nachname,fraktion,name,inhalt_neu
0,,,,,, ,
1,17.06.2020,ID1916500100,Helge,Braun,CDU/CSU,Helge Braun,"herr präsident! sehr geehrte damen und herren! die arbeit der bundesregierung in diesen tagen hat eine klare priorität: es ist die bewältigung der coronapandemie in all ihren ausprägungen. während noch vor wochen im wesentlichen eine eindämmung des ausbruchsgeschehens im mittelpunkt stand, steht momentan die bewältigung der wirtschaftlichen folgen im mittelpunkt unserer arbeit. deshalb hat die koalition vor wenigen tagen ein konjunktur- und zukunftspaket beschlossen. es wurde wiederum von der bundesregierung in der heutigen kabinettssitzung beschlossen. zuvor gab es am vergangenen montag einen umlaufbeschluss. außerdem fand am vergangenen freitag eine sondersitzung der bundesregierung statt. dieses konjunktur- und zukunftspaket wird nun in den beratungsgang des bundestages und des bundesrates eingebracht. zu den wesentlichen elementen dieses pakets gehört zum einen die belebung der konjunktur in dieser schwierigen situation. das flaggschiff in diesem bereich ist aus meiner sicht die absenkung der mehrwertsteuer ab dem . juli für ein halbes jahr, um die binnennachfrage zu stärken. ein zweiter sehr großer punkt zielt auf die stärkung unserer kommunen ab. wir werden bis zu prozent der kosten der unterkunft übernehmen, was die kommunen jährlich dafür wollen wir auch auf dauer sorgen in einer größenordnung von bis zu milliarden euro entlastet. weil gerade im bereich öffentlicher personennahverkehr die einnahmen fehlen, werden wir außerdem einmalig die regionalisierungsmittel um , milliarden euro anheben. darüber hinaus liegt uns die situation von familien sehr am herzen; deshalb führen wir den kinderbonus von euro ein. wir sorgen auch dafür, dass alleinerziehende über die entsprechende freibetragsanhebung in der pandemie mehr finanzielle möglichkeiten haben. die deutsche wirtschaft stärken wir insbesondere mit dem am freitag im kabinett beschlossenen gesetz mit sehr vielen steuerlichen maßnahmen, die auch zusätzliche liquidität für die unternehmen bringen. ein weiterer großer punkt ist das vom bundeswirtschaftsministerium auf den weg gebrachte paket zur überbrückung von umsatzeinbrüchen bei den unternehmen. neben diesen gesetzgeberischen maßnahmen haben wir zur vermeidung einer zweiten welle viele maßnahmen ergriffen, die wir heute auch in der ministerpräsidentenkonferenz mit den ministerpräsidenten besprechen werden, zum beispiel die stärkung des öffentlichen gesundheitsdienstes, damit uns die kontaktnachverfolgung vollständig gelingt. seit gestern morgen ist unsere corona-warn-app neben der normalen, klassischen, personenbezogenen kontaktnachverfolgung durch die gesundheitsämter ein wichtiges instrument. damit ist insbesondere da, wo wir mit menschen zusammenkommen, die wir nicht kennen, eine kontaktnachverfolgung möglich. viele haben ja lange auf diese app gewartet. in der tat, wir sind nicht die ersten weltweit, die eine solche app vorstellen. aber ich glaube, die deutsche ist schon etwas besonderes: erstens. sie arbeitet nämlich zum einen dezentral und völlig pseudonymisiert. das heißt, es gibt keine ausleitung von persönlichen informationen an den staat. zweitens. sie ist völlig freiwillig. drittens. was ich am anfang noch gar nicht im funktionsumfang dieser app gesehen habe: wir binden die labore in deutschland an, was ermöglicht, dass man sehr schnell sein testergebnis erfährt. momentan kann das ja noch etwas dauern, ungefähr bis stunden. das ist eine ganz kritische zeit; denn in dieser phase können die infrage kommenden kontakte noch nicht gewarnt werden, wenn man infiziert ist. über die anbindung der labore erfährt man schneller sein testergebnis und kann wiederum die leute, die man angesteckt haben könnte, schneller warnen. das macht die app schon zu etwas exzeptionellem, auch im vergleich zu anderen, vergleichbaren produkten. deshalb freue ich mich, dass wir heute vermelden können, dass innerhalb der ersten stunden bereits über millionen deutsche dieser app ihr vertrauen geschenkt und sie sich runtergeladen haben. vielen dank, herr bundesminister. wir beginnen jetzt mit der regierungsbefragung zu den einleitenden ausführungen des herrn ministers zum geschäftsbereich des kanzleramtes, zu den vorangegangenen kabinettssitzungen sowie zu allgemeinen fragen. das wort hat zunächst für die afd-fraktion die kollegin beatrix von storch."
2,17.06.2020,ID1916500200,Beatrix,von Storch,AfD,Beatrix von Storch,"vielen dank, herr präsident. herr minister, wir müssen über das thema lockdown reden. der lockdown zieht ökonomische und soziale folgen in massivem umfang nach sich. sie haben gesagt: die wirtschaftlichen folgen sind zentral. das ist so. wir haben grundrechte außer kraft gesetzt und beendet. wir haben die wirtschaftliche betätigung eingestellt. in der folge rollt eine welle von unternehmensinsolvenzen in nie gekanntem ausmaß auf uns zu, um das etwas bildhafter zu umschreiben; bei ihnen war das der satz mit den wirtschaftlichen folgen. den unternehmensinsolvenzen folgen die unternehmerinsolvenzen. hunderttausende von privaten existenzen sind zerstört. zum teil ist das familienvermögen, das über generationen in kleinen betrieben aufgebaut worden ist, für immer weg. kurzarbeiterzahlen und die arbeitslosenzahlen explodieren. die staatsverschuldung nimmt ein ausmaß an, das keiner mehr nachvollziehen kann. meine frage ist: hat die bundesregierung die maßnahmen, die sie ergriffen hat, inzwischen analysiert und bewertet? und da sie schon von der vermeidung einer zweiten welle sprechen: welche maßnahmen, die sie jetzt getroffen haben, würden sie bei einer zweiten welle nicht mehr ergreifen, weil sie festgestellt haben, sie sind unverhältnismäßig, grundgesetzwidrig oder wirkungslos? herr minister."
3,17.06.2020,ID1916500300,Helge,Braun,CDU/CSU,Helge Braun,"frau kollegin, um zunächst eines deutlich zu machen: die drastischen folgen, die sie geschildert haben, sind die folgen einer pandemie und nicht die folgen des handelns der bundesregierung. ein zweites: es wäre eine fehleinschätzung, zu glauben, dass die menschen in deutschland einkaufen und große investitionen tätigen würden, wenn uns die pandemie aus dem ruder läuft. wir haben viele maßnahmen ergriffen, um die gesundheit der menschen zu schützen. dazu waren kontaktbeschränkungen und einschränkungen unserer freiheitsrechte notwendig. das ist richtig. aber hätten wir das nicht gemacht das sehen wir in ländern, die wesentlich anders vorgegangen sind als wir , hätte das trotzdem dazu geführt, dass die wirtschaft in vergleichbarer weise geschädigt worden wäre. wer glaubt, dass konsumfreude entsteht, dass die leute gerne in restaurants gehen oder in den urlaub fahren, wenn sie die sorge haben, dass sie krank werden und dann medizinisch nicht richtig versorgt werden, liegt falsch. es funktioniert nicht, hier einen gegensatz aufzumachen. gesundheitsschutz und die chance auf erholung der wirtschaft sind zwei seiten derselben medaille. die maßnahmen, die wir ergriffen haben, waren richtig. jetzt planen wir nicht die maßnahmen für eine zweite welle, sondern wir planen maßnahmen, um eine zweite welle zu verhindern. dazu gehört es, den öffentlichen gesundheitsdienst zu stärken, dazu gehört unsere corona-warn-app, und dazu gehören die lokalen beschränkungen. mit dieser strategie sind wir momentan außerordentlich erfolgreich. nachfrage?"
4,17.06.2020,ID1916500400,Beatrix,von Storch,AfD,Beatrix von Storch,"ja, sehr gerne. die bundesregierung hat also keinen fehler gemacht, auch aus der jetzigen perspektive? sie können sagen, sie haben in der vergangenheit keinen fehler gemacht? das zweite ist: können sie ausschließen, dass, wenn die vermeidung der zweiten welle nicht klappt, ein zweiter lockdown kommt? können sie ausschließen, dass wir noch mal einen lockdown bekommen?"
5,17.06.2020,ID1916500500,Helge,Braun,CDU/CSU,Helge Braun,"wenn sie mich besser kennen würden, würden sie sicher wissen, dass ich niemals sagen würde, dass ich ohne fehler bin oder dass die bundesregierung ohne fehler ist. fehler passieren immer, zumal in einer phase, in der wir es mit einem virus zu tun haben, das völlig neu auf diesem planeten ist, das keiner kennt. zum ergebnis unseres bisherigen handelns insgesamt muss man sehr deutlich sagen: es gab im internationalen vergleich länder, die deutlich restriktiver gehandelt haben. sie haben eben gesagt, wir haben das wirtschaften eingestellt. das haben wir nicht. wir haben überall dort beschränkungen auferlegt, wo es zu publikumsverkehr kommt, aber ansonsten haben wir die ganze deutsche wirtschaft dem grunde nach weiterlaufen lassen. sie hatte ja auch probleme, weil lieferketten nicht funktioniert haben, weil zum beispiel in spanien oder in anderen ländern die wirtschaftlichen beschränkungen viel weiter gingen. auf der anderen seite gibt es länder wie zum beispiel schweden und großbritannien, die sich später und weniger entschieden als wir auf beschränkungen eingelassen haben und heute mit wesentlich höheren todeszahlen zu kämpfen haben. ich bin ziemlich überzeugt, dass die gesamtstrategie, so wie wir sie als bundesregierung mit der breiten unterstützung des bundestages gefahren haben, im hinblick auf die gesundheitlichen, aber auch auf die wirtschaftlichen und sozialen folgen ein sehr ausgewogener weg war, um den uns übrigens viele menschen auf der welt beneiden. gibt es unmittelbar zu diesem thema noch nachfragen? das ist nicht der fall. dann kommen wir zum nächsten gemeldeten fragesteller. das ist der kollege carsten schneider, spd-fraktion."
6,17.06.2020,ID1916500600,Carsten,Schneider,SPD,Carsten Schneider,"herr minister, sie haben zu beginn ihrer ausführungen auf das konjunkturpaket hingewiesen. einige maßnahmen, zumindest was die mehrwertsteuersenkung angeht, haben die koalitionsfraktionen zeitlich befristet. der kinderbonus in höhe von euro wird einmalig ausgezahlt. das wurde gestern per paralleleinbringung beschlossen. in unserem beschluss ist keine kompensation der länderausgaben enthalten, sondern die länder tragen einen teil der lasten im zuge der steuerverteilung. da wir am freitag das gesetz beraten und in anderthalb wochen am . juni in einer sondersitzung beschließen werden, ist meine frage, ob die bundesregierung plant, über den verteilungsschlüssel, den wir per steuergesetz, stichwort einkommensteuerverteilung , festgelegt haben, hinaus den ländern entgegenzukommen und einen größeren anteil und, wenn ja, welchen anteil zu finanzieren. dieser punkt scheint mir noch offen zu sein. herr minister."
7,17.06.2020,ID1916500700,Helge,Braun,CDU/CSU,Helge Braun,"herr kollege, das ist insofern richtig, als heute nachmittag eine ministerpräsidentenkonferenz mit der bundeskanzlerin stattfindet. bisher ist das konjunkturpaket sozusagen ein beschluss der koalition; umgesetzt wird er von der bundesregierung. natürlich brauchen wir an ganz vielen stellen auch die unterstützung der länder für dieses paket. wir haben sehr frühzeitig deutlich gemacht auch der bundesfinanzminister hat es sehr frühzeitig deutlich gemacht , dass wir als bund bereit sind, die ausfälle, die im nächsten halben jahr durch die mehrwertsteuersenkung anfallen, komplett zu tragen. darüber hinaus haben wir deutlich gemacht das ist jedenfalls der aktuelle beratungsgegenstand , dass wir bereit sind, den kinderbonus vollständig zu übernehmen, da er über das kindergeld ausgezahlt wird; sonst ist grundsätzlich eine hälftige finanzierung durch die länder erforderlich. ansonsten gehen wir davon aus, dass dort, wo wir jetzt programme auflegen und es zu liquiditäts- und verschiebeeffekten im bereich der steuern kommt, die länder den entsprechenden finanzierungsanteil selber tragen. darüber wird sicherlich heute in der ministerpräsidentenkonferenz zwischen der bundesregierung und den ländern noch erheblicher diskussionsbedarf bestehen. noch eine frage? bitte schön."
8,17.06.2020,ID1916500800,Carsten,Schneider,SPD,Carsten Schneider,"eine kleine zusatzbemerkung, gekleidet in eine frage: geben sie doch bitte in der besprechung, die sie nachher noch haben werden von diesem verfassungsorgan zum nächsten, repräsentiert durch die ministerpräsidenten , weiter, dass die länder und gemeinden den übergroßen anteil am steueraufkommen haben und sie dementsprechend an der finanzierung der kosten des konjunkturprogramms beteiligt sein sollen. ansonsten ist der bund nämlich überfordert. vielen dank."
9,17.06.2020,ID1916500900,Helge,Braun,CDU/CSU,Helge Braun,das werde ich gerne wortwörtlich so weitergeben. dazu noch speziell eine nachfrage? dann erteile ich das wort dem nächsten fragesteller: stephan thomae für die fdp-fraktion.
10,17.06.2020,ID1916501000,Stephan,Thomae,FDP,Stephan Thomae,"vielen dank, herr präsident. herr bundesminister, ich habe eine frage zu einem anderen thema ihres geschäftsbereiches. am . mai hat das bundesverfassungsgericht eine entscheidung zur kontrolle des bundesnachrichtendienstes bei der überwachung des fernmeldeverkehrs von ausländern im ausland verkündet. es hat unter anderem eine neue parlamentarische kontrolle des bnd modelliert und auch die grundrechtsbindung des bnd schärfer gefasst. daraufhin wurde kritik laut, dass diese entscheidung die arbeitsfähigkeit des bnd zu beeinträchtigen in der lage sei, vor allem die zusammenarbeitsfähigkeit mit ausländischen nachrichtendiensten. deswegen ist meine frage an sie, ob die regierung die auffassung teilt, dass eine stärkere, eine bessere parlamentarische kontrolle die arbeitsfähigkeit des bnd beeinträchtigen wird oder ob nicht vielmehr eine bessere parlamentarische kontrolle nützlich sein kann, um den dienst besser zu machen."
11,17.06.2020,ID1916501100,Helge,Braun,CDU/CSU,Helge Braun,"das zweite würde ich unterstützen. ich habe das urteil des bundesverfassungsgerichts sehr begrüßt. wir haben ja nach den letzten ereignissen im kontext nsa eine sehr umfassende neuregelung des bnd-gesetzes vorgenommen. wir hatten uns dafür entschieden, dass der bnd in zukunft auf einer sehr, sehr klaren rechtsgrundlage arbeiten soll. diese verfassungsklage war insofern wichtig, weil damit die frage gestellt wurde, ob das bnd-gesetz auch aus sicht des bundesverfassungsgerichts in ordnung ist. ich finde das urteil sehr ausgewogen. es hat zum einen die wichtige staatliche aufgabe des bnd, uns als bundesregierung, aber auch sie als parlament mit wichtigen und verlässlichen informationen über die komplexe lage im ausland aufzuklären, sehr betont. in diesem zusammenhang hat es auch betont, dass die arbeitsfähigkeit einer ausland-ausland-aufklärung wichtig ist und erhalten werden muss. insofern ist dieses urteil eine sehr gute grundlage. das zweite, was betont wurde, ist, dass die parlamentarische kontrolle aber auch durch einen richterlichen spruchkörper eine quasi richterliche kontrolle noch verstärkt werden muss. deshalb setzen wir dieses urteil sehr gerne um. denn ich gehe davon aus, dass dadurch die akzeptanz der arbeit des bnd und auch die rechtssicherheit hinsichtlich der arbeit im bnd gestärkt werden. ich gehe davon aus, dass das neue bnd-gesetz, das wir am ende hier gemeinsam beschließen werden, für die arbeit dieses nachrichtendienstes eine wichtige stärkung bedeutet und keine schwächung. nachfrage, herr kollege?"
12,17.06.2020,ID1916501200,Stephan,Thomae,FDP,Stephan Thomae,"ja, gerne. ich will es ausdrücklich würdigen, dass sie die nützlichkeit der kontrolle des bnd an dieser stelle unterstreichen. vielleicht erlauben sie eine nachfrage: wird der gesetzentwurf der regierung zur neufassung des kontrollmechanismus eine stärkung der kontrollmöglichkeiten und ‑befugnisse des parlaments vorsehen, oder wollen sie diese möglichkeiten des parlaments möglichst knapphalten?"
13,17.06.2020,ID1916501300,Helge,Braun,CDU/CSU,Helge Braun,"wir sind noch in einem sehr frühen stadium. ich habe im kanzleramt jetzt erst mal aufträge erteilt. wir werden unseren entwurf eng mit dem innen- und dem justizministerium abstimmen müssen. mein ziel ist, dem parlament möglichst früh im herbst einen entwurf vorzulegen, damit wir das verfahren im winter, spätestens im frühjahr abschließen können. ich glaube, dass das ein guter zeitrahmen ist, um sicherzustellen, dass dieses gesetz nicht gegenstand irgendwelcher debatten wird, die weniger mit dem bnd als mit dem bundestagswahlkampf zu tun haben. insofern arbeiten wir eilig; aber es ist jetzt noch zu früh, um erste aussagen zur ausgestaltung des entwurfs zu machen. vielen dank. unmittelbar dazu eine nachfrage des kollegen benjamin strasser, ebenfalls fdp-fraktion."
14,17.06.2020,ID1916501400,Benjamin,Strasser,FDP,Benjamin Strasser,"herr staatsminister braun, in dem verfassungsgerichtsurteil wird darauf hingewiesen, dass eine klassische präventive kontrolle der nachrichtendienste, wie es sie in anderen ländern dieser welt gibt, in deutschland so nicht möglich ist. das hat konsequenzen für das parlament bei der nachrichtendienstkontrolle. wir haben das staatsversagen im zusammenhang mit dem nsu erlebt, wir haben einen anschlag auf dem breitscheidplatz erlebt und feststellen müssen, dass das parlamentarische kontrollgremium offensichtlich nicht immer rechtzeitig von nachrichtendiensten über die zustände in diesen diensten informiert worden ist. weil wir als bundestagsfraktion ihnen einen gesetzentwurf zur einführung eines parlamentarischen nachrichtendienstbeauftragten vorgelegt haben, ist meine frage an sie, wie sie in dieser bnd-reformnovelle die präventive parlamentarische kontrolle stärken wollen oder ob das für diese bundesregierung kein thema ist, weil aus ihrer sicht alles so stimmt, wie es momentan läuft."
15,17.06.2020,ID1916501500,Helge,Braun,CDU/CSU,Helge Braun,"das bundesverfassungsgerichtsurteil macht ja deutlich, dass nicht alles so stimmt, wie es jetzt läuft. deshalb ändern wir das ja jetzt. ich habe gerade gesagt, dass es noch ein bisschen früh ist, um über einzelheiten zu sprechen; aber wir müssen auch aufpassen: das urteil bezieht sich auf die ausland-ausland-fernmeldeaufklärung, und viele der von ihnen genannten schrecklichen ereignisse im inland fallen nicht in den engeren bereich der zuständigkeit des bnd und betreffen auch nicht den engeren bereich dessen, worum es in dem urteil geht. das muss man ein bisschen auseinanderhalten. aber die parlamentarische kontrolle ist natürlich wichtig. darüber hinaus steht es dem parlament natürlich immer frei, diese frage für sich zu definieren. wir werden selbstverständlich versuchen, für das, was das bundesverfassungsgericht vorgibt, also für das zusammenspiel von politischer kontrolle und richterlicher kontrolle, einen vorschlag zu unterbreiten, den sie alle gut finden und der die waagschale, die das bundesverfassungsgericht einfordert, auch wirklich widerspiegelt. eine nachfrage, herr kollege?"
16,17.06.2020,ID1916501600,Benjamin,Strasser,FDP,Benjamin Strasser,"verstehe ich sie richtig: der gesetzentwurf wird von der bundesregierung vorgelegt werden, nicht von den parlamentsfraktionen? also auch für den bereich der parlamentarischen kontrolle legt die bundesregierung einen gesetzentwurf vor, einen gesamtgesetzentwurf, der auch uns glücklich macht? so habe ich sie gerade verstanden."
17,17.06.2020,ID1916501700,Helge,Braun,CDU/CSU,Helge Braun,"wir werden einen entwurf zur änderung des bnd-gesetzes vorlegen, der allen anforderungen dieses gerichtsurteils rechnung trägt. gibt es unmittelbar dazu noch wortmeldungen? das ist nicht der fall. dann kommen wir zum nächsten fragesteller: das ist der kollege rudolf henke, cdu/csu-fraktion."
18,17.06.2020,ID1916501800,Rudolf,Henke,CDU/CSU,Rudolf Henke,"herr minister, der koalitionsausschuss hat in aussicht gestellt, auch bei dem thema ausbildungsplätze aktiv zu werden und anzuerkennen, wenn betriebe die zahl ihrer ausbildungsplätze nicht reduzieren oder gar erhöhen. ausbildungsverträge kann man ja zu jedem zeitpunkt im jahr abschließen, wenn man das möchte. wenn die ausbildung nicht im august oder september beginnt, lässt sie sich aber nicht so gut mit den berufskollegs synchronisieren. deswegen starten die meisten ausbildungsverhältnisse im august oder im september. meine frage ist: wie sieht der zeitplan für die umsetzung dieser förderabsicht aus? wann können die organisationen der wirtschaft auf ihre mitglieder zugehen und gewissermaßen für eine verstärkte anstrengung in diesem ausbildungsjahr werben?"
19,17.06.2020,ID1916501900,Helge,Braun,CDU/CSU,Helge Braun,"da haben sie völlig recht. wir arbeiten mit hochdruck daran, weil wir natürlich auch die sorge haben, dass manch einer mit dem abschluss eines ausbildungsvertrages wartet. es finden noch letzte gespräche zwischen der bildungsministerin und dem minister für arbeit und soziales statt. aber ich bin ziemlich sicher, dass wir im kabinett in der nächsten, spätestens in der übernächsten woche das programm auf den weg bringen werden. es soll die schaffung von ausbildungsplätzen honorieren. das zweite thema, das uns sehr beschäftigt, ist, dass durch die viele kurzarbeit, die wir momentan in deutschland haben, teilweise auch die ausbildung der vorhandenen azubis nicht mehr so stattfindet, wie es sein sollte. auch das soll adressiert werden. nachfrage?"
20,17.06.2020,ID1916502000,Rudolf,Henke,CDU/CSU,Rudolf Henke,"die kommende sitzungswoche wird die letzte sitzungswoche des bundestages vor der sommerpause sein. kann ich ihrer antwort entnehmen, dass sie das so einschätzen, dass es zur wirksamkeit dieses programms keiner gesetzesänderungen bedarf?"
21,17.06.2020,ID1916502100,Helge,Braun,CDU/CSU,Helge Braun,"ja, wir gehen momentan davon aus, dass das programm untergesetzlich erfolgt, vorbehaltlich neuer erkenntnisse, die uns in den nächsten wochen noch erreichen. was wir vom deutschen bundestag brauchen, ist die zustimmung zum nachtragshaushalt in der nächsten sitzungswoche. in diesem sind die benötigten mittel veranschlagt. den nachtragshaushalt haben wir heute im kabinett auf den weg gebracht; er muss nach der sitzung des bundesrates am . juli in kraft treten. das ist eine wesentliche voraussetzung das gilt für alle unsere programme im rahmen des konjunkturpaketes , damit wir die programme schnell finanzwirksam ausrollen können. vielen dank, herr bundesminister. dazu eine unmittelbare nachfrage der kollegin yasmin fahimi, spd-fraktion."
22,17.06.2020,ID1916502200,Yasmin,Fahimi,SPD,Yasmin Fahimi,"teilen sie die auffassung, dass mit blick auf die coronapandemie die ausbildungsbetriebe nicht nur dadurch betroffen sind, dass sie in kurzarbeit geraten sind? das ist ja ein offensichtliches problem. deswegen hat es auch eine beschlusslage gegeben, dass es eine übernahmeprämie geben soll. das heißt, unternehmen, die auszubildende aus von insolvenz betroffenen oder von insolvenz bedrohten betrieben übernehmen, sollen eine prämie erhalten. muss es nicht insgesamt darum gehen, unabhängig von der betriebsgröße regionale ausbildungsmärkte zu stabilisieren? das heißt, dass wir nicht nur die unmittelbar von corona betroffenen betriebe in den blick nehmen müssen, sondern auch die ausbildungsaktivitäten unterstützen und honorieren müssen, die in solchen formen durch auftrags- und verbundausbildung, durch übernahme etc. erfolgen. das heißt, dass die prämie auch für ausbildungsplätze gezahlt werden muss, die zusätzlich geschaffen werden, auch wenn der betrieb nicht von corona betroffen ist."
23,17.06.2020,ID1916502300,Helge,Braun,CDU/CSU,Helge Braun,"grundsätzlich haben wir eine menge instrumente, um ausbildung zu stärken. im rahmen des konjunkturpakets wird genau auf die wirtschaftlichen folgen der coronapandemie geschaut. das heißt, soweit wirtschaftliche betroffenheit besteht, wird das auch sehr umfangreich wirken. wir haben die säulen, die sie gerade genannt haben, auch die, die ich eben schon beschrieben habe. das bundesinstitut für berufsbildung wird uns anfang juli nochmals einen bericht über die lage am ausbildungsmarkt geben. dann werden wir uns dazu haben wir uns ebenfalls verabredet im lichte dieses berichtes sehr genau angucken, ob zwischen den instrumenten, die wir jetzt quasi im vorgriff aufgrund derjenigen probleme geschaffen haben, von denen wir bisher wissen, dass es sie am arbeitsmarkt für azubis gibt, noch weitere lücken klaffen. das oberziel über dem ganzen lautet: wir wollen auf gar keinen fall, dass es durch corona im bereich der beruflichen bildung in irgendeiner weise zu einem verlorenen jahrgang kommt. wir wollen, dass die jungen menschen einen ausbildungsplatz haben. wir wollen, dass diejenigen, die einen haben, ihn behalten, und wir wollen, dass auch die ausbildung im betrieb weiter gut funktioniert. nachfrage? nicht. gut. dann kommen wir zum nächsten fragesteller. das ist der kollege andré hahn, fraktion die linke."
