,datum,redeID,vorname,nachname,fraktion,name,inhalt_neu
49,03.07.2018,ID194404900,Klaus-Peter,Schulze,CDU/CSU,Klaus-Peter Schulze,"herr präsident! liebe kolleginnen und kollegen! meine sehr verehrten damen und herren auf der besuchertribüne! ich glaube nicht, herr hohmann, dass das bundesumweltministerium, das in seiner fachlichen zuständigkeit ein papier zum insektenschutz auf den weg gebracht hat, die alleinige verantwortung für die situation, die wir jetzt festzustellen haben, trägt. ich glaube, der insektenschutz ist ein problem, das wesentlich breiter angegangen werden muss. hier spielt die landwirtschaft eine rolle, aber nicht nur die landwirtschaft. ich will ihnen mal zwei kleine geschichten aus meinem wahlkreis erzählen. ich hatte kürzlich beim besuch der offenen gärten ein gespräch mit einem bürger, der vor seinem grundstück einen schönen grünstreifen hat stehen lassen. er erzählte mir, er sei unter androhung der ersatzvornahme von seiner stadt aufgefordert worden, die fläche zu mähen. die stadt habe ihm gedroht, es wegzumähen und ihn dafür aufkommen zu lassen, wenn er nicht innerhalb von drei wochen tätig werde. der erste punkt ist, dass man die kommunalen reinigungssatzungen auch unter diesem gesichtspunkt mal betrachten muss. die zweite geschichte: im vergangenen jahr, im sommer , hat mich die presse besucht und bei mir zu hause ein interview darüber geführt, wie ich es mir denn so vorstelle. da wurde auch ein bild von meinem garten gemacht. einen tag später bekam ich einen anruf und wurde gefragt, ob mein rasenmäher kaputt sei oder ich keine zeit hätte, den rasen zu mähen. das zeigt doch, dass wir selbst umdenken müssen. an bestimmten stellen kann jeder seinen eigenen beitrag leisten. damit werden wir das gesamtproblem nicht lösen, aber es auf jeden fall abmindern. meine damen und herren, es ist uns gelungen, den haushalt im bereich naturschutz um millionen euro zu erhöhen. die zusätzlichen mittel in höhe von millionen euro gehen in die förderung der biologischen vielfalt. wir mein kollege träger von der spd und ich hätten gerne mehr gewollt. allerdings sagen hier die haushälter: es muss erst mal das geld ausgegeben werden, das tatsächlich da ist. kollege gädechens hat ja darauf hingewiesen, dass das ein schwachpunkt ist; der mittelabfluss funktioniert noch nicht so, wie wir uns das vorstellen. aber wenn das in den nächsten wochen und monaten besser wird, werden wir uns sicherlich für den haushalt noch das eine oder andere gemeinsam mit dem koalitionspartner vornehmen können. wenn sie sagen, herr kindler, es würde kein zusätzliches geld in den klimaschutz gesteckt, dann ist das nicht richtig. wir haben hier einen mittelaufwuchs um millionen euro auf millionen euro; das entspricht bereits prozent. wenn jede haushaltsstelle in diesem bundeshaushalt um prozent stiege, zum beispiel der verteidigungshaushalt, dann wäre das doch eine richtige nummer; aber das geht eben nicht. hier haben wir prozent mehr, und das ist aus meiner sicht schon ganz gut. ich halte die erhöhung in diesem bereich auch für sehr wichtig. ich möchte das mal an dem beispiel eines iki-projektes, das in südamerika über mehrere länder hinweg durchgeführt wird, ganz kurz erläutern. hier werden im rahmen des projekts sulu in paraguay und kolumbien kartierungen zur landnutzungsänderung vorgenommen. das ist aus meiner sicht deshalb sehr wichtig, weil zunehmend große agrarbetriebe auch in die steppengebiete, die trockensavannen, vordringen und versuchen, große teile in agrarland umzuwandeln. mit dem geld, das wir hier einsetzen der wwf treibt vor ort die planung voran , werden planungsgrundlagen dafür geschaffen, wie man in der zukunft bei der landumnutzung vorgehen sollte. wichtig ist aus meiner sicht, dass die regierungen, die jetzt von uns das geld entgegennehmen und die planung unterstützen, dann auch die umsetzung vor ort hinbekommen nicht, dass wir planungsmittel ausgeben, aber die realität zum schluss eine ganz andere ist. ich möchte auf unsere unterstützung von internationalen projekten zu sprechen kommen. dort geben wir nicht nur geld aus, sondern wir sorgen auch für wissenstransfer, um beispielsweise biosphärenreservate zu entwickeln. die entwicklung eines biosphärenreservats ist deshalb sehr wichtig, weil damit den menschen wege aufgezeigt werden, wie sie erstens in ihrer heimat bleiben und zweitens dort eine vernünftige wertschöpfung auf den weg bringen können. aus meinem wahlkreis ist ein vertreter des biosphärenreservats spreewald aktiv daran beteiligt, ein entsprechendes projekt an einem see in burma auf den weg zu bringen. ich wünsche mir für den nächsten haushaltsansatz, , dass wir in diesem bereich eine kleine erhöhung der mittel vornehmen, damit die erfahrungen, die wir in deutschen bioreservaten gesammelt haben, auch an anderen stellen dieser erde angewendet werden können und durch den wissenstransfer leistungen, die ohnehin mit öffentlichen mittel in deutschland finanziert wurden, weitergegeben werden können. zum schluss zum thema personal; kollege gädechens ist darauf eingegangen, die kollegin ihnen hat es kritisiert. ich bin sehr froh, dass es gelungen ist, den personalaufwuchs im umweltbundesamt hinzubekommen, damit die genehmigungsverfahren für pflanzenschutzmittel schneller vorangehen und die vorgegebenen zeiten, die uns die europäische union ins hausaufgabenheft geschrieben hat, tatsächlich erreicht werden. wir haben darüber gemeinsam mit dem kollegen färber in der letzten legislatur intensiv diskutiert und können jetzt sagen: unsere aufgabe haben wir erfüllt. es ist mehr personal vorhanden. wir als cdu/csu-fraktion werden in den nächsten wochen, monaten und jahren prüfen, ob mit mehr personal unser ziel, die genehmigungsverfahren schneller durchzuführen, tatsächlich erreicht wird. herzlichen dank für ihre aufmerksamkeit. herr kollege schulze, ich nehme die gelegenheit wahr, ihnen zu ihrem heutigen geburtstag zu gratulieren. es ist ein vorbildlicher einsatz, hier am geburtstag eine rede zu halten. der nächste redner ist der kollege michael thews von der spd-fraktion."
50,03.07.2018,ID194405000,Michael,Thews,SPD,Michael Thews,"sehr geehrter herr präsident! sehr geehrte damen und herren! sehr geehrte kolleginnen und kollegen! die gute nachricht ist: prozent mehr im umwelthaushalt. das heißt eben auch: prozent mehr für wichtige investitionen in den internationalen klimaschutz, in die förderung des naturschutzes, aber auch in die zwischen- und endlagerung radioaktiver abfälle. ich möchte mit einem lob an die ministerin beginnen. frau schulze, ich glaube, sie sind sehr gut in die arbeit hineingekommen. wenn man sich die bilanz der ersten zeit anschaut, stellt man fest, dass sie mit dem aktionsprogramm insektenschutz, aber auch mit ihrer klaren haltung bei der nachrüstung von dieselfahrzeugen wichtige akzente gesetzt haben. sie haben sich aber auch für das europaweite verbot von mikroplastik eingesetzt. damit sind wir beim thema plastik. der kollege kindler hat sie gerade kritisiert, dass sie die einführung einer plastiksteuer abgelehnt haben. jetzt muss man vielleicht klarstellen, was sie wirklich gesagt haben. es ging um eine plastiksteuer, die keine lenkungswirkung entfaltet hätte. generell wurde nicht abgelehnt, dass gegebenenfalls abgaben oder steuern erhoben werden, die dann eine lenkungswirkung entfalten würden. deutschland geht da einen ganz anderen weg. ja, wir erklären ihnen das gleich. wir haben in der letzten legislaturperiode gemeinsam mit unserem koalitionspartner das verpackungsgesetz beschlossen. das ist ein wichtiger punkt. es hat viele jahre gedauert, dieses gesetz auf den weg zu bringen. in dem verpackungsgesetz haben wir zum einen den anstieg der recyclingquoten beschlossen das ist schon mal ein ganz wichtiger punkt und zum zweiten eine ökologisierung der lizenzabgabe. das heißt, in deutschland gibt es schon eine abgabe derjenigen, die verpackungsabfälle erzeugen oder in umlauf bringen. diese wird in zukunft anders gestaltet werden. wenn man sich anschaut, was das jetzt schon bewirkt hat in verbindung mit der stiftung zentrale stelle verpackungsregister, die wir geschaffen haben, die für mehr kontrolle und für einen einfacheren vollzug sorgen wird; der muss dann allerdings in den ländern auch durchgeführt werden , dann stellt man fest, dass wir damit schon einiges angeregt haben. mittlerweile ist es tatsächlich so, dass sich sehr viele damit beschäftigen, wie zum beispiel das design von produkten, die auf den markt kommen, geändert werden kann. ich habe neulich eine pet-recyclinganlage besucht. wenn man das macht, dann erkennt man, dass es immer noch sehr viele verpackungsabfälle gibt, die vom design her nicht für das recycling geeignet sind. wir haben angeregt, dass hier wesentlich mehr druck auf die industrie ausgeübt wird, im sinne eines hochwertigen recyclings, also im sinne von cradle to cradle, um aus einem produkt wieder das gleiche produkt machen zu können. das gelingt aber nur, wenn wir den einsatz der rezyklate, die dabei erzeugt werden, weiter fördern. hier spielt eventuell die öffentliche beschaffung eine rolle; da kann man erste akzente setzen. wir müssen für mehr akzeptanz sorgen und dieses vorhaben unterstützen. dazu gehört auch die aufklärung der bevölkerung. es muss immer wieder über umweltfreundliche, zum beispiel mehrwegsysteme informiert werden. auch dazu haben wir in der letzten legislaturperiode dinge auf den weg gebracht, die jetzt umgesetzt werden, wie zum beispiel die kennzeichnung von einweg und mehrweg am regal. aber auch die industrie ist im rahmen einer selbstverpflichtung dabei, flaschen entsprechend zu kennzeichnen. auch auf der europäischen ebene ist einiges in gang gekommen. wir haben das kreislaufwirtschaftspaket der eu, das wir umsetzen müssen, und auch im bereich plastik soll, wie wir gehört haben, einiges passieren. wenn verbote, dann sind sie auf europäischer ebene sinnvoll. wir werden das verfolgen und unterstützen. die bilder, die zurzeit in den medien kursieren, zeigen, dass viele länder mit diesem problem einfach überfordert sind. einige flüsse, insbesondere in asien und in afrika, tragen große frachten dieses plastiks in die weltmeere. auch da ist es wichtig, dass wir als land vorbild sind und in diesen ländern unterstützend eingreifen. ich bin zuversichtlich, dass mit diesem haushalt der weg zu einer nachhaltigen umweltpolitik umgesetzt wird. deutschland hat im bereich der regenerativen energien, aber auch im bereich der kreislaufwirtschaft eine vorbildfunktion, die wir weiterhin wahrnehmen wollen und angesichts der globalen herausforderungen auch annehmen müssen. lassen sie uns die arbeit in diesem sinne fortführen. unterstützen sie uns dabei. vielen dank. der letzte redner, bevor wir zur abstimmung kommen, ist der kollege rüdiger kruse für die cdu/csu-fraktion."
51,03.07.2018,ID194405100,Rüdiger,Kruse,CDU/CSU,Rüdiger Kruse,"herr präsident! meine sehr geehrten damen und herren! der kollege kindler von den grünen hat die ministerin als einkaufsberaterin der bundesregierung bezeichnet. das war nicht nett, und das war auch nicht richtig. frau ihnen von der fdp hat sie als nachhaltigkeitsministerin bezeichnet. das war ganz nett, ist aber auch nicht richtig. die umweltministerin ist die umweltministerin. nachhaltigkeit, das wissen wir, ist ein querschnittsthema, eine wesentlich größere aufgabe. sie besteht aus den bekannten säulen: umwelt, soziales, wirtschaft. nach meiner meinung brauchen wir auch noch die kultur, um ein narrativ zu schaffen. das bedeutet aber auch, dass diese zuständigkeit auf regierungsseite bei der kanzlerin liegt und auf unserer seite nicht bei einem fachausschuss, sondern beim gesamten parlament. der kollege köhler von der fdp hat natürlich auch kritisiert geschenkt ; aber er hat auch mehr optimismus eingefordert. er hat gesagt: wir haben sehr, sehr gute ausgangsvoraussetzungen. recht hat der mann. das land steht gut da. die idee der nachhaltigkeit wird ja gar nicht bestritten, sie wird nur noch nicht richtig gelebt. das ist schon mal was. es gibt viele dinge, über die wir uns überhaupt nicht einig sind, bei denen es noch viele diskussionen geben wird. das prinzip der nachhaltigkeit hingegen haben wir alle inhaliert. das ist ja auch ein einfaches prinzip: nicht mehr verbrauchen als nachwächst, die wichtigen belange der menschen als gleichwertig betrachten, nicht einen aspekt nach vorne stellen, nicht sagen: nur die wirtschaft zählt , oder: nur die umwelt zählt , sondern das ganze zusammenführen. und das ist eine klassische aufgabe, die wir zu leisten haben. diese aufgabe ist leistbar. wir haben sdgs. die muss nicht jeder auswendig lernen. das sind aber nicht viel mehr als die zehn gebote. jeder kann sich die für seinen fachbereich richtigen raussuchen. dann besteht die möglichkeit, durchzudeklinieren, ob das, was wir machen wollen, in richtung nachhaltigkeit führt oder ob das kontraproduktiv ist. so schön es ist, dass der haushalt aufwächst, nur mit den prozenten, die wir obendrauf legen können, werden wir das ganze nicht ändern. ein gutes beispiel: wenn man sich gedanken darüber macht, wie man den anteil von häusern und wohnungen an der co -produktion verringern kann, dann wird einem schnell klar, dass es eine halbe ewigkeit dauern würde, dieses ziel nur durch neubau zu erreichen. bis prozent neubau sind für einen systemwechsel zu wenig. wenn man da etwas ändern will, muss man auch an die substanz ran. man kann sich darüber unterhalten, ob die zusätzlichen millionen, die im verkehrsbereich, im umweltbereich und für wirtschaft der entsprechende etat wird ja gleich diskutiert ausgegeben werden, in richtung nachhaltigkeit zielen. das müssen wir auch tun. wir müssen aber auch an die substanz. wir müssen schauen: was haben wir eigentlich jetzt in unserem haushalt? was geschieht mit diesen milliarden, und welchen beitrag leisten sie? wo können wir umsteuern? das ist die aufgabe, der sich dieses parlament stellen sollte. es gibt dazu zum beispiel eine vorleistung, die im auftrag der bundesregierung vom rat für nachhaltige entwicklung entwickelt wurde: den deutschen nachhaltigkeitskodex. das ist auch ganz nett, weil es nicht so ist, dass derjenige, der ihn nicht befolgt, schlecht behandelt wird, sondern es wird nach dem motto comply or declare verfahren: entweder man macht das, was da drinsteht, oder man muss erklären, warum man es nicht macht. der wunsch der regierung ist natürlich das wird jedes jahr bei den haushaltsberatungen im bericht auch gesagt , dass die unternehmen, die im staatsbesitz sind, das auch tun. dazu werden sie eingeladen. einladen können wir natürlich jeden, auch alle anderen unternehmen. es gibt sehr viele normale unternehmen aus der freien wirtschaft, die da mitmachen. aber wir können doch sagen, dass unsere eigenen unternehmen das auch tun müssen. wir sollten also bei nächster gelegenheit beschließen, dass dieser nachhaltigkeitskodex auf die paar hundert unternehmen, die im bundesbesitz sind, anwendung findet. das ist ein schritt nach vorn; denn entweder ist der kodex richtig und gut es ist ja unserer , dann muss man ihn auch umsetzen, oder aber er ist eigentlich falsch, dann muss man ihn abschaffen. das wäre eine solche konkrete handlungsweise, der wir uns verpflichten könnten. wir haben mit dem thema nachhaltigkeit auch die zukunftsgerechtigkeit, die generationengerechtigkeit abgebildet. da gibt es bei einer haushaltsdebatte natürlich aspekte, bei denen wir sagen können: jawohl, wir haben jetzt die berühmte schwarze null, wir haben sogar ein stück mehr. wir fangen an, unsere strukturen wieder zu erneuern, unsere infrastruktur auf vordermann zu bringen. gleichzeitig müssen wir aber auch eine erzählung haben und sagen können, was wir für die zukunft bieten wollen. natürlich ist die befolgung der nachhaltigkeitsziele, auf die man sich international geeinigt hat, genau das, was vorbildlich wäre. es ist ja nichts schlechtes daran, wenn eine nation, ohne belehrend zu sein, vorbildlich ist. das ist dann auch der sinn. natürlich ist unser anteil an der weltbevölkerung, unser anteil am co -ausstoß nicht so bedeutend groß. aber unser verhalten wirkt sich auf andere aus; wir haben eine vorbildfunktion, und wir können dieser vorbildfunktion nachgehen. deswegen ist es nicht fair, darauf zu verweisen, dass in entwicklungsländern der co -ausstoß ja noch ansteige. vielmehr geht es um die fragestellung: was machen wir, die wir uns auch anders verhalten können? mit welchem verhalten gehen wir beispielgebend voran? da bin ich sehr froh, dass es innerhalb der großen koalition in all diesen jahren nie thema war, ob wir in diese richtung gehen wollen. nachdenken müssen wir über die geschwindigkeit. wenn ich diese debatte revue passieren lasse, dann war es doch so, dass die meisten redner in diese richtung argumentiert und gesagt haben: wir finden, das ist der richtige weg. wir wollen mehr tun. wir müssen mehr tun. wenn wir das, wie der kollege köhler gesagt hat, mit dem nötigen optimismus tun, dann senden wir auch in dieses land ein gutes signal und geben eine vorgabe, was deutschland als nation darstellen und als guten beitrag für diese welt leisten kann. danke schön. vielen dank, herr kollege kruse. ich schließe die aussprache zu diesem einzelplan. wir kommen zur abstimmung über den einzelplan bundesministerium für umwelt, naturschutz und nukleare sicherheit in der ausschussfassung. wer stimmt für diesen einzelplan? wer stimmt dagegen? dann ist der einzelplan angenommen mit den stimmen der koalition gegen die stimmen der opposition."
52,03.07.2018,ID194405200,Steffen,Kotré,AfD,Steffen Kotré,"sehr geehrter herr präsident! sehr geehrte damen und herren! die bundesregierung hatte ursprünglich das ziel, bis million elektroautos auf die straße zu bringen; mein kollege herr holm hat das heute morgen schon gesagt. aber es lohnt, trotzdem noch einmal darauf hinzuweisen: dieses ziel wird krachend verfehlt. das ist auch kein wunder; denn die e‑mobilität für pkws ist ökonomischer unsinn. elektrische fahrzeugantriebe gibt es schon seit hundert jahren. elektrische antriebe sind überall dort unschlagbar, wo strom leicht und kostengünstig zugeführt werden kann. das ist bei elektrofahrzeugen nicht der fall. deswegen wurden sie ja auch so weit verdrängt. wir können chemie oder physik nicht überlisten. sie setzen uns unsere grenzen. die energiedichte von batterien ist einfach zu gering. zum vergleich: eine tankfüllung von litern dieselkraftstoff wiegt kilogramm, eine bleibatterie mit vergleichbarer energiemenge schon tonnen, und eine lithium-ionen-batterie wiegt , tonnen. genau da sehen wir das dilemma der e‑mobilität. das macht das problem überdeutlich. es ist auch nicht aufgabe des staates, eine einzige technologie zu fördern; denn e‑mobilität ist nur eine möglichkeit von vielen. e‑mobilität kann und soll machen, wer möchte, aber bitte nicht subventioniert mit steuergeldern. denn es handelt sich hier nicht um grundlagenforschung und nicht um industrielle forschung, sondern um markteinführung. da muss der markt antworten, ob er das haben möchte oder nicht. wir sehen in dieser diskussion über e‑mobilität und im vorantreiben der e‑mobilität ganz klar eine umverteilung von unten nach oben, eine umverteilung von unten hin zu den ökofantasten und realitätsverweigerern. das ist unsozial. das machen wir nicht mit. nach einer völlig verfehlten energiewende wird jetzt einer desaströsen verkehrswende das wort geredet. ich hoffe, dass wir hier noch die kurve kriegen und das unterlassen. das wäre besser für das portemonnaie auch der geringverdiener. die schadstoffproblematik des verbrennungsmotors ist schon längst gelöst. lesen sie bitte zum beispiel das positionspapier der wissenschaftlichen gesellschaft für kraftfahrzeug- und motorentechnik. dafür zeichnen professoren verantwortlich. sie sagen ganz klar: der verbrennungsmotor ist der motor der mobilität. er wird durch elektrische antriebe ergänzt, aber nicht ersetzt. aufgrund seiner geringeren emissionen und vor allen dingen immissionen gibt es in naher zukunft auch keine argumente mehr gegen den diesel- und benzinmotor. denn bereits der heutige technologiestand stellt sicher, dass die emissionswerte ausnahmslos eingehalten werden können. meine damen und herren von den linksgrünen und den regierungsparteien, ich rate doch dringend zu nachhilfe in sachen wissenschaft und technik. das hilft gegen ideologische wunschträume. bitte hören sie auf, an dieser stelle wieder unsere volkswirtschaft planwirtschaftlich zu schädigen. dieseltechnologie ist zukunft. die dieseltechnologie gehört zu deutschland. daran halten wir von der afd fest. deshalb: schluss mit der diskriminierung des diesels! deshalb: streichung aller markteinführenden subventionen für die e‑mobilität! diese millionen euro sind an anderer stelle besser zu verwenden. vielen dank. für die cdu/csu-fraktion hat der kollege andreas mattfeld das wort."
