,datum,redeID,vorname,nachname,fraktion,name,inhalt_neu
0,,,,,, ,
1,14.02.2019,ID198000100,Franziska,Giffey,SPD,Franziska Giffey,"sehr geehrter herr präsident! meine damen und herren! wir sind heute auf dem weg zu einem wichtigen gesetz gegen kinderarmut in deutschland: dem starke-familien-gesetz. der präsident hat gerade den langtitel vorgetragen; es sind wörter. wir haben uns entschieden, das in der kommunikation kurzzufassen und darüber zu sprechen, worum es geht: um starke familien in deutschland, die das land spürbar stärker machen. bei diesem gesetzesvorhaben geht es um kinder, die in familien leben, in denen das geld knapp ist. wir haben millionen kinder in deutschland. den meisten kindern geht es gut; sie sind nicht abhängig von staatlichen leistungen, nicht in schwieriger finanzieller lage. das ist die gute nachricht. aber millionen kinder haben die schwierigkeit, in familien zu leben, in denen das geld knapp ist, weil die eltern sozialleistungen beziehen oder weil sie geringe einkommen haben, weil sie verkäuferin, handwerker, friseurin sind was auch immer , weil, obwohl sie jeden tag aufstehen und arbeiten gehen, das geld am ende des monats trotzdem nicht reicht. wir wollen mehr dafür tun, dass eben diese kinder genau die gleichen chancen haben, egal ob zu hause viel geld oder wenig geld da ist. deshalb ist es richtig, dass die bundesregierung in den nächsten jahren über milliarde euro zusätzlich ausgeben wird, um aktiv etwas gegen kinderarmut zu tun. wir wollen, dass eltern nicht deshalb arm werden, weil sie kinder haben. wir wollen, dass kinder gut aufwachsen können. deshalb werden wir zwei dinge tun: den kinderzuschlag neu gestalten und das bildungs- und teilhabepaket ausweiten. eltern, die arbeiten und wenig verdienen, sollen zusätzlich zum kindergeld den kinderzuschlag bekommen. dieser wird so erhöht, dass er das existenzminimum eines jeden kindes deckt, dass er den bedarf eines jeden kindes deckt, und er wird zusätzlich zum kindergeld gezahlt. damit geht einher, dass diejenigen, die den kinderzuschlag bekommen, gleichzeitig auch von den kitagebühren befreit werden das haben wir im gute-kita-gesetz geregelt und sie anspruch auf leistungen aus dem bildungs- und teilhabepaket haben. wir haben gemeinsam mit hubertus heil, dem arbeits- und sozialminister, diesen gesetzentwurf eingebracht. wir haben entschieden, dass das zusammengehört: bildungs- und teilhabepaket sowie die konkrete leistung, die an die familien geht. zum verbesserten bildungs- und teilhabepaket gehört eben, dass für familien, die schwierigkeiten haben, in denen das geld knapp ist, das mittagessen in der schule kostenfrei ist, dass der eigenanteil bei der schülerfahrkarte eben nicht mühsam ausgerechnet werden muss, dass das schulstarterpaket von auf euro erhöht wird und dass es endlich eine lernförderung gibt, und zwar nicht erst dann, wenn das kind versetzungsgefährdet ist wie absurd ist das eigentlich? , sondern dann, wenn das kind es braucht, und dass diese lernförderung auch kostenlos ist. es geht darum, dass wir die alleinerziehenden unterstützen. jede fünfte familie in deutschland ist alleinerziehend; das betrifft jedes fünfte kind. wir wollen, dass die unterhaltsvorschussleistungen nicht mehr zu prozent angerechnet werden und damit alleinerziehende vom kinderzuschlag ausgeschlossen sind. wir wollen, dass sie davon profitieren können. wir werden den kreis der anspruchsberechtigten auf millionen kinder erweitern, die den kinderzuschlag erhalten können. natürlich ist es wichtig, dass alle die, die einen anspruch auf kinderzuschlag haben, ihn auch tatsächlich in anspruch nehmen. wir wissen ich bin mir sicher, das kommt gleich in der debatte , dass ihn noch nicht alle in anspruch nehmen. im moment haben wir eine abrufquote von prozent. lassen sie uns gemeinsam daran arbeiten, dass wir auf die prozent kommen und dass alle die, die den anspruch haben, ihn auch kennen und ihn geltend machen! dafür müssen wir gut kommunizieren. wir müssen den leuten sagen: ja, ihr habt das recht, und ihr sollt diesen antrag auch stellen können. der antrag soll so ausgestaltet sein, dass er einfach auszufüllen ist, und wir wollen unbürokratisch damit umgehen. deshalb überarbeiten wir ihn gerade. er wird sprachlich vereinfacht, er wird technisch vereinfacht. er wird so sein, dass ihn jeder ausfüllen kann. wir werden den antrag auf kinderzuschlag digital möglich machen, sodass jeder auch vom smartphone aus seine leistung beantragen kann. und wir werden es nicht mehr so machen, dass man ihn alle nase lang, jeden monat, wenn sich das gehalt ein bisschen ändert, neu stellen muss, sondern dass die leistung für sechs monate verlässlich gewährt wird, ohne dass jemand zurückzahlen muss. wir wollen die abbruchkante abschaffen. das heißt, wenn eltern etwas mehr verdienen, dann soll es nicht so sein, dass sie gleich den anspruch auf den kinderzuschlag verlieren und sich sagen: lohnt sich das für mich überhaupt? das tue ich mir nicht an , sondern wir wollen, dass sie sagen: ich beantrage das. ich weiß, ich bekomme das verlässlich, und ich kann, auch wenn ich etwas mehr verdiene, damit rechnen, dass das nicht gleich alles weg ist, sondern dann eben stufenweise heruntergeht. für uns steht der kinderzuschlag auch nicht im widerspruch zu einer kindergrundsicherung ganz im gegenteil. die spd sagt ganz klar: wir machen das, was geht, schritt für schritt, und wir machen es realistisch. wir bringen jetzt mit dem starke-familien-gesetz eine ganz große gesetzesänderung gegen kinderarmut auf den weg. das ist der erste schritt, die grundlage für eine perspektivische kindergrundsicherung. aber: wenn man alle leistungen neu gestalten, zusammenführen und vereinfachen will, dann geht das nicht von heute auf morgen. so realistisch müssen wir sein. deshalb ist ganz klar: wir machen jetzt das, was geht, was sofort, ab dem sommer und ab dem nächsten jahr den familien zugutekommt; denn wir wollen, dass alle kinder, die in deutschland aufwachsen, ihren weg machen können, dass jedes kind es packt. wir wollen als sozialstaat das tun, was nötig ist, damit die menschen ermächtigt werden, für sich selbst zu stehen, frei und selbstbestimmt zu leben, damit alle kinder, die hier groß werden, eine gute zukunft haben. vielen herzlichen dank. martin reichardt, afd, ist der nächste redner."
2,14.02.2019,ID198000200,Martin,Reichardt,AfD,Martin Reichardt,"sehr geehrter herr präsident! sehr geehrte damen und herren! liebe spd, ich freue mich, dass sie mir heute die gelegenheit geben, den menschen im lande aufzuzeigen, wie es um die spd bestellt ist. sie bieten mir die gelegenheit, ihr in den letzten wochen beschlossenes sozialstaatspapier und auch das starke-familien-gesetz mit der realität abzugleichen. schlechte zeiten für die spd! denn die familien haben schon erkannt, dass sie die hoffnung aufgeben können, von der spd eine wende zum guten zu erwarten. familien leben nicht von durchsichtigen populistischen versprechungen und auch nicht von gesetzen, die mogelpackungen sind. das starke-familien-gesetz ist nun der angekündigte große wurf einer der zahllosen der sozialdemokratie für familien. wir müssen leider wieder sagen: es ist eine mogelpackung. bisher sind wie gesagt nur prozent aller anspruchsberechtigten auch in der lage, ihren anspruch wahrzunehmen. einer der gründe dafür: der hohe bürokratische aufwand. dies sollte mit dem starke-familien-gesetz geändert werden; das hat frau ministerin giffey auch definiert. was ein großer wurf für die spd ist, zeigen einschlägige anfragen: tatsächlich geht man von einer steigerung um prozentpunkte im ersten umlauf aus. das ist realpolitik der sozialdemokratie! das ist die politik, die sie unter die -prozent-hürde führen wird, meine damen und herren! mit der letzten vorgestellten reform von hartz iv wollen sie offensichtlich für ihre parteifunktionäre den weg in die arbeitslosigkeit ebnen. das muss hier festgestellt werden. alleinerziehende profitieren damit bewegen wir uns im rahmen dessen, was auch die entsprechenden verbände sagen wenig bis gar nicht von der reform des kinderzuschlags. auch hier wurde das versprechen der spd nicht eingelöst. alleinerziehende sind überwiegend frauen. frauen schaffen das! ja, frauen müssen unter der spd auch viel schaffen; denn sie kämpfen allein gegen wirtschaftliche not. leider haben sie, frau giffey, es nicht geschafft, diesen starken frauen auch ein starkes gesetz zur unterstützung an die seite zu stellen. das wäre ihre pflicht gewesen. die afd begrüßt ausdrücklich das freie schulessen, die abschaffung des eigenanteils bei der schülerbeförderung im rahmen der bildungs- und teilhabepakete. aber auch bei diesen paketen klafft zwischen der zahl der anspruchsberechtigten und der zahl der leistungsbezieher eine erhebliche lücke. auch dieses starke-familien-gesetz, das mit stark falsch betitelt ist, wird daran nichts ändern. für deutsche familien ja, für deutsche familien ist die teilhabe an diesen dingen nämlich mit einem hohen maß an bürokratie verbunden. anders sieht diese teilhabe für diejenigen menschen aus, die sie seit in deutschland willkommen heißen. deutsche familien werden nämlich nicht bei der ausfüllung der formulare unterstützt. das zeigt sich auch in den einschlägigen zahlen: die zahlen bezüglich der leistungen, die nach dem asylbewerberleistungsgesetz bewilligt werden, sind deutlich höher als die, die nach dem entsprechenden sozialgesetzbuch bewilligt werden. das muss hier festgestellt werden. das betrifft die schulausflüge, das betrifft die lernförderung, das betrifft alle dinge in diesem bereich. hier sieht man ganz deutlich, wen die spd in deutschland fördert: es sind nicht die schon länger hier lebenden, meine damen und herren. eine bessere zukunft für deutsche familien und schon länger hier lebende ausländische familien gibt es nicht mit dieser regierung, gibt es nicht mit der spd und gibt es leider auch nicht mit ihnen, frau ministerin. ihre amtszeit ist leider geprägt von mogelpackungen: das gute-kita-gesetz macht keine guten kitas. das familienentlastungsgesetz entlastet die familien nicht in hinreichendem umfang. das starke-familien-gesetz stärkt die familien nicht hinreichend. frau ministerin, ich muss sie und die spd leider zum verdachtsfall für mogelpackungen erklären. vielen dank. nächste rednerin ist die kollegin nadine schön, cdu/csu."
3,14.02.2019,ID198000300,Nadine,Schön,CDU/CSU,Nadine Schön,"sehr geehrter herr präsident! liebe kolleginnen und kollegen! sehr geehrte damen und herren! dieses gesetz ist eine der großen familienpolitischen maßnahmen in dieser legislaturperiode. völlig gleich, ob man es nun starke-familien-gesetz oder familienstärkungsgesetz nennt oder den langtitel wählt wie der name schon sagt: wir wollen familien stärken. welche familien wollen wir mit diesem gesetz stärken? zum einen familien mit kindern, die arbeiten und bei denen das geld kaum reicht, um über die runden zu kommen, zum zweiten alleinerziehende und zum dritten familien, die geringverdiener sind oder sozialleistungen beziehen und die ihren kindern mehr teilhabe am gesellschaftlichen leben ermöglichen wollen. darüber hinaus hat das gesetz zum ziel, abläufe und verfahren zu vereinfachen und damit bürger, behörden und einrichtungen von bürokratie zu entlasten. zu allen vier zielen möchte ich einige sätze aus sicht der unionsfraktion sagen. zum ersten. wir wollen die situation von familien verbessern, in denen das einkommen der eltern nicht für den lebensunterhalt der ganzen familie reicht. das sind geringverdiener wie friseurin, koch, reinigungskraft oder vielleicht der türsteher. der kinderzuschlag sorgt dafür, dass diese familien nicht aufstocken müssen oder nicht gleich sagen: ich gehe in den leistungsbezug; denn arbeiten lohnt sich für mich nicht. als union wollen wir arbeit fördern und nicht arbeitslosigkeit. deshalb gilt es, gerade geringverdiener mit kindern besonders zu unterstützen. deshalb erhöhen wir den kinderzuschlag, und zwar deutlich von derzeit euro auf euro pro monat. außerdem wird er künftig angepasst an das existenzminimum steigen. künftig bleibt das war uns als union besonders wichtig mehr vom kinderzuschlag übrig, wenn das einkommen der eltern steigt. bisher war ab einer gewissen grenze schluss, der kinderzuschlag fiel komplett weg. das war die sogenannte harte abbruchkante. diese schaffen wir ab und lassen den kinderzuschlag stattdessen bei steigendem einkommen langsam auslaufen. wer mehr arbeitet, der soll auch mehr in der tasche haben diesem grundsatz tragen wir damit rechnung. leistung muss sich lohnen das ist auch der grundsatz bei einem weiteren punkt: verdient nämlich ein kind, das unterhalt oder unterhaltsvorschuss bekommt, durch einen ferienjob, durch kellnern oder indem es anderen nachhilfeunterricht gibt, etwas hinzu, dann wird das, was das kind verdient, den eltern bisher voll angerechnet. das ist doch ungerecht , haben viele junge leute gesagt; denn sie wollen ja das, was sie sich mit dem zeitungaustragen verdienen, auch für sich behalten, das soll ja sozusagen on top kommen. auch hier sagen wir: leistung muss sich lohnen. deshalb wird zukünftig nur noch die hälfte angerechnet, die kinder werden also wirklich etwas von ihrem verdienst haben. schließlich soll der kinderzuschlag einfacher zu beantragen sein, online und für sechs monate statt bisher nur für einen monat. das macht den kinderzuschlag attraktiver. für mich ist es ein unding, dass es eine staatliche leistung gibt, die gerade nur von einem drittel der anspruchsberechtigten in anspruch genommen wird. wir müssen die antragstellung für diese leistung vereinfachen. wir müssen besser werden, damit mehr kinder, mehr familien in den genuss des kinderzuschlags kommen. die zweite gruppe, die wir stärken wollen, sind alleinerziehende. viele sagen: jetzt arbeite ich schon, kümmere mich um die kinder und habe trotzdem kaum mehr als jemand, der nicht arbeitet. gerade für alleinerziehende ist es ein tagtäglicher spagat, das kind oder die kinder, die familie zu organisieren, den job und das ganze leben zu managen. dann noch jeden euro umdrehen zu müssen, das ist eine große herausforderung für viele alleinerziehende. deshalb verbessern wir auch für sie die situation. sie sollen den kinderzuschlag künftig auch dann erhalten, wenn sie für ihre kinder unterhalt oder unterhaltsvorschuss bekommen. das ist richtig und ein wichtiger baustein im kampf gegen das armutsrisiko von alleinerziehenden und damit auch von ihren kindern sowie gegen altersarmut von frauen insgesamt. die dritte gruppe, die wir unterstützen wollen, sind familien, die kinderzuschlag, wohngeld oder leistungen nach dem sgb ii beziehen und die ihren kindern mehr teilhabe am gesellschaftlichen leben ermöglichen wollen. schon bisher konnten sie ihr kind in einem verein oder in der musikschule anmelden und bekamen dafür vom staat einen zuschuss in höhe von euro. wir wissen: mit euro kommt man manchmal nicht besonders weit. deshalb hat die union gesagt: wir wollen diesen zuschuss erhöhen. künftig soll man bis zu euro für vereinsmitgliedschaften, für die teilhabe am gesellschaftlichen leben geltend machen können. wenn die afd jetzt den eindruck erwecken möchte, dass ein unterschied gemacht wird zwischen menschen, die schon länger oder erst seit in unserem land leben, sage ich ganz deutlich: das ist totaler quatsch. alle haben den gleichen anspruch auf das bildungs- und teilhabepaket, und das ist auch richtig so. all diese maßnahmen sind aus sicht der union richtig und wichtig. sie bilden auch den richtigen ansatz im kampf gegen kinderarmut. wir wollen arbeit finanzieren und nicht arbeitslosigkeit. wir wollen menschen stärken, auf eigenen beinen zu stehen und zusammen mit ihren kindern einen geregelten tagesablauf zu haben. vor allem wollen wir kindern chancen eröffnen. das ist das beste mittel gegen armut und gegen altersarmut. deshalb unterstützen wir diesen gesetzentwurf voller überzeugung in der ersten lesung und freuen uns auf die beratung im ausschuss. jetzt erteile ich das wort dem kollegen grigorios aggelidis, fdp."
4,14.02.2019,ID198000400,Grigorios,Aggelidis,FDP,Grigorios Aggelidis,"sehr geehrter herr präsident! sehr geehrte frau ministerin! meine sehr geehrten damen und herren! frau ministerin, sie haben gleich zu beginn ihrer rede gezeigt, worum es zuallererst geht: es geht zuallererst um kommunikation. deswegen heißt dieses gesetz auch so, wie es heißt. der kinderschutzbund hat völlig recht, wenn er sagt, der richtige name wäre starke-bürokratie-gesetz und ihre namensgebung sei eigentlich nichts anderes als realsatire. da hat er absolut recht. bei einem ihrer auftritte dort hatten sie die einstiegsrede gehalten habe ich einen eindruck davon gewinnen können, warum das so ist. dort haben sie gesagt: ja, wir müssen den gesetzen solch schlichte namen geben ich sage jetzt schlicht ; sie sagen schön oder einfach , damit auch die menschen in dortmund verstehen, was hinter den gesetzen steht. ich persönlich habe das als eine unglaubliche anmaßung und frechheit empfunden gegenüber den menschen, die dort leben, bzw. menschen, die in arbeitervierteln groß geworden sind. ich bin in solch einem viertel groß geworden. wir können das verstehen. das kann ich ihnen versichern. jetzt kommen wir zu dem gesetzentwurf. ja, sie wollen das richtige. ja, sie wollen familien stärken. denn chancengerechtigkeit für familien und chancengerechtigkeit für kinder sind trotz des vielen geldes, das wir zahlen, nicht gegeben. nur prozent derjenigen, die geld bekommen sollen, bekommen es auch. gemäß der antwort auf unsere anfrage soll dieses gesetz dazu führen, dass aus prozent jetzt prozent werden. ich sage: das ist ja ein richtig großer wurf. schauen wir uns einmal den hauptgrund an. der hauptgrund ist, dass es mehr oder weniger alle sechs monate lassen wir jetzt einmal veränderungen, die zwischen diesen zeiten passieren, außen vor neu beantragt werden muss. es gibt immer noch eine stichtagsregelung, und es gibt immer noch einen zu komplizierten antrag. sie haben bei den abbruchkanten etwas gemacht, aber die ungerechten anrechnungen, die es gibt und die die alleinerziehenden zu recht nach wie vor sehen, haben sie nicht abgeschafft. ganz im gegenteil: sie reden davon, frau schön, dass sie den jugendlichen ihr geld lassen, das sie zum beispiel bei einem ferienjob verdienen. gestatten sie mir den hinweis: der freibetrag beim kindeseinkommen soll euro im monat betragen, und jeder euro, der darüber hinausgeht, soll angerechnet werden. das ist nicht das, was wir unter motivation für die jugendlichen verstehen. gerecht ist es erst recht nicht. ein ganz wesentlicher punkt ist: sie belassen es immer noch bei der koppelung, zumindest laut dem referentenentwurf, der mir vorliegt. der kollege von der spd hat ja bereits in einem interview gesagt: nein, das alles wird noch verändert. sie lassen immer noch zu, dass es eine ganz klare koppelung zwischen den leistungen nach dem bildungs- und teilhabepaket und anderen sozialleistungen gibt. auch das finden wir nicht zielführend. auch das finden wir ungerecht. das gehört entkoppelt. materielle existenzsicherung ist das eine, aber chancengerechtigkeit für kinder ist etwas völlig anderes. da müssen wir gerechter und fairer werden. das ist auch genau die richtung, die wir im endeffekt mit unserem antrag verfolgen. wir wollen die entkoppelung genau dieses sachverhalts. wir wollen, dass ein starkes augenmerk da müssen wir als haus und als parlamentarier großzügiger sein auf das thema chancenaufbau gelegt wird. wir wollen die bürokratie deutlich abbauen. wir wollen im ersten schritt den wegfall dieser regelung mit den sechs monaten. bafög wird für ein jahr bewilligt. ihre heil-rente soll ohne jegliche bedürftigkeitsprüfung gezahlt werden. aber die familien sollen alle sechs monate ihre bedürftigkeit nachweisen. das finden wir zutiefst ungerecht. in ihrem referentenentwurf ist immer noch diese stichtagsregelung vorgesehen. das bedeutet: ist der stichtag vorbei, kann man nicht einmal einen monat zurückgehen und sagen, dass man erst jetzt festgestellt hat, also am monatsersten oder monatszweiten, dass man unter die grenzen fällt. auch das ist feindlich gegenüber den familien. auch das wollen wir abschaffen. zur vereinfachung der anträge habe ich schon einiges gesagt. mit unseren maßnahmen als ersten schritten in die richtige richtung wollen wir den familien den automatischen zugang erleichtern, damit es nicht nur prozent werden. wie wäre es, wenn wir ambitioniert sagen, dass wir spätestens zum ende der legislaturperiode auf mindestens drei viertel kommen wollen? eigentlich müssen prozent das ziel sein. dafür arbeiten wir. vielen dank. nächster redner ist der fraktionsvorsitzende der linken, dr. dietmar bartsch."
