,datum,redeID,vorname,nachname,fraktion,name,inhalt_neu
84,16.01.2020,ID1914008400,Florian,Post,SPD,Florian Post,"sehr geehrter herr präsident! liebe kolleginnen und kollegen! zu herrn brandner kein wort ich glaube, seine rede hat für sich selbst gesprochen. wir haben hier schon sehr oft über verrohung und hass und hetze im internet gesprochen, die wir bekämpfen wollen. fast alle fraktionen hier im haus bis auf eine sind sich wahrscheinlich einig, dass bei uns die meinungsfreiheit dort aufhört, wo das strafrecht beginnt. natürlich liegt genau hier das problem begraben: es geht auch um die durchsetzbarkeit von strafrecht, aber auch von zivilrechtlichen ansprüchen bei beleidigungen im netz oder sonstiger hetze. auch deshalb ist das netzdg eingeführt worden.herr kollege höferlin von der fdp, ich kann ihre argumentation hier wirklich beim besten willen nicht nachvollziehen. sie sagten in ihrer rede, hass und hetze im internet nähmen jeden tag zu, deshalb habe sich das netzdg nicht bewährt. das wäre ungefähr so, als wenn ich sagen würde: weil nach wie vor irgendwelche häuser abbrennen, schaffe ich die feuerwehr ab. das kann ja nicht konsequent sein.sie lehnen in ihrem antrag im übrigen ausdrücklich die meldepflicht ab. bisher ist es so, dass plattformbetreiber im bereich der sozialen medien morddrohungen freiwillig den strafverfolgungsbehörden melden. es ist doch viel besser, wenn wir uns hier auf ein verfahren einigen, das eine gesetzlich reglementierte pflicht zur weitergabe etabliert, damit die entscheidung darüber nicht jedem selbst überlassen bleibt oder im ermessensspielraum von mitarbeitern liegt. ich finde schon, dass wir hier ein regularium brauchen. auch aus diesem grunde wird das netzdg weiterentwickelt.alles, was sie hier gesagt haben, herr kollege höferlin, war nach dem motto: wasch mir den pelz, aber mach mich nicht nass. ich gehe einmal davon aus ich bin fest davon überzeugt , dass es auch in der fdp niemand gutheißt, wenn im internet morddrohungen ausgesprochen oder sonstige strafbare handlungen begangen werden. aber wie wollen sie denn diese straftaten verfolgen, wenn sie gegenüber den zuständigen behörden nicht kenntlich gemacht werden? insofern brauchen wir diese weiterentwicklung des netzdg und auch die meldepflicht, meinetwegen auch ich weiß, man kann über den namen streiten eine zentrale meldestelle, die sie in ihrem antrag explizit ablehnen. hier erkenne ich bei ihnen einen eklatanten widerspruch. ich weiß nicht, wie ihr antrag dazu dienen soll, das netzdg weiterzuentwickeln. sie gehen ein bisschen in die richtung: sie wollen das netzdg zwar immer noch abschaffen, aber einzelne punkte finden sie doch wieder nicht so schlecht und wollen sie ins telemediengesetz überführen. insofern halte ich ihnen jetzt zugute, dass sie sich auf dem richtigen weg befinden. wenn wir jetzt noch ein bisschen diskutieren und konstruktiv zusammenarbeiten, dann wird das schon davon bin ich fest überzeugt. unsere tür steht offen. wir sind gerne bereit, hier mit der opposition konstruktive vorschläge zu erarbeiten. ich freue mich auf die weitere zusammenarbeit.danke schön. vielen dank, herr kollege post. nächste rednerin ist die kollegin anke domscheit-berg, fraktion die linke."
85,16.01.2020,ID1914008500,Anke,Domscheit-Berg,DIE LINKE,Anke Domscheit-Berg,"sehr geehrter herr präsident! liebe kolleginnen und kollegen! die meinungsfreiheit ist wie alle verfassungsgrundrechte ein schutzrecht gegen den staat. das heißt, niemand soll aufgrund seiner meinungsäußerungen staatlich verfolgt werden. aber rote linien im strafrecht setzen ihr grenzen. holocaustleugnungen und bedrohungen sind zu recht strafbar. sorgt der staat aber nicht ausreichend dafür, dass solche rechtsbrüche bestraft werden, ist auch das ein angriff auf die meinungsfreiheit. denn wer digitaler gewalt ausgesetzt ist und dann nicht auf ausreichenden staatlichen schutz vertrauen kann, der leidet nicht nur, der droht auch zu verstummen.nun plant die bundesregierung in ihrem maßnahmenpaket zur bekämpfung der hasskriminalität strafverschärfungen und eine quasi automatisierte anzeigepflicht für soziale netzwerke, die die anzahl von anzeigen sehr stark steigern würde. das löst aber nicht das größte bestehende problem, nämlich den eklatanten mangel an qualifizierten fachkräften bei polizei und justiz, und wird die folge haben, dass noch mehr anzeigen ohne urteil im sande verlaufen und das vertrauen in unser rechtssystem noch mehr erschüttert wird. waren prozent der strafbaren hasspostings mehr als fälle politisch motivierte kriminalität von rechts, mit rassistischen, frauenfeindlichen, antisemitischen, homophoben oder transfeindlichen inhalten. von dieser art hass betroffene sind aber ohnehin schon in unserer gesellschaft marginalisiert. ihr schutz wird dennoch nicht ausgebaut, beratungsstellen werden nicht besser ausgestattet, und über die melderegisterauskunft kann weiterhin viel zu leicht die private adresse fast aller personen erfragt und dann im netz verbreitet werden. prävention wird angekündigt, aber null konkretisiert. soziale netzwerke werden nach wie vor nicht gezwungen, in deutschland zustellungsbevollmächtigte für jegliche gerichtliche post einzurichten. und statt schwerpunktstaatsanwaltschaften wird eine zentralstelle im bka geplant. all die dinge, die ich gerade genannt habe, würden betroffenen helfen. alles das fordern wir von der linksfraktion. verteidigungsministerin akk, immerhin ein mitglied der bundesregierung, aber auch bundestagspräsident schäuble und andere fordern stattdessen die klarnamenpflicht in sozialen netzen, die nicht nur verfassungswidrig ist, sondern die bedrohungslage für betroffene sogar noch verschärfen würde; denn wie die melderegisterauskunft erleichtert sie den übergang von digitaler zu physischer gewalt. der bundesgerichtshof urteilte aber schon vor elf jahren ich zitiere :eine beschränkung der meinungsäußerungsfreiheit auf äußerungen, die einem bestimmten individuum zugeordnet werden können, ist mit art. … gg nicht vereinbar.im namen der linksfraktion fordere ich die bundesregierung daher auf, den schutz betroffener in den vordergrund zu stellen und keine neuen anlässe zu suchen, verfassungsgrundrechte für alle zu beschneiden. im übrigen bin ich der meinung, dass informationen zu schwangerschaftsabbrüchen nichts im strafgesetzbuch verloren haben. § gehört endlich abgeschafft.vielen dank. als nächste rednerin erhält das wort die kollegin renate künast, bündnis /die grünen."
86,16.01.2020,ID1914008600,Renate,Künast,BÜNDNIS 90/DIE GRÜNEN,Renate Künast,"herr präsident! meine damen und herren! rassismus, antisemitismus, frauenfeindlichkeit, homophobie das sind alles keine randerscheinungen; das wissen wir. wir wissen allerdings auch, dass es keine ganz neuen erscheinungen sind. ich muss das vorausschicken, damit ich auch sagen kann: ich bin froh, dass wir inzwischen begonnen haben, das problem des rechtsextremismus zu erkennen, und auch heute hier darüber reden obwohl wir viel früher hätten darüber reden sollen. warum? es hat schon lange, bevor die, die dafür bezahlt werden, politik zu machen, opfer geworden sind, lange bevor wir von hass, verbaler und tatsächlicher gewalt und von angriffen wie zuletzt der kollege betroffen waren, nämlich schon seit mitte der , neue strategien im rechtsextremismus gegeben. es hat ermordungen wie die von amadeu antonio in eberswalde kurz nach der wiedervereinigung gegeben. denken sie an die fußballweltmeisterschaft : da gab es no-go-areas. ausländer, die zu besuch kamen, people of colour, wurden quasi aufgefordert: begebt euch nicht ins umland. hunderte menschen sind seit damals getötet worden oder haben schwere gewalt erlebt. ich finde, wir sollten derer heute respektvoll gedenken und in aller demut sagen: wir hätten früher sein können. ich möchte auf zwei ebenen eingehen, meine damen und herren, und etwas klarstellen: es geht um rechtsextremismus im netz, der dort organisiert praktiziert wird, aus dem bürgertum noch unterstützt, damals von herrn henkel, von herrn sarrazin, von herrn gauland. aber es geht nicht nur um diesen organisierten rechtsextremismus. es geht in wahrheit neben diesem gezielten angriff auf unsere demokratie auch darum, dass im privaten bereich immer mehr hass und onlinestalking im netz auftauchen, zum beispiel, wenn menschen sich trennen, dass es von ehemaligen partnern angriffe auf frauen gibt, dass dort stalking und bedrohung stattfinden.wir müssen auch über cybergrooming reden. wir müssen das thema netzdg in die debatte aufnehmen. es geht zum beispiel um spiele, die von kindern gespielt werden, die möglichkeiten für anbahnungsversuche bieten. was ist die antwort der regierung? sie führen mehrere gesetzesverfahren gleichzeitig durch. in richtung der ministerin muss ich sagen: sie kommen mit einer überfälligen reform des netzdg, das schon falsch war, als es verabschiedet wurde. sie haben dann gesagt: wir warten die evaluierung ab. nun machen sie pressearbeit, rücken aber weder den entsprechenden gesetzentwurf noch die ergebnisse der evaluierung heraus. wer gegen die anfeindungen gegenüber unserer demokratie kämpfen will, der sollte sich ein besseres verfahren überlegen. es gibt also zwei verfahren: zum einen die überarbeitung des netzdg wer auch immer sich die maßnahmen überlegt hat , zum anderen gibt es einen antrag der grünen aus dem herbst , herr müller, in dem das alles schon drinsteht. aber eine debatte darüber vertagen sie regelmäßig. dann gibt es ihr neun-punkte-paket gegen rechtsextremismus, das eine meldepflicht und ähnliches enthält. ich kann an dieser stelle nur eines sagen: wir müssen über die entwürfe, wenn sie denn irgendwann einmal vorliegen, sehr sorgfältig diskutieren. warum? wir müssen darüber diskutieren, weil man die grundrechte, die würde, den respekt und die körperliche unversehrtheit nicht dadurch wahrt, indem man sie auf der anderen seite schleift, meine damen und herren. frau kollegin, sie müssen zum schluss kommen. ja. meinen kollegen von der fdp sage ich: man muss sich schon überlegen, ob man das netzdg abschaffen oder reformieren will. aber sie haben noch zeit.an die koalition gerichtet sage ich: ich möchte die gesetzentwürfe haben, und ich möchte endlich ein gesamtpaket, das analog und digital verbindet, das tatsächlich eine taskforce rechtsextremismus beinhaltet und das die institutionen, die zivilgesellschaft und die beratungsangebote unterstützt frau kollegin, sie müssen zum schluss kommen, bitte. und nicht nur das recht ausweitet. das wird nämlich nicht reichen. nächster redner für die cdu/csu-fraktion ist der kollege alexander hoffmann."
87,16.01.2020,ID1914008700,Alexander,Hoffmann,CDU/CSU,Alexander Hoffmann,"herr präsident! geschätzte kolleginnen und kollegen! meine sehr verehrten damen und herren! liebe frau kollegin künast, ich nehme ihren vorschlag ernsthaft auf. sie wollen über cybergrooming reden. das können wir morgen früh, uhr, machen. bis dahin hat ihre fraktion noch zeit, sich zu überlegen, ob sie der strafbarkeit des untauglichen versuchs zustimmt, wofür ich ausdrücklich werben möchte. sie können morgen ihren ankündigungen von heute taten folgen lassen. wir haben in diesem haus schon oft über das verhältnis von freiheit und sicherheit gesprochen. auch in der digitalen welt ist es so, dass sich freiheit und sicherheit gegenseitig nicht ausschließen. sie bedingen einander. es wird im netz freiheit nicht ohne sicherheit geben, und es kann keine sicherheit ohne die freiheit geben. es ist immer wichtig, beide aspekte in ein ausgewogenes verhältnis zueinander zu stellen. dort, wo das eine auf der strecke bleibt, kann es das andere nicht geben. aber genau an dieser stelle weist der vorliegende antrag schwächen auf.ich will ihnen ein beispiel nennen. sie haben in ihrer rede gesagt, sie wollen nicht, dass plattformen löschen. das wird von der einen oder anderen fraktion noch garniert, indem man sagt, das wäre eine privatisierung der rechtsdurchsetzung. ganz ehrlich, ich glaube, dass keine fraktion, die das behauptet, das tatsächlich ernst meint. wenn das so wäre, hätten sie nämlich vom ersten tag an, seitdem es facebook gibt, sturm gegen facebook laufen müssen; denn vom ersten tag an löscht facebook selbstständig anhand eigener standards. man muss ehrlich sagen: das hat sie über die jahre nie wirklich interessiert, bis wir über das netzdg diskutiert haben.ein zweites beispiel: es war doch früher schon so und es ist auch heute so, dass zum beispiel ein zeitungsverlag einen leserbrief, der eine beleidigung enthält, nicht veröffentlichen darf. wenn wir einen solchen vorgang in die digitale welt transferieren, dann tun sie so, als wäre das das ende der meinungsfreiheit. hinzu kommt, dass der schaden, der angerichtet wird, in der digitalen welt ein ganz anderer ist. die zeitung wird gelesen, dann liegt sie einen tag auf dem küchentisch, und dann kommt sie ins altpapier. eine beleidigung, die in die digitale welt entsandt wird, zum beispiel auf einer plattform wie facebook, wird einmal, zehnmal, hundertmal geteilt, und irgendwann ist sie tausendfach unrückholbar im netz. das heißt, es gibt dort einen ganz anderen ausbreitungsgrad und damit einen ganz anderen gefährdungsgrad für den einzelnen, und dann reden wir doch wieder über sicherheit.schauen sie sich einzelne beispiele an. menschen sind in den suizid getrieben worden, weil bestimmte mobbingmaßnahmen nie wieder aus dem internet gelöscht worden sind. es gab menschen, die youtube angefleht haben, im interesse ihrer familie bestimmte falschbehauptungen aus dem netz zu nehmen, aber nichts ist passiert. daran wird, glaube ich, sehr deutlich, dass es gar nicht anders geht, als plattformbetreibern manschetten anzulegen.ich möchte betonen ich glaube, auch das eint uns : wir merken doch alle, dass wir uns den weg zum netzdg nicht leicht gemacht haben. wir alle haben frühzeitig erkannt, dass wir absolutes neuland betreten. es ist tatsächlich ein hoher anspruch, den wir haben, meinungsfreiheit und die sicherheit des einzelnen ausgewogen in einklang zu bringen. es wäre mir deswegen wichtig, dass wir in den debatten die komplexität der herangehensweise wechselseitig nicht ignorieren und so tun, als ob wir mit dem rasenmäher über das grundrecht der meinungsfreiheit gehen und ihm an keiner stelle zur erforderlichen geltung verhelfen. genau deswegen haben wir eine evaluierung vereinbart. wir haben gute erkenntnisse daraus gewonnen. kollege müller hat aus der anhörung berichtet. er hat auch berichtet, dass bei den fachleuten ein umdenken stattgefunden hat, was den umgang mit dem netzdg angeht. seien wir doch ehrlich zueinander: wir stehen vor einer umfassenden herausforderung. das bedeutet, wir müssen uns dabei zeit lassen. wir müssen wirklich tiefgehend arbeiten, um die herausforderungen anzugehen. sie haben mitbekommen, dass wir dabei sind, ein umfassendes paket zu schnüren. ich kann sie nur einladen: beteiligen sie sich an diesem dialog. dann kommt am ende mit sicherheit etwas gutes dabei heraus. da frau künast so lebhaft ist, komme ich auf das thema cybergrooming zurück. wir rechnen morgen fest mit ihrer unterstützung. ich werde darauf zurückkommen.vielen dank für die aufmerksamkeit. vielen dank, herr hoffmann. letzter redner zu diesem tagesordnungspunkt ist der kollege dr. jens zimmermann, spd-fraktion."
88,16.01.2020,ID1914008800,Jens,Zimmermann,SPD,Jens Zimmermann,"herr präsident! meine damen und herren! gewalttaten, hetzkampagnen, hasskommentare bedrohen unser zusammenleben. sie machen mich und viele betroffen, und sie verlangen unser handeln. wir alle kennen die weisheit auf worte folgen taten . wenn ich mir anschaue, was gestern unserem kollegen karamba diaby passiert ist, dann wird klar: das ist ausfluss dieser alten weisheit. sie hat sich wieder einmal bewahrheitet. ich will betonen: wir stehen fest an der seite unseres kollegen. als spd-fraktion verurteilen wir jede art der gewalt. wir brauchen einen starken staat, wir brauchen klare regeln, und wir brauchen auch eine konsequente strafverfolgung. nur so können wir friedlich zusammenleben.frau künast, ich stimme vielem zu, was sie gesagt haben, aber im kampf gegen rechts würde ich mir wünschen, dass in hessen zum beispiel die nsu-akten zugänglich gemacht werden und nicht mit geheimhaltung belegt und jahre unter verschluss gehalten werden. das würde sehr viel helfen. jeder, der in verantwortung steht, kann etwas dazu beitragen. das ist mir wichtig an dieser stelle.die fdp hat für den vorliegenden antrag die überschrift meinungsfreiheit verteidigen recht im netz durchsetzen gewählt. dem können wir zustimmen. doch wenn man sich den antrag anschaut, stellt man fest: es sind viele widersprüche drin. auf der einen seite soll im netz recht durchgesetzt werden, auf der anderen seite soll das netzwerkdurchsetzungsgesetz abgeschafft werden. sie wollen das dann zwar irgendwo im telemediengesetz verankern, aber warum das besser sein soll, das lässt der antrag offen. dann sollen es wieder die privaten unternehmen mit ihren hausregeln richten, aber eine richtig harte verpflichtung der unternehmen, zu handeln, ist im vorliegenden antrag nicht enthalten. das ist unserer meinung nach inkonsequent.das, was die bundesjustizministerin zur weiterentwicklung des netzwerkdurchsetzungsgesetzes vorgelegt hat, ist der richtige weg. wir greifen die erfahrungen, die in den letzten jahren mit dem gesetz gemacht wurden, auf. die meldewege müssen einfacher auffindbar sein. der widerspruch gegen eine unberechtigte löschung muss erleichtert werden. wir sind, was diese intention ihres antrags betrifft, ganz bei ihnen. aber wir brauchen auch bessere auskunftsansprüche für opfer von beleidigungen und drohungen. das thema des zustellungsbevollmächtigten, den sie auch wollen, muss noch besser geregelt werden, sodass es an allen stellen klar ist. ich glaube, der weg, das netzwerkdurchsetzungsgesetz weiterzuentwickeln, folgt eigentlich ganz genau der intention zumindest der überschrift ihres antrags.lassen sie mich zusammenfassen, meine damen und herren: als spd-fraktion schützen wir die meinungsfreiheit und arbeiten für ein freies und solidarisches zusammenleben. doch dafür braucht es konkrete regeln. deswegen ist es der richtige weg, das netzwerkdurchsetzungsgesetz weiterzuentwickeln.herzlichen dank. vielen dank, herr dr. zimmermann. mit diesen worten schließe ich die aussprache."
89,16.01.2020,ID1914008900,Michael,Donth,CDU/CSU,Michael Donth,"herr präsident! liebe kolleginnen und kollegen! heute debattieren wir einen gesetzentwurf zur umsetzung der technischen säule des vierten eisenbahnpakets der europäischen union. wir sprechen hier über eu-recht, das wir sowieso zwingend in nationales recht umsetzen müssen, also einen vergleichsweise technischen vorgang. mich freut es trotzdem, heute darüber sprechen zu können; denn dieser gesetzentwurf ist ein weiterer wichtiger mosaikstein im bild unseres vereinten europas.nur mit einem über die einzelnen eu-mitgliedstaaten hinweg funktionierenden schienenverkehr werden wir es schaffen, die europäische union möglichst ohne technische und betriebliche hindernisse bereisen und vernetzen zu können. das freut mich als verkehrspolitiker. das freut mich aber auch gleichermaßen als tourismuspolitiker, da eine enge verzahnung und einheitlichere regeln und standards im schienenverkehr auf eu-ebene zu einem besseren transitverkehr zwischen den staaten führen werden und somit güter und personen schneller und auch wirtschaftlicher transportiert werden. dabei sollte jedem echten europäer das herz aufgehen.wir kommen unserem ziel immer näher, den europäischen verkehr nachhaltiger und grenzenloser zu machen. der parlamentarische beirat für nachhaltige entwicklung hat dies für diesen jetzt zu beschließenden gesetzentwurf gutachterlich bestätigt. wie schaffen wir das konkret?erstens. wir vereinfachen den grenzüberschreitenden schienenverkehr. durch die harmonisierung der sicherheitsbescheinigungen der eisenbahnverkehrsunternehmen kann jedes unternehmen mit einer einzigen bescheinigung am gesamten europäischen schienenverkehr teilnehmen.zweitens. wir entschärfen nadelöhre. künftig haben die eisenbahnverkehrsunternehmen ein wahlrecht, ob sie ihre für den betrieb notwendige sicherheitsbescheinigung beim eisenbahn-bundesamt, dem eba, oder bei der europäischen eisenbahnagentur beantragen wollen.drittens. wir entbürokratisieren im bereich der instandhaltung von güterwagen. das eba wird als neue aufgabe die anerkennung und überwachung der zertifizierungsstellen erhalten und nicht mehr, wie bisher, die instandhaltungsstellen-bescheinigungen und die bescheinigungen für die instandhaltungsfunktion selbst ausstellen müssen.viertens. wir schaffen einen einheitlichen sicherheitsstandard. der gesetzentwurf regelt nämlich eine engere zusammenarbeit der bahnsicherheitsbehörden in europa, und auch das ist unerlässlich. wir wollen doch, dass bahnreisende an jedem bahnhof in europa jeden zug von jedem eisenbahnunternehmen in dem wissen nutzen können, dass überall dieselben hohen sicherheitsstandards gelten. wir steigern damit die attraktivität und verlässlichkeit des europäischen schienenverkehrs. wenn heute der zug von stuttgart nach paris wegen eines technischen defekts was ja passieren soll ausfällt, kann er womöglich nicht durch einen anderen zug ersetzt werden, weil dessen sicherheitstechnik vielleicht nur für eines der beiden länder zugelassen ist.durch diese nun festzulegenden einheitlichen zulassungskriterien in den nationalen netzen schaffen wir die möglichkeit für einen attraktiveren, umsteigefreieren und vielleicht auch günstigeren europäischen eisenbahnverkehr. dann wird es interessanter, das auto einmal stehen zu lassen oder sich die sicherheitskontrollen an den flughäfen zu ersparen und ganz entspannt im zug platz zu nehmen.das deutsche wie auch das europäische eisenbahnrecht sind voll von technischen feinheiten, die angeglichen werden müssen, wenn wir den umstieg auf die klimafreundliche bahn europäisch denken wollen. auch wenn das thema vielleicht nicht so sexy ist wie eine mehrwertsteuersenkung: wenn die bahnkundinnen und bahnkunden dann hoffentlich in einigen jahren mit möglichst wenigen umstiegen im zug von reutlingen nach marseille sitzen und sich fragen, ob das irgendwann einmal anders war, dann haben wir unser ziel erreicht. mit dem gesetzentwurf, um dessen zustimmung ich sie heute bitte, werden wir dazu beitragen.aber wir müssen noch mehr tun. wir müssen, wenn wir einen möglichst grenzenlosen eisenbahnverkehr haben wollen, im rahmen von ertms eine einheitliche zuglenkungs- und steuerungstechnik flächendeckend verbauen und die geplanten europäischen trassen im rahmen von ten, also die hauptachsen auf dem kontinent, fertigstellen. hier sehe ich unsere initiative im bereich der planungsbeschleunigung als unerlässliches mittel, um national hier bei uns unseren beitrag schneller leisten zu können. kurz: es ist die gesamtheit der mosaiksteine, die das bild entstehen lässt. mit diesem schon angesprochenen weiteren steinchen, sehr geehrte damen und herren, liebe kolleginnen und kollegen, arbeiten wir heute abend weiter an diesem bild des vereinten europas. deshalb bitte ich sie: stimmen sie dem zu.herzlichen dank. vielen dank, herr kollege donth. nächster redner ist der kollege wolfgang wiehle, afd-fraktion."
