,datum,redeID,vorname,nachname,fraktion,name,inhalt_neu
0,,,,,, ,
1,03.07.2018,ID194400100,Peter,Boehringer,AfD,Peter Boehringer,"herr präsident! liebe kolleginnen und kollegen! eine anmerkung vielleicht aus aktuellem anlass: diese rede halte ich unter der prämisse, dass die mehrheit, die wir bei den haushaltsberatungen im ausschuss hatten, auch bei der endabstimmung im plenum noch steht. das wäre also die von cdu, csu und spd. doch das ist wahrscheinlich; denn wir erleben derzeit eigentlich nur großes staatsschauspiel im hinblick auf die bayernwahlen. die forderung von herrn seehofer nach der zurückweisung von migranten, die bereits einen antrag in einem anderen land gestellt haben, war schlicht die forderung nach der einhaltung geltenden rechts, das seit an den deutschen grenzen permanent gebrochen wird. es sagt viel über den zustand unseres landes aus, wenn diese selbstverständliche forderung ernsthaft widerspruch der kanzlerin auslösen kann und sie diesen machtkampf dann auch noch gewinnt. zur sache, zum haushalt . es ist ein idealumfeld mit niedrigstzinsen, ezb-anleihekäufen und , alles letzten endes künstlich die konjunktur und damit die steuereinnahmen stimulierend. der angeblich ausgeglichene haushalt ist damit kein erfolg guter politik, sondern ergebnis nicht nachhaltiger sondereffekte und von nicht eingestellten risikovorsorgemaßnahmen. wären im ausschuss alle änderungsvorschläge der afd angenommen worden, hätte sich eine entlastung des bundeshaushalts von etwa milliarden euro ergeben. dabei hat die afd die sogenannte asylrücklage in höhe von milliarden euro noch gar nicht angefasst. würde die regierung an den grenzen zum recht zurückfinden, dann könnten diese milliarden für andere aufgaben oder für steuerentlastungen eingesetzt werden. die umwidmung könnte unseres erachtens relativ schnell vollzogen werden, da die rückkehr zum recht inzwischen auch von kollegen anderer fraktionen gefordert wird. der minikompromiss von heute nacht würde dafür jedoch keinesfalls ausreichen, wenn er denn überhaupt umgesetzt wird. einige anmerkungen zum entschließungsantrag der afd. erstens: transparenz beim haushalt. die koalition brachte einige ihrer wichtigsten änderungsanträge erst in letzter stunde ein, obwohl wir wochenlang in x sitzungen diskutiert haben. ein besonders prägnantes beispiel war ein änderungsantrag der koalition im volumen von fast milliarden euro, der in der abschlusssitzung morgens um uhr eingebracht wurde und die ausgaben für die bundesschuld reduzieren sollte, und dies bei einem titel, bei dem mir noch fünf tage zuvor im berichterstattergespräch erklärt worden war, das sei unmöglich, weil diese entwicklung viel zu unsicher sei; hier könne keine reduzierung erfolgen. so etwas ist nicht seriös. diese milliardenkürzung diente ausschließlich der sicherstellung der künstlich herbeigerechneten schwarzen null. bei vielen brisanten fragen zu haushaltspositionen hält sich die regierung bedeckt, etwa beim thema migrationskosten. entweder weiß sie gar nicht genau, was die von ihr alimentierten intransparenten ngos mit dem geld so machen, oder sie will es nicht sagen. fast die hälfte des etats des auswärtigen amts steht unter sogenannten deckungsvermerken. die entsprechenden titel sind somit untereinander vermischungsfähig, ohne dass der bundestag hierüber nochmals entscheiden müsste. dies hebelt ebenso wie übertragungsvermerke oder die projektfinanzierung über verschiedene teilhaushalte das transparenzgebot des haushalts aus und gefährdet bei exzessivem einsatz sogar die etathoheit des parlaments. zweitens. die eu wird haushalterisch weiterhin als staat behandelt. die deutschen beiträge zum eu-haushalt werden als negative einnahmen verbucht, was den bundeshaushalt nach unserer ansicht illegitim optisch und buchhalterisch verkürzt. der bund hat eigentlich ausgaben über milliarden euro und nicht die ausgewiesenen milliarden; das ist die offizielle zahl. die deutschen eu-kosten von etwa milliarden euro sollten eigentlich nach dem bruttoprinzip zuerst als steuereinnahmen und dann als eu-kosten verbucht werden; denn nicht die eu erhebt die steuern, sondern deutschland. die gängige praxis impliziert, dass die brd die eu-steuern für den überstaat eu eigentlich nur eintreibt. man spricht da auch von eu-eigenmitteln, was eine staatsqualität der eu suggeriert, die es gar nicht gibt und nach verfassungsrecht auch gar nicht geben darf. das heißt aber nicht, dass es die eu nicht versucht mit dieser fiskalkapazität. ganz aktuell liegt uns ein verordnungsentwurf der kommission vor, der der eu in zukunft tatsächlich das recht auf eigene steuererhebung einräumt. leider wurden vorige woche hier im haus zwei afd-anträge abgelehnt, die diese verfassungswidrigen planungen der eu stoppen sollten. drittens: kosten der integration nichtasylberechtigter. menschen, die als flüchtlinge zu uns kommen, müssen laut geltendem gesetz in ihre heimatländer zurückkehren, sobald der fluchtgrund entfallen ist. die afd sieht keine notwendigkeit, mit hohem finanziellen aufwand die integration dieser migranten irgendwie sicherzustellen. viertens: verteidigungsfähigkeit wiederherstellen. die ausrüstungssituation der bundeswehr befindet sich in einem katastrophalen zustand. die afd hat aufwüchse bei denjenigen positionen des verteidigungsetats beantragt, die der landesverteidigung im engeren sinne dienen. fünftens: ideologischen gesellschaftsumbau stoppen. viele mittel werden ressortfremd, aber stets im sinne einer links-grünen indoktrinierung eingesetzt. fast jede stelle muss dazu ihren beitrag leisten. so betreibt beispielsweise das kanzleramt projekte zur diversitätsentwicklung. derartige projekte sind nach ansicht der afd-fraktion zu streichen. diversität schafft sich eine gesellschaft selbst, wenn sie es denn will. wir brauchen eine rückbesinnung der regierungsinstitutionen auf die ihnen zugedachten aufgaben, nicht zuletzt im sinne einer sparsamen haushaltsführung. sechstens: klimasubventionen runter. die sogenannte energiewende ist zu hinterfragen. eine neuorientierung in der klimapolitik wäre gleichzeitig eine förderung des industriestandorts deutschland. statt künstliche co -zertifikatsplanwirtschaft zu betreiben, gilt es, unternehmen marktchancen frei suchen zu lassen. aus dem haushalt sollte nur die entsprechende infrastruktur finanziert werden. hier herrscht nachholbedarf, insbesondere beim fernstraßenbau oder beim straßenbau generell. ceterum censeo: kosten der euro-rettung. ich muss es immer wieder wiederholen: wir fordern die bildung von rückstellungen für die künftigen gewaltigen und fast sicheren ausfälle der euro-rettungsgelder. dies hartnäckig zu unterlassen, ist ein permanenter verstoß gegen die grundregeln der haushaltsvollständigkeit und der kaufmännischen vorsicht. wir reden von hunderten von milliarden. erst am vorigen freitag hat der bundestag wieder mal eine auszahlung an griechenland aus dem schattenhaushalt esm genehmigt. sehr praktisch diese schattenhaushalte; denn sonst hätten diese milliarden euro direkt sichtbar aus dem deutschen bundeshaushalt gezahlt werden müssen und das ist nur die absolute spitze des eisbergs. herr minister scholz, in ihrer haushaltsrede am . mai sagten sie: europa ist für deutschland das wichtigste nationale anliegen. ... es geht um die souveränität europas ... dazu stellen wir fest: dem deutschen volke lautet unser auftrag. die eu-ropäische fehldenke ist es, die die bürger der politik entfremdet und von der sie sich abwenden, so sehr, dass die wählerabwanderung inzwischen die sonst sklavisch eu-ropäischen csu-funktionäre zur rhetorik gegen noch mehr europa nötigt, auch wenn das reine heuchelei ist; denn gleichzeitig stimmt die csu in brüssel für noch mehr, dann sogar legale migration, stichwort dublin iv . wir sagen: nein, es geht eben nicht um eu-ropäische souveränität, und, nein, eu-ropa ist nicht das wichtigste anliegen deutschlands. herzlichen dank. nächster redner ist johannes kahrs, spd."
2,03.07.2018,ID194400200,Johannes,Kahrs,SPD,Johannes Kahrs,"sehr geehrter herr präsident! liebe kolleginnen und kollegen! wir kommen jetzt zur abwechslung und das ist nach den letzten tagen besonders erfrischend auf die sachebene zurück. dafür sind wir da, und das ist gut. wir haben hier eben eine etwas unterkomplexe rede des kollegen von der afd gehört; so kennt man sie. aber auch das ertragen wir mit fassung, weil wir wissen, dass diese koalition und dass diese regierung zumindest auf der sachebene, die wir hier heute diskutieren, dieses land anständig und vernünftig regieren. das kriegen wir hin, weil in den ausschüssen anständig gearbeitet wird. das, was die bundestagsabgeordneten können, können sich vielleicht auch die parteiführungen der union vornehmen, und dann kommen wir alle am ende dazu, dass wir auf der sachebene das einlösen, was wir mit dem koalitionsvertrag den menschen in diesem unserem deutschen vaterland versprochen und zugesagt haben. das werden wir jetzt auch tun. dazu hat olaf scholz einen haushalt vorgelegt, der all diese punkte entsprechend umfasst. ich freue mich, dass hinter mir der präsident des deutschen bundestages sitzt, der schon in der letzten legislaturperiode in seiner vorherigen verwendung ein bisschen auf uns aufgepasst hat. ich kann sagen: so wie der letzte haushalt vernünftig war, so ist dieser haushalt auch sehr vernünftig. es gibt aber ein paar kleine unterschiede. einer dieser unterschiede ist, dass wir mehr geld für investitionen ausgeben. das wiederum ist etwas gutes. das ist etwas, was bei den menschen in diesem land ankommen wird. wir geben mehr geld aus für straße, für digitalisierung, für schule, für bildung, für viele dinge, für viele themen, die für die wähler in diesem land richtig und wichtig sind. nach all dem klamauk der letzten tage, finde ich, muss man den menschen das vertrauen in die politik wieder zurückgeben. es wäre gut, wenn wir das auf der sachebene tun. deswegen haben wir mit dieser koalition bei den investitionen noch mal , milliarden euro obendrauf gelegt. ich glaube, damit haben wir haushälter unseren kleinen beitrag geleistet. für uns sozialdemokraten und für die kolleginnen und kollegen der cdu/csu mit dem kollegen ecki rehberg arbeite ich seit jahren gut und vertrauensvoll zusammen; ecki, dass du schmunzelst, ist mir lob genug sage ich, dass wir gerade auch beim personal den guten sozialdemokratischen dreisatz wieder hinbekommen. damit diese investitionen, die wir in den haushalt hineingeschrieben haben, auch umgesetzt werden und das geld nicht wie in den letzten jahren teilweise zurückfließt, haben wir gesagt: wir brauchen einen handlungsfähigen staat, einen staat, der satisfaktionsfähig ist, der es schafft, das geld, die ps, auf die straße zu bekommen. deswegen gilt der alte sozialdemokratische dreisatz: wir schaffen neue stellen, wir heben stellen, und wir entfristen. nur wenn wir einen staat haben, der handlungsfähig ist, können wir das geld auch entsprechend einsetzen. deswegen schaffen wir über neue stellen bei der bundespolizei, stellen im bundeskriminalamt. die zollverwaltung bekommt neue stellen. wir haben auch den maßgabebeschluss gefasst, dass in den nächsten vier jahren in jedem jahr neue stellen beim zoll geschaffen werden. ich glaube, jeder, der weiß, wie die situation beim zoll ist, wird dies begrüßen und unterstützen. beim bundesamt für migration und flüchtlinge man hörte in den letzten tagen häufiger davon gibt es neue stellen zusätzlich. stellen, herr seehofer, werden entfristet ich glaube, das ist auch ganz in ihrem sinne , sodass wir dann auch dazu kommen, dass diese behörde ihre arbeit vernünftig erledigen kann. bei der bundesanstalt für immobilienaufgaben auch das ist für viele wichtig; sie wissen, dass diese immobilien für die kommunen, für den wohnungsbau wichtig sind haben wir stellen entfristet. ich glaube, dass auch das eine gute sache ist. gleichzeitig haben wir hier einen haushalt, mit dem wir viele gute dinge tun, aber keine neuen schulden schaffen. bei der union hieß das immer: schwarze null. wir haben immer gesagt: über schwarze nullen reden wir nicht. wir machen keine neuen schulden, und das hat etwas mit generationengerechtigkeit zu tun. generationengerechtigkeit bedeutet nämlich, dass nicht andere menschen die schulden bezahlen müssen, die hier gemacht werden. deswegen machen wir seit fünf jahren keine neuen schulden, seitdem die spd an der regierung ist. schwarz-gelb hat das nicht hinbekommen, herr buschmann. ihre fdp hat mitregiert, als dreistellige milliardensummen an schulden gemacht worden sind. seitdem die spd mit der union regiert, werden keine neuen schulden gemacht, und das zeigt auch dieser haushalt. deswegen ist es ein guter haushalt. dem kann man auch zustimmen. vielen dank. jetzt erteile ich das wort dem kollegen otto fricke, fdp."
3,03.07.2018,ID194400300,Otto,Fricke,FDP,Otto Fricke,"sehr geschätzter herr präsident! meine lieben kolleginnen und kollegen! der haushalt gibt den bürgern klarheit darüber, wes geistes kind die regierung ist und wie sie sich das vorstellt. im koalitionsvertrag steht: eine neue dynamik für deutschland . ja, könnte man so sehen. aber wenn man dann genauer guckt, erkennt man: das ist kein haushalt der dynamik, das ist kein haushalt der ideen, sondern das ist ein haushalt der verschwendung. es ist ein haushalt der verschwendung von möglichkeiten: der möglichkeit, zukunft zu gestalten, der möglichkeit, die bürger zu entlasten, der möglichkeit, ernsthaft in forschung und bildung zu investieren, der möglichkeit, ernsthaft schulden zu tilgen, der möglichkeit, ernsthaft anteile an unternehmen zu verkaufen, der möglichkeit, ernsthaft subventionen abzubauen. all diese möglichkeiten verschwenden sie mit diesem haushalt in einer art und weise, die nicht zu akzeptieren ist. warum macht das diese koalition, neben all den kleinen auseinandersetzungen, die man in einer demokratie ja haben muss? ihnen fehlt die grundeinstellung. sie haben der kollege kahrs hat sich dessen ja gerühmt gesagt: wir haushälter haben jetzt noch mal mehr geld ausgegeben. die aussage muss sein: liebe bürger, wir haben euch noch mal mehr geld genommen, verteilen es dann an euch zurück und möchten dafür gerne applaus. das ist kein verständnis von einem staat, in dem der bürger im zentrum steht. rein ziffernmäßig: der haushalt steigt um , prozent, statt wie bisher um , prozent. dabei verschlechtern sich die wirtschaftsprognosen von , prozent auf ungefähr , prozent. was ist das für eine grundeinstellung, in der nicht nur die regierung sagt: was stört mich, wie das wachstum und die zukunft aussehen? , sondern in der auch noch die koalitionsfraktionen liebe cdu/csu, das kann ich ihnen hier wirklich ins stammbuch schreiben sagen: wir geben einfach noch mal mehr aus ? es ist am ende verschwendung. verschwendung gibt es auch beim thema investitionen. ja, der finanzminister wird sich rühmen und sagen: wir haben jetzt , milliarden euro für investitionen zur verfügung; wir haben noch mal ganz viel obendrauf gelegt. herr minister, wollen wir mal ehrlich sein: wie machen sie das denn? sie führen das baukindergeld ein, mit dessen hilfe private investieren sollen: haus bauen, wohnung kaufen oder älteres haus kaufen und renovieren. und was sagen sie? das baukindergeld ist eine staatliche investition. sie haben ein komisches verständnis von investitionen. unser verständnis von investition ist das nicht. im endeffekt ist es, genauso wie an anderer stelle, nur die möglichkeit, die zahlen nach oben zu bringen. sie schauen aber nicht darauf, was wirklich ankommt, wo wirklich in zukunft investiert wird. sie investieren fast immer nur in die vergangenheit. herr kollege kauder, wenn sie das für abwegig halten, dann schauen sie sich doch das sondervermögen digitale infrastruktur an, in das sie , milliarden euro einzahlen. und wie viel von diesen , milliarden euro geben sie dieses jahr aus? null! aber sie rühmen sich, , milliarden euro mehr investiert zu haben. so läuft das spiel doch im moment ab. zum thema privatisierung. dieser staat ist eigentümer von so vielen unternehmen; er hat anteile an zwei banken, an der telekom, an der post usw. jetzt könnte man ja sagen: wann, wenn nicht in wirtschaftlich guten zeiten, ist diese regierung in der lage, anteile zu verkaufen? macht sie nicht. noch viel schlimmer ist das, herr finanzminister, finde ich, ist schon eine harte nummer ja, ich weiß, ihr werdet gleich applaudieren für das, was er macht : dieser finanzminister hat gemeinsam mit seinem vorgänger noch mehr anteile an privaten unternehmen gekauft. er hat achtung! nicht million telekom-aktien, sondern millionen telekom-aktien gekauft. das muss man sich einmal vorstellen. ist das das ziel, ist das die neue dynamik? für mich ist das verschwendung statt abbau von neuverschuldung. meine damen und herren, im endeffekt fehlt dieser koalition die linie. es wird versucht, all die dinge, die in den letzten vier jahren schon gemacht worden sind, irgendwie mit mehr geld zuzukleistern. wir werden es erleben, wenn der neue haushalt vorliegt. es wird gesagt: hier ein bisschen mehr, da ein bisschen mehr, dort ein bisschen mehr. was aber nicht passiert, ist, dass sie wirklich in die zukunft blicken, dass sie sagen, wohin sie mit diesem land gehen wollen. ja, sie diskutieren über digitalisierung, aber sie schieben die gelder in bereiche, wo sie nicht ausgegeben werden. ja, sie diskutieren darüber, dass wir bei der infrastruktur etwas tun müssen. ich bin sehr gespannt, wann sie es schaffen, dass die brücken in nordrhein-westfalen saniert werden, weil die finanzmittel dafür gegeben wurden. dann zum damoklesschwert der rente. das damo klesschwert der rente mit diesen enormen ausgaben, mit der enormen steigerung schwebt über ihnen. wenn sie das problem nicht lösen, wird ihnen spätestens der haushalt um die ohren fliegen. aber auch das problem haben sie nicht gelöst. aber zum schluss ein versöhnliches wort, meine damen und herren: ich bedanke mich auch bei den koalitionsfraktionen für das gute klima im haushaltsausschuss. und zum thema verschwendung darf ich frei nach albert schweitzer zitieren: das einzige, was nicht weniger wird, wenn man es verschwendet, ist die liebe auch unter schwesterparteien, aber leider nicht in diesem haushalt. jetzt hat das wort der kollege eckhardt rehberg, cdu/csu."
