,datum,redeID,vorname,nachname,fraktion,name,inhalt_neu
0,,,,,, ,
1,16.01.2020,ID1914000100,Karl,Lauterbach,SPD,Karl Lauterbach,"herr präsident! meine sehr verehrten damen und herren! was ist das problem, weswegen wir heute zusammengekommen sind, um es zu lösen? in deutschland sterben jedes jahr mehr als menschen, die auf der warteliste für ein spenderorgan stehen; mehr als menschen stehen auf dieser warteliste. das sind sehr hohe zahlen. was dagegen die zahl der gespendeten organe, der spender angeht, muss man feststellen, dass diese nur ungefähr halb so hoch ist wie in unseren nachbarländern. in den nachbarländern werden auf die bevölkerung bezogen zwei- bis dreimal so viele organe gespendet. wir liegen also zurück. wir sind schlusslicht in europa.woran liegt das? ist in deutschland die spendenbereitschaft nicht da? nein, wir haben eine spendenbereitschaft, die hoch ist. prozent der menschen sind der organspende gegenüber positiv eingestellt. will man die organe vielleicht nicht nehmen? nein, auch das ist nicht so. prozent derjenigen, die auf der warteliste sind, wollen auf dieser warteliste sein, wollen ein organ haben. somit gibt es also die bereitschaft, zu spenden, und es gibt die bereitschaft, ein organ zu nehmen.trotzdem kommt das nicht zusammen. woran liegt das? das liegt daran, dass nur sehr wenige, weniger als ein drittel, einen organspendeausweis verfügbar haben und dass dieser in weniger als prozent der fälle bei einer spende, nämlich dann, wenn der hirntod eingetreten ist, eine rolle spielt. in prozent der fälle ist das eine angelegenheit der ärzte und der angehörigen. das war schon so, als ich noch gar nicht im bundestag war. vor mehr als jahren habe ich eine studie mit mehr als dialysepatienten geleitet. damals war das problem genauso wie heute.seitdem haben zahlreiche länder die widerspruchslösung eingeführt, über die wir heute debattieren. europäische länder haben das gemacht. in den ländern, die das gemacht haben, sind die spendenzahlen hochgegangen, zum beispiel in schweden. nachdem dort die widerspruchslösung eingeführt wurde, hat sich die spendenzahl verdoppelt. wieso ist das so? zu viele menschen, die bereit sind, zu spenden, werden nicht zum spender, weil die angehörigen und die ärzte in der situation des hirntodes überfordert sind, diese entscheidung für den verstorbenen zu treffen. mehr als die hälfte stimmt dann nicht zu. das ist das eigentliche problem.das problem ist nicht die organisation der organspende. die organisation ist in deutschland nicht schlechter als anderswo. es ist ja ganz klar: egal wie ich es organisiere ich kann es gut machen oder schlecht : wenn ich das organ nicht habe, macht die organisation keinen unterschied.es ist auch nicht so, dass es hier in deutschland keine bereitschaft gibt, zu spenden die bereitschaft ist da , sondern es ist vielmehr so: es fehlt eine einfache, unbürokratische regelung, wie man zum spender wird. das ist das problem. hier gibt es nun die widerspruchslösung. die widerspruchslösung ist nicht die lösung aller probleme; sie ist aber eine notwendige bedingung dafür, dass wir das schaffen. daher setzen sich fast alle von dem thema betroffenen ärztlichen organisationen, meine kolleginnen und kollegen, dafür ein, zum beispiel die deutsche gesellschaft für urologie, die deutsche gesellschaft für nephrologie, die deutsche transplantationsgesellschaft, die deutsche gesellschaft für chirurgie, die deutsche gesellschaft für internistische intensivmedizin und notfallmedizin. wir alle setzen uns für die einführung der widerspruchslösung ein, weil wir wissen, dass es sonst nicht gehen wird. wir werden es sonst nicht schaffen. die kollegin schmidtke wird darüber nachher reden. ich sage somit: wenn wir es nicht schaffen, diesmal die widerspruchslösung einzuführen wir kämpfen an dieser stelle seit mehr als zehn jahren dafür , dann wird sich erneut nichts ändern, dann werden wir in wenigen jahren die debatte, die wir heute haben, hier erneut führen, weil mit jeder variante der zustimmungslösung das problem nicht zu lösen ist. machen wir uns nichts vor!ich komme zu den ethischen gegenargumenten. immer wieder wird gesagt, die widerspruchslösung möge effizienter sein, das stelle man nicht strittig, in den europäischen ländern, die die widerspruchslösung haben, möge sie wirken, das stelle man nicht strittig, sie sei aber eine unethische lösung. übrigens, wenn wir so denken, dann dürften wir auch keine organe nehmen, die aus den ländern kommen, in denen die widerspruchslösung praktiziert wird. die eurotransplant-länder machen das ja alle. dann müssten sie alle auch konsequenterweise sagen: wir wollen diese organe nicht. diese nimmt aber jeder gerne an. weshalb ist das so? man muss natürlich vorsichtig sein. es wird immer gesagt: das ist dann eine pflicht zur spende. -das ist natürlich falsch. das ist unsinn. es gibt keine pflicht zur spende. es gibt eine pflicht, nein zu sagen, wenn ich zu den wenigen gehören will, die zwar nicht spenden wollen, aber gerne ein organ bekommen wollen. von diesen menschen kann ich wenigstens verlangen, dass sie bereit sind, dass sie den mut haben, nein zu sagen. das ist das wenigste. das ist aus meiner sicht auch in der tradition der christlichen ethik. das steht in dieser form schon mehr oder weniger in der bibel: das, was ich will, was mir selbst zugutekommt, muss ich auch bereit sein anderen zu geben. das ist in der tradition der aufklärung. das hat kant so ausgedrückt. das ist die goldene regel. es ist unethisch, ein organ nehmen zu wollen, aber nicht bereit zu sein, zumindest nein zu sagen, wenn man nicht bereit ist, zu spenden. das ist eine unethische haltung. jetzt hat das wort die kollegin hilde mattheis."
2,16.01.2020,ID1914000200,Hilde,Mattheis,SPD,Hilde Mattheis,"herr präsident! liebe kolleginnen und kollegen! es gibt keinen signifikanten zusammenhang zwischen der wirkung einer widerspruchsregelung und den spendenzahlen. den gibt es nicht. das hier zu suggerieren, ist ein fatal falscher ansatz. wir, die wir einen gesetzentwurf zur stärkung der entscheidungsbereitschaft einbringen, sagen: eine spende muss eine spende bleiben, ein aktiver, freiwilliger und selbstbestimmter akt von menschen, die in einem höchstmaß von solidarität für andere menschen etwas geben. das ist die grundlage von solidarität: freiwillig, selbstbestimmt etwas zu geben. das ist auch das menschenbild, das von unserem grundgesetz geprägt wird, nämlich die würde nicht zu verletzen über den tod hinaus. alle vergleiche, zum beispiel mit einer obduktion, verbieten sich hier; denn bei einer organspende handelt es sich nicht um den körper eines leichnams.wir wissen die zahlen werden angeführt : ja, in spanien gibt es eine höhere spendenzahl. selbst die dso sagt: wir bekommen gar nicht alle spendenbereitschaften gemeldet. das liegt an den strukturen. wir setzen auf dem gesetz, das wir im april letzten jahres verabschiedet haben, auf, nämlich zu sagen: man muss den menschen die möglichkeit geben, sich im laufe ihres lebens unter bestimmten voraussetzungen und in bestimmten situationen mit dem thema organspende zu befassen. wir wollen, dass sich die behörden da einbringen. wir wollen, dass dieses thema beim erste-hilfe-kurs für den führerschein behandelt wird. wir wollen, dass die hausärzte die möglichkeit bekommen mit einer leistungshinterlegung , in ihren sprechstunden alle zwei jahre mit ihren patientinnen und patienten darüber zu sprechen. wir wollen aber nicht auf die trägheit und den unwillen von menschen setzen, sich damit nicht zu befassen. denn das schafft kein vertrauen.liebe kolleginnen und kollegen, spendenbereitschaft bedeutet: man hat ein höchstmaß an vertrauen in das, was da passiert, in die ärztinnen und ärzte, in die menschen, die einen begleiten. da sage ich: das, was die widerspruchslösung sie nennt sich ja: doppelte widerspruchslösung suggeriert, ist nicht der fall. die angehörigen haben kein recht, nein zu sagen. vielmehr werden sie zu zeugen degradiert. ich nenne zwei punkte aus einem kommentar von heribert prantl, die mich besonders beeindruckt haben.das erste ist: menschen sind nicht nur individuen; sie sind beziehungsmenschen. sie stehen in beziehungen zueinander. ich darf nicht außer acht lassen, dass es hier auch beziehungen gibt. angehörige müssen mit dem, was da passiert ist, weiter leben, egal wie. sie brauchen eine möglichkeit, sich zu artikulieren; sie sollen nicht als zeugen auftreten, sondern den willen des angehörigen entsprechend verkörpern und nicht dastehen als diejenigen, die im prinzip keinen einfluss haben.das zweite, was heribert prantl zu recht anspricht, ist der ökonomische aspekt dieser doppelten widerspruchslösung: menschen werden degradiert, und die würde des menschen wird verletzt. das ist ein zentraler punkt. da müssen wir nein sagen. das geht nicht an dieser stelle und an anderen stellen übrigens auch nicht. von daher werben wir dafür: schauen sie genau hin, wenn sie es nicht schon getan haben. gucken sie auf dieses gesetz, das genau an dem punkt ansetzt, den uns alle untersuchungen bestätigen: es geht darum, die strukturen zu unterstützen, transparent zu machen, mit hohem einsatz in den kliniken arbeiten zu können. darum geht es. es geht auch darum, den menschen ihre selbstbestimmung nicht zu nehmen.vielen dank. jetzt erteile ich das wort dem kollegen detlev spangenberg."
3,16.01.2020,ID1914000300,Detlev,Spangenberg,AfD,Detlev Spangenberg,"herr präsident! sehr geehrte damen und herren! mehr vertrauen in die organspende der ansatz der afd nennt sich vertrauenslösung. die widerspruchslösung kann die zielsetzung, mehr spender zu erreichen, gefährden. wir haben unterschiedliche zahlen von spendern, aber das liegt nicht bloß an dem system, sondern auch daran, wie der tod festgestellt wird denken sie dabei an spanien , zum beispiel hirntod oder herztod. das sind große unterschiede, die auch die anzahl der spender bzw. die spendenmöglichkeit beeinflussen. die spendenbereitschaft wird nicht infrage gestellt, auch nicht von der afd, wie das fälschlicherweise, wie üblich, in der presse dargestellt wurde.wir alle haben in den letzten wochen post erhalten: zustimmung für die widerspruchslösung, aber auch verweigerung, weiterhin spender zu sein, wenn die widerspruchslösung kommt. auch das haben wir bekommen. das haben menschen geschrieben, die ihren ausweis wieder abgeben wollen, wenn diese art der willenserklärung so formuliert wird. vertrauen, meine damen und herren, ist das wichtigste bei diesem hochsensiblen thema. ich erinnere an die manipulationen von und in großhadern, berlin, heidelberg, bremen und göttingen, dann ist das natürlich nicht hilfreich, menschen dafür zu gewinnen, zu spenden. das mittel heißt vertrauen, immer wieder vertrauen. die widerspruchslösung, so sagen einige, ist die faktische enteignung des menschlichen körpers, das vermissen jeglicher sensibilität bei diesem hochemotionalen thema, und sie ignoriert auch hartnäckig, dass bei einem versäumnis, sich gegen die widerspruchslösung zu erklären, dies auch eine entscheidung über leben und tod bedeuten kann. das kann man diesen leuten nicht einfach wegnehmen. diese überlegung haben sie.ich gehe auf drei themenbereiche ein.erstens: einschränkung der persönlichen freiheit. minister spahn hat, wenn ich das richtig gelesen habe, im spiegel die abenteuerliche definition formuliert, dass wir an die freiheit derer denken müssen, die das organ erhalten möchten. meine damen und herren, so weit kann es nicht gehen, dass sich jemand damit beschäftigen muss zugunsten anderer, weil einer etwas erreichen will. die freiheit des einen ist genauso viel wert wie die freiheit des anderen. es geht hier, meine damen und herren, um menschen, die sich mit diesem problem nie beschäftigt haben und sich damit auch nicht beschäftigen wollen. wir müssen zur kenntnis nehmen, dass manche menschen das nicht tun wollen. das zwingen zu einer entscheidung ist der völlig falsche weg. spenden ja, aber nicht zu einer erklärung gezwungen werden.der nächste punkt: rücksicht auf persönliche ängste. keine sensibilität denen gegenüber, die vor diesem thema angst haben. niemand ist am leid der auf ein organ wartenden schuld. es kann daraus auch keine forderung an fremde dritte abgeleitet werden, bei allem verständnis für deren leid. so weit geht es nicht. wir haben auch kein recht, über ängstliche und zaudernde den moralischen zeigefinger zu heben bzw. eine moralische keule zu schwingen. dieses recht steht keinem zu.als letzten teil: die rechtssystematik. schweigen gilt nun einmal bei uns in deutschland grundsätzlich als keine willenserklärung; im zweifel heißt es nein.die kritiker, die das bestreiten, führen dann immer § absatz bgb umschreibung beim grunderwerb oder § hgb, wo geregelt ist, dass verträge auch durch schweigen zustande kommen, oder das testament an.meine damen und herren, ich sage das auch für die bevölkerung deutlich: diese argumente ziehen nicht, weil dort immer eine beziehung zwischen den partnern besteht, bestanden hat. dort steht also eine willenserklärung nicht einfach im leeren raum, sondern diese willenserklärung ist ausgesprochen worden; sie ist vorhanden. insofern passen diese dinge nicht. schweigen heißt grundsätzlich nein. so ist das bei uns, in unserem rechtssystem, nach wie vor. es wird eine weitere befürchtung ausgesprochen, dass diese widerspruchslösung ein einfalltor ist und am recht des eigenen willens vorbeigeht. sie formuliert eine neue rechtsfolge bzw. einen neuen tatbestand. eine spende, so professor dr. kluth von der uni halle, kann niemals als solidarisches pflichtverhalten formuliert werden.auch die deutsche stiftung patientenschutz, eugen brysch, schreibt: schweigen kann keine zustimmung sein. nur vertrauen ist hier die lösung; das ist der ansatz der afd. wir möchten gerne die zustimmungslösung, aber mit den ansätzen, die wir in unseren antrag eingearbeitet haben. dabei muss die patientenverfügung immer vorrang vor jeder anderen entscheidung haben. das ist unser grundsatz. lassen sie mich noch eines sagen: einen -jährigen automatisch als spender zu verpflichten, bringt auch gefährliche interpretationen mit sich, meine damen und herren. wir gehen sonst im strafrecht teilweise bis jahre hoch. hier wollen wir -jährige verpflichten. das, denke ich, meine damen und herren, sollte man nicht tun.ich schließe und sage eindeutig: es geht nicht darum, die meinung derer hervorzuheben, die dafür sind, meine damen und herren. darum geht es nicht, sondern darum, um die zu werben, die einfach noch kein vertrauen haben, diesen schritt, spender zu werden, zu gehen. um diese menschen müssen wir uns bemühen, meine damen und herren. allein das ist unsere aufgabe.vielen dank. dr. claudia schmidtke ist die nächste rednerin."
4,16.01.2020,ID1914000400,Claudia,Schmidtke,CDU/CSU,Claudia Schmidtke,"herr präsident! sehr geehrte damen und herren! in der dritten, der abschließenden debatte zur künftigen ausrichtung der organspende möchte ich über das sprechen, was im englischsprachigen raum elephant in the room , hier sozusagen der elefant im plenarsaal, genannt wird, also über das, was das thema eigentlich bestimmt, worüber wir aber ungern sprechen, weil es bequemer ist, es zu verdrängen: den tod.damit meine ich nicht die frage, ob der hirntod der tod ist diese wissenschaftliche tatsache wird von allen vorliegenden entwürfen anerkannt , sondern ich meine die belastung der organspendedebatte mit dem größten vorstellbaren tabuthema: unserer sterblichkeit.zivilisation begann mit der bestattung der leichname unserer angehörigen. es ist ein fester bestandteil unserer kultur, dass wir abschied nehmen wollen von dem menschen, der uns verlässt. und es schmerzt uns, wenn dem auch toten körper eines angehörigen oder freundes schaden zugefügt wird. diese werte sind eine feste grundlage unserer gesellschaft, und es fällt schwer, sie verletzt zu sehen.doch seit der zweiten hälfte des . jahrhunderts ist klar: jeder mensch kann dafür sorgen, dass mit seinem tod andere menschenleben gerettet werden. zu lebzeiten ist dies den wenigsten menschen vergönnt. heute aber kann man es als erbe hinterlassen und, statistisch betrachtet, drei leben von menschen retten, die gemeinsam mit ihren angehörigen und freunden in tagtäglicher anspannung teilweise über jahre darauf hoffen.seit bestehen der transplantationsmedizin ist folgendes gegeneinander abzuwägen: die unverletzlichkeit eines leichnams, den wir begraben, mit dem höchsten gut, einem leben, das gerettet werden kann. jeder mensch hat diese abwägung für sich und seinen körper zu treffen; auch daran will keiner der vorliegenden gesetzentwürfe etwas ändern.die widerspruchsregelung geht jedoch davon aus, dass der wert des zu rettenden lebens in unserer gesellschaft so hoch ist, dass, solange der widerspruch in jedem einzelfall respektiert wird, von einer zustimmung ausgegangen werden kann, ja sogar muss. liebe kolleginnen und kollegen, das ist alles, worum es geht.was diese einfache frage der abwägung jedoch kompliziert macht, ist die überschattung durch das thema, über das wir ungern sprechen: den tod. wenn wir nicht über ihn sprechen, ihn ignorieren, helfen uns die althergebrachten wertesysteme, die uns jahrhundertelang begleitet haben, dabei, ihn ertragen zu können. das verstehe ich gut.doch spätestens seit um uns herum fast ganz europa alles christliche nationen, alle gehören zu unserer wertegemeinschaft den schritt zur widerspruchsregelung gegangen ist, muss deutschland die frage gestellt werden, ob man sich weiterhin in diese verdrängung zurückziehen kann, ob wir schicksale wie das von marius schäfer weiterhin ertragen wollen.marius ist heute hier auf der tribüne mit seinem vater. er hat als elfjähriger, vor acht jahren, im gegensatz zu den vielen wartenden eine spende erhalten. allerdings: es war die erste lebendspende einer lunge in deutschland. beide eltern haben einen teil von ihrer lunge abgeben müssen, um ihm das leben bis heute, jeden einzelnen kostbaren tag, zu schenken.solch ein schritt ist zuvor bei uns noch nie gewagt worden. er gefährdet nämlich drei betroffene. doch waren marius’ zustand und seine werte so schlecht, dass sich die mutigen ärzte in hannover in letzter minute dazu durchringen mussten; denn in deutschland gab es kein organ für marius. er steht stellvertretend für so viele patientinnen und patienten, die uns in den vergangenen wochen angeschrieben haben.wenn wir heute die entscheidung über die künftige ausgestaltung der organspende treffen, entscheiden wir darüber, was uns wichtiger ist: mit minimalen veränderungen keine spürbare wirkung auf das schicksal der betroffenen zu entfalten und uns einzureden, dass das etwas mit solidarischen werten zu tun hat, oder ihnen hoffnung zu geben mit einer tatsächlichen veränderung, die nahezu alle unsere europäischen partner bereits vollzogen haben. wollen wir das? die zahlen sagen ja. die fachleute, auch die dso, sagen ja. die mehrheit der deutschen sagt ja. die patienten hoffen inständig auf ein ja.ich bitte sie: gehen sie den schritt! die widerspruchsregelung respektiert die entscheidung jeder einzelnen und jedes einzelnen ebenso wie die anderen entwürfe, doch nur bei ihr hat das zu rettende leben den stellenwert, der unserer gesellschaft guttut. jetzt erteile ich das wort der kollegin annalena baerbock."
5,16.01.2020,ID1914000500,Annalena,Baerbock,BÜNDNIS 90/DIE GRÜNEN,Annalena Baerbock,"herr präsident! sehr verehrte kolleginnen und kollegen! sehr verehrte gäste auf der tribüne! wir sind heute hier, um leben zu retten. das eint beide gesetzentwürfe. beiden gesetzentwürfen sind intensive gespräche mit betroffenen, mit krankenhäusern, mit ärztinnen und ärzten, mit angehörigen und mit vielen, vielen menschen in diesem land vorausgegangen. aber diese debatten haben uns allen eben auch noch mal verdeutlicht, dass das leben und der tod so vielfältig, so unterschiedlich sind wie wir menschen selbst. deswegen kann es aus unserer sicht nicht nur diese eine sichtweise auf die organspende geben, die dann vielleicht auch noch der staat verordnet.nein, es gibt vielfältige sichtweisen. eltern das haben einige zu recht angesprochen warten jeden tag händeringend auf dieses eine organ für ihr kind. das kann man sich als nichtbetroffene kaum vorstellen. es gibt aber auch die ehefrau, die mutter, die jahrelang auf ein herz wartet, die aber sagt: wenn ich nicht weiß, dass dieses herz freiwillig gespendet wurde, dann will ich gar nicht mehr auf der transplantationsliste sein. da sind die angehörigen. all diese sichtweisen müssen wir respektieren, sehr verehrte kolleginnen und kollegen. daher hat unsere gruppe einen gesetzentwurf zur stärkung der entscheidungsbereitschaft bei der organspende vorgelegt, der zum einen die spenderzahlen, zum anderen aber vor allen dingen das ist der entscheidende unterschied die de-facto-transplantationszahlen in den krankenhäusern in den blick nimmt. darum geht es am ende doch: es geht darum, leben zu retten und das selbstbestimmungsrecht eines jeden einzelnen zu wahren. ich weiß: wir versuchen hier heute alle unser bestes, aber ich sage zu den argumenten, die von vorrednern vorgebracht wurden: aus meiner sicht verkennt die widerspruchsregelung, dass man nicht einfach regelungen aus anderen ländern auf die deutsche situation, auf die rechtslage und die situation in den krankenhäusern, übertragen kann. man verkennt damit die realität hier bei uns in deutschland, und darum geht es. erstens. in anderen europäischen ländern darauf werden andere rednerinnen und redner noch eingehen gilt der herztod als ausreichend, in deutschland nicht. deswegen können sie diese zahlen nicht vergleichen. niemand will daran hier im hohen hause etwas ändern. zweitens. herr lauterbach, sie verweisen immer auf spanien. sie wissen aber ganz genau: die situation in spanien der gesamte gesundheitsausschuss war da ist so anders, weil sich dort in den krankenhäusern etwas verändert hat. wissen sie, was unser problem in den krankenhäusern ist, selbst wenn alle menschen spenderinnen und spender wären? nur von , prozent derjenigen, die in krankenhäusern für hirntot erklärt worden sind, wurden überhaupt organe transplantiert weil sie nicht gemeldet wurden. da müssen wir ran. wenn wir diese zahlen verdreifachen, haben wir genug organe, sehr verehrte damen und herren. der dritte punkt darauf werden kollegen aus unserer gruppe noch eingehen ist unser grundgesetz, und das gilt nun einmal nicht in anderen europäischen ländern. die haben ihre eigene geschichte. die haben ihre eigene verfassungsgeschichte. unsere verfassungsgeschichte schreibt in artikel und zu recht die aus unserer geschichte hervorgegangene besondere verantwortung in unser grundgesetz. da gilt es, das selbstbestimmungsrecht eines jeden einzelnen zu respektieren, meine sehr verehrten damen und herren. deswegen muss man immer das mildeste mittel wählen, um an das ziel zu kommen. wir haben das gleiche ziel: leben retten. wir wählen aber ein anderes mittel. ich möchte deutlich machen denn das wird sicherlich in der debatte noch kommen : wir verteidigen hier nicht den status quo. wir verteilen nicht einfach mehr infobroschüren. nein! unsere gesellschaft ist solidarisch. prozent der menschen wollen spenden, aber nur prozent haben einen ausweis. diesen prozent wollen wir ermöglichen, sich ganz einfach zu registrieren. es ist ein großer unterschied, ob ich einen pappausweis im portemonnaie habe, das ich nicht dabei habe, wenn ich ein kleid trage, oder das ist unser vorschlag ob ein onlineregister geschaffen wird, in das sich jeder eintragen kann.ich weiß, dass gleich vom bürgeramt die rede sein wird. ja, in manchen bürgerämtern ist es nicht schön; in anderen ist es das aber. da bekommt man alle informationen. man muss sich aber nicht vor ort informieren. man kann zum hausarzt gehen, und man kann vor allen dingen nach hause gehen und sich nach intensiver debatte online jederzeit, jede minute, jede stunde registrieren. das ist der dreh- und angelpunkt unseres vorschlages, sehr verehrte damen und herren. er ist so wichtig, weil dieser dreh- und angelpunkt an der situation in den krankenhäusern etwas verändert, weil die ärztinnen und ärzte sofort auf das onlineregister zugreifen können. sie müssen nicht fragen: hat der patient einen organspenderausweis? sie müssen nicht die angehörigen fragen: wie war es denn noch mal? sie können direkt darauf zugreifen. damit ändert sich an dem hauptproblem, nämlich dass zu wenig gemeldet und transplantiert wird, in der realität wirklich etwas, sehr verehrte damen und herren. wir stimmen hier heute über eine hochethische frage ab: wie kommen wir zu mehr transplantationen? wie retten wir mehr leben? wir stimmen aber auch darüber ab: wem gehört der mensch? in unseren augen gehört er nicht dem staat, nicht der gesellschaft. er gehört sich selbst, ungefragt, ohne widerspruch. daher bitte ich sie um zustimmung zur entscheidungslösung, um mehr menschenleben hier gemeinsam zu retten.herzlichen dank. nächster redner ist der kollege dr. hermann otto solms."
