,datum,redeID,vorname,nachname,fraktion,name,inhalt_neu
117,04.03.2021,ID1921511700,Johannes,Steiniger,CDU/CSU,Johannes Steiniger,"sehr geehrte frau präsidentin! liebe kolleginnen und kollegen! wir erleben, wenn wir im wahlkreis unterwegs sind nicht nur in coronazeiten , durchaus frust über die digitalisierung in deutschland, sei es im hinblick auf die digitalisierung der verwaltung, die digitalisierung der bildung oder auch die digitalisierung des gesundheitssystems, wenn es montags mal wieder heißt: die infektionszahlen können wir ihnen nicht genau darstellen, weil nicht alle gesundheitsämter am wochenende melden. wir sehen also: digitalisierung ist ein ganz wichtiger standortfaktor. das ist auch ein wichtiger standortfaktor für den finanz- und rechtsstandort in deutschland. herr keuter, nachdem ich mir diese ahnungslose rede angehört habe, die sie gerade gehalten haben, die zeigt, dass sie offensichtlich keine ahnung von blockchain, dezentralitäten und anderem haben, bin ich froh, dass sie keine verantwortung in deutschland haben und dass sie nie verantwortung für dieses land haben werden. wir machen hier einen ersten schritt mit dem vorliegenden gesetzentwurf zur einführung von elektronischen wertpapieren. damit schaffen wir ein neues stammgesetz. jetzt könnte der eine oder andere, der genau zuhört, vielleicht denken: elektronische wertpapiere, was soll das denn jetzt schon wieder sein? ein elektronisches papier, das gibt es doch eigentlich gar nicht. tatsächlich ist es so: im begriff wertpapier steckt das wort papier schon drin. wenn ich eine forderung oder ein recht habe, dann kann ich das nicht anfassen; deswegen wurden die forderung bzw. das recht in der vergangenheit immer als urkunde verbrieft. eine urkunde ist eindeutig, ist klar festgelegt und wird, wie es eben auch dargestellt worden ist, im zweifel in einem tresor eingeschlossen. dann ist das klar. was jetzt passiert, ist folgendes: wir holen die möglichkeit der verbriefung als urkunde, als papier, nun mit neuen technologischen möglichkeiten ins . jahrhundert. stichwort ist die sogenannte blockchain-technologie, die es ermöglicht, transaktionen dezentral auf verschiedenen rechnern eindeutig verschlüsselt abzusichern. so haben wir genau das, was wir vorher als papier hatten, jetzt über die blockchain-technologie als digitales medium. es ist also völlig falsch, herr keuter, was sie gerade zu dieser technologie gesagt haben. wir haben jetzt also die möglichkeit, besitzverhältnisse papierlos und digital rechtssicher abzubilden. blockchain ist sozusagen der ersatz für das papier. was den gesetzentwurf betrifft, könnte man natürlich sagen: das kommt alles vielleicht etwas spät. in der schweiz beispielsweise gibt es entsprechende regelungen schon, ebenso in luxemburg. kollege steiniger, gestatten sie eine frage oder bemerkung von herrn keuter? ja. bevor er eine intervention macht. vielen dank, herr kollege. sie haben mich gerade angesprochen und mir unkenntnis vorgeworfen. ich finde es schon relativ vermessen von einem juristen, einem banker erklären zu wollen, wie das wertpapiergeschäft funktioniert. das war damals übrigens mein spezialgebiet, und ich habe das geschäft von der pike auf, also von der effektenkasse her, gelernt. sie als jurist müssten doch eigentlich wissen, was die verbriefung, was eine urkunde bedeutet. da kann man nicht sagen: das liegt plötzlich digital vor. sie haben mir außerdem gerade unkenntnis über die blockchain-technologie vorgeworfen. sie haben offensichtlich ihren eigenen gesetzentwurf nicht gelesen, worin explizit gesagt wird, dass sie sich nicht auf eine technologie festlegen wollen. deshalb habe ich in meiner rede dieses ganze technologiethema ausgespart. sie haben offensichtlich ihre rede geschrieben, ohne zu wissen, was ich sagen werde. sie wussten, dass sie auf mich erwidern müssen; dann hätten sie aber bitte dieses thema aussparen können. das thema blockchain habe ich überhaupt gar nicht erwähnt. wie kommen sie darauf? vielleicht nehmen sie, wenn sie schon die technologie ansprechen, auch einmal bezug auf ihren eigenen gesetzentwurf, wo es nämlich ganz explizit darum geht, dass keine technologiefestlegung erfolgen soll. vielen dank. herr kollege keuter, herzlichen dank für ihre frage, die mir die gelegenheit gibt, sie zuerst darauf hinzuweisen, dass sie das nächste mal besser googeln müssen. ich bin kein jurist, sondern mathematiker, und kenne deshalb die kryptografischen verfahren, die hinter der distributed-ledger-technologie das ist der oberbegriff von blockchain-technologien stecken, sehr genau. was sie in ihrer rede gesagt haben, hat offenbart, dass sie überhaupt nicht verstehen, welche chancen diese technologie bietet, nämlich dass wir das, was wir früher in papierform gemacht haben, heute genauso sicher, fälschungssicher und eindeutig im digitalen bereich abbilden können. herzlichen dank für die offenbarung dieser ahnungslosigkeit! ich war gerade dabei, auszuführen: es wäre natürlich schöner gewesen, wenn wir diesen gesetzentwurf schon etwas früher gehabt hätten. wir als unionsfraktion haben schon im jahr ein eckpunktepapier gemacht. ich sehe thomas heilmann, der damals als kollege unserer fraktion maßgeblich daran mitgearbeitet hat, ebenso heribert hirte und andere. im märz gab es dann das eckpunktepapier von bmf und bmjv. es ist dringend notwendig, dass jetzt endlich etwas passiert. ich sage auch: das ist jetzt ein erster schritt in dieser legislatur, und es ist im grunde genommen ein in text gegossener arbeitsauftrag für die nächsten jahre. wenn wir uns mit dem gesetzentwurf beschäftigen, werden wir noch über ein paar punkte sprechen müssen, zum beispiel über die frage, wie wir mit fondsanteilen umgehen. derzeit ist die dezentrale abbildung nur für schuldverschreibungen möglich. wir können uns durchaus vorstellen, hier auch fondsanteile zu übernehmen. wir müssen über die fragen von abtretung und übertragung sprechen. ich finde auch, eine evaluation eines solchen gesetzes erst nach fünf jahren ist viel zu spät. wenn wir schon sagen, dass wir hier einen ersten schritt machen, dann sollten wir auch relativ schnell in eine evaluation gehen. alles in allem: es ist ein gutes gesetz, das zwar ein bisschen langweilig daherkommt, aber es macht etwas für die attraktivität unseres finanzstandortes. wir wollen, dass die unternehmen in deutschland bleiben. wir wollen, dass die blockchain-start-ups in deutschland gegründet werden. und wir wollen auch, dass die infrastruktur in deutschland weiterentwickelt wird. das hier ist ein guter erster schritt in gesetzesform. herzlichen dank. für die fdp-fraktion spricht nun der kollege frank schäffler."
118,04.03.2021,ID1921511800,Frank,Schäffler,FDP,Frank Schäffler,"frau präsidentin! meine lieben kolleginnen und kollegen! das ist jetzt der große wurf dieser koalition, was die blockchain-technologie betrifft. da lachen, ehrlich gesagt, die hühner. das hat mit blockchain eigentlich nichts zu tun. das ist ein blockchain-verhinderungsgesetz, was sie hier vorlegen. denn blockchain hat per definition keine dritte aufsicht, keine dezentrale aufsicht, die von irgendeinem unternehmen gesteuert wird oder die vom staat beaufsichtigt wird. bei der blockchain wollen sich die marktteilnehmer vielmehr gegenseitig kontrollieren. das ist der grundgedanke. nachdem sie hier vor zwei jahren eine blockchain-strategie angekündigt haben und dies das ergebnis dieser blockchain-strategie ist, ist das wirklich ziemlich lächerlich und ziemlich bescheiden, was sie hier vorlegen. was sie hier machen, ist im grunde das, was in europa vielfach schon längst existiert: in luxemburg und in frankreich gibt es bereits elektronische wertpapiere. sie beziehen das auf eine ganz kleine nische, indem sie sich nur auf die schuldverschreibungen und auf teile von fonds konzentrieren, und damit glauben sie, sie könnten hier den großen standortvorteil ausspielen. das wird aus meiner sicht nicht gelingen. im gegenteil: sie werden dafür sorgen, dass die heutigen monopolisten im markt, clearstream, ihr monopol behalten werden; denn das, was sie hier anlegen, führt dazu, dass das einzige unternehmen, das hiervon profitiert, clearstream selbst ist, und deshalb ist das eben das gegenteil dessen, was sie uns suggeriert haben. ich will noch einen anderen aspekt ansprechen, weil sie ja noch andere gesetzgebungsvorhaben vorgelegt haben und das ja eigentlich der letzte große wurf in dieser legislaturperiode sein soll, um die wertpapierkultur in deutschland tatsächlich voranzubringen. dieser wurf ist nun wirklich lächerlich; denn sie setzen letztendlich nur eu-richtlinien um, fast schon eins zu eins, und sie machen eigentlich nichts, um die wertpapierkultur in deutschland wirklich voranzubringen. wo ist denn die reform der riester-rente? wo ist denn die reform der aktienkultur in deutschland, die der besteuerung? stattdessen machen sie jetzt eine finanztransaktionsteuer. das ist eigentlich das, woran sie weiter arbeiten. aber tatsächlich machen sie eigentlich für die aktienkultur, für die sparkultur, für all das, was jetzt in der null- und negativzinsperiode eigentlich notwendig wäre, nichts. und das muss man ihnen ins stammbuch schreiben. damit versündigen sie sich im kern an millionen von sparern in diesem land. vielen dank. das wort hat der abgeordnete jörg cezanne für die fraktion die linke."
119,04.03.2021,ID1921511900,Jörg,Cezanne,DIE LINKE,Jörg Cezanne,"frau präsidentin! meine damen und herren! bei den vorliegenden gesetzentwürfen geht es um die möglichkeit, wertpapiere nicht auf papier, sondern in elektronischer form auszugeben. weiterhin sollen vergütungen, die institute erhalten, die mit wertpapieren sowie pfandbriefen und ähnlichen papieren handeln, eu-weit einheitlich geregelt werden. gegen eine vereinfachung von verfahren durch digitalisierung ist nichts einzuwenden; sie ist zeitgemäß. sie muss allerdings sicher sein und darf keine neuen schlupflöcher zur umgehung von bestehenden regulierungen öffnen. dass dies bei den vorliegenden gesetzen vollständig gegeben ist, darauf werden wir als linke in den kommenden beratungen ein besonderes augenmerk legen. und weiter: wenn durch eine finanzinnovation, die auf der blockchain- oder vielleicht auch auf einer weniger energieintensiven distributed-ledger-technologie beruht, banken als zwischenhändler oder abwicklungsstellen von finanzgeschäften verzichtbar werden, so darf dies nicht zu einem verlust an der notwendigen öffentlichen kontrolle führen. der banken- und wertpapierhandelssektor unterliegt bisher jedenfalls einer wenngleich noch zu schwachen regulierung. wenn umsätze von diesen bisher kontrollierten akteuren weggehen, muss die aufsicht zumindest auf gleichem niveau gewahrt bleiben. elektronischer handel erlaubt auch eine schnellere elektronische aufsicht. es muss also sichergestellt werden, dass diese neuen möglichkeiten genutzt werden, um geldwäsche, terrorfinanzierung oder steuerhinterziehung in zukunft besser als heute im auge behalten zu können. ob die bundesregierung bei der gewährleistung der staatlichen aufsicht die nötige entschlossenheit an den tag legt, wage ich zu bezweifeln. mit dem gesetz über die beaufsichtigung von wertpapierinstituten werden aufsichtsregeln, die bisher im kreditwesengesetz klar geregelt sind, aus diesem herausgelöst. damit einher geht eher eine aufweichung der regulierung und der reichweite staatlicher finanzaufsicht. das lehnen wir ab. und insgesamt ist es ja nicht gerade so, dass die finanzmärkte an zu geringer geschwindigkeit, zu niedrigen umsätzen oder zu wenigen finanzprodukten leiden. das gegenteil ist der fall: zu viele rein spekulative produkte ohne echten wert für die wirtschaftliche entwicklung werden gehandelt und bergen oft ein großes risiko. eine finanztransaktionsteuer, die alle finanzgeschäfte mit einer geringen steuer belegt, wäre neben einer stringenten regulierung ein mittel, diese risiken gering zu halten. um finanzumsätze zu entschleunigen, die orientierung auf die realwirtschaft zu stärken und spekulationen zu verteuern, ist sie weiterhin dringend nötig. es wäre deshalb gut, wenn die deutsche regierung die portugiesische ratspräsidentschaft bei ihrer neuen initiative in diesem bereich unterstützen würde. vielen dank. das wort hat lisa paus für die fraktion bündnis /die grünen."
120,04.03.2021,ID1921512000,Lisa,Paus,BÜNDNIS 90/DIE GRÜNEN,Lisa Paus,"frau präsidentin! meine damen und herren! drei gesetze der finanzmarktregulierung in drei minuten: es geht zweimal um die umsetzung von europäischem recht, und es geht einmal um ein neues deutsches gesetz. ich kann schon vorab sagen: wir begrüßen grundsätzlich, dass diese gesetze jetzt vorliegen, weil sie eine sinnvolle antwort auf die veränderungen auf dem finanzmarkt sind und tatsächlich dafür sorgen, dass unsere finanzmarktregulierung zeitgemäß bleibt. von daher: gut, dass diese gesetze heute vorliegen. bei einem der gesetze zur umsetzung von der europäischen auf die deutsche ebene geht es um die aufsicht über wertpapierfirmen. da gibt es jetzt neue europäische regeln statt eines nationalen flickenteppichs, und das ist auch wirklich wichtig, herr keuter; denn die bedeutung von solchen wertpapierfirmen wie blackrock & co ist eben seit deutlich gestiegen. deswegen brauchen wir da einen entsprechenden europäischen rahmen. außerdem begrüßen wir sehr, dass diese größeren wertpapierfirmen jetzt ökologische, soziale und governance-risiken offenlegen müssen ein klarer grüner erfolg, den wir im europäischen parlament hereinverhandelt haben. auch deswegen begrüßen wir dieses gesetz. im zweiten eu-umsetzungsgesetz geht es tatsächlich um ich benutze den englischen ausdruck covered bonds; in deutschland kennen wir solche anleihen als pfandbriefe. das gute an diesem gesetz ist, dass sich hohe deutsche standards auf der europäischen ebene weitgehend durchgesetzt haben. auch von daher begrüßen wir dieses gesetz in der deutschen umsetzung. wir werden es in der anhörung wahrscheinlich noch genauer anschauen. der deutsche pfandbrief ist ja sehr sicher. der ist ja sogar sicher, wenn die pfandbriefbank pleitegeht. allerdings wollen wir uns im rahmen der anhörung noch einmal genauer anschauen, wie die pfandbriefbanken in deutschland insgesamt aufgestellt sind; wir erinnern uns, dass es zumindest mal ein problem mit der hre gegeben hat. auch das ist, glaube ich, einen blick wert. beim dritten gesetz ist noch nicht so viel lob angebracht; denn das beste, was man über dieses gesetz sagen kann, ist, dass es vorliegt, mit anderthalb jahren verspätung das ist ja schon bei den verschiedenen akteuren hier jetzt deutlich geworden , und dass man jetzt mit dem thema e-wertpapiere anfängt. aber mit diesem gesetz schaffen wir es maximal, an einige europäische länder heranzureichen. wir sind weit davon entfernt, in irgendeiner art und weise vorreiter in diesem bereich zu sein. sie fangen jetzt mit einem bereich an das ist auch schon genannt worden : schuldverschreibungen und fondsanteilsscheine. die frage ist: warum soll das noch nicht für aktien gelten? beispielsweise führen wir jetzt registerführer ein. das ist erst mal grundsätzlich eine gute sache. da wundert man sich aber, warum jetzt das eigenkapital dafür auf euro präzisiert worden ist. da wollen wir auch noch einmal wissen: was hat das für konsequenzen für die markteinführung? es gibt weitere fragen. was ist zum beispiel mit kryptoverwahrern? all diese fragen sind nicht geklärt. wir werden in der anhörung sicherlich einen ersten weiteren schritt machen. aber da ist völlig klar: das kann in diesem bereich nur der anfang sein. von daher: lassen sie uns unsere arbeit tun, diese gesetze hier vernünftig beraten und dann auch verabschieden. das wort hat der kollege johannes schraps für die spd-fraktion."
121,04.03.2021,ID1921512100,Johannes,Schraps,SPD,Johannes Schraps,"vielen dank. frau präsidentin! sehr geehrte kolleginnen und kollegen! wir beraten heute in erster lesung drei gesetzentwürfe der bundesregierung; das ist schon genannt worden. und aus der debatte ist, glaube ich, auch schon deutlich geworden, dass das in einigen bereichen ehrlicherweise sehr technisch ist. wir setzen damit maßgebliche teile der europäischen finanzmarktrichtlinien in nationales recht um. was aber alle drei gesetzentwürfe eint das hat staatssekretärin ryglewski auch gerade schon deutlich gemacht , ist, dass sie alle drei einen wichtigen beitrag zu einem modernen, wettbewerbsfähigeren und transparenteren finanzmarkt in deutschland leisten, verehrte kolleginnen und kollegen. alle drei sind genannt worden. mit dem wertpapierinstitutsgesetz wollen wir ein spezifisches aufsichtssystem für wertpapierfirmen etablieren. das stärkt den verbraucherschutz und ebenso die finanzstabilität. beim cbd-umsetzungsgesetz mögen manche beim blick auf die tagesordnung vielleicht auch an cannabis oder cbd-öle gedacht haben, und bei der einen oder anderen wortmeldung hier vorne mag man auch daran denken, dass davon gebrauch gemacht wurde. darum geht es bei dem gesetz aber nicht jetzt habe ich wahrscheinlich die aufmerksamkeit ; es dient nämlich vielmehr der umsetzung der europäischen covered-bonds-richtlinie. diese richtlinie sieht eine mindestharmonisierung für sogenannte gedeckte schuldverschreibungen vor; das ist genannt worden. viele dieser produkte, wie bei uns eben der pfandbrief, verfügen über eine sehr lange tradition; aber sie sind in den verschiedenen eu-mitgliedstaaten eben auch sehr unterschiedlich ausgestaltet. insofern geht es dabei um schuldverschreibungen, die durch deckungswerte, wie zum beispiel grundpfandrechte oder eben auch öffentliche anleihen, besichert sind. insbesondere für den immobilienmarkt erfüllen diese eine ganz wichtige finanzierungsfunktion. um einen funktionierenden markt auf europäischer ebene zu gewährleisten, ist es ganz wichtig, dass wir nun europaweit diese einheitliche bezeichnung europäische gedeckte schuldverschreibung einführen. schließlich wird mit dem gesetz zur einführung elektronischer wertpapiere das deutsche recht für elektronische wertpapiere geöffnet. das ist nicht nur ein zentraler baustein dieses gesetzespakets das ist deutlich geworden , sondern das ist eben auch teil der blockchain-strategie der bundesregierung. die derzeit zwingende urkundliche verkörperung von wertpapieren in papierform wird um die möglichkeit elektronischer wertpapiere erweitert. die eintragung dieser elektronischen wertpapiere kann auf zwei arten erfolgen, und zwar entweder in einem zentralen register oder in dezentralen kryptowertpapierregistern, kollege schäffler, die auf dieser blockchain-strategie basieren. damit erweitert der gesetzentwurf ganz klar das innovative potenzial dieser technologie für unseren deutschen finanzplatz. wenn sogar die faz , nachdem im letzten jahr der referentenentwurf veröffentlicht wurde, schreibt, dass kaum ein gesetzentwurf im letzten jahr so positiv von den stakeholdern kommentiert wurde, dann muss auch was dran sein und dann kann der so falsch nicht sein. olaf scholz hat völlig zu recht darauf hingewiesen, dass möglicherweise manchen aus nostalgischen gründen die papierurkunde weiterhin lieb und teuer sein wird, dass aber der elektronischen variante die zukunft gehören wird. ich denke, da hat er auch vollkommen recht. wir haben hier in der debatte gemerkt, dass an der einen oder anderen stelle sicherlich noch diskussionsbedarf besteht. kollege schraps. damit komme ich zum schluss, frau präsidentin. in den öffentlichen anhörungen wird sicherlich noch genug zeit und raum für diskussionen sein. ich freue mich auf die weiteren beratungen im ausschuss, und da werden wir sicherlich auch noch mal darüber sprechen können, kollege schäffler, dass diejenigen, die hier am lautesten schreien, dass nicht über die eu-regulierung hinausgegangen wird, immer die sind, die auch im ausschuss am lautesten schreien, wenn über eu-regulierungen hinausgegangen wird. kollege, das müssen sie jetzt wirklich in die ausschussberatungen verlagern. ich bedanke mich für die aufmerksamkeit. die maske bitte aufsetzen! für die cdu/csu-fraktion hat nun der kollege sepp müller das wort."
122,04.03.2021,ID1921512200,Sepp,Müller,CDU/CSU,Sepp Müller,"frau präsidentin! meine sehr geehrten damen und herren! in der jetzigen debatte unterhalten wir uns über die umsetzung von zwei eu-richtlinien sowie über den gesetzentwurf zur einführung von elektronischen wertpapieren. mein kollege johannes steiniger hat schon einiges zu den elektronischen wertpapieren gesagt. lassen sie mich hier also die möglichkeit nutzen, um auf die umsetzung der beiden richtlinien zu sprechen zu kommen. es ist wichtig, dass wir europäische richtlinien eins zu eins umsetzen, weil das ziel ist, dass wir eine kapitalmarktunion schaffen. was heißt das? es darf nicht sein, dass innerhalb europas unterschiedliche aufsichtsregularien in bezug auf wertpapierinstitute gelten, sondern wir brauchen ein gleiches spielfeld, das sogenannte level playing field. das gehen wir mit der umsetzung der beiden richtlinien sowohl bei den pfandbriefen als auch bei den wertpapierinstituten an. was für mich in der jetzigen debatte sehr bezeichnend war, ist, dass von rechts außen, wo man ja immer die deutschen interessen hochhält, gerade auf das pfandbriefgesetz geschimpft wurde. wir werden mit dem pfandbriefgesetz den guten alten deutschen pfandbrief zu einer premiummarke machen. dass gerade sie das kritisieren, zeigt doch, wie zwiegespalten sie in bezug auf das verhältnis eu deutschland sind. wir sind diejenigen, die sagen: was europa nützt, ist gut für deutschland , und deswegen setzen wir uns für die umsetzung der eu-richtlinie ein. interessant war, herr cezanne von den linken, dass sie hinsichtlich der wertpapieraufsicht davon sprachen, dass es schwieriger wird, die wertpapierinstitute zu beaufsichtigen. ganz das gegenteil ist der fall. mit der herausnahme aus dem kreditwesengesetz werden wir die möglichkeit schaffen kollegin paus von den grünen hat das bereits gesagt , internationale wertpapierfirmen viel zielgenauer zu beaufsichtigen. wir werden mit diesem gesetz auch hier: danke für die eins-zu-eins-umsetzung der bafin ein ziehungsrecht geben, sodass sie die möglichkeit hat, große unternehmen explizit zu beaufsichtigen. also, genau das gegenteil ist der fall. mit diesem gesetz werden wir zielgenauer wertpapierunternehmen beaufsichtigen können. herr schäffler, sie haben ja den vogel abgeschossen, indem sie gesagt haben, wir als große koalition hätten für die mitarbeiter und die aktionäre nichts getan. ich möchte an den geschätzten mittlerweile stellvertretenden parteivorsitzenden unseres koalitionspartners kevin kühnert erinnern, der gesagt hat, wir müssten unternehmen kollektivieren, unter anderem bmw. zu was hat das geführt? hatten wir in deutschland über zusätzliche aktionäre, also mehr menschen, die sich am produktivkapital beteiligen. das müsste die spd freuen. vor allem uns freut das; denn mittlerweile gibt es in deutschland mehr menschen, die mit aktien ausgestattet sind, als menschen, die spd wählen, und das ist ein gutes zeichen. in dem sinne freue ich mich auf die weitere debatte. letzter redner in dieser debatte ist der kollege alexander radwan für die cdu/csu-fraktion."
