,datum,redeID,vorname,nachname,fraktion,name,inhalt_neu
12,18.11.2021,ID20301200,Jens,Spahn,CDU/CSU,Jens Spahn,"ich möchte, frau präsidentin, weil ich hier mehrfach erwähnt worden bin, kurz was sagen. sie haben mich angesprochen, und ich reagiere darauf. das ist das, wofür eine kurzintervention vorgesehen ist. das ist eine schwierige lage. das ist übrigens auch eine schwierige lage für eine geschäftsführende regierung mit einer gleichzeitig werdenden neuen mehrheit; daran gibt es überhaupt nichts herumzureden. das ist herausfordernd in vielerlei hinsicht. die lage ist gleichzeitig ernst, so ernst das ist ja das paradox trotz der impfquote, die wir haben , wie sie zu keinem zeitpunkt in dieser pandemie vorher gewesen ist. weil sie mich immer ansprechen: ich habe ihnen am . oktober drei vorschläge gemacht, drei wege aufgezeigt, wie der handlungsrahmen für die länder erhalten werden kann drei! : epidemische lage verlängern, den § infektionsschutzgesetz sehr minimalinvasiv verändern und den § absatz , den sie jetzt streichen. sie sind keinen dieser wege gegangen. das ist ihre entscheidung. sie haben sich für einen anderen weg entschieden: einen gesetzentwurf zu machen, bei dem wir als geschäftsführende regierung auch geholfen haben, ihn zu formulieren und zu entwickeln. sie haben viel nachgebessert, sind auf kritik eingegangen. auch das ist gut, richtig und wichtig, weil das den maßnahmenkatalog erweitert. deswegen ist hier ein stück beides richtig. ich würde mir wünschen, dass die länder mehr möglichkeiten hätten, zu reagieren, weil die dynamik der letzten drei wochen in dieser dimension, glaube ich, wenige vorhergesagt haben und keiner von uns weiß, was sich in den nächsten wochen entwickelt. gleichzeitig ist genauso richtig, dass der gesetzentwurf, den sie vorlegen, im zweifel besser ist, als wenn gar keine regelung gilt. beides ist richtig. aber eins ist auch sehr klar: wenn sie mit ihrer mehrheit, die sie hier haben, entgegen dem, was wir vorgeschlagen haben, was auch ich vorgeschlagen habe, am ende entscheiden, diesen weg zu gehen, dann nehmen sie bitte dafür nicht immer irgendjemand anderen als kronzeugen oder als punchingball. dann müssen sie, wenn sie diese neue mehrheit hier sein wollen, diese verantwortung auch übernehmen. davon kann sie hier keiner entlasten. frau dr. rottmann, möchten sie reagieren? herr spahn, würden sie kurz aufstehen? danke."
13,18.11.2021,ID20301300,Manuela,Rottmann,BÜNDNIS 90/DIE GRÜNEN,Manuela Rottmann,"von mir aus nicht, herr spahn. bleiben sie ruhig sitzen. herr spahn, ich finde das eigentlich gut, was sie gesagt haben, weil wir jetzt in ein gespräch kommen, und das biete ich der union, das bieten wir alle der union an, auch über diese abstimmung heute hinaus. wir sind schon im hauptausschuss auf die union zugegangen. ich habe es in vier jahren opposition nicht einmal erlebt nicht einmal! , dass wir noch während einer laufenden sitzung eine änderung an einem vorschlag der regierungsfraktionen vorgenommen haben. das ist diese woche passiert. ich weiß nicht, wie weit wir noch auf sie zugehen sollen. aber woran es krankt, ist: sie machen keine konkreten vorschläge. sie sagen uns nicht, was genau sie wollen. kommen sie auf uns zu, und wir reden gerne weiter. vielen dank. als nächster redner hat jetzt das wort für die fdp-fraktion michael theurer."
14,18.11.2021,ID20301400,Michael,Theurer,FDP,Michael Theurer,"sehr geehrte frau präsidentin! meine sehr verehrten damen und herren! wir haben die beispiellose situation, dass derzeit parteien, die über eine regierungsbildung verhandeln, für regierungshandeln oder ‑nichthandeln in die verantwortung genommen werden sollen. was wir hier tun, ist, eine gesetzliche grundlage für das handeln der bundesregierung und der länderregierungen zu schaffen. hier übernehmen die fraktionen spd, grüne und fdp verantwortung. auch nach dem, was minister spahn gerade gesagt hat, kann man die bisher amtierende und jetzt geschäftsführende bundesregierung nicht aus ihrer verantwortung für das konkrete regierungshandeln entlassen. die derzeitigen ansteigenden infektionszahlen sind ja seit wochen im gange und hätten beherztes handeln auf der bisherigen rechtsgrundlage erfordert. deshalb müssen sie sich die frage gefallen lassen, warum sie nicht gehandelt haben, meine damen und herren. kollege frei hat eingeräumt, dass die diskussion ihn verwirre, hat aber dann selbst zur verwirrung beigetragen. deshalb ist es wichtig, hier einmal für klarheit zu sorgen. wenn sie behaupten, wir, spd, fdp und grüne, hätten von ihrem gesetzentwurf abgeschrieben, ist das eine klare verdrehung der tatsachen. wir haben den gesetzentwurf eingebracht, im hauptausschuss wurde er behandelt, und sie haben dann einen änderungsantrag eingebracht. sie haben also das parlament belogen, und ich fordere sie auf, das klarzustellen und ihre unwahre behauptung zurückzunehmen. meine sehr verehrten damen und herren, wir sind in einer sehr schwierigen lage. die inzidenzen in manchen kreisen liegen bei über . in meinem wahlkreis, in karlsruhe, ist es jetzt schon so, dass die intensivstationen voll sind und patientinnen und patienten verlegt werden müssen. diese situation erkennen wir, und wir sind in großer sorge. wir leiten aus dieser situation ab, dass man mit der bisherigen gesetzeslage nicht in der lage war, diese dramatische entwicklung zu verhindern. deshalb schlagen wir mit dem heutigen gesetzentwurf vor, nachzuschärfen, die maßnahmen treffsicherer zu machen und, ja, an einigen stellen sogar noch zu verschärfen: g in bus und bahn, g am arbeitsplatz, die öffnung für die länder, g einzuführen mit personenobergrenzen bei veranstaltungen. das sind klare verschärfungen, meine damen und herren. aber wir sagen an dieser stelle auch: es ist erforderlich, eine kollektive kraftanstrengung in deutschland zu mobilisieren. denn das virus lässt sich nicht durch paragrafen bekämpfen, sondern nur durch technologische und soziale intelligenz sowie organisatorische effizienz. die haben die bisherigen regierungen vermissen lassen, und deshalb muss nachgeschärft werden. wir bitten deshalb alle in der union, die guten willens sind, unserem gesetzentwurf heute zuzustimmen. die gretchenfrage heißt: lassen sie sich impfen? ich habe den eindruck, dass das, was die bundesregierung bisher gemacht hat, ein trauriges bild abliefert. die werbekampagne lass dich impfen zeigt eine person mit pflaster am arm. da wünsche ich mir die werbekampagne aus frankreich. die zeigt ein küssendes paar mit dem slogan: ja, der impfstoff kann erwünschte nebenwirkungen haben. wir würden uns freuen, wenn diese kampagne mit mehr engagement angegangen würde, wenn influencer, wenn künstlerinnen und künstler, wenn kulturschaffende, auch mit zielrichtung auf milieus mit migrationshintergrund, jetzt fürs impfen werben würden. meine damen und herren, an die adresse der afd sie, die sie sich ja noch nicht mal an die maskenpflicht hier im haus halten : von ihnen erwarte ich, dass sie mal fürs impfen eintreten. machen sie das endlich! wir brauchen eine höhere impfquote, meine damen und herren. impfen und testen ist die lösung, um diese pandemie zu bekämpfen. es war klar, dass impfdurchbrüche kommen werden. tun sie doch nicht so, als ob man das nicht gewusst hätte. trotzdem ist das impfen richtig. ein letzter und persönlicher satz, weil meine redezeit zu ende ist: meine damen und herren, einige von ihnen wissen, dass seit dem . juli unsere tochter auf der intensivstation liegt. ich spreche jeden tag, wenn ich kann und vor ort bin, auch mit pflegekräften. ich finde es wirklich schwierig, wie die situation dort ist. wir haben einen pflegenotstand. das pflegepersonal-stärkungsgesetz hat nicht dazu geführt, die situation zu entschärfen. aber heute, an diesem tag, so zu tun, als ob die fortsetzung der epidemischen lage von nationaler tragweite den pflegekräftemangel beseitigen würde, ist unredlich. das ist eine lüge. die menschen in der pflege sagen mir: geld allein ist es nicht. es sind viele faktoren: die kinderbetreuung, die nicht mit den schichtzeiten in einklang zu bringen ist, der parkplatz, den man vor ort nicht gewährt, und viele andere dinge bis hin zur bezahlung. ich rufe dazu auf, dass wir uns gemeinsam überlegen, wie wir es schaffen, dass mehr junge menschen in die pflegeberufe gehen, anstatt dass sie jura oder volkswirtschaft oder bwl studieren; ich bin selber volkswirt. ich bin der meinung: das müssen wir an dieser stelle machen. hierzu sind wir bereit. herr theurer, kommen sie zum schluss. ich bin der meinung, dass wir hier nicht mit falschen argumenten vorgehen sollten. die lage ist wirklich dramatisch. aber jetzt den parteien spd, grünen und fdp vorzuwerfen, sie wären für den pflegemangel verantwortlich, das ist unredlich, meine damen und herren. helfen wir gemeinsam, dass wir mehr menschen für die pflege gewinnen. als nächster redner hat martin sichert für die afd-fraktion das wort. ich lenke die aufmerksamkeit zur tribüne. herr sichert spricht von oben von der tribüne."
15,18.11.2021,ID20301500,Martin,Sichert,AfD,Martin Sichert,"frau präsidentin! meine damen und herren! dass ich als abgeordneter hier vom balkon sprechen muss, zeigt, wie sehr ihre politik das land spaltet. mein kollege hier neben mir ist praktisch immun, weil sein antikörperwert weit über dem grenzwert liegt. und während er hier oben sitzt, kann da unten jeder geimpfte völlig frei corona verbreiten. g und g dienen nicht dem gesundheitsschutz; g und g dienen dazu, die bürger mit massivem druck zu willigen untertanen zu erziehen. da machen wir als afd nicht mit. am schlimmsten ist der umgang mit den jungen menschen. feiern in einer halle in meinem wahlkreis in nürnberg lautstark wetten, dass..? , und spd-abgeordnete stehen hier im bundestag beim gruppenfoto lachend zusammen, aber kinder müssen stundenlang maske tragen. jugendliche wurden infolge der impfung schwer herzkrank, und es starben seit februar mehr infolge der impfung als an corona. hunderttausende kinder erkranken psychisch, und die kinderkliniken sind voll, weil wegen abstand und masken das immunsystem gegen andere erkrankungen massiv geschwächt ist. diese maßnahmen sind ein himmelschreiendes verbrechen an der kommenden generation, und sie müssen umgehend beendet werden. was haben der saarländische innenminister, der präsident des deutschen olympischen sportbunds und der bundestagsabgeordnete sepp müller gemeinsam? sie waren alle dreifach geimpft und haben sich mit corona infiziert. das sind keine einzelfälle: über prozent der coronatoten im letzten monat waren laut robert-koch-institut vollständig geimpft. das paul-ehrlich-institut hat über schwere nebenwirkungen und über todesfälle nach impfung dokumentiert. fakt ist: jeden tag tote infolge der impfung und vollständig geimpfte coronatote. jede andere derart unwirksame impfung mit solch massiven nebenwirkungen wäre schon längst vom markt genommen worden. obwohl gestern intensivbetten weniger belegt waren als ende april, reden wir heute über weitgehende ermächtigungen der regierungen. herr sichert, erlauben sie eine zwischenfrage von herrn müller? gerne. danke, herr sichert. sie können ihn jetzt leider nicht sehen, aber er steht unter der tribüne. frau präsidentin, vielen dank. herr sichert, sie haben mich mit dem gleichen selbstbewusstsein erwähnt, mit dem sie hier zahlen niederlegen, die jeglicher grundlage entbehren! meine erstimpfung war mit johnson & johnson. meine boosterimpfung war am . oktober dieses jahres, nachdem das rki im oktober gesagt hat: vier wochen nach einer impfung mit johnson & johnson soll geboostert werden. am . oktober traten wir hier zusammen. am freitag darauf habe ich mich, weil mir die nase lief, mit einem schnelltest positiv getestet. dieses symptom hatte ich fünf tage lang. gott sei dank war ich geimpft! mir lief nur die nase! herr sichert, ich frage sie allen ernstes, wenn sie mich hier schon instrumentalisieren wollen und gegen die impfung sprechen: kennen sie meinen handballfreund, der in meinem alter ist und dessen namen ich nicht nenne, der vorher marathon gelaufen ist und sich vor einem halben jahr mit corona infiziert hat? er konnte sich nicht impfen lassen, weil er keiner prioritätsgruppe angehörte. er kommt jetzt nicht mal mehr die treppen hoch. wollen sie leugnen, dass die impfung hilft, sodass ich als junger mann mit corona nur eine laufende nase hatte? ich werbe bewusst für die impfung. liebe leute da draußen, bitte lasst euch endlich impfen! das ist der weg aus der pandemie. darum, herr sichert, meine frage bzw. meine bitte: stellen sie das klar; denn ihre behauptungen entbehren jeglicher grundlagen. sonst sagen sie das bitte. können sie die frage noch mal kurz wiederholen? die habe ich nicht verstanden. laut geschäftsordnung kann er eine zwischenbemerkung machen oder auch eine zwischenfrage stellen. sie dürfen jetzt antworten, herr sichert. auf die bemerkung kann ich gerne antworten. beschäftigen sie sich endlich mal mit den fakten, lesen sie mal die daten vom robert-koch-institut, lesen sie die daten vom paul-ehrlich-institut: fälle von nebenwirkungen, über fälle schwerer nebenwirkungen, über todesfälle infolge der impfung bis ende september. die daten bis ende oktober haben wir leider noch nicht. ja, ich freue mich, dass bei ihnen diese krankheit nur schwach verlaufen ist. aber in über prozent der fälle verläuft eine coronaerkrankung auch bei ungeimpften nur schwach. danke, dass sie hier noch mal bestätigen, dass sie geboostert gewesen sind und dass sie trotzdem corona bekommen haben. ich möchte gar nicht wissen, wie viele geboosterte dann in diesem land herumlaufen, die glauben, sie könnten corona nicht mehr verbreiten, weil sie hier eine falsche propaganda verbreiten und ständig so tun, als würde diese impfung dafür sorgen, dass die menschen nicht mehr erkranken können. das ist nicht der fall. über prozent der coronatoten sind laut robert-koch-institut, laut dem institut ihres bundesgesundheitsministeriums, vollständig geimpft gewesen. hören sie auf, den menschen zu erzählen, diese impfung würde sie komplett schützen, sondern sorgen sie dafür, dass die vulnerablen gruppen, dass die menschen ab , ab jahren gesondert geschützt werden, und hören sie auf, die kinder zu gängeln. wir haben momentan bundesweit nur zwei jugendliche auf den intensivstationen zwei jugendliche! , und dafür müssen die jungen menschen unfassbare einschränkungen ertragen. herr sichert. das ist unerträglich. herr sichert, sie haben von ihrer redezeit noch zeit für einen letzten schlusssatz übrig. dann fahre ich mit meiner rede fort. obwohl gestern intensivbetten weniger belegt waren als ende april, reden wir heute über weitreichende einschränkungen. wir tun dies, weil jedes dritte intensivbett aus personalmangel nicht genutzt werden kann. viele pflegekräfte haben auch wegen der massiven coronamaßnahmen ihrem beruf den rücken gekehrt. anstatt kinder und ungeimpfte mit dem infektionsschutzgesetz zu gängeln, müssen wir endlich die attraktivität der pflege massiv steigern. das ist die dringlichste aufgabe in dieser legislaturperiode. gehen wir sie endlich an! die nächste rednerin für die spd-fraktion ist heike baehrens."
16,18.11.2021,ID20301600,Heike,Baehrens,SPD,Heike Baehrens,"sehr geehrte frau präsidentin! liebe kolleginnen und kollegen! millionen menschen in unserem land sind in angst und sorge. immer mehr menschen allen alters infizieren sich mit dem coronavirus, und die zahl der schwererkrankten steigt täglich. die situation in unseren krankenhäusern und noch mehr auf den intensivstationen ist dramatisch. ärztinnen und pflegepersonal leisten schon heute an vielen orten mehr, als ihre kräfte hergeben. sie gehen körperlich, seelisch und manchmal auch ethisch an ihre grenzen. und sie, liebe kolleginnen und kollegen von der union, wollen den dringend notwendigen schutzmaßnahmen ihre stimme verweigern? wollen sie sich wie vorgestern im hauptausschuss tatsächlich enthalten? einer ihrer landesfürsten, der erst wenige tage im amt ist, droht gar damit, den bundesrat dafür zu instrumentalisieren, die heutigen beschlüsse zu torpedieren. wie klein wollen sie sich eigentlich noch machen? die menschen rufen nach hilfe und orientierung, und sie antworten mit parteitaktischem geplänkel. es war ihr eigener gesundheitsminister, der gefordert hat, das rechtskonstrukt der epidemischen lage aufzuheben, nicht weil die pandemie besiegt wäre nein! , sondern weil es richtig ist, dass der deutsche bundestag über die notwendigen infektionsschutzmaßnahmen entscheidet, nachdem zwei drittel der erwachsenen bevölkerung geimpft sind, weil es richtig ist, dass nicht ministerielle verordnungen regieren, sondern das gewählte parlament zu entscheiden hat, weil es richtig ist, dass regionale und länderspezifische maßnahmen von landesparlamenten zu beschließen sind, wenn sie einschneidend sind. dafür schaffen wir heute die grundlage, indem wir einerseits wichtige, bundesweit einheitliche maßnahmen beschließen und andererseits rechtssichere handlungsoptionen für die länder schaffen. wir erweitern den instrumentenkasten. wenn die zweitgrößte fraktion dieses hauses, die noch immer geschäftsführend in regierungsverantwortung steht, sich hier und heute einen schlanken fuß macht und nicht mehr zur lösung in dieser größten gesundheitskrise, die unser land je erlebt hat, beiträgt, dann ist das verantwortungslos und beschämend. alle, die in unseren krankenhäusern um das leben von menschen ringen, alle, die sich um alte und kranke menschen in unserem land kümmern und seit monaten alles tun, um sie vor dem virus zu schützen und gleichzeitig eine würdevolle pflege zu leisten, sie dürfen von uns als politik erwarten, dass wir das in unserer macht stehende tun, um infektionsgefahren abzuwenden, um menschen zu schützen und um unser gesundheitssystem funktionsfähig zu halten. deshalb: stimmen sie heute diesen dringend notwendigen maßnahmen zu! vielen dank für ihre aufmerksamkeit. nächste rednerin: für die cdu/csu-fraktion frau dr. katja leikert."
17,18.11.2021,ID20301700,Katja,Leikert,CDU/CSU,Katja Leikert,"sehr geehrte frau präsidentin! liebe kolleginnen und kollegen! in meinem wahlkreis, dem main-kinzig-kreis, haben wir bei den - bis ‑jährigen eine inzidenz von über , und wir sind bei weitem nicht der am stärksten betroffene landkreis. den rechtlichen rahmen jetzt zu verschlechtern, heute nach dieser debatte nach hause zu kommen und die pandemie als weniger schlimm zu erklären, das geht nicht. weil ich schon seit stunde minuten heute hier angeschrien werde: das wird den familien, die vor kita- und schulschließungen angst haben müssen, nicht gerecht. es wird auch nicht den kindern gerecht, die im unterricht diszipliniert ihre masken tragen. liebe links-gelbe, ihr gesetzentwurf nimmt rechtssicherheit, frau dittmar, und das wissen sie auch ganz genau. und keiner versteht, warum sie noch im august dafürgestimmt haben. frau göring-eckardt, es gibt kein thema und sie sind doch die ganze zeit anwesend gewesen , über das mehr diskutiert wurde als über die coronasituation in deutschland. es ist auch unser fraktionsvorsitzender ralph brinkhaus gewesen, der dafür gesorgt hat. statt hier herumzuschreien, ist es viel wichtiger, dass wir darüber sprechen, wie wir durch diese vierte welle kommen, welche maßnahmen wir brauchen und ob es wirklich notwendig ist, dass das berghain offen gehalten werden muss, egal wie hoch die inzidenzen sind. ich persönlich möchte weihnachten gerne mit meinen lieben verbringen; das ist mir lieber, als dass bars und klubs auf teufel komm raus offen gehalten werden. ich sage es ganz klar: ich möchte nicht, dass wir noch mal dahin kommen, dass schulen geschlossen werden müssen. ich weiß nicht, wie sie, liebe frau baerbock, das ihren kindern daheim erklären. ich werde in dieser lage definitiv nicht für ihre fehlentscheidung hier geradestehen. lieber herr buschmann, über die fdp kann man sich die ganze zeit nur wundern. sie haben schon im august die fortführung der epidemischen lage abgelehnt, weil alles irgendwie unproblematisch sei. die cdu/csu hatte damals recht, und wir haben heute recht. es braucht die epidemische lage, um schnell handeln zu können, auch und gerade um familien zu schützen. wir alle sollten auch mal lernerfolge im management der pandemie an den tag legen. wir alle wissen, was eltern mit kleinen kindern, was erzieherinnen in den kitas, lehrerinnen und lehrer, die menschen in den vereinen usw. in unserem land geleistet haben und wie schwierig die situation für schwangere ist, wie problematisch die situation für jugendliche, für studierende und auch für auszubildende ist. ihnen sollten wir alle einmal ein großes dankeschön für ihre disziplin sagen und uns auch dafür entschuldigen, wenn nicht jede maßnahme sofort gepasst hat. gerade deshalb müssen wir jetzt aus dieser lage und aus dem, was wir bisher beschlossen haben, lernen. wir müssen jetzt klar die lebensbereiche von familien schützen. die vulnerablen gruppen in diesem land, liebe fdp, sind ungeimpfte kinder und die menschen in den pflegeheimen. die vulnerablen gruppen sind nicht irgendwelche individualisten, die den einfachen satz nicht verstehen, dass die freiheit des einzelnen dort aufhört, wo die freiheit des anderen anfängt. sehr geehrte damen und herren, hier in dieser stadt, in der hauptstadt, in berlin, liegt die inzidenz bei den - bis -jährigen bei über . es sind aktuell schon fünf schulen im wechselunterricht. von einem auf den anderen tag werden schulen geschlossen. ich teile die kritik der eltern vor ort und deren forderung: es sind die schulen, die als letztes schließen sollten. vielleicht kann uns der geschäftsführende regierende bürgermeister von berlin, der hier ist, erklären, wie das zusammenpasst, in so einer situation die beendigung der pandemischen lage auszurufen. liebe ampelfraktionen, wir brauchen keine parteipolitischen spielchen, die ihren koalitionsverhandlungen geschuldet sind. bitte passen sie gut auf dieses land in zeiten der pandemie auf. herzlichen dank."
18,18.11.2021,ID20301800,Detlef,Müller,SPD,Detlef Müller,"nächster redner: für die spd-fraktion detlef müller. sehr geehrte frau präsidentin! meine damen und herren! wir befinden uns in der vierten und hoffentlich letzten großen welle der coronapandemie. die inzidenzzahlen steigen in vielen regionen ich komme aus sachsen auf bisher nicht gekannte höhen. solange wir keine ausreichende impfquote erreichen, müssen in allen bereichen maßnahmen ergriffen werden, die für die sicherheit der menschen in unserem land sorgen. das tun wir mit dieser änderung des infektionsschutzgesetzes auch für den bereich mobilität und verkehr. sie, meine damen und herren, kennen es doch aus eigenem erleben, insofern sie öffentliche verkehrsmittel nutzen: volle bahn, dicht gedrängt im bus, im hinterkopf aber das wissen um das hohe infektionsgeschehen, und nicht jeder fahrgast trägt die maske auch tatsächlich passend. alles zusammen: kein gutes gefühl. wir müssen auch die mobilität für alle nutzerinnen und nutzer öffentlicher verkehrsmittel im sinne des infektionsschutzes sicher gestalten. deswegen ist die nun kommende -g-regel in öffentlichen verkehrsmitteln für fahrgäste und personal nur folgerichtig und wird auch allenthalben begrüßt, unter anderem auch durch den deutschen städtetag. sie schließt, herr kleinwächter, grundsätzlich niemanden aus, ermöglicht aber allen eine höhere sicherheit, indem sie klarstellt, dass eben nur geimpfte, genesene oder getestete personen öffentliche verkehrsmittel nutzen. die großen fragen lauteten aber: wie soll das funktionieren, wer soll diese regelung durchsetzen, und wer soll sie kontrollieren? deshalb war es uns wichtig, diese regeln praktikabel zu gestalten. wir setzen auf stichprobenartige prüfungen anstelle von zutrittskontrollen, die in unserem öffentlichen verkehr auch gar nicht umsetzbar wären. und, meine damen und herren, es wird im regelfall eben nicht die zugbegleiterin und nicht der busfahrer sein, die bzw. der diese regeln durch- oder umsetzen muss. firmeneigene oder externe sicherheitsunternehmen sind gefordert wie jetzt schon bei den fahrausweiskontrollen. auch die bundespolizei und die polizeien der länder sowie die ordnungsbehörden der kommunen sind gefragt, diese stichprobenkontrollen durchzuführen und sie auch zu unterstützen. zur praktischen umsetzbarkeit gehört aber auch, dass schülerverkehre von der ‑g-regel ausgenommen sind; denn es ist schlichtweg nicht möglich, dass kinder und jugendliche sich vor der fahrt zur schule testen lassen, zumal sie bereits jetzt zwei- bis dreimal die woche im unterricht getestet werden. wir haben auch die taxiverkehre von den ‑g-regeln ausgenommen; denn taxen werden eben nicht von großen gruppen, die untereinander nicht weiter in kontakt stehen, genutzt. meine damen und herren, all diese regelungen werden die sicherheit im öffentlichen personenverkehr erhöhen. klar ist aber auch, dass all diese regeln nichts nützen, wenn einzelne menschen nicht bereit sind, rücksicht aufeinander zu nehmen, rücksicht, indem sie ihre mund-nasen-maske so tragen, dass sie mund und nase genau bedeckt, und vor allem rücksicht, indem sie sich ihrer eigenen verantwortung bewusst werden und ein impfangebot in anspruch nehmen. vielen dank für ihre aufmerksamkeit. nächster redner: für die cdu/csu-fraktion dr. jan-marco luczak."
