,datum,redeID,vorname,nachname,fraktion,name,inhalt_neu
96,17.06.2020,ID1916509600,Matthias,Zimmer,CDU/CSU,Matthias Zimmer,"herr präsident! meine damen und herren! es war vor ziemlich genau sechs jahren, als wir hier im plenarsaal die debatte über die einführung des mindestlohns hatten und die damalige arbeits- und sozialministerin, andrea nahles, diesen als einen meilenstein in der sozialpolitischen entwicklung der bundesrepublik deutschland beschrieben hat. sie hatte recht. er war ein meilenstein aus zwei gründen: erstens, weil nach langen debatten ein mindestlohn eingeführt worden ist, und zweitens, weil der deutsche bundestag die kluge selbstbeschränkung ausgeübt hat, diesen mindestlohn nicht selbst festzulegen, sondern eine mindestlohnkommission einzusetzen, die über die höhe des mindestlohns verhandelt. der bundestag würde ihn dann umsetzen, aber nicht selbst die entscheidung darüber fällen, wie hoch der mindestlohn ist. ich fand das klug. und das, finde ich, sollten wir weiterhin beibehalten. jetzt sagt der kollege birkwald völlig zu recht, es gab einen einstandswert völlig richtig, den musste es geben. aber wir haben danach die dinge aus unserer hand gegeben und haben gesagt: das soll die mindestlohnkommission regeln. das finde ich nach wir vor klug. lieber kollege birkwald, wenn man einmal ganz ehrlich ist, wird man sehen: wenn wir heute sofort einen mindestlohn von euro beschließen würden, dann weiß ich doch, was morgen passiert. sie fordern dann morgen einen mindestlohn von euro. das ist doch wie der wettlauf zwischen hase und igel. hier können wir nie gewinnen. meine damen und herren, ich lasse mich auch gerne auf eine diskussion darüber ein, ob der mindestlohn zu niedrig ist oder ob er nicht zu niedrig ist. der mindestlohn ist zumindest kein sozialpolitisches instrument das war der irrtum von frau ferschl , sondern er ist eine ordnungspolitische maßnahme zur regulierung des wettbewerbs. und das, finde ich, sollte man sich immer einmal vor augen halten. er ist eben nicht der gerechte lohn der katholischen soziallehre, er ist auch nicht der gerechte lohn, der bei adam smith im wohlstand der nationen aufgetaucht ist, sondern er ist in der ordoliberalen tradition ein mindestlohn, der den wettbewerb reguliert. und das soll er aus meiner sicht auch bleiben. nun ist in vielerlei hinsicht heute in der ausschusssitzung war das wieder so darüber debattiert worden: ist der mindestlohn im europäischen vergleich zu niedrig? ja, darüber kann man diskutieren. wenn man den median des lohns annimmt, ist die bundesrepublik ziemlich weit hinten im europäischen vergleich. nimmt man den durchschnittslohn im europäischen vergleich an, dann ist der mindestlohn in deutschland europäisches mittelfeld. nimmt man hingegen die kaufkraft als kriterium für den mindestlohn, dann sind wir in europa in der spitzengruppe. und dann kann aus meiner sicht überhaupt keine rede davon sein, frau ferschl, dass der mindestlohn gewissermaßen armut gebiert, wenn die kaufkraft in der europäischen spitzengruppe liegt. ich finde, da sollten sie ihre statistiken noch einmal ordentlich durchsehen. meine damen und herren, sind wir als union dagegen, dass der mindestlohn auf euro steigt? nein, wir sind nicht dagegen. wenn die mindestlohnkommission vorschlägt, den mindestlohn auf euro hochzusetzen, dann ist doch völlig klar, dass nach dem gesetz, wie wir es bislang beschlossen haben, dann auch der mindestlohn von uns auf dieser basis festgelegt werden wird. da gibt es doch überhaupt kein vertun. herr kollege? erlauben sie nur, was wir nicht wollen, ist gewissermaßen der immerwährende eingriff des gesetzgebers in die lohnfindung. wir haben der mindestlohnkommission eine möglichkeit gegeben, über die nachholende tarifentwicklung hinaus tätig zu werden und andere gesamtwirtschaftliche überlegungen bei der festlegung des mindestlohnes einzubeziehen. herr kollege, erlauben sie zwischenfragen? ich mache das gerne, herr präsident, und ich habe nur darauf gewartet, dass sie mich fragen. aha, das ist sehr schön. ich habe es vorhin schon versucht. frau kollegin ferschl hat die erste zwischenfrage. vielen dank, herr präsident, und danke, herr professor zimmer, dass sie die zwischenfrage zulassen. sie haben ja gerade selber auf den im europäischen vergleich sehr, sehr niedrigen mindestlohn in bezug auf den median hingewiesen. da liegen wir ja nicht nur im mittleren unteren feld, sondern wirklich ganz deutlich unten. sie haben auch gesagt, sie haben nichts gegen einen mindestlohn von euro, wenn ihn die mindestlohnkommission beschließt. das ist immer die argumentation, die von ihnen und von der union kommt, die ich aber, ehrlich gesagt, ziemlich zynisch finde, weil der mindestlohn von beginn an eben zu niedrig war, viel zu wenig kaufkraft entfaltet und viel zu wenige menschen vor armut schützt. es ist ja immer die große aussage, man müsste die tarifautonomie stützen. im übrigen das sei auch einmal angemerkt : wir sind mit sicherheit für die tarifautonomie. wir wollen tarifverträge sogar stärker, weil wir für eine erleichterung der allgemeinverbindlicherklärung sind. aber die mindestlohnkommission hat doch eine krux, und die steht in der geschäftsordnung; aus dieser will ich ganz kurz zitieren. in der geschäftsordnung der mindestlohnkommission steht, dass die anpassung des mindestlohns … im regelfall gemäß der entwicklung des tarifindex des statistischen bundesamts … in den beiden vorhergehenden kalenderjahren erfolgen soll und dass von diesem prinzip nur mit einer / -mehrheit der stimmberechtigten mitglieder der mindestlohnkommission abgewichen werden kann. das bedeutet letztendlich, dass wir immer wieder daran gebunden sind und diesen zu niedrigen mindestlohn fortlaufend festschreiben. wir wären bei den durchschnittlichen erhöhungen im jahr bei einem mindestlohn von euro. das ist aberwitzig. also müsste man richtigerweise sagen, man nimmt den mindestlohn einmal raus, erhöht ihn, um dann wieder die kommission arbeiten zu lassen. denn mit den stimmen der arbeitgeber wird mit sicherheit kein einmalig größerer sprung beschlossen werden. frau ferschl, sie haben mit einem völlig recht: diese geschäftsordnung, die sich die mindestlohnkommission gegeben hat, entspricht nicht den intentionen, die wir als gesetzgeber damals gehabt haben. eines muss man auch in aller deutlichkeit sagen das haben wir dieser mindestlohnkommission auch wiederholt gesagt : wir haben damals in dem gesetz vorgesehen, dass die mindestlohnkommission eben nicht nur eine nachholende tarifentwicklung festschreibt. denn dafür brauchen wir keine mindestlohnkommission. dafür brauchen sich nur zwei leute zum kaffee zu treffen und zu sagen: das sind die werte, die wir jetzt annehmen , um dann den mindestlohn entsprechend zu erhöhen. nein, wir wollten, dass die mindestlohnkommission sehr genau nachschaut: ist es vielleicht sinnvoll, jetzt die nachfrage zu stärken? ist es vielleicht sinnvoll, aus anderen gründen den mindestlohn zu erhöhen? ich brauche keine mindestlohnkommission, frau ferschl, um lediglich eine nachholende tarifentwicklung aufzuschreiben. dafür reicht ein notariatsgehilfe. deswegen sind wir auch der meinung: es ist ein fehler, was hier in der geschäftsordnung festgehalten worden ist, und das muss geändert werden. aber das bedeutet nicht, dass wir selbst den mindestlohn neu festlegen, sondern nur, dass die mindestlohnkommission so arbeitet, wie wir das gerne hätten. dann wären auch vernünftige mindestlohnabschlüsse möglich. meine damen und herren, ich glaube, dass es das vorrecht der opposition ist, höhere mindestlöhne zu fordern, und dass es auch das vorrecht der opposition ist, dies auf gesetzlichem wege zu tun. aber ich glaube, dass es eben nur das vorrecht der opposition ist und verantwortliches verhandeln in der regierung bedeutet, dass wir uns an die gesetze halten und die mindestlohnkommission arbeiten lassen mit dem hinweis darauf, wie wir gerne die arbeit hätten, nämlich auf gesetzlicher grundlage. ich denke, dass wir damit besser fahren, als in die tarifverhandlungen der mindestlohnkommission selbst einzugreifen. herzlichen dank. vielen dank, herr kollege dr. zimmer. zwischenfragen können zu einer verdoppelung der redezeit führen. herr zimmer, das ist kein vorwurf an sie. das dachte ich mir schon. nächster redner ist der kollege jürgen pohl, afd-fraktion."
97,17.06.2020,ID1916509700,Jürgen,Pohl,AfD,Jürgen Pohl,"herr präsident! sehr geehrte kollegen! werte zuschauer an den tv-geräten! die bevölkerung sagt: das maß ist voll. meine damen und herren, die fehler, die die regierung in den letzten monaten machte, waren groß genug. ohne jede rücksicht wurden arbeitsplätze von millionen von beschäftigten in gefahr gebracht oder sogar vernichtet. dem krisenmanagement der bundesregierung mangelt es gerade mit dem blick auf die ökonomie und die sozialen bedürfnisse der menschen an maß und verantwortungsbewusstsein. überall hat der lockdown verheerenden wirtschaftlichen schaden angerichtet. die prognosen sämtlicher wirtschaftsforschungsinstitute für die kommenden monate gleichen katastrophenmeldungen. in deutschland dürften viele kleine und mittelständische betriebe den von der bundesregierung angeordneten lockdown nicht überleben. das heißt, die politik der bundesregierung zerstört im großen stil die existenzen von unternehmern und deren mitarbeitern. liebe abgeordnete von den linken, es ist schon eine recht billige nummer im zuge des allgemeinen gezerres um coronahilfen, schnell noch anträge hinterherzuschieben und die dort mit zu verpacken, obwohl sie im ausschuss für arbeit und soziales regelmäßig und krachend mit ihren mindestlohnanträgen scheitern. sie stellen diesen antrag auch alleinig, um die gunst der stunde zu nutzen und klientelpolitik zu machen. sie werden doch wohl nicht denken, dass sie heute im sturm die herzen ihrer parlamentarischen kollegen erobern werden. kommen wir mal zu ihrem antrag. schauen wir uns diesen antrag mal an ich will es den leuten zu hause auch mal zeigen : wir haben eine einzige seite und ein bisschen, würde man sagen. das können die aber nicht sehen, herr kollege. mit dieser einen seite und ein bisschen soll auf einmal der mindestlohn pauschal um , prozent erhöht werden. mit dieser einen seite soll die mindestlohnkommission geknebelt werden. ich sage eines: ihr antrag vom . februar , von vor zwei jahren, der gleiches oder ähnliches wollte, hatte wenigstens noch vier seiten und dahinter eine begründung. die ersparen wir uns heute. ich meine: das ist gar nichts, was sie da gebracht haben. ich sage ihnen eines: der deutsche arbeitnehmer, den sie hier angeblich vertreten wollen, dieser deutsche arbeitnehmer, den sie am . juni in den knast und in die folterkammern der russen gesteckt haben, dieser arbeitnehmer hätte mehr achtung und mehr qualität in ihrer arbeit verdient. sie können doch nicht kommen und sagen: das ist der antrag, der den deutschen arbeitnehmer und deutschen mindestlöhner rettet , und liefern so ein dürftiges ding ab. das ist gar nichts! natürlich bin ich dafür. alles zu seiner zeit, wenn die betriebe sich das leisten können. ich sage ihnen eines: das habe ich nie gesagt. ich persönlich bin voll für eine mindestlohnerhöhung. ich bin für die soziale sicherstellung der arbeitnehmer. aber diese arbeitnehmer brauchen auch noch einen arbeitsplatz, herr birkwald. und wenn sie jetzt den deutschen unternehmern aufgeben: sie zahlen alle pauschal , prozent mehr mindestlohn , wie viele arbeitsplätze sollen dann verloren gehen? wo wollen sie die dann alle beschäftigen? sehen sie, genauso ist das. das heißt, es ist keine zeit für klientelpolitik. meine damen und herren, um das land wieder nach vorne zu bringen, wäre es zeit, gemeinsam an einem strang für eine gemeinsame wirtschafts- und vor allem soziale politik zu kämpfen. in diesem sinne: lassen sie uns im ausschuss darüber sprechen. danke schön für die sekunden. herr kollege pohl, es waren sekunden, aber ist auch egal; das machen die anderen auch. nächster redner wird nach der reinigung des rednerpults der kollege bernd rützel, spd-fraktion, sein."
98,17.06.2020,ID1916509800,Bernd,Rützel,SPD,Bernd Rützel,"sehr geehrter herr präsident! liebe kolleginnen! liebe kollegen! ich freue mich auf jeden fall, dass wir heute wieder mal über die erfolgsgeschichte mindestlohn sprechen. vielen dank für ihren antrag dazu, liebe kolleginnen und kollegen der linken. auch für mich ist es ein jubiläum. ich darf hier heute zum zehnten mal zum mindestlohn sprechen. wir haben auch schon öfter über die höhe des mindestlohnes gesprochen, und ja, klar: , euro der aktuelle mindestlohn sind zu wenig; das ist zu niedrig. arbeit ist mehr wert als diese , euro in der stunde. es lohnt sich auch, dafür zu kämpfen, und es lohnt sich, politisch zu kämpfen. kollegin ferschl hat, wie ich auch, die heutige ganzseitige anzeige in der frankfurter allgemeinen zeitung dabeigehabt, in der hunderte von wissenschaftlerinnen und wissenschaftlern sagen: hände weg von einer reduzierung des mindestlohnes wegen corona! im gegenteil: ihr müsst ihn erhöhen. genau das hat letztes jahr auch der spd-parteitag im sozialstaatspaket beschlossen. das ist ganz klare beschlusslage bei uns. wir sagen aber auch: der mindestlohn ist nach wie vor eine krücke. besser wäre es, tarifverträge zu haben, sodass die leute ein anrecht auf bessere und höhere löhne haben. morgen beschließen wir hier an dieser stelle änderungen im arbeitnehmer-entsendegesetz. das ist ein komplizierter name, aber dieses gesetz bringt fairness auf dem arbeitsmarkt, und es werden tariflöhne bezahlt. ich gebe dem kollegen zimmer recht: , als wir den mindestlohn auf den weg gebracht haben, haben wir in die tarifautonomie eingegriffen. wir haben diesen lohn einmal festgelegt und gesagt: die mindestlohnkommission, in der gewerkschafter und unternehmer sitzen, können das mit der tarifautonomie besser; die machen das. das ist richtig, und das soll auch so sein. aber wir stellen heute, nach sechs jahren, fest, dass der mindestlohn von , euro nach den erhöhungen bei , euro gelandet ist. das waren trippelschritte. das ist viel zu wenig; das geht zu langsam, und deswegen brauchen wir hier an dieser stelle einen richtigen wumms. apropos wumms : olaf scholz hat schon vor zwei jahren gefordert, einen mindestlohn von euro auf den weg zu bringen. und wer sollte ihm an dieser stelle widersprechen? ich sage auch: ja, es ist wieder zeit. wir müssen politisch eingreifen; woanders machen wir das auch. das ist nicht nur notwendig, sondern es ist auch geboten, dass wir das tun. danach kann die mindestlohnkommission weiter trippelschritte gehen. danke. vielen dank, herr kollege rützel. nächster redner ist für die fdp-fraktion der kollege carl-julius cronenberg."
99,17.06.2020,ID1916509900,Carl-Julius,Cronenberg,FDP,Carl-Julius Cronenberg,"herr präsident! liebe kolleginnen und kollegen! die gesundheitliche bedrohung durch corona sinkt, gott sei dank. gleichzeitig steigt für viele menschen die soziale bedrohung durch die folgen der pandemie. allein millionen kurzarbeiter bangen in diesen tagen um ihren job. die schnelle und entschlossene anpassung des kurzarbeitergelds hilft, aber machen wir uns nichts vor: wir haben noch keinen blassen schimmer, für wie viele betroffene beschäftigte es zurück in den job geht und für wie viele in die arbeitslosigkeit. deshalb lautet das gebot der stunde, den hohen beschäftigungsstand zu halten und nicht politisch motiviert zu gefährden. die linke wünscht sich nun einen mindestlohn, der in sozialpolitischer absicht armut bekämpft und damit über das ursprüngliche ziel, wettbewerbspolitisch vor lohndumping zu schützen, hinausgeht. ihr wunsch ist legitim; ordnungspolitisch klug ist er nicht. prozent lohnerhöhung ohne entsprechende produktivitätserhöhung: das gefährdet arbeitsplätze. dazu kommen wir noch. bei der einführung des mindestlohns vor sechs jahren hat der gesetzgeber aus gutem grund sehr behutsam in bestehende tariflöhne eingegriffen. keine prozent der tariflöhne mussten nach oben angepasst werden. bei ihrem vorschlag heute wären das prozent, also viermal so viel. das würde konsequenterweise entweder zur folge haben, dass nahezu alle tariflohngruppen angehoben werden so höhlen sie die tarifautonomie weiter massiv aus oder dass sie damit den lohnabstand zu den mittleren lohngruppen abschaffen, was ungerecht gegenüber den leistungsträgern ist, und zudem setzt es fehlanreize bei den schlüsselthemen aus- und weiterbildung. außerdem ist in beiden fällen zu befürchten, dass die tarifbindung sinkt, und das ist schlecht. schließlich würden sie die eintrittsbarriere in den ersten arbeitsmarkt für die schwächsten unserer gesellschaft erhöhen: ältere, langzeitarbeitslose, flüchtlinge, alleinerziehende mütter. sie würden ihnen die chance nehmen, sich hochzuarbeiten, und das lehnen wir ab. liebe kolleginnen und kollegen von den linken, sie befinden sich inzwischen aber in guter gesellschaft. die lust, den mindestlohn politisch festzusetzen, ist längst wie ein virus auf die koalitionsfraktionen übergesprungen. fast alle bernd rützel hat es gerade noch mal bestätigt wollen politisch eingreifen. liebe spd, die populistischen forderungen der linken zu kopieren, bringt ihnen keine wähler zurück, und liebe union, die politische absenkung des mindestlohns oder selbst das einfrieren rettet keinen job. die unabhängigkeit der mindestlohnkommission ist der garant für die arbeitsmarktstabilität, genau wie die unabhängigkeit der zentralbank garant für währungsstabilität ist. lassen sie die mindestlohnkommission einfach in ruhe ihre arbeit machen; matthias zimmer hat an der stelle doch vollkommen recht. und warten sie die evaluation ab! die haben sie sich für dieses jahr doch sowieso vorgenommen. ganz ehrlich: wenn mir oder den freien demokraten vor fünf jahren jemand prophezeit hätte, dass wir zu den letzten gralshütern des deutschen mindestlohngesetzes gehören würden, dann hätte ich ihn für verrückt erklärt. vielen dank. vielen dank, herr kollege. bevor wir fortfahren, stehe ich vor einem ganz kleinen problem, das ich jetzt eigenmächtig löse. ich bin von der afd-fraktion darauf hingewiesen worden, dass es zumindest in teilen des jakob-kaiser-hauses zum beginn der namentlichen abstimmung über den kfor-einsatz nicht geklingelt hat, und ich bin gebeten worden, die namentliche abstimmung um minuten zu verlängern, was deshalb unangemessen wäre, weil von der mitteilung bis zu dem zeitpunkt, den ich jetzt benennen werde, ausreichend zeit ist bzw. war, um vom jakob-kaiser-haus hierherzukommen. ich werde die namentliche abstimmung bis . uhr verlängern; das reicht aus. damit ist dem begehren der afd-fraktion rechnung getragen, und alle, die noch unterwegs sind, können abstimmen. ich muss das noch mal für die lobby bekannt geben: die namentliche abstimmung zum kfor-einsatz wird bis . uhr verlängert wegen eines möglichen technischen problems bei der durchsage im jakob-kaiser-haus. nächste rednerin ist die kollegin beate müller-gemmeke, fraktion bündnis /die grünen."
100,17.06.2020,ID1916510000,Beate,Müller-Gemmeke,BÜNDNIS 90/DIE GRÜNEN,Beate Müller-Gemmeke,"sehr geehrter herr präsident! kolleginnen und kollegen! wenn in zeiten von corona der mindestlohn infrage gestellt wird, wenn es die debatte gibt, dass der mindestlohn abgesenkt oder zumindest die erhöhung ausgesetzt werden soll, dann verunsichert das millionen von menschen im niedriglohnbereich, und dabei geht es auch um beschäftigte, die vor kurzem noch als systemrelevant bezeichnet wurden, weil sie für uns das leben am laufen gehalten haben. dieser hinweis war mir jetzt einfach wichtig; denn diese debatte auch in der union ist nicht nur schräg, sondern vor allem zynisch. genau wegen solcher diskussionen waren wir grünen bei der forderung, den mindestlohn parlamentarisch also hier im bundestag zu erhöhen, anfangs zögerlich; denn wenn der mindestlohn politisch erhöht werden kann, dann kann er auch politisch abgesenkt werden. deshalb stehen auch wir weiterhin zur mindestlohnkommission. wir wollen sie aber stärken, damit sie freiheiten und spielräume bekommt und tatsächlich gestalten kann. der mindestlohn ist eine frage der gerechtigkeit. er muss die beschäftigten vor lohndumping und die unternehmen vor schmutzkonkurrenz schützen, und ein mindestlohn muss natürlich vor allem die menschen vor armut schützen. aber genau das ist eben nicht der fall, und deshalb muss der mindestlohn deutlich erhöht werden. auch wir sagen: euro aber in zeiten von corona vielleicht nicht in einem schritt, sondern schrittweise. genau das schreiben ja auch die wissenschaftlichen institute der hans-böckler-stiftung in einer stellungnahme an die mindestlohnkommission. eine erhöhung in schritten, aber dennoch sehr schnell auf euro: das könnte eine gute strategie sein, und ich hoffe sehr, dass sich ein breites bündnis für diesen weg, für diese strategie starkmacht. vielleicht kann dann auch die spd bei dieser strategie mitmachen. das wäre jetzt, in der coronakrise, auch ökonomisch genau das richtige. wenn der mindestlohn jetzt steigt, dann werden millionen von menschen jeden einzelnen euro davon auch ausgeben. das stärkt die nachfrage. und dieser positive impuls wäre gerade jetzt für die wirtschaft extrem wichtig. für die beschäftigten ist es wichtig, dass ihre arbeit fair entlohnt wird. und das geht am besten mit guten tarifverträgen. dafür ist auch der mindestlohn wichtig; denn er stärkt und stabilisiert das tarifvertragssystem von unten. es braucht aber noch mehr anreize, um die tarifbindung zu stärken. tarifverträge, die für alle gelten, und tariftreueregelungen das sind die stichworte. neben einem höheren mindestlohn braucht es also ein bündel von maßnahmen. nur so entsteht lohngerechtigkeit und damit auch mehr nachfrage, und beides ist in zeiten von corona wichtig und dringend notwendig. vielen dank. vielen dank, frau kollegin müller-gemmeke. nächster redner ist der kollege thomas heilmann, cdu/csu-fraktion."
101,17.06.2020,ID1916510100,Thomas,Heilmann,CDU/CSU,Thomas Heilmann,"herr präsident! meine lieben kollegen! liebe mitbürgerinnen und mitbürger, weniger auf der tribüne als an den digitalen endgeräten! liebe linksfraktion, sie bleiben eine monothematische partei. deshalb führen wir heute wieder einmal ich weiß nicht, zum wievielten mal exakt dieselbe debatte. sie wollen einen politisch festgesetzten mindestlohn, und wir wollen einen, der marktwirtschaftlich von arbeitgebern und arbeitnehmern ermittelt wird. meine vorredner sind darauf eingegangen. als ich nun gestern meine rede vorbereiten wollte, war ihr antrag noch gar nicht eingereicht. ich habe meine fraktionskollegen um rat gebeten, und die haben gesagt: nimm einfach den alten antrag; die schreiben eh immer von sich selber ab. so werden sie von außen betrachtet. und deshalb habe ich mir überlegt, ihnen einen vorschlag zu machen: begeben sie sich außerhalb dessen, was sie immer denken, außerhalb ihrer blase, und erweitern sie ihren horizont. das konjunktur- und aufbruchspaket der bundesregierung enthält punkte. jeder einzelne wäre eine debatte wert. und bei jedem einzelnen stellt sich die frage: was sagt eigentlich die linkspartei dazu? von mir aus auch die linke . ich habe auf ihrer fraktionshomepage nachgeschaut: es gibt dort gerade mal zwei ziemlich kurze und ziemlich dürre statements. die kann man vielleicht mit ja, aber zusammenfassen. details? fehlanzeige! noch bemerkenswerter ist die homepage ihrer partei die linke. auch dort habe ich nachgeguckt. gleich am anfang findet man einen sehr langen artikel, der sehr sachlich das paket darstellt. dann kommen die reaktionen, allerdings nicht von ihnen. vielmehr zitieren sie zu meiner überraschung zuerst die reaktionen der cdu, dann die der spd, dann der anderen parteien, dann der gewerkschaften, dann der umweltverbände usw. nur ihre eigenen gibt es da irgendwie nicht. das bedeutet: auf der homepage der linken findet man mehr dazu, was die cdu zum konjunkturpaket sagt, als dazu, was ihre eigene partei sagt zu meiner großen überraschung. das könnte man übertriebene fairness nennen. mein fazit ist: die linkspartei hat nicht nur keine neuen ideen, sondern oft nicht mal eine meinung. deshalb habe ich noch eine anregung für sie mitgebracht: bundestagsabgeordnete und experten haben gleich neue vorschläge entwickelt und in einem buch neustaat aufgeschrieben. dort finden sie, wie unser staat modernisiert werden könnte. dort finden sie, wie wir neue arbeitsplätze schaffen wollen. dort finden sie, wie wir menschen helfen könnten, mit den anstehenden veränderungen zurechtzukommen; denn das ist aus unserer sicht die effektivste armutsbekämpfung. wir skizzieren, wie möglichst alle von der technologischen transformation profitieren könnten. sie finden in neustaat auch einen neuen vorschlag das müsste sie interessieren , wie wir die gesetzliche rente stärken können. wir haben insgesamt eine bestandsaufnahme vorgenommen, was der staat heute kann, was er nicht so gut kann und vor allem, wie es besser werden könnte. liebe linkspartei, lassen sie uns bitte über die lösungen der zukunft diskutieren, werden sie aktuell. nutzen sie zum beispiel die chancen des neustaats , und wiederholen sie nicht immer dieselben anträge! vielen dank, herr kollege heilmann."
