,datum,redeID,vorname,nachname,fraktion,name,inhalt_neu
117,07.04.2022,ID202811700,Christoph,Ploß,CDU/CSU,Christoph Ploß,frau präsidentin verehrte kolleginnen und kollegen wir müssen unabhängig von putins öl und gas werden darüber sind wir uns mittlerweile fraktionsübergreifend weitestgehend einig weitestgehend es gibt immer noch ein paar unverbesserliche aber ich denke mal zwischen den parteien in der demokratischen mitte herrscht einigkeit darüber wenn wir das erreichen wollen dann brauchen wir auf der einen seite den ausbau der erneuerbaren energien und dann brauchen wir lng; lng muss russisches gas ersetzen jetzt wissen wir alle dass wir um lng nach deutschland zu bekommen eine funktionierende lng-infrastruktur brauchen jetzt könnten einige sagen: warum hat man die denn noch nicht längst gebaut oder: die hätte doch schon vor jahren gebaut werden können da muss man zu beginn der debatte eines sagen: es gab gerade in der cdu viele engagierte politiker die sich genau dafür eingesetzt haben: enak ferlemann der auch noch sprechen wird oliver grundmann sitzt direkt daneben auch einige andere kollegen aus mecklenburg-vorpommern schleswig-holstein hamburg und niedersachsen die seit jahren genau dafür werben dass wir eine lng-infrastruktur in deutschland aufbauen diese personen waren aber bis zum ausbruch des ukrainekriegs die einsamen rufer in der wüste und sind vor allem auf widerstand der spd gestoßen liebe kollegen der ampelkoalition jetzt lachen sie hier aber selbst im februar dieses jahres hat noch ein parteitag der grünen in schleswig-holstein beschlossen kein lng-terminal zu bauen jetzt wollen wir nicht parteipolitik daraus machen zurückschauen und danach fragen wer schuld hat stattdessen wollen wir nach vorne schauen und fragen: wie können wir hier parteiübergreifend heute abend eine initiative beschließen durch die mit dem bau von lng-terminals möglichst noch in diesem jahr aber mindestens so schnell wie möglich begonnen werden kann dafür machen wir folgende vorschläge: wir sagen wir wollen auf ein aufwendiges planfeststellungsverfahren verzichten; denn wir wissen ja von vielen anderen infrastrukturprojekten dass es manchmal viele viele jahre dauern kann bis ein infrastrukturprojekt in deutschland realisiert wird ein schienenprojekt das nach einem klassischen planfeststellungsverfahren geplant wird dauert im durchschnitt jahre jahre das ist viel zu lange genannt werden aber auch andere zeiträume wir reden beim bau von lng-terminals manchmal über das ende der -jahre; in den besten fällen reden wir bisher über das jahr oder all das ist viel zu lange wenn wir unabhängig von putins gas werden wollen deswegen sagen wir: wir wollen planung im deutschen bundestag machen wir wollen das planrecht durch das parlament schaffen so wie wir das erfolgreich zum beispiel nach der wiedervereinigung in deutschland gemacht haben; da haben wir sehr schnell eine funktionierende infrastruktur aufgebaut das kann in dieser krise in der wir uns befinden ein sehr sehr gutes vorbild sein deswegen: planung durch gesetz bitte unterstützen sie diese initiative wir weisen aber auch auf andere punkte hin nämlich dass wir an unterschiedlichen standorten in norddeutschland lng-terminals brauchen oliver grundmann setzt sich seit vielen jahren für den standort stade ein wir haben wilhelmshaven wir haben trotz des beschlusses des grünenparteitags auch brunsbüttel im fokus aber wir wollen mit unserem antrag auch den osten deutschlands nicht vergessen deswegen auch ein wichtiger punkt : ein lng-terminal in mecklenburg-vorpommern wäre im sinne unseres landes und würde auch ostdeutschland in die konzeption einbeziehen ein weiterer wichtiger punkt zu dem wir sie einladen wollen ist dass wir nicht nur an lng denken sondern wir wollen auch wasserstoff und regenerative kraftstoffe einbeziehen wenn wir jetzt die lng-infrastruktur von morgen bauen dann sollten wir auch an wasserstoff und regenerative kraftstoffe von übermorgen denken die wir auch so schnell wie möglich benötigen damit deutschland klimaneutral wird deswegen: weiterdenken als nur an lng und gerade auch alternative energieträger einbeziehen ein weiterer punkt ist uns noch wichtig: die netzentgelte müssen deutlich wettbewerbsfähiger werden in deutschland sie müssen abgesenkt werden so wie das zum beispiel unser nachbarland polen gemacht hat auch da bitten wir um ihre unterstützung es gab vor einigen jahren den schönen spruch in der werbung er ist bekannt : geht nicht gibt’s nicht das muss auch beim bau von lng-terminals gelten deswegen bitten wir sie liebe ampelkoalition nachdem das heute vormittag kein glanzauftritt von ihnen war dass sie zumindest bei dem wichtigen thema lng-terminals auf unsere seite kommen und wir parteiübergreifend noch in diesem monat einen beschluss fassen kollege dass lng-terminals noch in diesem jahr gebaut werden können herzlichen dank das wort hat dr nina scheer für die spd-fraktion
118,07.04.2022,ID202811800,Nina,Scheer,SPD,Nina Scheer,sehr geehrte frau präsidentin liebe kolleginnen und kollegen ein netter versuch herr ploß; aber die initiativen für den bau von lng-terminals sind schon längst auf den weg gebracht insofern kommt ihr antrag auch wenn er vom datum her noch mal einen monat zurückversetzt wurde schlicht zu spät die geopolitische lage erfordert in der tat dass uns nichts anderes übrig bleibt als bei den diversifizierungsstrategien tatsächlich noch einmal nachzulegen dass sich die infrastruktur allein auf lng fokussiert das darf nicht stattfinden; das haben sie in der tat auch in ihrem antrag anklingen lassen es muss vielmehr natürlich darum gehen dass man die infrastruktur in form von lng-terminals die wir jetzt brauchen so aufbaut dass sie wie man es nennt -ready sind damit wasserstoffanlandung ebenfalls ermöglicht wird alles andere wäre rückwärtsgewandt und würde uns nicht nach vorne bringen ich möchte noch einmal kurz bei der situation ansetzen in der wir uns heute wiederfinden es ist durch einen kraftakt der bundesregierung und der beteiligten unternehmen in der tat jetzt schon gelungen den jahresmittelverbrauch bzw den import von russischem gas von prozent im jahresmittel auf prozent herunterzuschrauben das ist eine enorme leistung insofern sieht man hier auch dass es gelingt sich unabhängiger von den importen aus russland zu machen was aufgrund des völkerrechtswidrigen angriffs auf die ukraine auch dringend geboten ist der bau von lng-terminals ich habe es schon erwähnt muss aber unbedingt in zusammenhang mit dem beschleunigten umstieg auf erneuerbare energien geschehen nämlich dahin gehend dass wir wasserstoffanlandung mit ermöglichen müssen und auch hier die brücke in das zeitalter der erneuerbaren nicht abreißen lassen dürfen das wurde gestern auch mit dem kabinettsbeschluss zum osterpaket auf den weg gebracht insofern werden wir hier nicht eine offensive für fossile energien starten wie sie herr ploß das gerade hier formuliert haben sondern wir werden natürlich eine ausbauoffensive für erneuerbare energien bekommen das darf überhaupt nicht unter den tisch gekehrt werden die möglichkeiten die wir mit der ampelkoalition in richtung ausbauoffensive ergreifen wollen stehen unter der ganz klaren überschrift dass wir von einem überragenden öffentlichen interesse der erneuerbaren energien ausgehen das muss sich überall in allen einzelnen schritten wiederfinden das heißt bei unseren bemühungen um diversifizierung müssen wir auch schauen in welchen bereichen gas etwa durch bioenergie ersetzt werden kann auch hier ist der vorrang erneuerbarer energien wiederzufinden im bereich der wasserstofftechnologie werden dann übrigens auch sehr viele arbeitsplätze zu finden sein; in norddeutschland haben wir hier riesige potenziale zugleich müssen wir schauen dass wir dafür sorgen dass die europäischen rahmenbedingungen für die fossilen importe auf die wir noch eine zeit angewiesen sein werden so ausgestaltet werden dass mögliche emissionen vermieden werden in der vergangenheit beim gesetz zur weiterentwicklung der treibhausgasminderungs-quote ist es uns ja gelungen herr grundmann wird sich erinnern dass wir darüber verhandelt haben eine entsprechende anforderung an die damalige bundesregierung zu richten wir haben da im kontext einer methanstrategie hinsichtlich der methanemissionen ganz klar adressiert dass die bundesregierung sich dafür einsetzen soll verbindliche strenge standards zur klimaschonenden förderung und produktion fossiler kraft- und brennstoffe festzulegen ich muss etwas abkürzen weil die zeit abläuft jedenfalls möchte ich bei alldem noch mal hervorheben: man muss immer mitdenken dass natürlich auch die fossilen energien soweit wir noch von ihnen abhängig sind nachhaltigkeitsanforderungen unterworfen sind dieses thema ist auch aufgegriffen worden: im dezember gab es von der kommission einen vorschlag und wir sind darum bemüht dass dieser beschleunigt umgesetzt wird mir bleibt am ende der redezeit nur noch kurz zu erwähnen dass ihr antrag ich habe es eingangs schon angerissen quasi verfristet ist in diesem sinne werden wir ihn im wege der sofortabstimmung heute ablehnen vielen dank für ihre aufmerksamkeit ich bitte zu beachten dass sie bei überschreiten der redezeit auf kosten der nachfolgenden kolleginnen und kollegen ihrer fraktion sprechen das wort hat der abgeordnete steffen kotré für die afd-fraktion
119,07.04.2022,ID202811900,Steffen,Kotré,AfD,Steffen Kotré,sehr geehrte frau präsidentin sehr geehrte damen und herren seit kurzem überbietet sich die politik mit forderungen unsere energieversorgung umzugestalten unsere energieversorgung zu diversifizieren aber ich vermisse dabei einfach dass die kosten berücksichtigt werden: das ganze passiert konzeptionslos und eben leider ohne kalkulation der kosten laut dem vorliegenden antrag wird also eine entsprechende lng-infrastruktur gefordert wir alle wissen aber dass die hier nicht von heute auf morgen entstehen kann was stehen denn da für kosten dahinter ist denn überhaupt mal das transportproblem angesprochen bzw überdacht worden es gibt kaum transportkapazitäten und das über jahre hinaus man müsste also neue schiffe bauen der stahlpreis ist in die höhe gegangen; auch da explodieren die kosten all diese dinge werden das ganze vermutlich so teuer machen dass es sich ökonomisch gar nicht rechnet und selbst dieses lng-gas ist teurer als normales rohrleitungsgas gut wir wollen die energieversorgung diversifizieren dazu gehört lng-gas klar aber eben nicht hektisch und panisch auf den weg gebracht und es müssen wie schon gesagt alle kosten kalkuliert werden zur diversifizierung gehören aber auch kohle und kernenergie meine damen und herren und die haben den vorteil dass sie schon da sind wir müssen keine infrastruktur bauen wir müssen einfach das nutzen was jetzt schon da ist eine völlig preiswerte lösung meine damen und herren zum thema kernenergie haben sich ja viele experten zu wort gemeldet und erläutert dass der weiterbetrieb der kernkraftwerke überhaupt kein problem darstellt bei den brennelementen gibt es keinen engpass und auch die sicherheitsüberprüfungen stellen keinen engpass dar wir kommen also mit deren energie noch über den winter und wir sparen dazu auch noch mengen von gas ein das könnte doch der richtige weg sein wenn nicht die rot-grüne ideologie dem einen riegel vorschiebt und damit leider unsere marktwirtschaft und unseren wohlstand gefährdet und was soll denn der unfug mit dem wasserstoff das ist doch ökonomisch und ökologisch völlig sinnlos wir stecken doch viermal mehr energie hinein als wir herausbekommen wasserstoff ist das kleinste molekül es ist schwer zu speichern der aufwand ist enorm selbst der wirtschaftsminister habeck hat davon gesprochen dass wir beim wasserstoff in der testphase sind aber liebe freunde wir können doch nicht testen wir können doch unsere energieversorgung jetzt nicht auf die teststrecke schicken nein wir haben keine zeit mehr für experimente in der energieversorgung gestern kam der osterhase brachte das osterpaket und legte uns faule eier ins nest der energiepolitik die totalitäre klimaideologie nimmt formen an wenn nun windindustrie- und photovoltaikanlagen zur nationalen sicherheit gerechnet werden und nicht etwa die versorgungssicherheit selbst dann muss die links-grüne ideologiegetriebene politik nichts mehr begründen dann kann sie einfach so entscheiden und alle argumente die richtig sind vom tisch wischen dann gibt es keine überbordenden kosten mehr dann interessieren nicht mehr die wohlstandsverluste die höhere armut und auch die sinkende versorgungssicherheit diese argumente können dann einfach so vom tisch gewischt werden das passiert ja auch schon: windindustrieanlagen können jetzt in schutzgebiete gestellt werden pv-anlagen auf agrarflächen und sogar in moore das ist ein angriff auf unsere natur das ist die aufkündigung des naturschutzes meine damen und herren im gespräch ist auch schon der zwang dass hausbesitzer sich pv-anlagen aufs dach implementieren müssen das ist ein angriff auf das privateigentum das ist allerdings mit uns nicht zu machen achten sie bitte auf die zeit wir schützen unsere grundrechte meine damen und herren das geht mit uns so nicht vielen dank das wort hat für die fraktion bündnis /die grünen dr ingrid nestle
120,07.04.2022,ID202812000,Ingrid,Nestle,BÜNDNIS 90/DIE GRÜNEN,Ingrid Nestle,frau präsidentin liebe kolleginnen und kollegen dem vorliegenden antrag der cdu/csu-fraktion werden wir heute abend nicht zustimmen wir werden ihn ablehnen sie fordern nämlich jede menge dinge die wir längst tun die längst passieren nennen wir nur den zentralen bestandteil im titel ihres antrags die lng-infrastruktur voranzutreiben tatsächlich treibt minister habeck die infrastruktur mit einer handlungsbereitschaft mit einer entscheidungsfähigkeit voran die wir ehrlich gesagt bei der cdu-hausleitung in der letzten legislaturperiode schmerzhaft vermisst haben sie verlieren an manchen stellen auch etwas den blick für die realität herr ploß ich hatte den eindruck dass es ihnen selber in ihrer rede auch ein bisschen aufgefallen ist im antrag schreiben sie nämlich dass sie wollen dass systemrelevante lng-terminals und fsru-anlagen beides im plural also mindestens vier bis ende des jahres in betrieb genommen werden ich glaube sie haben in ihrer rede selbst gesagt so schnell wie möglich am besten noch in diesem jahr solle zumindest ein terminal in betrieb genommen werden ich glaube das was sie in ihrem antrag fordern hat ein bisschen den blick für die realität verloren besonders spannend ist dass sie das fordern die sie in der letzten legislaturperiode ich glaube fünf planungsbeschleunigungsgesetze vorgelegt haben und trotzdem brauchen infrastrukturprojekte wie schienen und straßen oft noch über ein jahrzehnt nur vier oh das ist ja erfreulich aber nicht nur diese probleme gibt es sondern der antrag ist auch finde ich enttäuschend rückwärtsgewandt weil wir in den letzten wochen meiner wahrnehmung nach in der debatte schon weiter waren sie schreiben selbst am anfang noch ganz zu recht ganz richtig: um die energiesicherheit deutschlands unabhängig von russlands öl und gas zu gewährleisten müssen nun alle zur verfügung stehenden optionen ergebnisoffen geprüft … werden richtig warum ist dann in ihrem antrag nichts zu lesen von effizienz nichts zu lesen von energiesparen und zu erneuerbaren energien fällt ihnen nichts ein außer regenerative kraftstoffe und verzicht auf kompensationsmaßnahmen das ist doch nicht ergebnisoffen wird doch dem maßstab alle maßnahmen prüfen nicht gerecht nehmen wir doch mal einen bereich der ihnen anscheinend immer wieder schwerfällt ja es würde wirklich helfen wenn wir die -h-regel bei der windenergie endlich abschaffen würden denn die hat faktisch man kann das an den zahlen ablesen den ausbau der windenergie in bayern zum erliegen gebracht im jahre wurden noch genehmigungsanträge gestellt kam h war die zahl der genehmigungsanträge um prozent zurückgegangen im jahr waren noch null übrig dass wir diese regelung abschaffen müssen müsste vielleicht auch im zentrum des interesses stehen warum kann die cdu/csu an dieser stelle nicht mitgehen verehrte damen und herren ich muss leider zum schluss kommen es reicht nicht einfach nur zu sagen: wir müssen von woanders importieren ja das ist auch wichtig aber auch im jemen gibt es krieg auch an anderen stellen passieren schreckliche dinge ja wir wollen hin zu erneuerbaren energien das ist die zukunft danke das wort hat der kollege ralph lenkert für die fraktion die linke
121,07.04.2022,ID202812100,Ralph,Lenkert,DIE LINKE,Ralph Lenkert,sehr geehrte frau präsidentin kolleginnen und kollegen bürgerinnen und bürger der bundestag muss eine unerträgliche entscheidung treffen in der ukraine tobt ein grausamer krieg dieser russische angriffskrieg muss beendet werden ein logischer gedanke ist es kein russisches erdgas mehr zu kaufen damit kein geld mehr in putins kriegsmaschinerie fließt ich sage es noch mal klar: putins krieg ist ein verbrechen und in keinster weise zu unterstützen heute stecken wir in der zwickmühle weil wir in europa in deutschland für billiges erdgas die risiken ausgeblendet haben was viele nicht wissen: wir brauchen erdgas nicht nur zum heizen nicht nur für glas- und stahlindustrie sondern auch für lebensmittel und zur herstellung von pflanzendünger düngemittel sind knapp weil man aus profitgründen die produktion auch nach russland und weißrussland verlagerte ohne düngerproduktion aus erdgas in deutschland reichen die düngerbestände nur noch für dieses jahr die ukraine und russland fallen als weizenexporteure aus in großen teilen afrikas gibt es wegen trockenheit keine ernten fehlt dünger in deutschland werden deutschland und europa zum weizenimporteur statt zu exportieren wir dürfen nicht zum importeur werden weil wir sonst den armen ländern das essen wegkaufen und ein massenhungertod droht es besteht die frage: wie kann man die drohende hungerkatastrophe abwenden wenn es ein gasembargo gibt ich habe keine antwort als mittelfristige lösung zum aufbrechen des dilemmas sind lng-hafenanlagen notwendig am besten wäre es wenn diese in staatlicher hand sind und sobald wie möglich auf wasserstoff oder ammoniak umgerüstet werden langfristig müssen wir regionale und europäische wirtschaftskreisläufe wiederherstellen und die fatalen abhängigkeiten von fossilen energieimporten beenden vielen dank das wort hat der kollege michael kruse für die fdp-fraktion
122,07.04.2022,ID202812200,Michael,Kruse,FDP,Michael Kruse,sehr geehrte frau präsidentin meine lieben kolleginnen und kollegen zunächst: herr lenkert vielen dank dass sie dieses sehr wichtige thema angesprochen haben das in dem antrag nicht so weitreichend thematisiert wird dass sie auf die zusammenhänge für die ernährung der weltbevölkerung hingewiesen haben fand ich dieser debatte sehr angemessen nun komme ich zu dem antrag insbesondere möchte ich als erstes etwas zum vorgehen sagen ich bin oppositionsabgeordneter in einem landesparlament gewesen und da kenne ich es so: als opposition fordert man was dann sagt die regierung dass sie es nicht tut und wenn es ein guter vorschlag war dann macht sie es vielleicht trotzdem hinterher und verkauft es als eigenen erfolg ihr verständnis von oppositionsarbeit ist offensichtlich ein anderes: wir als abgeordnete forderten etwas die regierung setzte es im eiltempo um und hinterher fordern sie das auch von der regierung und von der ampel ich weiß nicht das macht mich auf eine ganz merkwürdige art und weise betroffen insbesondere die tatsache dass sie offensichtlich auch die ausschussdrucksachen diese themen werden ja wöchentlich im ausschuss behandelt nicht lesen verleitet mich dazu ihnen diese vielleicht mal kurz vorzutragen in der ausschussdrucksache vom april die könnten sie kennen heißt es unter der überschrift neue lng-terminals und fsrus : die bundesregierung hat über die unternehmen … und … drei fsrus optioniert um die versorgungssicherheit in deutschland weiter zu erhöhen wenn sie uns das jetzt in ihrem antrag ernsthaft vorschlagen dann kann ich nur sagen: es ist genau wie beschrieben wir haben es uns überlegt die regierung hat gehandelt jetzt fordern sie es von uns das nehmen wir als zustimmung zu unserer arbeit herzlichen dank dafür was die konkreten standorte betrifft hätte ich mir sehr gewünscht dass sie in ihrem antrag ein bisschen differenzierter vorgehen; denn genau das wäre möglich gewesen sie wissen dass wir für die aufrechterhaltung der versorgungssicherheit nicht nur drei standorte brauchen sondern dass wir sie auch sehr gut über das land verteilen müssen wir wissen dass wir ein schiff im osten des landes brauchen wir wissen dass das zum beispiel in rostock oder in lubmin liegen könnte das bundeswirtschaftsministerium prüft gerade mit hochdruck dass diese schiffe dann auch an den richtigen orten liegen wilhelmshaven und hamburg sind weitere wichtige standorte damit wir über das gesamte netz genügend einspeisen können dazu hätte ich mir konkrete vorschläge oder ideen gewünscht ihr antrag fällt an dieser stelle hinter das zurück was in der öffentlichkeit bekannt ist und hinter das zurück was wir in den letzten wochen schon miteinander kommuniziert haben ich kann nur empfehlen: lesen sie vielleicht einfach mal die fachzeitungen; in denen wird das regelmäßig besprochen wenn sie das tun dann gewinnt ihr antrag beim nächsten mal auf jeden fall ich will aber auch positives feedback geben planungen per gesetz halten wir grundsätzlich für eine sinnvolle sache und deswegen ist das im koalitionsvertrag ja auch vereinbart die tatsache dass wir dafür hohe hürden von gerichten auferlegt bekommen führt dazu dass wir hier sehr genau überlegte maßnahmen vornehmen werden wenn wir sie vornehmen laden wir sie herzlich dazu ein fachlich beizutragen auf den punkt dass es beim thema lng-terminals insbesondere im jahr schon im ersten petitum ihres antrags gleich große ungenauigkeiten gibt ist die kollegin nestle dankenswerterweise schon eingegangen; deswegen muss ich dazu nicht mehr viel sagen er führt uns aber wie viele andere punkte dazu diesen antrag hier heute abzulehnen insbesondere führt mich persönlich dazu die tatsache dass ich ihren antrag einfach mal durchgeblättert und mir jeden einzelnen punkt angeschaut habe und tatsächlich konnte ich dann sehr viele punkte ich weiß nicht ob sie das von hinten sehen können mit einem haken belegen weil wir es schlichtweg schon angegangen oder sogar erledigt haben somit bietet dieser antrag keinen mehrwert für die politische entwicklung in diesem themenbereich mehr insbesondere der punkt macht mich in einer ist das eine zwischenfrage moment das wort erteile ich hier jetzt habe ich erst mal die uhr angehalten gestatten sie eine frage oder bemerkung des kollegen dr ploß selbstverständlich herr kollege kruse vielen dank für die zwischenfrage der kern unseres antrags ist ja dass möglichst noch in diesem jahr mit dem bau begonnen wird jetzt sagen sie sie erfüllen alle punkte die wir in unserem antrag fordern entweder bereits jetzt oder werden sie in zukunft erledigen können sie hier vor dem deutschen bundestag versprechen dass mit dem bau der ersten lng-terminals noch in diesem jahr begonnen wird lieber herr kollege ploß ich danke für die zwischenfrage; denn die kommt ja von ihnen ich kann ihnen versichern dass die regierungstragenden fraktionen und die regierung die wir tragen alles in ihrer macht stehende unternehmen werden damit der bau dieser terminals sehr bald beginnt so bald als möglich wenn sie kenntnis darüber haben dass es ihnen oder uns hier im hause möglich ist die unternehmen die diese terminals bauen sollen beispielsweise per gesetz oder verordnung dazu zwangszuverpflichten dies auf jeden fall in diesem jahr zu tun dann würde ich mich gerne mit ihnen in den fachlichen austausch darüber begeben ich glaube das ist nicht ohne weiteres möglich ich kann ihnen aber versichern: alles was in der macht dieses hauses steht wird dafür unternommen der rest ihrer frage ist so populistisch dass ich ihnen entgegenhalte: sie haben kein instrument um das zu erreichen; deswegen können sie das nicht garantieren aus dem gleichen grund kann ich ihnen das auch nicht garantieren herr kollege jetzt komme ich noch zu punkt in ihrem antrag diesen punkt fand ich ziemlich bemerkenswert wir machen hier wirklich wichtiges sie wollen da dass die bundesregierung aufgefordert wird dem deutschen bundestag zeitnah eine umfassende analyse verschiedener szenarien vorzulegen wie einseitige abhängigkeiten von russland im öl- kohle- und gasbereich abgebaut werden können ich möchte ihnen gerne ein dokument überreichen das stammt von der bundesnetzagentur und nennt sich bmwk lagebild energieversorgung es datiert vom april ist öffentlich verfügbar und beinhaltet all die analysen die sie von der bundesregierung fordern wir machen hier nicht nur wichtige gesetzgeberische arbeit wir machen auch bildungsarbeit heute möchte ich dazu beitragen sie weiterzubilden ich hoffe sie übernehmen dieses dokument von mir und lernen daraus herzlichen dank für ihre aufmerksamkeit das wort hat der kollege enak ferlemann für die cdu/csu-fraktion
