,datum,redeID,vorname,nachname,fraktion,name,inhalt_neu
77,07.04.2022,ID202807700,Sascha,Müller,BÜNDNIS 90/DIE GRÜNEN,Sascha Müller,frau präsidentin sehr geehrte damen und herren liebe kolleginnen und kollegen gäbe es das kurzarbeitergeld nicht man müsste es erfinden zahlreiche beschäftigungsverhältnisse konnten während der coronapandemie erhalten bleiben eben weil es das kurzarbeitergeld gibt auch ich war zu anfang der coronapandemie in kurzarbeit wenn auch nicht wie in anderen branchen zu prozent sondern nur mit reduzierter arbeitszeit für mich als sportjournalist gab es nun mal weniger zu tun als alle sportveranstaltungen abgesagt wurden die bundesliga komplett aussetzen musste die werbeeinnahmen ausblieben in der redaktion haben wir in dieser zeit genau darauf geachtet nicht länger zu arbeiten als es die strengen regeln der kurzarbeit erlaubten was bei einer journalistischen tätigkeit gar nicht so einfach ist: artikel müssen recherchiert mit informanten muss gesprochen werden interviews müssen redigiert und autorisiert werden manches geführte interview konnte wie ich aus anderen ressorts weiß daher gar nicht erscheinen insgesamt waren wir aber froh unseren beruf weiter ausüben zu können; denn die demokratische öffentlichkeit braucht guten journalismus und auch journalismus ist systemrelevant woran wir sicherlich seinerzeit überhaupt nicht gedacht hatten war der progressionsvorbehalt progressionsvorbehalt beim kurzarbeitergeld bedeutet es ist bereits gesagt worden dass das kurzarbeitergeld zwar steuerfrei ist der gezahlte betrag aber zur ermittlung des steuersatzes auf das eigentliche erwerbseinkommen herangezogen wird oft ergeben sich dadurch steuernachzahlungen ja aber das ist nicht zwingend es könnte auch der gegenteilige effekt eintreten zugegeben: emotional kann ich das anliegen des vorliegenden antrags aus der fraktion der linken durchaus nachvollziehen natürlich ist es ärgerlich wenn du zuerst staatliche hilfe bekommst und dann zeitverzögert über die einkommensteuer wieder was zurückzahlen sollst obwohl das kurzarbeitergeld doch eigentlich steuerfrei ist hier könnte der eindruck einer gefühlten ungerechtigkeit entstehen was aber passieren würde wenn wir dem vorliegenden antrag folgen würden wäre: wir würden aus einer vielleicht gefühlten ungerechtigkeit eine tatsächliche ungerechtigkeit machen unter ziffer des vorliegenden antrags streichen sie die notwendigkeit nach der kurzarbeit eine einkommensteuererklärung abzugeben nun für viele steuerzahlerinnen und steuerzahler bliebe diese notwendigkeit dennoch erhalten zum beispiel wenn sie einen antrag auf lohnsteuerermäßigung gestellt haben oder bei verheirateten wenn sie die steuerklassen iii und v gewählt haben die es für den im antrag genannten zeitraum ja noch gibt wie sie ja wissen wollen wir als ampel da ran das ganze wird auch nicht besser wenn sie den progressionsvorbehalt unter ziffer des antrags ganz streichen damit hebeln sie auch das ist schon gesagt worden den grundsatz der besteuerung nach leistungsfähigkeit aus und sie verschärfen den unterschied damit sorgen sie vielleicht auch für eine weitere gefühlte ungerechtigkeit zwischen jenen die als arbeitnehmerinnen und arbeitnehmer hilfen in form von kurzarbeitergeld erhalten haben und etwa soloselbstständigen die ihre überbrückungs- oder neustarthilfen das sind andere instrumente klar; aber dennoch nenne ich sie nicht nur mit progressionsvorbehalt sondern sogar insgesamt versteuern müssen nebenbei: eine bessere absicherung eine art von kurzarbeitergeld für soloselbstständige wäre mal eine überlegung wert aber das nur am rande nein das rückwirkende streichen des progressionsvorbehalts für die jahre bis wie im antrag gefordert kommt für uns in der tat nicht infrage die damit einhergehenden steuerentlastungen wären zudem und darauf kommt es gerade heute zu dieser zeit besonders an noch nicht einmal zielgerichtet für mich ich glaube für meine damaligen kolleginnen und kollegen ebenso war der sich ergebende höhere steuersatz kein wirkliches problem wenn sich steuernachzahlungen ergeben haben dann haben wir diese steuern gerne gezahlt damit der staat sich um die hilfen für die wirklich betroffenen branchen und beispielsweise auch um kunst- und kulturschaffende kümmern konnte natürlich sie hätten ja vorschläge machen können; das haben sie aber leider nicht gemacht könnte man darüber nachdenken wie diese eingangs erwähnte gefühlte ungerechtigkeit in der zukunft abzumildern wäre das ist vielleicht auch eine frage der kommunikation da sind mehrere möglichkeiten denkbar sie hätten beispielsweise einen freibetrag ab dem der progressionsvorbehalt erst gilt beantragen können das haben sie leider nicht gemacht man hätte natürlich darüber nachdenken können: was könnte man in der zukunft ändern um einerseits die besteuerung nach leistungsfähigkeit zu erhalten und andererseits die böse überraschung einer steuernachzahlung für die betroffenen zu vermeiden das wird schwer gehen oder aber vielleicht zumindest zu minimieren das haben sie mit dem vorliegenden antrag aber nicht getan und deshalb können wir uns auch nicht mit ihm anfreunden aber wir freuen uns auf die weitere diskussion im ausschuss ich danke für die aufmerksamkeit als nächste rednerin erhält für die afd-fraktion gerrit huy das wort
78,07.04.2022,ID202807800,Gerrit,Huy,AfD,Gerrit Huy,sehr geehrte frau präsidentin sehr geehrte damen und herren die linken sprechen in ihrem antrag ein problem an das sich in vielen fällen staatlicher subventionspolitik wiederfindet: sie ist nicht ehrlich genauer gesagt: ihre zahlen sind nicht ehrlich so fließt in vielen fällen gar nicht die angekündigte subventionssumme an die empfänger sondern eine reduzierte summe im fall des coronakurzarbeitergeldes heißt das in der regel dass am ende weniger als die angekündigten oder prozent des vorherigen einkommens im portemonnaie des kurzarbeiters landen warum es ist schon vielfach gesagt worden: die zahlung unterliegt dem sogenannten progressionsvorbehalt sie fließt zwar formal steuerfrei vom staat zum empfänger erhöht aber die steuern auf sein übriges einkommen sodass ihm am ende netto weniger verbleibt als angekündigt und nicht genug dass weniger geld bei ihm landet er muss dafür auch noch eine steuererklärung abgeben was besonders ärgerlich ist wenn er das zuvor nicht gebraucht hat schon beim bezug von nur euro kurzarbeitergeld wird sie fällig die steuererklärung was nicht nur beim empfänger des geldes sondern auch in den finanzbehörden einen erheblichen mehraufwand auslöst die regierung kann diesen mehraufwand zwar nicht genau beziffern; aber einige millionen zusätzliche steuererklärungen dürften es schon sein das erinnert fatal an andere hochbürokratische regierungsvorhaben wie zum beispiel die grundrente die etwa millionen rentnern zugutekommen soll es ist sehr erfreulich und es ist auch höchste zeit dass diese millionen rentner die jahrzehntelang rentenbeiträge eingezahlt haben einen aufschlag auf ihre viel zu niedrigen renten erhalten dass dafür aber neue mitarbeiter in der rentenanstalt eingestellt werden mussten zeigt dass auch die grundrente wie so vieles andere ein bürokratischer murks ist ein neuer mitarbeiter für grundrenten der steuerzahler muss ihr gehalt die nebenkosten die bürokosten und die verwaltungskosten zahlen geht’s nicht auch mal einfacher muss jede neue regierungsidee immer gleich in ein arbeitsbeschaffungsprogramm ausarten einfache lösungen die man verstehen und nachvollziehen kann mag die regierung offenbar nicht man muss ja schon steuerexperte sein um beim thema kurzarbeitergeld noch durchzublicken aber egal ob man es versteht oder nicht: zahlen muss man immer und die größenordnung hat es in sich von den milliarden euro ausgezahltem kurzarbeitergeld in flossen rund milliarden euro wieder an den fiskus zurück das sind knapp prozent die die kurzarbeiter im schnitt weniger im portemonnaie hatten als angekündigt das gleiche spiel im jahr : milliarden euro wurden als kurzarbeitergeld ausgezahlt milliarden euro flossen als steuern wieder an den fiskus zurück; wieder gut prozent das ist doch nicht fair die meisten kurzarbeiter hatten große mühe mit dem coronabedingten einkommensverlust zurechtzukommen und dann sollen sie am ende noch steuern nachzahlen und das auch noch bei der aktuellen mehrbelastung durch die hohe inflation geht’s noch wir finden die regierung sollte sich ehrlich machen und dem bürger grundsätzlich sagen was sache ist es wäre technisch übrigens überhaupt nicht schwierig den kurzarbeitern die steuererklärung abzunehmen das würde helfen man würde den progressionsvorbehalt abschaffen die kurzarbeiter hätten mehr geld und die behörden hätten weniger arbeit das wäre doch eine lösung ähnliches gilt übrigens auch für die rentenempfänger die zunehmend in die besteuerung ihrer renten hineinrutschen viele von ihnen haben in ihrem ganzen berufsleben keine steuererklärung ausfertigen müssen aber im alter verlangt man es plötzlich von ihnen am besten noch elektronisch oder sollen sie sich dafür einen steuerberater nehmen auch hier gilt dass es technisch sehr wohl möglich wäre dass die finanzbehörden den rentnern die außer ihrer rente nichts anders zu versteuern haben diese aufgabe einfach abnehmen; denn ihnen liegen alle nötigen daten vor es wäre schön wenn man den behörden die möglichkeit dazu einräumen würde aber zurück zur faktischen besteuerung des kurzarbeitergelds liebe linke wir von der afd können aus den dargelegten gründen sehr gut verstehen dass sie diesen antrag gestellt haben was wir nicht verstehen können ist dass sie einen fast gleichlautenden antrag von uns den wir schon im jahr und dann noch einmal im jahr gestellt haben rundweg abgelehnt haben das war wohl auch nicht ganz ehrlich danke das wort erhält der kollege markus herbrand für die fdp-fraktion
79,07.04.2022,ID202807900,Markus,Herbrand,FDP,Markus Herbrand,vielen dank frau präsidentin sehr verehrte kolleginnen und kollegen es ist ja schon angedeutet worden: dieser antrag ist mir nicht ganz unbekannt um es mal vorsichtig auszudrücken eigentlich müsste man lizenzgebühren dafür verlangen; denn er ist eins zu eins abgeschrieben worden man könnte ansatzweise auch eine urheberrechtsklage daraus machen aber es ist halt schlecht gemacht liebe kolleginnen und kollegen denn gute ideen sind nur dann gut wenn sie auch zum richtigen zeitpunkt kommen und gute ideen verlieren ihre wirkung wenn sie zum falschen zeitpunkt kommen sie kehren ihre wirkung teilweise geradezu um das werde ich ihnen gleich erläutern aber auch ich komme nicht umhin kurz darauf zurückzukommen was der progressionsvorbehalt eigentlich ist wir haben in deutschland einkünfte die steuerfrei sind und andere die steuerpflichtig sind in der mitte liegen die einkünfte die dem progressionsvorbehalt unterliegen es ist ja schon erläutert worden dass alle einkünfte berücksichtigt werden um den steuersatz zu ermitteln da es in den meisten fällen diesbezüglich zu nachzahlungen kommt nicht in allen aber in den meisten fällen hat der gesetzgeber vorgesorgt und sieht eine erklärungspflicht für diese fälle vor meine sehr verehrten damen und herren ich will ihren antrag nicht nur aus formalen gründen ablehnen vielmehr gibt es dafür herr kollege görke handfeste inhaltliche gründe im ursprung hatte dieser antrag im jahr eine sehr nachvollziehbare und gute agenda der gesetzgeber kann frei darüber entscheiden ob er einkünfte steuerfrei stellt ob er einkünfte steuerpflichtig stellt oder ob er einkünfte dem progressionsvorbehalt unterwirft damals hat die große koalition unseren antrag abgelehnt und gesagt: wir wollen daran nichts ändern stichwort: besteuerung nach der leistungsfähigkeit wir hätten uns damals dafür entscheiden können diesen coronabedingten progressionsvorbehalt und auch die erklärungspflicht auszusetzen das wäre seinerzeit eine große unterstützung für die menschen gewesen es wäre auch eine unterstützung für die verwaltung gewesen nun aber in ist es eigentlich zu spät nein es ist nicht eigentlich zu spät es ist zu spät diesen fehler der damaligen großen koalition zu beheben es würde geradezu zu neuen ungerechtigkeiten führen; denn sie wollen gleiche sachverhalte in der zukunft anders behandeln als in der vergangenheit und sie werden nicht wie sie in ihrem antrag schreiben für bürokratieentlastung sorgen vielmehr werden sie sogar für deutlich mehr bürokratie sorgen denn: wie wollen sie das in der praxis handhaben das müssten sie mir mal erläutern die erklärungen für sind ja schon längst abgegeben jedenfalls in den meisten fällen auch die -fälle die müssten dann ja rückwirkend korrigiert werden wollen sie das nur auf antrag machen soll das die verwaltung von amts wegen machen ist das rechtlich überhaupt noch möglich es interessiert sie vermutlich gar nicht ob das rechtlich möglich ist in der tat dieses prozedere ist einfach zu kompliziert es führt aus meiner sicht zu einer erheblichen mehrarbeit für die verwaltung wenn die - und -fälle jetzt wieder aufgerollt werden müssen deshalb denke ich ist dieser antrag überhaupt nicht durchdacht jedenfalls mit blick auf die vergangenheit ehrlich gesagt überlege ich immer noch ob es eher für mich spricht dass sie diesen antrag abgeschrieben haben oder ob es eher gegen sie spricht dass sie ihn so unreflektiert übernommen haben auch unter berücksichtigung der vergangenheit herzlichen dank vielen dank als nächster redner erhält das wort für die spd-fraktion parsa marvi und es ist seine erste rede im deutschen bundestag
80,07.04.2022,ID202808000,Parsa,Marvi,SPD,Parsa Marvi,vielen dank sehr geehrte frau präsidentin liebe kolleginnen und kollegen meine damen und herren dem antrag der fraktion die linke können wir nicht zustimmen weil er wie schon verschiedene rednerinnen und redner hier ausgeführt haben von seiner systematik her unstimmig ist und als einzelforderung unausgegoren ist damit ist ihr antrag das glatte gegenteil von der überaus zielgerichteten und wirksamen wirtschafts- arbeits- und sozialpolitik die wir seit zwei jahren zur eindämmung der auswirkungen der coronakrise einsetzen die nicht zuletzt von der spd in regierungsverantwortung vorangetrieben wurde und die sich jetzt ganz konkret in der arbeit dieser ampelkoalition niederschlägt ich versuche jedem antrag fast jedem antrag den ich ablehne etwas positives abzugewinnen und ich werde auch bei ihnen fündig ganz zu beginn ihres antrags finden sich durchaus anerkennende worte für unsere politik zur bewältigung der coronakrise sie haben recht dass das modell der kurzarbeit das wir schon in der wirtschafts- und finanzkrise / mit dem damaligen arbeitsminister olaf scholz erfolgreich erprobt haben und jetzt wieder mit hubertus heil unsere gesellschaft vor starken job- und wohlstandsverlusten bewahrt hat dadurch wurden in der spitze bis zu millionen jobs gerettet; herr müller hat ganz lebensnah ausgeführt welche branchen davon betroffen waren das instrument der kurzarbeit das alleine in meiner region über die agentur für arbeit karlsruhe-rastatt mehr als unternehmen in der spitze genutzt haben und die steuerfreie lohnersatzleistung kurzarbeitergeld waren und sind ein ganz zentraler baustein und markenzeichen unserer krisenpolitik die international anerkennung und nachahmer gefunden hat und unsere volkswirtschaft bis heute stabilisiert millionen von beschäftigten haben bisher vom kurzarbeitergeld profitiert das wir in den letzten zwei jahren herr gutting hat das glaube ich ausgeführt immer wieder optimiert haben mit einem auszahlungsvolumen von über milliarden euro die aktuelle krisenlage die sich verschärfenden lieferkettenprobleme und die enormen wirtschaftlichen folgen des russischen angriffskriegs in der ukraine zeigen dass das kurzarbeitergeld eine ganz wichtige leistung ist die dringend gebraucht wird aber damit bei dieser langen debatte zu ihrem antrag nicht der eindruck verfängt dass wir uns im zuge von maßnahmen zur stabilisierung und entlastung nur einzig und allein auf das kurzarbeitergeld konzentrieren müssten helfe ich ihnen gerne auf die sprünge wie umfassend das antikrisenmanagement dieser letzten zwei jahre war und wie umfassend es vor allen dingen noch werden wird wir bringen millionen von beschäftigten und unternehmen mit vielen durchdachten maßnahmen durch diese krise so haben zehntausende antragstellende unternehmen profitiert milliarden euro die im übrigen in der regel voll zu versteuern sind hat der staat während der pandemie an unternehmen ausgezahlt als sofort- überbrückungs- oder neustarthilfen über kfw-kredite oder den wirtschaftsstabilisierungsfonds für große unternehmen neben der kurzarbeit haben genau diese maßnahmen zum erhalt von arbeitsplätzen und zur vermeidung von insolvenzen beigetragen im jahr gab es knapp insolvenzen; das waren prozent weniger als im vorjahr und prozent unter vorkrisenniveau hinzu kommen konjunkturstützende maßnahmen die wir ganz konkret noch in dieser woche in erster lesung beim corona-steuerhilfegesetz und beim steuerentlastungsgesetz im bundestag beraten werden auch die bürgerinnen und bürger entlasten wir in diesem jahr mit einer vielzahl von konkreten maßnahmen in den bereichen mobilität energie und steuernachlässen mit einem volumen von mehr als milliarden euro genau das kommt familien und beschäftigten die ihnen als linke-fraktion so wichtig sind enorm zugute liebe kolleginnen und kollegen das alles zeigt: die ampelkoalition handelt umfassend und entschlossen um unser land gut durch die aktuellen krisen zu führen arbeitnehmerinnen und arbeitnehmer und unternehmen können sich sicher sein dass diese koalition zu zielgenauen maßnahmen greift die entlasten jobs und wohlstand sichern sie können sich auf die ampelkoalition verlassen wir haben eine abgestimmte strategie das ist weitaus wichtiger als das ganz kleine karo das die linke hier mit ihrem antrag zu spielen versucht wir werden diesen antrag guten gewissens ablehnen und mit unserer arbeit einfach weitermachen vielen dank das wort hat der kollege dr michael meister für die cdu/csu-fraktion
81,07.04.2022,ID202808100,Michael,Meister,CDU/CSU,Michael Meister,frau präsidentin liebe kolleginnen und kollegen die kurzarbeit und das kurzarbeitergeld sind ein etabliertes instrument das wir in deutschland haben um beschäftigung bei schwankungen in der nachfrage zu stabilisieren es ist auch ein dauerhaftes instrument allerdings haben wir in der finanzkrise und auch in der coronapandemie die zugangsregeln vereinfacht und wir haben die bezugszeiten deutlich erweitert um damit sozusagen dem schock der den arbeitsmarkt getroffen hat entgegenzuwirken und zu einer stabilisierung der beschäftigung beizutragen ich glaube das war eine richtige entscheidung jetzt muss man zur kenntnis nehmen dass das kurzarbeitergeld keine wohltat des staates ist sondern durch beiträge von arbeitnehmern und arbeitgebern finanziert wird anfang dieses monats sind fast alle maßnahmen im zusammenhang mit corona ausgelaufen deshalb sollten wir an der stelle darüber nachdenken ob wir aus fairnessgründen gegenüber denjenigen die das ganze bezahlen nämlich die arbeitnehmer und arbeitgeber die beiträge entrichten uns dringend mit der frage nach dem auslaufen der sonderregelungen auseinandersetzen müssten ich glaube das ist dringend geboten aus fairness gegenüber denjenigen die das ganze bezahlen der antrag der hier von der fraktion die linke gestellt wird bezieht sich auf den progressionsvorbehalt nach § einkommensteuergesetz und er bezieht sich ausschließlich auf die jahre bis ich habe eingangs gesagt: das kurzarbeitergeld gibt es dauerhaft nur die sonderregelungen zu zugang und dauer sind befristet deshalb müssten sie eigentlich wenn sie so einen antrag stellen das wäre denklogisch den antrag unbefristet stellen das tun sie ausdrücklich nicht deshalb ist das wie man sieht ziemlicher unsinn zum zweiten: sie stellen hier steuerpolitische grundsätze infrage das kann man tun man kann über die frage ob etwas steuerpflichtig ist oder nicht diskutieren worüber man nach meiner meinung nicht diskutieren sollte ist das prinzip der leistungsfähigkeit das prinzip der leistungsfähigkeit ist ein geltender grundsatz sie stellen dieses prinzip jetzt mit ihrem antrag infrage das könnte man wie gesagt durchaus in die diskussion bringen dann müssten sie aber bitte schön nicht nur das geltende prinzip infrage stellen sondern sie müssten einen neuen satz von prinzipien auf den tisch legen; über den wir diskutieren damit wir eine neue grundlage für die steuerpolitik in diesem land haben das tun sie aber nicht sondern sie greifen ein prinzip heraus stellen es infrage heben es auf und setzen nichts neues an diese stelle das nenne ich willkür und ich möchte in diesem land keine willkürliche steuerpolitik ich fand das eben sehr charmant herr herbrand wie sie für die fdp argumentiert haben es gibt zeiten da kann man prinzipien außer kraft setzen und stattdessen mit willkür arbeiten und es gibt andere zeiten in denen man nicht mit willkür arbeitet ich sage: wenn man prinzipien hat dann gelten die dauerhaft und dann muss man dauerhaft für diese prinzipien eintreten liebe kolleginnen und kollegen sie sollten sich in der fdp für die nächste phase der opposition gut überlegen ob sie wenn sie wieder anträge formulieren dann nicht ein paar prinzipien aufrechterhalten meine damen und herren das kurzarbeitergeld selbst ist nicht steuerpflichtig und es werden auf das kurzarbeitergeld auch keine steuern gezahlt; es ist eine steuerfreie leistung als einkommensersatzleistung worauf steuern gezahlt werden muss ist das sonstige einkommen jenseits des kurzarbeitergeldes es ist aber glaube ich unstreitig dass durch den bezug des kurzarbeitergeldes die leistungsfähigkeit gesteigert wird und wenn die leistungsfähigkeit steigt dann ist es angemessen die kollegen haben das ausgeführt dass ein höherer steuersatz auf dieses einkommen fällig wird dann wird diese steuer aus dem sonstigen einkommen gezahlt deshalb bleibt das kurzarbeitergeld vollkommen steuerfrei meine damen und herren ich bin schon überrascht dass dieser antrag jetzt gerade von den linken kommt sie tragen uns hier in vielen debatten vor: je höher das einkommen von jemandem und je höher seine leistungsfähigkeit ist umso höher müsste besteuert werden und sie mahnen uns permanent die steuern in deutschland für menschen mit höheren einkommen seien zu niedrig jetzt argumentieren sie bei diesem antrag denklogisch genau umgekehrt sie sagen: es gibt gründe dass jemand eine höhere leistungsfähigkeit hat aber den wollen wir nicht besteuern das hat auch nichts mit ihrer logik zu tun die sie von morgens bis abends vortragen: wer mehr hat soll bitte mehr zahlen meine damen und herren ich habe vorhin gesagt: das kurzarbeitergeld wird von den beitragszahlern finanziert an dieser stelle will ich deutlich sagen: das ist eine solidarleistung der menschen die jeden tag arbeiten an diejenigen die aktuell ein problem haben dann muss ich aber bitte schön verlangen dass diejenigen die solidarität empfangen nämlich das kurzarbeitergeld auch selbst einen solidarbeitrag leisten indem sie vernünftig ihre steuern entrichten dieser meinung bin ich und deshalb werden wir diesem antrag nicht zustimmen das bundesverfassungsgericht das ist richtigerweise vorhin gesagt worden hat sich mit der frage befasst und in zweierlei hinsicht sehr deutlich gesagt dass der progressionsvorbehalt verfassungsgemäß ist zum einen bezogen auf artikel absatz grundgesetz den allgemeinen gleichheitssatz das bundesverfassungsgericht hat ausdrücklich festgestellt: er wird nicht verletzt und zum zweiten bezogen auf das sozialstaatsprinzip; es hat festgestellt dass die einbeziehung der lohnersatzleistungen in den anwendungsbereich des progressionsvorbehalts keinen verfassungsbruch darstellt deshalb glaube ich ist es gut wenn wir ihren antrag diskutieren es ist aber genauso gut und wichtig dass wir ihn dann ablehnen vielen dank für bündnis /die grünen ergreift das wort der kollege dr wolfgang strengmann-kuhn
