,datum,redeID,vorname,nachname,fraktion,name,inhalt_neu
78,14.02.2019,ID198007800,Sebastian,Hartmann,SPD,Sebastian Hartmann,"sehr geehrter herr präsident! meine sehr geehrten damen und herren! herzlichen glückwunsch an die union! glauben sie eigentlich nach dieser aktuellen stunde, dass es eine schlaue idee war, drei jahre nach ein werkstattgespräch zum thema migration durchzuführen? sie haben gut hundert leute zusammengerufen und am ende hier im plenum etwas aufgeführt, das sich echt sehen lassen kann. wenn sie die geschichte schon nicht richtig erzählen, dann erinnere ich einmal daran, dass der ehemalige innenminister thomas de maizière in dieser woche ein buch vorgestellt hat, in dem er das, was der jetzige innenminister, ein csu-mann, mit blick auf die damaligen verhältnisse als herrschaft des unrechts bezeichnet hat, ehrabschneidend genannt hat. sie haben damit ein thema aufgegriffen, von dem wir als sozialdemokratinnen und sozialdemokraten gedacht haben, dass wir es in der vergangenen legislaturperiode auf einen guten weg gebracht haben, dass wir es geordnet haben. sie müssen sich auch den vorwurf gefallen lassen, dass sie seit den deutschen innenminister stellen und immer wieder die verantwortung für die migrationspolitik wegschieben, weil sie von den wahren problemen dieses landes ablenken wollen. sie haben damit der afd eine steilvorlage geboten. ich sage ihnen in aller klarheit: ich würde mir wünschen, wenn sie nur einen bruchteil ihres engagements, das sie im kampf gegen flüchtlinge aufbringen, auch einmal im kampf gegen steuerflüchtlinge einsetzen würden. denn darum geht es in unserem land: es geht nicht um die frage der pässe, sondern es geht auch um die frage von oben und unten, von arm und reich, von menschen mit chancen und ohne chancen in diesem land. kümmern sie sich um die wahren probleme in diesem land. darum hat sich die spd am vergangenen wochenende gekümmert. während sie in der werkstatt saßen und sich über irgendetwas unterhalten haben, was sie als migrationspolitik der vergangenheit bezeichnet haben, haben wir uns darum gekümmert, die wahren probleme der menschen in ihrem realen leben zu lösen. das ist gute politik in diesem land. glauben sie denn ich schaue dabei auf die menschen, die ich als gäste hier im haus auf den tribünen begrüße , dass es irgendjemandem besser geht mit seiner wohnung, wenn sie weiter solche selbstgespräche führen? wir wollen wohnen bezahlbar machen. glauben sie, dass die perspektiven für bis millionen menschen besser werden, wenn sie die einführung einer grundrente ohne bedürfnisprüfung mit der begründung blockieren, dass das keine frage für die cdu/csu ist? geben sie den widerstand auf, und machen sie endlich wieder politik für die vielen in diesem land und nicht die wenigen, meine damen und herren! und wenn wir schon dabei sind: wir wollen wohnen bezahlbar machen. wir wollen, dass es eine vernünftige rente gibt. sie haben aber das thema migration aufgemacht, und die afd ist dabei willfähriger helfer. sie vernebeln die wahren probleme. sie kümmern sich nur um die fragen der migration und um alles andere nicht. sie lenken davon ab, dass es in diesem land nicht gerecht zugeht. überlegen sie sich mal, wessen geschäft sie hier betreiben. sie reden nicht über die steuerflucht. sie reden nicht darüber, dass banken sich nicht an die regeln des wirtschaftssystems halten. sie verhindern, dass die mitte der gesellschaft endlich wieder anteil daran hat, dass es in diesem land gerechter zugeht. schaffung von gerechtigkeit ist die linie der sozialdemokratie. wir kümmern uns um arbeitsplätze, die gut bezahlt sind. wir kümmern uns um wohnen, das bezahlbar ist. wir kümmern uns um die grundrente. wir kümmern uns auch um bezahlbare energie, und wir kümmern uns darum, dass der klimawandel nicht dafür sorgt, dass alle absaufen. meine damen und herren, das ist verantwortungsvolle politik, die die realen probleme von realen menschen in den mittelpunkt rückt und nicht ständig ablenkt. liebe kollegen von der cdu/csu, wenn ihr meint, mit uns einen koalitionsvertrag schließen zu können und ihn dann beim thema migration, das so genau geregelt ist wie kein anderes thema, ändern zu können, dann sage ich: früher aufstehen, besser aufpassen! das ist geregelt. da könnt ihr so oft, wie ihr wollt, in die werkstatt fahren. so geht es nicht. meine damen und herren, wir haben um diese aktuelle stunde nicht gebeten. es ist die idee einer anderen fraktion gewesen. aber das wunderbare an politik ist: politische positionen werden wieder klar unterscheidbar. das brauchen wir nach dem katastrophenjahr , das insbesondere die csu und horst seehofer zu verantworten haben. jetzt können wir politik wieder unterscheidbar machen. das geht auch in einer großen koalition mit einem klaren profil einer linken, progressiven sozialdemokratie, einer volkspartei, die sich um die wahren probleme der menschen kümmert. das ist die linie. sie lachen noch. wir haben den erfolg. detlef seif hat von der evp gesprochen. zur evp gehört viktor orban. der ist bei euch in der parteienfamilie. das müsst ihr verantworten bei der europawahl. wir haben eine andere linie. wir kümmern uns um die menschen in diesem land. herzlichen dank. glück auf! der letzte redner in der aktuellen stunde ist der kollege alexander throm, cdu/csu-fraktion."
79,14.02.2019,ID198007900,Alexander,Throm,CDU/CSU,Alexander Throm,"sehr geehrter herr präsident! werte kolleginnen und kollegen! was können wir am ende dieser aktuellen stunde festhalten? die cdu veranstaltet ein werkstattgespräch, die afd beantragt eine aktuelle stunde, und von links bis rechts schreien alle auf. das heißt, wir haben als union etwas richtig gemacht, liebe kolleginnen und kollegen. zur fdp. frau kollegin teuteberg, es ist schon recht, wenn sie hier versuchen, kritik zu üben. keine sorge, warten sie es ab. immer an der richtigen stelle. die kollegin teuteberg hat versucht, kritik zu üben. nur, wenn sie kritik daran üben, dass es schwierig ist, mit den grünen im bundesrat die einstufung von ländern als sichere herkunftsländer zu beschließen, dann ist das problem, dass auch sie zumindest in zwei ländern mit den grünen in koalitionen stehen und sie es auch nicht durchsetzen können. das heißt, sie sollten, wenn sie im glashaus sitzen, nicht mit steinen werfen. es wurde gesagt, dass wir die lehren aus gezogen haben. es wurde viel erreicht; aber das thema steuerung, begrenzung der migration ist eine dauerbaustelle. deswegen auch die bezeichnung werkstattgespräch . es ist wichtig und gut, dass wir uns heute, im jahr , nach dem start einer neuen parteivorsitzenden, intensiv darüber unterhalten, bilanz ziehen und ausblick geben, wie wir die situation in der zukunft noch verbessern wollen. denn wir stellen fest: in der praxis ist das eine oder andere werkzeug, das wir haben, stumpf oder stumpf geworden. deswegen haben wir die werkzeuge nachgeschliffen und teilweise unseren werkzeugkasten aufgefüllt. die kollegen der spd jetzt kommt die erwiderung haben heute nur eines gezeigt: sie reden bei einem tagesordnungspunkt, wo es um die migration geht und darum, welche konsequenzen dies für die bundesregierung hat, nicht über dieses thema. sie reden über rente und wohnen alles wichtige themen , aber sie haben ihr thema verfehlt, liebe kollegen. ihr werkzeugkasten zur steuerung der migration ist offensichtlich leer. insofern kann ich nur allen parteien auch ihnen und insbesondere den grünen empfehlen, sich einmal mit den praktikern zusammenzusetzen. ich war dabei. das war hochinteressant. sie sollten eben nicht nur diejenigen einladen, frau kollegin polat, die ihnen sms schicken, sondern auch diejenigen, die ihnen nicht nach dem munde reden, diejenigen, die vielleicht mal eine andere sicht der dinge für sie bringen. dann ist das auch eine gewinnbringende angelegenheit. meine sehr verehrten damen und herren, liebe kolleginnen und kollegen, ich will auf ein kernproblem hinweisen. die mehrheit derjenigen, die zu uns kommen und schutz suchen, ist am ende der tage nicht schutzberechtigt. wurden prozent, wurden prozent der flüchtlinge nicht anerkannt. diese mehrheit der flüchtlinge müsste wieder ausreisen das sagen selbst die grünen , sie tun es nur nicht. wir haben heute abgelehnte ausreisepflichtige asylbewerber in deutschland. davon haben eine duldung. die duldung selbst ändert normalerweise nichts an der ausreisepflicht. sie bedeutet nur, dass die zwangsmaßnahme zeitweise ausgesetzt ist. eigentlich sollte diese duldung der ausnahmefall sein, laut unserem gesetz. tatsächlich ist sie zum regelfall geworden. unser ziel als union ist, dieses regel-ausnahme-verhältnis wieder richtig herzustellen. wer rechtskräftig abgelehnt wurde, muss deutschland in der regel auch wieder verlassen. liebe frau kollegin polat, sie und auch ihre parteivorsitzende baerbock, die in diesem jahr immer propagiert, dass wir den rechtsstaat durchsetzen müssen, sind herzlich aufgefordert, an dieser durchsetzung des rechtsstaates auch mitzuarbeiten. denn das, was wir heute erleben das wurde von praktikern so bezeichnet , ist ein abschiebedebakel. die meisten eingeleiteten abschiebungen enden im versuch, sie scheitern. das führt zu frust bei allen aktiven beteiligten. sprechen sie auch einmal mit den bundespolizistinnen und bundespolizisten, mit den mitarbeiterinnen und mitarbeitern in den ausländerbehörden. deshalb müssen wir hier aktiv werden, und das werden wir tun. wenn gefragt wurde, insbesondere liebe kollegen der spd, welche konsequenz das werkstattgespräch hat das ist thema dieses tagesordnungspunkts , dann ist es die, dass wir auch mit unseren neuen werkzeugen, mit den vorschlägen, auf die wir uns konzentriert und festgelegt haben, das gespräch mit ihnen suchen und ihnen auch die möglichkeit geben, ihren werkzeugkasten ein bisschen aufzufüllen. wir werden dies in allernächster zeit tun, indem wir das zweite gesetz zur besseren durchsetzung der ausreisepflicht einbringen werden und mit ihnen gemeinsam eine vernünftige gesetzgebung hier im bundestag machen. ich freue mich auf die abstimmung mit ihnen, herr kollege hartmann. herzlichen dank. vielen dank, kollege throm. die aktuelle stunde ist beendet. bevor wir zum nächsten tagesordnungspunkt kommen, darf ich ihnen die von den schriftführerinnen und schriftführern ermittelten ergebnisse der wahlen bekannt geben. ich beginne mit dem ergebnis der wahl eines mitglieds des vertrauensgremiums gemäß § absatz der bundeshaushaltsordnung: abgegebene stimmen , ungültige stimmen . mit ja haben gestimmt , mit nein , enthaltungen . der abgeordnete marcus bühl hat die erforderliche mehrheit von mindestens stimmen nicht erreicht. er ist als mitglied des vertrauensgremiums gemäß § absatz der bundeshaushaltsordnung nicht gewählt. das zweite ergebnis betrifft die wahl von zwei mitgliedern des gremiums gemäß § des bundesschuldenwesengesetzes. hier gab es abgegebene stimmen. für albrecht glaser haben mit ja gestimmt, neinstimmen, enthaltungen, ungültige stimmen. für volker münz haben mit ja gestimmt, mit nein, enthaltungen, ungültige stimmen. die abgeordneten albrecht glaser und volker münz haben damit die erforderliche mehrheit nicht erreicht. dann kommen wir zum ergebnis der wahl eines mitglieds des sondergremiums gemäß § absatz des stabilisierungsmechanismusgesetzes: abgegebene stimmen , ungültig . mit ja haben gestimmt, mit nein , enthaltungen . der abgeordnete peter boehringer hat die erforderliche mehrheit von mindestens stimmen nicht erreicht und ist damit als mitglied des sondergremiums gemäß § absatz des stabilisierungsmechanismusgesetzes nicht gewählt. das letzte ergebnis, das ich zu verkünden habe, betrifft die wahl des stellvertretenden mitglieds des sondergremiums gemäß § absatz des stabilisierungsmechanismusgesetzes: abgegebene stimmen , ungültig . mit ja haben gestimmt, mit nein , enthaltungen . die abgeordnete dr. birgit malsack-winkemann hat die erforderliche mehrheit von damit nicht erreicht und ist als mitglied des sondergremiums gemäß § absatz des stabilisierungsmechanismusgesetzes nicht gewählt."
80,14.02.2019,ID198008000,Stephan,Pilsinger,CDU/CSU,Stephan Pilsinger,"herr präsident! sehr geehrter herr bundesminister spahn! meine damen und herren! heute ist ein guter tag für viele menschen, die auf ein spenderorgan warten; denn heute bringen wir das zweite gesetz zur änderung des transplantationsgesetzes auf den weg. damit tragen wir maßgeblich dazu bei, die zahl der freiwilligen organspenden in deutschland zu erhöhen. vier zentrale aspekte des gesetzes werde ich hervorheben. beginnen möchte ich damit, dass wir die position der transplantationsbeauftragten mit diesem gesetz stärken und ausbauen. denn erstens werden wir die beauftragten für ihre wichtige aufgabe nach bundeseinheitlichen regeln freistellen. zweitens erhalten transplantationsbeauftragte künftig zugang zu den intensivstationen und zu allen erforderlichen informationen, um das spenderpotenzial auswerten zu können. drittens müssen sie künftig hinzugezogen werden, wenn patienten nach ärztlicher beurteilung als organspender in betracht kommen. in einem satz: die transplantationsbeauftragten werden mehr helfen können. ich begrüße die neuen vergütungsregelungen für die entnahmekrankenhäuser sehr; denn wir haben die ab geltungspauschalen besser als bisher ausdifferenziert. damit bilden wir den jeweiligen sächlichen und personellen gesamtaufwand in den einzelnen prozessschritten einer organspende besser ab. zudem enthalten die entnahmekrankenhäuser künftig einen zuschlag als ausgleich dafür, dass ihre infrastruktur im rahmen der organspende in besonderem maße in anspruch genommen wird. kurz: wir verbessern die strukturellen und finanziellen voraussetzungen in diesen häusern erheblich. und noch etwas ist so neu wie wirkungsvoll: wir stellen sicher, dass regional und flächendeckend die spezifisch qualifizierten ärzte bereitstehen. genau das gewährleistet der neurochirurgische und neurologische konsiliarärztliche rufbereitschaftsdienst. besonders freut es mich, dass wir die betreuung der angehörigen von organspendern verbessern und erstmals auf eine gesetzliche grundlage stellen. das ist mir besonders wichtig. jetzt darf die koordinierungsstelle den angehörigen postmortaler organspender ein angebot machen. sie kann betreuung bereitstellen und angehörigentreffen organisieren. damit ist ein wichtiges kurz- und langfristiges unterstützungsangebot gesetzlich verankert. zudem regeln wir den austausch zwischen den organempfängern und den nächsten angehörigen der organspender in form anonymisierter schreiben verbindlich. ein solcher austausch ist für viele betroffene von großer bedeutung. mit diesen maßnahmen verbessern wir die betreuung der angehörigen. dieser prozess ist aber noch nicht abgeschlossen. über den heutigen fortschritt hinaus müssen wir über die verbesserung der psychischen versorgung von spenderangehörigen und entsprechende regelungen nachdenken. dieses werden wir im nachgang dieses gesetzesverfahrens weiter im blick behalten. mit diesem gesetzentwurf ist viel erreicht. wir verbessern den prozess der organspende an entscheidenden stellen. dies wird zu einem nachhaltigen anstieg der organspendenzahlen in deutschland führen. damit werden wir mehr leben durch organspenden retten können. vielen dank allen, die an diesem gesetzentwurf mitgewirkt haben. der nächste redner ist für die afd-fraktion der kollege dr. robby schlund."
81,14.02.2019,ID198008100,Robby,Schlund,AfD,Robby Schlund,"herr präsident! liebe kollegen! werte gäste auf den rängen! organspenden in deutschland reichen nicht. von bis heute ist die zahl der organspender zurückgegangen. deshalb halten wir den gesetzentwurf der bundesregierung zur änderung des transplantationsgesetzes zunächst für eine sehr gute idee. speziell die verbesserung der zusammenarbeit und die stärkung der transplantationsbeauftragten in ihrer position sind die richtigen hebel. aber wenn man etwas macht, dann sollte man es auch gut machen und vor allem zu ende diskutiert haben. das ziel muss eine lösung sein, die den menschen in unserem land das vertrauen in die institutionen wieder zurückgibt, eine vertrauenslösung gewissermaßen. ansonsten würde man mit dem gesetz eher das gegenteil bewirken, nämlich weniger organspendebereitschaft, und das, meine damen und herren, wäre tatsächlich fatal. die transplantationsbeauftragten erhalten durch das gesetz weitreichende kompetenzen. so weit, so gut! was sie allerdings nicht beachtet haben, ist, dass nur durch ein strenges, bundesweit einheitliches ausbildungscurriculum der bundesärztekammer die notwendige qualitätssicherung erreicht werden kann. das sollte allerdings mit einer entsprechenden prüfung der fachlichen und ethischen eignung der zukünftigen transplantationsbeauftragten unter beweis gestellt werden. ansonsten, mit verlaub, erreichen sie nur chaos. wir möchten bemängeln, dass transplantationsbeauftragte selbstständig eigene verfahrensabläufe für die organentnahme in der klinik erstellen können. in deutschland sind derzeit mindestens entnahmemöglichkeiten verfügbar. wollen sie allen ernstes riskieren, verfahrensweisen bei der organentnahme einzeln irgendwie händeln zu müssen? was ist denn, wenn ein transplantationsbeauftragter vertreten werden muss, vielleicht von einem kollegen aus einem ganz anderen teil von deutschland? wird das selbst installierte system der organentnahme, von der vorbereitung bis zur betreuung der hinterbliebenen, dann etwa von einem tag zum anderen komplett umgekrempelt, oder schlimmer noch soll dann ein vertreter im eigenen haus, der nach ihrem vorschlag noch nicht einmal arzt sein muss, die verantwortung für dieses hochsensible prozedere übernehmen? nein, nein und nochmals nein. sollte man nicht gerade hier bei der so massiven erweiterung der privilegien der transplantationsbeauftragten bestimmte juristisch verankerte verhaltensregeln und ‑verpflichtungen abverlangen? wir denken, dass dies unumgänglich ist. schaffen sie bitte eine bundeseinheitliche richtlinie, die im einzelnen die zuständigkeiten sowie handlungs- und prozessabläufe in entnahmekliniken festlegt, ein qualitätsmanagementsystem für den prozessablauf bei der organspende, verbindlich für alle entnahmekliniken und transplantationszentren. das, meine damen und herren, schafft vertrauen und kontinuität. last, but not least: erkennen sie auch die spendenbereitschaft als ehrenamt an. verbessern sie die überlebenschancen von dialysepatienten durch die einführung und vergütung der cross-over-spende! und bitte, liebe kolleginnen und kollegen hier im bundestag, lehnen sie nicht gleich, ohne nachzudenken, jeden antrag der afd ab. die grundidee des gesetzentwurfs ist gut, aber es fehlt an strukturierung und qualitätsabsicherung. stimmen sie zu, unsere zusatzanträge an den ausschuss zu überweisen, damit wir darüber noch mal gemeinsam beraten können. ich bin mir sicher, dass wir eine gute lösung finden werden, mit der wir das vertrauen in die organspende wieder zurückgewinnen können. es geht hier nicht um uns, meine damen und herren, es geht einzig und allein um das interesse und das wohl unserer bürger und patienten in unserem land. vielen dank. für die spd-fraktion hat das wort der kollege dr. karl lauterbach."
82,14.02.2019,ID198008200,Karl,Lauterbach,SPD,Karl Lauterbach,"herr präsident! meine sehr verehrten damen und herren! zunächst einmal ist ihnen, herr schlund, zu danken. sie haben zur sache geredet. wir werden uns natürlich mit ihren anträgen beschäftigen. das verdienen die anträge. ich bin nicht ihrer meinung. ich glaube, dass das von ihnen angesprochene qualitätsmanagement sehr bürokratisch wäre und es auch nicht von bundesseite kontrollierbar wäre. trotzdem ist es mal ein konstruktiver vorschlag das muss hier erwähnt werden , der unserer prüfung bedarf. wir werden das im ausschuss tatsächlich diskutieren. bei der organspende müssen wir unbedingt etwas tun das ist ganz klar. die organspende ist einer der bereiche, in denen eine organisation zwar besonders notwendig ist, aber nicht wirklich gut vorgehalten wird. es ist auch einer der wenigen bereiche in der medizin, in denen man systematisch verluste macht, wenn man sich dort engagiert. die pauschalen sind nicht kostendeckend. das engagement, das hier gezeigt wird, führt systematisch zu verlusten. der bereich ist darüber hinaus sehr intransparent, und die organisation ist nicht wirklich so straff, wie sie gerade in diesem bereich sein müsste. daher ist das heute vorliegende gesetz ein wichtiges gesetz das ist keine kleinigkeit. es geht insbesondere darum, hier wirklich mit kostendeckung zu arbeiten. wir wollen diesen bereich nicht in einen bereich verwandeln, in dem man gewinne macht; es soll kein gewinnerzielungsbereich sein. daher ist es sehr sinnvoll, dass wir in diesem bereich genauso wie in der pflege erstmals zu einem system der kostenerstattung kommen. neben der herausnahme der pflege aus den fallpauschalen ist das jetzt der zweite bereich im krankenhaussektor, in dem wir die kostenerstattung wieder einführen, weil wir wollen, dass dort keine gewinne, aber auch keine verluste gemacht werden. das ist aus meiner sicht ein schritt in die richtige richtung. darüber müssen wir auch in bezug auf andere bereiche grundsätzlicher nachdenken. wir haben hier pauschalen, die sich nicht an den tatsächlichen kosten orientieren. das ändern wir, indem wir die pauschalen differenzieren. das spezifische tut hier nichts zur sache. der grundsätzliche unterschied ist aber, dass die pauschalen, die in der vorbereitung notwendig sind, in abhängigkeit von der schwere der erkrankung und dem aufwand der transplantation da gibt es große unterschiede; eine nierentransplantation ist weniger aufwendig als die transplantation einer herz-lungen-einheit differenziert werden. wir werden hier insgesamt dazu kommen, dass eine win-win-situation für das gesundheitssystem entsteht: wir geben etwas mehr geld aus, aber wir sparen auch geld. denn wenn es zu mehr transplantationen kommt, ersparen wir dem gesundheitssystem die hohen folgekosten, die bei jedem patienten, bei dem nicht transplantiert werden könnte, entstehen würden, weil er beispielsweise dauerhaft in der dialyse behandelt werden müsste. somit ist es ein gesetz, mit dem einerseits die krankenkassen langfristig geld sparen und andererseits die leistungen der krankenhäuser entsprechend gewürdigt werden. es ist eine win-win-situation, die wir dringend benötigen. daher ist es an der zeit, dass wir das jetzt regeln. ich komme zum abschluss. das gesetz wird nicht das problem lösen, dass wir insgesamt zu wenige gespendete organe haben. jeder fünfte auf der warteliste stirbt in deutschland. das ist ein unerträglicher zustand. prozent der bevölkerung sind grundsätzlich spendebereit. höchstens ein drittel ist aber später in dem sinne spendebereit, dass die spendenbereitschaft dokumentiert wurde und eine spende damit auch umgesetzt werden könnte. diese riesige lücke müssen wir schließen. was nützt die beste organisation der organspende, wenn es keine organe gibt? daher brauchen wir darüber hinaus dringend die wichtige reform der art und weise, wie die einverständniserklärung eingeholt wird. es ist bekannt, dass ich mich dort für eine widerspruchslösung einsetze; aber es gibt auch andere möglichkeiten, die wir hier diskutieren werden. das darf man nicht gegen das, was wir heute beschließen, ausspielen. wir brauchen sowohl eine bessere organisation der spenden, die stattfinden, als auch eine erhöhung der zahl der spenden, die überhaupt möglich sind, und wir machen heute den ersten wichtigen schritt. für die fdp-fraktion hat das wort die kollegin katrin helling-plahr."
