,datum,redeID,vorname,nachname,fraktion,name,inhalt_neu
59,19.10.2018,ID195905900,Jörg,Cezanne,DIE LINKE,Jörg Cezanne,frau präsidentin meine damen und herren mit dem vorliegenden gesetz will die bundesregierung ausdrücklich den bau von mietwohnungen für menschen mit mittlerem und niedrigem einkommen fördern private bauherren und investoren sollen dafür über vier jahre eine steuerentlastung erhalten das ziel teilen wir der weg dahin überzeugt uns nicht das eigentliche problem die frau staatssekretärin hat es sozusagen von hintenrum angesprochen im mietwohnungsbau sind zurzeit gar nicht die herstellungskosten oder die baukosten das eigentliche problem sind die bodenpreise insbesondere da wo wohnungen fehlen nehmen wir ein beispiel aus meiner heimat: im frankfurter nordend kostet der quadratmeter mindestens euro wenn sie diese grundstückskosten auf ein normales mietshaus umlegen dann sind das schon euro pro errichtetem quadratmeter mietwohnung auf solchem grund kann kein bezahlbarer wohnraum gebaut werden da sind ganz andere maßnahmen notwendig es ist richtig dass öffentlicher grund und boden zur verfügung gestellt wird das land hessen darf aber nicht perlen aus der frankfurter innenstadt wie das alte frankfurter polizeipräsidium einfach an den meistbietenden investor verscherbeln herr gutting hat von den wesentlichen leitplanken gesprochen aber die zentrale leitplanke damit das irgendwie funktionieren könnte fehlt es gibt im gesetz keine mietpreisbindung warum sollte ein investor eine mit steuervergünstigungen fertiggestellte mietwohnung für euro kaltmiete vermieten wenn der wohnungsmarkt und das mietrecht ihm problemlos erlauben sie auch für oder euro zu vermieten letztlich verschenken sie mit dem gesetz nur geld an immobilieninvestoren ohne dass eine ernsthafte gegenleistung erbracht werden muss die verpflichtung die geförderte wohnung für mindestens zehn jahre zu vermieten reicht nicht aus ein weiterer punkt bei dem wir zweifel haben: ein großer teil der wohnungen im jahr die die bundesregierung meint fördern zu können sind heute schon in der planung und werden ohnehin gebaut bauanträge können nur bis ende gestellt werden es ist also zu befürchten dass der wohnungsbau nicht angeregt wird sondern nur bereits geplante wohnprojekte für die bauherren billiger werden das nennt man mitnahmeeffekt und das hilft niemandem was heiß das aus unserer sicht die bilanz der derzeitigen wohnungspolitik bleibt insgesamt desaströs das lässt sich am beispiel meines heimatlandes hessen ganz gut zeigen: allein in der zeit von bis sind in hessen sozialwohnungen verloren gegangen aus der mietpreisbindung herausgefallen gleichzeitig ist die zahl der offiziell registrierten anspruchsberechtigten haushalte die mit einer sozialwohnung versorgt werden müssten auf angestiegen meine ehemalige chefin und fraktionsvorsitzende im hessischen landtag janine wissler sagt an dieser stelle immer: dafür hätte man keine grüne ministerin gebraucht das hätte die fdp auch alleine geschafft wir brauchen keine ungezielten steuergeschenke sondern einen kompletten neustart beim wohnungsbau wir brauchen eine rückkehr zur gemeinnützigkeit wir brauchen ein öffentliches wohnungsbauprogramm die sozialbindung sollte dauerhaft bestehen bleiben die stadt wien hat es mit einem solchen vorgehen geschafft sie kennen das beispiel; aber die machen das schon seit jahren die mieten auf einem niveau von bis euro pro quadratmeter zu halten das ist ein gutes beispiel dem wir nacheifern sollten vielen dank vielen dank jörg cezanne nächste rednerin: lisa paus für bündnis /die grünen jetzt kommen wir von der eifel über frankfurt nach berlin
60,19.10.2018,ID195906000,Lisa,Paus,BÜNDNIS 90/DIE GRÜNEN,Lisa Paus,so ist es frau präsidentin frau präsidentin meine damen und herren herr gutting sie haben bereits darauf hingewiesen: es gab einen solchen gesetzentwurf schon vor gut zwei jahren der war damals murks und der gesetzentwurf der heute vorliegt ist immer noch murks man kann sogar sagen: er ist noch murksiger als der vor zwei jahren weil er eben nicht denjenigen helfen wird die hilfe brauchen wir brauchen in deutschland nicht irgendwo neue wohnungen wir haben derzeit übrigens über leerstehende wohnungen sondern da wo sie benötigt werden nämlich in den ballungsgebieten wo wir eine angespannte wohnlage haben nach ihrem entwurf betrifft es alle wir brauchen auch nicht irgendwelche wohnungen in angespannten wohnlagen in den ballungsräumen sondern bezahlbare wohnungen aber dieser gesetzentwurf geht ebenso wie das baukindergeld komplett an dem problem vorbei und das wissen sie auch wir hatten eine expertenanhörung weswegen der letzte gesetzentwurf auch versenkt worden ist in dieser anhörung wurden kritikpunkte genannt die in den debattenbeiträgen schon verschiedentlich vorkamen erstens für bezahlbaren wohnraum braucht man nicht nur gedeckelte baukosten das ist ganz entscheidend sondern eben auch eine mietpreisbindung; denn sonst kommen die gedeckelten baukosten nicht bei den mieterinnen und mietern an in ihrem gesetzentwurf steht dazu nichts das müssen wir ändern zweiter punkt dieses gesetz gilt tatsächlich nur für einen sehr sehr eingeschränkten bereich der privatwirtschaft die genossenschaften und andere wohnungsbaugesellschaften profitieren nicht davon all die die zurzeit noch dafür sorgen dass wir bezahlbaren wohnraum haben profitieren nicht von dieser sonder-afa sie bräuchten eine investitionszulage das wurde in der expertenanhörung eingefordert ; die schaffen sie auch nicht auch da könnten sie nachbessern der dritte punkt wurde gerade genannt: dieses gesetz ist zeitlich begrenzt frau lambrecht sie haben das ausdrücklich gelobt aber faktisch ist es doch so dass sich ein haus eine wohnung nicht von heute auf morgen baut man braucht eine genehmigung usw das heißt de facto: weil die förderung auf drei jahre begrenzt ist wird das gesetz womöglich zu fast prozent reine mitnahmeeffekte generieren weil eben nur die dinge die schon geplant sind dann tatsächlich auf den weg gebracht werden daher wären wir auch hier für eine andere regelung der vierte punkt wurde ebenfalls bereits genannt: sie legen die förderobergrenze auf euro baukosten pro quadratmeter und die bemessungsgrundlage auf euro fest das passt faktisch für keine region in deutschland deswegen haben sie auch im bundesrat von den verschiedenen bundesländern verschiedene stellungnahmen gehört baden-württemberg möchte die grenze hochsetzen bayern natürlich auch brandenburg möchte die grenze natürlich herabsetzen andere länder auch diese grenze passt auf kein konkretes bauprojekt in deutschland daher finden wir auch dieses herangehen falsch man könnte es spezifischer machen man könnte zum beispiel in bezug auf die angespannten wohnlagen die ballungsgebiete sagen: wir fördern insbesondere dachausbau oder -ergänzungen dann hat man auch das bodenpreisproblem nicht auch das machen sie bisher nicht auch da würden wir uns wünschen das würden sie ändern zum schluss kann man eigentlich nur sagen: ändern sie den gesetzentwurf jetzt beinhaltet er keine sozialbindung keine beschränkung auf angespannte wohnlagen so wie ich den gesetzentwurf verstehe stellt sich sogar die frage inwieweit sie hier ein bauherrenvertriebsmodell für die gesamte eu gemacht haben das hat noch keiner thematisiert; aber das gesetz hätte anwendung für die gesamte eu wir wissen dass die baukosten in der eu teilweise deutlich unter euro liegen das könnte ein richtiges investitionsprojekt werden würde in deutschland aber nicht zu weiteren wohnungen führen daher haben wir noch deutlichen beratungsbedarf wir haben in deutschland ja die erfahrung mit dem aufbau ost gemacht; auch da gab es diese super sonder-afa sie hat einiges bewirkt erfolgte aber nach dem prinzip gießkanne wir mussten danach mithilfe zusätzlicher programme wohnungen wieder abreißen weil viel an der nachfrage vorbei gebaut worden ist da wurde nicht nur viel öffentliches geld verschwendet die schrottimmobilien die zum beispiel die berliner bankgesellschaft in die knie haben gehen lassen finden sich in vielen anderen banken in diesem land wieder sozusagen kaschiert so etwas brauchen wir nicht wieder deswegen bitte ich sie eindringlich: entweder sie überarbeiten diesen gesetzentwurf radikal oder sie ziehen ihn noch einmal zurück kommen sie bitte zum schluss ich komme zum schluss unsere position ist: einmal öffentlich gefördert dauerhaft preisgebunden wir brauchen ein gesetz zur wiedereinführung einer neuen wohnungsgemeinnützigkeit es sollen diejenigen bauen die bezahlbaren wohnraum schaffen können wir wollen eine investitionszulage plus steuerbefreiungen für diejenigen das war echt ernst gemeint das ist der letzte satz die dazu bereit sind ihren sozialen beitrag zu leisten das würde tatsächlich und dauerhaft zu bezahlbarem wohnraum in den ballungsgebieten führen herzlichen dank danke frau präsidentin nein ich bitte wirklich alle darum sich an die redezeit zu halten vielen herzlichen dank wir haben nämlich noch einiges vor uns jetzt wäre eigentlich ein redner dran den wir nicht finden eigentlich ist mario mieruch dran; er war angemeldet aber das fällt aus es wäre nett so etwas dann rechtzeitig anzukündigen aber gut nein die redezeit wird nicht einfach übertragen nächste rednerin: cansel kiziltepe für die spd-fraktion
61,19.10.2018,ID195906100,Cansel,Kiziltepe,SPD,Cansel Kiziltepe,frau präsidentin liebe kolleginnen und kollegen liebe gäste auf den tribünen ich bin mir sicher jeder kennt die geschichten von menschen die in berlin aber auch in anderen groß- und universitätsstädten schwierigkeiten haben bezahlbaren wohnraum zu finden man geht zur wohnungsbesichtigung und trifft auf hunderte von interessenten es ist aussichtslos das ist keine ausnahme das ist mittlerweile die regel liebe kolleginnen und kollegen und das ist kein zustand deswegen brauchen wir politische antworten und zwar auf allen ebenen auf bundesebene landesebene und kommunaler ebene und das so schnell wie möglich es war gut dass wir beim wohngipfel viele gute forderungen durchsetzen konnten und wir haben hier auch schon über die verschärfung der mietpreisbremse die absenkung der modernisierungsumlage höheres wohngeld usw usf debattiert wir brauchen aber mehr wir brauchen mehr bezahlbaren wohnraum und daran arbeiten wir um das zu erreichen müssen wir auf der einen seite die bestandsmieten schützen und auf der anderen seite den bau von neuen bezahlbaren mietwohnungen fördern ein instrument von vielen das hat christine lambrecht unsere staatssekretärin gesagt ist die sonderabschreibung für den neubau von mietwohnungen ziel dieser maßnahme soll es sein dass private unternehmen bezahlbaren wohnraum bereitstellen da die sonderabschreibungen zu steuermindereinnahmen bei den ländern führen brauchen wir hierfür die zustimmung der länder für uns ist wichtig dass wir anreize für den bau von bezahlbaren mietwohnungen setzen die fragen die wir uns stellen sind: wie schaffen wir das welche wirkung wird die sonderabschreibung für den neubau von mietwohnungen haben welcher wohnraum wird gebaut werden welche unternehmen profitieren davon auch damit werden wir uns in den parlamentarischen beratungsverfahren beschäftigen nun zu den bundesländern just am heutigen vormittag hat sich auch der bundesrat mit diesem thema beschäftigt man sieht an den stellungnahmen und beschlüssen dass eine allgemeine steuerliche förderung nach dem gießkannenprinzip als wenig zweckmäßig erachtet wird man hört auch dass diese subvention eher auf gebiete beschränkt werden sollte wo tatsächlich bedarf besteht es wird auch gefordert eine mietobergrenze einzuführen und diese an die sonderabschreibung für den neubau von mietwohnungen zu koppeln damit die sonderabschreibung für den neubau von mietwohnungen wirksam wird das sind alles berechtigte einwände wie wir finden liebe kolleginnen und kollegen klar ist auch: diese maßnahme wird nicht ausreichen; das wissen wir es ist eine maßnahme unter vielen wir brauchen viel mehr um den druck aus dem wohnungsmarkt zu nehmen brauchen wir zudem eine mieterfreundliche umsetzung der grundsteuerreform und ein verbot der share deals um spekulationen einzudämmen auch daran arbeiten wir liebe kolleginnen und kollegen wir wollen auch den sozialen wohnungsbau stärken das haben wir in angriff genommen in den kommenden jahren werden milliarden euro investiert wir wollen das weiter stärken und auch das grundgesetz hierfür ändern daran arbeiten wir gemeinsam mit unserem koalitionspartner die maßnahme die wir heute hier vorgelegt haben geht in die beratungen ich hoffe dass die stellungnahmen und der beschluss des bundesrates dabei berücksichtigt werden danke schön vielen dank frau kiziltepe der letzte redner in dieser debatte: sebastian brehm für die cdu/csu-fraktion
62,19.10.2018,ID195906200,Sebastian,Brehm,CDU/CSU,Sebastian Brehm,frau präsidentin liebe kolleginnen und kollegen der rat der immobilienweisen geht in seinem frühjahrsgutachten davon aus dass in einigen großstädten in deutschland in den ballungsräumen der kauf- und mietpreisanstieg bald zu ende ist dennoch hatten wir in den jahren und jeweils eine durchschnittliche preissteigerung von prozent im jahr lag diese noch einmal bei prozent das heißt in den letzten drei jahren lag der kauf- und mietpreisanstieg allein in den großen städten bei etwa prozent deswegen ist es gerade für junge familien aber auch für ältere menschen in den ballungsräumen schwierig geworden eigentum zu erwerben es ist zu teuer und die nachfrage ist groß daher ist eine unserer wichtigsten aufgaben in der politik jetzt maßnahmen zu ergreifen um dieser entwicklung entgegenzuwirken ich glaube die ganze diskussion über die mietpreisbremse führt nicht dazu dass wir mehr wohnungen in den großstädten oder in den ballungsräumen haben werden nein denn die verknappung des wohnraums bleibt bestehen das einzige was hilft wenn man die preise in den großstädten wirklich senken will ist: bauen bauen bauen alles andere sind keine maßnahmen um ein breiteres angebot an wohnraum zu schaffen deswegen haben wir uns als koalition zum ziel gesetzt die anzahl der neugebauten wohnungen um prozent zu erhöhen und millionen neue wohnungen in dieser legislaturperiode zu schaffen dieses ziel werden wir auch erfüllen und zwar durch eine kombination verschiedener bausteine der erste baustein war die einführung des baukindergelds dafür gab es viel kritik aber das baukindergeld ist eine erfolgsgeschichte schon im ersten monat sind anträge gestellt worden das ist gut für die jungen familien in unserem land bayern hat übrigens noch einmal etwas obendrauf gelegt der zweite baustein ist die zur-verfügung-stellung neuer grundstücke da sind natürlich die kommunen mit ihren wohnungsbaugenossenschaften gefragt und da sind die länder mit ihren wohnungsbaugesellschaften gefragt aber da ist auch der bund gefragt beim wohngipfel im september wurde bereits zugesagt dass grundstücke vom bund schneller zur verfügung gestellt werden das ist auch richtig so ein dritter baustein ist die steuerliche förderung des wohnungsneubaus durch die einführung der befristeten degressiven abschreibung in höhe von jeweils prozent für die nächsten vier jahre zusätzlich zur linearen abschreibung natürlich höre ich immer das argument: das führt zu preissteigerungen aber erinnern sie sich mal an die degressive sonderabschreibung beim aufbau ost von prozent im ersten jahr natürlich hat das einerseits zu preissteigerungen geführt; aber gleichzeitig ist die nachfrage wesentlich angekurbelt worden und es ist gebaut worden auch jetzt wird es so sein dass die nachfrage angekurbelt und mehr gebaut wird die signifikant höhere abschreibung soll dafür sorgen dass wir mehr wohnraum bekommen wenn wir über diesen gesetzentwurf diskutieren dann müssen wir auch über die feine ausgestaltung reden dabei geht es um die verschiedenen möglichkeiten die bereits angesprochen wurden erstens zur fördergrenze von euro pro quadratmeter der baukosten ich glaube dass das nach dem jetzigen baukostenindex in ordnung ist was ist aber in den nächsten drei oder vier jahren können wir die grenze von euro halten man muss darüber noch einmal diskutieren und dann den betrag vielleicht auch anpassen das zweite ist die europäische restriktion durch die de-minimis-verordnung was bedeutet dass der gesamtbetrag der degressiven abschreibung euro nicht überschreiten darf dabei geht es nicht um die absolute höchstgrenze für abschreibungen sondern um den zinsvorteil der durch die vorgezogene degressive abschreibung entsteht das ist schon sehr schwierig zu berechnen hier besteht noch rechtsunsicherheit deswegen muss man glaube ich am gesetzestext noch nachbessern und miteinander ins gespräch kommen drittens ich glaube wir müssen aufpassen dass wir mit der mietrechtsnovelle die gerade im gesetzgebungsverfahren ist einen gleichlauf herstellen nichts wäre schlimmer als den wohnungsmarkt durch die genannten maßnahmen anzukurbeln und dann diesen effekt durch mietpreisbindung mietpreisbremse und anderes wieder kaputtzumachen wir müssen also einen vorsichtigen weg einschlagen um den effekt den wir haben wollen wirklich zu erzielen liebe kolleginnen und kollegen es ist auch wichtig das ganze zu evaluieren bei einer normalen erhöhung der abschreibung gibt es keine de-minimis-vorschriften und auch keine so komplizierte berechnung deshalb muss man in dem gesamten prozess überlegen ob es nicht sinnvoller ist die linearen abschreibungen generell zu erhöhen ich lade herzlich dazu ein darüber noch einmal ins gespräch zu kommen wir sollten versuchen hier eine lösung zu finden das würde einen noch größeren impuls auf dem wohnungsmarkt und noch höhere effekte erzielen unser ziel muss es sein in den nächsten jahren wohnungen zu bauen zu bauen zu bauen das müssen wir ermöglichen bezahlbar selbstverständlich deswegen werden wir diesen gesetzentwurf weiter diskutieren ich hoffe dass wir uns in den genannten punkten miteinander abstimmen können sodass wir einen sinnvollen gesetzentwurf haben werden herzlichen dank vielen herzlichen dank herr brehm damit schließe ich die aussprache interfraktionell wird überweisung des gesetzentwurfs auf drucksache / an die in der tagesordnung aufgeführten ausschüsse vorgeschlagen es gibt keine weiteren vorschläge dann ist die überweisung so beschlossen
63,19.10.2018,ID195906300,Judith,Skudelny,FDP,Judith Skudelny,meine damen und herren wenn wir von fahrverboten reden gehen wir immer davon aus dass diese fahrverbote dazu führen dass die luft in deutschland besser und die gesundheit der menschen geschont wird wenn wir aber nach hamburg schauen und sehen was dort tatsächlich passiert wenn wir nach stuttgart schauen und hören was dort debattiert wird dann lässt sich sagen dass fahrverbote nicht dazu führen dass emissionen vermindert werden und die luft besser wird tatsächlich wollen die leute nämlich weiter mobil sein sind auf ihr auto angewiesen und weichen einfach nur von den hauptstraßen auf die nebenstraßen aus von den hauptstädten auf die dörfer damit werden emissionen nicht verringert sondern einfach verschoben weil wir sehen dass die wirkung nicht nur positiv ist sondern es auch negative aspekte gibt sollten wir ganz vorsichtig sein was die grundlage angeht auf welcher solche entscheidungen basieren schauen wir uns doch einfach mal die messstationen an nordrhein-westfalen ist eines der länder die überprüft haben wie eigentlich unsere messstellen funktionieren dabei wurde festgestellt dass von acht messstellen vier falsch messen in der richtlinie ist festgelegt dass die umgebungsluft gemessen wird in stuttgart wird an einer ampelanlage der an- und abfahrende verkehr gemessen aber schon auf der straßenseite gegenüber lassen sich diese werte nicht verifizieren in oldenburg ein ganz besonderes schmankerl werden die no x -grenzwerte auch dann überschritten wenn die straße gesperrt ist und dort kein einziges auto fährt da fragt man sich doch: ist es sinnhaft eine maßnahme wie ein fahrverbot einzuführen wenn falsch gemessen wird oder das ganze nichts bringt darüber sollten sich die bundesregierung und die länder noch einmal gedanken machen die frage ist hier: ist es denn wirklich sachliche politik oder ist es ideologie was wir hier betreiben heute hat die verkehrsministerkonferenz getagt zufälligerweise haben sich das grün geführte baden-württemberg und das rot-rot-grüne berlin dagegen ausgesprochen überhaupt nur die technischen anlagen zu überprüfen das ist etwas was man den menschen nicht verkaufen kann die messungen müssen richtig gemacht werden und zwar bundesweit einheitlich und unter ausschöpfung der möglichen toleranzen die fahrverbote führen nicht zu sauberer luft; sie führen zur verlagerung deswegen sollten wir sie vermeiden wo es geht und toleranzen ausnutzen wir sollten das wurde im umweltausschuss gesagt die wissenschaftliche basis noch einmal evaluieren und fragen: wo genau liegen eigentlich die grenzwerte die wir einhalten können und die wir im sinne der nachhaltigkeit einhalten wollen auch das ist ein ziel das wir gemeinsam in deutschland verfolgen sollten letztlich sollten wir uns auf europäischer ebene verstärkt für ein moratorium einsetzen es ist tatsächlich so dass die bundesregierung etwas spät in die pötte gekommen ist das sofortprogramm saubere luft kam erst ende letzten jahres die maßnahmen zur digitalisierung zum öffentlichen nahverkehr sind jetzt erst langsam in gang gekommen unsere industrie hat ein bisschen geschlafen aber jetzt steht sie gewehr bei fuß und die bundesregierung führt ja die verhandlungen sodass zu erwarten ist dass es hier auch bessere motoren bessere antriebe gibt das müssen wir mit einer mobilitätsgarantie gewährleisten damit wir das alles in der zur verfügung stehenden zeit schaffen brauchen wir ein moratorium wir bitten die bundesregierung sich dafür einzusetzen wenn sich die bundesregierung dafür einsetzt dann bitte ich inständig dass sich das umwelt- und das verkehrsministerium nicht miteinander beschäftigen sondern gemeinsam für die sache einsetzen die verhinderung von fahrverboten ist schließlich kein selbstzweck vielmehr wollen wir fahrverbote verhindern damit wir am ende zu besseren luftwerten in ganz deutschland kommen wir wollen nicht den dieselgegnern helfen wir wollen den menschen und der umwelt in deutschland helfen vielen dank frau kollegin nächster redner: carsten müller für die cdu/csu-fraktion
