,datum,redeID,vorname,nachname,fraktion,name,inhalt_neu
57,12.12.2018,ID197005700,Angela,Merkel,CDU/CSU,Angela Merkel,"ich bin dafür, dass wir die entsprechenden drei staaten zu sicheren herkunftsstaaten erklären, und hoffe, dass das auch im bundesrat eine mehrheit findet. wir können berichten, dass sich die zusammenarbeit mit allen drei staaten in sachen rückführung deutlich verbessert hat. im vergleich zu haben wir jetzt eine verneunfachung, eine verzehnfachung oder sogar eine verfünfzehnfachung der rückführungen. ich kann auch darauf verweisen, dass die zahlen bei der rückführung von deutschland nach marokko im europäischen vergleich sehr gut sind. insofern müssen wir auf diesem wege mit den ländern weitermachen. wir haben einen sehr guten datenaustausch. wir haben mehr fälle identifiziert, als bis jetzt aus deutschland zurückgeführt wurden. das ist eine zusammenarbeit, die sich von der größenordnung her in den letzten jahren rapide verbessert hat. danke sehr. andré hahn, fraktion die linke, stellt die nächste frage."
58,12.12.2018,ID197005800,André,Hahn,DIE LINKE,André Hahn,"frau bundeskanzlerin, trifft es zu, dass sich an verschiedenen stellen in deutschland, aber auch in österreich und der schweiz rechte gruppen formiert haben, die daran arbeiten, einen eigenen staat im staate aufzubauen, und trifft es zu, dass zu den mitgliedern dieser gruppen auch polizisten und soldaten, reservisten und beamte, zum teil auch mitarbeiter der sicherheitsbehörden des bundes zählen? ein netzwerk, das unter dem namen hannibal bekannt geworden ist, bereitet sich auf den tag x vor und will dann gegebenenfalls auch waffen einsetzen. sind sie durch den verfassungsschutz über diese vorgänge informiert worden, und was wollen sie dagegen unternehmen?"
59,12.12.2018,ID197005900,Angela,Merkel,CDU/CSU,Angela Merkel,"ich habe da volles vertrauen in die arbeit des verfassungsschutzes. sie wissen auch, dass, wann immer solche erkenntnisse vorliegen, entschieden und sehr massiv dagegen vorgegangen wird. es gibt leider entwicklungen, die uns beunruhigen müssen; aber unsere staatlichen institutionen sind hier handlungsfähig und handeln auch. nachfrage."
60,12.12.2018,ID197006000,André,Hahn,DIE LINKE,André Hahn,"frau bundeskanzlerin, ich habe sie ja gefragt, ob und in welcher weise sie darüber informiert worden sind. ich darf daran erinnern, dass die problematik der reichsbürger über jahre verharmlost worden ist. inzwischen wird die gefahr erkannt, nachdem unter anderem ein polizist ermordet worden ist. bei rechten netzwerken wurden, wie die sicherheitsbehörden und die generalbundesanwaltschaft wissen, sogenannte todeslisten gefunden. das ist doch ein punkt, der uns alle beunruhigen muss. wissen sie, ob auch abgeordnete dieses hauses auf diesen listen stehen, sind sie darüber informiert worden? und noch mal meine frage: was tun sie, um dem entgegenzuwirken?"
61,12.12.2018,ID197006100,Angela,Merkel,CDU/CSU,Angela Merkel,"über abgeordnete auf diesen listen bin ich nicht informiert. ansonsten weiß jede institution der bundesregierung, dass die bundesregierung als ganzes und ich als person entschieden gegen solche vorgänge vorgehen. da, wo dinge passiert sind, die nicht in ordnung waren ich nenne nur das beispiel nsu , haben wir, auch durch die einsetzung von untersuchungsausschüssen, gemeinsam die notwendigen schlussfolgerungen daraus gezogen. oliver krischer, fraktion bündnis /die grünen, stellt die nächste frage."
62,12.12.2018,ID197006200,Oliver,Krischer,BÜNDNIS 90/DIE GRÜNEN,Oliver Krischer,"herzlichen dank, herr präsident. frau bundeskanzlerin, am vergangenen wochenende hat der cdu-parteitag einen beschluss gefasst, der darauf abzielt, der deutschen umwelthilfe die gemeinnützigkeit und klagebefugnisse abzuerkennen. liebe kolleginnen und kollegen, beifallsstürme werden nicht auf die redezeit angerechnet. der beifallssturm zeigt ja auch, wofür viele der kolleginnen und kollegen hier stehen. als begründung für den antrag, den der cdu-parteitag beschlossen hat, wird angeführt, dass die deutsche umwelthilfe die einhaltung von bestehenden gesetzen einklagt. ich finde es bemerkenswert, dass so etwas als begründung für die aberkennung der gemeinnützigkeit herangezogen wird. das hätte ich von einer staatstragenden partei in deutschland eigentlich nicht erwartet. meine frage an sie, frau bundeskanzlerin: halten sie diesen beschluss für mit deutschem recht vereinbar? ich hoffe, dass sie ihn für nicht vereinbar halten. wenn sie ihn doch für vereinbar halten: was wird diese bundesregierung dann tun oder hoffentlich nicht tun , um diesen beschluss umzusetzen? herr kollege, so lang war der beifall auch wieder nicht."
63,12.12.2018,ID197006300,Angela,Merkel,CDU/CSU,Angela Merkel,"der beschluss setzt bei ganz anderen merkmalen an. die deutsche umwelthilfe weist schon eigenheiten auf zum beispiel, was die möglichkeit der mitgliedschaft anbelangt , die sie ganz klar von anderen organisationen unterscheidet. die überprüfung von staatlicher seite, ob die voraussetzungen für die gemeinnützigkeit erfüllt sind, und die politische einschätzung, dass sie nicht erfüllt sind, müssen wir jetzt in einklang bringen. deshalb werden wir uns das regierungsseitig anschauen. zusatzfrage."
64,12.12.2018,ID197006400,Oliver,Krischer,BÜNDNIS 90/DIE GRÜNEN,Oliver Krischer,"frau bundeskanzlerin, ihnen ist schon bekannt, dass wir in deutschland ein geübtes verfahren haben, bei dem finanzbehörden solche fragen beständig klären. wie ist dann zu erklären, dass mitglieder ihrer bundesregierung ich nenne mal beispielhaft herrn parlamentarischen staatssekretär bilger, der dort auf der regierungsbank sitzt ausdrücklich sagen: die aberkennung der gemeinnützigkeit und der klagebefugnisse wird wegen der klagetätigkeit der deutschen umwelthilfe beantragt. offensichtlich ist die motivation in der union eine andere als die, die sie gerade dargestellt haben. das, was sie dargestellt haben, ist das übliche verfahren zur überprüfung der gemeinnützigkeit. herr kollege, für nachfragen stehen sekunden zur verfügung. da sind sie jetzt weit drüber. bitte."
65,12.12.2018,ID197006500,Angela,Merkel,CDU/CSU,Angela Merkel,"ich sage das, was ich jetzt sage, und das ist, dass wir uns das anschauen werden. auch wenn von den finanzbehörden die gemeinnützigkeit festgestellt wird, entbindet uns dies nicht davon, uns das mal näher anzugucken. ich weise mal darauf hin: wenn eine organisation, die vielleicht uns etwas näher stünde, so viel geld von automobilkonzernen kriegen würde wie die deutsche umwelthilfe, dann würden sie sofort von schlimmem lobbyismus sprechen. die nächste frage stellt der kollege dr. bernd baumann, afd."
66,12.12.2018,ID197006600,Bernd,Baumann,AfD,Bernd Baumann,"frau bundeskanzlerin, ihr innenminister hat ja mal zusammengefasst: migration ist die mutter aller probleme . sie versprachen den deutschen wörtlich eine nationale kraftanstrengung zur rückführung derer, die abgelehnt wurden . und wie viele mit rechtskräftig abgelehnten asylanträgen sind derzeit im land? fast . und wie viele werden abgeschoben? waren es nur , nur noch , bis oktober nur noch . es werden also nicht mehr abgeschoben, sondern weniger. das ist keine nationale kraftanstrengung, wie versprochen. das ist ein schwächeanfall, man kann auch sagen: ein politisches totalversagen. frau bundeskanzlerin, die bürger haben ein recht darauf, zu wissen: wieso wird nicht abgeschoben? wollen sie nicht, oder können sie nicht?"
67,12.12.2018,ID197006700,Angela,Merkel,CDU/CSU,Angela Merkel,"wir arbeiten beständig daran ich habe ihnen die zahlen der nordafrikanischen länder marokko, tunesien und algerien eben genannt , dass wir besser werden. die nationale kraftanstrengung ist nicht beendet; das sage ich ausdrücklich. wir haben eine vielzahl von maßnahmen ergriffen, auch in der kooperation mit den ländern, um die dinge voranzubringen. wir haben dazu noch die möglichkeit der freiwilligen rückkehr geschaffen. im übrigen weise ich darauf hin, dass ich die zahlen, die sie genannt haben, so nicht teile. nachfrage, herr kollege baumann?"
68,12.12.2018,ID197006800,Bernd,Baumann,AfD,Bernd Baumann,"das sind die zahlen, wie sie in allen teilen der presse veröffentlicht sind, auch in antworten auf anfragen von abgeordneten. wenn sie in dieser die ganze bevölkerung sehr bewegenden frage eine nationale kraftanstrengung sozusagen ausrufen, dann ist es doch ihre aufgabe, dafür zu sorgen, dass es gelingt, dass die zahlen steigen oder zumindest bleiben, aber nicht noch weiter fallen. das ist doch ein totalversagen."
69,12.12.2018,ID197006900,Angela,Merkel,CDU/CSU,Angela Merkel,"ich teile ihre einschätzung nicht. ich habe jetzt auch kein fragezeichen bei ihren ausführungen gesehen. die nächste frage stellt der kollege bernd westphal, spd."
70,12.12.2018,ID197007000,Bernd,Westphal,SPD,Bernd Westphal,"vielen dank, herr präsident. sehr geehrte frau bundeskanzlerin, ich möchte ihnen eine frage zum thema rüstungsexporte stellen. wir haben im koalitionsvertrag vereinbart, dass wir bis ende die rüstungsexport richtlinien überarbeiten. das auswärtige amt hat im sommer einen entsprechenden vorschlag dazu vorgelegt. vielleicht können sie mir weiterhelfen bei der frage, wie sie hier garantieren wollen, dass wir die im koalitionsvertrag getroffene vereinbarung umsetzen. aufgrund der aktualität des themas habe ich noch eine frage zum stopp von rüstungsexporten nach saudi-arabien. wie sorgen sie im bundeskabinett dafür, dass der exportstopp auch weiterhin gültigkeit behält?"
71,12.12.2018,ID197007100,Angela,Merkel,CDU/CSU,Angela Merkel,"dazu haben wir ein einschlägiges gremium, den bundessicherheitsrat. alle, die diesem gremium angehören, sind der meinung, dass wir den stopp so einhalten. wir haben deshalb aktuelle vorhaben sozusagen auf eis gelegt. was die rüstungsexportrichtlinien anbelangt, so laufen die verhandlungen der zuständigen minister. ich schließe nicht ganz aus, dass ich sie um eine kleine verlängerung bitten muss. ich weiß nicht, ob das bis weihnachten noch etwas wird. nachfrage?"
72,12.12.2018,ID197007200,Bernd,Westphal,SPD,Bernd Westphal,"können sie gegenüber dem parlament und der öffentlichkeit einen zeitraum nennen, damit ihre aussage, was den stopp der rüstungsexporte nach saudi-arabien angeht, etwas präziser wird? es gibt vorkommnisse, die den stopp begründen. auf denen fußt ihre entscheidung. vielleicht können sie etwas genaueres dazu und auch zu der umsetzung des koalitionsvertrages sagen?"
73,12.12.2018,ID197007300,Angela,Merkel,CDU/CSU,Angela Merkel,"ich verspreche ihnen jetzt mal: spätestens im ersten halbjahr werden wir mit den rüstungsexportrichtlinien fertig sein. das sollte uns jetzt anspornen. und zweitens: wenn es keinen rüstungsexport gibt, dann gibt es keinen. was soll ich da präziser werden? null ist null. solange die dinge nicht aufgeklärt sind. im übrigen darf ich darauf verweisen, dass derzeit zum ersten mal relativ hoffnungsvolle jemen-verhandlungen in schweden stattfinden. wir werden von deutscher seite alles tun ich habe darüber mit dem bundesaußenminister gesprochen , dass die friedensverhandlungen für den jemen erfolg zeigen; denn dort sind millionen von menschen von hunger bedroht. das muss einen wirklich umtreiben, und das treibt uns ja gemeinsam um. die nächste frage stellt der kollege oliver luksic, fdp."
74,12.12.2018,ID197007400,Oliver,Luksic,FDP,Oliver Luksic,"vielen dank, herr präsident. frau bundeskanzlerin, die fahrverbote führen nicht nur zu wertverlusten, zu einem stück enteignung und zur einschränkung der mobilität. jetzt soll obendrauf ein instrument mit viel bürokratie zur überwachung und zur kontrolle der einfuhr in fahrverbotszonen aufgebaut werden. die bundesregierung hat eine änderung des straßenverkehrsgesetzes vorgeschlagen. darin ist festgehalten, dass eine kfz-kennzeichenerfassung per video anlasslos und dauerhaft durchgeführt werden soll, und das für eine ordnungswidrigkeit. das einfahren in eine umweltzone kostet euro bußgeld. deswegen meine frage: halten sie eine videoüberwachung angesichts der massiven kosten für bürokratie für sinnvoll und verhältnismäßig?"
75,12.12.2018,ID197007500,Angela,Merkel,CDU/CSU,Angela Merkel,"also, bis jetzt habe ich immer gedacht, dass sie die partei der digitalisierung sind und die vorteile davon auch nutzen wollen. in vielen europäischen städten wird die videoüberwachung heute selbstverständlich angewandt. die modernen verkehrsleitsysteme, die richtgeschwindigkeiten angeben, funktionieren alle nach diesem prinzip. sie wissen auch, dass die aufnahmen der nummernschilder, ähnlich wie bei der lkw-maut, sofort wieder gelöscht werden. insofern gibt es überhaupt keinen grund, moderne technologien auszuschließen und menschen wieder einzelne nummernschilder ablesen zu lassen. zusatzfrage?"
76,12.12.2018,ID197007600,Oliver,Luksic,FDP,Oliver Luksic,"ich habe noch eine frage zur verhältnismäßigkeit. bei euro bußgeld halte ich den aufwand in der tat für nicht sinnvoll. hinzu kommt, dass es eine umfassende rechtsprechung in sachen telekommunikationsüberwachung gibt, die besagt, dass anlasslose und dauerhafte überwachung nicht geht. deshalb frage ich mich schon, ob mit der erfassung nicht alle autofahrer unter generalverdacht gestellt werden; denn bei der terrorismusüberwachung stellt sich der staat gegen eine anlasslose und dauerhafte überwachung. hier geht um euro bußgeld. hier geht es um eine ordnungswidrigkeit. deshalb die frage: ist das ihrer meinung nach verfassungssicher? herr kollege luksic! das bayrische innenministerium hat zweifel angemeldet."
77,12.12.2018,ID197007700,Angela,Merkel,CDU/CSU,Angela Merkel,"ich gehe davon aus, dass das ordentlich geprüft ist; ich bin selber ja keine juristin. im übrigen ermuntere ich uns, nicht gegenüber allen innovationen im zusammenhang mit der digitalisierung als erstes abwehrend zu handeln. dass die fdp dabei an der spitze steht, darüber bin ich doch enttäuscht. frau bundeskanzlerin, ich würde gerne noch drei fragen zulassen, um diese fragerunde abzuschließen. lassen sie die fragen zu? passt das noch zu ihrer zeitlichen disposition? ja. dann ist der nächste fragesteller der kollege marian wendt, cdu/csu."
78,12.12.2018,ID197007800,Marian,Wendt,CDU/CSU,Marian Wendt,"frau bundeskanzlerin, sie hatten es selber angesprochen: die ordnung, begrenzung und steuerung der migrationspolitik setzen viele kleine schritte und bausteine voraus. ein populistisches marktschreierwesen, wie wir es leider selber erlebt haben, bringt uns da nicht weiter. deswegen stelle ich meine frage konkret zu einem wesentlichen baustein, dem abkommen mit italien. aktuell ist geplant, ein rückführungsabkommen für die dublin-fälle mit italien auszuhandeln. meine frage lautet: wie ist der stand? und vor allen dingen: wie schätzen sie die erfolgsaussichten für die umsetzung des abkommens ein, dass wir dauerhaft und einfach rückzuführende nach italien überführen können? vielen dank."
79,12.12.2018,ID197007900,Angela,Merkel,CDU/CSU,Angela Merkel,"angesichts der tatsache, dass es sich um eine sehr geringe anzahl von fällen im zusammenhang mit griechenland handelt, haben wir gesehen, dass die eingeführte prozedur ganz offensichtlich dazu führt, dass es ein gewisses abwenden von dem einfachen sich-weiter-bewegen oder der sekundärmigration gibt. das abkommen mit italien ist unterschriftsreif, aber leider von italien noch nicht zur unterschrift freigegeben. es ist gegenstand wiederkehrender gespräche, die ich mit dem italienischen ministerpräsidenten führe. italien hat natürlich sehr viel mehr mit der primärmigration zu tun, aber wir arbeiten weiter daran, dass das abkommen unterschrieben werden kann. heike hänsel, fraktion die linke, ist die nächste fragestellerin."
80,12.12.2018,ID197008000,Heike,Hänsel,DIE LINKE,Heike Hänsel,"danke, herr präsident. frau merkel, sie haben sich gerade über unsere solidarisierung mit den gelbwesten echauffiert. ich möchte ihre vorwürfe zurückweisen. wir haben in zahlreichen pressemitteilungen klar gesagt, dass wir uns für gewaltfreien protest einsetzen. ich finde ihre empörung mehr als scheinheilig. sie stehen seit jahren dafür, dass deutsche rüstungsgüter in viele länder dieser welt geschickt werden, in denen ein blutiger krieg stattfindet, wie zum beispiel im jemen. diese unterstützung von gewalt, wofür sie stehen, finde ich völlig inakzeptabel. jetzt gibt es zwar einen stopp der rüstungsexporte nach saudi-arabien für die dauer von zwei monaten. aber wieso lassen sie es zu, dass deutsche konzerne wie rheinmetall weiterhin über ihre bombenfabriken zum beispiel in sardinien oder südafrika ihre bomben, ihr kriegsgerät nach saudi-arabien liefern können und dadurch der von ihnen genannte friedensprozess im jemen nicht gerade unterstützt, wenn nicht sogar gefährdet wird?"
81,12.12.2018,ID197008100,Angela,Merkel,CDU/CSU,Angela Merkel,"sie haben richtigerweise darauf hingewiesen, dass wir bereits in der koalitionsvereinbarung eine sehr restriktive regelung im zusammenhang mit dem jemen getroffen haben. leider muss ich feststellen, dass sich von unseren europäischen partnern nur sehr wenige einer ähnlichen politik anschließen. hier wäre ein gemeinsames europäisches vorgehen wirklich sehr wünschenswert. vielleicht könnten auch sie sich dafür einsetzen. alles, was in unseren rechtlichen möglichkeiten bezüglich unserer hiesigen rüstungsexportrichtlinien steht, werden wir umsetzen. wenn uns fälle des verstoßes bekannt werden, dann werden wir natürlich darauf reagieren. zusatzfrage?"
82,12.12.2018,ID197008200,Heike,Hänsel,DIE LINKE,Heike Hänsel,"ja. es geht aber ganz konkret um die waffenfabriken in anderen ländern, um tochterfirmen von rheinmetall, die weiterhin zum beispiel saudi-arabien beliefern. sie könnten das durch das schließen einer gesetzeslücke in der außenwirtschaftsverordnung ganz leicht unterbinden. wir haben gemeinsam mit den grünen entsprechende anträge hier im parlament gestellt. sie haben nichts gemacht. wieso ist ihre regierung nicht bereit, diese gesetzeslücke nun unmittelbar zu schließen, damit diese art und weise der rüstungsexporte, der blutigen rüstungsexporte, endlich unterbunden wird?"
83,12.12.2018,ID197008300,Angela,Merkel,CDU/CSU,Angela Merkel,"ich werde ihre frage dazu nutzen, mich mit dieser gesetzeslücke noch mal intensiv zu beschäftigen. letzter fragesteller für heute ist der kollege dr. konstantin von notz, bündnis /die grünen."
84,12.12.2018,ID197008400,Konstantin,von Notz,BÜNDNIS 90/DIE GRÜNEN,Konstantin von Notz,"herr präsident! sehr geehrte frau bundeskanzlerin! ein ganz anderes thema: hackingangriffe allerorten: auf den deutschen bundestag, auf die netze des bundes, auf die bundeswehr. gleichzeitig erleben wir trollarmeen, beeinflussungen von wahlvorgängen: in großbritannien bezüglich des brexits, in den usa bezüglich der präsidentschaftswahl, bezüglich der unabhängigkeitsabstimmung in katalonien; überall nachgewiesenermaßen illegitime einflussnahmen, so will ich das mal nennen. was macht die bundesregierung konkret, um unsere digitale infrastruktur zu schützen, um die rechtsstaatlichkeit gegen diese digitalen angriffe zu verteidigen? was für maßnahmen unternehmen sie konkret, und inwieweit gucken sie sich auch die bundestagswahl an, proaktiv, ob es dort zu illegitimen einflussnahmen gekommen ist?"
85,12.12.2018,ID197008500,Angela,Merkel,CDU/CSU,Angela Merkel,"bei der bundestagswahl haben wir, haben viele parteien sich vorgenommen, bots nicht einzusetzen. ich halte das auch für eine richtige politische maßnahme. was wir konkret machen: wir, sowohl das verteidigungsministerium als auch das bundesinnenministerium in zusammenarbeit mit dem bundesamt für sicherheit in der informationstechnik, sind permanent dabei, sowohl die rechtlichen bedingungen als auch unsere technische ausstattung zu verbessern. sie werden in den haushaltsberatungen gesehen haben, was wir allein an dieser stelle einbringen. wir werden die diskussion darüber führen müssen sie ist innerhalb der bundesregierung im entstehen : wie können wir uns noch besser schützen, und müssen wir dazu auch aktive möglichkeiten nutzen, die wir heute noch nicht nutzen, oder nur abwehrmöglichkeiten? die diskussion ist noch nicht beendet; aber sie kommt auf uns zu. ich bin mal gespannt, wie sie dann dazu stellung nehmen. nachfrage?"
86,12.12.2018,ID197008600,Konstantin,von Notz,BÜNDNIS 90/DIE GRÜNEN,Konstantin von Notz,"ja. wir haben schon stellung genommen. wir haben gute anträge in diesem haus gestellt. insofern sage ich: man kann viel tun, zum beispiel kann man social bots kennzeichnen, um deutlich zu machen, ob man es mit einer maschine oder einem menschen zu tun hat. noch einmal ganz konkret zur bundestagswahl : frau merkel, sie kommen mir ein bisschen so vor wie jemand, der auf dem sofa zu hause sitzt, nicht rausgeht und sagt: steinpilze gibt es dieses jahr überhaupt nicht. man muss schon rausgehen, in feld und flur, und gucken, was los ist. deswegen die frage: was tun sie proaktiv proaktiv! , um aufzudecken, ob es zu einer illegitimen einflussnahme wie in den usa oder großbritannien gekommen ist?"
87,12.12.2018,ID197008700,Angela,Merkel,CDU/CSU,Angela Merkel,"wenn sie mir sagen, wo ich hingehen soll, dann will ich das gerne tun. auf dem sofa sitze ich selten. aber ich will mich gerne noch mal informieren, welche erkenntnisse insbesondere auch dem bundespresseamt über einflussnahmen vorliegen, und dann werden wir sie unterrichten. danke sehr. liebe kolleginnen und kollegen, die frau bundeskanzlerin hat jetzt fragen und nachfragen beantwortet. ich bedanke mich sehr und schließe damit die regierungsbefragung."
