,datum,redeID,vorname,nachname,fraktion,name,inhalt_neu
0,,,,,, ,
1,07.04.2022,ID202800100,Dagmar,Schmidt,SPD,Dagmar Schmidt,sehr geehrte frau präsidentin sehr geehrte damen und herren liebe kolleginnen und kollegen allein gestern wurden über neuinfektionen gemeldet knapp menschen kamen wegen und mit covid ins krankenhaus menschen sind daran gestorben das ist immer noch sehr und viel zu viel; aber es scheint trotz alledem aufwärtszugehen darum geht es heute aber nicht es geht nicht um das was ist sondern um das was mit sehr hoher wahrscheinlichkeit im nächsten herbst und winter sein wird und wofür wir heute vorsorge treffen wollen vorsorge dafür wenn wir wieder steigende infektionszahlen haben und dafür wenn die alten wiederkommen oder es neue virusvarianten geben kann wir werden im herbst wieder vor der gleichen herausforderung wie letzten herbst stehen das virus wird nicht einfach verschwinden und wir wollen vorsorge betreiben das gesundheitssystem die kritische infrastruktur vor allem aber die gesundheit der menschen zu schützen entweder wir haben dann die impflücke weitestgehend mit unserer beratungs- und impfpflicht geschlossen dann werden wir eine grundimmunisierung in der bevölkerung die einen weitestgehend normalen umgang mit dem virus zulässt haben; dafür sind wir oder die impflücke wird nicht geschlossen und wir haben weiterhin viele millionen menschen die keine vollständige grundimmunisierung mit drei viruskontakten haben und müssen dann wieder maßnahmen ergreifen: masken abstand kontaktbeschränkungen bis hin zu schließungen je nach schwere des virus auch dafür lieber diese freiheitseinschränkungen in kauf zu nehmen kann man sich entscheiden oder wir lassen es laufen mit allen konsequenzen: kranke tote überlastung des gesundheitssystems der kritischen infrastruktur und was mit long covid in gänze auf uns zukommt das wissen wir noch gar nicht auch dafür kann man sich entscheiden ich rate nur dann besser nicht krank zu werden und keinen unfall zu haben darauf will ich hinaus: man kann sich nicht gegen etwas entscheiden ohne sich für etwas anderes zu entscheiden man trägt hier also immer für das eine oder andere die verantwortung und wenn man an der einen oder anderen stelle liebe union andere vorstellungen oder ideen hat sei es eine beratungspflicht sei es eine altersgrenze seien es datengrundlagen seien es entscheidungsmechanismen ein impfregister dann gibt es in einer demokratie das bewährte verfahren der verhandlung und des kompromisses diesen kompromiss haben wir mit andrew ullmann und seiner gruppe gefunden und der sieht wie folgt aus: erstens wir geben der beratung der aufklärung und der direkten ansprache eine chance und führen eine beratungsnachweispflicht für alle ab ein das kann ab sofort geschehen und wir werden dafür werben und die entsprechenden möglichkeiten schaffen zweitens wir sorgen für den herbst vor: mit einer impfpflicht für die über ‑jährigen damit schützen wir das gesundheitssystem und schließen die impflücke vor allem bei der besonders vulnerablen gruppe drittens wir sorgen perspektivisch für eine große hohe grundimmunität aller erwachsenen als voraussetzung für ein normales gesellschaftliches leben: entweder dadurch dass die beratung und aufklärung wirkt mit dem schwerpunkt zunächst auf den über ‑jährigen und einem bericht dazu ende mai wenn das nicht wirkt dann bleibt es bei der impfpflicht mit kontrollen ab und nachweiserbringung bis herbst frau schmidt gestatten sie eine zwischenfrage aus der fraktion der afd nein nein und dann im herbst mit einer entscheidung für die - bis ‑jährigen auf grundlage eines berichts über impflücke virusmutation erwartbares infektionsgeschehen usw sodass es dann in einer schwierigen situation eine impfpflicht auch für die über ‑jährigen mit einfachem beschluss geben kann und wir über eine breite immunisierung wenn auch etwas später aus der dann schwierigen pandemischen lage herauskommen werden noch ein grundsätzlicher satz zum abschluss putins krieg gegen die ukraine wird weitere folgen haben die menschen in unserem land unsere wirtschaft der erhalt von arbeitsplätzen unser sozialstaat werden vor große herausforderungen gestellt wir haben heute die chance im herbst nicht auch noch mit den maßnahmen zur pandemiebekämpfung zurechtkommen zu müssen darum bitte ich um ihre zustimmung bevor ich den nächsten redner aufrufe: es gibt den wunsch nach einer kurzintervention von dem kollegen ehrhorn
2,07.04.2022,ID202800200,Thomas,Ehrhorn,AfD,Thomas Ehrhorn,vielen dank frau präsidentin frau kollegin ich bin jahre alt ich bin zweimal geimpft worden und ich hatte vor zwei wochen eine coronaerkrankung: zwei tage fieber das war es die behauptung diese impfung würde in irgendeiner weise vor der erkrankung schützen ist damit nachweislich falsch bedauerlicherweise habe ich auch mehrere mitglieder meiner familie mit dem virus angesteckt die behauptung die impfung würde in irgendeiner weise vor der ansteckung anderer menschen schützen ist damit ebenfalls nachweislich falsch das einzige was klar und beweisbar ist ist dass eine impfung wenn sie dann durchgeführt wird im allerbesten falle für drei monate eine schutzwirkung entfaltet wenn es überhaupt eine schutzwirkung gibt und dann ist es damit vorbei das macht das ganze in höchstem maße absurd denn was heißt es wenn diese zwangsimpfung von ihnen durchgesetzt wird das heißt dass ich selbst wenn ich mich noch einmal impfen lassen würde also zum dritten mal dann noch eine vierte eine fünfte eine sechste impfung benötigen würde niemand auf der welt nicht der gesundheitsminister nicht der kanzler und auch sie nicht kann mir in irgendeiner weise eine aussage dazu geben was das mit meinem körper machen würde klar ist nur eins: dass es gegebenenfalls sehr schwere nebenwirkungen geben kann die möglicherweise viel schlimmer sind als die coronaerkrankung mit zwei tagen fieber jemals sein könnte vielen dank frau schmidt möchten sie erwidern
3,07.04.2022,ID202800300,Dagmar,Schmidt,SPD,Dagmar Schmidt,mit großer freude zunächst kann ich dem kollegen sagen: sie haben ihre impfpflicht erfüllt mit zwei impfungen und einmal genesen haben sie alles das was wir in unser gesetz geschrieben haben erreicht ich sehe es geht ihnen gut das freut mich unsere impfpflicht bezieht sich entweder auf drei impfungen oder auf zwei impfungen und eine genesung das schützt zwar nicht davor dass man sich nicht noch mal anstecken kann aber es schützt davor dass man schwer erkrankt oder daran stirbt damit kommen wir in eine lage die in der gesamten gesellschaft für eine hohe grundimmunisierung sorgt dann brauchen wir keine maßnahmen mehr sondern wir können anfangen einen normalen umgang mit diesem virus zu pflegen es ist unser zutiefst gehegter wunsch dass wir endlich davon loskommen mit diesem virus umgehen zu müssen indem wir andere freiheitsbeschränkungen auf uns nehmen wir wollen es durch die grundimmunisierung durch drei impfungen oder zwei impfungen plus einmal genesen schaffen dass wir mit diesem virus wie mit anderen viren auch einen normalen umgang in unserer gesellschaft haben können ich würde mich freuen wenn sie nach ihren eigenen erfahrungen dem dann auch zustimmen könnten jetzt rufe ich den nächsten redner auf: den kollegen tino sorge für die fraktion cdu/csu
4,07.04.2022,ID202800400,Tino,Sorge,CDU/CSU,Tino Sorge,vielen dank frau präsidentin liebe kolleginnen und kollegen liebe frau kollegin schmidt ich muss sagen: das was sie ausgeführt haben kann ich nachvollziehen zumindest teilweise ich finde es auch gut dass sie gesagt haben: wir müssen im rahmen der diskussion über eine impfpflicht ob pro oder kontra oder wie auch immer wieder einen normalen umgang miteinander pflegen das teilen wir als unionsfraktion deshalb finde ich es gut dass sie auch wenn wir jetzt auf den letzten metern sind sagen: wir hätten in diesem hause aus der mitte aus der mehrheit des parlaments heraus eine mehrheit finden müssen darum darf ich hier noch einmal für unseren antrag für unseren kompromissvorschlag aus unionssicht werben sie haben gerade dargestellt dass wir für die pandemiebekämpfung im herbst vorsorge treffen müssen wir haben deshalb als union einen ausgewogenen vorschlag unterbreitet indem wir sagen: man kann bei der frage impfpflicht ja oder nein nicht sofort und pauschal entscheiden das ist wie bei der frage: sind sie/bist du für die ehe ja oder nein da kann man nur sagen: es kommt darauf an: es muss die richtige frau da sein es muss der richtige zeitpunkt sein und es müssen die umstände passen wir reden hier über eine impfpflicht zu einem zeitpunkt in dem wir glücklicherweise sinkende inzidenzzahlen haben wo momentan in den krankenhäusern glücklicherweise keine überlastungssituation herrscht und wo wir überhaupt nicht wissen welche variante im herbst grassiert wir wissen nicht ob die impfstoffe im herbst dann so gut funktionieren wie sie funktionieren sollten deshalb haben wir als union gesagt: lasst uns doch zuallererst eine belastbare datengrundlage schaffen; stichwort impfregister ich finde es gut dass sie diesbezüglich jetzt auch sagen: wir müssen das machen aber es ist natürlich kein kompromissvorschlag wenn sie in den gesprächen sagen: wir sind bereit das zu machen aber eben irgendwann das wäre der erste schritt deshalb sagen wir erstens: wir wollen ein impfregister damit wir überhaupt erst mal wissen wie denn der immunstatus in der bevölkerung aussieht zweitens sagen wir: wir müssen vorsorge für den herbst treffen diese vorsorge beinhaltet auch lieber herr kollege gesundheitsminister dass wir die impfinfrastruktur vorhalten da kann es nicht sein dass sie in allen bereichen lockern dass die maskenpflicht aufgehoben wird dass sie sich aus der finanzierung der impfzentren der länder zurückziehen wollen und hier gleichzeitig mit macht eine impfpflicht auf vorrat möglichst ab durch die hintertür durchziehen wollen das halten wir für den falschen weg liebe kolleginnen und kollegen herr sorge gestatten eine zwischenbemerkung oder zwischenfrage aus der fraktion bündnis /die grünen sehr gerne frau kollegin sie haben das wort vielen dank für die möglichkeit der zwischenfrage können sie mir bitte erläutern wie es gehen soll mitten in eine neue welle hinein die im herbst hoffentlich nicht kommt die aber nach expertenmeinung mit überwiegender wahrscheinlichkeit doch kommt dann eine impfkampagne zu starten die noch erfolg haben soll alle experten sagen: wir müssen vorsorge treffen wir müssen jetzt handeln vor einer neuen welle wenn die welle erst mal wieder ansteigt ist es einfach zu spät können sie uns das bitte noch mal erklären wie das funktionieren soll vielen dank vielen dank herr kollege für die frage das gibt mir die möglichkeit noch mal ein paar dinge richtigzustellen wenn sie hier sagen alle experten würden das so sehen dann ist das nicht richtig wir haben immer gesagt: wir müssen vorsorge treffen das heißt natürlich nicht dass wir jetzt pauschal eine impfpflicht für alle menschen beschließen wobei sie in den letzten tagen von der impfpflicht ab zunächst auf die impfpflicht ab und jetzt ab umgeschwenkt sind gleichzeitig aber sagen sie alle müssten sich zwingend beraten lassen das wäre nicht nur bürokratisch irrsinnig sondern das wird auch von den kommunalen spitzenverbänden und von den kassen abgelehnt nein es geht darum vorsorge zu treffen wenn wir wissen dass im herbst möglicherweise eine welle auf uns zukommt dann ist es doch umso wichtiger jetzt diesen vorsorgemechanismus den wir vorschlagen in gang zu setzen es geht doch genau darum wir können doch nicht sagen: wir nutzen ein mittel eine impfpflicht noch dazu für alle personen wenn wir wissen dass aufgrund glücklicherweise milderer verläufe die auswirkungen dieses virus in den alterskohorten komplett unterschiedlich sind da müssen wir doch schauen wenn wir die überlastung des gesundheitssystems vermeiden wollen und wir nach jetzigem stand wissen dass überdurchschnittlich häufig ältere wenn sie schwere verläufe haben auf die intensivstation kommen können wir doch jetzt nicht pauschal sagen: wir zwingen alle sich beraten zu lassen und wir lassen unabhängig von der im herbst geltenden variante jetzt alle impfen obwohl wir wissen dass das gar kein geeignetes mittel ist lieber herr kollege ich will ihnen noch mal ganz deutlich sagen: es irritiert mich seit wochen dass wir bei der frage der eingriffe immer so lapidar darüber hinweggehen sagen: na ja es ist eben ein grundrechtseingriff wir reden hier über abwägung von grundrechten wir reden über eingriffe in die körperliche unversehrtheit lieber herr kollege das sage ich auch ganz offen in richtung bundeskanzler und in richtung bundesgesundheitsminister: ich hätte erwartet dass bei dieser sensiblen frage einer impfpflicht und eines eingriffs in die grundrechte eine güterabwägung stattgefunden hätte und die argumentation dazu deutlicher gemacht worden wäre darüber muss in der mitte des parlaments gesprochen werden da kann man nicht sagen: wir nutzen ein mittel nämlich die impfpflicht pauschal für alle in dem wissen dass es irgendwas bringt ja impfen schützt impfen schützt individuell vor schweren verläufen aber eine pauschale impfpflicht führt eben nicht dazu dass wir mögliche überlastungssituationen verhindern die wir momentan gar nicht haben deshalb liebe kolleginnen und kollegen: stimmen sie für unseren antrag das ist doch der kompromiss der in der mitte liegt wir haben die position: impfpflicht ab wir haben diejenigen die sagen: wir brauchen gar keine impfpflicht und wir als union haben gesagt: lasst uns doch die vorsorgemaßnahmen treffen wenn tatsächlich dieser fall eintreten sollte wobei auch wissenschaftler sagen dass überhaupt noch nicht bewiesen ist ob tatsächlich im herbst eine gefährlichere variante kommt aber wie gesagt: lasst uns vorsorge treffen und dann müssen wir doch die impfzentren haben wir müssen doch in dem moment wissen: gibt es diese variante haben wir impfstoffe da können wir auch hier im parlament in kürzester zeit entscheiden aber eben nicht jetzt auf vorrat und in dem wissen dass es nicht das mildeste mittel ist deshalb liebe kolleginnen und kollegen werbe ich inständig: stimmen sie unserem antrag zu jetzt haben wir ja in den letzten tagen quasi auf den letzten metern die frage gehört warum die union da nicht kompromissbereit sei also ich kann ihnen nur sagen liebe kolleginnen und kollegen: wir haben vor wochen einen kompromiss auf den tisch gelegt sie können doch nicht ernsthaft erwarten wenn sie es in der eigenen ampelkoalition nicht hinbekommen eine mehrheit für dieses thema zu bekommen dass wir diese arbeit bei uns in der unionsfraktion machen wo es auch ein breites meinungsspektrum gibt wenn dieser kompromissvorschlag von ihnen nicht mal ansatzweise diskutiert wird dann erwarte ich von ihnen auch dass sie ernsthaft auf uns zugehen und nicht lapidar sagen: na ja wir machen eine impfpflicht jetzt erst ab dann ab jetzt ab aber sofort und ein impfregister irgendwann mal insofern auch für diejenigen die hier noch unentschlossen sind: liebe kolleginnen und kollegen wir wissen doch alle: es ist ein sehr komplexes thema wir haben alle individuelle betroffenheit wir haben eine meinung wir haben uns alle eine meinung dazu gebildet wir wissen wie hochpolarisierend dieses thema in der gesellschaft diskutiert wird deshalb ist es doch an uns mit einem ausgewogenen kompromiss mit augenmaß die voraussetzungen zu schaffen dass im herbst diese welle eben nicht kommt oder bekämpft werden kann und dafür ist unser vorschlag ein wirklich tragfähiger kompromissvorschlag wir strecken ihnen die hand entgegen ergreifen sie diese hand stimmen sie unserem kompromissvorschlag zu dann werden wir auch für den herbst gut gewappnet sein in diesem sinne: danke für ihre unterstützung und vielen vielen dank liebe kolleginnen und kollegen das ist das was wir in den debatten immer gesagt haben ich habe es in einer debatte gesagt: wir sollten uns die tür zur versöhnung offen halten liebe kolleginnen und kollegen egal wie unterschiedlich die meinungen sein mögen wir haben als union einen vorschlag unterbreitet wir strecken ihnen die hand aus stimmen sie diesem vorschlag zu dann werden wir für den herbst gut gewappnet sein können die debatte befrieden und die polarisierung aus der gesellschaft nehmen vielen herzlichen dank nächste rednerin: für die afd-fraktion dr alice weidel
5,07.04.2022,ID202800500,Alice,Weidel,AfD,Alice Weidel,sehr geehrte frau präsidentin sehr geehrte damen und herren das grundgesetz hat den zweck die freiheitsrechte der bürger zu garantieren unter diesen wichtigen und grundlegenden rechten ragt das recht auf leben und körperliche unversehrtheit hervor das ist unsere letzte verteidigungslinie wenn eine regierung sich anmaßt dieses höchste recht nach belieben umzubiegen dann brauchen wir keinen verfassungsschutz mehr um zu sagen dass diese regierung verfassungsfeindlich handelt die impfpflicht ist nicht nur radikal verfassungsfeindlich; sie ist eine totalitäre anmaßung eine entwürdigung des individuums der einzig argumentative krüppel für die impfpflicht ist eine art kollektive notwehr: weil du mich angeblich mit deinem körper gefährdest hast du das recht verwirkt über diesen frei entscheiden zu dürfen ich zwinge dich daher zu deinem glück eine furchteinflößende sichtweise ab wann stellt der menschliche körper denn keine gefahr mehr dar nach der dritten nach der vierten nach der fünften impfung wer entscheidet das und wer gibt dem staat das recht uns zu unserem angeblichen glück zu zwingen weil die befürworter klüger sind als der rest ausgerechnet die erste berufsgruppe die von der freiheitsfeindlichen impfpflicht betroffen ist sind ärzte krankenpfleger altenpfleger die im übrigen in scharen ihren job kündigen also diejenigen die das größte wissen haben es geht also nicht um wissen um das abwägen von rechtsgütern sondern um die lust an der uneingeschränkten verfügungsgewalt schon der lockdown war eine politik vorbei am faktischen nach unserer freiheit ist jetzt unser körper an der reihe die mrna-vakzine sind keine konventionellen impfstoffe sondern ein quantensprung in der wissenschaft keiner dieser wirkstoffe hat eine reguläre zulassung das in millionenteuren werbekampagnen als piks zu verballhornen ist eine infantilisierung der bürger die einer rechtlichen entmündigung vorweggreift berechtigten bedenken wird nicht argumentativ sondern pseudomoralisch begegnet der einzig rational nachvollziehbare grund für eine impfpflicht sind die millionen impfdosen auf denen professor lauterbach sitzen bleibt das aber sind die probleme eines überforderten gesundheitsministers nicht unsere die regierung trifft entscheidungen ohne zuverlässige datengrundlagen es gibt keine belastbaren zahlen zum impfstatus zu nebenwirkungen oder zu hospitalisierungsraten hinzu kommt dass mittlerweile sogar doppelt geimpfte in der statistik als ungeimpft gelten wenn ihre letzte impfung ein halbes jahr zurückliegt ein impfstatus für ein halbes jahr da gibt selbst die regierung zu dass die impfung nichts taugt zahlenchaos auch bei der erfassung von impfnebenwirkungen: es mehren sich die zeichen und ich möchte dass sie das hier ernst nehmen für eine dramatische untererfassung von gravierenden gesundheitsschäden durch die neuartigen mrna-vakzine diese fälle sind keinesfalls selten die universitätsklinik marburg eröffnete eigens eine spezialambulanz die überläuft dort gibt es wartelisten von über patienten hunderte e‑mails am tag das unwürdige impfpflichtgeschacher der ampel ist deshalb nicht nur blamabel es ist verantwortungslos sie wollen mit ihrem impfpflichtgesetz das gesundheitsministerium ermächtigen jede gesetzesänderung ohne abstimmung im bundestag durchzuführen die impfpflicht ab dient ihnen lediglich als trojanisches pferd sie ist in wirklichkeit die impfpflicht für alle verlogener geht es nicht nächster redner ist wolfgang kubicki für die gruppe kubicki und andere
6,07.04.2022,ID202800600,Wolfgang,Kubicki,FDP,Wolfgang Kubicki,frau präsidentin liebe kolleginnen und kollegen es ist natürlich schwer nach einem solchen debattenbeitrag darauf nicht einzugehen aber die zeit erlaubt es mir leider nicht; denn ich bin auf drei minuten begrenzt wir können das an anderer stelle machen ich kann gut nachvollziehen herr kollege sorge dass emotionen bei diesem thema hochgehen gleichzeitig müssen wir aber aufpassen dass im eifer des gefechts nicht argumente benutzt werden die weniger auf evidenz zurückzuführen sind als auf den unbedingten willen die eigene position durchzusetzen abseits von politischen bewertungsfragen müssen wir im parlamentarischen prozess dafür sorgen falsche begründungen als solche zu identifizieren und als argumente aus der debatte herauszunehmen deshalb sollten wir mit blick auf die anhörung im gesundheitsausschuss folgende punkte festhalten: eine herdenimmunität wird durch die impfung nicht erreicht eine deutlich gefährlichere virusvariante im kommenden herbst ist nicht das wahrscheinlichste szenario ungeimpfte sind nicht schuld daran dass sich andere menschen infizieren wir hatten keine überlastung des gesundheitssystems und werden voraussichtlich auch keine bekommen die einführung einer allgemeinen impfpflicht mit einem nur bedingt zugelassenen impfstoff ist verfassungsrechtlich ohnehin ein problem impfungen dienen dem selbstschutz und nicht dem fremdschutz wenn wir uns auf diese punkte verständigen können darf es aus verfassungsrechtlichen gründen keine impfpflicht geben es ist nämlich nicht die aufgabe des staates erwachsene menschen gegen ihren willen zum selbstschutz zu zwingen dieses haus hat eine vorbildfunktion für die debattenkultur in unserem land deshalb darf es nicht darum gehen am ende einer abstimmung als vermeintliche sieger oder verlierer dazustehen es muss uns darum gehen am ende die rechtlich und gesundheitspolitisch beste sowie die gesellschaftlich verträglichste lösung gefunden zu haben hier können die menschen erwarten dass neue erkenntnisse auch zu einer revision der alten positionen führen wenn die delta-variante viele in diesem hause zum umdenken in sachen impfpflicht gebracht hat dann muss das auftreten der milderen omikron-variante konsequenterweise ebenfalls zu einem umdenken führen die menschen können nachvollziehen dass bei einer verschärfung der situation auch schärfere politische maßnahmen gefordert werden wenn diese schärferen maßnahmen aber auch gefordert werden obwohl die situation sich entspannt hat dann stellt sich die frage ob es wirklich noch um eine sachgerechte politische lösung oder eher darum geht die politische deutungshoheit zu behalten liebe kolleginnen und kollegen der ethikrat auf den sich ja so viele immer wieder berufen ich empfehle die seiten der veröffentlichung des ethikrats mal zu lesen hat in dieser woche eine bemerkenswerte stellungnahme zur vergangenen und künftigen auseinandersetzung mit der coronapandemie abgegeben er formulierte unter anderem ich zitiere : wenn die von einer pandemisch auftretenden infektionskrankheit ausgehenden gesundheitlichen risiken durch impfungen medikation immunisierung durch vorausgegangene infektionen oder auch infolge der verbreitung neuer virusvarianten mit höherer infektiosität aber geringerer pathogenität unterhalb dessen liegen was die gesellschaft im hinblick auf andere viruserkrankungen … hinzunehmen bereit ist lassen sich schwerwiegende freiheitseingriffe nicht mehr rechtfertigen frau präsidentin mein letzter satz: deshalb ist eine allgemeine impfpflicht ob ab oder weder rechtlich noch gesellschaftspolitisch zu rechtfertigen ich danke für die aufmerksamkeit nächster redner ist für die gruppe baehrens janecek und andere der kollege dr andrew ullmann
