,datum,redeID,vorname,nachname,fraktion,name,inhalt_neu
0,,,,,, ,
1,04.03.2021,ID1921500100,Rudolf,Henke,CDU/CSU,Rudolf Henke,"werter herr präsident! liebe kolleginnen und kollegen! meine damen und herren! liebe zuschauerinnen und zuschauer! die medizin ist eine soziale wissenschaft, und politik ist weiter nichts als medizin im großen. kein satz von mir, kein satz, den nur ich zitieren könnte. es ist ein satz von rudolf virchow, der hier in berlin direktor der pathologie an der charité war, der gleichzeitig mitglied des berliner abgeordnetenhauses, des preußischen landtags und des reichstags über jahrzehnte gewesen ist und der ein verständnis von wissenschaft in der medizin und der politik geprägt hat, wie wir es heute anwenden können und müssen in einem maß, wie es viele von uns sich nie hätten träumen lassen. ich glaube, dass unsere aufgaben, die wir fördern und voranbringen müssen, darin bestehen, die weitere reduktion von neuinfektionen in unserem land voranzubringen, die unterbrechung der diffusen zirkulation von sars-cov- in der bevölkerung zu erreichen und die vermeidung eines wiederanstiegs der fallzahlen anzustreben, indem die grundlegenden verhaltensregeln aha+l sowie eine selbstisolierung bei krankheitssymptomen von der bevölkerung weiter praktiziert werden und indem wir mit effektiver testung und kontaktpersonennachverfolgung die zahl der neuinfektionen niedrig halten, damit der öffentliche gesundheitsdienst neu auftretende fälle nachverfolgen kann, damit quarantäne und isolation überall, wo erforderlich, praktiziert werden können und damit ausbruchsuntersuchungen durchgeführt werden können. wir brauchen einen umfassenden einsatz der impfprävention. wir können erkennen, dass impfprävention hilft. ich erinnere an den . dezember , als wir in den nordrhein-westfälischen pflegeheimen vor dem start der impfkampagne eine anzahl von über infizierten menschen hatten, die dadurch in größte gefahr gekommen sind. wir haben in dieser woche erlebt, dass, nachdem praktisch alle bewohner von altenheimen durchgeimpft sind, in nordrhein-westfalen die zahl der noch von der krankheit befallenen in den heimen auf gesunken ist. das zeigt, wie sehr impfprävention wirkt. impfung ist eine starke waffe in der auseinandersetzung mit der pandemie. das zeigt auch, dass wir mit der intensivierung der impfkampagne den schutz besonders gefährdeter bevölkerungsgruppen ernst nehmen und dass wir damit wirkungen erzielen. das rki hat gestern seinen neuen bericht zu besorgniserregenden sars-cov- -virusvarianten vorgestellt. die britische variante macht in deutschland mittlerweile rund prozent aus. zugleich haben wir rund covid- -patientinnen und -patienten in intensivmedizinischer behandlung. das entspricht dem höchststand der welle im frühjahr , der ersten welle. allein das zeigt, dass wir uns ohne jeden zweifel weiter in einer epidemischen lage von nationaler tragweite befinden. deshalb ist es gut und richtig, wenn wir heute so fraktionsübergreifend wie möglich das rechtliche fortbestehen dieser lage nach dem infektionsschutzgesetz über den . märz , wenn die derzeitige feststellung ausläuft, festhalten und für die zeit ab april festlegen. wir haben oft über die rolle des deutschen bundestages in der pandemiebekämpfung debattiert. gerade nachdem gestern die ministerpräsidenten der bundesländer bei der bundeskanzlerin getagt haben, freue ich mich, dass unser haus fraktionsübergreifend so voll besetzt ist, wie es ist. ich fände es nicht schlecht, wenn wir hier nicht nur immer die bundeskanzlerin, den bundesminister für gesundheit, den bundesminister für wirtschaft zur rede stellen und zur verantwortung ziehen würden. ich rege an, dass sich vielleicht der eine oder andere ministerpräsident auch mal überlegt, ob er sich diesem haus stellt, wenn er so was veranstaltet, wie wir es gestern erlebt haben. wir haben konsequenzen aus den debatten gezogen, und diese konsequenzen sind im wesentlichen, dass wir eine rechtsgrundlage für die impfverordnung des bmg neu fassen und in das infektionsschutzgesetz einfügen. wir haben uns darauf verständigt, über die inzidenz hinaus weitere kriterien im gesetz festzuhalten: sowohl die frage der reproduktionsziffer als auch die anzahl der geimpften als auch die belastungssituation im gesundheitswesen. und wir haben uns darauf verständigt, dass wir eine evaluation mit unabhängigen wissenschaftlern betreiben, die ihr ergebnis bis ende vorlegen. wir erwarten von der nächsten bundesregierung, sich dazu zu verhalten, sodass wir dann eine debatte darüber bekommen, welche konsequenzen daraus für die gestaltung des infektionsschutzgesetzes zu ziehen sind. wir haben uns außerdem darauf verständigt, dass wir bei den kompetenzen, die wir dem bundesminister für gesundheit übertragen, durch die streichung des wortes insbesondere an vier stellen eine konkretisierung des auftrags vornehmen. liebe kolleginnen und kollegen, ich glaube, dass der bundestag seine rolle mit der verabschiedung dieses gesetzes stärkt, und deswegen bitte ich sie alle sehr herzlich um ihre zustimmung. vielen dank für die aufmerksamkeit. jetzt erteile ich das wort dem kollegen dr. robby schlund, afd."
2,04.03.2021,ID1921500200,Robby,Schlund,AfD,Robby Schlund,"sehr geehrter herr präsident! werte kollegen! frau bundeskanzlerin, nur noch ein drittel der bevölkerung hält eine beibehaltung der coronamaßnahmen für sinnvoll. immer mehr mittelständler stellen sich die existenzfrage, und die zahl der psychischen krankheiten durch den dauerlockdown steigt exorbitant. der mittelstand in deutschland steht vor der schwersten krise seit dem zweiten weltkrieg. arbeitslosigkeit, betriebsschließungen und insolvenzen beherrschen in deutschland die tagesordnung. die coronapandemie ist längst nicht mehr nur ein gesundheitspolitisches, sondern mittlerweile auch ein gesamtgesellschaftliches problem. umso unverständlicher ist es, dass statt kurz-, mittel- und langfristiger lösungen ein chaotisches krisenmanagement angeboten wird, mit fehlenden öffnungs- und unterstützungsperspektiven. wir brauchen kein gesetz für den fortbestand einer epidemischen lage. was wir aber brauchen, meine damen und herren, was wir in der tat brauchen, ist ein rastermanagement, welches die afd bereits seit februar fordert. dies gilt es umzusetzen, und dem gilt es aufmerksamkeit zu schenken. aber was, meine damen und herren, ist denn nun der große unterschied zu dem, was hier gerade in deutschland stattfindet? bei unserem rastermanagement werden die risikogruppen und erkrankten bei gleichzeitigem aufrechterhalten systemrelevanter gesellschaftlicher und wirtschaftlicher prozesse geschützt. eine indirekte bestätigung erfuhr ich dazu bei einem gespräch mit dem chef des russischen gesundheitsausschusses im oktober letzten jahres, herrn dr. morozov. denn in russland setzt man ein ähnliches konzept mit expertenkommissionen ein, wie wir, die afd, es fordern. ergänzt wird das ganze durch einen staatlich organisierten freiwilligendienst, um die risikogruppen und erkrankten effektiv zu unterstützen. einen neuerlichen lockdown gab und gibt es in russland nicht. schauen wir auf die aktuellen daten der johns-hopkins-universität, wird schnell deutlich, dass es keinen zusammenhang ich betone: keinen zusammenhang zwischen den sieben-tage-inzidenzen und den todesraten bei lockdown-maßnahmen oder eben keinen lockdown-maßnahmen gibt. so sind in russland zum beispiel die sieben-tage-inzidenz wie auch die coronatodeszahlen, bezogen auf die gesamtbevölkerung, um circa die hälfte niedriger als in deutschland oder in österreich. in anbetracht des weniger effizienten gesundheitssystems in russland zeigt sich hier deutlich, dass es auf jeden fall am management liegt und nicht primär an der gesundheitsversorgung. trotz massiver kritik aus dem gesundheitsausschuss besteht aus unserer sicht eben kein widerspruch zwischen einem effizienten expertenrat und der forderung nach aufhebung der feststellung der epidemischen lage. denn die epidemische lage wird sozusagen benutzt, um grundrechtseinschränkungen zu legitimieren. deshalb plädieren wir erstens für die sofortige aufhebung der epidemischen lage von nationaler tragweite, zweitens für die beseitigung der grundrechtseingriffe und ermächtigungen durch dieses gesetz und drittens für die entwicklung eines rastermanagementkonzeptes mit expertenrat unter berücksichtigung der drei säulen des pandemiemanagements: schutz der risikogruppen, medikamentöse beeinflussung der virusausbreitung und last, but not least prophylaxe sowie impfstrategie auf freiwilliger basis. vielen dank für ihre aufmerksamkeit. jetzt erhält das wort die kollegin sabine dittmar, spd."
3,04.03.2021,ID1921500300,Sabine,Dittmar,SPD,Sabine Dittmar,"sehr geehrter herr präsident! liebe kolleginnen und kollegen! fast genau vor einem jahr musste das parlament erstmals eine epidemische lage von nationaler tragweite feststellen. wir haben damals in verbindung mit dem ersten bevölkerungsschutzgesetz wichtige gesetzliche regelungen getroffen, um flexibel und schnell auf die entwicklungen der sars-cov- -epidemie reagieren zu können. wir haben die pandemiebedingten regelungen im lnfektionsschutzgesetz damals für ein jahr befristet. dies geschah in der annahme, dass corona heute schon längst der vergangenheit angehören würde. leider ist das nicht der fall. sars-cov- hält weiterhin die welt in atem, mit fast millionen erkrankten und , millionen todesfällen. auch in deutschland gibt es keine entwarnung. nach einem erfreulichen rückgang der zahl der neuinfektionen befinden wir uns seit mitte februar in einer seitwärtsbewegung auf einem sehr hohen niveau mit steigender tendenz. das virus und mittlerweile maßgeblich die wesentlich infektiöseren virusmutanten, die in kürze auch das lnfektionsgeschehen bestimmen werden, erfordern deshalb weiterhin ein konsequentes handeln von uns allen. deshalb werden wir heute feststellen, dass die epidemische lage von nationaler tragweite weiter besteht. wir werden weiter regeln, dass, wenn nach drei monaten keine erneute feststellung erfolgt, diese automatisch als aufgehoben gilt und damit auch alle verbundenen rechtsverordnungen und anordnungen ihre gültigkeit verlieren. ich möchte an dieser stelle eines mal ganz deutlich machen, weil ich in vielen gesprächen den eindruck gewinne, dass es immer wieder vermischt wird: wenn der bundestag heute das fortbestehen der epidemischen lage feststellt, heißt das nicht, dass die zur bekämpfung von corona getroffenen maßnahmen auch auf dauer fortbestehen. schritt für schritt wird zwischen bund und ländern über lockerungsmöglichkeiten und über notwendige und angemessene einschränkungen beraten werden, und die länder müssen bei der umsetzung begründen, dass die maßnahmen geeignet, erforderlich und angemessen sind. und hierzu genügt es eben nicht, sich ausschließlich an den inzidenzwerten zu orientieren. hier müssen beispielsweise auch der r-wert, die belastung des gesundheitssystems, die impfquote oder neue testmöglichkeiten berücksichtigt werden. das haben wir in dem vorliegenden gesetzentwurf auch noch einmal ganz deutlich festgestellt. meine damen und herren, ich kann den wunsch nach lockerungen gut verstehen; es geht uns ja allen so. bürgerinnen und bürger, gewerbetreibende, touristiker, kulturschaffende, wir alle brauchen eine klare perspektive. und genau das ist auch die herausforderung. denn das abwägen zwischen infektionsgeschehen und weiteren lockerungen, das für und wider zwischen öffnen und aufrufen zum durchhalten es ist und bleibt eine gratwanderung. allerdings kann dieser schmale grat mittlerweile mit etwas mehr zuversicht beschritten werden. denn mit den impfungen, den tests und dank der digitalen kontaktdatenerfassung haben wir neue und bessere möglichkeiten zur verfügung. deshalb bin ich froh, dass die bund-länder-konferenz gestern nicht nur über öffnungsstrategien, sondern vor allem auch über impf- und teststrategien gesprochen hat. bei der teststrategie bleiben für mich als medizinerin allerdings noch einige fragen offen. ein test pro woche in schule und kita kann nur ein anfang sein. ich begrüße, dass wir nun endlich bei der impfstrategie weiterkommen. die große menge an impfstoffdosen auf halde ist für mich völlig inakzeptabel. ein ausdehnen des intervalls zwischen erster und zweiter impfung, ein abschmelzen der reserve für die zweitimpfung und die hoffentlich zügige anpassung der stiko-empfehlung bezüglich des einsatzes von astrazeneca sind gute signale. ich sage mit allem nachdruck: neben einer deutlichen kapazitätssteigerung in den impfzentren müssen jetzt sehr zeitnah die haus- und facharztpraxen und auch die betriebsärzte mit in die impfstrategie integriert werden. meine damen und herren, zum ende meiner rede möchte ich noch auf ein paar wichtige veränderungen hinweisen, die wir im parlamentarischen verfahren erreicht haben; auf die rechtlichen feinheiten wird mein kollege fechner eingehen. für uns als gesundheitspolitiker war es wichtig, den pflegeschutzschirm unverändert fortzuführen. die angedachten regelungen hätten zu großer unsicherheit bei den einrichtungsträgern geführt. ich hoffe, diese sorgen haben wir nehmen können. wir passen auch die entschädigungsregel im infektionsschutzgesetz für eltern, die pandemiebedingt kinderbetreuung leisten, an die bereits erweiterten regelungen zum kinderkrankengeld im sozialgesetzbuch an. und wir haben die prämienzahlung für besonders belastete pflegekräfte und andere krankenhausbeschäftigte erheblich ausgeweitet. hierzu werden millionen euro bereitgestellt. ich denke, die beschäftigten haben diese prämie mehr als verdient. meine damen und herren, insgesamt legen wir ihnen ein gelungenes gesetz vor, das im parlamentarischen verfahren wirklich entscheidende veränderungen erfahren hat. ich denke, mit ein bisschen mehr tempo beim impfen, einer gut durchdachten teststrategie und wenn wir alle weiterhin achtsam und sorgfältig miteinander umgehen, werden wir peu à peu ein stück normalität zurückgewinnen. ich danke für die aufmerksamkeit und bitte um zustimmung zum gesetz. bleiben sie gesund! nächste rednerin ist die kollegin christine aschenberg-dugnus, fdp."
4,04.03.2021,ID1921500400,Christine,Aschenberg-Dugnus,FDP,Christine Aschenberg-Dugnus,"sehr geehrter herr präsident! liebe kolleginnen und kollegen! wir als fdp-bundestagsfraktion erkennen an, dass sie einige unserer forderungen in diesem gesetzentwurf umgesetzt haben. so begrüßen wir, dass der bundestag nunmehr mindestens alle drei monate der feststellung der epidemischen lage zustimmen muss. das haben wir schon sehr lange gefordert! ebenso positiv ist, dass impfziele für die priorisierung jetzt im gesetz aufgeführt werden und auch dass bestimmte schutzschirme verlängert werden; das ist für die akteure sehr wichtig. leider haben sie es aber nicht geschafft, die verfassungsrechtlichen verstöße, die immer noch vorliegen, aufzuheben, meine damen und herren. von ihnen als regierung wurde trotz öffentlicher anhörungen, trotz einhelliger auffassung der verfassungsrechtler, trotz einschätzung der leopoldina und des ethikrates ganz einfach die mute-taste, also die stummschaltung, gedrückt und auf durchzug geschaltet. das geht nicht, meine damen und herren! ich frage mich ernsthaft: wo ist die verfassungsrechtliche expertise der koalition geblieben? ich sehe da nichts. die feststellung der epidemischen lage alle drei monate eröffnet dem ministerium doch nach wie vor die option, innerhalb dieser drei monate verordnungen ohne zustimmung des bundestages zu erlassen. das geht nicht, meine damen und herren! eine solche dauergenehmigung ist verfassungswidrig. sie umgehen hier den parlamentsvorbehalt, und das ist eine missachtung des parlamentes. sie wollen einfach nicht akzeptieren, dass ihre verordnungsermächtigung ohne beteiligung des bundestages von allen verfassungsrechtlern einhellig als verstoß gegen artikel grundgesetz bewertet wird, meine damen und herren. außerdem ist die nennung von impfzielen für die priorisierung allein nicht ausreichend; auch das haben verfassungsrechtler bestätigt. eine impfpriorisierung, die ja im moment leider noch aufgrund der beschränkten verfügbarkeit der impfstoffe notwendig ist, muss gesetzlich normiert sein. alles andere ist verfassungswidrig. leider stellen sie unseren regelungsvorschlag immer wieder falsch dar, wenn sie behaupten, er wäre zu statisch und zu unflexibel. ich empfehle einfach mal einen blick in unseren änderungsantrag. auch wir wollen eine verordnungsermächtigung, um schnell auf neue impfstoffe oder mit anpassung der priorisierung reagieren zu können; auch wir wollen flexibilität, auch wir wollen impfungen in arztpraxen und von betriebsärzten. aber und das weigern sie sich leider zu akzeptieren das kann nur mit zustimmung des deutschen bundestages geschehen, meine damen und herren. genau das steht in unserem änderungsantrag. denn die frage, wann wer geimpft wird, hat nun mal auswirkungen auf leben und körperliche unversehrtheit der menschen. wir benötigen rechtssicherheit, und als fraktion, die die rechtsstaatlichkeit sehr hochhält, ist uns das besonders wichtig. meine damen und herren, leider müssen wir aufgrund des missmanagements bei der impfstoffbeschaffung auch weiterhin priorisieren. deshalb kommt es beim wettlauf gegen das virus aufs tempo beim impfen an. da hakt es noch gewaltig. deswegen gehen wir erneut in vorleistung und bringen morgen einen antrag für ein nationales impfportal in den deutschen bundestag ein. dass impfdosen auf halde liegen und nicht verimpft werden, ist ein zustand, den wir nicht akzeptieren können und der beendet werden muss. meine damen und herren, das impfmanagement der bundesregierung hat der politik und dem ansehen deutschlands einen schweren schaden zugefügt: platz in europa, platz in der welt. das ist doch einfach nicht hinnehmbar! das ist doch eine schande, und das muss geändert werden! des weiteren kritisieren wir an dem gesetzentwurf, dass die schutzschirme nicht ausreichend aufgespannt werden. es fehlen wichtige akteure wie zum beispiel die hebammen, heilmittelerbringer und zahnärzte, die jetzt in dem schutzschirm nicht berücksichtigt werden. im ergebnis werden wir ihr gesetz ablehnen. vielen dank. nächste rednerin ist die kollegin susanne ferschl, die linke."
5,04.03.2021,ID1921500500,Susanne,Ferschl,DIE LINKE,Susanne Ferschl,"herr präsident! sehr verehrte kolleginnen und kollegen! die pandemische lage besteht weiterhin; das belegen die aktuellen zahlen. deswegen sind auch weitere maßnahmen notwendig; das ist unstrittig. aber das, was wir hier seit einem jahr erleben, ist nichts anderes als chaos und planlosigkeit. es fehlt nach wie vor an transparenz, an demokratischer beteiligung des parlaments und an einer klaren strategie. gestern tagte wieder die ministerpräsidentenkonferenz samt kanzlerin, und mir kommt es langsam so vor wie und täglich grüßt das murmeltier : stundenlanges spektakel im kanzleramt drinnen und stundenlanges warten draußen auf die ergebnisse. ich weiß, ich wiederhole mich, aber: die debatten gehören raus aus dem kanzleramt und rein hier ins parlament! frau bundeskanzlerin, sie halten es seit einem jahr nicht für notwendig, zumindest vor dieser runde hier eine öffentliche regierungserklärung abzugeben, nicht mal im nachgang. das ist doch an ignoranz kaum zu überbieten! öffentlichkeit würde für transparenz sorgen und so manchen wilden theorien vorbeugen. umso entsetzter bin ich, dass union und spd gestern im gesundheitsausschuss mit den stimmen der afd einen unterausschuss beschlossen haben, der nichtöffentlich hinter verschlossenen türen beraten soll. das schlägt doch dem fass den boden aus! liebe union und liebe spd, ich weiß nicht, wie sie ihre rolle verstehen; aber unsere aufgabe als parlamentarier ist doch, für transparenz zu sorgen und wesentliche entscheidungen selbst zu treffen und nicht der bundesregierung zu überlassen. und die fragen, ob man seinem beruf nachgehen kann, ob es ausgangssperren gibt, ob schulen und kitas geschlossen sind, sind doch wohl wesentliche entscheidungen. und im übrigen auch die frage andersherum: wann wird denn wieder geöffnet? das einzig wesentliche, was der bundestag in diesen fragen beschlossen hat, war vor circa einem jahr eine umfassende verordnungsermächtigung der bundesregierung und auch der landesregierungen. was fällt ihnen nach einem jahr an verbesserungen ein? der bundestag soll nun die epidemische lage im dreimonatsrhythmus beschließen. tut er es nicht, gelten auch alle verordnungen, die seit anfang in kraft getreten sind, nicht mehr, also auch krankenhausfinanzierung, arbeitsschutz usw. das ist doch lediglich eine scheinbeteiligung des parlaments; regieren per verordnung bleibt weiter möglich. das ist mit uns nicht zu machen, und deshalb lehnen wir das ab. was bezüglich der akzeptanz der bevölkerung ein genauso großes problem ist wie die fehlende transparenz, ist die fehlende strategie. im vorfeld und auch im nachgang dieser ministerpräsidentenkonferenz wird so würde man es zumindest in bayern sagen regelmäßig eine andere sau durchs dorf getrieben. jeder und jede hat andere ideen und andere vorschläge. der eine erzählt, dass der osterurlaub nicht möglich ist, der nächste erzählt was von bedeutenden schritten der öffnung, die es demnächst geben wird. die inzidenzwerte, die gestern diskutiert wurden, die für die öffnungen maßgeblich sind, schwankten im stundentakt zwischen , und . es ist nicht mehr nachvollziehbar. die bisherigen öffnungsschritte muten zumindest seltsam an. während aktuell noch ganze schulklassen in homeschooling sind, haben friseure seit . märz wieder geöffnet. ich habe nicht grundsätzlich etwas dagegen. aber warum ausgerechnet friseure, und warum ausgerechnet zum . märz? und warum sind eigentlich bayerische baumärkte weniger infektiös als andere? ich sage ihnen: das ist alles nicht logisch. das ist willkür und keine strategie. wir sind uns einig: alle freiheitseinschränkungen müssen so schnell wie möglich aufgehoben werden. aber für öffnungsszenarien sind kontaktnachverfolgung, ein breiter zugang zu impfstoffen und schnelltests nötig. und bei all diesen punkten hat die bundesregierung bislang versagt. die corona-warn-app hat gefloppt, und die gesundheitsämter sind über einen viel zu langen zeitraum runtergespart worden, sodass die kontaktverfolgung erschwert wurde. ausreichender impfstoff steht nach wie vor nicht zur verfügung, auch weil sich die bundesregierung standhaft weigert, die lizenzen freizugeben. und auf die angekündigten schnelltests und selbsttests warten wir noch, während unsere österreichischen nachbarn damit schon lange arbeiten. ja, natürlich ist die lage dynamisch. aber ein jahr nach der pandemie können die menschen in diesem land doch erwarten, dass sie ordnung in dieses chaos bringen. und dazu gehören ein im parlament und ich betone: im parlament beschlossener stufenplan, der regelt, welche einschränkungen und welche bedingungen gelten, und eine hier beschlossene impf- und teststrategie. das alles fehlt in ihrem gesetzentwurf. nach zwölf monaten hätte ich wirklich mehr erwartet. ich erwarte von dieser bundesregierung auch, dass sie die weichen für die zukunft anders stellt. wir brauchen investitionen ins bildungssystem. das, was in dieser pandemie mit kindern und jugendlichen passiert ist, darf nie wieder passieren. und der gesundheits- und pflegebereich muss endlich der marktlogik entzogen werden. es ist doch völlig irre, dass im letzten jahr krankenhäuser geschlossen worden sind. abschließend bitte ich sie, unserem entschließungsantrag für eine lohnersatzleistung für die pflegenden angehörigen zuzustimmen; denn es sind menschen, die sehr häufig vergessen werden, und sie brauchen unbedingt ein soziales sicherungsprogramm. vielen dank. nächste rednerin ist die kollegin maria klein-schmeink, bündnis /die grünen."
