,datum,redeID,vorname,nachname,fraktion,name,inhalt_neu
111,19.04.2018,ID192611100,Oliver,Grundmann,CDU/CSU,Oliver Grundmann,sehr geehrte frau präsidentin sehr geehrte kolleginnen und kollegen sehr geehrter herr kollege antragsteller von der afd ein stück weit weniger polemik und übertreibung hätte bei der vorstellung ihres antrages gutgetan dann hätten wir hier auch eine sachliche debatte führen können wir wollen hier weiß gott nicht alles schlechtmachen was aus ihrer feder kommt und in ihrem antrag steht grundsätzlich schließe ich mich ausdrücklich den ausführungen der kollegin skudelny von der fdp an: es muss schluss sein mit dieser ideologischen hexenjagd auf unseren dieselmotor es muss auch schluss sein mit entsprechenden fragwürdigen studien des uba das haben wir auch klar zum ausdruck gebracht das damit renommierten wissenschaftlern vor den kopf stößt denn das verunsichert die menschen in diesem land da gebe ich ihnen durchaus recht und das wollen wir ausdrücklich nicht das wollen wir entschieden verhindern kurz zu ihnen liebe kollegen der fdp es stehen durchaus wertvolle dinge in ihrem antrag über die es sich zu sprechen lohnt über die wir in den zuständigen ausschüssen diskutieren werden: über möglichkeiten zur digitalisierung unserer infrastruktur über notwendige umgehungsstraßen und auch über objektivere schadstoffmessungen dazu werden wir entsprechende ausführungen hören und darüber werden wir auch diskutieren wir als union arbeiten mit hochdruck an innovativen lösungen und lassen uns bestimmt nicht durch die panikmache der deutschen umwelthilfe und anderer interessenverbände hetzen die als kraftvolles orchester aufspielen meine sehr geehrten damen und herren wir verwehren uns gegen eine solche dieselpanikmache aber wir verwehren uns gleichermaßen gegen die scheinbar einfachen antworten der afd sie legen hier zwei seiten vor schrauben ein stück weit an den grenzwerten und geben jedenfalls vor dann seien die probleme vom tisch so läuft das aber nicht das ist einfacher populismus das sind ganz einfache antworten ich will ihnen auch sagen warum solch ein antrag in die falsche richtung geht: weil die grenzwertdiskussion in unseren augen überhaupt nicht nötig ist ganz im gegenteil: es wäre sogar höchst fahrlässig jetzt an den grenzwerten herumzuschrauben das ist eben der springende punkt in dieser debatte und da unterscheidet sich unsere position fundamental von der position der afd aber gleichermaßen von der position der grünen wir stehen nämlich zum diesel wir vertrauen der dieselantriebstechnologie wir sehen unseren diesel nicht lediglich als verursacher von no -überschreitungen an sondern als teil einer lösungsstrategie das wird uns helfen unsere ambitionierten ziele im bereich des klimaschutzes zu erreichen gleichermaßen werden wir mit den neuen euro- -dieseln zukünftig die grenzwerte einhalten ich weiß ihr von den grünen wollt das nicht ihr habt eine völlig andere ausrichtung ihr findet den diesel per se schlecht zu den kollegen von der afd: ich habe mir schon die augen gerieben als ich mir ihren antrag durchgelesen habe im grunde wollen auch sie den diesel nicht zukunftsfähig machen; jedenfalls erreichen sie das nicht einem so formulierten antrag sie gebärden sich als dieselretter aber sie bewirken im grunde genau das gegenteil von dem was wir hier als richtig erachten herr grundmann erlauben sie eine zwischenfrage oder zwischenbemerkung des kollegen spaniel von der afd ja gerne vielen dank dass sie die zwischenfrage gestatten sie haben gerade ausgeführt dass sie zum diesel stehen und dass sie davon ausgehen dass sie durch eine anpassung der dieseltechnologie die vorgeschriebenen luftgrenzwerte erreichen ich frage sie: kennen sie die studie in der die luftreinhaltepläne der stadt stuttgart untersucht wurden da steht nämlich drin dass nur ein totales fahrverbot für alle fahrzeuge in der stadt stuttgart dazu führt dass man die grenzwerte erreicht das passt nicht zu ihrer aussage mich würde gerne generell auch interessieren welche verbindung sie zwischen luftgrenzwerten und fahrzeuggrenzwerten sehen sie ist bisher gar nicht beleuchtet worden deshalb finde ich ihre aussage sehr mutig aber ich würde gerne etwas dazulernen wie kann diese verbindung in bezug auf die ergebnisse der vom verkehrsministerium baden-württemberg initiierten wissenschaftlichen studie eingeordnet werden es muss nicht eine frage sein es kann auch eine bemerkung sein sehr geehrter herr kollege ich werde darauf im rahmen meiner rede noch eingehen in der kurz bemessenen redezeit werde ich auch noch auf die möglichkeiten der luftreinhaltung im rahmen des sofortprogramms eingehen über die studie werden wir bei der beratung der anträge in den ausschüssen ausführlich diskutieren vielen dank sie schreiben in ihrem antrag fleißig dass mit den neuen dieselmotoren die no -belastungen automatisch zurückgehen werden das ist richtig dem stimme ich ausdrücklich zu wir werden wenn das so weitergeht an zahlreichen messstellen bald keine grenzwertüberschreitungen mehr zu verzeichnen haben; ich bin sehr zuversichtlich dass das auch in anderen städten möglich sein wird gleichzeitig heißt es in ihrem antrag die grenzwerte seien viel zu streng und müssten auf den prüfstand ich frage mich schon: wie soll das zusammengehen sollen wir der automobilindustrie sagen jedenfalls denjenigen die fleißig waren die sich angestrengt haben : liebe autobauer wir haben uns geirrt die sauberen diesel die ihr entwickelt habt könnt ihr behalten die brauchen wir nicht mehr wir reduzieren die grenzwerte alles fein was für ein fatales was für ein falsches signal wäre das für die deutsche automobilindustrie sie braucht planungssicherheit das was hier heraufbeschworen bzw gefordert wird ist im grunde industriepolitik aus zeiten des sozialismus: was nicht passt wird passend gemacht genau dem widersetzen wir uns entschieden warum sind die no -belastungen in den letzten jahren so drastisch gesunken um prozent allein in den letzten jahren warum haben wir diese hochentwickelten dieselmotoren überhaupt am markt wir haben sie am markt weil die motoren fortwährend weiterentwickelt wurden und weil wir klare staatliche vorgaben gemacht haben um einen entsprechenden innovationsdruck zu erzeugen diesen wollen sie jetzt einfach verpuffen lassen ich will nicht alles schlechtreden aber man kann schon sagen: das ist ein stück weit pubertär da kommt ein schüler nach hause er hat schlechte noten und versucht deshalb das gesamte benotungssystem zu verändern anstatt sich um bessere leistungen zu bemühen das ist ein ansatz der in die falsche richtung geht mit diesem ansatz verabschiedet sich deutschland in die mittelmäßigkeit das wäre ein albtraum für unsere deutsche wirtschaft und deren ansehen in der welt betrachten wir das ganze aus einer anderen perspektive alle eu-staaten haben sich auf verbindliche eu-weite grenzwerte verständigt und jetzt soll ausgerechnet das land der autobauer der vw-sünder bei der eu-kommission vorstellig werden wir würden erstens keinerlei zustimmung bekommen zu recht wir würden uns lächerlich machen wir würden uns blamieren ich will ihnen sagen: wir stehen für verlässlichkeit und vertragstreue gegenüber unseren europäischen partnern so wie wir es festgeschrieben haben sie hingegen wollen im grunde einen irrlichternden trump-staat im herzen europas das lehnen wir entschieden ab ein zweiter punkt: was wäre das für ein fatales zeichen für unsere bürger sagen wir denen dann: das mit den grenzwerten haben wir nicht hingekriegt macht nichts grenzwerte runter ob tausende diesel unter wert verkauft oder verschrottet werden ist uns egal das ist euer problem ist das afd-politik ist das eine bürgernahe politik meine sehr geehrten damen und herren die grenzwerte die wir haben sind eine wichtige arbeitsgrundlage; wir halten daran fest wir haben das sofortprogramm saubere luft der bundesregierung: elektrifizierung von fahrzeugflotten digitalisierung kommunaler verkehrsleitsysteme ich komme von der küste und weiß: auch im maritimen bereich haben wir noch große chancen große potenziale: lng windwasserstoff landstrom zero-emission-antriebe all das sind gute wege in die zukunft damit können wir die städte sauberer moderner und lebenswerter machen mit einem solchen maßnahmenpaket bleibt deutschland mobilitätsland und innovationsführer kommen sie bitte zum schluss das sind die chancen der zukunft die wir kraftvoll anpacken werden ihr antrag das muss ich hier ausführen ist leider rückwärtsgewandt wir schauen nach vorne vielen dank ich habe gesehen dass sie eine frage stellen wollten aber wir sind zeitlich schon extrem spät dran ich bitte sie da schon eine frage aus ihrer fraktion gestellt wurde dazu beizutragen dass wir jetzt ein bisschen schneller vorankommen sind sie einverstanden ja sie sind einverstanden dann kommt jetzt als nächste rednerin judith skudelny für die fdp
112,19.04.2018,ID192611200,Judith,Skudelny,FDP,Judith Skudelny,frau präsidentin meine damen und herren der dieselfahrer darf nicht zum bauernopfer der nation werden die eu-grenzwerte wurden auf basis von korrelationsstudien festgelegt ich möchte ihnen einmal zeigen was korrelationsstudien können: wissenschaftler haben festgestellt dass die ehedauer korreliert das heißt zusammenhängt mit dem umfang der bäuche der ehemänner das heißt je länger eine ehe dauert desto größer wird der bauch das heißt aber im umkehrschluss nicht unbedingt dass der ausschlaggebende punkt für den bauch umfang tatsächlich die tatsache der ehe ist vielmehr sind andere tatsachen wie ein veränderter stoffwechsel das alter mangelnder sport und eine andere ernährung grund dafür dass der bauch ein bisschen größer wird genauso wie man bei ehe und bauchumfang nicht eins zu eins rückschlüsse ziehen kann ist auch das stickoxid bei der frage der herz-kreislauf-erkrankungen das geringste der auftretenden risiken nach wie vor sind die größten risiken für herz-kreislauf-erkrankungen in deutschland übergewicht rauchen mangelnder sport und falsche ernährung das sollten wir den menschen da draußen noch einmal sagen aber nicht nur das: wir deutschen sind auch so ein bisschen die messidioten europas während andere vollkommen im rahmen der europäischen gesetzgebung ihre messstationen ein stück weit weg von den straßen teilweise unter palmen aufstellen hat man das gefühl dass die länder und städte in deutschland bemüht sind höchstergebnisse zu messen ich sage es einmal mit dieter nuhr der gesagt hat: das ist so wie wenn man versucht den körpergeruch eines menschen an seinem hintern zu messen das ist die gemengelage von superstrengen grenzwerten der eu und radikalen messmethoden in deutschland genau in dieser gemengelage drohen die deutschen dieselfahrer zum opfer der politik zu werden eines möchte ich sagen: nachhaltig ist das nicht nachhaltig ist ein ausgewogenes maß von ökologisch ökonomisch und sozial schauen wir einmal was ein fahrverbot für dieselfahrzeuge bewirken würde: damit würden die wirtschaftlichen und sozialen belange derer die kalt enteignet werden derer die familie und beruf vereinbaren wollen derer die im handwerk und mittelstand wirtschaften möchten dem geringen ökologischen nutzen einer leichten senkung geopfert werden in deutschland müssen wir drei dinge noch viel entschlossener angehen erstens die messstellen müssen wir bundeseinheitlich weil auch die bundesbürger die konsequenzen tragen innerhalb des europäischen rechtsrahmens aber unter ausnutzung der toleranzen aufstellen wir müssen zweitens bezüglich des vertragsverletzungsverfahrens mit der eu im gespräch bleiben wir müssen zeigen dass wir durchaus noch nachhaltige maßnahmen haben die wir anwenden können und müssen um die grenzwerte einzuhalten wir müssen zeigen dass wir nach den erfolgen die wir bereits erzielt haben die luft in deutschland ist so gut wie seit jahren nicht nur noch etwas mehr zeit brauchen um die grenzwerte einzuhalten drittens das unterscheidet uns : auch bei der luftreinhaltung ist stillstand ein rückschritt natürlich wollen wir besser werden es gibt eine maßnahme mit der wir ganz einfach den gesellschaftlichen belangen und den ökologischen belangen rechnung tragen können: wir müssen unsere fahrzeuge zum fahren bringen und wir müssen den verkehr zum fließen bringen dann sind die geringsten schadstoffausstöße vorhanden umgehungsstraßen bessere infrastruktur digitalisierte verkehrslenkung und ein attraktiver öpnv: so betreibt man nachhaltigen luftschutz vielen dank frau kollegin skudelny nächste rednerin: ulli nissen für die spd-fraktion
113,19.04.2018,ID192611300,Ulli,Nissen,SPD,Ulli Nissen,liebe frau präsidentin liebe kolleginnen und kollegen mich erstaunt der antrag der afd nicht die afd bestreitet bekanntlich auch den klimawandel sie nimmt anscheinend auch den gesundheitsschutz der bevölkerung nicht besonders ernst da fällt mir ein spruch von otto waalkes ein: rauchen ist nicht gesundheitsschädlich sagt dr marlboro dazu passt dass es bei der afd einen kollegen gibt der langjährig bei daimler beschäftigt war und die gesundheitsgefährdung durch stickoxide kleinredet die bundes-immissionsschutzverordnung sieht aus gründen des gesundheitsschutzes vor dass der jahresmittelgrenzwert von mikrogramm für stickstoffdioxid nicht überschritten werden darf auch in meinem frankfurter wahlkreis sind an diversen messstellen überschreitungen aufgetreten hauptursächlich für die überschreitung ist in deutschland der verkehr und hier insbesondere der diesel schädlich im diesel abgas ist vor allem das stickstoffdioxid der mensch reagiert auf eine höhere konzentration mit husten und halsschmerzen später kommen schwindel übelkeit und kopfschmerzen hinzu im schlimmsten fall führt das zu einem lungenödem zu atem- oder herz-kreislauf-versagen oder auch zu asthma ich erinnere mich an unsere debatte zu den abgastests an affen nach meinung der experten standen diese angeblich im zusammenhang mit einer veröffentlichung der who die dieselabgase als krebserregend eingestuft hatte da wollte die automobilindustrie wohl eine eigene studie die etwas anderes beweist aber dummerweise entsprachen die ergebnisse nicht den vorstellungen von vw denn auch bei den modernen dieselfahrzeugen stellten die forscher kritische effekte fest als sie den affen später blut abnahmen und lungenabstriche bei ihnen machten es kam zu erhöhten entzündungswerten und reizungen zufälligerweise wurden die untersuchungsergebnisse dann nicht veröffentlicht bereits haben sich alle beteiligten auf das sofortprogramm saubere luft verständigt dafür stehen milliarde euro zur verfügung millionen euro kommen allein vom bund das sofortprogramm umfasst folgende maßnahmen: die elektrifizierung des wirtschaftsverkehrs die elektrifizierung von taxis mietwagen und carsharingfahrzeugen die elektrifizierung von busflotten im öpnv die förderung der ladeinfrastruktur die nachrüstung von dieselbussen im öpnv mit abgasnachbehandlung und die digitalisierung kommunaler verkehrssysteme es gibt schon gute umsetzungsüberlegungen mein heimischer verkehrsverbund der rmv will zum beispiel auf strecken der taunusbahn brennstoffzellenfahrzeuge einsetzen in meinem frankfurter wahlkreis wird darüber nachgedacht abwrackprämien für alte mopeds bei gleichzeitiger neuanschaffung von elektrozweirädern zu zahlen da tut man nicht nur etwas für bessere luft sondern auch für weniger lärm diesen unterschied merke ich wenn ich mit meinem elektroroller mit ihm bin ich seit neun jahren unterwegs neben einem alten mopedstinker stehe der lieferverkehr nimmt immer mehr zu eine gute lösung wären mikrodepots diese können drei paketfahrzeuge ersetzen die stadt gent in belgien hat für den lieferverkehr tolle konzepte entwickelt paketfahrzeuge die unterwegs sind sollen nur noch elektrische transporter sein dhl geht mit seinem streetscooter positiv voran es gibt bei diesen modellen sogar tests den feinstaub von den reifen direkt aufzufangen das finde ich wirklich hervorragend auch die e-mobilität im güterverkehr muss angegangen werden bei mir in frankfurt wird jetzt auf der a eine teststrecke für lastwagen gebaut ab sollen dort trucks an oberleitungen fahren es gibt daneben überlegungen e-lkws von der maut zu befreien darüber sollten wir diskutieren die klimaziele müssen auch in der seeschifffahrt engagierter angegangen werden die dringende hardwarenachrüstung für dreckige dieselfahrzeuge ist heute abend ja noch einmal ein extrathema aus meiner sicht ist es vollkommen klar dass wir zum schutz der gesundheit unserer bevölkerung weitere aktivitäten ergreifen müssen um die luftreinhaltung in deutschland zu verbessern lassen sie uns daran gemeinsam arbeiten ich danke ihnen vielen dank kollegin ulli nissen nächster redner: ralph lenkert für die fraktion die linke
114,19.04.2018,ID192611400,Ralph,Lenkert,DIE LINKE,Ralph Lenkert,sehr geehrte frau präsidentin geehrte kolleginnen und kollegen alle diskutieren über den dieselskandal es drohen fahrverbote und da hört der spaß auf die debatte zu den anträgen von afd und fdp gibt mir die chance für etwas mehr klarheit zu sorgen als maschinenbautechniker eines automobilzulieferers bin ich es gewohnt parameter und ihre wirkung auf prozesse im einzelnen und in zusammenhängen zu beleuchten und zu analysieren liebe zuhörerinnen und zuhörer jetzt wird es leider technisch in der natur ist ein stickoxidgehalt von bis zu mikrogramm je kubikmeter üblich in der eu gilt ein grenzwert von mikrogramm je kubikmeter er entspricht der empfehlung der weltgesundheitsorganisation und das stundenmittel also der durchschnittliche wert in einer stunde soll mikrogramm nicht überschreiten wieso ist bei arbeitsplätzen ein grenzwert von mikrogramm zulässig ist das gute lobbyarbeit oder sind das andere betrachtungsweisen es sind zugeständnisse an die industrie weil manche prozesse anders einfach nicht finanzierbar oder durchführbar sind und man handelt mit gesunden beschäftigten diese haben zwei möglichkeiten: sie halten das entweder aus oder sie wechseln den job in kammerversuchen mit menschen hat man festgestellt dass stickoxidbelastungen von über mikrogramm je kubikmeter schon nach minuten zu reaktionen in der lunge führten menschen mit asthma kinder senioren und kranke sind empfindlicher als ein junger kerngesunder mann deswegen müssen die grenzwerte deutlich niedriger sein grenzwerte sollen alle schützen herr kollege lenkert in tierversuchen wurde festgestellt dass sich die no x -auswirkung also die stickoxidauswirkung im körper addiert ähnlich wie bei quecksilber wenn sie jeden tag eine winzige quecksilbermenge zu sich nehmen passiert akut nichts irgendwann ist aber die grenze in ihrem körper überschritten und dann leiden sie an einer quecksilbervergiftung die schleichend ihre gesundheit vernichtet herr lenkert erlauben sie damit das ganz klar ist: ich lasse nur eine zu eine zwischenfrage oder -bemerkung von einem cdu/csu-kollegen das muss nicht sein kollege möring herr kollege lenkert vielen dank dass sie die zwischenfrage zulassen ich mache es auch ganz kurz zu der betrachtung der grenzwerte bei der industrie und ihrer argumentation dazu: würden sie auch vor dem hintergrund dass im bürobereich mikrogramm pro kubikmeter als grenzwert gelten während es im verkehrsbereich mikrogramm pro kubikmeter sind so argumentieren es gibt einen unterschied zwischen der büroarbeitszeit und der gesamtzeit des täglichen lebens wir reden hier über das jahresmittel von mikrogramm pro kubikmeter selbst ich halte mich mit arbeitsstunden in der woche nicht stunden im jahr in meinem büro auf das heißt also im klartext: es ist eine summenwirkung und es liegt durchaus im interesse der arbeitgeber einen etwas höheren grenzwert anzusetzen bei gesunden menschen passiert zwar nicht sofort etwas aber das heißt doch nicht dass ich im jahresmittel auch in meiner freizeit unbedingt denselben belastungen ausgesetzt sein muss das ist ein kompromiss um das mögliche mit dem machbaren zu verbinden ich zitiere an dieser stelle den ersten und einzigen ddr-umweltminister der sagte: grenzwerte sind der kompromiss zwischen dem was wir bereit sind an gesundheitsschäden in kauf zu nehmen und dem was unsere bequemlichkeit oder wirtschaft erfordert da kann ich ihnen ein einfaches beispiel nennen: wie viele menschen sind bereit für die einführung eines tempolimits zu stimmen obwohl sie wissen dass mit einem tempolimit viele menschen gesundheit und leben behalten würden liebe kolleginnen und kollegen die weltgesundheitsorganisation berichtete von einem unfall an einer gasheizung kinder atmeten über zwei wochen mikrogramm je kubikmeter stickoxide ein die atemwegserkrankungen stiegen um prozent wenn man das weiß sind selbst mikrogramm zu hoch sich in europa einfach auf amerikanische grenzwerte zu berufen zeugt davon dass man den unterschied zwischen den schutzsystemen in amerika und in europa nicht kennt in amerika gibt es nur dann strenge grenzwerte wenn eindeutig nachgewiesen ist: es ist schädlich aber wenn vw oder jemand anderes schäden verursacht und es wird nachgewiesen dass sie schuld haben dann wird es richtig teuer in europa ist das anders in europa herrscht das vorsorgeprinzip das bedeutet: wenn schäden auftreten könnten müssen sie nachweisen dass dies nicht passiert ansonsten bekommen sie keine zulassung treten trotzdem schäden auf müssen sie so gut wie gar nicht haften wenn hier also jemand fordert amerikanische grenzwerte und amerikanische regelungen zur zulassung ohne die amerikanischen haftungsregeln einzuführen handelt er grob verantwortungslos und gefährdet die gesundheit unserer bevölkerung unserer menschen die linke steht für das vorsorgeprinzip das lassen wir nicht aufweichen sehr geehrte kolleginnen und kollegen ich weiß nicht wie vielen von ihnen bewusst ist dass stickoxide zu ozon führen ozon entsteht aus stickoxiden für den herrn techniker oder ingenieur einmal die formel zur erinnerung: no plus o plus uv-licht ergibt stickstoffmonoxid plus ozon so lange wie energie zugeführt wird bei sonnenschein und stickoxidkonzentration entsteht also ozon wollen sie jetzt wetterabhängige grenzwerte einführen dass also der daimler bei sonnenschein nicht fahren darf oder muss vw eine wetterprognose berücksichtigen bevor menschen mit ihren autos losfahren dürfen mal ehrlich: so etwas können wir uns sparen es ist vielen kranken menschen egal ob ihr asthma durch die stickoxide oder durch das ozon das durch stickoxide entsteht ausgelöst wird demzufolge sind grenzwerte zwingend einzuhalten technisch ist dies erreichbar unsere kinder und unsere gesundheit werden es uns danken vielen dank vielen dank ralph lenkert nächste rednerin: dr bettina hoffmann für bündnis /die grünen
