,datum,redeID,vorname,nachname,fraktion,name,inhalt_neu
82,24.03.2022,ID202508200,Peter,Felser,AfD,Peter Felser,"sehr geehrte frau präsidentin! sehr geehrter herr minister! liebe kollegen! liebe landwirte draußen in den betrieben! wie oft wurde in dieser woche das wort zeitenwende bemüht? russische panzer haben zu einer ‑grad-wende in der verteidigungspolitik geführt. schauen wir mal rein in den einzelplan , ob dort eine wende zu erkennen ist! eine kleine miniwende haben wir bei der digitalisierung. erstmals bekommen wir ein budget für die künstliche intelligenz; das begrüßen wir. das ist richtig, das ist zukunftsweisend, wenngleich es nur ein bescheidender anfang ist, wenn man die ausgaben für ki mal mit denen von china und den usa vergleicht. aber immerhin! wir begrüßen auch, dass sie in den bereich ausgewogene ernährung investieren, in bildung und aufklärung. das ist in zeiten von adipositas und von herz-kreislauf-erkrankungen gut. da ist das geld gut und richtig investiert. jetzt aber zu dem, was an diesem haushalt, einzelplan , vor allem auffällt. in welchem bunker, in welcher blase, in welchem elfenbeinturm, herr minister, haben sie das hier eigentlich zusammengeschrieben? das ist ja null komma null an die aktuelle lage angepasst. wo finden sich in diesem plan bitte die auswirkungen der coronakrise, wo die derzeitige schwere inflation, wo die düngerkrise? wo finden sich die maßnahmen hinsichtlich der auswirkungen des völkerrechtswidrigen angriffs russlands auf die ukraine? davon findet sich fast gar nichts in ihrem entwurf. sie ignorieren all diese krisen und arbeiten einfach weiter nach ideologischer tagesordnung, so als ob nichts passiert wäre. das ist grundlegend falsch, und das lehnen wir ab. sie haben es gerade selber gesagt: die landwirtschaft steht mit dem rücken an der wand. wachsen oder weichen diese parole hat uns sehr viel schaden zugefügt. jedes jahr schließen tausende höfe in deutschland, und die bäuerlichen familien verlieren ihre existenz. mit den explodierenden energiekosten, betriebsmittelkosten und düngerkosten wird das höfesterben weitergehen. mit diesem haushalt werden am ende des jahres wieder tausende höfe ihre hoftore für immer schließen müssen. das lehnen wir ab. beenden sie endlich das höfesterben! aber, liebe kollegen, es geht und ginge ja definitiv anders. frankreich hat kurzfristig ein hilfspaket über millionen euro aufgestellt. damit werden die finanziellen folgen des ukrainekriegs für die französischen landwirte abgemildert. das sind rein steuerliche erleichterungen. so geht hilfe für die landwirtschaft. österreich, dänemark und polen handeln ähnlich. und sogar die eu-kommission plant jetzt noch ein zusätzliches unterstützungspaket von millionen euro und die freigabe der krisenreserve; sie haben es gerade gesagt, herr minister. warum machen sie in deutschland nicht von der möglichkeit gebrauch, den landwirten national zu helfen? uns verwundert, dass die bundesregierung nur so spärliche entlastungen für die heimische landwirtschaft vorgesehen hat. umfangreichere entlastungen wären aber dringend erforderlich. es kommt ja noch dazu, dass sie die bundeszuschüsse zur landwirtschaftlichen unfallversicherung jetzt um millionen euro gekürzt haben. wo soll das hinführen? aber noch mal zur aktuellen lage. wir haben krieg in europa, krieg in unmittelbarer nachbarschaft. und da halten sie es nicht für geboten, herr minister, die nationalen getreidereserven für krisenzeiten aufzustocken? jahrelang wurde hier gespart. große teile der bestände sind überlagert und liegen schon länger als zehn jahre; sie sind gar nicht mehr nutzbar. so ein zustand ist nicht hinnehmbar. das, liebe kollegen, ist das gegenteil von krisenvorsorge. krisenvorsorge hieße jetzt aber auch, dass wir auf allen landwirtschaftlichen flächen lebensmittel anbauen dürften. setzen sie bitte jetzt, in dieser situation, die ohnehin falschen vorgaben aus! ja, richtig: die ökologischen vorrangflächen müssen jetzt bewirtschaftet werden, aber nicht nur dieses jahr, sondern bitte auch in den nächsten jahren. die instrumente dazu gibt uns brüssel ja auch an die hand, und die anderen länder machen das genauso. unsere landwirte dürfen hier nicht weiter eingeschränkt werden. sie sprechen von der -prozent-zwangsbrache. die ist nächstes jahr ausgesetzt; sie muss aber für immer verhindert werden. denn wenn das kommt das sage ich ihnen , können sie diesen irrsinn keinem mehr erklären. prozent zwangsbrache: das entspricht , millionen hektar in der europäischen union. und diese aus ideologischen gründen einfach stillzulegen, wäre der absolute wahnsinn. das könnten sie keinem mehr erklären. nur zum vergleich: auf diesen flächen könnten über millionen tonnen weizen angebaut werden. marokko, ägypten, tunesien, algerien, äthiopien: diese länder benötigen zusammen knapp tonnen weizen pro jahr. da sehen sie, wohin das führt. liebe kollegen, in afrika verhungern menschen; bei uns steigen die preise in den himmel. in dieser lage weiter an ihrer ideologie festzuhalten, wäre völlig unverantwortlich. am montag haben die ersten bauern bereits angekündigt: sie werden diesen irrsinn durchbrechen, sie werden für die hungernden menschen weizen anbauen und dann eben illegal anbauen. das haben die landwirte angekündigt. so weit sind wir schon. kommen sie endlich in der wirklichkeit an! kanzler scholz vollzieht seine -grad-wende in der verteidigungspolitik; im wirtschaftsministerium darf man wieder etwas lauter über laufzeitverlängerungen für die kernkraft nachdenken. leiten sie jetzt bitte im ministerium eine agrarwende ein eine agrarwende, die unsere bauern schützt und die sicherstellt, dass für unsere bürger jederzeit gute und gesunde lebensmittel zur verfügung stehen. das wäre und das ist das gebot der stunde. vielen dank. es folgt der kollege frank schäffler für die fdp-fraktion."
83,24.03.2022,ID202508300,Frank,Schäffler,FDP,Frank Schäffler,"frau präsidentin! meine lieben kolleginnen und kollegen! es wird dieser tage viel von einer zeitenwende gesprochen, insbesondere in der außen- und sicherheitspolitik. aber ich glaube, auch in der landwirtschaftspolitik stehen wir vor einer zeitenwende. das umdenken ist erforderlich, weil wir den fokus stärker auch bei der ernährungssicherheit als wichtigem standortfaktor für deutschland und für europa sehen müssen. ich glaube, dass man das am besten dadurch erreicht, dass man die landwirte, die bäuerinnen und bauern in deutschland, als unternehmer respektiert und die voraussetzungen dafür schafft, dass sie mit ihrer hände arbeit auch tatsächlich wirtschaftlich erfolgreich sein können. dafür wollen wir die voraussetzungen schaffen. wir wollen eben nicht mit der gießkanne, wie es die vorgängerregierung mit der bauernmilliarde gemacht hat, einfach geld unter die menschen streuen, sondern es müssen die richtigen rahmenbedingungen gesetzt werden, damit die landwirte auch tatsächlich eine zukunft haben. derzeit sind die landwirte vor ganz schwierige voraussetzungen gestellt. die vorgängerregierung hat durch gesetzliche rahmenbedingungen immer wieder unsicherheit geschaffen; es gab keine planungssicherheit für die landwirte. darunter haben sehr viele betriebe gelitten. jetzt sind die schweinepreise und die weizenpreise zwar wieder angestiegen; aber gleichzeitig stellen wir fest, dass die preise für dünger, diesel und erdgas noch stärker ansteigen und deshalb die landwirte in ihrer situation nicht wirklich bessere voraussetzungen haben. darauf hat die koalition heute reagiert. wir haben heute verkündet, dass wir die energiesteuer auf europäisches mindestmaß reduzieren wollen. das hat auswirkungen auf den dieselpreis, das hat auch auswirkungen auf den ölpreis. das heißt, das sind ernste und konkrete maßnahmen, von denen wir glauben, dass wir mit ihnen auch den landwirten in ihrer situation durchaus helfen können. auch die energiepauschale von euro hilft den landwirten. auch der familienzuschuss für die kinder hilft den landwirtschaftlichen familien. ich glaube also, da haben wir heute etwas vorgelegt, das man durchaus vorzeigen kann. im einzelplan haben wir die mittel für die eiweißpflanzenproduktionsstrategie auf , millionen euro erhöht. die mittel für die digitalisierung in der landwirtschaft werden auf , millionen euro erhöht. und wir haben die förderung des präventiven hochwasserschutzes auf millionen euro erhöht. aber: umweltschutz muss mit augenmaß stattfinden. er darf den landwirten nicht die wirtschaftliche grundlage entziehen. hier ist es notwendig, finde ich, dass die geplante ‑prozentige flächenreduktion durch die gap-reform, die reform der gemeinsamen agrarpolitik, in dieser schwierigen situation noch mal überprüft wird. für deutschland würde das bedeuten, dass hektar künftig nicht mehr bewirtschaftet werden. rechnerisch könnten dort millionen tonnen weizen produziert werden. der verein land schafft verbindung hat jetzt in meiner heimatregion petershagen im kreis minden-lübbecke dazu eine bemerkenswerte aktion gestartet, wo er auf einem feld entsprechend diese prozent als verzweiflungsakt eingezeichnet hat, um deutlich zu machen, dass die bäuerinnen und bauern lebensmittel produzieren, die auch weltweit gebraucht werden, um die ernährungssicherheit der menschheit zu sichern. wir müssen insgesamt landwirte als unternehmer verstehen und entsprechend eingriffe ins eigentum der landwirte vermeiden. wenn wir das tun, dann muss der staat auch dafür geradestehen und finanzielle mittel bereitstellen. wenn jetzt die eu den krisenreservefonds, wie es der minister vorhin auch gesagt hat, entsprechend aktiviert, dann muss auch klar sein, dass man historische fehler nicht noch einmal macht. ich glaube, wenn der staat lagerkosten für schweinefleisch und für andere produkte letztendlich finanziert, dann ist das der falsche weg. diese produkte müssen auf den markt; sonst erleben wir wie im letzten jahrhundert milchseen und butterberge. ich glaube, das wäre der falsche weg. dann muss man am ende wieder langwierig darauf setzen, die marktmechanismen in gang zu setzen. das wäre aus meiner sicht der völlig falsche weg. was unsere landwirte jetzt brauchen, sind verlässlichkeit, wertschätzung und vor allem ein moratorium an vorschriften. daran wollen wir als fdp und in der koalition arbeiten. vielen dank. vielen dank. für die fraktion die linke erhält das wort dr. gesine lötzsch."
84,24.03.2022,ID202508400,Gesine,Lötzsch,DIE LINKE,Gesine Lötzsch,"vielen dank, frau präsidentin. meine sehr geehrten damen und herren! der weizenpreis geht durch die decke. kostete eine tonne weizen anfang februar euro, sind es in dieser woche bereits euro. hungersnöte bedrohen millionen von menschen. und was tut die bundesregierung effektiv gegen diese not, herr minister? diese frage haben sie nicht beantwortet. sie wollen sich im rahmen der deutschen g‑ -präsidentschaft dafür einsetzen, dass die märkte offenbleiben und der globale handel funktioniert. doch wie wollen sie das machen? wo ist im bundeshaushalt das geld eingestellt, um die weizenpreise zu drücken? wir haben es nicht gefunden, meine damen und herren. marktgläubigkeit hilft nicht weiter. der amazon-kapitalismus heute bestellt und morgen geliefert ist nicht nur hochriskant, sondern lebensgefährlich, und vorsorge darf für diese bundesregierung kein fremdwort sein. da bin ich schon bei den ökologischen vorrangflächen; vorhin wurden brachen genannt. ich fand es wichtig und richtig, dass diese flächen gesichert wurden, und nun wollen sie einen teil dieser flächen für die futterproduktion freigeben. ich frage sie: wäre es nicht viel sinnvoller, ein -milliarden-euro-sondervermögen ackerland in das grundgesetz zu schreiben? das wäre gut für unsere ernährungssicherheit. in den vergangenen jahren haben sich die preise für ackerland verdreifacht. gerade in ostdeutschland haben investoren franz müntefering von der spd nannte sie einst heuschrecken vielen bäuerinnen und bauern das arbeiten unmöglich gemacht. statt ökologische flächen zu bewirtschaften, sollten sie ackerland kaufen und preiswert verpachten. das würde den bäuerinnen und bauern helfen und die ernährung langfristig sichern. wir brauchen einen preisdeckel für ackerland. besser wäre es noch, wenn grund und boden gemeineigentum wären. das wäre wirklich nachhaltig, meine damen und herren. für wen, meine damen und herren, ist die lebensmittelversorgung in unserem land wirklich gesichert? der hartz-iv-satz hat schon vor der krise nicht zum leben gereicht. mit steigenden preisen für energie und lebensmittel wird es für viele menschen eng und bedrohlich. sie müssen für einen inflationsausgleich sorgen und sofort den hartz-iv-satz und die minirenten anheben. das wäre der richtige weg. meine damen und herren, ich bin mir sicher: ein sondervermögen ackerland würde uns langfristig mehr sicherheit bringen als ein sondervermögen rheinmetall ja, rheinmetall ; denn es geht nicht um die bundeswehr, sondern um die aktienkurse von rheinmetall. nur kann man aktien leider nicht essen. vielen dank. es folgt der abgeordnete dr. sebastian schäfer für bündnis /die grünen."
85,24.03.2022,ID202508500,Sebastian,Schäfer,BÜNDNIS 90/DIE GRÜNEN,Sebastian Schäfer,"sehr geehrte frau präsidentin! sehr geehrter herr minister! meine sehr verehrten damen und herren! wir führen diese debatte hier, während menschen in der ukraine aufgrund des krieges hungern und keinen zugang zu frischem trinkwasser haben. es geht für diese menschen um existenzielle fragen. das dürfen wir bei allen innenpolitischen debatten nicht vergessen. ich bin cem özdemir sehr dankbar, dass er schnell reagiert und eine koordinierungsstelle für lebensmittelhilfen eingerichtet hat, worüber bereits mehr als tonnen an lebensmittelhilfen in die ukraine geliefert wurden. aber die auswirkungen des krieges beschränken sich nicht nur auf die ukraine. russland und die ukraine werden möglicherweise längerfristig als getreideexporteure ausfallen. die fao, die ernährungs- und landwirtschaftsorganisation der vereinten nationen, rechnet infolge des ukrainekrieges mit einem ‑prozentigen anstieg der weltweiten lebensmittel- und futterpreise. das hätte dramatische folgen gerade für die länder des globalen südens, insbesondere in ostafrika, die von russischen und ukrainischen getreideimporten besonders abhängig sind. daher ist es richtig, dass der landwirtschaftsminister angekündigt hat, sich gemeinsam mit der außenministerin dafür einzusetzen, das world food programme besser auszustatten, um so einer globalen ernährungskrise entgegenzuwirken. unsere lebensmittelversorgung in deutschland ist gesichert. es gibt keinen grund für hamsterkäufe. dennoch spüren unsere landwirtinnen und landwirte, deren lage schon vorher alles andere als einfach war, die auswirkungen dieses schrecklichen krieges. die preise für diesel, aber ganz besonders auch für dünger sind nach oben geschnellt. und dennoch: wir dürfen jetzt nicht den fehler machen, krisen gegeneinander auszuspielen. die klimakrise ist und bleibt eine menschheitsaufgabe. deshalb stellen wir mit diesem haushalt die weichen für eine klimaschonendere landwirtschaft und eine tierwohlorientierte nutztierhaltung. das bedeutet weniger tiere in den ställen, und das ist auch richtig so. der übermäßige konsum von tierischen erzeugnissen ist ein problem für die gesundheit, für die umwelt und für die lebensmittelsicherheit. ab stellen wir milliarde euro als anschubfinanzierung zur verfügung, um den klimafreundlichen und tiergerechten umbau der tierhaltung entscheidend voranzubringen, und wir ermöglichen mit der kennzeichnung der haltungsbedingungen mehr marktwirtschaft. auch hier müssen wir eine jahrelange blockade der union auflösen. die bürgerinnen und bürger können dann mit einer informierten kaufentscheidung die zukunft unserer landwirtschaft mitgestalten. das ist eine gewaltige herausforderung, vor der wir bei der landwirtschaft und bei der ernährung der welt stehen. wir werden das nur gemeinsam schaffen. herzlichen dank. es folgt für die cdu/csu-fraktion die kollegin christina stumpp."
86,24.03.2022,ID202508600,Christina,Stumpp,CDU/CSU,Christina Stumpp,"sehr geehrte frau präsidentin! sehr geehrter herr minister! liebe kolleginnen und kollegen! meine vorrednerinnen und vorredner haben es bereits gesagt, doch ich möchte noch einmal darauf hinweisen, weil man es gar nicht häufig genug sagen kann: sie stocken im haushalt das personalbudget um prozent auf, und die land- und forstwirtschaft hat die abstriche zu verkraften. ich möchte deshalb gerne aufzeigen, wo das geld in ihrem ressort nötiger gebraucht wird als im aufbau eines beamtenapparats. der deutsche wald ist die grüne lunge und wichtiger klimaschützer unseres landes. er bindet rund prozent des jährlichen -ausstoßes. außerdem ist er ein wichtiger wirtschaftsfaktor und sichert viele arbeitsplätze in den ländlichen regionen. seine bedeutung, aber auch seine gefährdung nimmt durch den klimawandel ständig zu. deshalb müssen wir den wald der zukunft jetzt gemeinsam gestalten. um die wälder klimaresistenter aufzuforsten, sind im vorliegenden haushalt für den zeitraum bis nun millionen euro vorgesehen. das sind millionen euro pro jahr. zwar ist eine grundsätzliche unterstützung für den umbau unserer wälder begrüßenswert, aber dazu wird das geld bei weitem nicht reichen. das thünen-institut geht davon aus, dass dafür in den kommenden jahren insgesamt milliarden euro notwendig sein werden, eher sogar milliarden euro, weil dürre, stürme und borkenkäferplagen von jahr zu jahr zunehmen werden. bricht man den betrag auf die jahre herunter, bedeutet das, dass wir für den waldumbau zwischen millionen und , milliarden euro pro jahr veranschlagen müssen. millionen euro sind da viel zu knapp bemessen und somit ein tropfen auf den heißen stein. die frage, wie die honorierung von ökosystemleistungen für eine nachhaltige waldbewirtschaftung pragmatisch erfolgen soll, ist noch offen. aber eines ist gewiss: auch dafür werden wir öffentliche gelder bereitstellen müssen; das hat selbst die eu mit ihrer waldstrategie festgehalten. aber wir brauchen nicht nur gelder für den waldumbau, sondern auch für den bereich der tierhaltung. wenn wir den gesellschaftlichen forderungen, mehr für das tierwohl zu tun, nachkommen wollen, werden dafür finanzielle fördermittel notwendig sein; denn ohne zusätzliche gelder kann auch dieser umbau nicht gelingen. die bundesregierung will eine verbesserte tierhaltung erreichen, indem sie sich für eine verpflichtende herkunftskennzeichnung und eine eu-weit einheitliche regelung einsetzt. die eu will diese option für weitere bestimmte lebensmittel prüfen und gegebenenfalls bis zum vierten quartal einen vorschlag vorlegen. aber vom warten werden keine ställe umgebaut, und es wird auch nicht mehr tierwohl erzeugt. frankreich hat es im rahmen eines modellprojektes vorgemacht: ab dem . märz dieses jahres müssen dort restaurants und kantinen die herkunft des angebotenen schweine-, geflügel- und lammfleischs angeben. wir brauchen in deutschland deshalb eine kombination aus tierhaltungs- und herkunftskennzeichnung wie die ‑d-kennzeichnung, die garantiert, dass das jeweilige tier in deutschland geboren, aufgezogen, gemästet, geschlachtet und verarbeitet wurde, und zwar so schnell wie möglich. das gibt unseren verbraucherinnen und verbrauchern die notwendige gewissheit und sichert das tierwohl. unsere landwirtinnen und landwirte brauchen dafür rechtssicherheit beim baurecht und beim immissionsschutz, aber sie brauchen auch fördergelder; denn mehr tierwohl wird sich nicht nur durch den ladenpreis finanzieren lassen. die borchert-kommission hat hierzu vorschläge für die finanzierung gemacht, beispielsweise über eine höhere mehrwertsteuer für alle fleischprodukte. die konzepte liegen auf dem tisch. setzen sie sie bitte um! nicht nur die borchert-kommission hat bereits hervorragende arbeit geleistet; auch die zukunftskommission landwirtschaft, kurz: zkl, hat ausgezeichnete vorschläge ausgearbeitet, damit unsere heimische landwirtschaft auch weiterhin ein starker und wertvoller bestandteil in unserem land bleiben kann. dafür, so die zkl, brauche es wertschätzung, wertschöpfung, die steigerung des klima- und umweltschutzes und der biodiversität sowie wirtschaftliche tragfähigkeit und planungssicherheit für die landwirtschaft, insbesondere für unsere junglandwirtinnen und junglandwirte. die empfehlungen dafür wurden im spannungsfeld von agrar-, umwelt- und gesellschaftspolitik gemeinsam errungen. deshalb sollten die kompromisse der zkl unbedingt in die arbeit der regierung mit einbezogen werden. der wandel unserer landwirtschaft ist eine gesamtgesellschaftliche aufgabe. ökologisches handeln muss in ökonomischen erfolg umgesetzt und finanziell angemessen unterstützt werden. die zkl hat gezeigt, wie sinnvoll runde tische sind. sehr geehrter herr minister, ich möchte zum abschluss noch einen appell an sie richten: berufen sie jetzt einen lebensmittelgipfel ein! die auswirkungen des schrecklichen krieges in der ukraine zeigen uns, wie fragil der markt auch hier in deutschland ist. sie zeigen uns, dass alle voneinander abhängig sind und wir gerade in solch einer schwierigen situation wie dieser oftmals zu wenig verständnis für die nöte der anderen haben. deshalb brauchen wir jetzt unter einbeziehung der politik einen runden tisch kommen sie bitte zum schluss. mit den vertretern der gesamten wertschöpfungskette: vom acker über die ladentheke bis hin zum verbraucher. frau kollegin, sie müssen jetzt zum schluss kommen. denn wie sagte der agrarwissenschaftler und friedensnobelpreisträger norman borlaug: mit leeren mägen und menschlichem elend kann man keine friedliche welt aufbauen. danke. ein zitat von einem nobelpreisträger geht noch; aber achten sie bitte ein wenig auf ihre redezeiten. als nächste rednerin erhält das wort für die spd-fraktion peggy schierenbeck."
