,datum,redeID,vorname,nachname,fraktion,name,inhalt_neu
0,,,,,, ,
1,09.12.2021,ID20600100,Otto,Fricke,FDP,Otto Fricke,"geschätzte frau präsidentin! auch wenn ich jetzt denke: warum gehen die alle, wenn ich mit der rede anfange? , möchte ich als allererstes hervorheben, dass wir jetzt hier einen gesetzentwurf vorliegen haben, den ich gemeinsam mit den kollegen sven-christian kindler und dennis rohde vorbereiten durfte, und ich will damit zeigen, wie diese neue ampelkoalition auch schon gearbeitet hat, als der bundeskanzler noch gar nicht gewählt war. ich möchte ausdrücklich darauf hinweisen: wir haben in den nächsten monaten neben all den aufgaben, die der koalitionsvertrag an uns heranträgt, ganz wesentliche überlegungen zu treffen: wie stabilisieren wir unsere wirtschaft? wie stabilisieren wir unsere sozialsysteme? wie stabilisieren wir insbesondere die betroffenen unternehmen in der nächsten zeit, in der phase, in der wir noch nicht genau wissen, wie es mit corona weitergeht? dementsprechend legt ihnen die koalition einen gesetzentwurf vor, der als eines der elemente neben der frage kurzarbeit und überbrückung ganz essenziell für deutsche unternehmen ist. er umfasst änderungen, die sich auf das stabilisierungsfondsgesetz und wir sehen es ja sehr schön an der anzeigetafel das wirtschaftsstabilisierungsbeschleunigungsgesetz beziehen. bei beiden gesetzen geht es letztlich darum, wie wir größeren, aber auch mittelständischen unternehmen helfen, wenn sie in liquiditätsschwierigkeiten kommen. eigentlich sollten diese gesetze zum ende des jahres auslaufen. das hätte bedeutet, es hätten keine weiteren anträge mehr bearbeitet werden können. das hätte bedeutet, es hätten weitere hilfen, trotz der notwendigkeiten, die uns corona aufzwingt, nicht mehr so erfolgen können, wie es nötig wäre. wir als koalition sind zu dem ergebnis gekommen ich danke da den kollegen : ja, wir verlängern; aber wir verlängern nicht ad infinitum, sondern wir sagen ganz klar, dass wir aus dieser situation irgendwann auch rauskommen müssen. der gesetzentwurf sieht vor, dass wir zum ende des monats juni die möglichen hilfen aus diesem fonds beenden werden. das bedeutet: ab dann wird es keine neuen beschlüsse mehr geben. gleichzeitig beheben wir aber auch einen konstruktionsfehler des alten gesetzes, nämlich dass die antragsfristen quasi noch bis zum ende des gesetzentwurfes gelten. das gibt allen beteiligten unternehmen, seien sie klein, seien sie mittel, seien sie groß ich nenne hier nur das beispiel lufthansa , die möglichkeit, hilfen vom staat dann zu bekommen, wenn sie in ihrer liquidität gefährdet sind. zweitens und das ist ganz wichtig machen wir aber auch etwas, was für meine fraktion von ganz besonderer bedeutung ist das ist auch ein signal an die kapitalmärkte : wir haben durch die bisherige form der durch die große koalition eingebrachten gesetze ein volumen von achtung! milliarden euro gehabt, die bereitgestellt wurden. diese milliarden euro waren ein sicherheitspuffer; ich billige der alten regierung auch durchaus zu, dass dieser richtig war. aber er war zu hoch, weil das möchte ich deutlich sagen es erkennbar nicht notwendig war, so viel zu helfen. es wurden etwa im bereich der unternehmenshilfen von den bis zu milliarden euro, die wir angeboten haben, maximal milliarden euro genutzt. das reduzieren wir jetzt. wir brauchen diese milliarden euro nicht. stattdessen geben wir dem kapitalmarkt, geben wir denjenigen, die deutschland auch in zukunft hilfen am kapitalmarkt geben werden, denen, die unsere bonds zeichnen werden, ein deutliches signal und reduzieren den betrag von milliarden auf milliarden euro. und bevor jetzt hier kritik kommt: das ist immer noch das zehnfache dessen, was bisher in anspruch genommen wurde. es ist damit ausreichend. bei den ausgestellten garantien gehen wir von milliarden euro zurück auf milliarden euro, weil diese garantien bisher nicht genutzt wurden. auch das ist ein zeichen, das wichtig ist. ich will dabei zum schluss meiner rede den zusammenhang mit dem, was auch in der nächsten woche noch auf uns zukommt, deutlich hervorheben. da geht es um die frage, wie wir im haushalt insgesamt stehen. weil die wirtschaftliche entwicklung so ist, wie sie ist, weil wir auch beim thema nachhaltigkeit das sage ich jetzt besonders in richtung meiner neuen freunde von den grünen einen erheblichen umbau unserer industrie brauchen, werden wir sehr viele haushaltsmittel benötigen. dafür muss der bundeshaushalt die entsprechenden volumina haben. deswegen, glaube ich, zeigen wir mit diesem gesetzentwurf auch sehr deutlich, dass die flexibilität des haushalts gegeben ist und ausreichend mittel zur verfügung stehen. meine damen und herren, zum schluss: heute reden wir darüber, wie wir helfen, wie wir stabilisieren. aber wir müssen auch ganz klar erkennen: wir werden bei maßnahmen und das sage ich in richtung arbeits- und sozialministerium, aber auch in richtung wirtschaftsministerium sehr genau gucken, wie wir in den nächsten monaten aus der situation corona herausgleiten; denn wir können diese hilfssysteme nicht dauerhaft anbieten. wir müssen aus einer stagnation herauskommen. deswegen schließe ich auch für den kollegen rohde weil ich nicht immer shakespeare oder goethe zitieren will mit herrn willy brandt, aus der regierungserklärung : unser ziel lautet: stabilisierung ohne stagnation . herzlichen dank."
2,09.12.2021,ID20600200,Andreas,Jung,CDU/CSU,Andreas Jung,"nächster redner: für die cdu/csu-fraktion andreas jung. frau präsidentin! liebe kolleginnen und kollegen! als union stehen wir kritisch in opposition zu dieser regierung, aber wir arbeiten für die menschen in unserem land. deshalb werden wir vorlagen nicht daran bemessen, wo sie herkommen, sondern daran, was drinsteht. deshalb will ich kollege fricke sagen, dass ich die überlegungen, die sie eben vorgetragen haben, im grundsatz nachvollziehen kann. das ist auch die haltung meiner fraktion. wir sind der meinung, dass es richtig ist, über eine verlängerung der fristen, wie sie es dargestellt haben, zu sprechen nicht dauerhaft, aber solange die krise geht. ebenso wir halten es für richtig, den garantierahmen zu senken. für uns gilt ein versprechen: in dieser situation, in der unser land hart von der pandemie getroffen ist, in der auch die wirtschaftliche tätigkeit hart getroffen ist, in der unternehmen in ihrer existenz gefährdet sind und in der es um arbeitsplätze geht, werden wir alles tun, um diese arbeitsplätze zu sichern. dieses versprechen gilt auch in der opposition. deshalb werden wir die diskussion über dieses gesetz in konstruktivem geist führen. aber es gilt auch ein anderes versprechen wir haben es hier im deutschen bundestag abgegeben : wenn wir jetzt so getroffen sind, dass wir von der ausnahmeregelung zur schuldenbremse gebrauch machen und viele milliarden euro schulden aufnehmen müssen, um in dieser situation zu stabilisieren, dann werden wir diese schulden in unserer generation zurückbezahlen. das haben wir hier im deutschen bundestag gemeinsam beschlossen. ich fordere den bundeskanzler auf, das versprechen, das er als bundesfinanzminister gegeben hat, nicht zu brechen. das haben sie aber in ihrem koalitionsvertrag vor. sie wollen die schulden nicht in den nächsten jahren zurückbezahlen; sie wollen das jetzt um jahre in die zukunft verschieben. das entspricht nicht ihrem selbstformulierten anspruch, ein bündnis für nachhaltigkeit zu sein. das ist politik zulasten der künftigen generationen und ist das brechen des von uns gemeinsam gegebenen versprechens bei der ersten gelegenheit, mit einem federstrich. das werden wir ihnen nicht durchgehen lassen. dasselbe gilt im übrigen bei dem, was sie zum thema haushaltspolitik otto fricke hat es angesprochen ganz generell sagen. da schreiben sie die schuldenbremse für die zeit nach der krise, ab , in den koalitionsvertrag. dann sucht man das finanztableau und stellt fest: fehlanzeige. man sucht die priorisierung für zukunftsinvestitionen und stellt fest: fehlanzeige. stattdessen wollen sie haushaltstricks machen. sie wollen schattenhaushalte aufmachen. die haushaltsgrundsätze aber heißen klarheit und wahrheit , nicht schatten und nebel . wir werden ihnen das nicht durchgehen lassen. wir werden auf transparenz dringen. wir werden auf eine solide haushaltspolitik im sinne der künftigen generationen auch in zukunft hier in diesem hause dringen. herzlichen dank."
3,09.12.2021,ID20600300,Andreas,Schwarz,SPD,Andreas Schwarz,"nächster redner: für die spd-fraktion andreas schwarz. sehr verehrte frau präsidentin! liebe kolleginnen und kollegen! meine lieben mitbürgerinnen und mitbürger an den fernsehbildschirmen! es ist mir eine außerordentliche freude, nach der gestrigen wahl unseres neuen bundeskanzlers olaf scholz heute den ersten gesetzentwurf der neuen bundesregierung vorstellen zu dürfen. ich darf der neuen bundesregierung an der stelle nochmals alles gute und ein glückliches und gutes händchen wünschen. das gleiche gilt für die neuen hier im bundestag. möge es uns gelingen, gemeinsam für dieses land gute entscheidungen zu treffen, so, wie wir hier gerade den einstieg in gute neue entscheidungen wagen: wir werden heute in erster lesung darüber beraten, ein gesetz zu verlängern, das bis . dezember gelten sollte. darin geht es um stabilisierungsmaßnahmen des wirtschaftsstabilisierungsfonds, auch kurz wsf genannt. wir wollen die gegenwart sichern, um zukunft und fortschritt gestalten zu können. leider, meine damen und herren, ist corona nicht vorbei. weiterhin ist entschlossenes handeln, wie wir es in der vorgängerregierung gezeigt haben, auch jetzt in der ampelkoalition notwendig. natürlich sind auch die länder wichtig bei dem weg, den wir gemeinsam gehen. es geht hier nicht nur um einschränkungen im täglichen leben, die wir eben durchmachen müssen. wir müssen abstand halten, wir müssen uns dem maskenzwang auch hier im hause unterwerfen. das ist auch richtig und wichtig, weil auch gesundheitsschutz eine wichtige maßnahme ist. aber, meine damen und herren, was erwarten die unternehmerinnen und unternehmer in unserem land von der politik in dieser zeit? sie erwarten kontinuität bei den entscheidungen, sie erwarten verlässlichkeit eines starken staates, den wir gott sei dank haben, und sie erwarten schnelle, mutige entscheidungen und reaktionen. das heißt, sie erwarten rettungsschirme, die, wenn notwendig, auch gewährleisten, dass sie helfen. unternehmen brauchen am ende des tages planbarkeit. dafür sorgt diese bundesregierung. die stabilisierungsmaßnahmen des wirtschaftsstabilisierungsfonds zeigen: das land steht zusammen, auch in schwierigen zeiten, und die unternehmen können sich auf unseren staat verlassen. das zeigen nicht nur die wirtschaftsdaten; das zeigt auch der arbeitsmarkt, wo wir ebenfalls sehr stabilisierend eingegriffen haben. denn, liebe kolleginnen und kollegen, bei den betroffenen unternehmen geht es häufig auch um viele tausende von arbeitsplätzen, die gefährdet sind. hier haben wir nicht nur eine arbeitsmarktpolitische, sondern auch eine industriepolitische verantwortung, die wir mit sicherheit sehr ernst nehmen. es geht auch um schlüsseltechnologien, die wir vor dem ausverkauf sichern müssen. aber es geht, wie gesagt, ebenso um viele arbeitsplätze, die wir erhalten wollen. deswegen werden wir mit annahme dieses gesetzentwurfs die befristungsregelung bis . juni verlängern. würden wir nicht verlängern, dann wäre dies, meine damen und herren, liebe kolleginnen und kollegen, nach derzeitiger lage ein völlig falsches signal nach draußen. wirtschaft hat auch viel mit psychologie zu tun. wir müssen weiter in der lage sein, die wirtschaftlichen folgen der coronapandemie für betroffene unternehmen abzufedern. liebe mitbürgerinnen und mitbürger, gerade mit dem wsf haben die bundesregierung und wir als parlament im märz ein ganz wichtiges signal und instrument geschaffen, um größeren unternehmen, die in notlage geraten sind, helfen zu können. sie erinnern sich es wurde schon erwähnt an die problematik der lufthansa. der wsf ist kein hexenwerk; dennoch wirkt er wunder. er besteht, wie sie wissen, aus drei elementen mit einem bisherigen gesamtvolumen von milliarden euro. dabei wollen wir jetzt den garantierahmen von milliarden euro reduzieren, weil er bisher nicht in anspruch genommen wurde. das zeigt: wir haben nicht nur stabile staatsfinanzen und ein stabiles bankenwesen, sondern auch robuste unternehmen. deshalb passen wir den rahmen auf zukünftig milliarden euro an. darüber hinaus gibt es rekapitalisierungsmaßnahmen, die bis zum direkten einstieg des staates in unternehmen gegriffen haben. auch hier wollen wir die obergrenze, wie bereits vom kollegen otto fricke erwähnt, von milliarden auf milliarden euro kappen. nach bisherigen berechnungen wurden auch nur , milliarden euro davon in anspruch genommen. keine änderung wird es bei der finanzierung von coronasonderprogrammen über die kfw geben. sie enthielten bisher milliarden euro und sollen sie auch weiterhin behalten, obwohl auch da im moment erst , milliarden euro ausgereicht wurden. sie sehen, liebe kolleginnen und kollegen, der wirtschaftsstabilisierungsfonds ist in diesen schwierigen zeiten wichtig, und er ist eine absolute erfolgsstory. es ist mehr als sinnvoll, ihn weiterzuführen. meine damen und herren, liebe zuschauerinnen und zuschauer an den bildschirmen, die botschaft lautet: wir bewahren das land und unsere wirtschaft vor erheblichen beschädigungen und stabilisieren den arbeitsmarkt. das nenne ich voraussicht, und das passt zu dem motto unserer neuen regierung mehr fortschritt wagen , weil wir es können. vielen dank."
4,09.12.2021,ID20600400,Peter,Boehringer,AfD,Peter Boehringer,"nächster redner: für die afd-fraktion peter boehringer. frau präsidentin! verehrte kolleginnen und kollegen! die heute vorgeschlagene reduktion des bislang grotesk hohen garantievolumens von über milliarden euro ist überfällig; wir haben es hier eben gehört. es war, je nach rechnung, um bis oder prozent von olaf scholz zu hoch angesetzt. davon reden wir hier. das wird hier jetzt mal korrigiert. profitiert haben aber vom wirtschaftsstabilisierungsfonds entgegen dem, was wir eben gehört haben, fast nur nach politischen kriterien ausgesuchte großunternehmen. jeder arbeitsplatz, etwa bei der tui, wurde mit euro aus dem wsf subventioniert. und wenn man auch noch kfw-hilfskredite einbezieht, die ja ebenfalls über den wsf staatlich garantiert werden können, dann sind es sogar euro pro tui-angestelltem. tausende von kleinen reisebüros und reiseveranstaltern hätten mit demselben recht durch den staat gerettet werden können. sie aber wurden einfach coronaopfer, um die sich olaf scholz weder als finanzminister noch jetzt als kanzler in irgendeiner form kümmert. ganz im gegenteil: in deutschland werden heute millionen menschen durch -g-regeln schuldlos diskriminiert, ohne medizinische logik; denn auch geimpfte sind potenziell ansteckend, und sie belegen auch tausende von intensivbetten. eine gesellschaft ist krank, wenn menschen ständig symptomlos beweisen müssen, gesund zu sein, oder sie gar bei verweigerung des eigenen körpers gegenüber einer zunehmend wirkungslosen und unsicheren neuen impfmethodik überall ausgesperrt werden. die afd erklärt sich hier auch heute mal wieder solidarisch mit millionen von menschen in deutschland, die täglich zu unrecht dieses unrecht und diese diskriminierung erfahren. wir erleben seit märz eine politisch gemachte eskalation: aus dem statistisch herbeidefinierten und durch prämien für bettenabbau noch beförderten gesundheitsnotstand wird über faktischen impfzwang ein rechtsnotstand, dann über lockdowns ein wirtschaftsnotstand und eben schließlich ein haushaltsnotstand. wir müssen raus aus dieser dauerschleife. beenden sie die vollständig gescheiterten maßnahmen gegen corona, und der haushalt und die wirtschaft werden sich von alleine berappeln. zur konstruktion des wsf. genau wie bei der finanzkrise vor zehn jahren hören wir auch heute wieder den spruch: es sind doch bloß garantien … , genau wie damals. das war übrigens damals, vor genau zehn jahren, der titel eines artikels, den ich zur ersten griechenlandrettung veröffentlicht hatte. die garantien von heute sind die kredite von morgen, die abschreibungen von übermorgen und am ende höhere steuern. auch heute wieder ist die garantiekonstruktion nur ein trick zur zeitlichen aufschiebung der öffentlichen aufregung darüber. die durch garantien verbürgten kredite des wsf sind teilweise verloren. aber das sagen sie den menschen heute noch nicht. die kfw und der wsf werden diese garantien ziehen. die abschreibungen werden dann künftige steuerzahler belasten, aber erst nach der ampel. und ausgerechnet mein letzter satz, frau präsidentin der fdp-finanzminister lindner macht mit dieser verschleierung genau dort weiter, wo die merkel-groko aufgehört hatte. vielen dank."
5,09.12.2021,ID20600500,Sven-Christian,Kindler,BÜNDNIS 90/DIE GRÜNEN,Sven-Christian Kindler,"nächster redner: für die fraktion bündnis /die grünen sven-christian kindler. sehr geehrte frau präsidentin! meine damen und herren! wir sehen ja alle hier zurzeit bis auf einige schwurbler im haus , was eigentlich phase ist: wir befinden uns mitten in einer schweren pandemie. die coronakrise ist noch lange nicht vorbei. die krankenhäuser geraten an ihre kapazitätsgrenzen: auf normalstationen, auf intensivstationen. in einigen regionen deutschlands sind sie schon weiter, längst darüber hinaus. wir haben gestern in einer anhörung zum infektionsschutzgesetz im hauptausschuss noch einmal sehr deutlich gehört, dass mit der omikron-variante höchstwahrscheinlich eine neue schwere variante zu befürchten ist, die im januar in deutschland das regime übernehmen könnte. und das zeigt ja: für uns alle ist es jetzt notwendig, konsequente maßnahmen gegen diese pandemie zu ergreifen. das ist jetzt unsere aufgabe hier im deutschen bundestag. vielen von uns hier im haus ist sehr bewusst, dass es angesichts der schweren vierten welle und der omikron-variante vor der tür einerseits jetzt konsequente, härtere maßnahmen kontaktbeschränkungen, reisebeschränkungen, untersagen von veranstaltungen, auch regionale lockdowns braucht. aber andererseits wissen wir auch, dass sie natürlich kurzfristig deutlich negative wirtschaftliche folgen für betroffene branchen und betroffene betriebe haben. es ist in der anhörung gestern noch einmal deutlich klar geworden, dass es mittelfristig ökonomisch für unsere wirtschaft deutlich besser und sinnvoller ist, die pandemie in den griff zu kriegen, als sie laufen zu lassen. das zeigen alle empirischen erkenntnisse weltweit. aber kurzfristig haben wir negative wirtschaftliche effekte. die müssen wir natürlich, soweit es geht, eben auch für betriebe und betroffene branchen verhindern. das machen wir heute hier, und das ist sehr wichtig für uns. deswegen beraten wir in der koalition, dass wir die bestehenden breiten wirtschaftshilfen verlängern. konkret diskutieren wir heute die verlängerung des wirtschaftsstabilisierungsfonds bis mitte des nächsten jahres, bis sommer . wir haben als fraktion bündnis /die grünen der einrichtung dieses fonds zugestimmt, weil es insbesondere für mittelständische und große unternehmen, die durch harte maßnahmen betroffen und eingeschränkt sind, aber auch durch internationale verwerfungen auf den märkten massive beeinträchtigungen haben, hilfe braucht. deswegen ist es sinnvoll, dass wir hier als ampelkoalition einen entsprechenden entwurf auf den weg gebracht haben. ich danke otto fricke und dennis rohde noch mal für die konstruktiven beratungen. das zeigt: das parlament ist handlungsfähig, auch in zeiten, in denen die exekutive der neuen regierung noch nicht im amt ist. ich bitte sie darum, dieser verlängerung dann auch in zweiter und dritter lesung zuzustimmen. ich will aber auch noch mal sehr deutlich sagen: die bisherigen regeln zum wirtschaftsstabilisierungsfonds gelten weiterhin. wer zur bewältigung wirtschaftlicher krisen jetzt solidarität des staates erwartet, also von uns allen, von den bürgerinnen und bürgern, der muss sich dann auch an die regeln, die im parlament, im haushaltsausschuss aufgestellt wurden, halten. der wirtschaftsstabilisierungsfonds dient explizit nicht zur absicherung von boni für topmanager und vorstände, und er dient auch explizit nicht zur absicherung von dividendenzahlungen an aktionäre mit steuergeld. wir werden im haushaltsausschuss, im parlament sehr genau darauf achten, dass dies nicht der fall ist. ich würde mir wünschen, dass das auch für andere krisenabsichernde maßnahmen gilt, für die wir konkret steuergeld einsetzen. ich will noch etwas zur beteiligung der eigentümerseite sagen. der wsf muss der lender of last resort der wirtschaftshilfen bleiben, also das letzte mittel bei den wirtschaftshilfen, das wir einsetzen. wir haben es in wirtschaftlichen krisen oft erlebt, dass am ende die allgemeinheit für wirtschaftliche risiken zahlt und das vermögen privater eigentümer ohne eigenleistung abgesichert wird. das darf nicht der fall sein. ich erwarte, dass bei den unternehmen, die sich unter den schutzschirm begeben, die eigentümerseite dann auch relevante beiträge leistet. das ist unsere anforderung. wir werden auch sehr genau darauf achten, dass die ökologischen und klimapolitischen ziele der europäischen union, die die grundlage für die genehmigung des wsf durch die europäische kommission waren, bei der beantragung und der entscheidung berücksichtigung finden. es geht in dieser pandemie um eine stabilisierung der wirtschaft, ja; aber das darf keinen fossilen lock-in bedeuten. wir müssen eine stabilisierung der wirtschaft hinbekommen, und wir müssen eine transformation der wirtschaft hinbekommen. die einhaltung der , -grad-grenze und die klimapolitischen ziele der europäischen union sind grundlage für alle entscheidungen. vielen dank. nächster redner: für die fraktion die linke victor perli."
6,09.12.2021,ID20600600,Victor,Perli,DIE LINKE,Victor Perli,"vielen dank. frau präsidentin! meine damen und herren! es ist richtig, in dieser schweren krise alles dafür zu tun, um eine pleitewelle zu verhindern. das hat die linke immer unterstützt. es ist auch richtig, diese hilfen jetzt zu verlängern. aber wir kritisieren, dass die neue koalition die fehler in dem alten gesetz nicht korrigiert. dabei haben wir doch alle erlebt, dass die staatlichen hilfen die beschäftigten nicht abgesichert haben. für uns linke ist klar: wenn konzerne mit milliarden gerettet werden, dann darf es keine entlassungen und dann darf es kein lohndumping geben. wir können auch nicht akzeptieren, dass diese konzerne ihr geld weiter in steueroasen verschwinden lassen. öffentliches geld muss öffentlichen interessen dienen. das beispiel lufthansa verdeutlicht das problem. die lufthansa wurde gerettet, aber über menschen wurden entlassen. über menschen! die bundesregierung wurde durch die beteiligung in form dieser staatshilfe zum größten eigentümer. aber anstatt um die jobs zu kämpfen, haben olaf scholz und peter altmaier geschwiegen. das darf auf gar keinen fall schule machen. deswegen muss das gesetz geändert werden. wir wundern uns schon, dass sich spd und grüne nicht dafür einsetzen. die spd hat damals gesagt: mit der cdu/csu ist nicht mehr drin. die grünen haben mit uns zusammen in der opposition für ein besseres gesetz gekämpft. und jetzt sind sie an der regierung und legen hier ein weiter so ohne änderungen -gesetz vor. was für eine enttäuschung! meine damen und herren, mit öffentlichem geld müssen öffentliche interessen gesichert werden. das gilt auch für die coronaimpfstoffe. eine pandemie kann nur weltweit besiegt werden. deshalb muss die neue bundesregierung schleunigst die blockade zur freigabe der patente beenden. sie muss aufhören, diese lobbytätigkeit für die pharmaindustrie! geben sie endlich die patente frei! das werden sie von uns heute und in zukunft noch sehr häufig hören. vielen dank."
