,datum,redeID,vorname,nachname,fraktion,name,inhalt_neu
33,28.04.2022,ID203103300,Hubertus,Heil,SPD,Hubertus Heil,"herr präsident! meine lieben kolleginnen und kollegen! am kommenden sonntag ist der tag der arbeit, der . mai, ein feiertag mit wirklich stolzer tradition, ein tag, auf den ich mich als arbeitsminister, aber auch ganz persönlich freue, ein tag mit großer tradition, an dem es aber auch um hochaktuelle themen geht. am sonntag werden viele millionen menschen auf der welt auf die straße gehen, für werte wie frieden, für freiheit, für soziale gerechtigkeit und für solidarität. am . mai geht es natürlich aber immer wieder auch um den wert und die würde der arbeit. es geht darum, meine damen und herren, dass millionen von arbeitnehmerinnen und arbeitnehmern das bekommen, was ihnen zusteht: anständige arbeitsbedingungen und faire löhne. dazu gehört eben auch die erhöhung des mindestlohns. herr präsident, meine damen und herren, wir sind heute hier, um eine zusage, ein versprechen einzulösen: mehr respekt! auch dafür ist diese bundesregierung angetreten: mehr respekt für diejenigen, die tag für tag dafür sorgen, dass der laden läuft, die großes leisten, und das oftmals für kleines geld. die rede ist ganz konkret von verkäuferinnen, die in einer bäckerei arbeiten, von denjenigen, die als helferinnen und helfer in der landwirtschaft tätig sind, oder auch von friseurinnen. meine damen und herren, es sind gerade diese menschen mit kleineren und normalen einkommen, die sich schon während der pandemie in den letzten zwei jahren große sorgen gemacht haben und jetzt angesichts steigender preise besonders beunruhigt sind. die bundesregierung hat deswegen dafür gesorgt, dass besonders diese menschen in der jetzigen krise entlastet werden. deswegen haben wir entlastungspakete auf den weg gebracht, um härten abzufedern. wir entlasten damit zum beispiel eine familie mit normalem einkommen arbeitnehmerin und arbeitnehmer mit zwei kindern, beide eltern berufstätig um mehr als euro in diesem jahr. hinzu kommen individuelle entlastungen, etwa beim strom, bei kraftstoffen, beim nahverkehr. das ist politik für soziale stabilität in unserem land. denn es kann nicht sein, dass gerade die menschen mit den kleinen einkommen die größten lasten tragen. sie brauchen unsere solidarität. herr präsident, meine damen und herren, mehr respekt bedeutet auch, dass wir gerade jetzt das gesetz zur erhöhung des mindestlohns auf den weg bringen. die evaluation, also die untersuchung, des bestehenden mindestlohns aus dem jahr hat uns zwei klare botschaften mit auf den weg gegeben. erstens. die einführung des mindestlohns ist ein erfolgsmodell. er hat sozialversicherungspflichtige arbeit gesichert und höhere löhne für rund millionen menschen gebracht. ich kann mich übrigens noch sehr lebhaft an die ideologischen debatten aus der damaligen zeit um die einführung des mindestlohns erinnern. damals waren manche auf dem plan, die den untergang der sozialen marktwirtschaft an die wand gemalt haben; interessanterweise sind das auch diejenigen, die sich jetzt wieder zu wort melden; insofern sollten sie ihre eigenen worte erinnern. die wahrheit ist: das gegenteil ist richtig. die einführung des gesetzlichen mindestlohns war und ist ein sozialpolitischer meilenstein. ich will mich auch heute noch dafür bedanken, dass meine amtsvorgängerin andrea nahles das damals durchgesetzt hat. unser ziel muss es in einer sozialen marktwirtschaft doch sein, dass die, die vollzeit arbeiten, auch davon leben können. die zweite botschaft dieser evaluation aus dem jahre war: wir müssen dafür sorgen, dass sich der mindestlohn angemessen weiterentwickelt. das ist sozialpolitisch geboten, das ist sozialstaatlich geboten, auch angesichts der aktuellen preisentwicklung, damit millionen menschen nicht den anschluss an die arbeitende mitte in diesem land verlieren. für die arbeitnehmerinnen und arbeitnehmer ist es daher wichtig, dass die erhöhung des mindestlohns jetzt schnell kommt. zugleich allerdings fordern die arbeitgeber und ihre verbände, dass es einen hinreichenden vorlauf dafür gibt. ich wie auch die bundesregierung bin überzeugt, dass mit dem inkrafttreten zum . oktober hier ein fairer und auch schonender interessenausgleich gelungen ist. klar ist auch, dass die weiterentwicklung des mindestlohns als instrument des sozialstaates eine aufgabe des gesetzgebers ist. gleichzeitig will ich betonen, dass das bewährte system des sozialpartnerschaftlich verhandelten mindestlohns damit nicht grundsätzlich infrage gestellt wird. wir wollen es nur insoweit anpassen, wo das erforderlich ist, um für einen angemessenen mindestschutz der arbeitnehmerinnen und arbeitnehmer zu sorgen. klar ist auch, dass die mindestlohnkommission in zukunft weitere anpassungen übernehmen wird. das heißt, dass damit auch die sozialpartnerinnen und sozialpartner eingebunden sind. natürlich, meine damen und herren, ist der mindestlohn auch nach dieser erhöhung immer nur eine absolute lohnuntergrenze. die ist notwendig. euro das entspricht ungefähr prozent des mittleren einkommens in deutschland sind eine vernünftige lohnuntergrenze. aber ich sage auch: uns als bundesregierung reicht das nicht aus. wir wollen wieder mehr tarifbindung in deutschland, und dafür werden wir auch anreize setzen. deshalb bin ich froh, dass wir im koalitionsvertrag verankert und vereinbart haben, dass beispielsweise öffentliche aufträge des bundes zukünftig nur an die unternehmen gehen sollen, die nach tarif bezahlen, meine damen und herren. das ist ein konkreter anreiz für mehr tarifbindung. mit diesem gesetzentwurf sorgen wir dafür, dass der mindestlohn zum . oktober auf euro steigt. wer vollzeit zum mindestlohn arbeitet, verdient bisher brutto rund euro, dann rund euro. ich will noch mal sagen, wer vor allen dingen davon profitiert: millionen von menschen, vor allen dingen frauen, die am arbeitsmarkt arbeiten, die den laden am laufen halten, und auch sehr viele beschäftigte in ostdeutschland. das ist eine lohnerhöhung von rund prozent. das haben wir versprochen, und wir machen das, meine damen und herren. ich sage das gerade in diesen zeiten. wir haben am heutigen vormittag zu recht über frieden und äußere sicherheit gesprochen. aber das ist kein gegensatz zu sozialer stabilität im inneren. im gegenteil, meine damen und herren: äußere sicherheit und innerer sozialer frieden sind zwei seiten einer medaille. deshalb geht es nicht um krisenmanagement oder sozialen fortschritt; wir müssen beides schaffen in deutschland. unser sozialstaat, meine damen und herren, und auch unsere soziale marktwirtschaft sind stark. der sozialstaat sorgt für verlässlichen schutz und gesellschaftlichen zusammenhalt, gerade auch in zeiten der krise. unser ziel und dafür leistet die erhöhung des mindestlohns auf euro einen wichtigen beitrag ist und bleibt ein starkes und ein faires deutschland. herzlichen dank. vielen dank, herr minister heil. nächster redner ist der kollege stephan stracke, cdu/csu-fraktion."
34,28.04.2022,ID203103400,Stephan,Stracke,CDU/CSU,Stephan Stracke,"sehr geehrter herr präsident! meine sehr verehrten damen und herren! unter führung der union in der kanzlerschaft von angela merkel haben wir den allgemeinen gesetzlichen mindestlohn in deutschland zum . januar eingeführt. wir haben dies in dem bewusstsein getan, dass gute arbeit in deutschland auch fair entlohnt werden muss. dort, wo der tarifvertragliche schutz nicht oder nicht hinreichend ausgebildet ist, braucht es eine angemessene lohnuntergrenze, um zu verhindern, dass der wettbewerb zwischen unternehmen auf dem rücken von beschäftigten ausgetragen wird. wir wollen auch dafür sorgen, dass man von dem lohn tatsächlich leben kann. der mindestlohn hat sich bewährt. durch die beschlüsse der mindestlohnkommission liegt die höhe des mindestlohns aktuell bei , euro; sie steigt zum . juli dieses jahres weiter an auf , euro, und nun soll der mindestlohn auf euro erhöht werden. dies erfolgt nicht auf der grundlage der beschlüsse der mindestlohnkommission, sondern durch eine politische setzung des gesetzgebers. ich will an dieser stelle ganz klar sagen: ein mindestlohn von euro ist angemessen, und er ist richtig. euro sind eine wichtige unterstützung von menschen mit geringen einkommen. millionen arbeitnehmerinnen und arbeitnehmer profitieren davon. der minister hat darauf hingewiesen: es sind überwiegend frauen. sie sind es ja, die infolge von mehrfachbelastungen, der schwierigkeit, familie und beruf in einklang zu bringen, häufiger im niedriglohnbereich beschäftigt sind und deshalb auch niedrige renten haben. zugleich bleibt aber auch der hinweis richtig, dass wir in einer sozialen marktwirtschaft wie der unsrigen keine politische lohnfindung wollen; das lehnen wir ab. ein überbietungswettbewerb bei der höhe von löhnen, meistens ja dann zu wahlkampfzeiten vorgetragen, ist brandgefährlich. ein solcher wettbewerb schwächt die sozialpartnerschaft. wir brauchen jedoch starke arbeitgeber und starke gewerkschaften, und wir dürfen sie nicht beschädigen. letztendlich würde ein solcher überbietungswettbewerb, wenn er auf dauer ausgetragen würde, zulasten der schwächsten am arbeitsmarkt gehen. denn sie sind es, die letztendlich durch neue barrieren am eintritt in den arbeitsmarkt gehindert werden. wir brauchen jedoch nicht neue hürden, sondern weniger. wir wollen auch, dass der erhöhte mindestlohn von euro tatsächlich bei den menschen ankommt, und zwar dauerhaft. für eine vollzeitbeschäftigte arbeitskraft mit stunden beispielsweise bedeutet die erhöhung ein einkommensplus von brutto euro. sie verdient rund prozent mehr als bei einer mindestlohnhöhe von , euro, muss aber prozent mehr steuern zahlen. im verhältnis muss sie also mehr steuern zahlen als vorher. ursache dafür ist die gestaltung des steuertarifs; wir nennen das auch kalte progression . die kalte progression müssen wir in diesem bereich verhindern, damit die erhöhung des mindestlohns auf euro tatsächlich bei den menschen ankommt. die kalten, klammen hände des bundesfinanzministers dürfen sich nicht tief in die taschen der geringverdiener hineingraben. hier ist die bundesregierung gefordert, aktiv zu werden, den effekt der kalten progression abzumildern. das bleiben sie aber schuldig. wir brauchen mehr netto vom brutto. an dieser stelle liefert die bundesregierung nicht, und das ist etwas, was wir bemängeln und auch klarmachen. ein zweiter effekt, der hinzukommt, ist der der steigenden sozialbeiträge. die entwicklung der abgabenlast kennt bei dieser koalition absehbar nur eine richtung, und zwar die nach oben. bei der krankenversicherung es fehlen rund milliarden euro für , bei der pflegeversicherung auch da ein defizit , bei der rente und bei der arbeitslosenversicherung sind erhöhungen entsprechend angekündigt. es droht auf der ganzen breite ein beitragssatztsunami. auch hier ist die bundesregierung gefordert, die sozialbeiträge stabil zu halten; denn sie sind es letztendlich, die in besonderem maße geringverdiener belasten. wir als union haben dies mit unserer sozialgarantie von prozent gemacht. diese koalition bleibt diesen ansatz schuldig. ein dritter effekt kommt hinzu. das ist der massive kaufkraftverlust, den wir derzeit erfahren: prozent in diesem monat. das merken wir bei den grundnahrungsmitteln, bei den spritpreisen, bei den heizkosten. auch das belastet natürlich gerade bezieherinnen und bezieher von geringen einkommen in massiver art und weise. auch da muss diese koalition mehr tun, als sie es tatsächlich macht. und auch hier ist der ansatz wieder die steuer. hier können sie zeigen, dass sie tatsächlich dafür sorge tragen, dass die erhöhung auf euro mindestlohn bei den menschen ankommt. von der mindestlohnerhöhung sollen auch diejenigen profitieren, die in einem minijob beschäftigt sind. es ist richtig, dass dies getan wird. nötig und richtig ist auch, dass dies dynamisiert wird. sie gehen auch eine teilzeitfalle an, nämlich den übergang zwischen minijob und midijob. aber das, was sie tun, ist nicht die lösung. auch da müssen sie an das steuerrecht heran, um die teilzeitfalle tatsächlich wirksam zu beseitigen. herr kollege. es bleibt für diese koalition viel zu tun, um es richtig zu machen. vielen dank, herr kollege stracke. als nächster redner erhält das wort der kollege frank bsirske, bündnis /die grünen."
35,28.04.2022,ID203103500,Frank,Bsirske,BÜNDNIS 90/DIE GRÜNEN,Frank Bsirske,"herr präsident! abgeordnete! erinnern wir uns: bevor eine gesetzliche lohnuntergrenze eingezogen wurde, befanden sich die löhne in vielen bereichen auf einer rutschbahn nach unten, begünstigt durch eine sinkende tarifbindung. mitgliedschaften in arbeitgeberverbänden ohne tarifbindung und das ausscheren vieler unternehmen aus tarifverträgen führten dazu, dass immer mehr menschen, statt von tarifverträgen geschützt zu sein, sich mit der rückkehr von unsicherheit konfrontiert sahen: damit, das eigene leben in zeiten prekärer arbeitsverhältnisse nicht mehr wirklich planen zu können, damit, von armut bedroht zu sein, obwohl sie arbeiteten arbeitende armut eben. die einführung des gesetzlichen mindestlohns war ein wichtiger schritt, dem entgegenzutreten. es war eine reaktion auf die anhaltend rückläufige tarifbindung und entsprach dem willen der großen mehrheit der menschen in unserem land, die nämlich nicht in einer gesellschaft leben wollen, in der arbeit armmacht und entwürdigt. mit dem mindestlohn ist klargestellt worden, dass es rote linien gibt, die zu überschreiten politisch nicht zugelassen werden soll, genauso wie es seinerzeit ein us-präsident franklin delano roosevelt auf den punkt gebracht hat, als er bei der einführung des nationalen gesetzlichen mindestlohns sagte zitat : unternehmen, deren existenz lediglich davon abhängt, ihren beschäftigten weniger als einen zum leben ausreichenden lohn zu zahlen, sollen in diesem land kein recht mehr haben, weiter ihre geschäfte zu betreiben. wenn wir heute, sieben jahre nach einführung des gesetzlichen mindestlohns in deutschland, schauen, wo wir stehen, so müssen wir feststellen: deutschland befindet sich im langfristigen eu-vergleich weit abgeschlagen auf einem der letzten plätze. der mindestlohn ist seit seiner einführung um nur , prozent gestiegen. da bleibt nach abzug der inflation nur eine reale steigerung von weniger als prozent pro jahr. dem wollen wir nicht länger zuschauen. mit der anhebung auf euro bringen wir den deutschen mindestlohn in die nähe des auch von der eu‑kommission für notwendig gehaltenen richtwerts von prozent des medianlohns jenseits der armutsgefährdung und verbessern so die entlohnung von rund millionen menschen in unserem land. das hilft gerade jetzt vielen angesichts steigender preise, die die menschen mit niedrigen einkommen ja besonders hart treffen. von der anhebung profitieren insbesondere menschen in den neuen bundesländern und vor allem auch frauen; denn sie haben doch ein doppelt so hohes risiko wie männer, zu löhnen unterhalb von euro zu arbeiten. es ist durchaus bemerkenswert, wie jetzt darauf reagiert wird. dieselben arbeitgeberverbandsfunktionäre, die sich öffentlich wie in der mindestlohnkommission stets gegen deutliche anhebungen des mindestlohns gesträubt haben, erklären nun, das problem sei ja gar nicht die höhe von euro die sei durchaus vertretbar , das problem sei, dass der schritt politisch beschlossen werden solle. das sind dieselben leute, die seit vielen jahren die augen davor verschließen, dass die tarifbindung kontinuierlich sinkt: von rund prozent anfang der -jahre auf knapp prozent heute. das sind dieselben leute, die ot‑mitgliedschaften in arbeitgeberverbänden kultivieren und bestens damit klarkommen, dass tarifunterbietung zum zwecke zusätzlicher profite und höherer dividenden längst auch in der beletage deutscher unternehmen angekommen ist, wie zum beispiel in der hochprofitablen wohnungswirtschaft. zur weiteren deregulierung braucht man bei einer solchen ausgangslage keine neuen gesetze mehr. staatliches nichtstun reicht vollkommen aus. dann könnte sich die tarifautonomie in teilen der wirtschaft von selbst erledigen wenn nicht gegengesteuert wird. dazu aber gegenzusteuern sind wir fest entschlossen. ein höherer mindestlohn ist notwendig, reicht aber nicht aus; denn das wirkungsvollste instrument, um die ungleichheit der markteinkommen zu verringern, ist und bleibt eine höhere und eine hohe tarifbindung. dazu werden wir ein bundestariftreuegesetz erlassen, die kollektive nachwirkung von tarifverträgen im verbund mit den unternehmen festschreiben und weitere schritte prüfen. denn ohne die stärkung des tarifsystems, ohne die festigung der bindungskraft von tarifverträgen wird sich die ungleichheit in der einkommensverteilung weiter verfestigen oder sogar noch erhöhen. ist es nun mit risiken verbunden, den mindestlohn in einem schritt auf euro anzuheben? schritte wie dieser haben nirgendwo zu relevanten negativen konsequenzen für den arbeitsmarkt geführt. in großbritannien zum beispiel ist der mindestlohn bereits auf prozent des medianlohns angehoben worden und soll bis weiter auf prozent erhöht werden. die anhebung auf euro ist deshalb auch ein signal in richtung mindestlohnkommission, den mindestlohn mutig weiterzuentwickeln, dafür zu sorgen, dass er nicht wieder unter prozent des medians fällt, dafür zu sorgen, dass der mindestlohn für eine auskömmliche rente reicht. da sind wir nicht, auch nicht mit euro; aber da sollten wir hin. dass dies erreicht wird, dass es gelingt, die tarifbindung wieder zu erhöhen, ist zentral, um faire entlohnungsbedingungen für alle menschen in unserem land in einer sozial-ökologischen marktwirtschaft zu ermöglichen, in der arbeit nicht armmacht und nicht entwürdigt. vielen dank, herr kollege bsirske. nächster redner ist der abgeordnete jürgen pohl, afd-fraktion."
36,28.04.2022,ID203103600,Jürgen,Pohl,AfD,Jürgen Pohl,"herr präsident! meine damen und herren! es ist die erste aufgabe und pflicht der opposition, wenn nötig, wasser in den wein zu gießen und die wahrheit auszusprechen. der vorliegende entwurf des mindestlohnerhöhungsgesetzes ist zuvörderst ein wahlgeschenk, ein wahlversprechen, das aber in einer gänzlich anderen zeit abgegeben wurde. heute leben wir in der seit der wiedervereinigung höchsten inflationsrate von bald prozent. diese inflation raubt normalverdienern und rentnern im land die mühsam erarbeitete existenzgrundlage. warum handeln wir am mindestlohngesetz vorbei? warum tagt trotz grassierender inflation die mindestlohnkommission nicht? im juni war die letzte tagung. seit dieser zeit wird die teuerung konsequent ignoriert. meine damen und herren, der bisher stärkste mindestlohnstieg um satte prozent wird in zeiten einer rasant kletternden inflation alsbald von der teuerung aufgefressen. zwar ist die erhöhung des gesetzlichen mindestlohnes auf euro pro arbeitsstunde grundsätzlich zu begrüßen, doch wir wissen seit einer anfrage der nunmehr zerfallenden linksfraktion aus dem jahr , dass rein rechnerisch ein mindestlohn von , euro nötig ist, um eine altersrente oberhalb der grundsicherung zu gewährleisten. demnach garantiert die in rede stehende mindestlohnerhöhung nicht einmal einen schutz vor altersarmut, was scharf zu kritisieren ist. somit fällt das wahlgeschenk für rund millionen beschäftigte dann doch nicht so generös aus, wie es uns die ampelkoalitionäre und die parteizentralen weismachen wollen. eigentlich ist es schlimmer, meine damen und herren. wie das diw zutreffend feststellt, sind die von armut betroffenen haushalte nicht die, die vom mindestlohn profitieren, weil der effekt des mindestlohns als instrument zur bekämpfung von familienarmut sehr begrenzt ist. die gegenwärtige inflation trifft die armen ungleich härter als die reichen bevölkerungsgruppen. so weiß der armutsforscher professor butterwegge ich zitiere : wer mehr als . euro netto im monat verdient, den bringt es nicht um, wenn seine lebenshaltungskosten um , prozent steigen. einen paketboten in münchen mit euro netto machten um , prozent höhere preise aber noch ärmer. da ging es noch um , prozent. zur erinnerung: wir stehen jetzt bei , prozent inflation. empirische analysen des diw zeigen, dass der anstieg des mindestlohnes für viele beschäftigte, vor allen dingen in minijobs oder in teilzeit, mit einem rückgang der arbeitsstunden einhergeht. daher übersetzt sich das wachstum des stundenlohnes nicht unmittelbar in ein wachstum des monatseinkommens; alle sozialpolitiker dieses hauses wissen das. kurzum, die bloße erhöhung des mindestlohns löst nicht die probleme des deutschen arbeitnehmers. diese probleme liegen tiefer und sind grundsätzlicher natur. der gesetzliche mindestlohn ist doch nur ausdruck der krise des sozialstaates sowie eines völlig maroden lohngefüges. dass wir heute mit den mindestlöhnen systemkosmetik betreiben, hat eigentlich seine ursache in den unsäglichen lohnzurückhaltungen der letzten jahre. unseren unsozialen sozialdemokraten unter dem nun nicht mehr geliebten kanzler schröder und den abgehobenen grünen, den gestaltern von hartz iv, denen haben wir dieses elend zu verdanken. die politisch gewollte lohnzurückhaltung, also das nichtausschöpfen des verteilungsspielraums aus produktivitätszuwächsen, kostete nicht nur lohn, sondern auch hunderttausende von arbeitsplätzen. das sind verschenkte wachstums- und wohlstandschancen in deutschland. wenn man solche chancen verschenkt, dann braucht man nämlich einen mindestlohn. die auf das konto von rot-grün gehende brutale deregulierung des arbeitsmarktes unter hartz iv führte, wie wir heute wissen, zu einem dramatischen anstieg von prekären beschäftigungsverhältnissen und leiharbeit meistens zu hungerlöhnen , zu einer massiven ausweitung von teilzeit- bzw. befristeten jobs. da liegt der hase im pfeffer. alle maßnahmen zur lohnerhöhung werden durch die neuerliche ausweitung atypischer arbeitsverhältnisse konterkariert. das ist genau der punkt, wo wir als afd ansetzen wollen. der afd als soziale volkspartei lachen sie weiter! ihre wähler da oben das hatte ich ihnen in der letzten legislatur erklärt , die schauen alle zu. wir wollen auch was tun für die arbeitnehmer. lachen sie weiter! das ist genau der punkt, wo wir als afd ansetzen, als soziale volkspartei, die sich um die belange der arbeitnehmer und der steuerzahler kümmert. drei dinge sind für uns unverhandelbar. erstens. man muss von seiner arbeit leben können. zweitens. man muss von seiner arbeit eine familie gründen können. drittens. man muss diese familie auch ernähren können. ziel der afd ist es, mit einer soliden wirtschafts- und sozialpolitik mindestlöhne endlich überflüssig werden zu lassen. wir brauchen den wohlstandslohn zum wohle der arbeitnehmer und der familien. unter diesen aspekten stimmen wir der überweisung in den ausschuss zu. danke schön. vielen dank, herr kollege pohl. nächster redner ist der kollege pascal kober, fdp-fraktion."
