,datum,redeID,vorname,nachname,fraktion,name,inhalt_neu
0,,,,,, ,
1,12.12.2018,ID197000100,Angela,Merkel,CDU/CSU,Angela Merkel,"herr präsident! liebe kolleginnen und kollegen! ich beginne mit dem g‑ -gipfel. argentinien war ein sehr guter gastgeber und hat alles darangesetzt, dass wir zu einem abschlusskommuniqué kommen konnten; das ist uns auch gelungen. wir konnten auf den hamburger erfahrungen vom vorjahr während unserer g‑ -präsidentschaft aufbauen. wir haben es geschafft, noch einmal eine -erklärung zum klimaschutz hinzubekommen; das ist wichtig für die derzeitige konferenz in katowice. die vereinigten staaten von amerika haben dabei nicht mitgemacht. wir haben die fortsetzung unseres compact with africa erreichen können. wir haben das thema weltweite gesundheit in der agenda der g dauerhaft verankert. wir haben uns für eine reform des multilateralen handelssystems ausgesprochen. das sind wichtige kernpunkte, die die multilaterale zusammenarbeit der g noch einmal unterstreichen. die verhandlungen waren extrem schwierig und auch extrem lang aber ende gut und insofern doch ein gewisses maß an zufriedenheit. was den europäischen rat anbelangt, der morgen und übermorgen stattfindet, so werden wir uns dort zum ersten mal damit auseinandersetzen, was die österreichische präsidentschaft erarbeitet hat, nämlich eine sogenannte verhandlungsbox für die mittelfristige finanzielle vo rausschau. sie wissen, dass wir als europäischer rat es vor der europawahl nicht mehr schaffen werden, uns über die finanzen zu verständigen; aber die struktur der zukünftigen verhandlungen wird jetzt klarer erkennbar. da gibt es naturgemäß sehr große interessenunterschiede. wir werden uns mit dem thema des austritts großbritanniens beschäftigen. wir werden einen bericht der premierministerin hören und dann im artikel‑ -format, also zu , noch einmal kurz beraten. wir haben nicht die absicht, das austrittsabkommen zu verändern. das ist die allgemeine position der mitgliedstaaten. insoweit ist nicht zu erwarten, dass wir mit irgendwelchen veränderungen aus den debatten herausgehen. wir werden uns dann mit der reform der wirtschafts- und währungsunion beschäftigen. die finanzminister haben hier entsprechend vorgearbeitet. die vollendung der bankenunion, aber auch ein sogenanntes euro-zonenbudget werden auf der tagesordnung stehen und in zusammenhang mit der bankenunion auch eine politische einigung über die veränderung des esm in richtung eines europäischen währungsfonds. und wir können festhalten das will ich noch sagen , dass wir eine vielzahl von europäischen bürgerdialogen durchgeführt haben mitgliedstaaten haben sich daran beteiligt , die jetzt auf dem europäischen rat ausgewertet werden. in deutschland haben dazu auf initiative der bundesregierung knapp veranstaltungen stattgefunden. ich kann aus meiner eigenen erfahrung berichten, dass das auf reges interesse gestoßen ist. so weit in kürze zu den beiden genannten themen. vielen dank. die erste frage stellt der kollege frohnmaier, afd."
2,12.12.2018,ID197000200,Markus,Frohnmaier,AfD,Markus Frohnmaier,"sehr geehrte frau bundeskanzlerin, das brexit-abkommen zwischen der eu und dem vereinigten königreich ist darauf angelegt, das britische volk für seine demokratische entscheidung zu bestrafen. es sieht vor, dass sich die briten vorerst den regularien des binnenmarktes unterwerfen müssen, ohne in zukunft mitreden zu dürfen. es sieht vor, dass sich die briten der gerichtsbarkeit des eugh unterwerfen müssen, ohne in zukunft dort richter zu stellen. es sieht vor, dass die briten milliarden pfund an die eu zahlen müssen, obwohl sie nicht mehr mitglied wären. es sieht weiter vor, dass eine zollgrenze entlang der irischen see, also in ihrem eigenen land, errichtet wird, wenn großbritannien den binnenmarkt verlässt. dieses abkommen zerteilt das vereinigte königreich, es gefährdet den frieden in nordirland und schürt zwietracht und hass im britischen volk. frau merkel, sieht so ein europäisches friedensprojekt aus?"
3,12.12.2018,ID197000300,Angela,Merkel,CDU/CSU,Angela Merkel,"ihre mischung von fakten und wertungen teile ich nicht. ich versuche mal, mich mit den sachverhalten auseinanderzusetzen. es gibt eine übergangsphase im zusammenhang mit dem austritt großbritanniens aus der europäischen union. während dieser ist es in der tat so, dass großbritannien noch die regeln der europäischen union befolgt. ende , wenn das austrittsabkommen vollkommen in kraft tritt, haben wir eine neue situation. ich glaube, das ist ein sehr fairer ausgleich. wir haben ja noch ein weiteres dokument zu den zukünftigen beziehungen. die zwischenzeit, diese interimszeit, wird gebraucht, um die zukünftigen beziehungen vertraglich zu vereinbaren und nicht nur politisch zu vereinbaren. was sie sagen, herr kollege jetzt muss ich mich wegen der zeit schon beeilen , ist deshalb sachlich falsch. da großbritannien einen speziellen hintergrund hat, durch die parallelität vom austritt großbritanniens und einem existenten good friday agreement, das die verhältnisse zwischen der republik irland und nordirland regelt, kommen wir zu einer sehr schwierigen konstruktion. deshalb haben wir solche dinge wie einen sogenannten backstop vorgesehen, um die frage, wie die grenze zwischen irland und nordirland aussehen wird, noch weiter zu diskutieren. danke sehr. die nächste frage stellt der kollege nils schmid, spd."
4,12.12.2018,ID197000400,Nils,Schmid,SPD,Nils Schmid,"frau bundeskanzlerin, ungeachtet der bemühungen um die reform des welthandelssystems haben wir ja einen handfesten handelskonflikt usa-europa. was sind denn die nächsten schritte der eu, wenn es tatsächlich zu der mehrfach angekündigten einführung von importzöllen auf automobilexporte aus der eu vonseiten der usa kommen sollte? und umgekehrt: wie sehen sie die chancen, dass es zu einem investitionsgüterabkommen zwischen der eu und den usa kommen kann, um zumindest beschränkt handelsliberalisierung zu betreiben? letzter punkt in diesem zusammenhang: haben sie denn vor dem treffen der chefs der deutschen automobilkonzerne mit präsident trump in washington informationen über dieses treffen erhalten? wie weit war die bundesregierung im vorfeld dieses treffens einbezogen?"
5,12.12.2018,ID197000500,Angela,Merkel,CDU/CSU,Angela Merkel,"um mit dem dritten punkt zu beginnen: wir haben in der tat von diesem treffen gewusst. wir haben die automobilkonzerne darauf hingewiesen, dass es nur um bilaterale gespräche bezüglich investitionen in den vereinigten staaten von amerika gehen kann, weil alle handelsfragen durch die europäische kommission geregelt werden. ich habe auch selber mit dem kommissionspräsidenten über dieses treffen gesprochen. die deutsche botschafterin in den vereinigten staaten von amerika war auch anwesend. die handelsgespräche werden durch die kommissarin malmström geführt. sie sind initiiert worden durch jean-claude juncker nach dem g‑ -treffen im frühsommer dieses jahres; sie werden weiter fortgeführt. ich glaube, dass das auch sehr gut und vernünftig ist. insofern hoffe ich, dass wir keine weiteren eskalationen im handelsstreit sehen, sondern das langsam in formale verhandlungen überleiten. aber so weit sind wir noch nicht. die nächste frage stellt der kollege alexander graf lambsdorff, fdp."
6,12.12.2018,ID197000600,Alexander Graf,Lambsdorff,FDP,Alexander Graf Lambsdorff,"vielen dank, herr präsident. frau bundeskanzlerin, es gibt ja eine massive verunsicherung in sachen brexit. unsere mitbürgerinnen und mitbürger, die im vereinigten königreich leben, studierende, familien, sind verunsichert, wie es weitergeht. viele betriebe sind verunsichert, wie es weitergeht. warum geben sie morgen keine regierungserklärung dazu ab? es wäre wirklich angezeigt, hier ein bisschen, ich sage mal, ruhe und sicherheit in die debatte aus deutscher sicht zu bringen. die frage ist ja, womit wir rechnen müssen. wir rechnen damit, dass es vermutlich zu einem harten brexit kommt. die britische regierung hat handreichungen ausgegeben für ihre betriebe und ihre bürgerinnen und bürger, die auf dem kontinent leben; die bundesregierung hat das nicht getan. die europäische kommission hat so etwas getan; von der bundesregierung ist dazu nichts zu hören. ich glaube, es ist höchste zeit, dass die bundesregierung sich hier positioniert, für ruhe, sicherheit, planbarkeit sorgt. das würden wir uns sehr von ihnen wünschen. warum erklären sie das morgen nicht ein bisschen ausführlicher als hier in diesen kurzen fünf minuten, die sie gerade hatten?"
7,12.12.2018,ID197000700,Angela,Merkel,CDU/CSU,Angela Merkel,"ich glaube, dass wir regelmäßig darüber berichten, wie der stand ist. das tun wir auch heute in dieser fragestunde. wir haben heute zwei gesetze im kabinett verabschiedet, die sich mit steuerlichen fragen und auch fragen der sozialstandards beschäftigen, für den fall, dass es zu einem harten brexit, wie man sagt, kommen sollte. ansonsten setzen wir weiter darauf und ich habe da durchaus auch weiter die hoffnung , dass es zu einem geordneten austritt großbritanniens aus der europäischen union kommt. wir haben wenig zeit, aber wir haben noch zeit. die britische premierministerin war ja gestern da und hat gesagt, dass die abstimmungen spätestens bis zum . januar stattfinden sollen. sie wissen selber, auch aus der aktuellen berichterstattung, dass die dinge im fluss sind. ich kann den bürgerinnen und bürgern in deutschland nur sagen: wir arbeiten hart dafür, dass es zu einem geordneten brexit kommt, und wir bereiten uns parallel darauf vor, dass, wenn er nicht geordnet verläuft, dann auch alle sicherheiten durch rechtsetzung da sind, damit keine unbilligen härten entstehen. sie wollen eine nachfrage stellen? graf lambsdorff."
8,12.12.2018,ID197000800,Alexander Graf,Lambsdorff,FDP,Alexander Graf Lambsdorff,"premierministerin may war ja gestern bei ihnen zu besuch; das haben wir gesehen. sie ist ja dann auch aus dem auto herausgekommen. die frage, die ich jetzt an sie habe, ist ganz konkret: haben sie sie darauf angesprochen, dass ihre regierung, also die regierung von premierministerin may, die rechte von eu-bürgerinnen und eu-bürgern in großbritannien bei einem no-deal-szenario, also bei einem harten brexit, empfindlich beschneiden will? insbesondere will sie antragsfristen verkürzen und sieht eine wirklich scharfe diskriminierung binationaler ehen vor, also bei denen ein eu-bürger, beispielsweise ein deutscher, mit einer amerikanerin verheiratet ist und in großbritannien lebt. haben sie sie darauf angesprochen? ich glaube, das, was die britische regierung gerade plant, ist für viele ein echtes problem."
9,12.12.2018,ID197000900,Angela,Merkel,CDU/CSU,Angela Merkel,"das ist richtig. aber ich habe meine gesprächszeit gestern darauf verwendet, dass wir zu einem geordneten austritt großbritanniens kommen, bei dem all die dinge, die sie jetzt genannt haben, eben gerade nicht eintreten würden, weil das in dem austrittsabkommen sehr gut geregelt ist. die nächste frage stellt der kollege jürgen hardt, cdu/csu."
10,12.12.2018,ID197001000,Jürgen,Hardt,CDU/CSU,Jürgen Hardt,"frau bundeskanzlerin, sie haben vor einigen monaten auf der istanbuler konferenz viel kraft darauf verwendet, für die humanitäre situation und die bürgerkriegssituation in syrien eine lösung zu finden. es gibt einen waffenstillstand in der region idlib, der allerdings seitens der assad-truppen wohl regelmäßig gebrochen wird, und einen fahrplan für die schaffung einer verfassungsgebenden versammlung bis ende dezember. jetzt gibt es schwierigkeiten auf diesem weg. präsident putin hat in istanbul zugesagt, dass er seinen einfluss auf assad geltend machen wird, um ihn dazu zu bewegen, diesem prozess nicht im wege zu stehen. wir sehen dort wenig fortschritt. meine frage an sie: war das gegenstand beim g‑ -gipfel? oder haben sie im rahmen des g‑ -gipfels die gelegenheit gehabt, mit dem russischen präsidenten darüber zu reden und ihn darin zu bekräftigen, dass er an dieser absprache von istanbul festhält?"
11,12.12.2018,ID197001100,Angela,Merkel,CDU/CSU,Angela Merkel,"ich habe in meinem telefonat in dieser woche mit dem russischen präsidenten noch einmal über die situation gesprochen; es hat ja jetzt auch wieder ein treffen in astana stattgefunden. es geht, verkürzt gesprochen, ja darum, dass eine verfassungsgebende versammlung personell einmal durch die regimekritischen kräfte, einmal durch das assad-regime selbst und durch ein drittes drittel durch experten besetzt wird. die besetzung des dritten drittels gestaltet sich naturgemäß schwierig. es gibt fortschritte. wir sind noch nicht am ziel; aber die dinge sind im fluss. und ich habe mit freude gehört, dass es eine gewisse wahrscheinlichkeit gibt ich will jetzt hier keine sicherheiten verbreiten , dass bis zum jahresende vielleicht doch eine entsprechende besetzung möglich wäre. das wäre ein großer fortschritt. gesine lötzsch, fraktion die linke, stellt die nächste frage."
12,12.12.2018,ID197001200,Gesine,Lötzsch,DIE LINKE,Gesine Lötzsch,"vielen dank, herr präsident. in der abschlusserklärung des g‑ -gipfels wird ja über ein weltweit faires steuersystem gesprochen. darum möchte ich wissen: was hat die bundesregierung, was haben sie persönlich konkret unternommen, damit konzerne wie google, amazon und apple in europa und weltweit endlich fair und gerecht besteuert werden?"
13,12.12.2018,ID197001300,Angela,Merkel,CDU/CSU,Angela Merkel,"noch unter der ägide des finanzministers wolfgang schäuble ist das sogenannte beps-regime verabschiedet worden, das jetzt schrittweise eingeführt wird und das zu sehr viel größerer transparenz bei steuern und damit auch zu mehr gerechtigkeit führt. darüber hinaus arbeitet die oecd in richtung einer mindestbesteuerung. für uns wäre natürlich eine weltweite lösung auf diesem gebiet sehr, sehr wichtig. der finanzminister olaf scholz wird das auch bei den g‑ -verhandlungen ins zentrum stellen. wir haben mit frankreich vereinbart, dass wir bis ende wir haben im zweiten halbjahr ja die eu-präsidentschaft möglichst eine solche internationale regelung für eine mindestbesteuerung auf den weg bringen wollen. in der kombination mit beps wären wir dann einen gewaltigen schritt weiter. nachfrage?"
14,12.12.2018,ID197001400,Gesine,Lötzsch,DIE LINKE,Gesine Lötzsch,"ja. nun hat es ja schon viele ankündigungen gegeben, auch zu anderen steuern. die frage ist: wann werden sie zumindest für deutschland dafür sorgen, dass die konzerne, die hier große gewinne machen, auch entsprechend besteuert werden?"
15,12.12.2018,ID197001500,Angela,Merkel,CDU/CSU,Angela Merkel,"ich sage ja: das beps-regime wird jetzt eingeführt. es wird, glaube ich, auch weiter umgesetzt und soll spätestens weltweit gelten. darüber hinaus haben wir gesagt: wir setzen darauf, bis ende international zu versuchen, eine mindestbesteuerung einzuführen. am . januar wird es, wenn es nach deutschland und frankreich geht, eine eu-weite besteuerung geben. ich halte es für das beste, das auf der basis einer mindestbesteuerung zu machen. die kommission ist aber aufgefordert, noch einmal einen entwurf vorzulegen; denn wir sind mit der augenblicklichen besteuerung der unternehmen, wie sie im entwurf der kommission vorgesehen ist, nicht zufrieden, weil sie das deutsche unternehmensteuerrecht stark tangieren würde. franziska brantner, bündnis /die grünen, stellt die nächste frage."
16,12.12.2018,ID197001600,Franziska,Brantner,BÜNDNIS 90/DIE GRÜNEN,Franziska Brantner,"sehr geehrte frau bundeskanzlerin, war ein verlorenes jahr für europa. am beginn dieses jahres haben sie zusammen mit der spd einen aufbruch für europa versprochen. davon ist leider nicht viel übrig geblieben und das, obwohl die zustimmung für europa in deutschland so hoch ist wie noch nie: bei über prozent. ihre antworten auf die fragen der kollegin haben gerade gezeigt, was das problem europas mit ihnen, mit dieser bundesregierung ist. sie verkaufen trippelschritte als die große antwort. meine frage an sie ist: glauben sie denn wirklich, dass das, was sie gerade erwähnt haben, angesichts der herausforderungen, vor denen europa steht, angemessen ist? glauben sie, dass das ausreicht, um den sozialen zusammenhalt, eine faire besteuerung der digitalunternehmen wirklich voranzubringen? warum nutzen sie nicht die chance, mit frankreich wirklich ambitioniert voranzugehen? gehen sie voran! was hindert sie daran?"
17,12.12.2018,ID197001700,Angela,Merkel,CDU/CSU,Angela Merkel,"wir gehen mit frankreich ambitioniert nach vorne und werden auf dem gleichzeitig mit dem europäischen rat stattfindenden gipfelteil, der als euro-zonen-gipfel angekündigt ist, natürlich wegweisende beschlüsse fassen. es wird ein euro-zonen-budget geben. es wird die weiterentwicklung des esm um einen backstop geben. es wird die bankenunion ein ganzes stück vorangebracht, auch durch den abbau von sogenannten non-performing loans. wir haben unter sozialen gesichtspunkten gerade ein mobilitätspaket verabschiedet, das im bereich der spediteure natürlich gewaltige auswirkungen haben wird. wir haben eine vielzahl anderer regelungen getroffen, zum beispiel im bereich von forschung und investitionen. wir haben eine agentur zur förderung von sprunginnovationen in europa geschaffen. bei einer minute zeit für die beantwortung von fragen ist es mir natürlich nur möglich, bestenfalls ein halbes prozent dessen, was wir dieses jahr gemacht haben, darzustellen. nachfrage, frau kollegin?"
18,12.12.2018,ID197001800,Franziska,Brantner,BÜNDNIS 90/DIE GRÜNEN,Franziska Brantner,"ja. frau merkel, sie haben gerade den euro-zonen-haushalt erwähnt. sie kennen ja die beschlusslage. das ist zwar dem namen nach ein euro-zonen-haushalt, da ist aber in wirklichkeit noch kein geld drin. er hat deshalb keinerlei stabilisierende funktion. das ist aber, wie wir eigentlich alle wissen, notwendig, um für die nächste krise gewappnet zu sein. auch bei der digitalsteuer ist der fortschritt sehr klein; denn nur ein teil der unternehmen finanziert sich über werbung. von daher wirklich noch einmal meine frage: glauben sie, dass das angemessen ist? wir sehen, wie groß die fliehkräfte in europa sind. wir sehen die weltweiten herausforderungen. ist das auf der höhe dessen, was europa heute braucht?"
19,12.12.2018,ID197001900,Angela,Merkel,CDU/CSU,Angela Merkel,"ich kann nur sagen, dass deutschland und frankreich durch die meseberger beschlüsse sozusagen die weichen gestellt haben und dass es schon ausgesprochen schwierig ist, wesentliche bestandteile davon zwischen allen mitgliedstaaten, in diesem falle der euro-zone, überhaupt durchzusetzen. es geht ja nicht darum, dass deutschland und frankreich vorschläge machen, denen kein anderer folgt. dann sagen sie wieder, wir würden dauernd dinge machen, die wir dann nicht durchsetzen können. insofern ist es schon so, dass wir versuchen müssen, alle mitzunehmen. da ist ein euro-zonen-budget innerhalb der nächsten mittelfristigen finanziellen vorausschau genau die richtige antwort; denn das ist machbar. dieses budget dient der wettbewerbsfähigkeit und der konvergenz. das sind zwei ganz wesentliche dinge, die schon jacques delors in seinem bericht, als es um die einführung der währungsunion ging, genannt hat. da werden wir jetzt ein stück konkreter; und ich finde das gut. norbert kleinwächter, afd, stellt die nächste frage."
20,12.12.2018,ID197002000,Norbert,Kleinwächter,AfD,Norbert Kleinwächter,"werte frau bundeskanzlerin, sie werden über eine vertiefung der wirtschafts- und währungsunion beraten, über ihre heilige kuh euro, über eine politik, gegen die auch jetzt schon viele menschen in frankreich gelb gekleidet auf die straße gehen. warum? weil sie den kaufkraftverlust durch diese währungspolitik spüren. gleichzeitig haben sich die schuldenstände der länder nicht erhöht: frankreich prozent des bip, spanien , prozent, italien , prozent. daher frage ich sie: nehmen sie zur kenntnis und werden sie auf dem gipfel vertreten, dass die leute vor dieser macron/merkel’schen eu-dystopie davonlaufen? nehmen sie zur kenntnis, dass viele eu- und insbesondere euro-länder mit dem rücken zur wand stehen und dass es deswegen auch falsch ist, dass deutschland dafür haftet? nehmen sie zur kenntnis, dass es auch jederzeit von der ezb eine leitzinserhöhung geben kann, die dann diese länder noch weiter in gefahr bringt? und gestehen sie dann ein, dass es zeit ist, dass sie weg sind?"
21,12.12.2018,ID197002100,Angela,Merkel,CDU/CSU,Angela Merkel,"ich glaube, dass wir vieles unternommen haben und gerade jetzt, im zusammenhang mit der vollendung der bankenunion, auch dabei sind, das weiter zu tun, um das euro-system stabiler zu machen. wir bauen gleichzeitig risiken ab. deutschland vertritt eine politik, nach der der stabilitäts- und wachstumspakt einzuhalten ist. da sind wir heute sehr viel weiter als noch vor einigen jahren. ich darf sie darauf hinweisen, dass in den letzten jahren massiv arbeitslosigkeit in europa abgebaut werden konnte nicht ausreichend und dass wir alle wirtschaftswachstum hatten. das sind dinge, die ausgesprochen positiv zu bewerten sind. dass wir trotzdem weiter um unseren wohlstand kämpfen müssen, gerade in den bereichen forschung und innovation, ist notwendig aber nicht durch solch eine polemik. die nächste frage stellt der kollege christian petry, spd."
22,12.12.2018,ID197002200,Christian,Petry,SPD,Christian Petry,"frau bundeskanzlerin, ich möchte sie etwas zur europäischen säule sozialer rechte fragen. sie wissen, dass der binnenmarkt auf vier grundfreiheiten gegründet ist und dass es dringend notwendig war, die sozialen grundrechte zu stärken, sozusagen als soziale säule. deshalb wurde ja auf dem eu-gipfel von göteborg einiges wegweisendes vereinbart. das problem ist natürlich die umsetzung und die durchsetzungsfähigkeit dieser sozialen säule. vor diesem hintergrund möchte ich sie gerne fragen, welche vorhaben in diesem bereich für sie besonders wichtig sind und welche sie noch in dieser legislaturperiode in deutschland umsetzen möchten."
23,12.12.2018,ID197002300,Angela,Merkel,CDU/CSU,Angela Merkel,"ich will zwei dinge nennen. das eine ist das von mir schon kurz angesprochene mobilitätspaket. das ist etwas, was, glaube ich, im bereich des transportwesens von größter bedeutung ist für menschenwürdige arbeitsverhältnisse, vor allem im bereich der lkw-transporte. das war ein sehr schwieriges unterfangen, weil wir daran noch einmal gesehen haben, dass die lebensstandards innerhalb der europäischen union eben doch sehr unterschiedlich sind. wenn man sich zum beispiel die höhe des mindestlohns in bulgarien anschaut und mit der höhe unseres mindestlohns vergleicht, sieht man das. trotzdem haben wir hier etwas für eine ganze berufsgruppe getan. ich glaube, das war sehr wichtig. das zweite ist, dass beim rat der arbeits- und sozialminister in der vergangenen woche, glaube ich, eine einigung über eine europäische arbeitsagentur gefunden wurde, nicht in dem sinne, dass sie operativ tätig wird, aber in dem sinne, dass sie maßstäbe einführt, für gleiche standards sorgt und sich damit beschäftigt, wie man missstände beseitigen kann. auch das halte ich für einen strukturellen fortschritt. ich hoffe, dass wir bei beidem, insbesondere bei der europäischen arbeitsagentur, im trilogverfahren wirklich vorankommen werden. zusatzfrage?"
24,12.12.2018,ID197002400,Christian,Petry,SPD,Christian Petry,"herzlichen dank. genau zu diesem bereich hätte ich eine zusatzfrage, und zwar zu dem kapitel iii der beschlüsse von göteborg. das eine ist der aufbau einer nationalen arbeitslosenversicherung dort, wo dies noch nicht effektiv genug funktioniert, was absolut sinnvoll und notwendig ist. das andere ist der vorschlag, das über eine arbeitsagentur zu begleiten und darüber hinaus ein europäisches rückversicherungssystem zu installieren, um die nationalen arbeitslosenversicherungssysteme stabil genug für mögliche wirtschaftskrisen zu machen. daran schließt sich eine frage an, die sich auf den mindestlohn bezieht. den in bulgarien hatten sie gerade beispielsweise genannt. wir haben vonseiten frankreichs und luxemburgs jeweils beschlüsse gehört, den mindestlohn um euro pro monat zu erhöhen. dort sind die mindestlöhne bereits deutlich höher als in der bundesrepublik. sehen sie auch hier, in der bundesrepublik, einen nachholbedarf, den mindestlohn deutlich anzuheben, um die entsprechenden sozialen verwerfungen und schieflagen zu mindern?"
25,12.12.2018,ID197002500,Angela,Merkel,CDU/CSU,Angela Merkel,"erstens. ich glaube, dass wir in deutschland ein sehr gutes system haben. der mindestlohn wird ja auch bei uns steigen. ich glaube auch, dass die idee der kommission, die steigerung an den allgemeinen lohnzuwachs zu koppeln, gut ist. deshalb halte ich genauso das jetzige system für sehr nachhaltig. schauen sie sich unsere arbeitslosenrate an: sie gehört vor allen dingen bei der jugendarbeitslosigkeit zu den geringsten in ganz europa, und darauf können wir stolz sein. zweitens jetzt habe ich ihre erste frage vergessen. ach so. wie konnte mir das entgehen! hier gibt es unterschiedliche sichtweisen innerhalb der die koalition tragenden parteien. das kommt auch in ihrer fragestellung zum ausdruck. wir glauben, dass es wichtig ist, jetzt überall erst einmal eine arbeitslosenversicherung aufzubauen, auf die die menschen in europa auch ein anrecht haben. deshalb sehen wir schritte, um hier sozusagen zur vereinheitlichung bzw. zur stabilisierung durch solch eine rückversicherung zu kommen, im augenblick nicht als zielführend an. alexander graf lambsdorff, fdp, stellt die nächste frage."
