,datum,redeID,vorname,nachname,fraktion,name,inhalt_neu
60,24.03.2022,ID202506000,Andrea,Lindholz,CDU/CSU,Andrea Lindholz,"sehr geehrte frau präsidentin! meine sehr geehrten damen und herren! liebe kolleginnen und kollegen! investitionen in die sicherheit sie sind nicht immer populär, aber sie sind zwingend notwendig. deshalb hat auch schon die letzte bundesregierung unter der führung der union in den letzten acht jahren massiv in die innere sicherheit investiert. wir haben den haushalt des bundesinnenministeriums von , milliarden euro im jahr auf knapp milliarden euro im vergangenen jahr fast verdreifacht. es ist gut, frau ministerin, dass sie diesen weg weiter gehen; es ist gut, dass wir weitere aufwüchse sehen. und ich unterstütze ausdrücklich auch die wiedereinführung der ruhegehaltsfähigkeit der polizeizulage und sehe das als ein sehr gutes zeichen. zum thema bevölkerungsschutz will ich an dieser stelle aber kritisch anmerken ich werde dazu später noch kommen : das reicht leider bei weitem nicht aus. um sicherheit zu gewährleisten, brauchen wir neben geld auch weitsicht, und wir brauchen die bereitschaft, führungsverantwortung zu übernehmen. und das, liebe frau ministerin, vermisse ich an der einen oder anderen stelle. mit ihrem aktionsplan rechtsextremismus betreiben sie vor allem eines, und das ist augenwischerei. denn vieles aus dem plan hatten wir schon in der letzten legislaturperiode auf den weg gebracht. ich nenne hier das förderprogramm demokratie im netz oder auch den lagebericht über rechtsextremismus im öffentlichen dienst. um rechtsextreme netzwerke auch effektiv aufdecken zu können, brauchen die sicherheitsbehörden aber an moderne methoden angepasste befugnisse. es reicht nicht, dass ich den festnetzanschluss abhören oder sms-nachrichten lesen darf. wenn ein entsprechender verdacht vorliegt, dann muss es mir auch möglich sein, messengerdienste mit quellen-tkü und onlinedurchsuchung zu erfassen. da ist es eben nicht ausreichend, wenn wir hier keine entsprechenden befugnisse haben. bei der aufnahme der kriegsflüchtlinge aus der ukraine verweigern sie beharrlich die übernahme der führungsverantwortung in unserem land. nach wie vor kommen täglich teilweise mehr als frauen und kinder nach deutschland. seit wochen warnen polizei und helfer vor pädophilen und menschenhändlern, die dieses chaos ausnutzen. und trotzdem: es gibt zwar in der zwischenzeit endlich mehr präsenz der bundespolizei an den bahnhöfen, aber es gibt immer noch keine schutzzonen und keine geordnete aufnahme. und das geht einfach nicht. es gibt auch bis heute, trotz ihrerseits immer wieder vorgenommener ankündigungen, keine systematische registrierung bei der einreise, so wie es die polen machen. wir wissen eben nicht genau, wer in unser land kommt. die verteilung in unserem land funktioniert eben nicht reibungsfrei. sie muten hier den kommunen ganz massive belastungen zu. bei mir im wahlkreis ist gestern ein bus mit flüchtlingen angekommen, die eigentlich nach niedersachsen hätten fahren sollen. sie waren zutiefst verunsichert, sie waren verängstigt, und es war auch für die helfer vor ort eine sehr schwierige situation. vor drei tagen sind bei uns busse überhaupt nicht angekommen, obwohl die helferinnen und helfer stundenlang gewartet haben um dann kurz vor mitternacht zu erfahren, dass die busse gar nicht erst abgefahren sind. ich bringe das bewusst als beispiel; sie sind in berlin nicht abgefahren. es ist wichtig, dass wir den ehrenamtlern danken. aber, liebe kolleginnen und kollegen, sehr geehrte frau ministerin, damit frustrieren sie die ehrenamtler. dieses chaos müssen sie sofort abstellen! wir müssen wissen, wer kommt, und die kommunen vor ort müssen informiert sein. es braucht den nationalen krisenstab, und es braucht auch den nationalen flüchtlingsgipfel. und wenn sie hier schon nicht auf die union hören, damit verbesserungen eintreten, dann hören sie doch wenigstens auf die kommunalen spitzenverbände, die das fordern, auf die hilfsorganisationen wie die diakonie, auf die länder und auf ihre koalitionspartner; denn die alle wissen aus gutem grund, warum sie diesen gipfel fordern. das ist keine zeit des abwartens, das ist auch keine zeit für befindlichkeiten einer ministerin, sondern es ist eine zeit des handelns. bitte handeln sie hier endlich! wirklich große sorge bereitet mir der umgang der ampel mit dem bevölkerungsschutz. am dienstag sagte bundesfinanzminister lindner hier an dieser stelle ich zitiere aus dem protokoll : fraglos ist der zivilschutz im kern natürlich eine aufgabe der länder. nein, liebe kolleginnen und kollegen, das ist fraglos falsch. gemäß artikel absatz nummer des grundgesetzes ist der zivilschutz ausschließlich aufgabe des bundes, und der bund unterstützt die länder auch im katastrophenfall. da muss ich mich wirklich wundern: nach zwei jahren corona, nach der flut und jetzt nach der wirklich erschreckenden bedrohung durch russland ist diese ahnungslosigkeit des bundesfinanzministers in keinster weise mehr nachvollziehbar. sie fordern zu recht, dass die bundeswehr mit milliarden euro gestärkt wird. das ist gut, das ist richtig, und das ist wichtig. aber das bundesamt für bevölkerungsschutz ist mindestens auch wichtig, wenn nicht ebenso wichtig, weil es die zweite seite der medaille der äußeren und inneren sicherheit darstellt. das bundesamt für bevölkerungsschutz wird mit mickrigen millionen euro jetzt im zweiten entwurf zusätzlich gefördert. armin schuster, der präsident des bbk, hat angekündigt, dass er noch millionen euro braucht, um all das, was wir in der letzten legislaturperiode beschlossen haben, umzusetzen. er bekommt zusätzlich millionen. das ist viel zu wenig und reicht gerade einmal, um warn-sms zu versenden. sie investieren keinen zusätzlichen euro in sirenen, in die nina-warn-app, in die nationale reserve für trinkwasser, notstrom, gesundheit und notunterkünfte. liebe kolleginnen und kollegen, das ist fahrlässig. wir haben doch gesehen, was wir brauchen: wir brauchen ein resilientes deutschland. wir haben hier im vergangenen jahr, in der letzten legislaturperiode, die neuausrichtung des bbk mit seiner zentralstellenfunktion beschlossen. wenn sie wollen, dass dieses amt den anforderungen gerecht werden kann, dann braucht es, verdammt noch mal, eine bessere finanzielle grundausstattung; sonst schaden sie dem bevölkerungsschutz. ich bitte sie dringend, an der stelle nachzubessern dringend! ich will zum abschluss sagen: wenn sie es ernst meinen mit der zivilen verteidigung, mit der warnung, mit der neuausrichtung des bbk und seiner zentralstellenfunktion, dann brauchen wir für die nächsten zehn jahre ein sondervolumen von mindestens milliarden euro. deshalb bitte ich sie alle nachdrücklich: wir müssen an dieser stelle für einen zivilschutz und einen besseren bevölkerungsschutz in deutschland nachbessern. danke schön. vielen dank, frau kollegin lindholz. als nächste rednerin erhält die kollegin jamila schäfer, bündnis /die grünen, das wort."
61,24.03.2022,ID202506100,Jamila,Schäfer,BÜNDNIS 90/DIE GRÜNEN,Jamila Schäfer,"sehr geehrter herr präsident! liebe kolleginnen und kollegen! die herausforderungen der innenpolitik in den letzten jahren waren oft größer als der politische wille, sie wirklich anzugehen, seien es zum beispiel eine lösungsorientierte migrationspolitik, der kampf gegen rechtsextremismus oder ein wirksamer zivilschutz. es ist super, dass sie da jetzt mehr tun wollen. das hätten sie natürlich auch schon in den letzten jahren machen können. die neue regierung ist jetzt angetreten, um das zu ändern. wir wollen ein vorbereiteter und ein anpackender staat sein, und der vorliegende haushalt des innenministeriums zeigt das selbstvertrauen und auch den politischen willen zum anpacken schwarz auf weiß. in der migrationspolitik haben wir die ideologische sackgasse der letzten jahre endlich hinter uns gelassen, nämlich den trugschluss, dass die bekämpfung von migration politische handlungsfähigkeit sei. aber wer suggeriert, dass man in einer krisengebeutelten welt migration einfach so ausknipsen kann, der wird stets an der realität scheitern. um die herausforderungen wirklich anzupacken, müssen wir migration als realität anerkennen und selbstbewusst gestalten. die gesellschaft ist hier schon lange weiter, als die politik der letzten jahre es gewesen ist. die zivilgesellschaft war es doch, die wir schaffen das geschafft hat. aber darauf darf sich der staat jetzt natürlich nicht ausruhen. bund und länder dürfen die kommunen und auch die freiwilligen nicht im stich lassen. neben besseren strukturen für die erstaufnahme und versorgung geht es jetzt darum, allen bei uns ankommenden menschen mit integrationskursen und integrationsangeboten zur seite zu stehen. zu ihrer ausfinanzierung werden wir bis in den ergänzungshaushalt hinein das notwendige tun. frau kollegin, darf ich sie einen kleinen moment unterbrechen? ich würde gerne den justizminister und frau künast bitten, ihr gespräch außerhalb des plenarsaals fortzusetzen. die afd-fraktion hat sich schon beschwert, zu recht, dass sie gestört wird. und es ist auch optisch nicht sehr klug. frau kollegin, sie haben das wort. entschuldigung. noch ein versäumnis müssen wir korrigieren. während rechtsextreme gewalttaten immer mehr geworden sind und die radikalisierung antidemokratischer gruppen zugenommen hat, haben die innenminister in der vergangenheit oft weggesehen und verharmlost. aber diese verharmlosung hat rechten netzwerken viel raum gegeben und eine massive sicherheitslücke erzeugt. der nsu, die anschläge in halle, in hanau und auch der mord an walter lübcke sind nur die spitze des eisbergs des menschenverachtenden rechtsterrorismus in deutschland. aber ich kann ihnen sagen: die zeiten der bagatellisierung sind vorbei! diese bundesregierung übernimmt verantwortung und hat den kampf gegen rechtsextremismus endlich zur zentralen priorität deutscher innenpolitik gemacht. damit setzt ministerin faeser die richtigen schwerpunkte. vielen dank dafür! es ist gut, dass die experten und expertinnen unserer behörden und vor allem im bundesinnenministerium in diesem bereich vermehrt und verstärkt werden sollen. die bundeszentrale für politische bildung fördert die medienkompetenz, um fake news zu entlarven und die gesellschaftliche resilienz zu stärken. durch den kreml gesteuerte desinformations- und hasskampagnen im netz sind zu einem wahlbeeinflussenden faktor im westen geworden. deshalb ist jeder euro, der in projekte gegen rechtsextremismus gesteckt wird, ein beitrag zur internationalen widerstandsfähigkeit von demokratien, gerade im globalen systemwettbewerb, und das müssen wir weiter ausbauen. ich finde es sehr gut, dass wir im kontext von putins angriffskrieg jetzt endlich über den zivilschutz sprechen. das ist längst überfällig. das zeigten schon der fehlgeschlagene warntag und auch die flutkatastrophe im letzten sommer. die katastrophenhilfe und der zivilschutz wurden in den letzten jahren wirklich gefährlich vernachlässigt. das lag auch, ehrlich gesagt, daran, dass in der union oft sicherheit beim militär aufgehört hat, und genau dieses verkürzte sicherheitsverständnis ist ein sicherheitsrisiko. auch hier dürfen wir uns nicht auf der arbeit der ehrenamtlichen ausruhen; denn die funktioniert genau dann am besten, wenn es eine professionelle struktur gibt, die ansprechbar ist und die den überblick behält. thw, rotes kreuz und die freiwilligen feuerwehren haben immer wieder großartiges geleistet. aber wir brauchen ein starkes bundesamt für bevölkerungsschutz und katastrophenhilfe als zentrale koordinierungsstelle. ja, und geeignetes gerät und auch eine angemessene personelle ausstattung brauchen im haushalt eine entsprechende finanzierung. wir haben jetzt schon viel über die bundeswehr und deren stärkung gesprochen. aber im notfall ist es eben auch wichtig, dass wir unsere zivilbevölkerung im katastrophenfall schützen und auch versorgen können. also setzen wir die seit einem jahr vorliegende neuausrichtung des bundesamts für bevölkerungsschutz und katastrophenhilfe jetzt endlich in die realität um. ich komme zum schluss. darum würde ich bitten, frau kollegin. liebe kolleginnen und kollegen, wir dürfen keine angst vor den innenpolitischen herausforderungen der vergangenen jahre haben. der vorliegende haushalt gibt uns die mittel und den rahmen an die hand, um diese endlich anzugehen. nutzen wir sie! vielen dank. vielen dank, frau kollegin schäfer. nächster redner ist der kollege marcus bühl, afd-fraktion."
62,24.03.2022,ID202506200,Marcus,Bühl,AfD,Marcus Bühl,"herr präsident! sehr geehrte damen und herren! wenn man haushalt für innenpolitik und heimat hört, klingt das erst mal sehr gut. das hört sich nach steuermitteln für den schutz unserer heimat an und nach allen erforderlichen maßnahmen zur sicherheit unserer bürger. die realität, frau ministerin, sieht leider ganz anders aus, angefangen beim völlig unzureichenden grenzschutz, viel zu wenigen neuen bundespolizisten, mangelhaftem katastrophenschutz oder dem geplanten absinken des gesamthaushaltes. um bei den tragischen ereignissen der letzten wochen zu bleiben: die bundespolizei muss an den grenzen genau kontrollieren können, wer ein echter flüchtling und wer ein trittbrettfahrer ist. das leid der flüchtenden ukrainer darf nicht als einfallstor einer unkontrollierten einwanderung nach deutschland missbraucht werden. und jetzt, wo wir zeitweise so viele frauen, kinder und familien unterbringen, müssen endlich alle ausreisepflichtigen und abgelehnten asylbewerber der vergangenen jahre abgeschoben werden. frau minister, während polen vorbildlich flüchtlinge registriert, scheitert die deutsche regierungspolitik schon wieder an der konsequenten bekämpfung illegaler migration es mutet geradezu absurd an , unter anderem schlicht aus mangel an fingerabdruckgeräten und der möglichkeit des abgleichs unter den behörden. bereits wurde bekannt, dass mehr als prozent der ausländerbehörden fingerabdrücke nicht elektronisch abgleichen können; ein völlig unhaltbarer zustand. bleiben wir beim thema innere sicherheit . zusätzliche stellen bei der bundespolizei sind ein anfang, aber zuerst kommt die ausbildung und erst in drei jahren dann die eigentliche verstärkung. und vor allem: in den kommenden jahren geht jährlich ein beträchtlicher teil der beamten in den ruhestand. insofern ist die nettoverstärkung nicht groß, sondern kompensiert hauptsächlich die altersbedingten abgänge. erschreckend kommt hinzu, dass die mittelfristige finanzplanung bereits nächstes jahr ein absinken des haushalts des innenministeriums um , milliarden euro vorsieht. von den neuen polizisten, die dieses jahr bei der bundespolizei fertig ausgebildet sind, werden viele in ballungszentren mit hohen mieten versetzt, mieten, die sich die jungen polizeiabsolventen oft nicht leisten können und so wohngemeinschaften bilden oder lange strecken pendeln müssen. hier besteht dringender handlungsbedarf für eine lösung; und die lösung heißt nicht, dass die wohnungsfürsorge des bundes wohnungen in den ballungsgebieten zu den gleichen hohen mieten anbietet. kommen wir zu ein paar punkten bei der sachausstattung unserer sicherheitskräfte. die im letzten jahr gestartete und von uns in der letzten legislatur bereits intensiv unterstützte auslieferung des neuen modularen körperschutzes begrüßen wir ausdrücklich. es bleibt zu hoffen, dass die flächendeckende ausstattung zügig erfolgt. die umsetzung der vom parlament bereits im jahr beschlossenen umflottung der transporthubschrauber der bundespolizei schleppt sich dahin. eine vergabe des auftrags ist nach fast dreijähriger dauer noch immer nicht erfolgt. dabei müssen die fast jahre alten transporthubschrauber sehr dringend ersetzt werden. beim digitalausbau hinken wir anderen ländern um viele jahre hinterher. viel zu oft funktioniert der digitalfunk bei polizeilichen einsatzlagen nicht störungsfrei. bei den bereitschaftspolizisten der länder sind die ausrüstungen oft nicht kompatibel und gleichwertig, wodurch gemeinsame einsatzlagen mit der bundespolizei ganz erheblich erschwert werden. es gibt viel zu tun, frau ministerin. ich freue mich auf die kommenden haushaltsberatungen, in denen wir uns mit unseren anträgen für die innere sicherheit starkmachen werden, um deutschland vom kopf zurück auf die füße zu stellen. ich danke für ihre aufmerksamkeit. vielen dank, herr kollege bühl. nächster redner ist der kollege dr. thorsten lieb, fdp-fraktion."
63,24.03.2022,ID202506300,Thorsten,Lieb,FDP,Thorsten Lieb,"sehr geehrter herr präsident, willkommen zurück. wir haben sie vermisst. schön, sie wieder zu sehen! genau, finde ich auch. sehr geehrte frau bundesministerin faeser! verehrte kolleginnen und kollegen! vor wenigen tagen habe ich das gemeindezentrum der jüdischen gemeinde in frankfurt am main besucht. direkt neben dem gemeindezentrum befindet sich eine grundschule; auch eine kita ist dort untergebracht. das ist ein deutliches zeichen für die aktivität der gemeinde. aber jedes mal, wenn man da vorbeigeht, stellt man fest: die fortbestehende notwendigkeit von sicherheitseinrichtungen ist ausgesprochen erdrückend. immer wieder stelle ich mir die frage: wie fühlt sich das an für die kinder und jugendlichen, jeden tag in einer solchen situation in schule und kita zu kommen? dass sicherheitseinrichtungen leider weiter notwendig sind, zeigt eine aktuelle studie. es ist erschütternd, zu lesen, dass in diesem land rund ein drittel der jungen erwachsenen unter jahren antisemitisch denken. trotz aller anstrengungen ist es jahre nach dem ende des zweiten weltkrieges und dem holocaust nicht gelungen, das gespenst des antisemitismus endgültig aus diesem land zu vertreiben. deswegen sage ich eines klar: solange irgendeine jüdische einrichtung oder institution in diesem land noch diese art von sicherung benötigt, bleibt die bewältigung dieser zentralen herausforderung auf der tagesordnung; das muss uns klar sein. wir müssen alle gemeinsam mit aller kraft tag für tag gegen antisemitismus in diesem land kämpfen. ich bin der regierung und der ministerin ausgesprochen dankbar, dass das nicht nur ein lippenbekenntnis ist, sondern dass sich die notwendigkeit des handelns durch einen klaren fußabdruck im etat zeigt, nämlich insbesondere durch die konkret angekündigte ausfinanzierung der umfassenden maßnahmen, zum beispiel die mittel für prävention im umfang von mehr als millionen euro. ich freue mich sehr darauf, im rahmen der detaildiskussion gemeinsam dafür zu sorgen, dass die mittel effizient und zielgerichtet eingesetzt werden. liebe kolleginnen und kollegen, gerade das bundesministerium des innern zeichnet sich durch eine besondere vielfalt der aufgaben aus: gesellschaftlicher zusammenhalt und heimat, it und netzpolitik, verfassung, verwaltungsmodernisierung; die liste lässt sich fast unendlich verlängern. jedes dieser für unsere gesellschaft zentralen themen wäre wahrscheinlich eine eigene debatte wert; und in den kommenden wochen haben wir dazu reichlich gelegenheit. vor allem der ukrainekrieg und die offenen aufgaben im bereich des katastrophen- und bevölkerungsschutzes haben schon jetzt enorme auswirkungen auf den aktuellen etat. erste antworten sind im entwurf enthalten; dafür haben wir zu danken. aber uns allen in diesem saal muss, glaube ich, bewusst sein: die lage ist dynamisch, die lage wird sich weiterentwickeln, und natürlich können wir stand heute noch nicht abschließend sagen, wohin uns die reise führt. jeder, der anderes formuliert und glaubt und erwartet, wir müssten heute eine abschließende aussage treffen, hat die welt nicht verstanden; denn man kann nicht wissen, wie die lage sich entwickelt. gerade angesichts der fülle der aufgaben und der aktuellen herausforderungen ist es wichtig, sich zu fokussieren. ich zum beispiel werde mein augenmerk darauf legen, die vielzahl von programmen mit teilweise ähnlichen zielstellungen sehr genau auf den prüfstand zu stellen, um abschätzen zu können, ob wir die entsprechenden ziele auch erreichen. die anstehenden und dringend notwendigen digitalisierungsaufgaben betreffend sage ich mit über zehn jahren anwaltlicher erfahrung in it-projekten: wir müssen sehr genau hingucken; projekte neigen dazu, länger zu dauern und teurer zu werden. was wir aber als ampel wollen, ist, mit jedem eingesetzten euro in diesem bereich das maximum an digitalisierung und verwaltungsmodernisierung herauszuholen, liebe freundinnen und freunde. daneben muss der fokus es wurde schon angesprochen auf den aktuellen herausforderungen liegen. viele dinge ich gucke in richtung der union sind zu lange liegen geblieben. großen ankündigungen auf pressekonferenzen ist wenig bis gar nichts gefolgt. die jahre unter einem unionsgeführten innenministerium haben mehr offene baustellen und mehr fragen hinterlassen, als dass aufgaben erledigt worden sind; das ist doch die wahrheit. und sie hätten im ersten regierungsentwurf die chance gehabt, nachzuarbeiten; das ist jedoch unterblieben. wir als ampel packen das jetzt an. die millionen euro für das bbk sind genau richtig investiert, so können wir dort endlich einen sprung machen und nach vorne kommen. es wird höchste zeit; es darf uns kein fehlgeschlagener warntag mehr passieren wie . frau ministerin, das bundesministerium des innern trägt besondere verantwortung für den zusammenhalt der gesellschaft und für die sicherheit in unserem land. dafür haben sie meine, unsere unterstützung. ich freue mich auf die zusammenarbeit. herzlichen dank. vielen dank, herr kollege lieb. als nächster redner erhält das wort der kollege victor perli, fraktion die linke."
64,24.03.2022,ID202506400,Victor,Perli,DIE LINKE,Victor Perli,"herr präsident! meine damen und herren! durch den schlimmen krieg in der ukraine sind millionen menschen auf der flucht. tausende kommen jeden tag nach deutschland. wir erleben eine große welle der solidarität aus der bevölkerung und in den kommunen. alle, die sich hier einsetzen, haben große anerkennung und respekt verdient. herzlichen dank! dieser haushaltsentwurf wurde wegen des kriegsausbruchs dem parlament eine woche später vorgelegt. dafür haben wir volles verständnis. wir haben kein verständnis dafür, dass nicht ein einziger zusätzlicher euro bereitgestellt wurde, um die kommunen dabei zu unterstützen, die flüchtlinge jetzt gut zu betreuen. die städte und gemeinden müssen bei der unterbringung der geflüchteten komplett in vorleistung treten. dabei hat der bund eigentlich eine rücklage, die sogenannte flüchtlingsrücklage, um menschen in not zu helfen. ich habe mit mehreren bürgermeistern in meiner heimat gesprochen, in salzgitter und wolfenbüttel. sie sind unzufrieden. sie mieten wohnungen an, sie sorgen für integration, sie stellen personal ein; aber sie wissen nicht, was sie an unterstützung bekommen: nicht vom bund und nicht vom land. frau ministerin, warum haben sie mit diesem haushaltsentwurf keine soforthilfe bereitgestellt, um zu zeigen: wir gehen hier schnell voran, und wir möchten, dass sie alle mitmachen ? komplett aus der zeit gefallen ist, dass in diesem haushaltsentwurf kürzungen bei der integration vorgesehen sind, zum beispiel bei den integrationskursen. das muss zurückgenommen werden. sie haben angedeutet, dass es in diese richtung geht. das finden wir richtig. die mittel in diesem bereich müssen erhöht werden, genauso bei der migrationsberatung. wir bekommen briefe von den wohlfahrtsverbänden, in denen es heißt: wir brauchen jetzt dringend mehr unterstützung. wir brauchen handlungssicherheit. wir als linke finden, die müssen sie auch bekommen. mit blick auf den krieg stellen sich jetzt viele bürgerinnen und bürger fragen: wie gut sind wir eigentlich in einer notsituation, im ernstfall geschützt? wie ist der katastrophenschutz in meiner region aufgestellt? auch die coronapandemie und die hochwasserkatastrophe im letzten jahr haben gezeigt, dass es viel verbesserungsbedarf gibt. es war zum beispiel ein großer fehler das ist natürlich auch ein ausdruck der kaputtsparpolitik im neoliberalismus , dass man vielerorts die sirenen abgebaut hat. was für ein wahnsinn, dass man die jetzt wieder aufstellen muss. das war völlig falsch. wir haben auch keinen überblick, wo es welche warnmittel gibt. das muss dringend behoben werden. das hat herr seehofer oft angekündigt, und es ist nicht passiert. das darf nicht mehr vernachlässigt werden. wir brauchen ein update beim bevölkerungs- und katastrophenschutz. meine damen und herren, es ist erschreckend, dass inzwischen neonazis per haftbefehl gesucht werden. die nsu-mordserie, der terroranschlag eines nazis in hanau mahnen: es darf nicht weggeschaut werden, hier muss konsequent entwaffnet werden. frau ministerin, sie haben einen sehr ambitionierten plan vorgelegt, wie sie gegen nazistrukturen, gegen rassismus, gegen völkische ideologie vorgehen möchten. das begrüßen wir ausdrücklich, und wir werden sie dabei unterstützen, auch mit eigenen vorschlägen. ich hoffe, dass wir das in den haushaltsberatungen diskutieren werden, und freue mich auf eine gute zusammenarbeit und ein entschlossenes handeln. klare kante gegen rechts! vielen dank. vielen dank, herr kollege perli. als nächsten redner hören wir den kollegen martin gerster, spd-fraktion."
