,datum,redeID,vorname,nachname,fraktion,name,inhalt_neu
0,,,,,, ,
1,18.11.2021,ID20300100,Sabine,Dittmar,SPD,Sabine Dittmar,"sehr geehrte frau präsidentin! sehr geehrte damen und herren! gemeinsam mit den kolleginnen und kollegen vom bündnis /die grünen und der fdp haben wir in der vergangenen woche einen gesetzentwurf zur änderung des infektionsschutzgesetzes vorgelegt. wir haben intensiv darüber beraten, welchen gesetzlichen ordnungsrahmen wir für die kommenden monate der pandemiebewältigung benötigen und schaffen müssen. wir reagieren mit den notwendigen und rechtssicheren maßnahmen auf die sehr schwierige coronalage. sie, sehr geehrte kolleginnen und kollegen von der union, wollen allerdings an dem verfassungsrechtlich äußerst problematischen sonderrecht festhalten, das an die feststellung der epidemischen lage von nationaler tragweite gebunden ist. sie wollen, dass sowohl verfassungsrechtlich als auch epidemiologisch fragwürdige ausgangssperren und beherbergungsverbote oder die flächendeckenden schließungen von einzelhandelsbetrieben beibehalten werden. auch maskendeals wären weiter möglich, wenn ja, wenn sie politische verantwortung hätten. aber die übernehmen jetzt wir. wir erhalten das hohe schutzniveau, das wir gegen covid- in deutschland haben, nicht nur, sondern wir erhöhen es. und das ist auch dringend notwendig. die coronasituation in deutschland ist äußerst schwierig. neuinfektionen, volllaufende intensivstationen, in manchen regionen müssen covid- -patientinnen und -patienten in andere häuser verlegt werden, planbare operationen werden abgesagt. die belastung für das medizinische und pflegerische personal ist dramatisch. und genau deshalb, weil die lage so schwierig ist, brauchen die länder rechtssicherheit bei der anordnung ihrer schutzmaßnahmen, und diese rechtssicherheit schaffen wir mit dem vorliegenden gesetzentwurf. ich sage hier noch mal in aller ausdrücklichkeit: die länder haben mit dem vorgelegten gesetzentwurf mehr möglichkeiten des effizienten handelns als bei der aktuell noch gültigen rechtslage. die länder werden weiterhin bewährte instrumente zur anwendung bringen: g, g, g plus, kontaktbeschränkungen im öffentlichen und privaten bereich, personenobergrenzen, kontaktnachverfolgung. wir schaffen mit dem gesetz rechtssicherheit für g plus, und wir geben den ländern mit einer öffnungsklausel die möglichkeit für weiter gehende schutzmaßnahmen. zwingende voraussetzung hierfür ist der beschluss des jeweiligen landesparlamentes. damit können beispielsweise dann auch veranstaltungen abgesagt, diskotheken oder sonstige freizeiteinrichtungen vorübergehend geschlossen werden. und wir ermöglichen bundesweit einheitliche schutzmaßnahmen, die weit über die möglichkeiten hinausgehen, die die länder augenblicklich haben: g am arbeitsplatz, g im öffentlichen personen- und fernverkehr, besondere testpflichten für sensible einrichtungen, homeoffice. gleichzeitig sichern wir ab, dass das gesundheitsamt bei konkreten ausbruchsgeschehen einzelne schließungen anordnen kann, um das infektionsgeschehen einzudämmen. mit dem vorgelegten gesetzentwurf sorgen wir für rechtssicherheit und schützen die menschen, die am verletzlichsten sind. liebe bürgerinnen und bürger, vor uns liegen zweifelsohne anstrengende monate. das ist frustrierend. es könnte für uns alle so viel einfacher sein: einfacher, wenn mehr bürgerinnen und bürger geimpft wären, einfacher, wenn wir mit den auffrischungsimpfungen weiter wären. um vor die vierte welle zu kommen, müssen wir täglich mindestens , millionen menschen impfen. und das schaffen wir. das haben wir im sommer schon geschafft, und wir brauchen jetzt wieder einen gemeinsamen kraftakt. niedergelassene ärzte werden impfen. wir werden die impfzentren hochfahren; mobile teams werden zum einsatz kommen. die devise lautet: impfen, impfen, impfen! und mein dringender appell an die heutige konferenz der ministerpräsidenten und ministerpräsidentinnen: sorgen sie dafür, dass nicht nur beschlussvorlagen vorgelegt werden, sondern dass diese dann auch konkret umgesetzt und kontrolliert werden! abschließend kann ich ihnen, liebe kolleginnen und kollegen von der union, folgende anmerkung nicht ersparen: ihr antrag zur epidemischen lage ist fadenscheinig und durchsichtig. sie lassen sich von ihren freistaaten treiben, die schlusslichter bei der impfquote und spitzenreiter bei der inzidenz sind, die all die maßnahmen, deren wegfall sie jetzt so lautstark beklagen die flächendeckende schließung von betrieben, von schulen, von hotels , längst hätten anordnen können, es aber nicht getan haben. und selbst, wenn sie es jetzt erst täten, hätte die rechtsverordnung immer noch gültigkeit bis zum . dezember. kommen sie bitte zum schluss. gerne. werden sie also ihrer verantwortung als ehemalige regierungsfraktion gerecht, und hören sie auf mit dem politisch kleinkarierten klein-klein! denn wir bringen ein ausgewogenes gesetz zur abstimmung, um gemeinsam corona zu überwinden, und corona kennt keine ländergrenzen und keine parteigrenzen. ich bitte um zustimmung. entschuldigung, sie sind zu schnell heute, herr stracke. als nächster redner hat nun das wort für die cdu/csu-fraktion stephan stracke."
2,18.11.2021,ID20300200,Stephan,Stracke,CDU/CSU,Stephan Stracke,"vielen dank, frau präsidentin. meine sehr verehrten damen und herren! frau kollegin dittmar, sie werden mit ihrer rede und mit dem, was sie als gesetzentwurf vorgelegt haben, der dramatik der lage nicht gerecht. und für parteipolitik besteht an dieser stelle schon überhaupt kein anlass. die lage ist in diesem land hochdramatisch. die vierte welle hat unser land mit voller wucht erfasst, und wir steuern tatsächlich auf einen sehr schweren winter zu. die zahl der neuinfektionen liegt aktuell bei über , die sieben-tage-inzidenz deutschlandweit bei . unsere krankenhäuser stoßen doch in weiten teilen schon an ihre grenzen, intensivbetten sind belegt, es gibt einen engpass. wir sehen schon in einzelnen regionen, frau dittmar, verlegungen von patientinnen und patienten. planbare operationen werden letztendlich aufgehoben; sie werden verschoben. und auch unsere ärztinnen und ärzte, unsere pflegekräfte, die unglaubliches in diesem land leisten, stoßen an ihre belastungsgrenze. das ist die gesamte lage, vor der wir in diesem bereich stehen. und es sind ganz überwiegend die ungeimpften, die die intensivbetten belegen. deswegen bleibt richtig: impfen ist der weg aus der pandemie; es macht den entscheidenden unterschied. denn wer sich hat impfen lassen, hat einen höheren schutz vor einem schweren krankheitsverlauf, der schützt sich und andere vor ansteckung. und deswegen ist auch an dieser stelle hier noch mal mein appell an all diejenigen, die zweifel haben, die unentschlossen sind: bitte lassen sie sich impfen! das schützt sie und schützt unsere gesellschaft. das ist jetzt weiterhin notwendig. und für diejenigen, die bereits einen impfschutz haben, kommt jetzt die dritte impfung. das nimmt auch fahrt auf: , millionen haben die dritte impfung bekommen. hier bleibt noch einiges zu tun. die länder fahren hierzu die impfzentren hoch. wir brauchen auch hier alle kapazitäten, mobile impfteams, heimärzte, hausärzte, betriebsärzte, vieles mehr, um auch die bürgerschaft gezielt anzusprechen. aber neben dem impfen sind weitere schutzmaßnahmen erforderlich. wir müssen die zahl der neuinfektionen drastisch reduzieren, jetzt reduzieren. wir müssen die infektionsdynamik reduzieren, jetzt, und sie brechen. dazu trifft die links-gelbe koalition heute hier im bund ihre ersten politischen entscheidungen. und heute machen sie ihre ersten fehler. der erste fehler ist: sie verlängern nicht die epidemische lage von nationaler tragweite; das haben sie angekündigt. der zweite fehler: sie verkürzen den maßnahmenkatalog der länder. die zahlen gehen hoch, und sie reduzieren die maßnahmen. das kann nicht gut gehen. der dritte fehler. in dieser situation brauchen wir eine enge abstimmung zwischen den ländern und dem bund. dass das stattfindet, das hat die spd, das hat scholz, das haben die ministerpräsidenten vonseiten der spd verhindert. jetzt ist es gut, dass das zumindest heute erfolgt. aber es hätte viel früher erfolgen müssen. das zeigt: sie haben keinen plan für diese pandemie bzw. dafür, wie man dieser begegnen kann. wir stellen heute den antrag, die epidemische lage zu verlängern, weil sie flexible maßnahmen, den notwendigen passgenauen rahmen den ländern an die hand gibt. es ist das falsche signal, das sie an die bevölkerung aussenden, dass sie genau dieses bewährte rechtsinstrument, das wir in diesem bereich haben, nicht verlängern wollen, ohne not. es ist auch inhaltlich falsch, dies zu tun. sie schaffen ein neues sonderrecht. es zeigt sich, dass sie sich in dem bereich komplett verrannt haben. marco buschmann hat gesagt: wir geben den ländern einen kleinen katalog mit wenig eingriffsintensiven maßnahmen an die hand, um sicher und verantwortungsvoll durch den winter zu kommen. tatsächlich legen sie eine -grad-drehung hin, weil sie vieles wieder zurückgedreht haben doch wieder kontaktbegrenzung, doch wieder länderöffnungsklausel und doch wieder über die begrenzung hinausgehen, wo sie gesagt haben, sie würden ein übergangsrecht schaffen, das letztendlich begrenzt ist. in das alles haben sie sich komplett verrannt. und sie haben das letztendlich zwar geändert, aber nicht in dem maße, dass es für das, was vor uns steht, genügen kann. die länder brauchen einen wirklich passgenauen flexiblen rahmen. diesen verkürzen sie ohne not. das ist der falsche weg für deutschland. als nächste rednerin für die fraktion bündnis /die grünen hat katrin göring-eckardt das wort."
3,18.11.2021,ID20300300,Katrin,Göring-Eckardt,BÜNDNIS 90/DIE GRÜNEN,Katrin Göring-Eckardt,"frau präsidentin! liebe kolleginnen und kollegen! eine sehr berühmte deutsche bundeskanzlerin hat mal gesagt: mit dem kopf durch die wand wird nicht gehen. da siegt zum schluss immer die wand. und es wäre schon hilfreich, die wand zu sehen. es wäre schon hilfreich, die wand zu sehen, die sie nicht nur nicht eingerissen haben, sondern wo sie noch nicht mal verstanden haben, wo die tür ist. meine damen und herren, das, was gerade in unserem land passiert, in den krankenhäusern insbesondere, ist dramatisch, und es wird noch dramatischer werden; denn die infektionen können wir nicht zurückdrehen. es werden sich weitere menschen anstecken, werden erkranken, und viele schwer. mir macht das riesige sorgen. und ich sage sehr klar und bewusst: wir befinden uns in einer notsituation, die krankenhäuser ganz besonders, und darauf müssen wir reagieren, und zwar jetzt, und zwar konsequent, und zwar gemeinsam bund, länder, kommunen, bürgerinnen und bürger , und das ist das, was wir heute hier in diesem parlament besprechen, so wie es in der demokratie gut und üblich ist. natürlich könnte ich mich jetzt hierhinstellen und sagen, was alles nicht getan wurde, um gar nicht erst in diese situation zu kommen, herr stracke; denn die rechtslage, die sie hier einklagen, besteht ja. ich könnte fragen: seit wie vielen wochen und monaten hat denn eigentlich das coronakabinett nicht getagt? ich könnte fragen: wo ist eigentlich der große plan zum boostern, den man spätestens zu beginn des septembers hätte besprechen müssen, vom bund aus mit den ländern? ich könnte fragen: warum gibt es eigentlich nicht viel mehr und längst flächendeckend g oder von mir aus auch regionale lockdowns, die sie gefordert haben, die aber nicht stattgefunden haben? aber heute, meine damen und herren, an diesem tag erwarten die menschen in unserem land zu recht, dass wir uns hier zusammenreißen und handeln. es interessiert nämlich niemanden, keinen intensivmediziner und keine intensivmedizinerin und noch nicht mal den ungeimpften am beatmungsgerät, ob hier die einen opposition üben und die anderen sich anschicken, eine regierung zu machen. es interessiert niemanden, dass wir in einer zwischenzeit sind. vielmehr ist tatsächlich die einzige möglichkeit, die wir hier als parlament gemeinsam haben, zu handeln und verantwortung zu übernehmen, und das erwarte ich auch von ihnen, meine damen und herren. ich erwarte das übrigens auch bei den gesprächen mit den ministerpräsidenten und im bundesrat. eins nervt mich wirklich: wer die notsituation, in der wir jetzt gerade sind, mit dem rechtlichen konstrukt der epidemischen lage gleichsetzt, verkennt, worum es geht. denn wir sind nicht im jahre null der pandemie, wir sind im zweiten jahr; und wir wählen ein verfahren, das alles in sich hat, was es jetzt braucht: parlament, debatte, anhörungen von expertinnen und experten und wieder debatte und beschluss und dann den bundesrat, meine damen und herren. das ist das, was wir machen. das ist übrigens auch der unterschied zwischen ihnen und uns. wir sagen: diese parlamentsdebatte ist das a und o. es reicht nicht, hier nur die hand zu heben und zu sagen: wir haben eine epidemische notlage , sondern wir müssen uns hier auch tatsächlich damit auseinandersetzen, um welche maßnahmen es geht und welche wirksam sind. und herr brinkhaus kommt heute noch nicht mal an dieses pult! wir brauchen rechtssichere maßnahmen. bei einem zweidrittelanteil der geimpften kann man eben nicht handeln wie in einer zeit, als der impfstoff noch nicht mal für alle über -jährigen reichte. corona verschwindet doch nicht, wenn sie jetzt hier die epidemische lage von nationaler tragweite beschließen. corona bekämpfen wir durch maßnahmen und durch impfen. ich verlange von ihnen, dass sie sich dem stellen: welche maßnahmen sind zu ergreifen, und wie schaffen wir es mit dem impfen? das ist in vielerlei hinsicht die aufgabe, vor der wir alle gemeinsam und hoffentlich auch die länder stehen. das paket frau dittmar hat zu recht darauf hingewiesen beinhaltet deutlich mehr, als wir bisher hatten. homeoffice oder g: damit schützen wir die arbeitsplätze. wir schützen den öffentlichen verkehr mit g in den zügen. natürlich ist das kontrollierbar: mit stichproben, wie man das eben in solchen fällen macht. wir ermöglichen vieles weitere in den ländern. masken in schulen sollten selbstverständlich sein. wenn man in nordrhein-westfalen einerseits karneval feiern will und sagt: das war schon ganz prima , und andererseits übermorgen sagt: wir haben aber eine riesige notlage , dann ist das für mich jedenfalls nicht glaubwürdig, meine damen und herren. es ist möglich, überall auflagen auszusprechen. es ist möglich, veranstaltungen auch abzusagen. sie können jetzt sehr drastische maßnahmen ergreifen, auch in sachsen, auch in bayern. wir sind auf sie zugegangen und haben gesagt: solche maßnahmen haben einen längeren übergang. das haben wir auf ihre bitte hin im hauptausschuss für den zeitraum bis über den dritten advent hinaus beschlossen. dann muss es aber bitte auch gemacht werden, meine damen und herren, und zwar jetzt. wir brauchen einen schutzwall im öffentlichen leben und besonders dort, wo es um die kinder und jugendlichen geht. deswegen steht zum ersten mal in diesem gesetz, dass wir die pflicht zur berücksichtigung der situation von kindern und jugendlichen haben die pflicht! das heißt, jede maßnahme muss in zukunft daraufhin überprüft werden, wie kinder gegen corona geschützt werden und wie man dafür sorgt, dass schulen und kitas so lange wie möglich aufbleiben, meine damen und herren. wir sind in einer wahnsinnig schwierigen situation. es geht hier um gefahrenabwehr, und es geht nicht ohne impfen. ich hoffe sehr, dass der plan zum impfen den ländern sehr bald vorgelegt wird, dass wir als bund alles dafür tun, dass überall geimpft wird, wo es nur geht, angefangen bei den apotheken bis hin zu den mobilen impfteams. von ihnen, herr brinkhaus, herr dobrindt, von ihrer gesamten fraktion sie trauen sich ja heute noch nicht mal hierher ans pult verlange ich, mitverantwortung zu übernehmen. ich lade sie ein; ich lade die länder ein. und ich hoffe sehr, dass wir in diesem land zeigen: wir können gemeinsam in einer schwierigen situation verantwortung übernehmen, und es stiehlt sich niemand weg, wenn es dann wirklich unbequem wird. herzlichen dank. als nächster redner hat das wort für die fdp-fraktion dr. marco buschmann."
4,18.11.2021,ID20300400,Marco,Buschmann,FDP,Marco Buschmann,"frau präsidentin! meine sehr geehrten kolleginnen und kollegen! wir legen ihnen heute ein neues maßnahmenpaket zur bekämpfung von corona vor. dieses neue maßnahmenpaket tritt an die stelle eines alten maßnahmenpaketes. diesem alten maßnahmenpaket hätte man unterschiedliche namen geben können; es trägt nun mal den namen der epidemischen lage. das hat aber nichts mit der beschreibung der wirklichkeit zu tun. ein maßnahmenpaket bewertet man nach den rechtsfolgen und den instrumenten, die es enthält. wenn einige hier den eindruck erwecken, mit der auswechslung des maßnahmenpakets sei die botschaft verbunden, corona sei vorbei, dann will ich denen ein für alle mal noch mal klar sagen, was wir auch schon vor mehreren wochen gesagt haben: corona ist nicht vorbei und war nicht vorbei. corona war immer gefährlich, und es war immer unsere gemeinsame haltung, diese gefahr entschlossen zu bekämpfen. behaupten sie nicht das gegenteil, liebe kolleginnen und kollegen von der cdu/csu! die lage ist ernst, insbesondere dort, wo die impfquoten niedrig sind, wo die boosterquoten niedrig sind, und das ist schwerpunktmäßig nennen wir es mal beim namen insbesondere in sachsen und bayern der fall. deshalb kann man nur alle menschen in diesem land auffordern weil wir sehen, dass das impfen hilft : wenn sie noch nicht geimpft sind, lassen sie sich einen impftermin geben! wenn sie sich boostern lassen können, lassen sie sich boostern! ich kann nur alle verantwortungsträger in diesem land auffordern: tun wir alles dafür, dass alle personen, die medizinisch verantwortbar eine spritze setzen können, sich an einer nationalen impfoffensive beteiligen! das ist der weg aus der pandemie, meine damen und herren. die behauptung, dass das neue maßnahmenpaket die länder wehrlos dalässt, ist objektiv falsch. sie war es schon von anfang an, weil wir von anfang an sehr robuste maßnahmen auf rechtssichere beine gestellt haben. auch die praktisch relevanten maßnahmen wie beispielsweise g oder g oder die hygienekonzepte mit personenobergrenzen standen vorher auf rechtlich tönernen füßen. wir stellen sie jetzt auf rechtssichere füße. das ist ein fortschritt in der pandemiebekämpfung, meine damen und herren. wir haben das maßnahmenpaket erweitert. mittlerweile geht es sogar bis zu kontaktbeschränkungen im öffentlichen und im privaten raum. wer der meinung ist, dass das kein scharfes schwert gegen die pandemie sei, bei dem weiß ich nicht, wie man ihm helfen kann. wir haben effektive maßnahmen, um corona zu bekämpfen. behaupten sie nicht das gegenteil! das ist wahrheitswidrig, meine damen und herren. trotzdem hört und liest man ja immer wieder, es reiche nicht, wir würden den instrumentenkasten reduzieren, und das sei ein fehler; herr stracke hat es ja wieder gesagt. das sagen sie immer abstrakt. dann gehen wir doch mal näher ran: welche maßnahmen meinen sie denn? immer dann, wenn wir mit ihnen über die konkreten maßnahmen sprechen wollen, geben sie uns ja recht. sie geben uns recht. wollen sie verfassungswidrige ausgangssperren? helge braun sagt: nein. wollen sie den einzelhandel pauschal schließen? armin laschet hat gestern beim handelsverband deutschland erklärt: der handel ist kein pandemietreiber. recht hat er damit. also wollen sie ihn doch offenbar nicht pauschal zumachen. wollen sie bundesweit pauschale lockdowns mit schulschließungen und hochschulschließungen? hendrik wüst hat vor wenigen tagen im landtag nordrhein-westfalen erklärt, das sei eine bestrafung der bereits geimpften personen, die sich solidarisch gezeigt haben. sie geben uns auch da recht, meine damen und herren. liebe kolleginnen und kollegen von der union, ich könnte so weitermachen. in wahrheit haben sie in der sache keine argumente, die ihren abstrakten vorwurf, der instrumentenkasten sei zu wenig, belegen könnten. in wahrheit kämpfen sie auch nicht in der sache gegen corona. sie kämpfen gegen eine politische konstellation, die im werden begriffen ist. wir sollten aber heute nicht union gegen ampel stellen. es geht heute nicht um union oder ampel; es geht darum, unser land zu schützen. dafür stellen wir die richtigen maßnahmen zur verfügung, meine damen und herren. nächster redner: für die afd-fraktion tino chrupalla."
5,18.11.2021,ID20300500,Tino,Chrupalla,AfD,Tino Chrupalla,"frau präsidentin! sehr geehrte damen und herren! vor drei monaten appellierte ich in der debatte um die epidemische lage an dieses hohe haus zitat : bürger, die sich nicht impfen lassen wollen, sind keine impfverweigerer . sie nehmen das ihnen gegebene grundrecht in anspruch, selbst über ihre gesundheit und damit über ihr leben zu entscheiden. … eine impfentscheidung muss die individuelle entscheidung eines jeden bürgers bleiben. heute verhandeln wir die nächste änderung des vielschichtigen infektionsschutzgesetzes, diesmal von den voraussichtlich neuen koalitionsparteien eingebracht. aber wo sind eigentlich ihre wahlversprechen an die bürger geblieben, weg von der politik der verbote und für ein ende der völlig überzogenen maßnahmen? das ist ein spruch der fdp. liebe fdp, wo ist der wahlspruch geblieben? die ampelparteien machen anscheinend mit der panischen politik der letzten zwei jahre nahtlos weiter. herr lindner, sie haben gestern sogar eine impfpflicht nicht mehr ausgeschlossen. da sieht man: sie sind noch nicht mal in der regierung und schon das erste mal umgekippt. respekt! meine damen und herren, nun können wohl alle bürger davon ausgehen, dass sie von der alten und neuen bundesregierung sich vollends vom grundgesetz abgewendet haben und die faktische impfpflicht durch das parlament peitschen wollen. seit zwei jahren spalten die regierenden in der herzkammer der demokratie , wie sie dieses haus ja so gerne nennen, aktiv unsere gesellschaft. sie haben sich das feindbild der ungeimpften zu eigen gemacht, und diese sollen für alles verantwortlich sein, wie überfüllte krankenhäuser und steigende infektionsraten. aber ist es nicht verwunderlich, dass es nach einem jahr und einer impfquote von nahezu prozent keine entspannung im gesundheitswesen gibt? oder liegt es nicht doch an den politischen versäumnissen der alten bundesregierung? es wurden im vergangenen jahr krankenhäuser geschlossen, mehr als intensivbetten abgebaut, in sachsen nahezu , und es hat sich noch immer niemand um personellen nachwuchs im pflegebereich bemüht. herr spahn, warum haben sie betten abgebaut? antworten sie auf diese fragen! genau das alles sind rahmenbedingungen, um die wir uns hier zu kümmern haben, liebe kollegen. dafür können wir nicht die verantwortung an ungeimpfte bürger abgeben und diese endgültig zu sündenböcken machen. meine damen und herren, ich weiß, sie sprechen jetzt wieder von einer neuen und viel schlimmeren situation in der vierten welle. aber machen sie sich doch bitte bei den bürgern endlich mal ehrlich, und geben sie zu, dass sie sich mit ihren maßnahmen und empfehlungen verkalkuliert haben. fast religiös rufen sie die gesellschaft zur impfung auf. bekommen sie aber mit, dass die menschen da draußen dem nicht uneingeschränkt folgen möchten? ich denke, sie alle hier haben verstanden, dass die hoffnung, die sie in die impfstoffe gesetzt haben, zu groß war. das rki berichtet von mittlerweile impfdurchbrüchen, und wahrscheinlich ist die dunkelziffer noch viel höher. das heißt, die angebotenen impfungen sind nicht so zuverlässig und dauerhaft wie anfänglich erhofft. und ja, niemand konnte das wissen. nur: was ist die perspektive, die sie den bürgern aufzeigen? boosterimpfungen im halbjahrestakt oder einmal im quartal oder vielleicht eine aboimpfung? was aber ist beispielsweise mit der weiterentwicklung von wirksamen medikamenten? über eine sache sind wir uns jedoch einig: jede person, unabhängig vom sogenannten g-status, kann überträger des virus sein. aus dieser erkenntnis heraus sind die ‑g- oder ‑g-regelungen abzulehnen und eigentlich sinnlos. sie sind mindestens ein lockdown auf raten und sollen die bürger immer stärker unter druck setzen, sich impfen zu lassen. werte kollegen, wer als politiker mit solchen mitteln gegen das eigene volk kämpft, überschreitet maßlos die eigenen kompetenzen und beugt wieder unser grundgesetz. hören sie endlich auf, einzelne gruppen gegeneinander auszuspielen! sie erschüttern damit das vertrauen in unsere parlamentarische demokratie immer stärker. es liegt in unserer hand, ob die übermächtigkeit des staates heute ein ende findet. die bürger haben ein recht darauf, eigenverantwortlich handeln zu dürfen. vielen dank. als nächster redner für die fraktion die linke hat dietmar bartsch das wort."
