,datum,redeID,vorname,nachname,fraktion,name,inhalt_neu
51,18.11.2021,ID20305100,Martin,Hess,AfD,Martin Hess,"sehr geehrte frau präsidentin! verehrte kollegen! europa wird angegriffen, und migranten werden als waffe eingesetzt. wer polnische grenzschützer mit waffengewalt angreift, wer sie mit steinen bewirft, wer baumstämme verwendet in der absicht, befestigte grenzanlagen zu durchbrechen, wer also eine grenze mit gewalt stürmt, der ist kein flüchtling, der ist ein angreifer, und polen hat jedes recht, sich gegen diesen angriff zu verteidigen. hätte die bundeskanzlerin den mut gehabt, das zu tun, was polen jetzt macht, nämlich die eigene bevölkerung vor illegaler massenmigration und damit eben auch vor islamistischem terror, vor clankriminellen und vor gewaltverbrechern zu schützen, dann wären wir überhaupt gar nicht in dieser lage. die kanzlerin hat durch ihr versagen den einsatz der massenmigrationswaffe erst möglich gemacht. polen beweist, dass die aussage der kanzlerin, wir könnten unsere grenzen nicht schützen, eine lüge ist. deshalb: fangen wir endlich mit dem grenzschutz an! der schutz unserer außengrenzen ist die elementare grundlage für die sicherheit in europa. seit hat sich die zahl der terrortoten pro jahr in europa von auf erhöht. wer polen jetzt kritisiert oder gar, wie wolfgang schäuble, die gewalttätigen migranten in die eu holen will, der missachtet vitale sicherheitsinteressen der deutschen bevölkerung, und er sendet das fatale signal an jeden despoten, dass die massenmigrationswaffe erfolg hat. dies dürfen wir niemals zulassen! darf sich nicht wiederholen! deshalb müssen wir jetzt polen mit allen politischen und auch logistischen mitteln bei der verteidigung europas unterstützen. wir müssen ein klares politisches signal an die migranten senden, dass wir keine gewalttätigen grenzdurchbrecher in deutschland aufnehmen. und wir müssen vor allem anfangen, auch an unseren grenzen illegale migranten zurückzuweisen. wenn wir jetzt versagen, dann werden millionen weitere illegale migranten folgen. deshalb gibt es keine alternative: wir brauchen die festung europa. ich danke ihnen. nächster redner: für die spd-fraktion uli grötsch."
52,18.11.2021,ID20305200,Ulrich,Grötsch,SPD,Ulrich Grötsch,"vielen dank. sehr geehrte frau präsidentin! liebe kolleginnen und kollegen! seit unserer letzten befassung mit der durch lukaschenko absichtlich herbeigeführten migrationskrise an der belarussischen grenze zu polen gibt es keine entspannung. im gegenteil: die lage spitzt sich von tag zu tag dramatisch zu, sowohl zwischen den polnischen und den belarussischen einsatzkräften als auch für die menschen, die im wettlauf gegen die zeit im niemandsland ausharren. die bewusst herbeigeführte notlage von menschen als massenmigration und gefahr für europa zu titulieren, mit menschlichem leid also politik zu machen, menschen falsche tatsachen vorzuspiegeln, um daraus für sich selbst politisches kapital zu schlagen, den menschen in deutschland und europa angst zu machen, vermeintliche krisen zu provozieren oder aus krisen kapital zu schlagen, obwohl hilfe, humanität und ordnung das gebot der stunde wären, das ist die politik von herrn lukaschenko und das ist auch ihre politik, das ist die politik der afd auf allen ebenen, das verbindet sie mit einem diktator, der sein eigenes volk wegen der äußerung abweichender, freier meinungen einsperrt und foltert. mit keinem wort verurteilen sie das perfide spiel des belarussischen diktators in ihren anträgen. vielmehr unternehmen sie den kläglichen versuch sie eben auch wieder, herr hess , asylsuchende menschen, die unter vorspiegelung falscher tatsachen nach belarus gelockt wurden, als täter darzustellen. dabei sind diese menschen die opfer, und lukaschenko der täter. sie haben es eben noch einmal gesagt, und sie feiern auch in ihrem antrag die abschreckung durch die polnischen grenzbehörden ab und fordern, dass die strafverfahren der eu gegenüber polen sozusagen als belohnung dafür eingestellt werden. unterstützung dafür bekommen sie, wie immer in brandenburg, von rechtsextremisten und in den einschlägigen kreisen in den sozialen medien. wie immer dürfen sie sich auf die unterstützung von rechtsextremisten in ihren positionierungen verlassen wenn das mal kein zufall ist! aber zurück zum thema, liebe kolleginnen und kollegen; es ist ernst genug. meine fraktion hat in der letzten debatte eu-sanktionen gegen das regime in minsk gefordert, und diese hat außenminister heiko maas gemeinsam mit seinen kolleginnen und kollegen in der europäischen union auch beschlossen. von lukaschenko genutzte flugrouten wurden geschlossen, etwa aus dem irak oder der türkei. ich sage auch: gleichzeitig müssen wir natürlich weiterhin diplomatische schritte unternehmen. deshalb bin ich froh, dass frau merkel sich mit dem weißrussischen diktator in verbindung gesetzt hat, und jetzt geht es um vieles ich will meine redezeit nicht überziehen, frau präsidentin , das dürfen sie auch nicht. vieles, was wir in den nächsten wochen auch in aller gewissheit machen werden, und zwar immer in aller seriosität und mit ganz viel humanität. vielen dank. vielen dank, kollege grötsch."
53,18.11.2021,ID20305300,Mathias,Middelberg,CDU/CSU,Mathias Middelberg,"frau präsidentin! kolleginnen und kollegen! die anträge der afd sind abzulehnen; darüber brauchen wir im grunde gar kein weiteres wort zu verlieren. migranten hier erneut als waffe zu bezeichnen und die tatsache, dass sie in ihren anträgen das wort mensch an fast keiner stelle genannt haben ich habe jedenfalls keine gefunden; vielleicht berichtigen sie mich da , das disqualifiziert ihre anträge. ihr vortrag hat sich hier schon an sich disqualifiziert. aber die jetzt werdende koalition, das werdende links-gelbe bündnis das werdende links-gelbe bündnis; ich wiederhole es noch einmal ausdrücklich täuscht natürlich hier darüber hinweg, dass es selbst gar kein konzept für eine ausgewogene migrationspolitik für dieses land hat. ich zitiere ihnen nur zwei äußerungen: herr habeck hat vor drei wochen gefordert, dass wir die menschen an der belarussisch-polnischen grenze unmittelbar in die eu bringen müssten und in der eu verteilen sollten. herr maas dagegen hat am montag ausdrücklich gesagt: ich würde dafür plädieren, dass die menschen, die dort sind … in ihre herkunftsländer zurückgeführt werden. das ist ein widerspruch, den sie auflösen müssen. und das werden wir wahrscheinlich hier demnächst bei vielen debatten erleben: dass sie in der migrationspolitik sehr schwer übereinkommen werden. da sind wir auf die auseinandersetzung gespannt. eines muss in der situation jetzt klar sein: wir dürfen uns nicht erpressen lassen! es geht hier um ein humanitäres drama, es geht aber auch um einen politischen erpressungsversuch durch den belarussischen diktator. dieser erpressung dürfen wir nicht nachgeben! ansonsten werden demnächst diktatoren darüber entscheiden, wer wann und wie viele menschen in die eu einreisen dürfen. das kann nicht sein, das muss unsere entscheidung bleiben. das beispiel lukaschenkos darf auf gar keinen fall schule machen. letzte bemerkung und da bin ich dem kollegen grötsch dankbar, dass er das hier eben angesprochen hat : wenn wir aus gründen der menschlichkeit die furchtbare situation, in der sich die menschen an der grenze dort befinden, problematisieren und wirklich schnell und pragmatisch helfen wollen, dann darf es keine formalistisch-diplomatischen argumente geben. das sage ich in ihre richtung, herr nouripour weil sie das ja ausdrücklich kritisiert haben : ich habe großes verständnis und begrüße es ausdrücklich, dass unsere bundeskanzlerin den direkten kontakt gesucht hat. ich sehe darin keine diplomatische oder sonst problematische anerkennung, sondern hier geht es darum, dass wir schnell und wirksam hilfe organisieren, der unhcr und andere hilfswerke vor ort zugang bekommen, damit sie den menschen dort helfen können; darum muss es gehen, und dazu sind auch solche wege zu beschreiten. vielen dank, dr. middelberg. nächster redner: für bündnis /die grünen omid nouripour."
54,18.11.2021,ID20305400,Omid,Nouripour,BÜNDNIS 90/DIE GRÜNEN,Omid Nouripour,"frau präsidentin! meine damen und herren! die lage an den außengrenzen der europäischen union ist dramatisch. wir reden hier über eine massive humanitäre krise, und es kann niemanden kaltlassen, wenn in diesen zeiten menschen mitten in europa erfrieren, weil ihnen die notwendige hilfe verweigert wird. und ja, wir sehen, dass das eine große politische herausforderung für die europäische union ist und dass wir zusammenstehen müssen. die verantwortung dafür liegt beim diktator lukaschenko und im kreml; das muss man an dieser stelle klar benennen und deutlich adressieren. wir müssen dort vieles hinbekommen; das ist offensichtlich. die höchste priorität ist natürlich, den menschen zu helfen. muss man in dieser situation auch mit dem lukaschenko-regime sprechen? die antwort ist: ja. müssen wir derzeit mit den taliban sprechen, um noch menschen aus dem land zu holen, weil es nicht passiert ist, als es regulär hätte möglich sein können? ja. würde irgendjemand in der unionsfraktion auf die idee kommen, zu sagen, frau merkel solle bei den taliban anrufen? ich glaube nicht. das ist einer der gründe, warum es derzeit bei unseren nachbarn und partnern in polen, lettland und litauen massive irritationen gibt. im übrigen wäre es auch ein grund zur irritation, wenn die union in ihrem nächsten antrag zu diesem thema wieder präsident lukaschenko schreiben würde; das haben sie in ihrem letzten antrag nämlich gemacht. ich unterstelle mal, dass das ein versehen war. aber auf solche dinge muss man verstärkt achten. bitte unterlassen sie das; denn lukaschenko ist nicht der präsident von belarus; er hat die wahl gestohlen. nun hat frau merkel das gespräch gesucht; wir haben das kritisiert. jetzt gibt es gespräche. wir erwarten, dass jetzt nicht nur über die notlage gesprochen wird, sondern dass sie, die berechtigterweise auch im europäischen korps seit august letzten jahres das gespräch mit lukaschenko verweigert hat, in diesen gesprächen auch die freilassung der politischen häftlinge in dem land fordert. derzeit sind es so viele wie in den letzten jahrzenten nicht mehr. sehr viele wurden im letzten sommer verhaftet. wenn man mit den angehörigen redet, hört man, dass es ihre hauptsorge ist, dass sie in der jetzigen situation vergessen werden. dass diese menschen nicht vergessen werden, dazu könnte die frau bundeskanzlerin einen großen beitrag leisten. dass maria kalesnikava, sergej petruchkin und all die anderen endlich freigelassen werden, gehört jetzt genauso auf die tagesordnung. denn das ziel von lukaschenko ist doch, genau davon abzulenken. damit können wir ihn nicht durchkommen lassen. dass frau merkel unseren vorschlag von letzter woche, dass der unhcr jetzt die arbeit übernehmen soll, eingebracht hat, begrüßen wir. jetzt ist es notwendig, das zu ende zu denken. wenn der unhcr jetzt die anträge bearbeitet, den menschen obhut gewährt, dann wird es menschen geben, die als flüchtlinge anerkannt werden, die diesen status vom unhcr bekommen. dann kann man doch nicht, wie sie es gerade gemacht haben und wie es im übrigen der außenminister gemacht hat, von vornherein die aufnahme von flüchtlingen ausschließen. das ist einfach nicht konsistent. ich bin sehr dankbar, dass wolfgang schäuble gestern genau dies richtigerweise und mit den richtigen worten zum ausdruck gebracht hat. denn diese art, zu helfen, gehört dazu. das, was die eu-außenministerinnen und ‑minister in den letzten tagen beschlossen haben, ist gut. es ist richtig, dass die sanktionen weitergehen und verschärft werden; es ist richtig, dass jetzt die airlines angegangen werden. in diesem zusammenhang, kolleginnen und kollegen von der afd: wenn sie das, was sie gesagt haben, ernst meinen würden sie sind diejenigen, die zweimal zu assad gepilgert sind , dann würden sie auch zugeben, dass sehr viele menschen mit cham wings aus syrien nach belarus geflogen worden sind. der chef von cham wings ist rami machluf; er ist der cousin von assad und deswegen der reichste mann des landes. dass sie das ausblenden, zeigt, worum es hier eigentlich geht. die erpressung kann nur funktionieren, wenn wir hier vor angst in hypnose verfallen. genau dazu tragen sie bei, weil sie glauben, politisch daraus honig saugen zu können. das werden wir nicht zulassen. das wird die gesamte europäische union nicht zulassen; denn die europäische union ist und bleibt eine wertegemeinschaft, basierend auf rechtsstaatlichkeit, menschlichkeit und menschenrechten, die universell verbrieft sind. deshalb ist es notwendig, jetzt deutlich zu machen, dass wir an der seite unserer kolleginnen und kollegen in unseren partnerstaaten polen, lettland und litauen stehen, dass wir ihnen helfen, dass wir solidarisch sind, aber dass wir von ihnen natürlich auch verlangen, dass sie sich an recht und gesetz halten, ngos dorthin lassen, wo hilfe notwendig ist, journalistinnen und journalisten dort arbeiten lassen. das ist die europäische union; das macht die wertegemeinschaft aus, für die wir alle gemeinsam stehen, wenn wir demokratinnen und demokraten sind. vielen dank, omid nouripour. nächste rednerin: für die fdp-fraktion linda teuteberg."
55,18.11.2021,ID20305500,Linda,Teuteberg,FDP,Linda Teuteberg,"frau präsidentin! liebe kolleginnen und kollegen! gewogen, gewogen und für zu leicht befunden, so urteilte einst winston churchill in einer anderen historischen situation über das verhalten der westlichen demokratien. wir sind heute in einer anderen situation, aber in einer sehr schwierigen, die auch eine bewährungsprobe ist für die westlichen demokratien. es lohnt sich, darüber nachzudenken, mehr als einen gedanken darauf zu verwenden, dass geschichte der hintergrund aller politik ist. das gilt auch für die jetzige situation, und zwar aus mindestens zwei gründen: es handelt sich zum einen um eine form der hybriden kriegsführung. wir sollten dimension und kalkül dessen, was da passiert, wie stark das vorbereitet ist und worauf es zielt, nicht unterschätzen, und zum anderen gehört es auch zu den lehren aus unserer geschichte, keine politik zu machen über die köpfe unserer mittel- und osteuropäischen nachbarn hinweg, keine verträge zulasten dritter zu schließen, sondern in europa geeint vorzugehen, liebe kolleginnen und kollegen. dieser angriff auf die liberalen demokratien und freiheitlichen rechtsstaaten nimmt uns von zwei seiten in die zange. nämlich einerseits, indem er uns herausfordert, zu zeigen: wir sind anders, wir sind wertegebunden, wir sind anders als lukaschenko, wir nehmen nicht den tod von menschen in kauf. und andererseits, indem wir gefordert sind, zu zeigen, dass liberale demokratien handlungs-, problemlösungs- und durchsetzungsfähig sind und gerade nicht schwach und erpressbar, wie diktatoren und autokraten sie darstellen wollen. es gibt zwei arten, wie man in dieser situation der herausforderung nicht gerecht wird und das kalkül von diktatoren und autokraten aufgehen lässt: nämlich entweder wenn man sich den vorwurf von zynismus und menschenverachtung gefallen lassen müsste, weil man die menschenwürde nicht achtet, oder wenn wir den fehler machen würden, vorwürfe an polen oder die europäische union zu richten, wie es manche in der debatte tun, übrigens auch wenn man eine unterschiedslose aufnahme und verteilung in europa vertritt. wir müssen mit polen jetzt uneingeschränkt solidarisch sein, dafür sorgen, dass nicht der druck auf die polnische grenze verstärkt wird und dass das kalkül lukaschenkos nicht aufgeht. oberste priorität jetzt sind die hilfen für die in der kälte ausharrenden migranten. kein weiteres menschenleben darf verloren gehen; dafür müssen wir uns einsetzen. mittel- und langfristig brauchen wir aber eine europäische asyl- und außenpolitik; nur damit können wir solche situationen mittel- und langfristig verhindern. deshalb ist es jetzt wichtig, zu beobachten, was dort weiter an staatlicher schleusung stattfindet. der irak versucht heute, menschen in ihr heimatland zurückzuführen. aber das sind menschen, die am flughafen ausgeharrt haben. leider ist es so, dass es keinen grund zur entwarnung gibt. lukaschenko hält weiter menschen im grenzgebiet fest, nutzt sie als geiseln und lässt ihnen keinen rückweg. deshalb gibt es keinen grund zur entwarnung. nach meinem kenntnisstand ist die bundespolizei mit acht hundertschaften an der deutsch-polnischen grenze im einsatz, und es gibt dort auch eine enge und vertrauensvolle zusammenarbeit mit dem polnischen grenzschutz. man führt gemeinsame streifen durch. deshalb gibt es übrigens derzeit auch keinen anlass für stationäre grenzkontrollen. was wir brauchen, ist aufklärungsarbeit in den herkunftsländern, damit sich die menschen gar nicht erst auf diesen gefährlichen weg machen. wir müssen über die lügen und versprechen der schleuser aufklären. wir brauchen einen wirksamen außengrenzschutz übrigens nicht nur in sonntagsreden, sondern wirklich. das liegt im gemeinsamen europäischen interesse und ist eine gemeinsame europäische aufgabe, weil das die voraussetzung für freizügigkeit im innern ist. deshalb müssen wir uns daran auch finanziell beteiligen. schließlich geht es darum, dass wir jetzt genau dieser herausforderung gerecht werden. außenpolitisch ist mit den sanktionen zum glück bewegung hineingekommen, aber hier muss weiter druck ausgeübt werden. wir müssen rechtsstaatlich die kontrolle darüber gewinnen, wo wir geordnete asylverfahren durchführen. lassen sie uns zeigen, dass wir dieser herausforderung gerecht werden, dass liberale demokratien sensibel und robust, wertegebunden und wehrhaft gleichermaßen sind! vielen dank. vielen dank, linda teuteberg. nächste rednerin: für die fraktion die linke zaklin nastic."
56,18.11.2021,ID20305600,Zaklin,Nastic,DIE LINKE,Zaklin Nastic,"verehrte frau präsidentin! meine damen und herren! die polnische regierung sagt uns, wir müssen unsere grenze schützen, aber vor wem? , fragte mich mariusz, ein polnischer menschenrechtsaktivist, am samstag in der nähe der polnisch-belarussischen grenze. vor frauen, kindern und familien? , fragt er. mariusz rettet, wie viele polinnen und polen, seit monaten menschen vor dem tod in den polnischen wäldern und wird dafür von rechten in polen als vaterlandsverräter beschimpft, von denen, die wie die afd so tun, als würden wir überrannt, als würde es eines heldenhaften abwehrkampfes bedürfen, um die festung europa zu schützen. beim außenminister maas hört sich das leider auch nicht viel anders an, wenn er halberfrorene und hungernde menschen zurück in kriegs- und krisengebiete schicken möchte. wir linken sagen ganz deutlich: diesen menschen muss sofort geholfen werden. internationale beobachter, journalistinnen, hilfsorganisationen, ärzte müssen sofort ins grenzgebiet gelassen werden, und diese no-go-area, die da geschaffen wurde, muss sofort weg. an dieser grenze herrscht kein recht; es ist eine rechtsfreie zone. auch das sagte mir mariusz. die menschen werden von lukaschenko für seine schändlichen zwecke missbraucht. er sagt sich: das, was erdogan von der eu kriegt, das möchte ich auch. beide lehnen wir als linke grundlegend ab. wir lehnen aber auch die menschenschinderei der polnischen rechten regierung, für die die eu und auch die deutsche regierung jetzt plötzlich ihre herzen erwärmen, ab. die illegalen zurückweisungen müssen sofort beendet werden. die genfer flüchtlingskonvention muss geachtet werden. die grünen frage ich auch hier: steht eigentlich euer medialer krieg gegen putin und lukaschenko über allem, auch über geflüchtete? frau merkel muss telefonieren, und zwar für menschen, die aus ihrer heimat, wie dem jemen, dem irak oder eben aus dem norden syriens, von wo die kurden vor erdogan flüchten, fliehen müssen. fluchtursachen sind auch nato-kriege und deutsche rüstungsexporte. deswegen: stoppen sie endlich die rüstungsexporte an die saudi-arabische kriegsverbrecherkoalition, die den jemen zerbombt! stoppen sie erdogan und seinen verbrecherischen krieg gegen die kurden in syrien! kommen sie bitte zum schluss. fluchtursachen und nicht geflüchtete gehören bekämpft. danke schön, kollegin nastic. nächster redner: für die spd-fraktion frank schwabe."
57,18.11.2021,ID20305700,Frank,Schwabe,SPD,Frank Schwabe,"frau präsidentin! liebe kolleginnen und kollegen! verehrte damen und herren! weil der herr dr. middelberg schon gemutmaßt hat, was die neue koalition möglicherweise hier alles tun könnte: das können sie ja gar nicht wissen; denn das dürfen ja nur frau teuteberg und ich wissen, weil wir in dieser arbeitsgruppe waren, die darüber diskutiert hat, und die generalsekretäre uns gesagt haben, dass wir das nicht sagen dürfen. und wir halten uns daran. so viel kann ich ihnen aber doch sagen: das, was wir tun werden, wird sich ein stück weit einem realismustest unterziehen. wir werden nämlich in der realität des . jahrhunderts ankommen. das ist mit ihnen oftmals schwierig. wir wissen: es gibt migration; es wird sie immer geben. wir müssen menschen integrieren, wir wollen aber eben auch steuern. und erst dann, wenn man versteht, dass es migration und integrationsnotwendigkeiten gibt, können wir auch steuern. das werden wir, denke ich, am ende gemeinsam tun. das wäre im übrigen auch das, was die europäische union tun sollte und längst hätte tun können. dann wären wir jedenfalls besser auf die krise und auf die situation, die wir jetzt haben, vorbereitet. diese situation wurde das ist klar, und darin sind wir uns in diesem hause zum großen teil einig; bei manchen weiß ich es nicht, mit einigen sind wir uns, glaube ich, nicht einig durch lukaschenko, einen diktator in europa, verursacht, der das ganze nutzt, um zu versuchen, die europäische union zu erpressen. das ist der diktator, mit dem sie kuscheln, und deswegen kommt ihr antrag ein bisschen seltsam daher. ich muss das mal zitieren. es war frau weidel, die gesagt hat: hier aus allen rohren gleich mit sanktionen zu drohen, halte ich für einen völlig falschen weg. das war einen tag nachdem das flugzeug mit herrn protassewitsch entführt wurde. es ist derselbe diktator, der im moment versucht, die europäische union zu erpressen. es ist wichtig, darauf mit einer, wie ich finde, richtigen doppelstrategie zu reagieren. wir sagen: wir tun alles, damit diese erpressung nicht funktionieren kann. das können wir nicht zulassen; es kann niemand zulassen, dass so etwas geschieht. wir müssen alles tun, um diese route zu schließen. aber wir müssen gleichzeitig und das geschieht dann, wenn wir die route schließen können eine humanitäre lösung für gestrandete menschen finden. deswegen will ich herrn schäuble ausdrücklich dafür danken und vielleicht tut das auch die gesamte unionsfraktion , dass er deutlich gemacht hat, dass es uns eben nicht egal sein kann, was mit den menschen passiert, sondern dass wir eine humanitäre lösung für die menschen brauchen. das ist also ein doppelter ansatz: wir müssen diese route schließen das ist das, woran heiko maas und auch frau merkel im grunde genommen tag und nacht arbeiten und staaten und fluggesellschaften dazu bringen, menschen nicht weiter zu schleusen. gleichzeitig müssen wir aber auch eine humanitäre lösung anstreben und deutlich machen, dass auch polen internationales recht und die genfer flüchtlingskonvention achten muss und dass zugang für den unhcr, für das rote kreuz, für iom und für viele andere möglich sein muss. es kann doch wohl wirklich nicht sein, dass am ende menschen, die in die sackgasse, in die irre geführt worden sind, den preis dafür zahlen müssen, dass es diktatoren in europa gibt, die europa entsprechend erpressen wollen. wir können nicht menschen zur abschreckung sterben lassen. wir brauchen aber ein geordnetes verfahren, und dafür muss diese route geschlossen werden. das ist das, woran der außenminister und diese amtierende regierung tag und nacht auch arbeiten. vielen dank. vielen dank, frank schwabe. nächste rednerin: für die cdu/csu-fraktion dr. katja leikert."
