,datum,redeID,vorname,nachname,fraktion,name,inhalt_neu
29,09.12.2021,ID20602900,Silke,Launert,CDU/CSU,Silke Launert,"sehr geehrter herr präsident! liebe kolleginnen und kollegen! sehr geehrte damen und herren! manchmal glaubt man, man ist im falschen film. genau dieses gefühl hatte ich vorhin, liebe ekin, als ich deine rede hörte. worum geht es? ja, es stimmt: es geht zunächst um einen gesetzentwurf der union. der hintergrund ist: wir haben mitte letzten jahres in der wirtschaftskrise gesagt, wir müssten die konjunktur ankurbeln. was haben wir gemacht? da ein rechtsanspruch auf ganztagsbetreuung eh kommen soll, haben wir millionen euro als beschleunigungsmittel vorgezogen und haben den kommunen gesagt: kommt, kommunen, wenn ihr gleich investiert, kurbelt ihr die wirtschaft an. investiert! die gelder kommen eh. das war das signal. allerdings sollten diese mittel das war übrigens der wunsch von herrn scholz eng befristet werden. warum? konjunkturpaket bedeutet, nicht zwei jahre zu planen, sondern die mittel schnell auszugeben. der zeitplan war ambitioniert das war von vornherein klar , aber es war machbar. das ist sinn und zweck dieses konjunkturpaketes gewesen. die frist läuft dieses jahr aus. nun haben wir seit einigen monaten massive verzögerungen am bau, wodurch sich auch der mittelabruf verzögert. und deshalb kam der hilferuf der kommunen. wir haben ihn gehört, und wir haben ihn aufgegriffen. vor vier wochen haben wir eine verlängerung der fristen zur umsetzung dieser investitionsmaßnahmen im ganztagsbetreuungsbereich beantragt. diese beschleunigungsmittel soll es, wenn maßnahmen nicht bis ende dezember fertig werden, länger geben, am besten ein jahr, so wie sie es jetzt auch beantragt haben. aber was hat man gemacht? der gesetzentwurf wurde von der neuen mehrheit im parlament in die versenkung geschickt. wir haben hier vor drei wochen einen gesetzentwurf vorgelegt. und was hat man gemacht? man hat ihn abgelehnt. die kommunen haben uns angefleht und gesagt, sie brauchten planungssicherheit, das sei wichtig. trotzdem hat man ihn abgelehnt. und jetzt kommt es deshalb fühle ich mich im falschen film : warum hat man ihn abgelehnt? nicht, weil wir die bösen sind, nein, das argument war: wir machen es besser. man hat gesagt: eigentlich habt ihr recht, aber wir machen in ein paar wochen einen eigenen antrag; dann machen wir das besser, dann tun wir noch irgendetwas dazu. das ist schon unglaublich! faktisch heißt das: bei einer völlig berechtigten sache, einem so unglaublich wichtigen anliegen übrigens hat das der grüne ministerpräsident jahrelang blockiert, man glaubt es kaum; schade, dass die ehemalige familienministerin nicht da ist; die hätte das bestätigen können lassen sie die kommunen, die diese gelder brauchen, wochenlang hängen, nur weil es aufgrund der pandemie zu verzögerungen kommt. die machtdemonstration ist ihnen wichtiger als das anliegen. also ganz ehrlich! und dann ist wieder die union schuld. ich habe das gefühl: die fdp und die grünen haben noch nicht kapiert, dass sie verantwortungsvoll handeln müssen, dass sie in der regierung sind und nicht in der opposition. hier ging machtdemonstration über die sache. das war wirklich so. es ist eigentlich völlig lächerlich! dass sie das noch nicht einmal sehen, das ist das abstruse! noch dreister war dann das argument ich sage jetzt nicht, von wem es kam , schuld habe das kanzleramt, das habe die fristverlängerung blockiert. ich kann ihnen sagen: die mitarbeiter in der arbeitsgemeinschaft, die kanzleramtsmitarbeiter sie waren informiert sind im dreieck gesprungen. ich habe noch in der debatte die telefonische mitteilung gekriegt, dass das eine lüge ist. eine lüge! leider habe ich den rednern zugehört und nicht auf mein handy geschaut. sonst hätte ich das schon vor drei wochen klarstellen können. es wird mit unwahrheiten argumentiert. unglaublich! die sache aber ist völlig berechtigt. deshalb stimmen wir auch zu. wir stellen nicht parteipolitik über die sache. wir lassen die kommunen nicht hängen. das ist wichtig! sie brauchen planungssicherheit. wenn wir sie mit investitionsprogrammen locken, damit sie investieren, dann können wir sie nicht, nur weil es zu bauverzögerungen kommt, hängen lassen. deshalb werden wir zustimmen. bei uns stehen nicht die partei und die machtdemonstration über der sache. wir wollen weiterhin auf der seite der kommunen stehen."
30,09.12.2021,ID20603000,Ulrike,Schielke-Ziesing,AfD,Ulrike Schielke-Ziesing,"sehr geehrte damen und herren! sehr geehrter herr präsident! verehrte bürger! nach monatelanger untätigkeit der alten regierung haben wir seit gestern eine neue bundesregierung, eine regierung, die zwar groß verkündet, eine sogenannte zukunftsregierung zu sein, die aber offensichtlich die gegenwart komplett ausblendet und ihre prioritäten anderswo setzt. während nämlich die inflation in deutschland das höchste niveau seit fast jahren erreicht, macht man sich in der koalition gedanken über die freigabe von cannabis, eine feministische außenpolitik, die vergabe der staatsbürgerschaft an jeden, der nach deutschland kommt, usw. usf. der begriff inflation aber kommt im gesamten koalitionsvertrag ein einziges mal vor. dabei ist die preisexplosion, die wir gerade vor allem in deutschland erleben, das vergiftete erbe der merkel-koalition mit tatkräftiger unterstützung der grünen. steuern und abgaben sind in deutschland auf einem höchststand, und die ebenso sinnlose wie sündteure -bepreisung heizt die inflation an. für viele familien im land wird es ein schlimmes weihnachten werden, an dem man sich entscheiden muss, ob man zu hause heizen wird oder stattdessen lebensmittel oder geschenke kauft. die lage ist ernst und akut, doch die neue regierung nimmt sie nicht ernst. wir haben in deutschland derzeit eine offizielle inflationsrate von , prozent. was bedeutet das? alles wird teurer, richtig. aber auch das gesparte geld wird abgewertet, die altersvorsorgebeträge, alles verliert an wert , prozent in diesem jahr. wenn jemand beispielsweise euro auf der bank hat, dann sind diese euro im laufe eines jahres durch die inflation euro weniger wert. das sind die realen auswirkungen der inflation. reiche haben mit der inflation kein problem. sie haben in immobilien und aktien investiert, die mit der inflation mitwachsen. unternehmen haben mit der inflation kein problem, weil sie höhere erzeugerkosten einfach an die konsumenten weiterreichen. staaten haben mit der inflation auch kein problem. sie finden inflation sogar eine gute sache. schließlich verschwinden gleichzeitig mit den ersparnissen der eigenen bürger auch die eigenen schulden. es ist mir unbegreiflich, dass eine partei wie die spd, die sich doch in sonntagsreden stets um die sorgen der kleinen leute kümmert, dieses gewaltige problem einfach links liegen lässt. die ampel hat die kleinen leute verraten und verkauft. so hässlich ist das, und darüber müssen wir reden. wir müssen aber nicht nur reden, sondern wir müssen handeln, nicht irgendwann einmal in den nächsten jahren, sondern hier und jetzt. unser antrag zeigt, wie das geht. wir schieben dabei nicht geld von der linken tasche in die rechte, indem wir den leuten zuerst hohe steuern abnehmen und dann großzügig einen teil davon wieder verteilen, sondern wir entlasten die bürger sofort und merklich durch steuersenkungen: abschaffung der unseligen -steuer, damit energie nicht unendlich verteuert wird und ärmere familien nicht im winter in kalten wohnungen sitzen müssen, eine herabsetzung der umsatzsteuer für energie auf null prozent, damit die menschen, die das land am laufen halten, mit dem auto zur arbeit fahren können, eine anhebung des steuerlichen grundfreibetrages, damit dem fleißigen mittelstand mehr übrig bleibt. all das sind maßnahmen, die kurzfristig umgesetzt werden können und unmittelbar wirkung entfalten. lassen sie mich hier auch noch kurz über die rolle der europäischen zentralbank sprechen; denn wer über die inflation spricht, der darf die ezb nicht übersehen. die langjährige nullzinspolitik und die gelddruckorgien haben die voraussetzungen für die enteignung der deutschen sparer geschaffen. die haben nämlich die d-mark aufgegeben, weil man ihnen versprochen hat, dass der euro ebenso hart wird wie die d-mark. und statt dass jetzt die ezb diese menschen schützt, die ihr ihr ganzes erspartes anvertraut haben, erfüllt madame inflation lagarde pünktlich die wünsche der pleitestaaten im süden. dem muss einhalt geboten werden. verweisen wir die ezb auf den ihr nach den verträgen zustehenden platz! stellen wir uns gemeinsam schützend vor den deutschen sparer, und setzen wir endlich maßnahmen um, die die inflation wirksam bekämpfen! vielen dank. vielen dank, frau kollegin. als nächste rednerin hat das wort die kollegin cansel kiziltepe, spd-fraktion."
31,09.12.2021,ID20603100,Cansel,Kiziltepe,SPD,Cansel Kiziltepe,"herr präsident! liebe kolleginnen und kollegen! sehr geehrte damen und herren! es ist gut, dass wir heute über inflation sprechen. es ist ein thema, um das sich viele mythen ranken. dabei betrifft es alle. die rechtsaußenfraktion hat ausnahmsweise mal ein wichtiges thema aufgeschnappt. da hört es aber auch auf. auch eine kaputte uhr ist zweimal am tag richtig. liebe kolleginnen und kollegen, wir sehen an dem antrag, wie offenkundig fehlerhaft das vwl-grundwissen hier ist. die gedankenspiele um eine preisstabilität von null sind leider irreführend. inflation ist zu recht unbeliebt. wir merken sie an der tankstelle oder im supermarkt. die gefahr einer hohen inflation leuchtet vielen schnell ein. doch eine zu geringe inflation ist auch eine gefahr für die preisstabilität. dann kommt die deflation. sie destabilisiert das wirtschaftssystem, weil die schulden von selbst wachsen. es ist eine situation, in der ihr rucksack immer schwerer wird, ohne dass sie auch nur das geringste dagegen machen könnten. deswegen widerspricht ihnen wirklich jede notenbank der welt bei einem inflationsziel von null prozent, und ja, auch der scheidende bundesbankpräsident jens weidmann, dessen rücktritt sie für ihre schlechte argumentation nutzen wollen. liebe kolleginnen und kollegen, man muss die gefahren der inflation ernst nehmen, doch da helfen hektisch zusammengeschusterte maßnahmenkataloge wenig. sie bedienen einfach nur die ängste der menschen, ohne die ursachen der preisentwicklungen zu erklären. es wird von hyperinflation gesprochen, von ketchupflaschen oder dem fahren ohne bremse. dabei liegt die große gefahr darin, dass die sondereffekte überschätzt werden und die ezb zu schnell handelt. dann wären die jobs genau der arbeiterinnen und arbeiter in gefahr, denen sie hier scheinheilig zur seite stehen wollen. ihre falsche analyse und hysterie hilft niemandem weiter, doch damit ist ihr antrag großzügig gefüllt. nein, die inflation ist nicht einfach die schuld der ezb. sie suchen einfach einen sündenbock. doch die fakten sprechen eine andere sprache. das von ihnen verteufelte gelddrucken der ezb ist erstens ein komplett falsches bild, und zweitens hat eine steigende geldmenge nichts mit der inflation zu tun. sie verbreiten hier ideologische und veraltete ökonomische theorien. stattdessen steigen die preise durch probleme bei den globalen lieferketten, ein knappes angebot an gas, containern und halbleitern und einen anstieg der energiepreise. das kostet uns alle; aber die ezb kann keine chips herbeizaubern oder den gashahn mal wieder aufdrehen. wenn sie also tatsächlich ein ende der nullzinspolitik wollen, dann sollten sie sich für höhere löhne einsetzen, statt hier populistische sonntagsreden zu halten. wir wissen alle, dass ihre sozialpolitik nur ein feigenblatt ist, um ihre nationalistische politik zu kaschieren. ihre strategie ist es, den menschen mit gruselmärchen über inflation angst zu machen. unsere politik ist eine andere. wir wollen menschen eine perspektive mit höheren löhnen und einer ehrlichen klimapolitik geben. wir erhöhen den mindestlohn, sichern die rente, bekämpfen den klimawandel auf breiter front. dafür stehen wir als spd und als ampelkoalition. vielen dank. vielen dank, frau kollegin. als nächster redner erhält das wort der kollege dr. hermann-josef tebroke, cdu/csu-fraktion."
32,09.12.2021,ID20603200,Hermann-Josef,Tebroke,CDU/CSU,Hermann-Josef Tebroke,"herr präsident! liebe kolleginnen und kollegen! meine sehr verehrten damen und herren! preise sind nicht stabil. sie schwanken auch wegen angebot und nachfrage, und wenn sie im zeitverlauf leicht ansteigen, ist das auch nicht schlimm, ganz im gegenteil. in den letzten jahren haben wir in der bundesrepublik deutschland sowohl in d‑mark- als auch in eurozeiten inflationsraten zwischen prozent und prozent gesehen, in den letzten jahren nahe prozent. nehmen wir das jahr : da waren es , prozent aufs jahr gerechnet, natürlich vor allem auch wegen der pandemie und der maßnahmen, die wir gegen die pandemie ergriffen haben. jetzt erholt sich zum glück die wirtschaft mit einigem ruckeln, und die preise steigen ebenfalls. für das jahr rechnen wir mit gut , prozent; für das jahr werden , prozent angenommen. das ist in der höhe also weder ungewöhnlich noch unerwartet. selbst eine monatsrate von etwa prozent ist nicht unerwartet; das haben wir schon gesehen. wichtig ist der trend, der sich da abzeichnet, und auch, dass wir uns fragen, was genau dahintersteckt. das heißt: welche preise genau sind gestiegen? was sind die faktoren, weswegen sie gestiegen sind? wie lange dauert die wirkung dieser faktoren an? und vor allem: wer ist betroffen? wenn private haushalte, zumal solche mit niedrigem einkommen, sich sorgen machen, dann müssen wir das ernst nehmen. aber das machen wir nicht, indem wir sie weiter verunsichern und verängstigen und wohlfeile, vermeintlich schnelle hilfen anbieten. das ist unseriös, und das ist auch populistisch, zumal wenn die maßnahmen möglicherweise unzulässig, nicht umsetzbar, nicht zielgenau, nicht effizient sind oder wenn sie längst gefordert sind oder in teilen auch schon umgesetzt werden. alles das finde ich leider überwiegend in dem vorliegenden antrag. den lehnen wir also ab. so ist es nach dem unionsrecht unzulässig, die umsatzsteuer auf energie auf null zu setzen oder das -emissionshandelssystem abzuschaffen oder die energiesteuer gänzlich auf null zu setzen. auch lehnen wir aus grundsätzlichen erwägungen die abschaffung der -bepreisung ab, genauso wie wir es ablehnen, der mindestlohnkommission vorgaben zu machen oder sogar eine ad-hoc-anpassung des mindestlohns vorzunehmen. unsere unterstützung findet vielleicht die anpassung der steuerlichen grundfreibeträge und auch der eckwerte, aber nicht pauschal, sondern im hinblick auf die inflation, um die es hier geht. das haben wir zuletzt in der alten koalition mit dem zweiten familienentlastungsgesetz gemacht; allerdings sind wir da von , prozent inflation ausgegangen. jetzt erwarten wir natürlich eine nachbesserung durch die koalition, die jetzt neu im amt ist. zu der reform der energiebesteuerung haben wir in grundsätzlichen zügen und in anderen und weiteren zusammenhängen viele vorschläge gemacht, etwa die reduzierung der stromsteuer und natürlich auch die abschaffung der eeg-umlage. insofern kann ich hier sagen: da sind wir längst unterwegs. meine damen und herren, natürlich müssen wir uns als politik mit der inflation, den ursachen und den wirkungen befassen nicht nur für unternehmen und wirtschaftsbereiche, sondern eben auch für private haushalte. das machen wir als union das machen wir schon lange , und das werden wir auch in zukunft machen. es wäre viel wichtiger und ergiebiger, uns nicht mit der diskussion solcher fragwürdiger schnellschüsse befassen zu müssen, sondern uns grundlegender, intensiver und ehrlicher gedanken darüber zu machen, wie wir uns gegen unerwünschte effekte der geldentwertung schützen können. wie kommen wir raus aus der pandemie? sicher nicht, indem wir das coronavirus weiter leugnen, sondern indem wir uns impfen lassen. wie erreichen wir eine reduzierung der inflationsrisiken anfälliger lieferketten? wie kontrollieren wir die entwicklung der energiepreise? und nicht zuletzt: wie fördern wir inflationsgeschützte vermögensbildung, gerade auch einkommensschwacher haushalte, etwa durch bildung von wohneigentum und dergleichen mehr? auf die debatte zu diesen aufgabenstellungen freuen wir uns als opposition. herr kollege, kommen sie bitte zum schluss. den antrag der afd lehnen wir ab. vielen dank, herr kollege tebroke. als nächste rednerin erhält das wort die kollegin lisa paus, fraktion bündnis /die grünen."
33,09.12.2021,ID20603300,Lisa,Paus,BÜNDNIS 90/DIE GRÜNEN,Lisa Paus,"herr präsident! meine damen und herren! die bild -zeitung bläst zum sturm: der teuer-schock! , in xxl, und die afd verlängert das mit ihrem antrag bis hier in den deutschen bundestag. das ist einfach nur infam. ja, es ist so: im vergleich zum november sind die preise im monat november um , prozent gestiegen. die , prozent sind aber weit weg von einer xxl-inflation oder gar irgendeiner hyperinflation. eine ähnlich hohe inflation hatten wir übrigens sogar noch in den -jahren; in den -jahren hatten wir sie eigentlich ständig. herr tebroke hat schon darauf hingewiesen: in diesem jahr sind das gar nicht wirklich , prozent das ist völlig irreführend , sondern wir liegen im jahr bei einer inflationsrate von unter prozent. ja, das sind mehr als prozent das ziel der ezb , aber, ehrlich gesagt, angesichts der ganzen effekte der deflation, die wir letztes und vorletztes jahr hatten ist das erstaunlich wenig, wenn man eben auch bedenkt, dass die mehrwertsteuer wieder auf prozent erhöht worden ist, dass die lieferketten immer noch brüchig sind und dass auch die energiepreise nachholend wieder gestiegen sind. es ist richtig: das eine prozent ist nicht nichts. das müssen wir auch weiter beobachten, aber das ist weit weg davon, irgendwelche hysterien auszulösen. richtig ist auch: wir müssen schauen, ob wir das für die schwächsten abfedern müssen. was sie von der afd hier vorschlagen, ist aber das gegenteil von dem, was wir jetzt brauchen; denn sie setzen mit all diesen maßnahmen, die in ihrem antrag stehen, einfach die lohn-preis-inflationsspirale so richtig in gang. das ist das gegenteil von dem, was wir brauchen. sie treiben also die inflation mit ihrem antrag in die höhe und bewirken das gegenteil. frau schielke-ziesing hat gerade ja noch mal deutlich gemacht, dass die ezb wieder schuld ist, und laut ihrem antrag ist natürlich auch die neue bundesregierung schuld. in einem punkt bin ich sehr dankbar dafür, herr tebroke, wie sie hier heute gesprochen haben. leider hat herr linnemann auch aus ihrer fraktion sich deutlich anders geäußert. ich würde mich sehr freuen, wenn sie mit herrn linnemann noch mal sprechen könnten; denn er spricht von kalter enteignung der sparer und davon, dass frau lagarde dringend mal die politik ändern muss. das ist was anderes als das, was sie heute gesagt haben, und deswegen würde ich mich freuen, wenn die unionsfraktion insgesamt zu dem schluss kommen würde, den sie hier heute angekündigt haben. wir alle miteinander wissen: selbst wenn die ezb jetzt kurzfristig reagieren würde und sie wissen, die ezb muss ihre politik mittelfristig ausrichten , wäre erst in gut zwölf monaten ein entsprechender effekt zu sehen. und auch alle die, die nun fragen: die amerikaner machen das doch jetzt; warum macht die ezb das nicht? , haben wohl nicht mitbekommen, dass die amerikaner vor einem guten jahr auf einem wesentlich höheren inflationsniveau waren als wir. deswegen ist es richtig, dass die fed jetzt reagiert. in der europäischen union ist die situation aber völlig anders, und deswegen reagiert die ezb aktuell völlig angemessen. sie hat es im blick, wird aber nicht kurzfristig hyperagieren. auch wenn der wirtschaftsweise der cdu was anderes behauptet: der sachverständigenrat der ehemaligen bundesregierung hat noch mal deutlich gemacht, dass er davon ausgeht, dass der inflationsanstieg vorübergehend ist und dass zum jahresbeginn der sondereffekt der reduzierten mehrwertsteuer ausläuft, dass die inflation insgesamt aber wahrscheinlich weiterhin erhöht sein wird, weil wir eben mit corona noch nicht durch sind und die krise wieder in vollem gang ist. das führt wahrscheinlich zu weiteren lieferengpässen und anpassungen der energiepreise. wir müssen das ist die kunst das schlimmste verhindern und dürfen gleichzeitig die lohn-preis-spirale, die die afd anheizen will, nicht aus dem blick verlieren. schauen wir mal in den koalitionsvertrag, was er für dinge vorgesehen hat, und da finden wir, dass der instrumentenkasten dafür schon vorhanden ist. im koalitionsvertrag verankert ist: kein mensch wird in zukunft aufgrund der vereinbarungen der ampel aus der wohnung fliegen. der heizkostenzuschuss wird einmalig erhöht, auch um dem entgegenzutreten. bevor eine kindergrundsicherung in ganzer schönheit eingeführt wird worauf ich mich sehr freue , werden wir einen sofortzuschlag auch für den kinderregelsatz einführen, um eben den ärmsten kindern in diesem land entsprechende unterstützung zu geben. und wir werden auch einen mindestlohn von euro einführen, der für mindestens prozent der beschäftigten zu einer entlastung führen und sehr gut gegen die inflation wirken wird. sie können sich wirklich auf die jetzige koalition verlassen. bitte vertrauen sie uns! wir werden beobachten und das ganze mit augenmaß so gestalten, dass solche vorschläge, wie die von der afd, hier keinen platz haben. danke. vielen dank, frau kollegin paus. nächste rednerin ist die kollegin jessica tatti, fraktion die linke."
34,09.12.2021,ID20603400,Jessica,Tatti,DIE LINKE,Jessica Tatti,"sehr geehrter herr präsident! liebe kolleginnen und kollegen! wie geht es ihnen eigentlich beim lesen von afd-anträgen? mich packt da immer eine leicht morbide spannung. was kommt diesmal: völkisch-national, frauenfeindlich oder irgendwie verschwurbelt? diesmal tut die afd zumindest so, als ob sie sehr besorgt wäre wegen der in der tat wachsenden sozialen ungleichheit durch die hohe inflation. daraus folgen dann aber ziemlich skurrile vorschläge. für die afd ist es sozial, wenn die besitzer von spritfressenden luxusautos mehr profitieren als die fahrer von kleinwagen. für die afd ist es sozial, wenn die bewohner von großen villen, die viel beheizte wohnfläche haben, mehr profitieren als familien in beengten mietwohnungen. für die afd ist es auch sozial, wenn wohlhabende mit mehr als euro zinserträgen weniger steuern zahlen müssen, während leute, die nichts auf der hohen kante haben, leer ausgehen. das ist unsozial, das ist wirtschaftspolitischer unsinn; denn die afd entlastet leute mit viel geld viel stärker als die mit niedrigen und mit mittleren einkommen. aber letztere leiden doch am meisten unter dem verlust der kaufkraft. das ist also ein komplett falscher weg. die afd ist eben nicht, auch wenn sie es noch so oft behauptet, die partei der kleinen leute. es ist die linke, die konsequent für höhere löhne und sozialleistungen gekämpft hat. die ampelregierung ist mit dem anspruch des sozialen fortschritts angetreten. machen sie jetzt etwas gegen die soziale ungleichheit in diesem land! verhindern sie stromsperren in diesem winter! gehen sie die erhöhung des mindestlohnes unverzüglich an! stoppen sie die unerträgliche tarifflucht vieler unternehmen, und beenden sie die mietenexplosion und die massive altersarmut! das fördert gezielt diejenigen, die jetzt am härtesten von der inflation getroffen werden. das sind die wesentlichen verbesserungen für millionen menschen in diesem land. eine solche regierungspolitik wäre wirklich mal echter fortschritt. vielen dank, frau kollegin tatti. als nächsten redner rufe ich auf den kollegen pascal kober, fdp-fraktion."
