,datum,redeID,vorname,nachname,fraktion,name,inhalt_neu
0,,,,,, ,
1,28.04.2022,ID203100100,Britta,Haßelmann,BÜNDNIS 90/DIE GRÜNEN,Britta Haßelmann,"sehr geehrte frau präsidentin! liebe kolleginnen und kollegen! seit dem . februar ist unsere welt eine andere. mitten in europa tobt ein furchtbarer krieg: völkerrechtswidrig, mit kriegsverbrechen und an brutalität und grausamkeit, die wir jeden tag erleben, kaum vorstellbar. dieser angriffskrieg bricht in eklatanter weise mit dem international geltenden recht, auf das sich die weltgemeinschaft gemeinsam verständigt hat. ich weiß nicht, wie es ihnen geht, aber seit dem . februar beginnt jeder morgen mit neuen schrecklichen nachrichten aus der ukraine und beginnt jeder tag mit trauer, mit schmerz und mit fassungslosigkeit über das ausmaß der zerstörung, über das leid von menschen, über tod, über kinder auf der flucht, mit bildern von menschen, die durstend in bunkern hausen, von ermordeten zivilistinnen und zivilisten, toten soldaten und vergewaltigungen, die inzwischen systematisch als kriegswaffe gegen frauen eingesetzt werden. der krieg zerstört unsere europäische friedens- und sicherheitsordnung und ist ein angriff auf unsere werte, auf freiheit, demokratie und selbstbestimmung. wir alle verurteilen diesen krieg aufs schärfste. die russische regierung muss alle kampfhandlungen unverzüglich einstellen. seit zwei monaten arbeiten wir hier im parlament, in der bundesregierung, mit unseren europäischen partnern, im rahmen der g , der weltgemeinschaft und der internationalen staatengemeinschaft ununterbrochen und mit nachdruck daran: wie können wir hilfe und unterstützung bieten? dazu gehören finanzielle unterstützung, wirtschaftliche unterstützung, humanitäre unterstützung und auch die unterstützung mit waffen. wir ringen seit dem ersten tag um ehrliche antworten. wir wägen ab, wir zweifeln, und, ja, wir hadern. aber wir entscheiden, und das ist am ende das, was zählt. niemand weiß heute genau, was werden wird, meine damen und herren, und mich beunruhigen die, die heute schon ganz genau wissen, was gestern zu tun war und übermorgen zu tun ist. ich finde es wichtig, zum ausdruck zu bringen, wie schwer die situation ist und wie darum gerungen werden muss, was die richtigen antworten sind. wir haben inzwischen fünf harte sanktionspakete gegen russland und die russische führung vereinbart. das ist wichtig und notwendig, alles getragen im europäischen kontext, von der nato und der weltgemeinschaft. wir tun alles, um so schnell wie möglich aus dieser wahnsinnig zementierten abhängigkeit fossiler energien, in die uns die fehlentscheidungen der letzten jahre gebracht haben, herauszukommen. auch das ist wichtig und notwendig. wir sind bei allem, was wir tun, vom festen grundsatz geleitet, dass die ukraine nach der charta der vereinten nationen ein uneingeschränktes recht auf selbstverteidigung hat. wir nehmen unsere aufgabe verantwortungsvoll wahr, einerseits nicht kriegspartei zu werden das ist die erklärte absicht nicht nur deutschlands, sondern aller europäischen partnerinnen und partner und andererseits die ukraine nicht schutzlos dem aggressor putin auszuliefern. genau hier ist unsere verantwortung im spannungsfeld immer wieder, jeden tag aufs neue zu entscheiden, was zu tun notwendig ist, um die ukraine in ihrem recht auf selbstverteidigung zu unterstützen, meine damen und herren. deshalb ist es auch wichtig und notwendig, dass wir neben der finanziellen und humanitären hilfe und den waffenlieferungen, für die wir bereits direkt im anschluss an den angriffskriegsbeginn gesorgt haben, jetzt auch den ringtausch schwerer waffen und die massive finanzielle unterstützung der ukraine für direkte waffenkäufe und die lieferung eigener schwerer waffen da, wo es möglich ist, in aller sorgfalt zu prüfen und dann auch zu entscheiden, so wie wir das im vorliegenden antrag getan haben, und noch einmal gemeinsam bekräftigen: die ukraine kann sich auf unsere unterstützung verlassen, meine damen und herren. es freut mich, dass wir dieses signal heute gemeinsam mit ihnen von der union abgeben; das sei an dieser stelle ganz eindeutig in richtung der cdu/csu gesagt. denn ein wichtiges signal in dieser krisenzeit ist nach innen und nach außen, dass demokratinnen und demokraten in diesem haus an dieser stelle zusammenstehen, und dafür bin ich dankbar. das handeln der bundesregierung und unser gemeinsamer antrag heute hier im parlament sind ein starkes signal an die ukraine. bitte, meine damen und herren, verstehen sie es als solches! es ist auch ein klares signal an die menschen hier im land, die voller sorge auf das leid, die zerstörung und die entwicklung dieses krieges schauen. vielen dank. für die unionsfraktion erteile ich das wort dem kollegen friedrich merz."
2,28.04.2022,ID203100200,Friedrich,Merz,CDU/CSU,Friedrich Merz,"frau präsidentin! liebe kolleginnen und kollegen! diesen jungs und mädels muss ich mal sagen: weil ich nicht tue, was ihr wollt, deshalb führe ich . so hat sich der bundeskanzler einige tage vor ostern in einem rundfunkinterview auf die frage eingelassen, ob und wie er denn in diesem land führe. mit jungs und mädels waren dabei offenbar die drei ausschussvorsitzenden gemeint, die eine reise in die westukraine unternommen hatten. mal ganz unabhängig davon, wer gemeint war: mitglieder des deutschen bundestages herablassend mit jungs und mädels zu bezeichnen, ist für einen bundeskanzler der bundesrepublik deutschland völlig inakzeptabel. meine damen und herren, einfach nur das gegenteil von dem zu tun, was mitglieder des deutschen bundestages für richtig halten, ist auch kein ausdruck von führung. dieser sprachgebrauch ist eher ein zeichen von unsicherheit und von schwäche. der bundeskanzler hat über wochen in der diskussion über die frage, ob der ukraine denn nun waffen geliefert werden sollten oder nicht, hingehalten, seine antwort offengelassen und die frage ausweichend beantwortet. ich erinnere nur an die regierungsbefragung, die wir hier vor drei wochen hatten. der bundeskanzler hat alle fragen beantwortet, die ihm nicht gestellt worden sind, und keine einzige frage von denen beantwortet, die wir ihm gestellt haben, meine damen und herren. das ist kein ausdruck von besonnenheit, wie sie von den ampelfraktionen es in den letzten tagen versuchen zu erklären. das ist zögern, das ist zaudern, und das ist ängstlichkeit. nun regen sie sich darüber auf, dass wir das thema hier im plenum ansprechen. aber, meine damen und herren, das problem für den bundeskanzler war und ist nicht die opposition. das problem für den bundeskanzler war und ist bis zum heutigen tag die kritik aus den eigenen reihen. dabei waren worte wie führungsschwäche und kommunikationsdesaster noch harmlose formulierungen. politische hütchenspiele sind dem bundeskanzler vorgeworfen worden, bis hin zu der offenen frage, ob er seinem amt noch gewachsen sei. ich will es dabei bewenden lassen. wenn sie die staatspolitische verantwortung der opposition nur so verstehen, dass wir ihnen in allem, was sie hier vorlegen und vorschlagen, kritiklos zustimmen, dann ist das ein großer irrtum, meine damen und herren. wir erlauben uns hier schon, diese kritik, die geäußert wird, aufzunehmen und zum gegenstand einer parlamentarischen diskussion zu machen. es ist trotzdem gut, dass wir heute gemeinsam den versuch unternehmen, einen antrag zu verabschieden, der sich umfassend mit der hilfe für die ukraine befasst. wenn die bundesregierung in den letzten tagen und wochen zu diesen fragen eine klare und einvernehmliche haltung eingenommen hätte und wenn der bundeskanzler dies klar und unmissverständlich hier gesagt hätte, dann wäre weder der antrag noch diese ganze debatte heute morgen notwendig gewesen. wenn wir in der letzten woche nicht einen antrag vorgelegt hätten, dann wären sie doch nie auf den gedanken gekommen, nun ihrerseits tätig zu werden und einen solchen antrag dem deutschen bundestag vorzulegen. nein, meine damen und herren, wir führen hier eine wichtige diskussion, und wir nehmen in dieser diskussion auch unsere verantwortung wahr. ich will ihnen zu der debatte von gestern noch mal etwas sagen. wir hatten gestern die diskussion über das -milliarden-euro-programm für die bundeswehr und die dazu vorgeschlagene änderung des grundgesetztextes. meine damen und herren, wir haben die sechs punkte genannt, die für uns wichtig sind, wenn wir dem zustimmen sollen. ich sage ihnen noch mal: nehmen sie das bitte nicht auf die leichte schulter! wir sind grundsätzlich bereit, mit ihnen einen solchen weg zu gehen. aber wir lassen uns nicht einfach nur so zur zustimmung auffordern. wir haben einige punkte genannt. ich will es hier an dieser stelle sehr deutlich wiederholen: unsere zustimmung ist auch davon abhängig, dass wir in wenigen jahren nicht wieder da stehen, wo wir heute stehen, nämlich bei einer unterfinanzierten bundeswehr. deswegen wollen wir sehen, dass der einzelplan für die verteidigung kontinuierlich aufwächst und nicht einmalig ein bestimmter betrag zur verfügung gestellt wird. wir wollen die beschaffungssystematik ändern. übrigens war der bundeskanzler begeistert, als wir ihm vorgeschlagen haben, dass wir am beschaffungssystem etwas ändern wollen. dann machen wir es doch jetzt gemeinsam! nörgeln und kritisieren sie doch nicht ständig an der opposition herum. ich will nur diese beiden punkte nennen. wir haben hier noch einen ziemlich langen weg vor uns. seitdem der bundeskanzler vor acht wochen den vorschlag unterbreitet hat, ist wertvolle zeit verstrichen. wir sind zu keinem dieser punkte bisher übereingekommen, geschweige denn, dass wir ein gemeinsames gesamtkonzept ausformuliert und aufgeschrieben haben. wir sind noch ziemlich weit entfernt von einer einigung. meine damen und herren, mit dem antrag des heutigen tages sind wir dankenswerterweise einen schritt weiter. richtigerweise enthält dieser text nicht nur bewertungen und einschätzungen zu waffenlieferungen an die ukraine. richtigerweise! auch wir wissen, dass waffengewalt in einer solchen auseinandersetzung immer nur das letzte mittel sein darf und letztendlich auch das eingeständnis des scheiterns von diplomatie und der suche nach politischen lösungen umfasst. das ist so. aber an dieser stelle stehen wir seit dem . februar . ich will es mal mit diesen worten deutlich sagen: niemand von uns befürwortet leichtfertig den einsatz militärischer gewalt. niemand! diese zwischenrufe verstehe ich nun wirklich überhaupt nicht. wir wollen hier eine gewissenhafte diskussion führen. wenn bei diesem satz solche zwischenrufe von ihnen kommen, dann frage ich mich, wie ernst sie die bereitschaft meinen, mit uns zu einer gemeinsamen lösung in diesen schwierigen fragen zu kommen. ich frage mich wirklich, wie ernst sie das nehmen! meine damen und herren, wir haben doch alle diese schrecklichen bilder vor augen, und sie beschweren uns doch jeden tag: die bilder von menschenrechtsverletzungen, die bilder vom stahlwerk in mariupol. das sind doch furchtbare bilder. aber gerade weil wir diese bilder vor augen haben, müssen wir doch heute sagen: einem aggressor wie putin und seinem machtapparat muss man in einer solchen situation als ultima ratio mit militärischer gewalt begegnen. es geht nicht anders in einer solchen situation! es bestreitet hier niemand. aber wir müssen doch auch nach draußen hin erklären, warum wir heute zu einem solchen gemeinsamen antrag kommen. noch mal: wenn sie das schon vor einigen wochen getan hätten, dann bräuchten wir es heute nicht gemeinsam zu tun. an der stelle stehen wir doch heute. wenn die ukraine und ihre mutige armee sich nicht militärisch verteidigten und wenn wir der ukraine dabei nicht helfen würden, dann wird uns diese unterlassene hilfe wie schon in der vergangenheit als schwäche und als zögerlichkeit ausgelegt, und dann wird es nach der ukraine weitere länder und weitere regionen geben, die von dem russischen regime bedroht werden, meine damen und herren. in diesem zusammenhang ist der hinweis des bundeskanzlers, dass unsere deutschen waffen möglicherweise einen dritten weltkrieg auslösen würden, ebenso unverantwortlich wie aus unserer eigenen historischen erfahrung heraus falsch und irreführend. der hinweis ist unverantwortlich; denn er lässt ja nur den schluss zu, dass aus der sicht des bundeskanzlers alle anderen länder, die mehr für die ukraine tun als wir und davon gibt es viele , die kriegsgefahr in europa erhöhen. meine damen und herren, das ist doch eine geradezu groteske umkehrung von ursache und verantwortung für diesen krieg. eine groteske umkehrung! ich frage in richtung der spd: warum sollten gerade deutsche waffen diese wirkung haben, alle anderen aber nicht? der hinweis ist auch historisch falsch, weil doch gerade wir wissen, dass besänftigung und beschwichtigung in der internationalen sprache der politik heißt das appeasement die ausweitung einer aggression überhaupt erst möglich machen. deshalb ist es gut, dass wir heute mit diesem gemeinsamen antrag und der beschlussfassung darüber klarheit schaffen. die bundesregierung kann sich ab heute auf ein breites zustimmendes votum des deutschen bundestages stützen und der ukraine die waffen liefern, die sie braucht und die wir ihr dann zur verfügung stellen können. meine damen und herren, deswegen will ich abschließend sagen: ich will mich bei den fraktionen der spd, der grünen und der fdp und bei ihren jeweiligen vorsitzenden ausdrücklich bedanken, dass wir in den letzten tagen hier zu dieser gemeinsamen haltung gefunden haben. die arbeit an den texten und die vielen gespräche, die wir in den letzten tagen dazu geführt haben, haben sich gelohnt. herzlichen dank. lars klingbeil hat das wort für die spd-fraktion."
3,28.04.2022,ID203100300,Lars,Klingbeil,SPD,Lars Klingbeil,"frau präsidentin! liebe kolleginnen und kollegen! seit über zwei monaten führt wladimir putin einen brutalen angriffskrieg gegen die ukraine. täglich sehen wir das leid, das putin und seine vasallen über die menschen im land bringen: gezielte tötung von zivilisten, die bombardierung von krankenhäusern, von schulen, von kindergärten. wladimir putin trägt die verantwortung für diesen krieg. er wird als kriegsverbrecher in die geschichte eingehen. und wir werden alles daransetzen, dass er vor den zuständigen gerichten dieser welt für diesen brutalen krieg zur verantwortung gezogen wird. es ist gut, dass wir heute hier im parlament ein eindeutiges, ein unmissverständliches signal aus der mitte des deutschen bundestages setzen: putin muss diesen völkerrechtswidrigen angriffskrieg beenden! wir stehen an der seite derjenigen, die mutig und tapfer in der ukraine kämpfen. wir stehen an der seite der ukraine. das machen wir mit diesem gemeinsamen antrag deutlich. herr merz, mir war wichtig, diesen punkt am anfang meiner rede zu nennen. bei ihnen hat es fünf minuten gedauert, bis sie zum ersten mal etwas zum krieg und zum leiden der menschen in der ukraine gesagt haben. ich habe hier eigentlich auf meinem zettel stehen: dank an die union. herr merz, ich muss ihnen das in aller emotionalität sagen: das hätte heute von ihnen eine staatspolitische rede werden können. es ist aber eine parteipolitische rede geworden. sie haben zu ihren eigenen leuten gesprochen. ich will ihnen sagen, herr merz: ich bin dankbar dafür, dass wir einen gemeinsamen antrag auf den weg gebracht haben. danke an die vier fraktionen und die vorsitzenden! aber hier ist kein platz für parteipolitische profilierung. herr merz, ich will das anhand meiner eigenen geschichte beschreiben. ich bin in dieses parlament gekommen. die spd ist damals in die opposition gegangen. das war schwierig für uns, weil wir lange regiert haben. wir haben eine schwarz-gelbe regierung erlebt, die nicht immer harmonisch war. und trotzdem haben wir damals als spd bei den großen internationalen fragen, die abgestimmt wurden, nach dem prinzip gehandelt: erst das land, dann die partei. erinnern sie sich, herr merz, an das karfreitagsgefecht, das erste mal, dass deutsche soldaten im ausland gefallen sind. trotzdem hat die spd am afghanistan-mandat festgehalten, hat ein klares bekenntnis zur bundeswehr abgegeben. erinnern sie sich an die großen debatten über die schutzschirme für griechenland, für spanien, den eurorettungsschirm. wir hätten uns das einfach machen können, aber wir haben damals nie gegen die regierung gestimmt. lieber herr merz, ich habe mir in den letzten tagen sorgen um die union gemacht, als sie kritisiert haben, dass olaf scholz nach japan fährt, dass olaf scholz sich mit einem der wichtigsten westlichen verbündeten trifft. da habe ich mich gefragt: was ist nur aus der union von angela merkel geworden? was passiert da gerade in der union? lieber herr merz, diejenigen, die am antrag mitgeschrieben haben, haben nach dem prinzip gehandelt: erst das land, dann die partei! ich hätte mir gewünscht, dass diejenigen, die ihre rede geschrieben haben, auch nach diesem grundsatz gehandelt hätten. aber zur sache. ich will ein paar sätze zu diesem antrag sagen, weil er mir wirklich wichtig ist. dieser antrag stützt das handeln der bundesregierung. diese regierung handelt, sie liefert, sie führt. ich will das an dieser stelle sagen, weil antragsberatungen ein moment sind, wo man mal danke sagen kann. die vertreterinnen und vertreter der bundesregierung haben entscheidungen mit einer reichweite für die nächsten , , jahre zu treffen, mit einer tragweite, die leben und tod betreffen. es sind entscheidungen, die man sich in der regierung nicht einfach macht. ich will hier stellvertretend nancy faeser, christian lindner, annalena baerbock, christine lambrecht, robert habeck und vor allem bundeskanzler olaf scholz für das danken, was wir in den letzten wochen an guter führung durch die bundesregierung gemeinsam erlebt haben. ich habe in den letzten tagen viele bewertungen der bundesregierung gelesen. ich empfehle übrigens, mal die aktuelle ausgabe der time zu lesen; da bekommt man einen überblick, wie deutschlands rolle in der welt gesehen wird. lassen sie uns einmal auf die fakten schauen. fakt eins. deutschland hat mit den partnern sanktionen vorbereitet und setzt diese massiv durch. selten gab es ein so großes, umfassendes sanktionspaket wie jetzt gegen russland. russland wird ökonomisch von den internationalen märkten abgekoppelt und wird es über einen langen zeitraum bitter zu spüren bekommen, was die konsequenzen dieser sanktionen sind. fakt zwei. deutschland reduziert die abhängigkeit von russischem gas und russischem öl. das tun wir in einem größeren tempo, als es im koalitionsvertrag schon vorgesehen war. ich bin dankbar dafür, dass wir das täglich in aller entschiedenheit gemeinsam tun. fakt drei. wir agieren eingebettet in die internationale kooperation. der westen die nato, die europäische union war lange nicht mehr so geeint und so stark wie jetzt. ich sage: daraus müssen wir etwas machen. wir können nicht nur zusammenkommen, weil putin uns treibt, sondern wir brauchen jetzt eine transatlantische agenda für die zukunft. wir brauchen jetzt eine starke europäische union. das ist ein geschenk für uns, aber es kommt auf das handeln der bundesregierung an. und ja, deutschland liefert waffen. diese bundesregierung hat mit einem prinzip gebrochen, das über jahrzehnte in deutschland galt. wir liefern seit dem beginn des krieges, und wir sind jeden tag einen schritt weitergegangen: in der qualität, in der quantität dessen, was wir tun. aber wir hatten auch hier prinzipien. in dieser kontinuität stehen die entscheidungen der letzten tage. wir haben gesagt: wir stimmen uns mit den internationalen partnern ab. wir haben gesagt: wir gefährden nicht die eigene landes- und bündnisverteidigung. und wir haben gesagt, dass wir selbst nicht zur kriegspartei werden. alles das tut die bundesregierung. ich bin dankbar dafür das ist der letzte punkt, den ich ansprechen will , dass wir eine regierung haben, die weiß, dass sie konsequent und schnell entscheiden muss, die aber nicht herr merz, dieser eindruck entsteht manchmal bei ihnen morgens aufwacht und überlegt: was können wir heute tun? gerade in diesen zeiten, gerade in zeiten von leben und tod, von krieg und frieden geht es darum, dass man grundüberzeugungen und prinzipien hat und diese auch in einer zeitenwende nicht über den haufen wirft. liebe kolleginnen und kollegen, trotz aller parteipolitischer differenzen will ich am ende noch einmal betonen: es ist richtig und wichtig, dass es hier aus der mitte des parlamentes ein klares signal an wladimir putin und ein klares signal an die menschen in der ukraine gibt, dass wir als deutscher bundestag auf der richtigen seite der geschichte stehen. aber ich sage ihnen auch: kleingeistigkeit und kleinkariertheit, wie sie manches mal gerade in der politischen debatte erlebt werden, bringen uns nicht weiter. wir haben schwierige entscheidungen vor uns, beispielsweise zum sondervermögen. herr merz, das ist mein letzter appell: machen sie deutlich, dass sie an der seite der soldatinnen und soldaten stehen! herr kollege klingbeil. machen sie deutlich, dass sie bereit sind, die fehler aus jahren unionsgeführtem verteidigungsministerium zu korrigieren herr kollege. und mit der ampel gemeinsam daran zu arbeiten, die bundeswehr entsprechend auszustatten. das wäre ein richtiges signal aus der union. vielen dank fürs zuhören."
4,28.04.2022,ID203100400,Tino,Chrupalla,AfD,Tino Chrupalla,"frau präsidentin! sehr geehrte damen und herren! liebe landsleute! vor nunmehr über zwei monaten hat russland die ukraine angegriffen. wir haben wieder krieg in europa. noch zu beginn haben wir alle hier in diesem hohen haus gehofft, dass der konflikt schnell beendet sein wird und die bevölkerung in der ukraine wieder in ruhe leben kann. leider kam es anders. die afd-fraktion gedenkt aller kriegstoten und trauert mit deren hinterbliebenen. der neue krieg in europa stellt uns alle vor eine schwierige situation und entscheidung. plötzlich werden alte wunden aufgerissen und überkommene denkmuster bedient. aber gerade für ein friedliches zusammenleben müssen wir die ideologischen scheuklappen absetzen und uns der diskussion im eigenen land stellen. ich finde es unentschuldbar, dass bundeskanzler olaf scholz heute an so einem wichtigen tag hier nicht anwesend ist. bislang stand er zu seinem wort, dass waffen keine lösung sind. heute bringen die koalition und die unionsfraktion einen gemeinsamen antrag ein, der den ukrainekrieg verlängern wird und uns zur kriegspartei in einem atomar geführten krieg machen könnte. werte kollegen, wir streiten über die zukunft deutschlands. es geht um krieg und frieden, auch in mitteleuropa, und herr scholz reist zur kirschblüte nach japan. und nein: auch reisepläne kann man ändern. erinnern sie sich: der bundeskanzler ließ außenministerin baerbock vorfristig nach berlin zurückkehren, um über die impfpflicht abzustimmen. daran sieht man, wo die prioritäten dieses bundeskanzlers liegen. alle, die immer davon sprechen, aus der geschichte gelernt zu haben, sind heute die ersten, die uns aktiv in einen krieg hineinziehen wollen. genau das besagt dieser heute vorliegende antrag. er liest sich wie die beitrittsbekundung zu einem krieg. vom duktus her erinnert er an die dunkelsten zeiten. ich muss es hier noch mal deutlich sagen: wir befinden uns nicht im krieg mit russland oder irgendeinem land, und die große mehrheit der deutschen bevölkerung möchte nicht an diesem krieg beteiligt werden. deswegen muss man fragen: welchen zweck verfolgen sie? die ukraine gehört nicht der nato an, auch nicht der eu und ist ebenso ein souveräner staat in europa wie russland. es liegt im deutschen interesse, auch zukünftig zu beiden staaten ein gutes verhältnis zu unterhalten, politisch, wirtschaftlich und kulturell. schon mit der entscheidung der bundesregierung, gepard-panzer an die ukraine zu liefern, wurde die position deutschlands entschieden geschwächt; denn wir können nicht mehr als neutraler vermittler auftreten, wir können eigentlich nur noch hoffen, dass dieses vorgehen die diplomatischen wege nicht endgültig versperrt hat. sie intervenieren mit waffenlieferungen in einen fremden krieg und nennen das wertegeleitete außenpolitik . haben sie sich eigentlich mal gefragt, welche wirkung diese entscheidung auf unsere partner china und indien hat? wir brauchen interessengeleitete außenpolitik für deutschland und europa. die fraktion der alternative für deutschland im bundestag spricht sich ganz entschieden gegen die lieferung von waffen an die ukraine aus. waffen haben kriege noch nie verkürzt und sind keine humanitären hilfsgüter. wir müssen unsere humanitäre hilfe fortführen. ich meine damit sowohl die unterstützung von kriegsflüchtlingen als auch die hilfe für die notleidenden vor ort, zum beispiel durch die lieferung von medizinischen hilfsmitteln, von medikamenten sowie durch die bereitstellung von sauberem wasser und energie. viele hier im plenarsaal und gerade auch die medien müssen endlich rhetorisch abrüsten. die friedensrhetorik muss in den vordergrund treten, nicht die kriegsrhetorik. werte kollegen, bitte kommen sie zur vernunft. lassen sie ihr gewissen entscheiden, und stimmen sie gegen die waffenlieferung an die ukraine! die alternative für deutschland sie kommen bitte zum schluss. ist die einzige fraktion im deutschen bundestag, die aktiv für den frieden auf dem kontinent europa eintritt. vielen dank. der kollege christian dürr hat das wort für die fdp-fraktion."
