,datum,redeID,vorname,nachname,fraktion,name,inhalt_neu
115,14.02.2019,ID198011500,Anja,Weisgerber,CDU/CSU,Anja Weisgerber,"sehr geehrte frau präsidentin! werte kolleginnen und kollegen! persönliche schicksalsschläge, der verlust des arbeitsplatzes, suchtprobleme, all das sind auslöser für wohnungslosigkeit. aber auch der wohnraummangel und die steigenden mieten führen dazu, dass die wohnungslosigkeit gerade in den ballungszentren steigt. besonders in den kalten wintermonaten sind die eisigen temperaturen für menschen ohne ein dach über dem kopf lebensgefährlich. ich muss ihnen ganz ehrlich sagen: immer wenn ich, auch hier in berlin, obdachlose sehe, dann fühle ich mit ihnen und frage mich, wie es so weit kommen konnte, dass diese menschen auf der straße leben. insofern muss ich zustimmen: jeder obdachlose ist einer zu viel; da sind wir uns alle einig, meine damen und herren. deshalb ist es wichtig, dass wir für die menschen, die obdach- und wohnungslos sind, hilfsangebote machen. die angebote müssen für die persönliche situation individuell erfolgen. zur wahrheit gehört aber auch, dass der staat bereits zahlreiche maßnahmen anbietet, um wohnungs- und obdachlosigkeit zu vermeiden. deutschland ist ein funktionierender sozialstaat. meine damen und herren, die politik verfolgt in erster linie einen präventiven ansatz und vermittelt vor allem hilfen, bevor wohnungslosigkeit entsteht. es gibt die ansprüche der mindestsicherung nach dem zweiten und dem zwölften buch sozialgesetzbuch. es muss bei uns in deutschland niemand auf der straße leben; der staat bietet hilfen an. trotzdem ich gehe gern darauf ein passiert es, und dem müssen wir entgegenwirken. aber entgegen der behauptung der antragsteller macht die bundesregierung bereits einiges, um den betroffenen menschen zu helfen. es gibt in deutschland eine vielzahl von programmen, um menschen, die in not geraten sind, zu unterstützen. weil sie es mir nicht glauben, möchte ich auf die einzelnen programme eingehen: der bund unterstützt seit mehreren jahren die projekte der bundesarbeitsgemeinschaft wohnungslosenhilfe. allein in den letzten drei jahren wurden über euro durch den bund investiert. hier werden bestimmte adressaten gruppen wie straßenkinder oder auch obdachlose frauen besonders in den fokus genommen. mit dem europäischen hilfsfonds für die am stärksten benachteiligten personen in deutschland, kurz: ehap, werden wohnungslose und von wohnungslosigkeit bedrohte menschen besonders durch bundes- und eu-mittel mit hilfsangeboten unterstützt. gefördert werden insbesondere beratungsstellen, die mit zusätzlichem personal ausgestattet werden, um förderprogramme mit den jeweiligen zielgruppen zu vernetzen. viele menschen wurden bereits beraten, und es wurde hilfe angeboten, und diese hilfsangebote wurden auch bereits angenommen. ich kann ihnen auch noch berichten: aus meiner zeit als europaabgeordnete weiß ich, dass es den europäischen sozialfonds gibt. ich habe da viele projekte in deutschland besucht auch in meiner heimatstadt schweinfurt , mit denen jugendliche, die aus schwierigen familien stammen auch mit langjährigem hartz-iv-bezug, hartz-iv-generationen , an die hand genommen wurden. ihnen wurde der weg bereitet, einen ausbildungsplatz zu bekommen, aus diesem umfeld auszubrechen; denn vielleicht könnten auch sie auf der straße enden. das wollen wir nicht. gerade diesen jungen menschen müssen wir doch eine chance geben, meine damen und herren! ich halte es auch für ganz wichtig, den ehrenamtlichen beitrag von vielen menschen in deutschland, die auch den obdachlosen helfen, an dieser stelle einmal zu würdigen. hier leisten kirchengruppen, stadt- und bahnhofsmission, caritas und ehrenamtliche vereine großartiges engagement für ihre mitmenschen. so vermeiden wir auch eine ausgrenzung dieser menschen. das macht eine funktionierende gesellschaft aus. das weiß ich zu schätzen und bedanke mich noch mal ganz außerordentlich für dieses ehrenamtliche engagement. gerne möchte ich auch noch auf die immer wieder geforderten statistiken zur obdach- und wohnungslosigkeit in deutschland zu sprechen kommen. zweifelsfrei können exakte zahlen ein besseres hilfsangebot für menschen in not ermöglichen. die umsetzung das gehört auch zur wahrheit ist aber schwierig; denn selten bleiben obdachlose dauerhaft an einem ort. wie soll hier denn erfassung erfolgen? auch wollen sich viele menschen, die in solche situationen geraten, einer erfassung eher entziehen. die motive dafür sind auch durchaus nachvollziehbar. zusätzlich weisen experten richtigerweise darauf hin, dass es schwierig ist, zwischen vorübergehender und dauerhafter obdachlosigkeit zu unterscheiden. dies macht eine exakte erfassung so schwierig. die bundesarbeitsgemeinschaft wohnungslosenhilfe hat heute schon sehr hilfreiche zahlen. das sind wohl schätzungen; aber darauf kann man aufbauen. trotz aller statistiken und der programme, die ich gerade angesprochen habe: ein wichtiger schlüssel ist und bleibt, dass wir auf allen ebenen ich betone noch mal: auf allen ebenen , bund, länder und gemeinden, für mehr wohnungen sorgen. da muss man einfach noch mal feststellen: seit der föderalismusreform liegt die zuständigkeit für den sozialen wohnungsbau bei den ländern. der bund hat dennoch die kompensationsmittel für den sozialen wohnungsbau zur verfügung gestellt. es gibt länder, die hier mit gutem beispiel vorangehen ich möchte selbstverständlich bayern erwähnen und intensiv in den sozialen wohnungsbau investieren. für die jahre und erhalten die länder vom bund mindestens milliarden euro für den sozialen wohnungsbau. wir setzen jetzt darauf, dass die grundgesetzänderung, die vor kurzem im bundestag beschlossen wurde, auch kommt. wir appellieren an die länder, dass diese gelder in den ländern endlich zielgerichtet eingesetzt werden, meine damen und herren. um die wohnraumoffensive durchzusetzen, ist es wichtig, dass wir uns an verschiedene gesellschaftliche gruppen und akteure wenden. wir haben zum einen die sonderabschreibung, damit mehr wohnungen gebaut werden. wir haben die erhöhung des wohngeldes, die ja auch im koalitionsvertrag schon verankert wurde und die kommt. wir haben die wohnungsbauprämie, um junge menschen aufzufordern, zu sparen, damit sie sich später auch eine wohnung leisten können. wir haben das kfw-bürgschaftsprogramm. und wir haben das baukindergeld. wir haben auf allen ebenen etwas. ich sage ihnen auch: wir brauchen auch die eigentumsförderung; das werden wir vonseiten der union immer wieder betonen. sie sehen: wir tun einiges. ich würde mich freuen, wenn auch die opposition das mal anerkennen würde. vielen dank. das wort hat der abgeordnete detlev spangenberg für die afd-fraktion."
116,14.02.2019,ID198011600,Detlev,Spangenberg,AfD,Detlev Spangenberg,"herr präsident! sehr geehrte damen und herren! wohnungs- und obdachlosigkeit bekämpfen, zwangsräumungen verhindern , menschenrecht auf wohnen dauerhaft sicherstellen so die die anträge der fraktionen die linke bzw. bündnis /die grünen. ich habe mir das mal durchgelesen und dann eine neue überschrift für sie gefunden: sozialneid schüren und eigeninitiative verhindern , das würde ich über diesen antrag schreiben, meine damen und herren, so könnte man das sehen. wir wissen alle, dass mietverträge und auch arbeitsverträge besondere verträge sind: da haben wir keine gleichstellung, diese sind nicht auf einer augenhöhe. das ist auch richtig so; das ist ein besonderer vertrag. trotzdem, meine damen und herren, sie bedienen mal wieder das klischee des raffgierigen vermieters und des ausgebeuteten mieters. so ist das nicht. in den meisten fällen ist es eine sozialpartnerschaft, die wir auch hier brauchen; aber das kommt in ihrem antrag wieder mal nicht zum ausdruck. sie müssen mal zuhören! viele jahre müssen die leute sparen, um eigentum zu erwerben. manche wollen das nicht; sie wollen zur miete wohnen. das ist eine eigenständige entscheidung, die jeder für sich selbst trifft. die hohe anspardisziplin und auch unternehmerisches risiko mietausfall durch nicht bediente annuitäten können viele vermieter in den ruin treiben, meine damen und herren. das, wie gesagt, sollte man, wenn man diese zielgruppe immer so angreift, dabei mitbedenken. sie machen hier einen rundumschlag bei den gründen von wohnungslosigkeit, ohne die ursachen zu unterscheiden. das machen sie nicht. sie nennen zum beispiel überschuldung, insbesondere mietschulden. wo liegt hier die rechtfertigung, mietschulden gegenüber anderen schulden anders zu bewerten oder zu bagatellisieren? für schulden ist grundsätzlich erst mal der schuldner verantwortlich. das ist vertragsrecht. das ist nun mal so, meine damen und herren. der vermieter hat auch nicht die aufgabe, staatliche soziale aufgaben zu übernehmen. das hat er nicht. arbeitsplatzverlust und krankheit das führen sie auf werden in deutschland grundsätzlich sozial abgefedert. auch hier ist nicht der vertragspartner verantwortlich, sondern allein unser sozialsystem, wenn überhaupt. sie nennen weiter die trennung vom lebenspartner. da frage ich mich, wieso hier die gesellschaft mit wohnungen zur verantwortung zu ziehen ist. das müssen die beiden oder die drei oder vier, die da wohnen, schon selber klären. das hat vorher geklappt und klappt auch hinterher. hören sie jetzt erst mal zu! sie nennen den mangel an bezahlbarem wohnraum. da kommen wir zu dem, was mein kollege vorhin schon gesagt hat. wer ist denn für diese kostenexplosion verantwortlich? dafür sind sie mitverantwortlich mit ihrer multinationalen globalen politik auf dem rücken der einheimischen bevölkerung. sie können scheinbar nicht mal rechnen. wenn hunderttausende in das land strömen: wo sollen die denn wohnen? die wohnungen kommen doch nicht schlagartig wie gras aus der erde. wie stellen sie sich das vor? die müssen gebaut werden. dann nehmen sie auch noch leute aus der eu mit hinein die wollen sie auch noch haben , dass sie bloß noch einen antrag schreiben müssen ich suche arbeit , und dann sollen sie nach drei monaten die gleichen rechte bekommen. also, sie haben irgendwie noch einen goldesel, den sie ständig aufmachen können, um das zu bezahlen. geschätzt geht das in viele milliarden. meine damen und herren, gerade diese gruppe von personen, die ich eben genannt habe und die jetzt zu uns geströmt sind oder immer noch strömen, will aber nicht in den ländlichen raum ziehen. dort haben wir unheimlich viel leerstand, meine damen und herren. nein, die wollen natürlich alle in die städte ziehen, und dafür haben sie mit ihrer mietpreisbremse und kappungsgrenze noch einen anreiz geschaffen. obwohl sie doch schon dicht besiedelt sind, knallen sie die leute immer noch dort rein, anstatt den ländlichen raum zu stärken. nein, sie müssen den ländlichen raum stärken. das begreifen sie nicht. sie müssen den stärken und nicht die überfüllten gebiete mit diesen instrumenten bedenken, meine damen und herren. das ist entscheidend. wo sollen denn die wohnungen herkommen, und warum soll die deutsche bevölkerung die kosten für diese wohnungen wieder stemmen? das ist gar nicht einzusehen. wir kommen jetzt mal dazu, wie die mietsteigerungen überhaupt zustande kommen. zum einen haben wir erhöhte baukosten. daran haben sie alle mitgewirkt: dämmvorschriften, energieeinsparverordnung, energieausweis, solardächer usw. usw. das kostet doch alles geld. das wird doch umgelegt. ich glaube, sie haben immer noch nicht verstanden, dass ihre aktionen natürlich das bauen verteuert haben, in jeder beziehung. dann haben wir noch solche kuriositäten wie das sperren von öfen und heizungsanlagen wegen angeblich überzogener abgaswerte. sie haben doch öfen rausgeschmissen, die noch ganz normal funktionieren. die müssen alle verschrottet werden. wieder neu erz abbauen und neue herstellen! wunderbare planung! auch umweltkosten! meine damen und herren, noch eins zum thema: nebenkosten sind keine mietkosten. das können sie sich auch mal anhören. nebenkosten sind abgaben, die der staat teilweise mit zu verantworten hat. da haben wir die energieabgaben, die umsatzsteuer, die eeg-umlage auf strom und gas, und das macht im monat pro haushalt bis zu euro aus. da könnte man auch sparen, wenn man das mal zurückfahren würde. darüber könnte man nachdenken. sie wollen die erleichterung der zwangsräumung aufheben. die wollen sie einschränken. aber für den bürger, der in die dritte säule der altersvorsorge investiert hat, haben sie nichts übrig; der interessiert sie nicht. das haben sie nicht verstanden, nicht? er kann durch die säumigen zahler in den ruin getrieben werden. auch das ist für sie uninteressant. sie machen hier eine angeblich soziale welle durch ausgrenzung derer, die allein den wohnraum erst geschaffen haben. die grenzen sie aus, meine damen und herren. zur forderung nach begrenzung des mietpreises: wer übernimmt denn die steigenden, auch durch die politik verursachten kosten? wer soll die übernehmen? wenn sie das dem vermieter aufdrücken, dann wird die attraktivität der vermietungen natürlich zurückgehen; es wird weniger angebote geben. das müsste selbst ihnen einleuchten, aber da habe ich so meine zweifel, ob sie das nachvollziehen können. herr spangenberg, achten sie bitte auf die zeit und kommen sie zum schluss! dann komme ich zurück zu den linken. sie haben doch beklagt, dass der soziale oder der städtische wohnungsbau zurückgegangen ist. hören sie erst mal zu! das müssen sie bitte jetzt im ausschuss klären. kommen sie zum schluss! wurden , milliarden euro durch den verkauf aller dresdner sozialwohnungen eingenommen mit den stimmen der linken. recht vielen dank. wiedersehen! für die spd-fraktion hat nun bernhard daldrup das wort."
117,14.02.2019,ID198011700,Bernhard,Daldrup,SPD,Bernhard Daldrup,"frau präsidentin! liebe kolleginnen und kollegen! wir haben zu diesem tagesordnungspunkt zwei anträge vorliegen, von denen ich meine, dass sie sich mit einem wichtigen thema seriös auseinandersetzen, und deswegen diskutiere ich darüber auch so. wir haben eben ihren beitrag gehört, herr spangenberg. es war zwar nicht so viel zu verstehen, aber sie haben irgendwie mit sozialneid angefangen und dann ein bild von gesellschaft gezeichnet, das wiederum das, was ich schon vorher wusste, wieder mal bestätigt: sie sind dieser gesellschaft eigentlich fremd. sie verstehen sie nicht. ich finde es gut, dass das thema heute aufgegriffen wird. obdach- oder wohnungslosigkeit ist individuell eine ganz dramatische situation. das ist allerdings keineswegs nur sozusagen auf wohnungslosigkeit zu reduzieren, aber es ist ganz zweifellos das hauptthema. wohnungslosigkeit, obdachlosigkeit macht armut in diesem land sichtbar. wir sehen sie auf den straßen unserer städte. deswegen ist es richtig, dass wir uns auch damit beschäftigen. ja, die zahlen steigen; das stimmt. das wissen wir auch ohne überprüfbare statistiken. in einigen ländern haben wir so was allerdings. in nordrhein-westfalen haben die sozialdemokraten dafür gesorgt, dass es so etwas gibt. aber ich glaube, liebe kolleginnen und kollegen von den linken, die aussage die bundesregierung sieht seit jahrzehnten untätig zu entwertet ein bisschen die ernsthaftigkeit der debatte, die wir zu dem thema führen. ich glaube, das ist nicht richtig. die frage muss lauten: wer muss eigentlich etwas tun? was muss getan werden, und reicht es? wohnungslosigkeit hat nämlich viele ursachen, bei deren bekämpfung meines erachtens das steht auch im antrag der grünen unter dem begriff primärprävention der vorsorgende sozialstaat eine große rolle spielt, vielleicht manchmal sogar mehr als der reparierende oder reagierende. wir haben heute morgen gehört, was franziska giffey zu dem starke-familien-gesetz gesagt hat. wir haben gehört, dass es einen höheren kinderzuschlag und mehr geld im bereich von bildung und teilhabe geben soll; milliarde euro gegen kinderarmut. das alles gehört dazu. bei anderen altersgruppen gehört eine erhöhte grundrente dazu. das sind die bedingungen für den vorsorgenden sozialstaat, um den wir uns kümmern müssen, wenn wir darüber reden. zuständig das ist aber kein wegschieben; überhaupt nicht sind auch länder und kommunen, selbstverständlich, wie auch die kreise. wenn die grünen sagen, man müsse einen dialog beginnen, dann sage ich, und ich weiß, wovon ich rede: diesen dialog gibt es schon lange und intensiv. und ich weiß, dass angespannte wohnungsmärkte dazu führen, dass sich städte und gemeinden mit viel engagement, viel einsatz und im übrigen auch mit viel geld um die bekämpfung von obdachlosigkeit und wohnungslosigkeit kümmern. es gibt kaum eine stadt, die sich nicht wirklich umfassend darum kümmert, wohnungsnot zu bekämpfen. in münchen geht es sogar so weit, dass nicht nur leerstehende flüchtlingsunterkünfte genutzt werden, sondern auch pensionen angemietet werden, um angebote zu machen. es gibt eine ganz kompetente und komplexe sozialberatung dazu, wie es sie beispielsweise auch in frankfurt und hannover gibt, wo alle möglichkeiten genutzt werden. ich kann ihnen auch duisburg nennen mit seinen häusern in den statistischen bezirken, um wohnungslosigkeit zu verhindern. es gibt viele, viele gute geschichten, auch in dortmund beispielsweise. aber am schluss heißt es trotzdem: trotz höchster not lassen sich nicht alle helfen. aber der anspruch bleibt: integration in das qualifizierte hilfesystem ist unser anspruch dabei. es ist also keineswegs so, wie in dem antrag zu lesen war. nicht soziale kälte, sondern engagement, gesetzlich wie ehrenamtlich, prägt die haltung von staat und gesellschaft in diesem land, jedenfalls gegenüber menschen, die wohnungslos sind. ich will aber gar nicht davon ablenken: wohnungsnot hat in erster linie mit wohnungsmangel zu tun. deswegen sage ich ihnen: wir nehmen das recht auf wohnen ernst, indem wir erstens mieterinnen und mieter besser schützen, nämlich mit einem mietrechtsanpassungsgesetz, das hier thematisiert worden ist, indem wir zweitens das wohngeld deutlich erhöhen und uns der aufgabe stellen, indem wir drittens mietspiegel anpassen, indem wir viertens mit unglaublich viel geld soziale wohnraumförderung betreiben und indem wir uns fünftens um stadtentwicklung, städtebauförderung und soziale quartiere kümmern, um auf diese weise wohnungslosigkeit und obdachlosigkeit vorbeugend zu vermeiden. trotzdem freue ich mich auf die beratung der anträge. kollege daldrup! frau präsidentin, ich wollte nur noch diesen satz sagen. es ist alles okay. ich will nur nicht, dass ihre kollegin ihnen böse wird, wenn ich ihr ihre redezeit anrechne. für die fdp-fraktion hat nun der kollege hagen reinhold das wort."
118,14.02.2019,ID198011800,Hagen,Reinhold,FDP,Hagen Reinhold,"sehr geehrte frau präsidentin! sehr geehrte damen und herren! herr daldrup, es kommt nicht so oft vor, dass wir uns einig sind. aber sie haben recht: auch ich freue mich, dass wir hier heute so eine wichtige debatte führen. ich hätte gedacht, dass wir das auch quer durch das haus mit dem nötigen ernst tun. diesen vermisse ich bei einigen. ich fange einmal bei dem antrag der linken an. frau lay, immer nur auf die mieten abzustellen, ist leider viel zu kurz gesprungen. deshalb bin ich sehr dankbar, dass wir nicht nur einen antrag von ihnen, sondern auch einen antrag von den grünen haben, der deutlich differenzierter an die sache herangeht und der einen großen unterschied macht, was auch richtig ist, zwischen obdachlosigkeit und leuten, die davon bedroht sind, wohnungslos zu werden. das ist auch wichtig. housing first jetzt für sich als linke idee zu vereinnahmen, wo ich weiß, dass das in düsseldorf und in anderen städten seit jahren über alle parteien hinweg breit getragen und bei privaten stiftungen unterstützt wird, das zeigt, wie ernst sie die debatte nehmen. ich hätte mir gewünscht, dass wir hier viel ernsthafter miteinander diskutieren würden. bleiben sie doch einmal entspannt. ich finde in den anträgen gute sachen. das will ich nicht verschweigen; das ist auch völlig in ordnung. aber nicht alles, was darin steht, ist richtig; das können sie sich vorstellen. aber ich hätte gedacht, wir fassen wenigstens die guten punkte aus den anträgen zusammen. housing first ist einer davon, auch die verantwortung das ist hier dargestellt worden dafür, dass kommunen, länder und der bund gemeinsam agieren müssen. ich halte viel davon, dass die kommunen endlich eine solche finanzielle ausstattung bekommen, damit sie das auch machen können. wenn man sich einmal mit dem thema auseinandersetzt, wenn man in obdachlosencafés geht, wenn man sich mit den leuten unterhält, dann stellt man fest, dass die sozialarbeiter manchmal nur monate davon entfernt sind, ihre eigenen kunden zu werden das ist doch die wahrheit vor ort , weil sie nicht ausfinanziert sind und befristete arbeitsverträge haben. darüber muss doch einmal gesprochen werden. aber darüber finde ich in diesen anträgen gar nichts, und das ärgert mich. deshalb will ich da einen unterschied machen. in bezug auf die notunterkünfte müssen wir darüber reden, dass es viele notunterkünfte gibt, in die leute mit hund oder unter drogen gar nicht hineindürfen, dass wir andere konzepte brauchen und dass sie personell besser ausgerüstet werden müssen, um jedem eine chance zu geben, nicht nur denjenigen, die stark sind und manchmal ja gar nicht in diesen unterkünften sein dürften. auch darüber muss geredet werden. gerade in den ballungsräumen gibt es auch viele menschen, die aus anderen ländern kommen und die eben keinen anspruch darauf haben, bei uns die kosten der unterkunft bezahlt zu bekommen. die verdrängen die schwachen, die es eigentlich nötig hätten. auch darüber muss gesprochen werden. was wir nicht brauchen jetzt komme ich zu den von wohnungslosigkeit bedrohten ist mehr regulierung. damit bekommen sie das mit sicherheit nicht hin. glauben sie mir: bezüglich der forderung nach mehr wohnraum sind wir uns einig. aber ich will an die grundlagen heran. warum zieht es denn alle in die ballungsräume? warum ist denn der druck in den ballungsräumen so enorm? darüber muss doch geredet werden. das bekommt man auch mit den schönsten reden über ländliche räume nicht wegdiskutiert. das ist übrigens ein trend, der sich in den nächsten jahren verstärken wird. insofern muss ich gucken: wo sind soziale netzwerke, die ich auch in anderen gebieten anbieten kann, damit diese leute auch in anderen gebieten überhaupt eine chance haben. worüber auch nicht geredet wird, ist ein thema, mit dem die gesellschaft ziemlich schwach umgeht. ich erzähle ihnen einmal eine geschichte aus meiner heimatstadt: ich habe viele deutschkurse für flüchtlinge angeboten, als sie zu uns kamen, und gesagt: wir brauchen auch alphabetisierungskurse für deutsche. in deutschland gibt es nämlich fast prozent funktionelle analphabeten. man hat mich in meiner kleinen heimatstadt zusammen mit den helfern, die das gemacht haben, beschimpft und gesagt: das kann nicht wahr sein. bei uns gibt es keine funktionellen analphabeten. das alles ist nicht wahr. fürchterlich! stigmatisiert hat man diese leute. die trauen sich mit sicherheit nicht mehr zu uns in die deutschkurse. warum erzähle ich das eigentlich? weil wir sehr oft wissen, welche leute von wohnungslosigkeit bedroht sind. die kennt unser system. das kommt nicht von heute auf morgen. aber es sind auch viele menschen dabei, die einfach den brief vom amt nicht lesen. es gibt übrigens schon lange die meldepflicht vom amtsgericht an die sozialämter; das ist in den anträgen falsch dargestellt. da liegt der brief auf einem stapel mit ungeöffneten anderen briefen obendrauf: teilweise, weil sie es sozial nicht mehr schaffen, teilweise aber auch, weil sie diese briefe nicht lesen können. deshalb müssen wir uns deutlich breiter aufstellen. wir dürfen diese leute nicht stigmatisieren. wir müssen in bildung investieren, damit sie, wenn sie netzwerke in den ballungsräumen suchen, nicht feststellen müssen, dass wir nicht genügend möglichkeiten haben, ihnen zu helfen. ich freue mich darauf, wenn wir ernsthaft über die anträge diskutieren. ich finde gerade in dem der grünen eine ganze menge punkte, die auch wir unterstützen können. ich teile aber mitnichten die ansicht, dass das ganze ausschließlich über die mieten geht. auch mit dem geld, das sie in die hand nehmen wollen, um das zu ändern, wird das nicht funktionieren. da entzaubern sie sich ja selbst. sie schreiben, milliarden euro reichten aus, und in der begründung werden dann zehn jahre lang jeweils jährlich milliarden euro gefordert. sie haben auch noch nicht gehört, über wie viel geld wir im bundeshaushalt verfügen und was wir damit alles machen wollen. aber das war ich von den linken nicht anders gewohnt. schönen dank. für die fraktion bündnis /die grünen hat nun christian kühn das wort."
